rank,item,repo_name,stars,forks,language,repo_url,username,issues,last_commit,description
70,Python,ML-From-Scratch,10635,1728,Python,https://github.com/eriklindernoren/ML-From-Scratch,eriklindernoren,11,2018-11-02T07:45:47Z,Machine Learning From Scratch. Bare bones Python implementations of machine learning models and algorithms with a focus on accessibility. Aims to cover everything from data mining to deep learning.
71,Python,iTerm2-Color-Schemes,10372,2919,Python,https://github.com/mbadolato/iTerm2-Color-Schemes,mbadolato,11,2018-12-01T06:00:56Z,"Over 175 terminal color schemes/themes for iTerm/iTerm2 (with ports to Terminal, Konsole, PuTTY, Xresources, XRDB, Remina, Termite, XFCE, Tilda, and Terminator)"
72,Python,incubator-airflow,10339,3621,Python,https://github.com/apache/incubator-airflow,apache,251,2018-12-21T02:45:04Z,Apache Airflow (Incubating)
73,Python,Awesome-Linux-Software,9926,875,Python,https://github.com/luongvo209/Awesome-Linux-Software,luongvo209,8,2018-12-17T15:01:21Z,"A list of awesome applications, software, tools and other materials for Linux distros. "
74,Python,pix2code,9881,965,Python,https://github.com/tonybeltramelli/pix2code,tonybeltramelli,0,2017-12-13T08:36:56Z,pix2code: Generating Code from a Graphical User Interface Screenshot
75,Python,bert,9829,1812,Python,https://github.com/google-research/bert,google-research,85,2018-12-20T21:30:29Z,TensorFlow code and pre-trained models for BERT
76,Python,Algorithm_Interview_Notes-Chinese,9754,2803,Python,https://github.com/imhuay/Algorithm_Interview_Notes-Chinese,imhuay,10,2018-11-07T05:52:59Z,2018/2019/校招/春招/秋招/算法/机器学习(Machine Learning)/深度学习(Deep Learning)/自然语言处理(NLP)/C/C++/Python/面试笔记
77,Python,nginx-proxy,9684,1839,Python,https://github.com/jwilder/nginx-proxy,jwilder,481,2018-12-19T16:23:16Z,Automated nginx proxy for Docker containers using docker-gen
78,Python,powerline,9681,764,Python,https://github.com/powerline/powerline,powerline,134,2018-11-11T12:23:54Z,"Powerline is a statusline plugin for vim, and provides statuslines and prompts for several other applications, including zsh, bash, tmux, IPython, Awesome and Qtile."
79,Python,salt,9472,4433,Python,https://github.com/saltstack/salt,saltstack,2354,2018-12-21T03:43:12Z,Software to automate the management and configuration of any infrastructure or application at scale. Get access to the Salt software package repository here: 
80,Python,Mask_RCNN,9335,3937,Python,https://github.com/matterport/Mask_RCNN,matterport,675,2018-12-18T06:44:36Z,Mask R-CNN for object detection and instance segmentation on Keras and TensorFlow
81,Python,FastPhotoStyle,9033,796,Python,https://github.com/NVIDIA/FastPhotoStyle,NVIDIA,27,2018-08-24T01:33:43Z,"Style transfer, deep learning, feature transform"
82,Python,sshuttle,9006,668,Python,https://github.com/apenwarr/sshuttle,apenwarr,23,2018-02-15T13:16:12Z,Wrong project!  You should head over to http://github.com/sshuttle/sshuttle
83,Python,locust,8910,1301,Python,https://github.com/locustio/locust,locustio,147,2018-12-20T15:20:18Z,Scalable user load testing tool written in Python
84,Python,RocAlphaGo,8883,2490,Python,https://github.com/Rochester-NRT/RocAlphaGo,Rochester-NRT,30,2018-06-09T13:55:11Z,"An independent, student-led replication of DeepMind's 2016 Nature publication, ""Mastering the game of Go with deep neural networks and tree search"" (Nature 529, 484-489, 28 Jan 2016), details of which can be found on their website https://deepmind.com/publications.html."
85,Python,neural-doodle,8853,778,Python,https://github.com/alexjc/neural-doodle,alexjc,45,2016-12-28T15:58:48Z,"Turn your two-bit doodles into fine artworks with deep neural networks, generate seamless textures from photos, transfer style from one image to another, perform example-based upscaling, but wait... there's more! (An implementation of Semantic Style Transfer.)"
86,Python,Python,8811,5595,Python,https://github.com/geekcomputers/Python,geekcomputers,73,2018-12-20T09:58:21Z,My Python Examples
87,Python,tflearn,8808,2225,Python,https://github.com/tflearn/tflearn,tflearn,538,2018-12-15T21:45:51Z,Deep learning library featuring a higher-level API for TensorFlow.
88,Python,pytorch-tutorial,8759,2633,Python,https://github.com/yunjey/pytorch-tutorial,yunjey,27,2018-12-04T13:33:51Z,PyTorch Tutorial for Deep Learning Researchers
89,Python,neural-enhance,8712,910,Python,https://github.com/alexjc/neural-enhance,alexjc,113,2018-01-25T05:01:58Z,Super Resolution for images using deep learning.
90,Python,zulip,8707,2661,Python,https://github.com/zulip/zulip,zulip,1214,2018-12-21T03:41:35Z,Zulip server - powerful open source team chat
91,Python,bokeh,8692,2338,Python,https://github.com/bokeh/bokeh,bokeh,470,2018-12-20T22:51:23Z,Interactive Web Plotting for Python
92,Python,Theano,8620,2457,Python,https://github.com/Theano/Theano,Theano,631,2018-12-11T02:25:07Z,"Theano is a Python library that allows you to define, optimize, and evaluate mathematical expressions involving multi-dimensional arrays efficiently. It can use GPUs and perform efficient symbolic differentiation."
93,Python,autojump,8579,449,Python,https://github.com/wting/autojump,wting,132,2018-12-03T03:52:01Z,A cd command that learns - easily navigate directories from the command line
94,Python,kivy,8531,1945,Python,https://github.com/kivy/kivy,kivy,675,2018-12-19T09:44:05Z,"Open source UI framework written in Python, running on Windows, Linux, macOS, Android and iOS"
95,Python,cookiecutter,8509,931,Python,https://github.com/audreyr/cookiecutter,audreyr,198,2018-12-20T10:09:47Z,"A command-line utility that creates projects from cookiecutters (project templates). E.g. Python package projects, jQuery plugin projects."
96,Python,pelican,8412,1533,Python,https://github.com/getpelican/pelican,getpelican,140,2018-12-21T02:38:11Z,Static site generator that supports Markdown and reST syntax. Powered by Python.
97,Python,beets,8407,1491,Python,https://github.com/beetbox/beets,beetbox,634,2018-12-20T18:02:48Z,music library manager and MusicBrainz tagger
98,Python,matplotlib,8381,3853,Python,https://github.com/matplotlib/matplotlib,matplotlib,1496,2018-12-21T02:53:03Z,matplotlib: plotting with Python
99,Python,yapf,8377,566,Python,https://github.com/google/yapf,google,207,2018-12-10T08:03:23Z,A formatter for Python files
100,Python,gensim,8322,3152,Python,https://github.com/RaRe-Technologies/gensim,RaRe-Technologies,230,2018-12-20T13:09:08Z,Topic Modelling for Humans
1,R,ggplot2,3515,1320,R,https://github.com/tidyverse/ggplot2,tidyverse,155,2018-12-20T13:42:31Z,An implementation of the Grammar of Graphics in R
2,R,ML_for_Hackers,3433,2223,R,https://github.com/johnmyleswhite/ML_for_Hackers,johnmyleswhite,33,2017-10-18T01:53:18Z,"Code accompanying the book ""Machine Learning for Hackers"""
3,R,awesome-R,3294,1108,R,https://github.com/qinwf/awesome-R,qinwf,30,2018-12-18T22:16:46Z,"A curated list of awesome R packages, frameworks and software."
4,R,shiny,3184,1441,R,https://github.com/rstudio/shiny,rstudio,430,2018-12-17T19:01:15Z,Easy interactive web applications with R
5,R,swirl_courses,2775,5971,R,https://github.com/swirldev/swirl_courses,swirldev,120,2018-12-01T02:17:01Z,:mortar_board: A collection of interactive courses for the swirl R package.
6,R,AnomalyDetection,2749,629,R,https://github.com/twitter/AnomalyDetection,twitter,66,2018-04-16T21:53:31Z,Anomaly Detection with R
7,R,dplyr,2742,1003,R,https://github.com/tidyverse/dplyr,tidyverse,106,2018-12-20T17:15:51Z,dplyr: A grammar of data manipulation
8,R,devtools,1748,624,R,https://github.com/r-lib/devtools,r-lib,39,2018-12-17T15:58:22Z,Tools to make an R developer's life easier
9,R,knitr,1688,714,R,https://github.com/yihui/knitr,yihui,67,2018-12-20T19:27:48Z,A general-purpose tool for dynamic report generation in R
10,R,investing,1679,104,R,https://github.com/zonination/investing,zonination,0,2016-12-27T13:58:02Z,Investing Returns on the Market as a Whole
11,R,r4ds,1675,2050,R,https://github.com/hadley/r4ds,hadley,58,2018-12-09T03:32:11Z,R for data science
12,R,benchm-ml,1584,287,R,https://github.com/szilard/benchm-ml,szilard,10,2018-09-15T18:57:25Z,"A minimal benchmark for scalability, speed and accuracy of commonly used open source implementations (R packages, Python scikit-learn, H2O, xgboost, Spark MLlib etc.) of the top machine learning algorithms for binary classification (random forests, gradient boosted trees, deep neural networks etc.)."
13,R,stan,1456,272,R,https://github.com/stan-dev/stan,stan-dev,274,2018-12-20T00:02:43Z,Stan development repository (home page is linked below). The master branch contains the current release. The develop branch contains the latest stable development.  See the Developer Process Wiki for details.  
14,R,stats337,1451,219,R,https://github.com/hadley/stats337,hadley,7,2018-06-21T15:57:29Z,Readings in applied data science
15,R,plotly,1398,496,R,https://github.com/ropensci/plotly,ropensci,271,2018-12-17T16:07:43Z,An interactive graphing library for R
16,R,nyc-taxi-data,1380,426,R,https://github.com/toddwschneider/nyc-taxi-data,toddwschneider,0,2018-11-28T02:45:39Z,"Import public NYC taxi and for-hire vehicle (Uber, Lyft, etc.) trip data into PostgreSQL database"
17,R,rmarkdown,1367,598,R,https://github.com/rstudio/rmarkdown,rstudio,99,2018-12-18T18:19:59Z,Dynamic Documents for R
18,R,bookdown,1246,570,R,https://github.com/rstudio/bookdown,rstudio,61,2018-12-05T17:16:15Z,Authoring Books and Technical Documents with R Markdown
19,R,awesome-network-analysis,1225,263,R,https://github.com/briatte/awesome-network-analysis,briatte,13,2018-10-21T16:14:17Z,A curated list of awesome network analysis resources.
20,R,DataScienceR,1211,654,R,https://github.com/ujjwalkarn/DataScienceR,ujjwalkarn,3,2018-04-18T00:01:52Z,"a curated list of R tutorials for Data Science, NLP and Machine Learning "
21,R,mlr,1130,321,R,https://github.com/mlr-org/mlr,mlr-org,454,2018-12-20T17:35:29Z,mlr: Machine Learning in R 
22,R,tensorflow,1092,298,R,https://github.com/rstudio/tensorflow,rstudio,5,2018-12-18T13:03:51Z,TensorFlow for R
23,R,DiagrammeR,1078,175,R,https://github.com/rich-iannone/DiagrammeR,rich-iannone,78,2018-12-12T01:51:59Z,Graph and network visualization using tabular data in R
24,R,gganimate,1050,178,R,https://github.com/thomasp85/gganimate,thomasp85,35,2018-12-20T10:03:45Z,A Grammar of Animated Graphics
25,R,rvest,1019,266,R,https://github.com/hadley/rvest,hadley,69,2018-10-31T12:41:34Z,Simple web scraping for R
26,R,caret,971,457,R,https://github.com/topepo/caret,topepo,121,2018-12-09T18:47:17Z,caret (Classification And Regression Training) R package that contains misc functions for training and plotting classification and regression models
27,R,labs,970,1397,R,https://github.com/genomicsclass/labs,genomicsclass,15,2018-10-29T20:05:09Z,Rmd source files for the HarvardX series PH525x
28,R,ggthemes,945,187,R,https://github.com/jrnold/ggthemes,jrnold,2,2018-10-07T05:25:16Z,"Additional themes, scales, and geoms for ggplot2"
29,R,patchwork,916,68,R,https://github.com/thomasp85/patchwork,thomasp85,28,2018-09-22T12:30:35Z,The Composer of ggplots
30,R,CausalImpact,877,142,R,https://github.com/google/CausalImpact,google,12,2018-03-28T14:22:21Z,An R package for causal inference in time series
31,R,blogdown,849,193,R,https://github.com/rstudio/blogdown,rstudio,5,2018-12-20T20:14:34Z,Create Blogs and Websites with R Markdown
32,R,wesanderson,830,72,R,https://github.com/karthik/wesanderson,karthik,8,2018-08-26T23:49:57Z,A Wes Anderson color palette for R
33,R,slidify,802,347,R,https://github.com/ramnathv/slidify,ramnathv,180,2016-08-02T03:54:45Z,Generate reproducible html5 slides from R markdown
34,R,swirl,793,525,R,https://github.com/swirldev/swirl,swirldev,161,2018-10-11T16:05:05Z,":cyclone: Learn R, in R."
35,R,reticulate,784,130,R,https://github.com/rstudio/reticulate,rstudio,141,2018-12-19T12:08:59Z,R Interface to Python
36,R,broom,784,209,R,https://github.com/tidymodels/broom,tidymodels,130,2018-12-20T09:59:15Z,Convert statistical analysis objects from R into tidy format
37,R,plumber,762,138,R,https://github.com/trestletech/plumber,trestletech,93,2018-12-19T20:29:09Z,Turn your R code into a web API.
38,R,tofsims,755,5,R,https://github.com/fossasia/tofsims,fossasia,0,2017-11-29T19:16:12Z,
39,R,httr,751,1801,R,https://github.com/r-lib/httr,r-lib,3,2018-12-17T20:45:28Z,httr: a friendly http package for R
40,R,purrr,719,160,R,https://github.com/tidyverse/purrr,tidyverse,41,2018-12-20T15:22:16Z,A functional programming toolkit for R
41,R,tidytext,698,146,R,https://github.com/juliasilge/tidytext,juliasilge,6,2018-12-20T23:59:23Z,"Text mining using dplyr, ggplot2, and other tidy tools :sparkles::page_facing_up::sparkles::page_facing_up::sparkles:"
42,R,googlesheets,670,161,R,https://github.com/jennybc/googlesheets,jennybc,87,2018-06-29T17:30:23Z,Google Spreadsheets R API
43,R,tidyr,668,253,R,https://github.com/tidyverse/tidyr,tidyverse,76,2018-12-08T17:51:32Z,Easily tidy data with spread and gather functions.
44,R,readr,668,204,R,https://github.com/tidyverse/readr,tidyverse,65,2018-12-20T19:49:27Z,"Read flat files (csv, tsv, fwf) into R"
45,R,rethinking,666,210,R,https://github.com/rmcelreath/rethinking,rmcelreath,78,2018-11-25T10:07:43Z,Statistical Rethinking course and book package
46,R,magrittr,660,124,R,https://github.com/tidyverse/magrittr,tidyverse,22,2018-12-13T21:05:56Z,Improve the readability of R code with the pipe
47,R,forecast,655,233,R,https://github.com/robjhyndman/forecast,robjhyndman,8,2018-12-18T23:16:08Z,forecast package for R
48,R,SparkR-pkg,650,350,R,https://github.com/amplab-extras/SparkR-pkg,amplab-extras,21,2016-06-10T21:42:55Z,R frontend for Spark
49,R,ggvis,648,181,R,https://github.com/rstudio/ggvis,rstudio,192,2018-10-01T16:22:08Z,Interactive grammar of graphics for R
50,R,advanced-shiny,631,235,R,https://github.com/daattali/advanced-shiny,daattali,0,2018-06-02T15:42:50Z,Shiny tips & tricks for improving your apps and solving common problems
51,R,tidyverse,631,130,R,https://github.com/tidyverse/tidyverse,tidyverse,16,2018-12-17T19:33:07Z,Easily install and load packages from the tidyverse
52,R,MLPB,624,222,R,https://github.com/ben519/MLPB,ben519,0,2017-12-15T20:25:45Z,Machine Learning Problem Bible | Problem Set Here >>
53,R,BanditsBook,604,204,R,https://github.com/johnmyleswhite/BanditsBook,johnmyleswhite,6,2018-04-05T06:34:29Z,Code for my book on Multi-Armed Bandit Algorithms
54,R,sparklyr,603,217,R,https://github.com/rstudio/sparklyr,rstudio,333,2018-12-20T17:30:33Z,R interface for Apache Spark
55,R,htmlwidgets,593,174,R,https://github.com/ramnathv/htmlwidgets,ramnathv,102,2018-12-19T23:52:15Z,HTML Widgets for R
56,R,rnaseq_tutorial,590,343,R,https://github.com/griffithlab/rnaseq_tutorial,griffithlab,9,2018-11-01T19:59:51Z,"Informatics for RNA-seq: A web resource for analysis on the cloud. Educational tutorials and working pipelines for RNA-seq analysis including an introduction to: cloud computing, critical file formats, reference genomes, gene annotation, expression, differential expression, alternative splicing, data visualization, and interpretation."
57,R,ggraph,581,69,R,https://github.com/thomasp85/ggraph,thomasp85,56,2018-09-17T08:59:43Z,Grammar of Graph Graphics
58,R,perceptions,581,73,R,https://github.com/zonination/perceptions,zonination,0,2017-08-25T14:34:20Z,Perceptions of Probability and Numbers
59,R,ProgrammingAssignment2,567,114448,R,https://github.com/rdpeng/ProgrammingAssignment2,rdpeng,2649,2018-12-18T08:05:37Z,Repository for Programming Assignment 2 for R Programming on Coursera
60,R,ggrepel,565,69,R,https://github.com/slowkow/ggrepel,slowkow,22,2018-10-30T18:22:50Z,:round_pushpin: Repel overlapping text labels away from each other.
61,R,text2vec,562,99,R,https://github.com/dselivanov/text2vec,dselivanov,30,2018-09-15T19:52:09Z,"Fast vectorization, topic modeling, distances and GloVe word embeddings in R."
62,R,testthat,558,223,R,https://github.com/r-lib/testthat,r-lib,88,2018-12-14T21:46:17Z,An R 📦 to make testing 😀
63,R,janitor,551,60,R,https://github.com/sfirke/janitor,sfirke,48,2018-12-01T22:31:28Z,simple tools for data cleaning in R
64,R,r-source,549,186,R,https://github.com/wch/r-source,wch,0,2018-12-21T01:08:17Z,"Read-only mirror of R source code from https://svn.r-project.org/R/, updated hourly. See the build instructions on the wiki page."
65,R,rappor,549,99,R,https://github.com/google/rappor,google,32,2018-12-05T19:11:55Z,RAPPOR: Privacy-Preserving Reporting Algorithms
66,R,RStartHere,545,203,R,https://github.com/rstudio/RStartHere,rstudio,7,2018-04-02T18:39:27Z,A guide to some of the most useful R Packages that we know about
67,R,ProjectTemplate,535,152,R,https://github.com/KentonWhite/ProjectTemplate,KentonWhite,15,2018-11-26T19:59:09Z,A template utility for R projects that provides a skeletal project.
68,R,drake,530,46,R,https://github.com/ropensci/drake,ropensci,15,2018-12-21T03:57:16Z,An R-focused pipeline toolkit for reproducibility and high-performance computing
69,R,lintr,510,92,R,https://github.com/jimhester/lintr,jimhester,135,2018-12-18T15:41:02Z,Static Code Analysis for R
70,R,rstan,510,171,R,https://github.com/stan-dev/rstan,stan-dev,142,2018-12-18T18:55:09Z,"RStan, the R interface to Stan"
71,R,asdfree,503,438,R,https://github.com/ajdamico/asdfree,ajdamico,87,2018-09-24T18:24:04Z,analyze survey data for free
72,R,gt,489,20,R,https://github.com/rstudio/gt,rstudio,48,2018-12-20T21:26:57Z,"Easily generate information-rich, publication-quality tables from R"
73,R,keras,476,164,R,https://github.com/rstudio/keras,rstudio,9,2018-11-29T15:02:35Z,R Interface to Keras
74,R,plyr,474,119,R,https://github.com/hadley/plyr,hadley,27,2018-12-05T19:23:26Z,"A R package for splitting, applying and combining large problems into simpler problems"
75,R,opencpu,472,90,R,https://github.com/opencpu/opencpu,opencpu,72,2018-11-20T22:55:09Z,OpenCPU system for embedded scientific computation and reproducible research
76,R,hrbrthemes,461,52,R,https://github.com/hrbrmstr/hrbrthemes,hrbrmstr,10,2018-07-05T18:09:39Z,":lock_with_ink_pen: Opinionated, typographic-centric ggplot2 themes and theme components"
77,R,ggmap,458,188,R,https://github.com/dkahle/ggmap,dkahle,76,2018-10-26T18:26:07Z,a package for plotting maps in R with ggplot2
78,R,ggthemr,454,71,R,https://github.com/cttobin/ggthemr,cttobin,3,2018-04-16T15:09:03Z,Themes for ggplot2.
79,R,sf,453,111,R,https://github.com/r-spatial/sf,r-spatial,29,2018-12-20T21:47:33Z,Simple Features for R
80,R,networkD3,447,225,R,https://github.com/christophergandrud/networkD3,christophergandrud,69,2018-04-11T11:04:51Z,D3 JavaScript Network Graphs from R
81,R,formattable,445,62,R,https://github.com/renkun-ken/formattable,renkun-ken,42,2017-10-04T03:09:59Z,Formattable Data Structures
82,R,brms,442,57,R,https://github.com/paul-buerkner/brms,paul-buerkner,38,2018-12-21T00:38:42Z,brms R package for Bayesian generalized multivariate non-linear multilevel models using Stan
83,R,quanteda,440,105,R,https://github.com/quanteda/quanteda,quanteda,73,2018-12-20T11:58:21Z,An R package for the Quantitative Analysis of Textual Data
84,R,ballr,435,90,R,https://github.com/toddwschneider/ballr,toddwschneider,1,2018-11-11T23:15:17Z,Interactive NBA and NCAA Shot Charts with R and Shiny
85,R,addinslist,430,94,R,https://github.com/daattali/addinslist,daattali,2,2018-12-18T03:40:34Z,Discover and install useful RStudio addins 
86,R,future,429,39,R,https://github.com/HenrikBengtsson/future,HenrikBengtsson,52,2018-12-20T17:18:26Z,:rocket: R package: future: Unified Parallel and Distributed Processing in R for Everyone
87,R,esquisse,424,44,R,https://github.com/dreamRs/esquisse,dreamRs,11,2018-11-22T11:20:44Z,RStudio add-in to make plots with ggplot2
88,R,renjin,424,69,R,https://github.com/bedatadriven/renjin,bedatadriven,56,2018-12-20T16:24:26Z,JVM-based interpreter for the R language for the statistical analysis.
89,R,lubridate,403,151,R,https://github.com/tidyverse/lubridate,tidyverse,55,2018-12-13T21:31:18Z,Make working with dates in R just that little bit easier
90,R,shinyjs,403,85,R,https://github.com/daattali/shinyjs,daattali,10,2018-11-14T08:37:29Z,Easily improve the user experience of your Shiny apps in seconds
91,R,mindr,403,35,R,https://github.com/pzhaonet/mindr,pzhaonet,0,2018-12-16T17:37:52Z,"an R package which converts markdown files (.md, .Rmd) into mindmaps (brainstorms)"
92,R,rayshader,402,29,R,https://github.com/tylermorganwall/rayshader,tylermorganwall,1,2018-12-20T13:36:17Z,"R Package for Producing and Visualizing Hillshaded Maps from Elevation Matrices, in 2D and 3D"
93,R,engsoccerdata,395,118,R,https://github.com/jalapic/engsoccerdata,jalapic,15,2018-10-11T18:34:24Z,English and European soccer results 1871-2017
94,R,datapasta,394,28,R,https://github.com/MilesMcBain/datapasta,MilesMcBain,19,2018-10-13T01:33:59Z,"On top of spaghetti, all covered in cheese...."
95,R,ggalt,394,56,R,https://github.com/hrbrmstr/ggalt,hrbrmstr,25,2018-06-28T16:13:04Z,":earth_americas: Extra Coordinate Systems, Geoms,  Statistical Transformations & Scales for 'ggplot2'"
96,R,SIT,392,347,R,https://github.com/systematicinvestor/SIT,systematicinvestor,23,2018-10-19T01:25:00Z,Systematic Investor Toolkit
97,R,tidytuesday,391,183,R,https://github.com/rfordatascience/tidytuesday,rfordatascience,12,2018-12-16T20:58:16Z,Official repo for the #tidytuesday project
98,R,pkgdown,387,185,R,https://github.com/r-lib/pkgdown,r-lib,31,2018-12-10T15:40:55Z,Generate static html documentation for an R package
99,R,highcharter,382,81,R,https://github.com/jbkunst/highcharter,jbkunst,125,2018-07-06T03:46:30Z,R wrapper for highcharts based on htmlwidgets 
100,R,waffle,379,52,R,https://github.com/hrbrmstr/waffle,hrbrmstr,29,2018-12-06T15:35:26Z,:maple_leaf: Make waffle (square pie) charts in R
1,Ruby,rails,41663,16877,Ruby,https://github.com/rails/rails,rails,1051,2018-12-21T03:25:43Z,Ruby on Rails
2,Ruby,jekyll,36325,7968,Ruby,https://github.com/jekyll/jekyll,jekyll,140,2018-12-18T17:49:15Z,:globe_with_meridians: Jekyll is a blog-aware static site generator in Ruby
3,Ruby,legacy-homebrew,28261,12762,Ruby,https://github.com/Homebrew/legacy-homebrew,Homebrew,0,2018-08-26T20:05:17Z,:skull: The former home of Homebrew/homebrew (deprecated)
4,Ruby,discourse,26949,6305,Ruby,https://github.com/discourse/discourse,discourse,14,2018-12-21T04:00:09Z,"A platform for community discussion. Free, open, simple."
5,Ruby,fastlane,24038,3669,Ruby,https://github.com/fastlane/fastlane,fastlane,332,2018-12-20T23:30:56Z,🚀 The easiest way to automate building and releasing your iOS and Android apps
6,Ruby,awesome-awesomeness,22960,2918,Ruby,https://github.com/bayandin/awesome-awesomeness,bayandin,6,2018-12-12T07:57:03Z,A curated list of awesome awesomeness
7,Ruby,gitlabhq,21458,5525,Ruby,https://github.com/gitlabhq/gitlabhq,gitlabhq,30,2018-12-21T04:00:26Z,GitLab CE Mirror | Please open new issues in our issue tracker on GitLab.com
8,Ruby,huginn,20224,2222,Ruby,https://github.com/huginn/huginn,huginn,336,2018-12-17T07:27:36Z,Create agents that monitor and act on your behalf.  Your agents are standing by!
9,Ruby,devdocs,19470,1259,Ruby,https://github.com/freeCodeCamp/devdocs,freeCodeCamp,93,2018-12-19T18:50:30Z,API Documentation Browser
10,Ruby,devise,19416,4576,Ruby,https://github.com/plataformatec/devise,plataformatec,49,2018-12-20T13:51:21Z,Flexible authentication solution for Rails with Warden.
11,Ruby,vagrant,17716,3607,Ruby,https://github.com/hashicorp/vagrant,hashicorp,413,2018-12-21T01:19:42Z,Vagrant is a tool for building and distributing development environments.
12,Ruby,mastodon,16173,2879,Ruby,https://github.com/tootsuite/mastodon,tootsuite,1059,2018-12-20T16:52:19Z,"Your self-hosted, globally interconnected microblogging community"
13,Ruby,brew,15417,3440,Ruby,https://github.com/Homebrew/brew,Homebrew,23,2018-12-20T20:12:13Z,🍺 The Homebrew package manager
14,Ruby,ruby,15160,4088,Ruby,https://github.com/ruby/ruby,ruby,175,2018-12-21T00:03:50Z,The Ruby Programming Language [mirror]
15,Ruby,engineering-blogs,14561,1676,Ruby,https://github.com/kilimchoi/engineering-blogs,kilimchoi,42,2018-12-18T20:48:42Z,A curated list of engineering blogs
16,Ruby,metasploit-framework,14486,7540,Ruby,https://github.com/rapid7/metasploit-framework,rapid7,612,2018-12-21T00:54:07Z,Metasploit Framework
17,Ruby,homebrew-cask,14350,6783,Ruby,https://github.com/Homebrew/homebrew-cask,Homebrew,76,2018-12-21T03:13:47Z,🍻 A CLI workflow for the administration of macOS applications distributed as binaries
18,Ruby,bootstrap-sass,12709,3463,Ruby,https://github.com/twbs/bootstrap-sass,twbs,1,2018-12-14T18:17:21Z,Official Sass port of Bootstrap 2 and 3.
19,Ruby,diaspora,12107,2910,Ruby,https://github.com/diaspora/diaspora,diaspora,441,2018-12-18T12:44:26Z,"A privacy-aware, distributed, open source social network."
20,Ruby,sass,11635,1941,Ruby,https://github.com/sass/sass,sass,88,2018-12-08T07:24:55Z,Sass makes CSS fun again.
21,Ruby,CocoaPods,11143,2008,Ruby,https://github.com/CocoaPods/CocoaPods,CocoaPods,176,2018-12-20T04:05:07Z,The Cocoa Dependency Manager.
22,Ruby,capistrano,10786,1690,Ruby,https://github.com/capistrano/capistrano,capistrano,46,2018-12-11T14:20:19Z,Remote multi-server automation tool
23,Ruby,sinatra,10329,1842,Ruby,https://github.com/sinatra/sinatra,sinatra,94,2018-12-19T23:28:43Z,Classy web-development dressed in a DSL (official / canonical repo)
24,Ruby,logstash,9700,2613,Ruby,https://github.com/elastic/logstash,elastic,1359,2018-12-20T22:31:57Z,"Logstash - transport and process your logs, events, or other data"
25,Ruby,gollum,9644,1440,Ruby,https://github.com/gollum/gollum,gollum,42,2018-12-10T18:54:40Z,"A simple, Git-powered wiki with a sweet API and local frontend."
