rank,item,repo_name,stars,forks,language,repo_url,username,issues,last_commit,description
67,Python,sanic,11237,1062,Python,https://github.com/huge-success/sanic,huge-success,128,2019-01-26T10:54:54Z,Async Python 3.5+ web server that's written to go fast
68,Python,fabric,10961,1683,Python,https://github.com/fabric/fabric,fabric,310,2019-01-26T21:47:35Z,"Simple, Pythonic remote execution and deployment."
69,Python,ML-From-Scratch,10910,1812,Python,https://github.com/eriklindernoren/ML-From-Scratch,eriklindernoren,10,2019-01-23T19:22:24Z,Machine Learning From Scratch. Bare bones Python implementations of machine learning models and algorithms with a focus on accessibility. Aims to cover everything from data mining to deep learning.
70,Python,airflow,10817,3812,Python,https://github.com/apache/airflow,apache,254,2019-01-27T00:13:44Z,Apache Airflow
71,Python,luigi,10816,1832,Python,https://github.com/spotify/luigi,spotify,59,2019-01-25T13:53:24Z,"Luigi is a Python module that helps you build complex pipelines of batch jobs. It handles dependency resolution, workflow management, visualization etc. It also comes with Hadoop support built in. "
72,Python,material-theme,10758,774,Python,https://github.com/equinusocio/material-theme,equinusocio,4,2018-04-23T13:45:04Z,"Material Theme, the most epic theme for Sublime Text 3 by Mattia Astorino"
73,Python,iTerm2-Color-Schemes,10658,2992,Python,https://github.com/mbadolato/iTerm2-Color-Schemes,mbadolato,11,2019-01-22T21:28:36Z,"Over 200 terminal color schemes/themes for iTerm/iTerm2 (with ports to Terminal, Konsole, PuTTY, Xresources, XRDB, Remina, Termite, XFCE, Tilda, FreeBSD VT, and Terminator)"
74,Python,Algorithm_Interview_Notes-Chinese,10427,3022,Python,https://github.com/imhuay/Algorithm_Interview_Notes-Chinese,imhuay,11,2018-11-07T05:52:59Z,2018/2019/校招/春招/秋招/算法/机器学习(Machine Learning)/深度学习(Deep Learning)/自然语言处理(NLP)/C/C++/Python/面试笔记
75,Python,Awesome-Linux-Software,10052,905,Python,https://github.com/luong-komorebi/Awesome-Linux-Software,luong-komorebi,9,2019-01-26T14:58:42Z,"A list of awesome applications, software, tools and other materials for Linux distros. "
76,Python,pix2code,9944,981,Python,https://github.com/tonybeltramelli/pix2code,tonybeltramelli,0,2017-12-13T08:36:56Z,pix2code: Generating Code from a Graphical User Interface Screenshot
77,Python,Mask_RCNN,9920,4224,Python,https://github.com/matterport/Mask_RCNN,matterport,724,2019-01-22T03:11:09Z,Mask R-CNN for object detection and instance segmentation on Keras and TensorFlow
78,Python,nginx-proxy,9915,1883,Python,https://github.com/jwilder/nginx-proxy,jwilder,486,2019-01-22T23:36:37Z,Automated nginx proxy for Docker containers using docker-gen
79,Python,powerline,9838,773,Python,https://github.com/powerline/powerline,powerline,138,2018-11-11T12:23:54Z,"Powerline is a statusline plugin for vim, and provides statuslines and prompts for several other applications, including zsh, bash, tmux, IPython, Awesome and Qtile."
80,Python,salt,9574,4460,Python,https://github.com/saltstack/salt,saltstack,2371,2019-01-26T23:29:32Z,Software to automate the management and configuration of any infrastructure or application at scale. Get access to the Salt software package repository here: 
81,Python,Python,9520,5778,Python,https://github.com/geekcomputers/Python,geekcomputers,71,2019-01-26T04:06:37Z,My Python Examples
82,Python,TensorFlow-Course,9513,1580,Python,https://github.com/osforscience/TensorFlow-Course,osforscience,3,2019-01-24T08:02:31Z,Simple and ready-to-use tutorials for TensorFlow 
83,Python,pytorch-tutorial,9495,2867,Python,https://github.com/yunjey/pytorch-tutorial,yunjey,29,2018-12-04T13:33:51Z,PyTorch Tutorial for Deep Learning Researchers
84,Python,FastPhotoStyle,9202,831,Python,https://github.com/NVIDIA/FastPhotoStyle,NVIDIA,27,2018-08-24T01:33:43Z,"Style transfer, deep learning, feature transform"
85,Python,locust,9160,1326,Python,https://github.com/locustio/locust,locustio,154,2019-01-19T04:28:33Z,Scalable user load testing tool written in Python
86,Python,HelloGitHub,9067,942,Python,https://github.com/521xueweihan/HelloGitHub,521xueweihan,25,2018-12-27T14:46:02Z,:octocat: 分享 GitHub 上有趣、入门级的开源项目，帮你找到编程的乐趣。欢迎推荐、自荐项目，让更多人知道你的项目⭐️
87,Python,sshuttle,8996,665,Python,https://github.com/apenwarr/sshuttle,apenwarr,22,2018-02-15T13:16:12Z,Wrong project!  You should head over to http://github.com/sshuttle/sshuttle
88,Python,faceswap,8923,2712,Python,https://github.com/deepfakes/faceswap,deepfakes,9,2019-01-27T01:55:33Z,Non official project based on original /r/Deepfakes thread. Many thanks to him!
89,Python,zulip,8903,2757,Python,https://github.com/zulip/zulip,zulip,1203,2019-01-26T23:48:42Z,Zulip server - powerful open source team chat
90,Python,neural-doodle,8898,779,Python,https://github.com/alexjc/neural-doodle,alexjc,45,2016-12-28T15:58:48Z,"Turn your two-bit doodles into fine artworks with deep neural networks, generate seamless textures from photos, transfer style from one image to another, perform example-based upscaling, but wait... there's more! (An implementation of Semantic Style Transfer.)"
91,Python,RocAlphaGo,8895,2490,Python,https://github.com/Rochester-NRT/RocAlphaGo,Rochester-NRT,30,2018-06-09T13:55:11Z,"An independent, student-led replication of DeepMind's 2016 Nature publication, ""Mastering the game of Go with deep neural networks and tree search"" (Nature 529, 484-489, 28 Jan 2016), details of which can be found on their website https://deepmind.com/publications.html."
92,Python,tflearn,8890,2234,Python,https://github.com/tflearn/tflearn,tflearn,543,2019-01-10T14:15:08Z,Deep learning library featuring a higher-level API for TensorFlow.
93,Python,bokeh,8876,2363,Python,https://github.com/bokeh/bokeh,bokeh,482,2019-01-26T22:57:01Z,Interactive Web Plotting for Python
94,Python,neural-enhance,8835,925,Python,https://github.com/alexjc/neural-enhance,alexjc,116,2018-01-25T05:01:58Z,Super Resolution for images using deep learning.
95,Python,autojump,8821,451,Python,https://github.com/wting/autojump,wting,136,2018-12-24T05:09:24Z,A cd command that learns - easily navigate directories from the command line
96,Python,cookiecutter,8738,961,Python,https://github.com/audreyr/cookiecutter,audreyr,207,2019-01-22T19:11:55Z,"A command-line utility that creates projects from cookiecutters (project templates). E.g. Python package projects, jQuery plugin projects."
97,Python,tqdm,8721,457,Python,https://github.com/tqdm/tqdm,tqdm,151,2019-01-27T00:30:52Z,"A fast, extensible progress bar for Python and CLI"
98,Python,kivy,8680,1978,Python,https://github.com/kivy/kivy,kivy,692,2019-01-26T17:12:20Z,"Open source UI framework written in Python, running on Windows, Linux, macOS, Android and iOS"
99,Python,Theano,8664,2475,Python,https://github.com/Theano/Theano,Theano,643,2019-01-26T04:09:41Z,"Theano is a Python library that allows you to define, optimize, and evaluate mathematical expressions involving multi-dimensional arrays efficiently. It can use GPUs and perform efficient symbolic differentiation."
100,Python,matplotlib,8608,3919,Python,https://github.com/matplotlib/matplotlib,matplotlib,1473,2019-01-26T22:44:26Z,matplotlib: plotting with Python
1,R,ggplot2,3577,1346,R,https://github.com/tidyverse/ggplot2,tidyverse,163,2019-01-26T22:13:32Z,An implementation of the Grammar of Graphics in R
2,R,ML_for_Hackers,3453,2221,R,https://github.com/johnmyleswhite/ML_for_Hackers,johnmyleswhite,33,2017-10-18T01:53:18Z,"Code accompanying the book ""Machine Learning for Hackers"""
3,R,awesome-R,3329,1127,R,https://github.com/qinwf/awesome-R,qinwf,31,2019-01-20T22:59:45Z,"A curated list of awesome R packages, frameworks and software."
4,R,shiny,3231,1449,R,https://github.com/rstudio/shiny,rstudio,443,2019-01-23T18:06:28Z,Easy interactive web applications with R
5,R,swirl_courses,2800,6004,R,https://github.com/swirldev/swirl_courses,swirldev,121,2019-01-24T19:24:45Z,:mortar_board: A collection of interactive courses for the swirl R package.
6,R,AnomalyDetection,2791,637,R,https://github.com/twitter/AnomalyDetection,twitter,66,2018-04-16T21:53:31Z,Anomaly Detection with R
7,R,dplyr,2782,1017,R,https://github.com/tidyverse/dplyr,tidyverse,120,2019-01-26T15:38:10Z,dplyr: A grammar of data manipulation
8,R,devtools,1758,627,R,https://github.com/r-lib/devtools,r-lib,47,2019-01-23T19:12:25Z,Tools to make an R developer's life easier
9,R,r4ds,1729,2134,R,https://github.com/hadley/r4ds,hadley,72,2019-01-23T10:01:51Z,R for data science
10,R,knitr,1707,717,R,https://github.com/yihui/knitr,yihui,76,2019-01-24T23:46:21Z,A general-purpose tool for dynamic report generation in R
11,R,investing,1679,104,R,https://github.com/zonination/investing,zonination,0,2016-12-27T13:58:02Z,Investing Returns on the Market as a Whole
12,R,benchm-ml,1601,294,R,https://github.com/szilard/benchm-ml,szilard,10,2018-09-15T18:57:25Z,"A minimal benchmark for scalability, speed and accuracy of commonly used open source implementations (R packages, Python scikit-learn, H2O, xgboost, Spark MLlib etc.) of the top machine learning algorithms for binary classification (random forests, gradient boosted trees, deep neural networks etc.)."
13,R,stats337,1486,226,R,https://github.com/hadley/stats337,hadley,7,2018-06-21T15:57:29Z,Readings in applied data science
14,R,plotly,1424,501,R,https://github.com/ropensci/plotly,ropensci,239,2019-01-25T23:03:27Z,An interactive graphing library for R
15,R,nyc-taxi-data,1412,434,R,https://github.com/toddwschneider/nyc-taxi-data,toddwschneider,0,2018-11-28T02:45:39Z,"Import public NYC taxi and for-hire vehicle (Uber, Lyft, etc.) trip data into PostgreSQL database"
16,R,rmarkdown,1392,614,R,https://github.com/rstudio/rmarkdown,rstudio,106,2019-01-25T22:58:16Z,Dynamic Documents for R
17,R,bookdown,1300,588,R,https://github.com/rstudio/bookdown,rstudio,66,2019-01-19T21:13:07Z,Authoring Books and Technical Documents with R Markdown
18,R,awesome-network-analysis,1292,270,R,https://github.com/briatte/awesome-network-analysis,briatte,14,2018-12-28T11:02:41Z,A curated list of awesome network analysis resources.
19,R,DataScienceR,1231,667,R,https://github.com/ujjwalkarn/DataScienceR,ujjwalkarn,3,2018-04-18T00:01:52Z,"a curated list of R tutorials for Data Science, NLP and Machine Learning "
20,R,mlr,1155,325,R,https://github.com/mlr-org/mlr,mlr-org,462,2019-01-21T10:36:40Z,mlr: Machine Learning in R 
21,R,tensorflow,1106,303,R,https://github.com/rstudio/tensorflow,rstudio,6,2019-01-24T23:15:10Z,TensorFlow for R
22,R,gganimate,1103,191,R,https://github.com/thomasp85/gganimate,thomasp85,45,2019-01-10T14:47:57Z,A Grammar of Animated Graphics
23,R,DiagrammeR,1097,175,R,https://github.com/rich-iannone/DiagrammeR,rich-iannone,82,2018-12-12T01:51:59Z,Graph and network visualization using tabular data in R
24,R,rvest,1023,266,R,https://github.com/hadley/rvest,hadley,70,2019-01-23T19:39:39Z,Simple web scraping for R
25,R,caret,985,476,R,https://github.com/topepo/caret,topepo,131,2019-01-19T16:45:02Z,caret (Classification And Regression Training) R package that contains misc functions for training and plotting classification and regression models
26,R,labs,979,1408,R,https://github.com/genomicsclass/labs,genomicsclass,15,2018-10-29T20:05:09Z,Rmd source files for the HarvardX series PH525x
27,R,ggthemes,956,189,R,https://github.com/jrnold/ggthemes,jrnold,3,2019-01-11T05:47:57Z,"Additional themes, scales, and geoms for ggplot2"
28,R,patchwork,939,69,R,https://github.com/thomasp85/patchwork,thomasp85,29,2018-09-22T12:30:35Z,The Composer of ggplots
29,R,CausalImpact,888,148,R,https://github.com/google/CausalImpact,google,13,2018-03-28T14:22:21Z,An R package for causal inference in time series
30,R,blogdown,877,199,R,https://github.com/rstudio/blogdown,rstudio,8,2019-01-21T21:37:31Z,Create Blogs and Websites with R Markdown
31,R,wesanderson,863,75,R,https://github.com/karthik/wesanderson,karthik,9,2018-08-26T23:49:57Z,A Wes Anderson color palette for R
32,R,reticulate,808,137,R,https://github.com/rstudio/reticulate,rstudio,152,2019-01-23T19:56:49Z,R Interface to Python
33,R,broom,802,219,R,https://github.com/tidymodels/broom,tidymodels,140,2019-01-25T15:47:39Z,Convert statistical analysis objects from R into tidy format
34,R,slidify,802,348,R,https://github.com/ramnathv/slidify,ramnathv,180,2016-08-02T03:54:45Z,Generate reproducible html5 slides from R markdown
35,R,swirl,793,531,R,https://github.com/swirldev/swirl,swirldev,162,2018-10-11T16:05:05Z,":cyclone: Learn R, in R."
36,R,plumber,785,142,R,https://github.com/trestletech/plumber,trestletech,96,2019-01-23T20:15:13Z,Turn your R code into a web API.
37,R,tofsims,781,5,R,https://github.com/fossasia/tofsims,fossasia,0,2017-11-29T19:16:12Z,
38,R,httr,753,1810,R,https://github.com/r-lib/httr,r-lib,10,2019-01-16T17:13:49Z,httr: a friendly http package for R
39,R,purrr,729,167,R,https://github.com/tidyverse/purrr,tidyverse,40,2019-01-25T18:42:09Z,A functional programming toolkit for R
40,R,tidytext,714,146,R,https://github.com/juliasilge/tidytext,juliasilge,8,2019-01-05T21:22:56Z,"Text mining using dplyr, ggplot2, and other tidy tools :sparkles::page_facing_up::sparkles::page_facing_up::sparkles:"
41,R,rethinking,687,216,R,https://github.com/rmcelreath/rethinking,rmcelreath,81,2019-01-20T17:12:49Z,Statistical Rethinking course and book package
42,R,googlesheets,673,162,R,https://github.com/jennybc/googlesheets,jennybc,88,2018-06-29T17:30:23Z,Google Spreadsheets R API
43,R,tidyr,672,261,R,https://github.com/tidyverse/tidyr,tidyverse,48,2019-01-22T15:03:48Z,Easily tidy data with spread and gather functions.
44,R,readr,669,207,R,https://github.com/tidyverse/readr,tidyverse,65,2019-01-20T19:10:45Z,"Read flat files (csv, tsv, fwf) into R"
45,R,forecast,665,235,R,https://github.com/robjhyndman/forecast,robjhyndman,6,2019-01-21T15:58:28Z,forecast package for R
46,R,magrittr,663,123,R,https://github.com/tidyverse/magrittr,tidyverse,23,2019-01-05T16:37:00Z,Improve the readability of R code with the pipe
47,R,ggvis,652,180,R,https://github.com/rstudio/ggvis,rstudio,192,2018-10-01T16:22:08Z,Interactive grammar of graphics for R
48,R,SparkR-pkg,651,347,R,https://github.com/amplab-extras/SparkR-pkg,amplab-extras,21,2016-06-10T21:42:55Z,R frontend for Spark
49,R,advanced-shiny,648,243,R,https://github.com/daattali/advanced-shiny,daattali,0,2018-06-02T15:42:50Z,Shiny tips & tricks for improving your apps and solving common problems
50,R,tidyverse,641,133,R,https://github.com/tidyverse/tidyverse,tidyverse,15,2019-01-05T16:01:52Z,Easily install and load packages from the tidyverse
51,R,MLPB,632,232,R,https://github.com/ben519/MLPB,ben519,0,2017-12-15T20:25:45Z,Machine Learning Problem Bible | Problem Set Here >>
52,R,rnaseq_tutorial,614,351,R,https://github.com/griffithlab/rnaseq_tutorial,griffithlab,9,2018-11-01T19:59:51Z,"Informatics for RNA-seq: A web resource for analysis on the cloud. Educational tutorials and working pipelines for RNA-seq analysis including an introduction to: cloud computing, critical file formats, reference genomes, gene annotation, expression, differential expression, alternative splicing, data visualization, and interpretation."
53,R,BanditsBook,613,210,R,https://github.com/johnmyleswhite/BanditsBook,johnmyleswhite,5,2018-04-05T06:34:29Z,Code for my book on Multi-Armed Bandit Algorithms
54,R,sparklyr,613,222,R,https://github.com/rstudio/sparklyr,rstudio,349,2019-01-25T01:16:06Z,R interface for Apache Spark
55,R,gt,609,33,R,https://github.com/rstudio/gt,rstudio,67,2019-01-26T15:06:02Z,"Easily generate information-rich, publication-quality tables from R"
56,R,htmlwidgets,601,177,R,https://github.com/ramnathv/htmlwidgets,ramnathv,105,2019-01-16T20:16:05Z,HTML Widgets for R
57,R,ggraph,593,69,R,https://github.com/thomasp85/ggraph,thomasp85,59,2018-09-17T08:59:43Z,Grammar of Graph Graphics
58,R,perceptions,591,74,R,https://github.com/zonination/perceptions,zonination,0,2017-08-25T14:34:20Z,Perceptions of Probability and Numbers
59,R,drake,590,50,R,https://github.com/ropensci/drake,ropensci,2,2019-01-26T17:47:18Z,An R-focused pipeline toolkit for reproducibility and high-performance computing
60,R,ProgrammingAssignment2,575,114951,R,https://github.com/rdpeng/ProgrammingAssignment2,rdpeng,2670,2019-01-26T10:36:04Z,Repository for Programming Assignment 2 for R Programming on Coursera
61,R,ggrepel,574,70,R,https://github.com/slowkow/ggrepel,slowkow,22,2019-01-13T20:51:02Z,:round_pushpin: Repel overlapping text labels away from each other.
62,R,testthat,569,226,R,https://github.com/r-lib/testthat,r-lib,91,2019-01-02T18:15:04Z,An R 📦 to make testing 😀
63,R,text2vec,567,98,R,https://github.com/dselivanov/text2vec,dselivanov,29,2019-01-18T07:08:50Z,"Fast vectorization, topic modeling, distances and GloVe word embeddings in R."
64,R,janitor,566,63,R,https://github.com/sfirke/janitor,sfirke,53,2019-01-01T18:15:00Z,simple tools for data cleaning in R
65,R,r-source,555,188,R,https://github.com/wch/r-source,wch,0,2019-01-27T00:09:40Z,"Read-only mirror of R source code from https://svn.r-project.org/R/, updated hourly. See the build instructions on the wiki page."
66,R,rappor,555,104,R,https://github.com/google/rappor,google,32,2019-01-10T13:19:15Z,RAPPOR: Privacy-Preserving Reporting Algorithms
67,R,RStartHere,545,202,R,https://github.com/rstudio/RStartHere,rstudio,6,2018-04-02T18:39:27Z,A guide to some of the most useful R Packages that we know about
68,R,ProjectTemplate,538,153,R,https://github.com/KentonWhite/ProjectTemplate,KentonWhite,15,2018-11-26T19:59:09Z,A template utility for R projects that provides a skeletal project.
69,R,lintr,527,98,R,https://github.com/jimhester/lintr,jimhester,127,2019-01-25T18:04:04Z,Static Code Analysis for R
70,R,rstan,518,177,R,https://github.com/stan-dev/rstan,stan-dev,148,2019-01-19T00:28:54Z,"RStan, the R interface to Stan"
71,R,asdfree,508,438,R,https://github.com/ajdamico/asdfree,ajdamico,88,2019-01-26T13:39:07Z,analyze survey data for free
72,R,keras,497,171,R,https://github.com/rstudio/keras,rstudio,12,2019-01-26T17:11:54Z,R Interface to Keras
73,R,tidytuesday,495,232,R,https://github.com/rfordatascience/tidytuesday,rfordatascience,18,2019-01-24T15:52:47Z,Official repo for the #tidytuesday project
74,R,opencpu,481,90,R,https://github.com/opencpu/opencpu,opencpu,74,2019-01-11T22:09:55Z,OpenCPU system for embedded scientific computation and reproducible research
75,R,ggthemr,479,70,R,https://github.com/cttobin/ggthemr,cttobin,3,2018-04-16T15:09:03Z,Themes for ggplot2.
76,R,ggmap,477,196,R,https://github.com/dkahle/ggmap,dkahle,76,2019-01-24T20:43:29Z,a package for plotting maps in R with ggplot2
77,R,hrbrthemes,473,53,R,https://github.com/hrbrmstr/hrbrthemes,hrbrmstr,11,2019-01-21T20:16:34Z,":lock_with_ink_pen: Opinionated, typographic-centric ggplot2 themes and theme components"
78,R,plyr,471,120,R,https://github.com/hadley/plyr,hadley,27,2018-12-05T19:23:26Z,"A R package for splitting, applying and combining large problems into simpler problems"
79,R,esquisse,466,44,R,https://github.com/dreamRs/esquisse,dreamRs,16,2018-12-31T14:40:09Z,RStudio add-in to make plots with ggplot2
80,R,sf,464,118,R,https://github.com/r-spatial/sf,r-spatial,39,2019-01-25T09:16:35Z,Simple Features for R
81,R,quanteda,460,110,R,https://github.com/quanteda/quanteda,quanteda,79,2019-01-26T22:13:47Z,An R package for the Quantitative Analysis of Textual Data
82,R,networkD3,454,226,R,https://github.com/christophergandrud/networkD3,christophergandrud,69,2018-04-11T11:04:51Z,D3 JavaScript Network Graphs from R
83,R,brms,450,57,R,https://github.com/paul-buerkner/brms,paul-buerkner,38,2019-01-24T20:17:16Z,brms R package for Bayesian generalized multivariate non-linear multilevel models using Stan
84,R,formattable,449,62,R,https://github.com/renkun-ken/formattable,renkun-ken,43,2017-10-04T03:09:59Z,Formattable Data Structures
85,R,future,444,39,R,https://github.com/HenrikBengtsson/future,HenrikBengtsson,52,2019-01-25T07:58:28Z,:rocket: R package: future: Unified Parallel and Distributed Processing in R for Everyone
86,R,rayshader,443,32,R,https://github.com/tylermorganwall/rayshader,tylermorganwall,3,2019-01-27T03:57:47Z,"R Package for Producing and Visualizing Hillshaded Maps from Elevation Matrices, in 2D and 3D"
87,R,ballr,437,91,R,https://github.com/toddwschneider/ballr,toddwschneider,1,2018-11-11T23:15:17Z,Interactive NBA and NCAA Shot Charts with R and Shiny
88,R,addinslist,436,95,R,https://github.com/daattali/addinslist,daattali,2,2018-12-18T03:40:34Z,Discover and install useful RStudio addins 
89,R,renjin,431,70,R,https://github.com/bedatadriven/renjin,bedatadriven,61,2019-01-06T19:36:52Z,JVM-based interpreter for the R language for the statistical analysis.
90,R,datapasta,426,33,R,https://github.com/MilesMcBain/datapasta,MilesMcBain,18,2019-01-24T00:44:57Z,"On top of spaghetti, all covered in cheese...."
91,R,engsoccerdata,411,121,R,https://github.com/jalapic/engsoccerdata,jalapic,16,2019-01-02T15:38:32Z,English and European soccer results 1871-2017
92,R,mindr,409,37,R,https://github.com/pzhaonet/mindr,pzhaonet,0,2019-01-23T08:15:12Z,"an R package which converts markdown files (.md, .Rmd) into mindmaps (brainstorms)"
93,R,shinyjs,408,85,R,https://github.com/daattali/shinyjs,daattali,10,2018-11-14T08:37:29Z,Easily improve the user experience of your Shiny apps in seconds
94,R,lubridate,405,149,R,https://github.com/tidyverse/lubridate,tidyverse,58,2019-01-20T09:01:21Z,Make working with dates in R just that little bit easier
95,R,ggalt,402,58,R,https://github.com/hrbrmstr/ggalt,hrbrmstr,25,2018-06-28T16:13:04Z,":earth_americas: Extra Coordinate Systems, Geoms,  Statistical Transformations & Scales for 'ggplot2'"
96,R,SIT,395,351,R,https://github.com/systematicinvestor/SIT,systematicinvestor,24,2018-10-19T01:25:00Z,Systematic Investor Toolkit
97,R,pkgdown,393,184,R,https://github.com/r-lib/pkgdown,r-lib,48,2019-01-23T19:21:06Z,Generate static html documentation for an R package
98,R,highcharter,391,84,R,https://github.com/jbkunst/highcharter,jbkunst,121,2019-01-26T18:12:31Z,R wrapper for highcharts based on htmlwidgets 
99,R,waffle,390,51,R,https://github.com/hrbrmstr/waffle,hrbrmstr,30,2019-01-10T13:05:16Z,:maple_leaf: Make waffle (square pie) charts in R
100,R,ggfortify,377,53,R,https://github.com/sinhrks/ggfortify,sinhrks,14,2018-05-26T11:30:48Z,Define fortify and autoplot functions to allow ggplot2 to handle some popular R packages.
1,Ruby,rails,41957,16948,Ruby,https://github.com/rails/rails,rails,1065,2019-01-26T23:29:41Z,Ruby on Rails
2,Ruby,jekyll,36670,8016,Ruby,https://github.com/jekyll/jekyll,jekyll,163,2019-01-25T09:03:20Z,:globe_with_meridians: Jekyll is a blog-aware static site generator in Ruby
3,Ruby,discourse,27243,6333,Ruby,https://github.com/discourse/discourse,discourse,19,2019-01-26T20:09:43Z,"A platform for community discussion. Free, open, simple."
4,Ruby,fastlane,24338,3711,Ruby,https://github.com/fastlane/fastlane,fastlane,211,2019-01-26T08:25:38Z,🚀 The easiest way to automate building and releasing your iOS and Android apps
5,Ruby,awesome-awesomeness,23496,2959,Ruby,https://github.com/bayandin/awesome-awesomeness,bayandin,7,2019-01-26T13:36:28Z,A curated list of awesome awesomeness
6,Ruby,gitlabhq,21539,5530,Ruby,https://github.com/gitlabhq/gitlabhq,gitlabhq,30,2019-01-25T22:32:45Z,GitLab CE Mirror | Please open new issues in our issue tracker on GitLab.com
7,Ruby,huginn,20420,2233,Ruby,https://github.com/huginn/huginn,huginn,345,2019-01-26T13:22:06Z,Create agents that monitor and act on your behalf.  Your agents are standing by!
8,Ruby,devdocs,19720,1273,Ruby,https://github.com/freeCodeCamp/devdocs,freeCodeCamp,100,2019-01-26T22:09:52Z,API Documentation Browser
9,Ruby,devise,19508,4585,Ruby,https://github.com/plataformatec/devise,plataformatec,29,2019-01-25T19:16:46Z,Flexible authentication solution for Rails with Warden.
10,Ruby,vagrant,17881,3636,Ruby,https://github.com/hashicorp/vagrant,hashicorp,381,2019-01-24T23:39:51Z,Vagrant is a tool for building and distributing development environments.
11,Ruby,mastodon,16523,2916,Ruby,https://github.com/tootsuite/mastodon,tootsuite,1111,2019-01-26T22:59:41Z,"Your self-hosted, globally interconnected microblogging community"
12,Ruby,brew,15976,3546,Ruby,https://github.com/Homebrew/brew,Homebrew,30,2019-01-27T03:13:37Z,🍺 The missing package manager for macOS (or Linux)
13,Ruby,ruby,15301,4096,Ruby,https://github.com/ruby/ruby,ruby,178,2019-01-26T13:43:54Z,The Ruby Programming Language [mirror]
14,Ruby,metasploit-framework,15026,7706,Ruby,https://github.com/rapid7/metasploit-framework,rapid7,655,2019-01-26T00:15:45Z,Metasploit Framework
15,Ruby,engineering-blogs,14711,1696,Ruby,https://github.com/kilimchoi/engineering-blogs,kilimchoi,7,2019-01-25T02:58:59Z,A curated list of engineering blogs
16,Ruby,homebrew-cask,14606,6902,Ruby,https://github.com/Homebrew/homebrew-cask,Homebrew,55,2019-01-27T03:27:37Z,🍻 A CLI workflow for the administration of macOS applications distributed as binaries
17,Ruby,bootstrap-sass,12723,3477,Ruby,https://github.com/twbs/bootstrap-sass,twbs,2,2019-01-11T09:55:53Z,Official Sass port of Bootstrap 2 and 3.
18,Ruby,diaspora,12137,2912,Ruby,https://github.com/diaspora/diaspora,diaspora,440,2019-01-21T22:13:58Z,"A privacy-aware, distributed, open source social network."
19,Ruby,sass,11682,1933,Ruby,https://github.com/sass/sass,sass,85,2018-12-08T07:24:55Z,Sass makes CSS fun again.
20,Ruby,CocoaPods,11248,2014,Ruby,https://github.com/CocoaPods/CocoaPods,CocoaPods,189,2019-01-26T19:40:55Z,The Cocoa Dependency Manager.
21,Ruby,capistrano,10832,1695,Ruby,https://github.com/capistrano/capistrano,capistrano,46,2019-01-14T14:21:47Z,Remote multi-server automation tool
