rank,item,repo_name,stars,forks,language,repo_url,username,issues,last_commit,description
1,top-100-stars,freeCodeCamp,297229,20847,JavaScript,https://github.com/freeCodeCamp/freeCodeCamp,freeCodeCamp,4892,2019-02-02T03:31:31Z,The https://www.freeCodeCamp.org open source codebase and curriculum. Learn to code for free together with millions of people.
2,top-100-stars,bootstrap,130433,63946,CSS,https://github.com/twbs/bootstrap,twbs,323,2019-02-01T17:52:56Z,"The most popular HTML, CSS, and JavaScript framework for developing responsive, mobile first projects on the web."
3,top-100-stars,vue,126866,18087,JavaScript,https://github.com/vuejs/vue,vuejs,223,2019-02-01T12:50:20Z,"🖖 Vue.js is a progressive, incrementally-adoptable JavaScript framework for building UI on the web."
4,top-100-stars,react,121267,21968,JavaScript,https://github.com/facebook/react,facebook,543,2019-02-01T21:05:14Z,"A declarative, efficient, and flexible JavaScript library for building user interfaces."
5,top-100-stars,tensorflow,119888,71786,C++,https://github.com/tensorflow/tensorflow,tensorflow,2029,2019-02-02T03:45:31Z,An Open Source Machine Learning Framework for Everyone
6,top-100-stars,free-programming-books,116906,29409,,https://github.com/EbookFoundation/free-programming-books,EbookFoundation,22,2019-02-01T15:43:50Z,:books: Freely available programming books
7,top-100-stars,awesome,101030,13378,,https://github.com/sindresorhus/awesome,sindresorhus,186,2019-02-01T02:04:24Z,:sunglasses: Curated list of awesome lists
8,top-100-stars,You-Dont-Know-JS,95722,18565,,https://github.com/getify/You-Dont-Know-JS,getify,220,2019-01-23T07:16:49Z,A book series on JavaScript. @YDKJS on twitter.
9,top-100-stars,oh-my-zsh,82819,16025,Shell,https://github.com/robbyrussell/oh-my-zsh,robbyrussell,1005,2019-02-02T02:26:52Z,"A delightful community-driven (with 1,200+ contributors) framework for managing your zsh configuration. Includes 200+ optional plugins (rails, git, OSX, hub, capistrano, brew, ant, php, python, etc), over 140 themes to spice up your morning, and an auto-update tool so that makes it easy to keep up with the latest updates from the community."
10,top-100-stars,d3,82127,20340,JavaScript,https://github.com/d3/d3,d3,7,2019-01-28T17:59:45Z,"Bring data to life with SVG, Canvas and HTML. :bar_chart::chart_with_upwards_trend::tada:"
11,top-100-stars,javascript,81266,15507,JavaScript,https://github.com/airbnb/javascript,airbnb,138,2019-01-30T04:11:58Z,JavaScript Style Guide
12,top-100-stars,gitignore,78450,37481,,https://github.com/github/gitignore,github,67,2019-01-31T22:47:53Z,A collection of useful .gitignore templates
13,top-100-stars,coding-interview-university,73795,21529,,https://github.com/jwasham/coding-interview-university,jwasham,58,2019-01-31T14:58:31Z,A complete computer science study plan to become a software engineer.
14,top-100-stars,react-native,73425,16356,JavaScript,https://github.com/facebook/react-native,facebook,764,2019-02-02T02:19:16Z,A framework for building native apps with React.
15,top-100-stars,developer-roadmap,71251,11079,,https://github.com/kamranahmedse/developer-roadmap,kamranahmedse,164,2019-02-01T00:42:07Z,Roadmap to becoming a web developer in 2019
16,top-100-stars,electron,69603,9041,C++,https://github.com/electron/electron,electron,1133,2019-02-02T02:21:27Z,":electron: Build cross-platform desktop apps with JavaScript, HTML, and CSS"
17,top-100-stars,linux,68888,24787,C,https://github.com/torvalds/linux,torvalds,252,2019-02-02T00:58:25Z,Linux kernel source tree
18,top-100-stars,vscode,68338,9126,TypeScript,https://github.com/Microsoft/vscode,Microsoft,4827,2019-02-02T03:57:29Z,Visual Studio Code
19,top-100-stars,create-react-app,62936,13824,JavaScript,https://github.com/facebook/create-react-app,facebook,349,2019-02-02T02:51:02Z,Set up a modern web app by running one command.
20,top-100-stars,awesome-python,60964,11857,Python,https://github.com/vinta/awesome-python,vinta,449,2019-01-29T04:32:24Z,"A curated list of awesome Python frameworks, libraries, software and resources"
21,top-100-stars,angular.js,59371,28945,JavaScript,https://github.com/angular/angular.js,angular,460,2019-01-26T10:32:23Z,AngularJS - HTML enhanced for web apps!
22,top-100-stars,Font-Awesome,58664,9949,JavaScript,https://github.com/FortAwesome/Font-Awesome,FortAwesome,4722,2019-02-01T19:46:30Z,"The iconic SVG, font, and CSS toolkit"
23,top-100-stars,node,57815,12806,JavaScript,https://github.com/nodejs/node,nodejs,830,2019-02-02T03:32:17Z,Node.js JavaScript runtime :sparkles::turtle::rocket::sparkles:
24,top-100-stars,animate.css,57169,12191,CSS,https://github.com/daneden/animate.css,daneden,16,2019-01-19T19:32:49Z,🍿 A cross-browser library of CSS animations. As easy to use as an easy thing.
25,top-100-stars,system-design-primer,56263,8140,Python,https://github.com/donnemartin/system-design-primer,donnemartin,69,2019-01-31T00:49:37Z,Learn how to design large-scale systems. Prep for the system design interview.  Includes Anki flashcards.
26,top-100-stars,axios,54485,4227,JavaScript,https://github.com/axios/axios,axios,523,2019-02-01T07:48:20Z,Promise based HTTP client for the browser and node.js
27,top-100-stars,go,52698,7247,Go,https://github.com/golang/go,golang,4209,2019-02-01T23:43:55Z,The Go programming language
28,top-100-stars,flutter,52219,5483,Dart,https://github.com/flutter/flutter,flutter,4260,2019-02-02T01:31:13Z,Flutter makes it easy and fast to build beautiful mobile apps.
29,top-100-stars,moby,52055,15080,Go,https://github.com/moby/moby,moby,3591,2019-02-02T02:51:29Z,Moby Project - a collaborative project for the container ecosystem to assemble container-based systems
30,top-100-stars,jquery,50870,17668,JavaScript,https://github.com/jquery/jquery,jquery,89,2019-01-29T13:13:54Z,jQuery JavaScript Library
31,top-100-stars,laravel,48898,15185,PHP,https://github.com/laravel/laravel,laravel,29,2019-02-02T03:22:31Z,A PHP framework for web artisans
32,top-100-stars,CS-Notes,48665,14999,,https://github.com/CyC2018/CS-Notes,CyC2018,0,2019-01-31T06:48:20Z,:books: 技术面试必备基础知识
33,top-100-stars,three.js,48460,18215,JavaScript,https://github.com/mrdoob/three.js,mrdoob,796,2019-02-02T03:48:26Z,JavaScript 3D library.
34,top-100-stars,models,47931,29253,Python,https://github.com/tensorflow/models,tensorflow,1377,2019-02-01T23:07:40Z,Models and examples built with TensorFlow
35,top-100-stars,kubernetes,47703,16562,Go,https://github.com/kubernetes/kubernetes,kubernetes,3132,2019-02-02T03:51:18Z,Production-Grade Container Scheduling and Management
36,top-100-stars,atom,47673,10902,JavaScript,https://github.com/atom/atom,atom,718,2019-02-02T01:02:23Z,:atom: The hackable text editor
37,top-100-stars,public-apis,47067,4889,Python,https://github.com/toddmotto/public-apis,toddmotto,5,2019-01-31T23:20:30Z,A collective list of free APIs for use in software and web development.
38,top-100-stars,webpack,46824,5913,JavaScript,https://github.com/webpack/webpack,webpack,488,2019-02-01T11:10:27Z,"A bundler for javascript and friends. Packs many modules into a few bundled assets. Code Splitting allows for loading parts of the application on demand. Through ""loaders"", modules can be CommonJs, AMD, ES6 modules, CSS, Images, JSON, Coffeescript, LESS, ... and your custom stuff."
39,top-100-stars,youtube-dl,46786,8119,Python,https://github.com/rg3/youtube-dl,rg3,2642,2019-02-02T00:21:18Z,Command-line program to download videos from YouTube.com and other video sites
40,top-100-stars,redux,46606,11849,JavaScript,https://github.com/reduxjs/redux,reduxjs,30,2019-01-30T19:19:57Z,Predictable state container for JavaScript apps
41,top-100-stars,swift,46534,7364,C++,https://github.com/apple/swift,apple,473,2019-02-02T02:49:56Z,The Swift Programming Language
42,top-100-stars,socket.io,45083,8339,JavaScript,https://github.com/socketio/socket.io,socketio,358,2019-01-19T06:08:50Z,Realtime application framework (Node.JS server)
43,top-100-stars,angular,44905,11644,TypeScript,https://github.com/angular/angular,angular,2664,2019-02-02T03:44:38Z,One framework. Mobile & desktop.
44,top-100-stars,puppeteer,44885,3884,JavaScript,https://github.com/GoogleChrome/puppeteer,GoogleChrome,275,2019-02-02T02:43:04Z,Headless Chrome Node API
45,top-100-stars,free-programming-books-zh_CN,44853,15014,JavaScript,https://github.com/justjavac/free-programming-books-zh_CN,justjavac,151,2018-12-23T11:54:19Z,:books: 免费的计算机编程类中文书籍，欢迎投稿
46,top-100-stars,TypeScript,44525,6272,TypeScript,https://github.com/Microsoft/TypeScript,Microsoft,3435,2019-02-02T03:09:08Z,TypeScript is a superset of JavaScript that compiles to clean JavaScript output.
47,top-100-stars,reveal.js,44496,12834,JavaScript,https://github.com/hakimel/reveal.js,hakimel,406,2019-02-01T10:09:10Z,The HTML Presentation Framework
48,top-100-stars,Semantic-UI,44361,4727,JavaScript,https://github.com/Semantic-Org/Semantic-UI,Semantic-Org,830,2019-01-22T05:37:47Z,Semantic is a UI component framework based around useful principles from natural language.
49,top-100-stars,java-design-patterns,44102,14315,Java,https://github.com/iluwatar/java-design-patterns,iluwatar,186,2019-01-31T22:55:49Z,Design patterns implemented in Java
50,top-100-stars,material-ui,44086,8964,JavaScript,https://github.com/mui-org/material-ui,mui-org,294,2019-02-02T01:41:32Z,React components that implement Google's Material Design.
51,top-100-stars,javascript-algorithms,43734,5893,JavaScript,https://github.com/trekhleb/javascript-algorithms,trekhleb,67,2019-02-01T14:23:46Z,📝 Algorithms and data structures implemented in JavaScript with explanations and links to further readings
52,top-100-stars,express,42186,7248,JavaScript,https://github.com/expressjs/express,expressjs,164,2019-01-31T11:59:28Z,"Fast, unopinionated, minimalist web framework for node."
53,top-100-stars,html5-boilerplate,42060,9973,JavaScript,https://github.com/h5bp/html5-boilerplate,h5bp,7,2019-01-29T16:09:40Z,"A professional front-end template for building fast, robust, and adaptable web apps or sites."
54,top-100-stars,ant-design,42038,14193,TypeScript,https://github.com/ant-design/ant-design,ant-design,321,2019-02-02T04:00:18Z,🌈 A UI Design Language
55,top-100-stars,rails,42026,16976,Ruby,https://github.com/rails/rails,rails,1084,2019-02-02T01:27:11Z,Ruby on Rails
56,top-100-stars,awesome-vue,41998,5819,,https://github.com/vuejs/awesome-vue,vuejs,78,2019-02-01T11:34:40Z,🎉 A curated list of awesome things related to Vue.js
57,top-100-stars,build-your-own-x,41889,2722,,https://github.com/danistefanovic/build-your-own-x,danistefanovic,2,2019-01-13T10:29:36Z,🤓 Build your own (insert technology here)
58,top-100-stars,flask,41680,11902,Python,https://github.com/pallets/flask,pallets,42,2019-01-25T13:56:55Z,The Python micro framework for building web applications.
59,top-100-stars,Chart.js,41576,9318,JavaScript,https://github.com/chartjs/Chart.js,chartjs,462,2019-02-02T02:38:32Z,Simple HTML5 Charts using the <canvas> tag
60,top-100-stars,meteor,40731,5036,JavaScript,https://github.com/meteor/meteor,meteor,277,2019-01-31T17:48:26Z,"Meteor, the JavaScript App Platform"
61,top-100-stars,thefuck,40607,2012,Python,https://github.com/nvbn/thefuck,nvbn,140,2019-01-20T06:02:28Z,Magnificent app which corrects your previous console command.
62,top-100-stars,moment,40025,6004,JavaScript,https://github.com/moment/moment,moment,256,2019-01-31T13:23:59Z,"Parse, validate, manipulate, and display dates in javascript."
63,top-100-stars,lantern,39958,8880,Go,https://github.com/getlantern/lantern,getlantern,2539,2019-01-23T19:44:50Z,🔴蓝灯最新版本下载 https://github.com/getlantern/download 🔴 Lantern Latest Download https://github.com/getlantern/download 🔴
64,top-100-stars,httpie,39616,2603,Python,https://github.com/jakubroztocil/httpie,jakubroztocil,143,2019-01-30T17:52:49Z,"As easy as httpie /aitch-tee-tee-pie/ 🥧 Modern command line HTTP client – user-friendly curl alternative with intuitive UI, JSON support, syntax highlighting, wget-like downloads, extensions, etc.  https://twitter.com/clihttp"
65,top-100-stars,awesome-go,39549,5131,Go,https://github.com/avelino/awesome-go,avelino,18,2019-02-01T14:12:07Z,"A curated list of awesome Go frameworks, libraries and software"
66,top-100-stars,django,39235,16907,Python,https://github.com/django/django,django,178,2019-02-02T03:02:09Z,The Web framework for perfectionists with deadlines.
67,top-100-stars,resume.github.com,39224,1043,JavaScript,https://github.com/resume/resume.github.com,resume,37,2018-12-29T23:17:05Z,Resumes generated using the GitHub informations
68,top-100-stars,Front-end-Developer-Interview-Questions,39021,7977,HTML,https://github.com/h5bp/Front-end-Developer-Interview-Questions,h5bp,39,2019-01-09T11:57:38Z,"A list of helpful front-end related questions you can use to interview potential candidates, test yourself or completely ignore."
69,top-100-stars,the-art-of-command-line,38653,3830,,https://github.com/jlevy/the-art-of-command-line,jlevy,106,2019-01-15T03:04:39Z,"Master the command line, in one page"
70,top-100-stars,30-seconds-of-code,38186,4088,JavaScript,https://github.com/30-seconds/30-seconds-of-code,30-seconds,9,2019-01-26T06:09:46Z,Curated collection of useful JavaScript snippets that you can understand in 30 seconds or less.
71,top-100-stars,elasticsearch,38105,12793,Java,https://github.com/elastic/elasticsearch,elastic,1861,2019-02-02T03:48:14Z,"Open Source, Distributed, RESTful Search Engine"
72,top-100-stars,keras,37908,14468,Python,https://github.com/keras-team/keras,keras-team,2098,2019-02-01T15:04:07Z,Deep Learning for humans
73,top-100-stars,awesome-machine-learning,37896,9354,Python,https://github.com/josephmisiti/awesome-machine-learning,josephmisiti,1,2019-01-30T07:02:44Z,"A curated list of awesome Machine Learning frameworks, libraries and software."
74,top-100-stars,json-server,37867,3281,JavaScript,https://github.com/typicode/json-server,typicode,399,2019-01-27T10:54:14Z,Get a full fake REST API with zero coding in less than 30 seconds (seriously)
75,top-100-stars,computer-science,37743,5441,,https://github.com/ossu/computer-science,ossu,40,2019-02-02T02:36:27Z,:mortar_board: Path to a free self-taught education in Computer Science!
76,top-100-stars,RxJava,37462,6380,Java,https://github.com/ReactiveX/RxJava,ReactiveX,27,2019-01-31T23:39:28Z,RxJava – Reactive Extensions for the JVM – a library for composing asynchronous and event-based programs using observable sequences for the Java VM.
77,top-100-stars,lodash,37158,3843,JavaScript,https://github.com/lodash/lodash,lodash,7,2019-02-01T07:43:03Z,"A modern JavaScript utility library delivering modularity, performance, & extras."
78,top-100-stars,material-design-icons,37055,7480,CSS,https://github.com/google/material-design-icons,google,533,2019-01-10T14:39:30Z,Material Design icons by Google
79,top-100-stars,bitcoin,36984,22020,C++,https://github.com/bitcoin/bitcoin,bitcoin,896,2019-02-02T01:11:01Z,Bitcoin Core integration/staging tree
80,top-100-stars,requests,36979,6758,Python,https://github.com/requests/requests,requests,156,2019-01-30T09:32:01Z,Python HTTP Requests for Humans™ ✨🍰✨
81,top-100-stars,ionic,36840,12845,HTML,https://github.com/ionic-team/ionic,ionic-team,399,2019-02-01T22:16:01Z,Build amazing native and progressive web apps with open web technologies. One app running on everything 🎉
82,top-100-stars,jekyll,36721,8022,Ruby,https://github.com/jekyll/jekyll,jekyll,164,2019-02-01T18:09:02Z,:globe_with_meridians: Jekyll is a blog-aware static site generator in Ruby
83,top-100-stars,every-programmer-should-know,36361,3284,,https://github.com/mtdvio/every-programmer-should-know,mtdvio,25,2019-01-31T09:52:29Z,A collection of (mostly) technical things every software developer should know
84,top-100-stars,node-v0.x-archive,35616,7844,,https://github.com/nodejs/node-v0.x-archive,nodejs,571,2018-04-04T08:28:02Z,Moved to https://github.com/nodejs/node
85,top-100-stars,markdown-here,35214,5950,JavaScript,https://github.com/adam-p/markdown-here,adam-p,226,2018-11-13T20:35:39Z,"Google Chrome, Firefox, and Thunderbird extension that lets you write email in Markdown and render it before sending."
86,top-100-stars,netdata,35175,3037,C,https://github.com/netdata/netdata,netdata,492,2019-02-01T20:42:45Z,"Real-time performance monitoring, done right! https://my-netdata.io/"
87,top-100-stars,ansible,35144,14222,Python,https://github.com/ansible/ansible,ansible,5609,2019-02-02T03:56:07Z,"Ansible is a radically simple IT automation platform that makes your applications and systems easier to deploy. Avoid writing scripts or custom code to deploy and update your applications — automate in a language that approaches plain English, using SSH, with no agents to install on remote systems. https://docs.ansible.com/ansible/"
88,top-100-stars,materialize,34983,4693,JavaScript,https://github.com/Dogfalo/materialize,Dogfalo,613,2019-01-27T13:59:29Z,"Materialize, a CSS Framework based on Material Design"
89,top-100-stars,nw.js,34969,3801,C++,https://github.com/nwjs/nw.js,nwjs,731,2019-01-31T15:23:20Z,Call all Node.js modules directly from DOM/WebWorker and enable a new way of writing applications with all Web technologies.
90,top-100-stars,element,34828,6927,Vue,https://github.com/ElemeFE/element,ElemeFE,770,2019-02-02T02:23:33Z,A Vue.js 2.0 UI Toolkit for Web
91,top-100-stars,yarn,34650,2060,JavaScript,https://github.com/yarnpkg/yarn,yarnpkg,1671,2019-02-01T10:57:57Z,"📦🐈 Fast, reliable, and secure dependency management."
92,top-100-stars,react-router,34618,7167,JavaScript,https://github.com/ReactTraining/react-router,ReactTraining,64,2019-02-01T17:10:41Z,Declarative routing for React
93,top-100-stars,impress.js,34439,6793,JavaScript,https://github.com/impress/impress.js,impress,53,2019-01-23T09:03:25Z,It's a presentation framework based on the power of CSS3 transforms and transitions in modern browsers and inspired by the idea behind prezi.com.
94,top-100-stars,next.js,34192,3791,JavaScript,https://github.com/zeit/next.js,zeit,205,2019-02-01T20:20:23Z,The React Framework
95,top-100-stars,redis,34104,13054,C,https://github.com/antirez/redis,antirez,2078,2019-02-01T10:40:22Z,"Redis is an in-memory database that persists on disk. The data model is key-value, but many different kind of values are supported: Strings, Lists, Sets, Sorted Sets, Hashes, HyperLogLogs, Bitmaps."
96,top-100-stars,normalize.css,33862,6855,CSS,https://github.com/necolas/normalize.css,necolas,17,2019-01-03T11:33:37Z,A modern alternative to CSS resets
97,top-100-stars,spring-boot,33799,22658,Java,https://github.com/spring-projects/spring-boot,spring-projects,397,2019-02-01T21:06:05Z,Spring Boot
98,top-100-stars,rust,33760,5504,Rust,https://github.com/rust-lang/rust,rust-lang,4678,2019-02-02T03:11:02Z,Empowering everyone to build reliable and efficient software.
99,top-100-stars,x64dbg,33592,911,C++,https://github.com/x64dbg/x64dbg,x64dbg,358,2019-01-22T02:25:54Z,An open-source x64/x32 debugger for windows.
100,top-100-stars,storybook,33574,2522,JavaScript,https://github.com/storybooks/storybook,storybooks,237,2019-02-02T02:35:32Z,"Interactive UI component dev & test: React, React Native, Vue, Angular, Ember"
1,top-100-forks,datasharing,4619,192558,,https://github.com/jtleek/datasharing,jtleek,445,2019-01-22T19:51:28Z,The Leek group guide to data sharing 
2,top-100-forks,ProgrammingAssignment2,575,115040,R,https://github.com/rdpeng/ProgrammingAssignment2,rdpeng,2673,2019-01-29T19:41:47Z,Repository for Programming Assignment 2 for R Programming on Coursera
3,top-100-forks,Spoon-Knife,10074,102441,HTML,https://github.com/octocat/Spoon-Knife,octocat,13149,2019-02-01T22:14:30Z,This repo is for demonstration purposes only.
4,top-100-forks,tensorflow,119888,71786,C++,https://github.com/tensorflow/tensorflow,tensorflow,2029,2019-02-02T03:45:31Z,An Open Source Machine Learning Framework for Everyone
5,top-100-forks,bootstrap,130433,63946,CSS,https://github.com/twbs/bootstrap,twbs,323,2019-02-01T17:52:56Z,"The most popular HTML, CSS, and JavaScript framework for developing responsive, mobile first projects on the web."
6,top-100-forks,SmartThingsPublic,1169,51109,Groovy,https://github.com/SmartThingsCommunity/SmartThingsPublic,SmartThingsCommunity,1126,2019-02-01T22:12:38Z,SmartThings open-source DeviceTypeHandlers and SmartApps code
7,top-100-forks,ExData_Plotting1,162,49009,,https://github.com/rdpeng/ExData_Plotting1,rdpeng,602,2019-01-29T20:23:40Z,Plotting Assignment 1 for Exploratory Data Analysis
8,top-100-forks,gitignore,78450,37481,,https://github.com/github/gitignore,github,67,2019-01-31T22:47:53Z,A collection of useful .gitignore templates
9,top-100-forks,RepData_PeerAssessment1,77,31267,,https://github.com/rdpeng/RepData_PeerAssessment1,rdpeng,266,2019-01-30T08:47:00Z,Peer Assessment 1 for Reproducible Research
10,top-100-forks,free-programming-books,116906,29409,,https://github.com/EbookFoundation/free-programming-books,EbookFoundation,22,2019-02-01T15:43:50Z,:books: Freely available programming books
11,top-100-forks,models,47931,29253,Python,https://github.com/tensorflow/models,tensorflow,1377,2019-02-01T23:07:40Z,Models and examples built with TensorFlow
12,top-100-forks,angular.js,59371,28945,JavaScript,https://github.com/angular/angular.js,angular,460,2019-01-26T10:32:23Z,AngularJS - HTML enhanced for web apps!
13,top-100-forks,courses,3124,27211,HTML,https://github.com/DataScienceSpecialization/courses,DataScienceSpecialization,93,2018-12-06T17:22:20Z,Course materials for the Data Science Specialization: https://www.coursera.org/specialization/jhudatascience/1
14,top-100-forks,frontend-nanodegree-resume,1015,25033,JavaScript,https://github.com/udacity/frontend-nanodegree-resume,udacity,0,2018-11-27T21:09:19Z,This repository is used for one of the projects in Udacity's Front-End Web Developer Nanodegree program. Learn how to become a Front-End Developer today with line-by-line code reviewed projects and get a job with career services!
15,top-100-forks,linux,68888,24787,C,https://github.com/torvalds/linux,torvalds,252,2019-02-02T00:58:25Z,Linux kernel source tree
16,top-100-forks,cgm-remote-monitor,639,23574,JavaScript,https://github.com/nightscout/cgm-remote-monitor,nightscout,221,2019-02-02T01:29:47Z,nightscout web monitor
17,top-100-forks,jekyll-now,5652,23063,CSS,https://github.com/barryclark/jekyll-now,barryclark,179,2019-01-31T23:34:04Z,"Build a Jekyll blog in minutes, without touching the command line."
18,top-100-forks,patchwork,825,22797,HTML,https://github.com/jlord/patchwork,jlord,590,2019-02-02T02:55:22Z,All the Git-it Workshop completers! 
19,top-100-forks,spring-boot,33799,22658,Java,https://github.com/spring-projects/spring-boot,spring-projects,397,2019-02-01T21:06:05Z,Spring Boot
20,top-100-forks,opencv,31511,22510,C++,https://github.com/opencv/opencv,opencv,1600,2019-02-01T16:15:45Z,Open Source Computer Vision Library
21,top-100-forks,recipes,59,22430,,https://github.com/LarryMad/recipes,LarryMad,2138,2019-02-01T14:52:52Z,
22,top-100-forks,bitcoin,36984,22020,C++,https://github.com/bitcoin/bitcoin,bitcoin,896,2019-02-02T01:11:01Z,Bitcoin Core integration/staging tree
23,top-100-forks,react,121267,21968,JavaScript,https://github.com/facebook/react,facebook,543,2019-02-01T21:05:14Z,"A declarative, efficient, and flexible JavaScript library for building user interfaces."
24,top-100-forks,coding-interview-university,73795,21529,,https://github.com/jwasham/coding-interview-university,jwasham,58,2019-01-31T14:58:31Z,A complete computer science study plan to become a software engineer.
25,top-100-forks,freeCodeCamp,297229,20847,JavaScript,https://github.com/freeCodeCamp/freeCodeCamp,freeCodeCamp,4892,2019-02-02T03:31:31Z,The https://www.freeCodeCamp.org open source codebase and curriculum. Learn to code for free together with millions of people.
26,top-100-forks,d3,82127,20340,JavaScript,https://github.com/d3/d3,d3,7,2019-01-28T17:59:45Z,"Bring data to life with SVG, Canvas and HTML. :bar_chart::chart_with_upwards_trend::tada:"
27,top-100-forks,You-Dont-Know-JS,95722,18565,,https://github.com/getify/You-Dont-Know-JS,getify,220,2019-01-23T07:16:49Z,A book series on JavaScript. @YDKJS on twitter.
28,top-100-forks,three.js,48460,18215,JavaScript,https://github.com/mrdoob/three.js,mrdoob,796,2019-02-02T03:48:26Z,JavaScript 3D library.
29,top-100-forks,vue,126866,18087,JavaScript,https://github.com/vuejs/vue,vuejs,223,2019-02-01T12:50:20Z,"🖖 Vue.js is a progressive, incrementally-adoptable JavaScript framework for building UI on the web."
30,top-100-forks,spark,20456,17996,Scala,https://github.com/apache/spark,apache,438,2019-02-02T03:39:58Z,Apache Spark
31,top-100-forks,jquery,50870,17668,JavaScript,https://github.com/jquery/jquery,jquery,89,2019-01-29T13:13:54Z,jQuery JavaScript Library
32,top-100-forks,shadowsocks,28492,17482,Python,https://github.com/shadowsocks/shadowsocks,shadowsocks,393,2019-01-21T14:22:43Z,
33,top-100-forks,rails,42026,16976,Ruby,https://github.com/rails/rails,rails,1084,2019-02-02T01:27:11Z,Ruby on Rails
34,top-100-forks,django,39235,16907,Python,https://github.com/django/django,django,178,2019-02-02T03:02:09Z,The Web framework for perfectionists with deadlines.
35,top-100-forks,spring-framework,26335,16772,Java,https://github.com/spring-projects/spring-framework,spring-projects,881,2019-02-01T13:54:02Z,Spring Framework
36,top-100-forks,tutorials,11303,16686,Java,https://github.com/eugenp/tutorials,eugenp,49,2019-02-01T21:03:36Z,"The ""REST With Spring"" Course: "
37,top-100-forks,kubernetes,47703,16562,Go,https://github.com/kubernetes/kubernetes,kubernetes,3132,2019-02-02T03:51:18Z,Production-Grade Container Scheduling and Management
