rank,item,repo_name,stars,forks,language,repo_url,username,issues,last_commit,description
66,Python,bitcoinbook,11366,3279,Python,https://github.com/bitcoinbook/bitcoinbook,bitcoinbook,106,2019-01-25T10:19:52Z,Mastering Bitcoin 2nd Edition - Programming the Open Blockchain
67,Python,sanic,11293,1065,Python,https://github.com/huge-success/sanic,huge-success,132,2019-01-31T14:24:32Z,Async Python 3.5+ web server that's written to go fast
68,Python,fabric,10979,1684,Python,https://github.com/fabric/fabric,fabric,313,2019-01-26T21:47:35Z,"Simple, Pythonic remote execution and deployment."
69,Python,ML-From-Scratch,10954,1820,Python,https://github.com/eriklindernoren/ML-From-Scratch,eriklindernoren,10,2019-01-23T19:22:24Z,Machine Learning From Scratch. Bare bones Python implementations of machine learning models and algorithms with a focus on accessibility. Aims to cover everything from data mining to deep learning.
70,Python,airflow,10893,3841,Python,https://github.com/apache/airflow,apache,257,2019-02-02T04:00:54Z,Apache Airflow
71,Python,luigi,10856,1833,Python,https://github.com/spotify/luigi,spotify,62,2019-01-31T20:45:25Z,"Luigi is a Python module that helps you build complex pipelines of batch jobs. It handles dependency resolution, workflow management, visualization etc. It also comes with Hadoop support built in. "
72,Python,material-theme,10760,774,Python,https://github.com/equinusocio/material-theme,equinusocio,4,2018-04-23T13:45:04Z,"Material Theme, the most epic theme for Sublime Text 3 by Mattia Astorino"
73,Python,iTerm2-Color-Schemes,10709,3016,Python,https://github.com/mbadolato/iTerm2-Color-Schemes,mbadolato,11,2019-01-22T21:28:36Z,"Over 200 terminal color schemes/themes for iTerm/iTerm2 (with ports to Terminal, Konsole, PuTTY, Xresources, XRDB, Remina, Termite, XFCE, Tilda, FreeBSD VT, and Terminator)"
74,Python,Algorithm_Interview_Notes-Chinese,10537,3053,Python,https://github.com/imhuay/Algorithm_Interview_Notes-Chinese,imhuay,11,2018-11-07T05:52:59Z,2018/2019/校招/春招/秋招/算法/机器学习(Machine Learning)/深度学习(Deep Learning)/自然语言处理(NLP)/C/C++/Python/面试笔记
75,Python,Awesome-Linux-Software,10086,905,Python,https://github.com/luong-komorebi/Awesome-Linux-Software,luong-komorebi,10,2019-02-01T14:30:12Z,"A list of awesome applications, software, tools and other materials for Linux distros. "
76,Python,Mask_RCNN,10042,4277,Python,https://github.com/matterport/Mask_RCNN,matterport,730,2019-02-01T04:12:39Z,Mask R-CNN for object detection and instance segmentation on Keras and TensorFlow
77,Python,nginx-proxy,9957,1888,Python,https://github.com/jwilder/nginx-proxy,jwilder,489,2019-01-30T01:32:01Z,Automated nginx proxy for Docker containers using docker-gen
78,Python,pix2code,9955,984,Python,https://github.com/tonybeltramelli/pix2code,tonybeltramelli,0,2017-12-13T08:36:56Z,pix2code: Generating Code from a Graphical User Interface Screenshot
79,Python,powerline,9863,773,Python,https://github.com/powerline/powerline,powerline,142,2018-11-11T12:23:54Z,"Powerline is a statusline plugin for vim, and provides statuslines and prompts for several other applications, including zsh, bash, tmux, IPython, Awesome and Qtile."
80,Python,TensorFlow-Course,9692,1623,Python,https://github.com/osforscience/TensorFlow-Course,osforscience,3,2019-01-24T08:02:31Z,Simple and ready-to-use tutorials for TensorFlow 
81,Python,salt,9604,4465,Python,https://github.com/saltstack/salt,saltstack,2414,2019-02-02T00:12:22Z,Software to automate the management and configuration of any infrastructure or application at scale. Get access to the Salt software package repository here: 
82,Python,Python,9593,5795,Python,https://github.com/geekcomputers/Python,geekcomputers,74,2019-01-29T03:41:02Z,My Python Examples
83,Python,pytorch-tutorial,9589,2885,Python,https://github.com/yunjey/pytorch-tutorial,yunjey,30,2018-12-04T13:33:51Z,PyTorch Tutorial for Deep Learning Researchers
84,Python,HelloGitHub,9240,957,Python,https://github.com/521xueweihan/HelloGitHub,521xueweihan,28,2019-01-27T15:43:11Z,:octocat: 分享 GitHub 上有趣、入门级的开源项目，帮你找到编程的乐趣。欢迎推荐、自荐项目，让更多人知道你的项目⭐️
85,Python,FastPhotoStyle,9220,832,Python,https://github.com/NVIDIA/FastPhotoStyle,NVIDIA,28,2018-08-24T01:33:43Z,"Style transfer, deep learning, feature transform"
86,Python,locust,9198,1334,Python,https://github.com/locustio/locust,locustio,153,2019-01-19T04:28:33Z,Scalable user load testing tool written in Python
87,Python,faceswap,9097,2764,Python,https://github.com/deepfakes/faceswap,deepfakes,8,2019-02-01T20:22:54Z,Non official project based on original /r/Deepfakes thread. Many thanks to him!
88,Python,sshuttle,8995,665,Python,https://github.com/apenwarr/sshuttle,apenwarr,22,2018-02-15T13:16:12Z,Wrong project!  You should head over to http://github.com/sshuttle/sshuttle
89,Python,zulip,8946,2776,Python,https://github.com/zulip/zulip,zulip,1211,2019-02-02T02:51:18Z,Zulip server - powerful open source team chat
90,Python,tflearn,8909,2235,Python,https://github.com/tflearn/tflearn,tflearn,544,2019-01-10T14:15:08Z,Deep learning library featuring a higher-level API for TensorFlow.
91,Python,neural-doodle,8904,782,Python,https://github.com/alexjc/neural-doodle,alexjc,45,2016-12-28T15:58:48Z,"Turn your two-bit doodles into fine artworks with deep neural networks, generate seamless textures from photos, transfer style from one image to another, perform example-based upscaling, but wait... there's more! (An implementation of Semantic Style Transfer.)"
92,Python,bokeh,8903,2375,Python,https://github.com/bokeh/bokeh,bokeh,463,2019-02-02T00:58:05Z,Interactive Web Plotting for Python
93,Python,RocAlphaGo,8896,2491,Python,https://github.com/Rochester-NRT/RocAlphaGo,Rochester-NRT,30,2018-06-09T13:55:11Z,"An independent, student-led replication of DeepMind's 2016 Nature publication, ""Mastering the game of Go with deep neural networks and tree search"" (Nature 529, 484-489, 28 Jan 2016), details of which can be found on their website https://deepmind.com/publications.html."
94,Python,autojump,8858,450,Python,https://github.com/wting/autojump,wting,136,2019-01-29T20:36:56Z,A cd command that learns - easily navigate directories from the command line
95,Python,neural-enhance,8855,929,Python,https://github.com/alexjc/neural-enhance,alexjc,116,2018-01-25T05:01:58Z,Super Resolution for images using deep learning.
96,Python,tqdm,8796,461,Python,https://github.com/tqdm/tqdm,tqdm,153,2019-02-01T01:17:11Z,"A fast, extensible progress bar for Python and CLI"
97,Python,cookiecutter,8789,967,Python,https://github.com/audreyr/cookiecutter,audreyr,211,2019-01-30T04:11:42Z,"A command-line utility that creates projects from cookiecutters (project templates). E.g. Python package projects, jQuery plugin projects."
98,Python,kivy,8718,1984,Python,https://github.com/kivy/kivy,kivy,696,2019-02-02T00:11:47Z,"Open source UI framework written in Python, running on Windows, Linux, macOS, Android and iOS"
99,Python,Theano,8671,2480,Python,https://github.com/Theano/Theano,Theano,643,2019-01-26T04:09:41Z,"Theano is a Python library that allows you to define, optimize, and evaluate mathematical expressions involving multi-dimensional arrays efficiently. It can use GPUs and perform efficient symbolic differentiation."
100,Python,matplotlib,8640,3942,Python,https://github.com/matplotlib/matplotlib,matplotlib,1466,2019-02-01T21:58:48Z,matplotlib: plotting with Python
1,R,ggplot2,3588,1354,R,https://github.com/tidyverse/ggplot2,tidyverse,162,2019-02-01T20:56:55Z,An implementation of the Grammar of Graphics in R
2,R,ML_for_Hackers,3458,2224,R,https://github.com/johnmyleswhite/ML_for_Hackers,johnmyleswhite,33,2017-10-18T01:53:18Z,"Code accompanying the book ""Machine Learning for Hackers"""
3,R,awesome-R,3343,1128,R,https://github.com/qinwf/awesome-R,qinwf,31,2019-01-20T22:59:45Z,"A curated list of awesome R packages, frameworks and software."
4,R,shiny,3237,1453,R,https://github.com/rstudio/shiny,rstudio,448,2019-02-01T21:29:09Z,Easy interactive web applications with R
5,R,swirl_courses,2807,6025,R,https://github.com/swirldev/swirl_courses,swirldev,121,2019-01-24T19:24:45Z,:mortar_board: A collection of interactive courses for the swirl R package.
6,R,AnomalyDetection,2797,640,R,https://github.com/twitter/AnomalyDetection,twitter,66,2018-04-16T21:53:31Z,Anomaly Detection with R
7,R,dplyr,2792,1026,R,https://github.com/tidyverse/dplyr,tidyverse,105,2019-02-01T14:57:09Z,dplyr: A grammar of data manipulation
8,R,devtools,1759,628,R,https://github.com/r-lib/devtools,r-lib,50,2019-01-23T19:12:25Z,Tools to make an R developer's life easier
9,R,r4ds,1738,2152,R,https://github.com/hadley/r4ds,hadley,73,2019-01-29T14:06:54Z,R for data science
10,R,knitr,1709,719,R,https://github.com/yihui/knitr,yihui,77,2019-01-31T15:24:55Z,A general-purpose tool for dynamic report generation in R
11,R,investing,1679,104,R,https://github.com/zonination/investing,zonination,0,2016-12-27T13:58:02Z,Investing Returns on the Market as a Whole
12,R,benchm-ml,1606,295,R,https://github.com/szilard/benchm-ml,szilard,10,2018-09-15T18:57:25Z,"A minimal benchmark for scalability, speed and accuracy of commonly used open source implementations (R packages, Python scikit-learn, H2O, xgboost, Spark MLlib etc.) of the top machine learning algorithms for binary classification (random forests, gradient boosted trees, deep neural networks etc.)."
13,R,stats337,1489,226,R,https://github.com/hadley/stats337,hadley,7,2018-06-21T15:57:29Z,Readings in applied data science
14,R,plotly,1428,502,R,https://github.com/ropensci/plotly,ropensci,240,2019-02-01T16:14:19Z,An interactive graphing library for R
15,R,nyc-taxi-data,1418,435,R,https://github.com/toddwschneider/nyc-taxi-data,toddwschneider,0,2019-01-31T13:28:14Z,"Import public NYC taxi and for-hire vehicle (Uber, Lyft, etc.) trip data into PostgreSQL database"
16,R,rmarkdown,1395,618,R,https://github.com/rstudio/rmarkdown,rstudio,107,2019-02-02T04:01:22Z,Dynamic Documents for R
17,R,bookdown,1303,589,R,https://github.com/rstudio/bookdown,rstudio,65,2019-01-30T22:14:07Z,Authoring Books and Technical Documents with R Markdown
18,R,awesome-network-analysis,1295,270,R,https://github.com/briatte/awesome-network-analysis,briatte,14,2018-12-28T11:02:41Z,A curated list of awesome network analysis resources.
19,R,DataScienceR,1238,669,R,https://github.com/ujjwalkarn/DataScienceR,ujjwalkarn,3,2018-04-18T00:01:52Z,"a curated list of R tutorials for Data Science, NLP and Machine Learning "
20,R,mlr,1159,325,R,https://github.com/mlr-org/mlr,mlr-org,458,2019-02-01T21:59:00Z,mlr: Machine Learning in R 
21,R,gganimate,1112,192,R,https://github.com/thomasp85/gganimate,thomasp85,46,2019-01-29T12:18:57Z,A Grammar of Animated Graphics
22,R,tensorflow,1105,303,R,https://github.com/rstudio/tensorflow,rstudio,5,2019-02-01T19:57:53Z,TensorFlow for R
23,R,DiagrammeR,1098,175,R,https://github.com/rich-iannone/DiagrammeR,rich-iannone,85,2018-12-12T01:51:59Z,Graph and network visualization using tabular data in R
24,R,rvest,1025,267,R,https://github.com/hadley/rvest,hadley,70,2019-01-23T19:39:39Z,Simple web scraping for R
25,R,caret,988,479,R,https://github.com/topepo/caret,topepo,136,2019-01-19T16:45:02Z,caret (Classification And Regression Training) R package that contains misc functions for training and plotting classification and regression models
26,R,labs,979,1407,R,https://github.com/genomicsclass/labs,genomicsclass,15,2018-10-29T20:05:09Z,Rmd source files for the HarvardX series PH525x
27,R,ggthemes,956,190,R,https://github.com/jrnold/ggthemes,jrnold,4,2019-01-31T14:57:34Z,"Additional themes, scales, and geoms for ggplot2"
28,R,patchwork,953,69,R,https://github.com/thomasp85/patchwork,thomasp85,29,2018-09-22T12:30:35Z,The Composer of ggplots
29,R,CausalImpact,891,148,R,https://github.com/google/CausalImpact,google,13,2018-03-28T14:22:21Z,An R package for causal inference in time series
30,R,blogdown,881,200,R,https://github.com/rstudio/blogdown,rstudio,8,2019-02-01T15:08:18Z,Create Blogs and Websites with R Markdown
31,R,wesanderson,867,76,R,https://github.com/karthik/wesanderson,karthik,10,2019-02-01T23:29:59Z,A Wes Anderson color palette for R
32,R,reticulate,808,137,R,https://github.com/rstudio/reticulate,rstudio,152,2019-01-27T23:23:03Z,R Interface to Python
33,R,broom,803,221,R,https://github.com/tidymodels/broom,tidymodels,141,2019-02-01T16:09:48Z,Convert statistical analysis objects from R into tidy format
34,R,slidify,803,348,R,https://github.com/ramnathv/slidify,ramnathv,179,2016-08-02T03:54:45Z,Generate reproducible html5 slides from R markdown
35,R,swirl,796,532,R,https://github.com/swirldev/swirl,swirldev,162,2018-10-11T16:05:05Z,":cyclone: Learn R, in R."
36,R,tofsims,793,5,R,https://github.com/fossasia/tofsims,fossasia,0,2017-11-29T19:16:12Z,
37,R,plumber,792,143,R,https://github.com/trestletech/plumber,trestletech,99,2019-02-01T22:36:39Z,Turn your R code into a web API.
38,R,httr,754,1810,R,https://github.com/r-lib/httr,r-lib,11,2019-01-16T17:13:49Z,httr: a friendly http package for R
39,R,purrr,730,166,R,https://github.com/tidyverse/purrr,tidyverse,45,2019-01-28T08:35:08Z,A functional programming toolkit for R
40,R,tidytext,716,145,R,https://github.com/juliasilge/tidytext,juliasilge,8,2019-01-05T21:22:56Z,"Text mining using dplyr, ggplot2, and other tidy tools :sparkles::page_facing_up::sparkles::page_facing_up::sparkles:"
41,R,rethinking,688,216,R,https://github.com/rmcelreath/rethinking,rmcelreath,81,2019-01-31T15:58:06Z,Statistical Rethinking course and book package
42,R,tidyr,675,262,R,https://github.com/tidyverse/tidyr,tidyverse,51,2019-02-01T09:51:30Z,Easily tidy data with spread and gather functions.
43,R,googlesheets,673,163,R,https://github.com/jennybc/googlesheets,jennybc,89,2018-06-29T17:30:23Z,Google Spreadsheets R API
44,R,readr,669,208,R,https://github.com/tidyverse/readr,tidyverse,68,2019-02-01T14:24:12Z,"Read flat files (csv, tsv, fwf) into R"
45,R,forecast,667,238,R,https://github.com/robjhyndman/forecast,robjhyndman,8,2019-01-21T15:58:28Z,forecast package for R
46,R,magrittr,663,124,R,https://github.com/tidyverse/magrittr,tidyverse,21,2019-01-05T16:37:00Z,Improve the readability of R code with the pipe
47,R,advanced-shiny,652,246,R,https://github.com/daattali/advanced-shiny,daattali,0,2018-06-02T15:42:50Z,Shiny tips & tricks for improving your apps and solving common problems
48,R,ggvis,652,180,R,https://github.com/rstudio/ggvis,rstudio,192,2018-10-01T16:22:08Z,Interactive grammar of graphics for R
49,R,SparkR-pkg,651,347,R,https://github.com/amplab-extras/SparkR-pkg,amplab-extras,21,2016-06-10T21:42:55Z,R frontend for Spark
50,R,tidyverse,643,135,R,https://github.com/tidyverse/tidyverse,tidyverse,15,2019-01-05T16:01:52Z,Easily install and load packages from the tidyverse
51,R,gt,639,37,R,https://github.com/rstudio/gt,rstudio,73,2019-02-01T22:31:20Z,"Easily generate information-rich, publication-quality tables from R"
52,R,MLPB,632,234,R,https://github.com/ben519/MLPB,ben519,0,2017-12-15T20:25:45Z,Machine Learning Problem Bible | Problem Set Here >>
53,R,rnaseq_tutorial,617,355,R,https://github.com/griffithlab/rnaseq_tutorial,griffithlab,9,2018-11-01T19:59:51Z,"Informatics for RNA-seq: A web resource for analysis on the cloud. Educational tutorials and working pipelines for RNA-seq analysis including an introduction to: cloud computing, critical file formats, reference genomes, gene annotation, expression, differential expression, alternative splicing, data visualization, and interpretation."
54,R,sparklyr,617,223,R,https://github.com/rstudio/sparklyr,rstudio,352,2019-02-02T03:31:59Z,R interface for Apache Spark
55,R,BanditsBook,615,211,R,https://github.com/johnmyleswhite/BanditsBook,johnmyleswhite,5,2018-04-05T06:34:29Z,Code for my book on Multi-Armed Bandit Algorithms
56,R,htmlwidgets,603,178,R,https://github.com/ramnathv/htmlwidgets,ramnathv,105,2019-01-16T20:16:05Z,HTML Widgets for R
57,R,ggraph,595,69,R,https://github.com/thomasp85/ggraph,thomasp85,59,2019-01-29T11:55:40Z,Grammar of Graph Graphics
58,R,drake,594,51,R,https://github.com/ropensci/drake,ropensci,4,2019-02-02T03:59:43Z,An R-focused pipeline toolkit for reproducibility and high-performance computing
59,R,perceptions,591,74,R,https://github.com/zonination/perceptions,zonination,0,2017-08-25T14:34:20Z,Perceptions of Probability and Numbers
60,R,ggrepel,576,70,R,https://github.com/slowkow/ggrepel,slowkow,22,2019-01-13T20:51:02Z,:round_pushpin: Repel overlapping text labels away from each other.
61,R,ProgrammingAssignment2,575,115040,R,https://github.com/rdpeng/ProgrammingAssignment2,rdpeng,2673,2019-01-29T19:41:47Z,Repository for Programming Assignment 2 for R Programming on Coursera
62,R,janitor,571,64,R,https://github.com/sfirke/janitor,sfirke,55,2019-01-27T23:46:00Z,simple tools for data cleaning in R
63,R,text2vec,570,98,R,https://github.com/dselivanov/text2vec,dselivanov,29,2019-01-18T07:08:50Z,"Fast vectorization, topic modeling, distances and GloVe word embeddings in R."
64,R,testthat,569,227,R,https://github.com/r-lib/testthat,r-lib,92,2019-01-02T18:15:04Z,An R 📦 to make testing 😀
65,R,rappor,561,104,R,https://github.com/google/rappor,google,32,2019-01-10T13:19:15Z,RAPPOR: Privacy-Preserving Reporting Algorithms
66,R,r-source,557,189,R,https://github.com/wch/r-source,wch,0,2019-02-02T00:09:47Z,"Read-only mirror of R source code from https://svn.r-project.org/R/, updated hourly. See the build instructions on the wiki page."
67,R,RStartHere,545,201,R,https://github.com/rstudio/RStartHere,rstudio,6,2018-04-02T18:39:27Z,A guide to some of the most useful R Packages that we know about
68,R,ProjectTemplate,537,154,R,https://github.com/KentonWhite/ProjectTemplate,KentonWhite,17,2019-02-01T16:29:48Z,A template utility for R projects that provides a skeletal project.
69,R,lintr,530,99,R,https://github.com/jimhester/lintr,jimhester,130,2019-02-01T17:13:41Z,Static Code Analysis for R
70,R,rstan,520,177,R,https://github.com/stan-dev/rstan,stan-dev,150,2019-01-30T02:54:32Z,"RStan, the R interface to Stan"
71,R,tidytuesday,518,244,R,https://github.com/rfordatascience/tidytuesday,rfordatascience,21,2019-02-01T13:34:19Z,Official repo for the #tidytuesday project
72,R,asdfree,510,440,R,https://github.com/ajdamico/asdfree,ajdamico,88,2019-01-26T13:39:07Z,analyze survey data for free
73,R,rayshader,504,34,R,https://github.com/tylermorganwall/rayshader,tylermorganwall,4,2019-01-31T03:57:51Z,"R Package for Producing and Visualizing Hillshaded Maps from Elevation Matrices, in 2D and 3D"
74,R,keras,498,174,R,https://github.com/rstudio/keras,rstudio,15,2019-02-01T19:38:33Z,R Interface to Keras
75,R,opencpu,484,91,R,https://github.com/opencpu/opencpu,opencpu,73,2019-01-11T22:09:55Z,OpenCPU system for embedded scientific computation and reproducible research
76,R,ggthemr,483,71,R,https://github.com/cttobin/ggthemr,cttobin,3,2018-04-16T15:09:03Z,Themes for ggplot2.
77,R,ggmap,481,197,R,https://github.com/dkahle/ggmap,dkahle,75,2019-01-29T23:41:37Z,a package for plotting maps in R with ggplot2
78,R,hrbrthemes,477,53,R,https://github.com/hrbrmstr/hrbrthemes,hrbrmstr,12,2019-01-21T20:16:34Z,":lock_with_ink_pen: Opinionated, typographic-centric ggplot2 themes and theme components"
79,R,esquisse,472,45,R,https://github.com/dreamRs/esquisse,dreamRs,16,2018-12-31T14:40:09Z,RStudio add-in to make plots with ggplot2
80,R,plyr,471,120,R,https://github.com/hadley/plyr,hadley,27,2018-12-05T19:23:26Z,"A R package for splitting, applying and combining large problems into simpler problems"
81,R,sf,467,117,R,https://github.com/r-spatial/sf,r-spatial,41,2019-01-29T20:59:18Z,Simple Features for R
82,R,quanteda,465,109,R,https://github.com/quanteda/quanteda,quanteda,86,2019-02-02T03:24:06Z,An R package for the Quantitative Analysis of Textual Data
83,R,networkD3,457,226,R,https://github.com/christophergandrud/networkD3,christophergandrud,69,2018-04-11T11:04:51Z,D3 JavaScript Network Graphs from R
84,R,brms,454,57,R,https://github.com/paul-buerkner/brms,paul-buerkner,38,2019-02-01T09:28:12Z,brms R package for Bayesian generalized multivariate non-linear multilevel models using Stan
85,R,formattable,449,63,R,https://github.com/renkun-ken/formattable,renkun-ken,43,2017-10-04T03:09:59Z,Formattable Data Structures
86,R,future,446,41,R,https://github.com/HenrikBengtsson/future,HenrikBengtsson,55,2019-01-28T17:17:14Z,:rocket: R package: future: Unified Parallel and Distributed Processing in R for Everyone
87,R,ballr,440,91,R,https://github.com/toddwschneider/ballr,toddwschneider,1,2018-11-11T23:15:17Z,Interactive NBA and NCAA Shot Charts with R and Shiny
88,R,addinslist,437,95,R,https://github.com/daattali/addinslist,daattali,2,2018-12-18T03:40:34Z,Discover and install useful RStudio addins 
89,R,datapasta,436,33,R,https://github.com/MilesMcBain/datapasta,MilesMcBain,18,2019-01-24T00:44:57Z,"On top of spaghetti, all covered in cheese...."
90,R,renjin,431,71,R,https://github.com/bedatadriven/renjin,bedatadriven,63,2019-01-06T19:36:52Z,JVM-based interpreter for the R language for the statistical analysis.
91,R,engsoccerdata,411,121,R,https://github.com/jalapic/engsoccerdata,jalapic,16,2019-01-02T15:38:32Z,English and European soccer results 1871-2017
92,R,mindr,411,37,R,https://github.com/pzhaonet/mindr,pzhaonet,0,2019-01-27T07:34:28Z,"an R package which converts markdown files (.md, .Rmd) into mindmaps (brainstorms)"
93,R,shinyjs,410,87,R,https://github.com/daattali/shinyjs,daattali,10,2018-11-14T08:37:29Z,Easily improve the user experience of your Shiny apps in seconds
94,R,lubridate,405,150,R,https://github.com/tidyverse/lubridate,tidyverse,59,2019-01-20T09:01:21Z,Make working with dates in R just that little bit easier
95,R,ggalt,403,59,R,https://github.com/hrbrmstr/ggalt,hrbrmstr,25,2018-06-28T16:13:04Z,":earth_americas: Extra Coordinate Systems, Geoms,  Statistical Transformations & Scales for 'ggplot2'"
96,R,SIT,395,352,R,https://github.com/systematicinvestor/SIT,systematicinvestor,24,2018-10-19T01:25:00Z,Systematic Investor Toolkit
97,R,waffle,395,52,R,https://github.com/hrbrmstr/waffle,hrbrmstr,30,2019-01-10T13:05:16Z,:maple_leaf: Make waffle (square pie) charts in R
98,R,pkgdown,395,184,R,https://github.com/r-lib/pkgdown,r-lib,48,2019-01-30T16:29:17Z,Generate static html documentation for an R package
99,R,highcharter,394,85,R,https://github.com/jbkunst/highcharter,jbkunst,124,2019-02-01T19:49:06Z,R wrapper for highcharts based on htmlwidgets 
100,R,ggfortify,379,53,R,https://github.com/sinhrks/ggfortify,sinhrks,14,2018-05-26T11:30:48Z,Define fortify and autoplot functions to allow ggplot2 to handle some popular R packages.
1,Ruby,rails,42026,16976,Ruby,https://github.com/rails/rails,rails,1084,2019-02-02T01:27:11Z,Ruby on Rails
2,Ruby,jekyll,36721,8022,Ruby,https://github.com/jekyll/jekyll,jekyll,164,2019-02-01T18:09:02Z,:globe_with_meridians: Jekyll is a blog-aware static site generator in Ruby
3,Ruby,discourse,27295,6330,Ruby,https://github.com/discourse/discourse,discourse,23,2019-02-02T02:26:38Z,"A platform for community discussion. Free, open, simple."
4,Ruby,fastlane,24379,3716,Ruby,https://github.com/fastlane/fastlane,fastlane,211,2019-02-01T21:35:09Z,🚀 The easiest way to automate building and releasing your iOS and Android apps
5,Ruby,awesome-awesomeness,23561,2966,Ruby,https://github.com/bayandin/awesome-awesomeness,bayandin,6,2019-02-01T15:36:54Z,A curated list of awesome awesomeness
6,Ruby,gitlabhq,21547,5526,Ruby,https://github.com/gitlabhq/gitlabhq,gitlabhq,30,2019-02-01T19:40:53Z,GitLab CE Mirror | Please open new issues in our issue tracker on GitLab.com
7,Ruby,huginn,20453,2239,Ruby,https://github.com/huginn/huginn,huginn,346,2019-01-29T23:54:01Z,Create agents that monitor and act on your behalf.  Your agents are standing by!
8,Ruby,devdocs,19775,1275,Ruby,https://github.com/freeCodeCamp/devdocs,freeCodeCamp,101,2019-02-01T08:39:04Z,API Documentation Browser
9,Ruby,devise,19527,4588,Ruby,https://github.com/plataformatec/devise,plataformatec,24,2019-02-01T12:05:09Z,Flexible authentication solution for Rails with Warden.
10,Ruby,vagrant,17904,3640,Ruby,https://github.com/hashicorp/vagrant,hashicorp,382,2019-02-02T00:15:51Z,Vagrant is a tool for building and distributing development environments.
11,Ruby,mastodon,16570,2929,Ruby,https://github.com/tootsuite/mastodon,tootsuite,1128,2019-02-02T00:26:50Z,"Your self-hosted, globally interconnected microblogging community"
12,Ruby,brew,16064,3575,Ruby,https://github.com/Homebrew/brew,Homebrew,15,2019-02-01T23:01:31Z,🍺 The missing package manager for macOS (or Linux)
13,Ruby,ruby,15327,4102,Ruby,https://github.com/ruby/ruby,ruby,176,2019-02-01T13:42:08Z,The Ruby Programming Language [mirror]
14,Ruby,metasploit-framework,15086,7728,Ruby,https://github.com/rapid7/metasploit-framework,rapid7,656,2019-02-01T22:46:54Z,Metasploit Framework
15,Ruby,engineering-blogs,14742,1699,Ruby,https://github.com/kilimchoi/engineering-blogs,kilimchoi,7,2019-01-25T02:58:59Z,A curated list of engineering blogs
16,Ruby,homebrew-cask,14667,6918,Ruby,https://github.com/Homebrew/homebrew-cask,Homebrew,80,2019-02-02T03:23:48Z,🍻 A CLI workflow for the administration of macOS applications distributed as binaries
17,Ruby,bootstrap-sass,12725,3480,Ruby,https://github.com/twbs/bootstrap-sass,twbs,2,2019-02-01T08:57:39Z,Official Sass port of Bootstrap 2 and 3.
18,Ruby,diaspora,12144,2917,Ruby,https://github.com/diaspora/diaspora,diaspora,444,2019-01-21T22:13:58Z,"A privacy-aware, distributed, open source social network."
19,Ruby,sass,11693,1936,Ruby,https://github.com/sass/sass,sass,85,2018-12-08T07:24:55Z,Sass makes CSS fun again.
