rank,item,repo_name,stars,forks,language,repo_url,username,issues,last_commit,description
1,top-100-stars,996.ICU,206929,16819,Rust,https://github.com/996icu/996.ICU,996icu,16684,2019-04-11T03:44:52Z,Repo for counting stars and contributing. Press F to pay respect to glorious developers.
2,top-100-stars,vue,135176,19192,JavaScript,https://github.com/vuejs/vue,vuejs,257,2019-04-11T01:00:59Z,"🖖 Vue.js is a progressive, incrementally-adoptable JavaScript framework for building UI on the web."
3,top-100-stars,react,126764,23050,JavaScript,https://github.com/facebook/react,facebook,646,2019-04-11T00:16:28Z,"A declarative, efficient, and flexible JavaScript library for building user interfaces."
4,top-100-stars,tensorflow,125209,73655,C++,https://github.com/tensorflow/tensorflow,tensorflow,2435,2019-04-11T03:56:13Z,An Open Source Machine Learning Framework for Everyone
5,top-100-stars,awesome,106242,13959,,https://github.com/sindresorhus/awesome,sindresorhus,61,2019-04-08T13:29:30Z,😎 Awesome lists about all kinds of interesting topics
6,top-100-stars,oh-my-zsh,86250,16392,Shell,https://github.com/robbyrussell/oh-my-zsh,robbyrussell,755,2019-04-10T22:07:09Z,"A delightful community-driven (with 1,300+ contributors) framework for managing your zsh configuration. Includes 200+ optional plugins (rails, git, OSX, hub, capistrano, brew, ant, php, python, etc), over 140 themes to spice up your morning, and an auto-update tool so that makes it easy to keep up with the latest updates from the community."
7,top-100-stars,javascript,83866,16033,JavaScript,https://github.com/airbnb/javascript,airbnb,136,2019-04-10T08:23:13Z,JavaScript Style Guide
8,top-100-stars,d3,83858,20621,JavaScript,https://github.com/d3/d3,d3,7,2019-03-14T16:14:52Z,"Bring data to life with SVG, Canvas and HTML. :bar_chart::chart_with_upwards_trend::tada:"
9,top-100-stars,gitignore,82011,39603,,https://github.com/github/gitignore,github,92,2019-04-11T02:43:51Z,A collection of useful .gitignore templates
10,top-100-stars,react-native,75946,16933,JavaScript,https://github.com/facebook/react-native,facebook,452,2019-04-11T01:44:24Z,A framework for building native apps with React.
11,top-100-stars,linux,72749,25680,C,https://github.com/torvalds/linux,torvalds,262,2019-04-10T19:51:07Z,Linux kernel source tree
12,top-100-stars,electron,72032,9373,C++,https://github.com/electron/electron,electron,1258,2019-04-10T23:51:21Z,":electron: Build cross-platform desktop apps with JavaScript, HTML, and CSS"
13,top-100-stars,create-react-app,66096,14736,JavaScript,https://github.com/facebook/create-react-app,facebook,338,2019-04-10T19:44:19Z,Set up a modern web app by running one command.
14,top-100-stars,awesome-python,65591,12639,Python,https://github.com/vinta/awesome-python,vinta,487,2019-04-10T21:04:08Z,"A curated list of awesome Python frameworks, libraries, software and resources"
15,top-100-stars,system-design-primer,61170,9076,Python,https://github.com/donnemartin/system-design-primer,donnemartin,76,2019-04-10T00:47:01Z,Learn how to design large-scale systems. Prep for the system design interview.  Includes Anki flashcards.
16,top-100-stars,node,60016,13356,JavaScript,https://github.com/nodejs/node,nodejs,844,2019-04-11T04:00:15Z,Node.js JavaScript runtime :sparkles::turtle::rocket::sparkles:
17,top-100-stars,flutter,59698,6543,Dart,https://github.com/flutter/flutter,flutter,5104,2019-04-11T03:53:25Z,Flutter makes it easy and fast to build beautiful mobile apps.
18,top-100-stars,angular.js,59481,28918,JavaScript,https://github.com/angular/angular.js,angular,460,2019-04-09T22:35:49Z,AngularJS - HTML enhanced for web apps!
19,top-100-stars,animate.css,58717,12458,CSS,https://github.com/daneden/animate.css,daneden,19,2019-04-03T10:25:56Z,🍿 A cross-browser library of CSS animations. As easy to use as an easy thing.
20,top-100-stars,CS-Notes,57394,17450,,https://github.com/CyC2018/CS-Notes,CyC2018,32,2019-04-08T12:09:35Z,:books:  技术面试必备基础知识
21,top-100-stars,go,56127,7650,Go,https://github.com/golang/go,golang,4468,2019-04-10T22:48:52Z,The Go programming language
22,top-100-stars,public-apis,55538,5697,Python,https://github.com/toddmotto/public-apis,toddmotto,48,2019-04-06T04:27:41Z,A collective list of free APIs for use in software and web development.
23,top-100-stars,moby,52873,15288,Go,https://github.com/moby/moby,moby,3654,2019-04-11T00:52:16Z,Moby Project - a collaborative project for the container ecosystem to assemble container-based systems
24,top-100-stars,laravel,51463,15679,PHP,https://github.com/laravel/laravel,laravel,27,2019-04-10T12:31:31Z,A PHP framework for web artisans
25,top-100-stars,jquery,51289,17973,JavaScript,https://github.com/jquery/jquery,jquery,80,2019-04-10T19:57:52Z,jQuery JavaScript Library
26,top-100-stars,models,51087,31372,Python,https://github.com/tensorflow/models,tensorflow,1549,2019-04-11T03:50:30Z,Models and examples built with TensorFlow
27,top-100-stars,kubernetes,50955,17600,Go,https://github.com/kubernetes/kubernetes,kubernetes,3157,2019-04-11T03:55:55Z,Production-Grade Container Scheduling and Management
28,top-100-stars,three.js,50432,18926,JavaScript,https://github.com/mrdoob/three.js,mrdoob,864,2019-04-11T03:19:12Z,JavaScript 3D library.
29,top-100-stars,atom,48338,11414,JavaScript,https://github.com/atom/atom,atom,709,2019-04-10T23:06:53Z,:atom: The hackable text editor
30,top-100-stars,free-programming-books-zh_CN,48277,15896,,https://github.com/justjavac/free-programming-books-zh_CN,justjavac,156,2019-03-28T10:44:57Z,:books: 免费的计算机编程类中文书籍，欢迎投稿
31,top-100-stars,redux,47968,12250,JavaScript,https://github.com/reduxjs/redux,reduxjs,30,2019-04-10T20:17:17Z,Predictable state container for JavaScript apps
32,top-100-stars,puppeteer,47800,4252,JavaScript,https://github.com/GoogleChrome/puppeteer,GoogleChrome,335,2019-04-11T02:12:56Z,Headless Chrome Node API
33,top-100-stars,TypeScript,47513,6625,TypeScript,https://github.com/Microsoft/TypeScript,Microsoft,3706,2019-04-11T03:50:50Z,TypeScript is a superset of JavaScript that compiles to clean JavaScript output.
34,top-100-stars,javascript-algorithms,47494,6640,JavaScript,https://github.com/trekhleb/javascript-algorithms,trekhleb,84,2019-04-07T01:55:07Z,📝 Algorithms and data structures implemented in JavaScript with explanations and links to further readings
35,top-100-stars,swift,47332,7497,C++,https://github.com/apple/swift,apple,528,2019-04-11T03:30:10Z,The Swift Programming Language
36,top-100-stars,angular,46990,12470,TypeScript,https://github.com/angular/angular,angular,2700,2019-04-11T00:15:43Z,One framework. Mobile & desktop.
37,top-100-stars,java-design-patterns,46489,15011,Java,https://github.com/iluwatar/java-design-patterns,iluwatar,194,2019-04-08T10:37:25Z,Design patterns implemented in Java
38,top-100-stars,material-ui,45911,9784,JavaScript,https://github.com/mui-org/material-ui,mui-org,301,2019-04-11T00:56:54Z,"React components for faster and easier web development. Build your own design system, or start with Material Design."
39,top-100-stars,socket.io,45910,8442,JavaScript,https://github.com/socketio/socket.io,socketio,375,2019-03-30T10:11:39Z,Realtime application framework (Node.JS server)
40,top-100-stars,reveal.js,45647,13179,JavaScript,https://github.com/hakimel/reveal.js,hakimel,426,2019-04-10T08:09:46Z,The HTML Presentation Framework
41,top-100-stars,Semantic-UI,45060,4772,JavaScript,https://github.com/Semantic-Org/Semantic-UI,Semantic-Org,868,2019-04-02T15:32:27Z,Semantic is a UI component framework based around useful principles from natural language.
42,top-100-stars,ant-design,44963,15692,TypeScript,https://github.com/ant-design/ant-design,ant-design,333,2019-04-11T03:59:51Z,🌈 A UI Design Language
43,top-100-stars,awesome-vue,44209,6118,,https://github.com/vuejs/awesome-vue,vuejs,100,2019-04-10T17:45:34Z,🎉 A curated list of awesome things related to Vue.js
44,top-100-stars,build-your-own-x,43920,2891,,https://github.com/danistefanovic/build-your-own-x,danistefanovic,23,2019-03-28T09:30:03Z,🤓 Build your own (insert technology here)
45,top-100-stars,express,43260,7341,JavaScript,https://github.com/expressjs/express,expressjs,180,2019-04-05T01:35:48Z,"Fast, unopinionated, minimalist web framework for node."
46,top-100-stars,flask,43246,12182,Python,https://github.com/pallets/flask,pallets,59,2019-04-08T21:26:52Z,The Python micro framework for building web applications.
47,top-100-stars,Chart.js,42862,9480,JavaScript,https://github.com/chartjs/Chart.js,chartjs,456,2019-04-08T07:43:13Z,Simple HTML5 Charts using the <canvas> tag
48,top-100-stars,rails,42761,17228,Ruby,https://github.com/rails/rails,rails,1141,2019-04-11T01:42:54Z,Ruby on Rails
49,top-100-stars,thefuck,42624,2123,Python,https://github.com/nvbn/thefuck,nvbn,152,2019-04-10T14:58:42Z,Magnificent app which corrects your previous console command.
50,top-100-stars,html5-boilerplate,42593,10093,JavaScript,https://github.com/h5bp/html5-boilerplate,h5bp,1,2019-04-11T01:34:11Z,"A professional front-end template for building fast, robust, and adaptable web apps or sites."
51,top-100-stars,30-seconds-of-code,42528,4687,JavaScript,https://github.com/30-seconds/30-seconds-of-code,30-seconds,7,2019-04-10T07:41:12Z,A curated collection of useful JavaScript snippets that you can understand in 30 seconds or less.
52,top-100-stars,awesome-go,42363,5501,Go,https://github.com/avelino/awesome-go,avelino,24,2019-04-10T15:05:42Z,"A curated list of awesome Go frameworks, libraries and software"
53,top-100-stars,lantern,41260,9041,Go,https://github.com/getlantern/lantern,getlantern,2543,2019-04-07T03:13:53Z,🔴蓝灯最新版本下载 https://github.com/getlantern/download 🔴 Lantern Latest Download https://github.com/getlantern/download 🔴
54,top-100-stars,meteor,40950,5031,JavaScript,https://github.com/meteor/meteor,meteor,300,2019-04-11T02:13:33Z,"Meteor, the JavaScript App Platform"
55,top-100-stars,moment,40781,6106,JavaScript,https://github.com/moment/moment,moment,314,2019-04-10T17:03:03Z,"Parse, validate, manipulate, and display dates in javascript."
56,top-100-stars,django,40743,17501,Python,https://github.com/django/django,django,203,2019-04-10T23:48:15Z,The Web framework for perfectionists with deadlines.
57,top-100-stars,resume.github.com,40232,1059,JavaScript,https://github.com/resume/resume.github.com,resume,36,2018-12-29T23:17:05Z,Resumes generated using the GitHub informations
58,top-100-stars,Front-end-Developer-Interview-Questions,40203,8134,HTML,https://github.com/h5bp/Front-end-Developer-Interview-Questions,h5bp,8,2019-04-10T21:22:05Z,"A list of helpful front-end related questions you can use to interview potential candidates, test yourself or completely ignore."
59,top-100-stars,keras,39989,15204,Python,https://github.com/keras-team/keras,keras-team,2306,2019-04-09T17:25:28Z,Deep Learning for humans
60,top-100-stars,elasticsearch,39986,13336,Java,https://github.com/elastic/elasticsearch,elastic,1926,2019-04-11T03:21:19Z,"Open Source, Distributed, RESTful Search Engine"
61,top-100-stars,json-server,39480,3459,JavaScript,https://github.com/typicode/json-server,typicode,424,2019-03-26T12:22:05Z,Get a full fake REST API with zero coding in less than 30 seconds (seriously)
62,top-100-stars,awesome-machine-learning,39156,9704,Python,https://github.com/josephmisiti/awesome-machine-learning,josephmisiti,1,2019-04-10T18:09:27Z,"A curated list of awesome Machine Learning frameworks, libraries and software."
63,top-100-stars,lodash,38475,3984,JavaScript,https://github.com/lodash/lodash,lodash,13,2019-04-08T08:42:46Z,"A modern JavaScript utility library delivering modularity, performance, & extras."
64,top-100-stars,RxJava,38430,6502,Java,https://github.com/ReactiveX/RxJava,ReactiveX,32,2019-04-10T21:27:25Z,RxJava – Reactive Extensions for the JVM – a library for composing asynchronous and event-based programs using observable sequences for the Java VM.
65,top-100-stars,requests,38054,6944,Python,https://github.com/kennethreitz/requests,kennethreitz,198,2019-04-08T16:13:00Z,Python HTTP Requests for Humans™ ✨🍰✨
66,top-100-stars,bitcoin,37864,22447,C++,https://github.com/bitcoin/bitcoin,bitcoin,957,2019-04-11T01:01:08Z,Bitcoin Core integration/staging tree
67,top-100-stars,ionic,37654,12971,TypeScript,https://github.com/ionic-team/ionic,ionic-team,519,2019-04-11T01:50:49Z,Build amazing native and progressive web apps with open web technologies. One app running on everything 🎉
68,top-100-stars,material-design-icons,37653,7620,CSS,https://github.com/google/material-design-icons,google,544,2019-02-24T01:25:22Z,Material Design icons by Google
69,top-100-stars,jekyll,37352,8130,Ruby,https://github.com/jekyll/jekyll,jekyll,138,2019-04-11T02:34:39Z,:globe_with_meridians: Jekyll is a blog-aware static site generator in Ruby
70,top-100-stars,netdata,37244,3238,C,https://github.com/netdata/netdata,netdata,547,2019-04-09T21:57:26Z,"Real-time performance monitoring, done right! https://my-netdata.io/"
71,top-100-stars,every-programmer-should-know,37191,3393,,https://github.com/mtdvio/every-programmer-should-know,mtdvio,27,2019-03-02T09:51:05Z,A collection of (mostly) technical things every software developer should know
72,top-100-stars,markdown-here,37043,6298,JavaScript,https://github.com/adam-p/markdown-here,adam-p,233,2019-03-20T19:54:09Z,"Google Chrome, Firefox, and Thunderbird extension that lets you write email in Markdown and render it before sending."
73,top-100-stars,element,36601,7355,Vue,https://github.com/ElemeFE/element,ElemeFE,693,2019-04-11T03:48:48Z,A Vue.js 2.0 UI Toolkit for Web
74,top-100-stars,spring-boot,36414,23931,Java,https://github.com/spring-projects/spring-boot,spring-projects,410,2019-04-10T23:34:28Z,Spring Boot
75,top-100-stars,next.js,36411,4201,JavaScript,https://github.com/zeit/next.js,zeit,198,2019-04-11T03:50:48Z,The React Framework
76,top-100-stars,storybook,36287,2869,JavaScript,https://github.com/storybooks/storybook,storybooks,365,2019-04-10T22:00:21Z,"UI component dev & test: React, Vue, Angular, React Native, Ember & more!"
77,top-100-stars,react-router,35742,7337,JavaScript,https://github.com/ReactTraining/react-router,ReactTraining,62,2019-04-09T23:49:53Z,Declarative routing for React
78,top-100-stars,shadowsocks-windows,35645,12141,C#,https://github.com/shadowsocks/shadowsocks-windows,shadowsocks,138,2019-04-09T10:31:14Z,"If you want to keep a secret, you must also hide it from yourself."
79,top-100-stars,redis,35559,13597,C,https://github.com/antirez/redis,antirez,2169,2019-04-10T16:55:17Z,"Redis is an in-memory database that persists on disk. The data model is key-value, but many different kind of values are supported: Strings, Lists, Sets, Sorted Sets, Hashes, HyperLogLogs, Bitmaps."
80,top-100-stars,materialize,35499,4748,JavaScript,https://github.com/Dogfalo/materialize,Dogfalo,637,2019-04-08T18:44:43Z,"Materialize, a CSS Framework based on Material Design"
81,top-100-stars,yarn,35359,2122,JavaScript,https://github.com/yarnpkg/yarn,yarnpkg,1771,2019-04-11T00:51:14Z,"📦🐈 Fast, reliable, and secure dependency management."
82,top-100-stars,rust,35255,5627,Rust,https://github.com/rust-lang/rust,rust-lang,4824,2019-04-11T03:50:01Z,Empowering everyone to build reliable and efficient software.
83,top-100-stars,nw.js,35245,3787,C++,https://github.com/nwjs/nw.js,nwjs,744,2019-04-11T01:41:38Z,Call all Node.js modules directly from DOM/WebWorker and enable a new way of writing applications with all Web technologies.
84,top-100-stars,impress.js,34672,6809,JavaScript,https://github.com/impress/impress.js,impress,51,2019-04-10T07:21:34Z,It's a presentation framework based on the power of CSS3 transforms and transitions in modern browsers and inspired by the idea behind prezi.com.
85,top-100-stars,normalize.css,34614,7018,CSS,https://github.com/necolas/normalize.css,necolas,21,2019-03-27T06:24:27Z,A modern alternative to CSS resets
86,top-100-stars,JavaGuide,34603,10666,Java,https://github.com/Snailclimb/JavaGuide,Snailclimb,21,2019-04-10T11:53:40Z,【Java学习+面试指南】 一份涵盖大部分Java程序员所需要掌握的核心知识。
87,top-100-stars,scikit-learn,34394,16835,Python,https://github.com/scikit-learn/scikit-learn,scikit-learn,1920,2019-04-11T02:52:05Z,scikit-learn: machine learning in Python
88,top-100-stars,papers-we-love,34125,3212,,https://github.com/papers-we-love/papers-we-love,papers-we-love,12,2019-04-05T00:26:26Z,Papers from the computer science community to read and discuss.
89,top-100-stars,Front-End-Checklist,34122,3243,JavaScript,https://github.com/thedaviddias/Front-End-Checklist,thedaviddias,4,2019-03-23T11:57:06Z,🗂 The perfect Front-End Checklist for modern websites and meticulous developers
90,top-100-stars,bulma,34119,2715,CSS,https://github.com/jgthms/bulma,jgthms,296,2019-04-07T18:20:53Z,Modern CSS framework based on Flexbox
91,top-100-stars,nvm,33984,3204,Shell,https://github.com/creationix/nvm,creationix,276,2019-03-24T18:55:57Z,Node Version Manager - Simple bash script to manage multiple active node.js versions
92,top-100-stars,gatsby,33659,4698,JavaScript,https://github.com/gatsbyjs/gatsby,gatsbyjs,517,2019-04-10T22:58:59Z,"Build blazing fast, modern apps and websites with React"
93,top-100-stars,opencv,33578,24246,C++,https://github.com/opencv/opencv,opencv,1684,2019-04-11T03:11:28Z,Open Source Computer Vision Library
94,top-100-stars,incubator-echarts,33433,9725,JavaScript,https://github.com/apache/incubator-echarts,apache,3240,2019-04-11T01:37:41Z,"A powerful, interactive charting and visualization library for browser"
95,top-100-stars,protobuf,33369,9091,C++,https://github.com/protocolbuffers/protobuf,protocolbuffers,617,2019-04-10T22:07:05Z,Protocol Buffers - Google's data interchange format
96,top-100-stars,freecodecamp.cn,32956,1218,CSS,https://github.com/FreeCodeCampChina/freecodecamp.cn,FreeCodeCampChina,111,2018-10-24T10:40:34Z,The FreeCodeCamp.cn(FCC China) open source codebase and curriculum. Learn to code and help nonprofits.
97,top-100-stars,deno,32864,1558,TypeScript,https://github.com/denoland/deno,denoland,207,2019-04-11T00:32:36Z,"A secure JavaScript/TypeScript runtime built with V8, Rust, and Tokio"
98,top-100-stars,scrapy,32283,7632,Python,https://github.com/scrapy/scrapy,scrapy,786,2019-04-10T20:43:04Z,"Scrapy, a fast high-level web crawling & scraping framework for Python."
99,top-100-stars,awesome-public-datasets,32200,5436,,https://github.com/awesomedata/awesome-public-datasets,awesomedata,90,2019-04-09T15:42:40Z,A topic-centric list of HQ open datasets. PR ☛☛☛
100,top-100-stars,android-architecture,32156,9014,,https://github.com/googlesamples/android-architecture,googlesamples,125,2019-04-03T18:45:44Z,A collection of samples to discuss and showcase different architectural tools and patterns for Android apps.
1,top-100-forks,datasharing,4686,194098,,https://github.com/jtleek/datasharing,jtleek,446,2019-01-22T19:51:28Z,The Leek group guide to data sharing 
2,top-100-forks,ProgrammingAssignment2,592,116140,R,https://github.com/rdpeng/ProgrammingAssignment2,rdpeng,2716,2019-04-10T16:20:01Z,Repository for Programming Assignment 2 for R Programming on Coursera
3,top-100-forks,Spoon-Knife,10113,103391,HTML,https://github.com/octocat/Spoon-Knife,octocat,13399,2019-04-11T00:26:49Z,This repo is for demonstration purposes only.
4,top-100-forks,tensorflow,125209,73655,C++,https://github.com/tensorflow/tensorflow,tensorflow,2435,2019-04-11T03:56:13Z,An Open Source Machine Learning Framework for Everyone
5,top-100-forks,bootstrap,132430,64767,JavaScript,https://github.com/twbs/bootstrap,twbs,381,2019-04-10T13:10:08Z,"The most popular HTML, CSS, and JavaScript framework for developing responsive, mobile first projects on the web."
6,top-100-forks,SmartThingsPublic,1246,53968,Groovy,https://github.com/SmartThingsCommunity/SmartThingsPublic,SmartThingsCommunity,1179,2019-04-11T02:24:11Z,SmartThings open-source DeviceTypeHandlers and SmartApps code
7,top-100-forks,ExData_Plotting1,169,49416,,https://github.com/rdpeng/ExData_Plotting1,rdpeng,609,2019-04-02T13:41:16Z,Plotting Assignment 1 for Exploratory Data Analysis
8,top-100-forks,gitignore,82011,39603,,https://github.com/github/gitignore,github,92,2019-04-11T02:43:51Z,A collection of useful .gitignore templates
9,top-100-forks,RepData_PeerAssessment1,85,31593,,https://github.com/rdpeng/RepData_PeerAssessment1,rdpeng,266,2019-01-30T08:47:00Z,Peer Assessment 1 for Reproducible Research
10,top-100-forks,models,51087,31372,Python,https://github.com/tensorflow/models,tensorflow,1549,2019-04-11T03:50:30Z,Models and examples built with TensorFlow
11,top-100-forks,free-programming-books,121211,30197,,https://github.com/EbookFoundation/free-programming-books,EbookFoundation,27,2019-04-10T13:16:42Z,:books: Freely available programming books
12,top-100-forks,angular.js,59481,28918,JavaScript,https://github.com/angular/angular.js,angular,460,2019-04-09T22:35:49Z,AngularJS - HTML enhanced for web apps!
13,top-100-forks,courses,3175,27478,HTML,https://github.com/DataScienceSpecialization/courses,DataScienceSpecialization,93,2019-02-22T08:01:12Z,Course materials for the Data Science Specialization: https://www.coursera.org/specialization/jhudatascience/1
14,top-100-forks,cgm-remote-monitor,719,26017,JavaScript,https://github.com/nightscout/cgm-remote-monitor,nightscout,209,2019-04-10T20:49:36Z,nightscout web monitor
15,top-100-forks,linux,72749,25680,C,https://github.com/torvalds/linux,torvalds,262,2019-04-10T19:51:07Z,Linux kernel source tree
16,top-100-forks,frontend-nanodegree-resume,1034,24816,JavaScript,https://github.com/udacity/frontend-nanodegree-resume,udacity,0,2018-11-27T21:09:19Z,This repository is used for one of the projects in Udacity's Front-End Web Developer Nanodegree program. Learn how to become a Front-End Developer today with line-by-line code reviewed projects and get a job with career services!
17,top-100-forks,opencv,33578,24246,C++,https://github.com/opencv/opencv,opencv,1684,2019-04-11T03:11:28Z,Open Source Computer Vision Library
18,top-100-forks,jekyll-now,5890,23944,CSS,https://github.com/barryclark/jekyll-now,barryclark,201,2019-04-10T14:56:58Z,"Build a Jekyll blog in minutes, without touching the command line."
19,top-100-forks,spring-boot,36414,23931,Java,https://github.com/spring-projects/spring-boot,spring-projects,410,2019-04-10T23:34:28Z,Spring Boot
20,top-100-forks,patchwork,864,23499,HTML,https://github.com/jlord/patchwork,jlord,699,2019-04-11T03:53:43Z,All the Git-it Workshop completers! 
21,top-100-forks,react,126764,23050,JavaScript,https://github.com/facebook/react,facebook,646,2019-04-11T00:16:28Z,"A declarative, efficient, and flexible JavaScript library for building user interfaces."
22,top-100-forks,recipes,62,22529,,https://github.com/LarryMad/recipes,LarryMad,2175,2019-04-11T02:39:53Z,
23,top-100-forks,bitcoin,37864,22447,C++,https://github.com/bitcoin/bitcoin,bitcoin,957,2019-04-11T01:01:08Z,Bitcoin Core integration/staging tree
24,top-100-forks,coding-interview-university,76286,22342,,https://github.com/jwasham/coding-interview-university,jwasham,61,2019-04-09T02:28:35Z,A complete computer science study plan to become a software engineer.
25,top-100-forks,freeCodeCamp,301203,21506,JavaScript,https://github.com/freeCodeCamp/freeCodeCamp,freeCodeCamp,2710,2019-04-11T02:59:28Z,The https://www.freeCodeCamp.org open source codebase and curriculum. Learn to code for free together with millions of people.
26,top-100-forks,d3,83858,20621,JavaScript,https://github.com/d3/d3,d3,7,2019-03-14T16:14:52Z,"Bring data to life with SVG, Canvas and HTML. :bar_chart::chart_with_upwards_trend::tada:"
27,top-100-forks,You-Dont-Know-JS,99775,19558,,https://github.com/getify/You-Dont-Know-JS,getify,243,2019-04-08T09:35:44Z,A book series on JavaScript. @YDKJS on twitter.
28,top-100-forks,tutorials,13264,19307,Java,https://github.com/eugenp/tutorials,eugenp,55,2019-04-10T22:07:59Z,"The ""REST With Spring"" Course: "
29,top-100-forks,vue,135176,19192,JavaScript,https://github.com/vuejs/vue,vuejs,257,2019-04-11T01:00:59Z,"🖖 Vue.js is a progressive, incrementally-adoptable JavaScript framework for building UI on the web."
30,top-100-forks,three.js,50432,18926,JavaScript,https://github.com/mrdoob/three.js,mrdoob,864,2019-04-11T03:19:12Z,JavaScript 3D library.
31,top-100-forks,spark,21325,18560,Scala,https://github.com/apache/spark,apache,433,2019-04-11T03:53:21Z,Apache Spark
32,top-100-forks,jquery,51289,17973,JavaScript,https://github.com/jquery/jquery,jquery,80,2019-04-10T19:57:52Z,jQuery JavaScript Library
33,top-100-forks,spring-framework,28072,17934,Java,https://github.com/spring-projects/spring-framework,spring-projects,885,2019-04-10T20:09:51Z,Spring Framework
34,top-100-forks,shadowsocks,29462,17896,Python,https://github.com/shadowsocks/shadowsocks,shadowsocks,429,2019-02-05T16:38:13Z,
35,top-100-forks,kubernetes,50955,17600,Go,https://github.com/kubernetes/kubernetes,kubernetes,3157,2019-04-11T03:55:55Z,Production-Grade Container Scheduling and Management
36,top-100-forks,django,40743,17501,Python,https://github.com/django/django,django,203,2019-04-10T23:48:15Z,The Web framework for perfectionists with deadlines.
37,top-100-forks,CS-Notes,57394,17450,,https://github.com/CyC2018/CS-Notes,CyC2018,32,2019-04-08T12:09:35Z,:books:  技术面试必备基础知识
38,top-100-forks,rails,42761,17228,Ruby,https://github.com/rails/rails,rails,1141,2019-04-11T01:42:54Z,Ruby on Rails
39,top-100-forks,DefinitelyTyped,21484,17118,TypeScript,https://github.com/DefinitelyTyped/DefinitelyTyped,DefinitelyTyped,2781,2019-04-11T03:53:40Z,The repository for high quality TypeScript type definitions.
