rank,item,repo_name,stars,forks,language,repo_url,username,issues,last_commit,description
95,Clojure,lt-cljs-tutorial,859,128,Clojure,https://github.com/swannodette/lt-cljs-tutorial,swannodette,10,2015-10-08T07:16:26Z,A ClojureScript Programming Language Tutorial for Light Table Users
96,Clojure,duct,848,45,Clojure,https://github.com/duct-framework/duct,duct-framework,6,2019-06-26T18:17:39Z,Server-side application framework for Clojure
97,Clojure,amazonica,828,180,Clojure,https://github.com/mcohen01/amazonica,mcohen01,29,2019-08-28T04:02:57Z,A comprehensive Clojure client for the entire Amazon AWS api.
98,Clojure,pallet,804,122,Clojure,https://github.com/pallet/pallet,pallet,126,2018-05-25T15:44:26Z,Automates controlling and provisioning cloud server instances. DevOps for the JVM.
99,Clojure,Nightlight,782,36,Clojure,https://github.com/oakes/Nightlight,oakes,12,2019-08-02T22:58:03Z,An embedded editor for Clojure
100,Clojure,environ,780,63,Clojure,https://github.com/weavejester/environ,weavejester,14,2019-01-10T12:38:44Z,Library for managing environment variables in Clojure
1,CoffeeScript,coffeescript,15293,2003,CoffeeScript,https://github.com/jashkenas/coffeescript,jashkenas,42,2019-08-24T08:10:09Z,Unfancy JavaScript
2,CoffeeScript,cypress,14458,770,CoffeeScript,https://github.com/cypress-io/cypress,cypress-io,1077,2019-09-05T20:57:07Z,"Fast, easy and reliable testing for anything that runs in a browser."
3,CoffeeScript,trix,13949,661,CoffeeScript,https://github.com/basecamp/trix,basecamp,26,2019-09-05T11:53:50Z,A rich text editor for everyday writing
4,CoffeeScript,SwitchyOmega,13271,2230,CoffeeScript,https://github.com/FelisCatus/SwitchyOmega,FelisCatus,250,2019-07-12T09:00:54Z,Manage and switch between multiple proxies quickly & easily.
5,CoffeeScript,vimium,11430,1380,CoffeeScript,https://github.com/philc/vimium,philc,673,2019-08-22T06:59:07Z,The hacker's browser.
6,CoffeeScript,zxcvbn,10500,678,CoffeeScript,https://github.com/dropbox/zxcvbn,dropbox,89,2019-08-06T08:27:30Z,Low-Budget Password Strength Estimation
7,CoffeeScript,marp,8080,452,CoffeeScript,https://github.com/yhatt/marp,yhatt,98,2019-08-21T23:45:58Z,"[Deprecated] Markdown presentation writer, powered by Electron."
8,CoffeeScript,dynamics.js,7181,397,CoffeeScript,https://github.com/michaelvillar/dynamics.js,michaelvillar,10,2019-02-26T06:19:21Z,Javascript library to create physics-based animations
9,CoffeeScript,morris.js,6938,1268,CoffeeScript,https://github.com/morrisjs/morris.js,morrisjs,320,2019-08-10T03:04:54Z,Pretty time-series line graphs
10,CoffeeScript,codecombat,6869,3506,CoffeeScript,https://github.com/codecombat/codecombat,codecombat,410,2019-09-06T10:14:59Z,Game for learning how to code.
11,CoffeeScript,chinese-copywriting-guidelines,6124,1006,CoffeeScript,https://github.com/sparanoid/chinese-copywriting-guidelines,sparanoid,7,2019-08-24T07:36:38Z,Chinese copywriting guidelines for better written communication／中文文案排版指北
12,CoffeeScript,overleaf,5597,711,CoffeeScript,https://github.com/overleaf/overleaf,overleaf,191,2019-09-06T08:47:20Z,A web-based collaborative LaTeX editor
13,CoffeeScript,At.js,5179,686,CoffeeScript,https://github.com/ichord/At.js,ichord,154,2019-02-19T10:21:06Z,Add Github like mentions autocomplete to your application.
14,CoffeeScript,vibrant.js,4424,211,CoffeeScript,https://github.com/jariz/vibrant.js,jariz,2,2017-11-28T15:50:23Z,Extract prominent colors from an image. JS port of Android's Palette.
15,CoffeeScript,aglio,4327,475,CoffeeScript,https://github.com/danielgtaylor/aglio,danielgtaylor,138,2019-05-13T14:40:13Z,An API Blueprint renderer with theme support that outputs static HTML
16,CoffeeScript,bootstrap-tour,4289,909,CoffeeScript,https://github.com/sorich87/bootstrap-tour,sorich87,173,2019-07-02T19:56:41Z,Quick and easy product tours with Twitter Bootstrap Popovers
17,CoffeeScript,Log.io,4020,636,CoffeeScript,https://github.com/NarrativeScience/Log.io,NarrativeScience,88,2016-03-08T02:11:04Z,Real-time log monitoring in your browser
18,CoffeeScript,node-xml2js,3749,453,CoffeeScript,https://github.com/Leonidas-from-XIV/node-xml2js,Leonidas-from-XIV,151,2019-09-03T19:10:12Z,XML to JavaScript object converter.
19,CoffeeScript,yakyak,3689,332,CoffeeScript,https://github.com/yakyak/yakyak,yakyak,68,2019-09-02T12:28:30Z,Desktop chat client for Google Hangouts
20,CoffeeScript,jquery.payment,3652,711,CoffeeScript,https://github.com/stripe/jquery.payment,stripe,0,2017-08-02T14:10:57Z,"[DEPRECATED] A general purpose library for building credit card forms, validating inputs and formatting numbers.          "
21,CoffeeScript,turbolinks-classic,3599,470,CoffeeScript,https://github.com/turbolinks/turbolinks-classic,turbolinks,45,2017-12-06T23:33:26Z,Classic version of Turbolinks. Now deprecated in favor of Turbolinks 5.
22,CoffeeScript,activate-power-mode,3562,435,CoffeeScript,https://github.com/JoelBesada/activate-power-mode,JoelBesada,52,2019-05-24T15:52:02Z,Atom package - Activate POWER MODE to write your code in style.
23,CoffeeScript,hubot-scripts,3518,1986,CoffeeScript,https://github.com/github/hubot-scripts,github,0,2017-07-10T16:06:49Z,"DEPRECATED, see https://github.com/github/hubot-scripts/issues/1113 for details - optional scripts for hubot, opt in via hubot-scripts.json"
24,CoffeeScript,wintersmith,3480,344,CoffeeScript,https://github.com/jnordberg/wintersmith,jnordberg,13,2019-07-21T19:20:37Z,A flexible static site generator
25,CoffeeScript,pow,3467,259,CoffeeScript,https://github.com/basecamp/pow,basecamp,123,2018-04-12T12:15:45Z,Zero-configuration Rack server for Mac OS X
26,CoffeeScript,pivottable,3227,817,CoffeeScript,https://github.com/nicolaskruchten/pivottable,nicolaskruchten,227,2019-05-19T13:09:56Z,"Open-source Javascript Pivot Table (aka Pivot Grid, Pivot Chart, Cross-Tab) implementation with drag'n'drop."
27,CoffeeScript,taiga-front,3210,694,CoffeeScript,https://github.com/taigaio/taiga-front,taigaio,319,2019-08-29T08:02:18Z,Project management web application with scrum in mind! Built on top of Django and AngularJS (Front)
28,CoffeeScript,Keypress,3181,320,CoffeeScript,https://github.com/dmauro/Keypress,dmauro,33,2018-09-27T02:21:46Z,A keyboard input capturing utility in which any key can be a modifier key.
29,CoffeeScript,dispatch-proxy,3076,189,CoffeeScript,https://github.com/alexkirsz/dispatch-proxy,alexkirsz,24,2019-07-13T20:04:51Z,"Combine internet connections, increase your download speed"
30,CoffeeScript,docpad,2996,250,CoffeeScript,https://github.com/docpad/docpad,docpad,23,2019-09-04T00:52:27Z,"Empower your website frontends with layouts, meta-data, pre-processors (markdown, jade, coffeescript, etc.), partials, skeletons, file watching, querying, and an amazing plugin system. DocPad will streamline your web development process allowing you to craft powerful static sites quicker than ever before."
31,CoffeeScript,sticky-kit,2974,560,CoffeeScript,https://github.com/leafo/sticky-kit,leafo,160,2019-07-10T14:57:39Z,A jQuery plugin for creating smart sticky elements
32,CoffeeScript,chaplin,2914,246,CoffeeScript,https://github.com/chaplinjs/chaplin,chaplinjs,46,2019-04-04T21:21:53Z,HTML5 application architecture using Backbone.js
33,CoffeeScript,instafeed.js,2905,722,CoffeeScript,https://github.com/stevenschobert/instafeed.js,stevenschobert,1,2018-09-07T00:26:43Z,A simple Instagram javascript plugin
34,CoffeeScript,noflo,2781,222,CoffeeScript,https://github.com/noflo/noflo,noflo,21,2019-09-03T17:43:04Z,Flow-based programming for JavaScript
35,CoffeeScript,talk-os,2744,847,CoffeeScript,https://github.com/jianliaoim/talk-os,jianliaoim,10,2017-09-05T02:27:58Z,Open source version of jianliao.com
36,CoffeeScript,butterfly,2646,290,CoffeeScript,https://github.com/paradoxxxzero/butterfly,paradoxxxzero,78,2019-07-18T02:11:40Z,A web terminal based on websocket and tornado
37,CoffeeScript,angular-google-maps,2591,1096,CoffeeScript,https://github.com/angular-ui/angular-google-maps,angular-ui,337,2018-11-14T19:00:52Z,AngularJS directives for the Google Maps Javascript API
38,CoffeeScript,pagedraw,2507,286,CoffeeScript,https://github.com/Pagedraw/pagedraw,Pagedraw,8,2019-06-08T18:31:17Z,a UI builder for React web apps
39,CoffeeScript,hallo,2485,346,CoffeeScript,https://github.com/bergie/hallo,bergie,109,2019-09-03T17:37:55Z,Simple rich text editor (contentEditable) for jQuery UI
40,CoffeeScript,cloudtunes,2372,237,CoffeeScript,https://github.com/jakubroztocil/cloudtunes,jakubroztocil,17,2018-03-20T18:40:05Z,"Web-based music player for the cloud :cloud: :notes: Play music from YouTube, Dropbox, etc."
41,CoffeeScript,oriDomi,2352,204,CoffeeScript,https://github.com/dmotz/oriDomi,dmotz,9,2018-07-14T18:10:28Z,Fold up DOM elements like paper
42,CoffeeScript,hubot-slack,2167,624,CoffeeScript,https://github.com/slackapi/hubot-slack,slackapi,40,2019-09-03T01:46:45Z,Slack Developer Kit for Hubot
43,CoffeeScript,QuoJS,2097,261,CoffeeScript,https://github.com/soyjavi/QuoJS,soyjavi,24,2018-09-03T00:16:56Z,Micro #JavaScript Library for Mobile Devices
44,CoffeeScript,js2coffee,2053,209,CoffeeScript,https://github.com/js2coffee/js2coffee,js2coffee,93,2018-02-21T04:17:31Z,Compile JavaScript to CoffeeScript
45,CoffeeScript,shadowsocks-gui,2004,1299,CoffeeScript,https://github.com/shadowsocks/shadowsocks-gui,shadowsocks,2,2018-09-24T04:39:12Z,Shadowsocks GUI client
46,CoffeeScript,CoffeeScriptRedux,1863,118,CoffeeScript,https://github.com/michaelficarra/CoffeeScriptRedux,michaelficarra,104,2017-04-13T04:30:10Z,:sweat: rewrite of the CoffeeScript compiler with proper compiler design principles and a focus on robustness and extensibility
47,CoffeeScript,ng-token-auth,1855,257,CoffeeScript,https://github.com/lynndylanhurley/ng-token-auth,lynndylanhurley,105,2019-01-20T22:26:57Z,Token based authentication module for angular.js.
48,CoffeeScript,BuckyClient,1773,102,CoffeeScript,https://github.com/HubSpot/BuckyClient,HubSpot,20,2016-08-05T20:07:08Z,Collect performance data from the client
49,CoffeeScript,vim-mode,1763,272,CoffeeScript,https://github.com/atom/vim-mode,atom,0,2017-06-15T20:06:24Z,Next generation vim support for atom
50,CoffeeScript,eco,1755,70,CoffeeScript,https://github.com/sstephenson/eco,sstephenson,33,2019-07-02T05:26:52Z,Embedded CoffeeScript templates
51,CoffeeScript,jquery.shapeshift,1699,347,CoffeeScript,https://github.com/AshesOfOwls/jquery.shapeshift,AshesOfOwls,88,2016-12-25T11:01:38Z,A dynamic grid system with drag and drop functionality.
52,CoffeeScript,dnschain,1691,160,CoffeeScript,https://github.com/okTurtles/dnschain,okTurtles,45,2017-04-22T03:52:26Z,"A blockchain-based DNS + HTTP server that fixes HTTPS security, and more!"
53,CoffeeScript,please-wait,1600,160,CoffeeScript,https://github.com/Pathgather/please-wait,Pathgather,4,2016-08-20T10:31:00Z,A simple library to show your users a beautiful splash page while your application loads.
54,CoffeeScript,psd.js,1523,238,CoffeeScript,https://github.com/meltingice/psd.js,meltingice,97,2019-07-03T00:32:57Z,A Photoshop PSD file parser for NodeJS and browsers
55,CoffeeScript,kartograph.js,1519,238,CoffeeScript,https://github.com/kartograph/kartograph.js,kartograph,36,2018-05-12T17:21:09Z,UNMAINTAINED Open source JavaScript renderer for Kartograph SVG maps
56,CoffeeScript,cyclotron,1496,101,CoffeeScript,https://github.com/ExpediaInceCommercePlatform/cyclotron,ExpediaInceCommercePlatform,12,2019-02-27T18:31:25Z,A web platform for constructing dashboards.
57,CoffeeScript,local_time,1483,102,CoffeeScript,https://github.com/basecamp/local_time,basecamp,8,2018-09-30T15:41:10Z,"Rails engine for cache-friendly, client-side local time"
58,CoffeeScript,roots,1477,135,CoffeeScript,https://github.com/jescalan/roots,jescalan,55,2018-02-03T16:40:23Z,a toolkit for rapid advanced front-end development
59,CoffeeScript,squel,1474,209,CoffeeScript,https://github.com/hiddentao/squel,hiddentao,118,2019-08-02T03:23:04Z,:office: SQL query string builder for Javascript
60,CoffeeScript,atom-beautify,1415,438,CoffeeScript,https://github.com/Glavin001/atom-beautify,Glavin001,186,2019-09-03T21:47:11Z,:lipstick: Universal beautification package for Atom editor (:warning: Currently migrating to https://github.com/Unibeautify/ and have very limited bandwidth for Atom-Beautify Issues. Thank you for your patience and understanding :heart: )
61,CoffeeScript,gulp-cheatsheet,1403,88,CoffeeScript,https://github.com/osscafe/gulp-cheatsheet,osscafe,4,2016-08-28T08:20:19Z,A cheatsheet for gulp.js
62,CoffeeScript,caniuse-cmd,1397,46,CoffeeScript,https://github.com/sgentle/caniuse-cmd,sgentle,14,2018-09-19T15:16:06Z,Caniuse command line tool
63,CoffeeScript,dropbox-js,1367,222,CoffeeScript,https://github.com/dropbox/dropbox-js,dropbox,85,2016-10-29T20:22:00Z,Deprecated JS library for API v1. Use our v2 SDK instead:
64,CoffeeScript,VimFx,1363,189,CoffeeScript,https://github.com/akhodakivskiy/VimFx,akhodakivskiy,2,2019-08-15T10:14:03Z,Vim keyboard shortcuts for Firefox
65,CoffeeScript,repl.it,1351,219,CoffeeScript,https://github.com/replit-archive/repl.it,replit-archive,1,2016-04-11T20:47:38Z,https://repl.it/feedback Online REPL for 15+ languages.
66,CoffeeScript,atom-vim-mode-plus,1325,104,CoffeeScript,https://github.com/t9md/atom-vim-mode-plus,t9md,110,2019-08-10T01:23:19Z,vim-mode improved
67,CoffeeScript,atom-simplified-chinese-menu,1315,151,CoffeeScript,https://github.com/chinakids/atom-simplified-chinese-menu,chinakids,24,2018-08-06T02:41:40Z,"Atom 的简体中文汉化扩展,目前最全的汉化包。包含菜单汉化、右键菜单汉化以及设置汉化"
68,CoffeeScript,camo,1298,231,CoffeeScript,https://github.com/atmos/camo,atmos,20,2019-08-16T13:37:02Z,:lock: an http proxy to route images through SSL
69,CoffeeScript,coffeekup,1285,88,CoffeeScript,https://github.com/mauricemach/coffeekup,mauricemach,39,2011-10-26T01:50:57Z,Markup as CoffeeScript.
70,CoffeeScript,pretty-error,1273,40,CoffeeScript,https://github.com/AriaMinaei/pretty-error,AriaMinaei,16,2018-04-14T01:55:57Z,See node.js errors with less clutter
71,CoffeeScript,mondrian,1232,116,CoffeeScript,https://github.com/artursapek/mondrian,artursapek,21,2017-10-30T03:18:15Z,Web-based vector graphics editor
72,CoffeeScript,qqbot,1210,390,CoffeeScript,https://github.com/xhan/qqbot,xhan,24,2016-02-15T03:31:44Z,基于WebQQ协议的QQ机器人。命令行工具，Hubot支持！
73,CoffeeScript,cson,1206,54,CoffeeScript,https://github.com/bevry/cson,bevry,3,2019-06-25T08:05:04Z,CoffeeScript-Object-Notation. Same as JSON but for CoffeeScript objects.
74,CoffeeScript,lineman,1204,88,CoffeeScript,https://github.com/linemanjs/lineman,linemanjs,30,2018-08-29T17:59:10Z,"Lineman helps you build fat-client JavaScript apps. It produces happiness by building assets, mocking servers, running specs on every file change"
75,CoffeeScript,shadowsocks-nodejs,1204,781,CoffeeScript,https://github.com/shadowsocks/shadowsocks-nodejs,shadowsocks,5,2016-08-11T03:01:11Z,
76,CoffeeScript,greenscreen,1189,161,CoffeeScript,https://github.com/groupon/greenscreen,groupon,47,2017-05-17T00:29:05Z,
77,CoffeeScript,apm,1176,275,CoffeeScript,https://github.com/atom/apm,atom,171,2019-08-16T21:13:07Z,Atom Package Manager
78,CoffeeScript,tacofancy,1166,455,CoffeeScript,https://github.com/sinker/tacofancy,sinker,11,2017-11-21T14:48:46Z,community-driven taco repo. stars stars stars.
79,CoffeeScript,angular-masonry,1145,240,CoffeeScript,https://github.com/passy/angular-masonry,passy,54,2017-05-17T15:42:06Z,An AngularJS directive for Masonry.
80,CoffeeScript,aurora.js,1129,133,CoffeeScript,https://github.com/audiocogs/aurora.js,audiocogs,57,2019-04-17T12:19:58Z,JavaScript audio decoding framework
81,CoffeeScript,git-time-machine,1119,48,CoffeeScript,https://github.com/littlebee/git-time-machine,littlebee,42,2018-12-21T00:33:44Z,Atom package that allows you to travel back in commit history
82,CoffeeScript,sync-settings,1115,116,CoffeeScript,https://github.com/atom-community/sync-settings,atom-community,77,2019-01-22T16:09:55Z,Synchronize all your settings and packages across atom instances
83,CoffeeScript,Heyoffline,1112,73,CoffeeScript,https://github.com/oskarkrawczyk/Heyoffline,oskarkrawczyk,3,2017-01-06T08:05:04Z,Warn your users when their network goes down. Make sure they don't lose anything.
84,CoffeeScript,badges,1094,768,CoffeeScript,https://github.com/boennemann/badges,boennemann,12,2019-04-05T16:27:49Z,:flower_playing_cards: Readme Badges – Gotta catch 'em all
85,CoffeeScript,hubble,1093,38,CoffeeScript,https://github.com/jaymedavis/hubble,jaymedavis,0,2018-10-11T01:39:44Z,A dashboard that displays in the terminal
86,CoffeeScript,buckets,1073,170,CoffeeScript,https://github.com/bucketsio/buckets,bucketsio,7,2015-05-31T04:57:37Z,[DEPRECATED] Manage content better.
87,CoffeeScript,stitch,1072,83,CoffeeScript,https://github.com/sstephenson/stitch,sstephenson,32,2012-11-02T14:08:32Z,Stitch your CommonJS modules together for the browser
88,CoffeeScript,pushd,1057,216,CoffeeScript,https://github.com/rs/pushd,rs,60,2019-08-28T15:41:52Z,Blazing fast multi-protocol mobile and web push notification service
89,CoffeeScript,Coffee-Physics,1052,90,CoffeeScript,https://github.com/soulwire/Coffee-Physics,soulwire,8,2016-12-12T17:36:34Z,"A simple, lightweight physics engine written in CoffeeScript"
90,CoffeeScript,node-slug,1044,93,CoffeeScript,https://github.com/dodo/node-slug,dodo,44,2019-04-05T15:49:19Z,slugifies even utf-8 chars!
91,CoffeeScript,jquery.turbolinks,1039,62,CoffeeScript,https://github.com/kossnocorp/jquery.turbolinks,kossnocorp,19,2017-09-03T12:15:16Z,💀 Deprecated ⚠️ jQuery plugin for drop-in fix binded events problem caused by Turbolinks
92,CoffeeScript,coffeelint,1029,178,CoffeeScript,https://github.com/clutchski/coffeelint,clutchski,92,2019-04-09T14:45:10Z,Lint your CoffeeScript.
93,CoffeeScript,octonode,1025,238,CoffeeScript,https://github.com/pksunkara/octonode,pksunkara,26,2019-09-04T04:30:53Z,github api v3 in nodejs
94,CoffeeScript,dploy,1019,90,CoffeeScript,https://github.com/lucasmotta/dploy,lucasmotta,61,2019-02-05T16:21:33Z,⛔️ currently unmaintained ⛔️
95,CoffeeScript,zappa,974,87,CoffeeScript,https://github.com/mauricemach/zappa,mauricemach,34,2011-11-23T00:17:43Z,Node development for the lazy.
96,CoffeeScript,muplayer,957,237,CoffeeScript,https://github.com/Baidu-Music-FE/muplayer,Baidu-Music-FE,14,2019-07-02T05:51:58Z,"An open source web audio player from Baidu Music, support HTML5 and Flash engine on different platforms(百度音乐播放内核)"
97,CoffeeScript,node-neo4j,931,142,CoffeeScript,https://github.com/thingdom/node-neo4j,thingdom,46,2018-11-20T12:02:09Z,[RETIRED] Neo4j graph database driver (REST API client) for Node.js
98,CoffeeScript,literallycanvas,924,274,CoffeeScript,https://github.com/literallycanvas/literallycanvas,literallycanvas,85,2018-10-23T16:47:12Z,A canvas in your browser. Literally.
99,CoffeeScript,pt,896,59,CoffeeScript,https://github.com/williamngan/pt,williamngan,10,2018-02-13T09:06:59Z,"An experimental library on point, form, and space."
100,CoffeeScript,apparatus,873,51,CoffeeScript,https://github.com/cdglabs/apparatus,cdglabs,26,2018-02-06T10:37:56Z,A hybrid graphics editor and programming environment for creating interactive diagrams.
1,CSS,animate.css,61854,13094,CSS,https://github.com/daneden/animate.css,daneden,25,2019-09-02T08:00:48Z,🍿 A cross-browser library of CSS animations. As easy to use as an easy thing.
2,CSS,material-design-icons,38753,7944,CSS,https://github.com/google/material-design-icons,google,564,2019-08-24T11:59:35Z,Material Design icons by Google
3,CSS,bulma,36434,2964,CSS,https://github.com/jgthms/bulma,jgthms,302,2019-09-05T10:23:17Z,Modern CSS framework based on Flexbox
4,CSS,normalize.css,36132,7353,CSS,https://github.com/necolas/normalize.css,necolas,30,2019-08-12T18:09:34Z,A modern alternative to CSS resets
5,CSS,freecodecamp.cn,35761,1358,CSS,https://github.com/FreeCodeCampChina/freecodecamp.cn,FreeCodeCampChina,135,2019-08-20T07:43:38Z,The FreeCodeCamp.cn(FCC China) open source codebase and curriculum. Learn to code and help nonprofits.
6,CSS,weui,23092,5879,CSS,https://github.com/Tencent/weui,Tencent,20,2019-09-05T12:21:43Z,"A UI library by WeChat official design team, includes the most useful widgets/modules in mobile web applications."
7,CSS,Hover,21714,4706,CSS,https://github.com/IanLunn/Hover,IanLunn,30,2019-07-14T02:43:04Z,"A collection of CSS3 powered hover effects to be applied to links, buttons, logos, SVG, featured images and so on. Easily apply to your own elements, modify or just use for inspiration. Available in CSS, Sass, and LESS."
8,CSS,hangzhou_house_knowledge,21146,4566,CSS,https://github.com/houshanren/hangzhou_house_knowledge,houshanren,105,2019-09-02T05:11:44Z,"2017年买房经历总结出来的买房购房知识分享给大家，希望对大家有所帮助。买房不易，且买且珍惜。Sharing the knowledge of buy an own house that according  to the experience at hangzhou in 2017 to all the people. It's not easy to buy a own house, so I hope that it would be useful to everyone."
9,CSS,bootstrap-material-design,19999,3300,CSS,https://github.com/FezVrasta/bootstrap-material-design,FezVrasta,52,2019-08-31T10:34:05Z,Material design theme for Bootstrap 3 and 4
10,CSS,the-swift-programming-language-in-chinese,18811,4981,CSS,https://github.com/SwiftGGTeam/the-swift-programming-language-in-chinese,SwiftGGTeam,2,2019-08-22T16:03:04Z,中文版 Apple 官方 Swift 教程《The Swift Programming Language》
11,CSS,Skeleton,16962,2946,CSS,https://github.com/dhg/Skeleton,dhg,133,2019-07-09T19:25:31Z,"Skeleton: A Dead Simple, Responsive Boilerplate for Mobile-Friendly Development"
12,CSS,nerd-fonts,16387,1030,CSS,https://github.com/ryanoasis/nerd-fonts,ryanoasis,100,2019-09-06T04:34:06Z,"Iconic font aggregator, collection, & patcher. 3,600+ icons, 40+ patched fonts: Hack, Source Code Pro, more. Glyph collections: Font Awesome, Material Design Icons, Octicons, & more"
13,CSS,my-mac-os,15116,629,CSS,https://github.com/nikitavoloboev/my-mac-os,nikitavoloboev,1,2019-08-26T13:12:57Z,List of applications and tools that make my macOS experience even more amazing
14,CSS,source-code-pro,15073,1266,CSS,https://github.com/adobe-fonts/source-code-pro,adobe-fonts,37,2019-09-05T23:52:18Z,Monospaced font family for user interface and coding environments
15,CSS,uikit,14874,2128,CSS,https://github.com/uikit/uikit,uikit,638,2019-09-06T10:18:09Z,A lightweight and modular front-end framework for developing fast and powerful web interfaces
16,CSS,hexo-theme-next,14661,3783,CSS,https://github.com/iissnan/hexo-theme-next,iissnan,60,2019-08-12T04:01:30Z,Elegant theme for Hexo. 
17,CSS,pace,14587,1907,CSS,https://github.com/HubSpot/pace,HubSpot,300,2018-10-29T21:03:14Z,Automatically add a progress bar to your site. #hubspot-open-source
18,CSS,Flat-UI,14530,2451,CSS,https://github.com/designmodo/Flat-UI,designmodo,9,2019-02-13T17:29:09Z,"Flat UI Free - Design Framework (html/css3/less/js). Flat UI is based on Bootstrap, a comfortable, responsive, and functional framework that simplifies the development of websites."
19,CSS,ratchet,14387,1521,CSS,https://github.com/twbs/ratchet,twbs,224,2019-09-05T06:31:48Z,"Build mobile apps with simple HTML, CSS, and JavaScript components. "
20,CSS,tailwindcss,14282,666,CSS,https://github.com/tailwindcss/tailwindcss,tailwindcss,42,2019-09-06T05:39:48Z,A utility-first CSS framework for rapid UI development.
21,CSS,NES.css,13352,1131,CSS,https://github.com/nostalgic-css/NES.css,nostalgic-css,26,2019-07-29T06:01:48Z,NES-style CSS Framework | ファミコン風CSSフレームワーク
22,CSS,tomorrow-theme,12520,3036,CSS,https://github.com/chriskempson/tomorrow-theme,chriskempson,111,2019-06-08T11:18:32Z,Tomorrow Theme now lives on at https://github.com/chriskempson/base16
23,CSS,You-Dont-Need-JavaScript,12173,721,CSS,https://github.com/you-dont-need/You-Dont-Need-JavaScript,you-dont-need,26,2019-04-03T08:48:37Z,"CSS is powerful, you can do a lot of things without JS."
24,CSS,solved-by-flexbox,11874,993,CSS,https://github.com/philipwalton/solved-by-flexbox,philipwalton,20,2019-04-25T19:32:04Z,"A showcase of problems once hard or impossible to solve with CSS alone, now made trivially easy with Flexbox."
25,CSS,Effeckt.css,11187,1507,CSS,https://github.com/h5bp/Effeckt.css,h5bp,0,2019-03-01T16:28:55Z,This repo is archived. Thanks!
26,CSS,hacker101,10677,1264,CSS,https://github.com/Hacker0x01/hacker101,Hacker0x01,24,2019-08-20T16:27:55Z,Hacker101
27,CSS,card,10595,1261,CSS,https://github.com/jessepollak/card,jessepollak,119,2019-07-28T07:49:31Z,:credit_card: make your credit card form better in one line of code
28,CSS,2048,10181,15772,CSS,https://github.com/gabrielecirulli/2048,gabrielecirulli,101,2019-07-17T12:32:20Z,A small clone of 1024 (https://play.google.com/store/apps/details?id=com.veewo.a1024)
29,CSS,spectre,9570,675,CSS,https://github.com/picturepan2/spectre,picturepan2,153,2019-08-09T11:48:08Z,"Spectre.css - A Lightweight, Responsive and Modern CSS Framework"
30,CSS,loaders.css,9317,1153,CSS,https://github.com/ConnorAtherton/loaders.css,ConnorAtherton,10,2018-09-20T11:12:43Z,"Delightful, performance-focused pure css loading animations."
31,CSS,_s,9307,2848,CSS,https://github.com/Automattic/_s,Automattic,81,2019-08-28T12:39:16Z,"Hi. I'm a starter theme called _s, or underscores, if you like. I'm a theme meant for hacking so don't use me as a Parent Theme. Instead try turning me into the next, most awesome, WordPress theme out there. That's what I'm here for."
32,CSS,tachyons,9157,575,CSS,https://github.com/tachyons-css/tachyons,tachyons-css,64,2019-08-28T07:33:18Z,Functional css for humans
33,CSS,photon,9127,528,CSS,https://github.com/connors/photon,connors,83,2018-10-13T17:09:16Z,The fastest way to build beautiful Electron apps using simple HTML and CSS
34,CSS,css,8542,640,CSS,https://github.com/primer/css,primer,90,2019-09-06T00:10:37Z,The CSS design system that powers GitHub
