rank,item,repo_name,stars,forks,language,repo_url,username,issues,last_commit,description
95,Clojure,uxbox,878,70,Clojure,https://github.com/uxbox/uxbox,uxbox,21,2020-04-23T09:46:06Z,UXBOX - The Open-Source prototyping tool
96,Clojure,clojurec,874,56,Clojure,https://github.com/schani/clojurec,schani,5,2018-04-25T22:28:20Z,A Clojure implementation on top of C
97,Clojure,amazonica,874,183,Clojure,https://github.com/mcohen01/amazonica,mcohen01,28,2019-12-23T22:33:52Z,A comprehensive Clojure client for the entire Amazon AWS api.
98,Clojure,pulsar,871,51,Clojure,https://github.com/puniverse/pulsar,puniverse,10,2020-02-05T08:27:44Z,"Fibers, Channels and Actors for Clojure"
99,Clojure,lt-cljs-tutorial,863,128,Clojure,https://github.com/swannodette/lt-cljs-tutorial,swannodette,10,2015-10-08T07:16:26Z,A ClojureScript Programming Language Tutorial for Light Table Users
100,Clojure,crux,862,60,Clojure,https://github.com/juxt/crux,juxt,114,2020-04-23T09:53:12Z,Open Time Store
1,CoffeeScript,coffeescript,15520,2016,CoffeeScript,https://github.com/jashkenas/coffeescript,jashkenas,42,2020-03-10T17:29:02Z,Unfancy JavaScript
2,CoffeeScript,SwitchyOmega,15116,2488,CoffeeScript,https://github.com/FelisCatus/SwitchyOmega,FelisCatus,364,2020-04-21T20:11:20Z,Manage and switch between multiple proxies quickly & easily.
3,CoffeeScript,trix,14897,763,CoffeeScript,https://github.com/basecamp/trix,basecamp,40,2020-04-20T14:02:25Z,A rich text editor for everyday writing
4,CoffeeScript,zxcvbn,11112,735,CoffeeScript,https://github.com/dropbox/zxcvbn,dropbox,104,2020-04-15T14:23:50Z,Low-Budget Password Strength Estimation
5,CoffeeScript,chinese-copywriting-guidelines,7649,1190,CoffeeScript,https://github.com/sparanoid/chinese-copywriting-guidelines,sparanoid,25,2020-04-05T03:02:31Z,Chinese copywriting guidelines for better written communication／中文文案排版指北
6,CoffeeScript,dynamics.js,7240,408,CoffeeScript,https://github.com/michaelvillar/dynamics.js,michaelvillar,10,2019-02-26T06:19:21Z,Javascript library to create physics-based animations
7,CoffeeScript,codecombat,7091,3736,CoffeeScript,https://github.com/codecombat/codecombat,codecombat,459,2020-04-23T07:07:34Z,Game for learning how to code.
8,CoffeeScript,morris.js,6958,1276,CoffeeScript,https://github.com/morrisjs/morris.js,morrisjs,325,2020-04-10T22:33:08Z,Pretty time-series line graphs
9,CoffeeScript,overleaf,6619,778,CoffeeScript,https://github.com/overleaf/overleaf,overleaf,143,2020-04-22T09:02:44Z,A web-based collaborative LaTeX editor
10,CoffeeScript,At.js,5221,702,CoffeeScript,https://github.com/ichord/At.js,ichord,156,2019-02-19T10:21:06Z,Add Github like mentions autocomplete to your application.
11,CoffeeScript,vibrant.js,4480,214,CoffeeScript,https://github.com/jariz/vibrant.js,jariz,2,2017-11-28T15:50:23Z,Extract prominent colors from an image. JS port of Android's Palette.
12,CoffeeScript,aglio,4462,486,CoffeeScript,https://github.com/danielgtaylor/aglio,danielgtaylor,141,2019-05-13T14:40:13Z,An API Blueprint renderer with theme support that outputs static HTML
13,CoffeeScript,bootstrap-tour,4318,925,CoffeeScript,https://github.com/sorich87/bootstrap-tour,sorich87,179,2019-11-02T05:43:03Z,Quick and easy product tours with Twitter Bootstrap Popovers
14,CoffeeScript,node-xml2js,3957,476,CoffeeScript,https://github.com/Leonidas-from-XIV/node-xml2js,Leonidas-from-XIV,172,2020-04-08T01:20:15Z,XML to JavaScript object converter.
15,CoffeeScript,yakyak,3758,340,CoffeeScript,https://github.com/yakyak/yakyak,yakyak,71,2020-04-17T09:57:44Z,Desktop chat client for Google Hangouts
16,CoffeeScript,jquery.payment,3628,710,CoffeeScript,https://github.com/stripe-archive/jquery.payment,stripe-archive,0,2017-08-02T14:10:57Z,"[DEPRECATED] A general purpose library for building credit card forms, validating inputs and formatting numbers.          "
17,CoffeeScript,turbolinks-classic,3600,448,CoffeeScript,https://github.com/turbolinks/turbolinks-classic,turbolinks,45,2017-12-06T23:33:26Z,Classic version of Turbolinks. Now deprecated in favor of Turbolinks 5.
18,CoffeeScript,activate-power-mode,3573,429,CoffeeScript,https://github.com/JoelBesada/activate-power-mode,JoelBesada,51,2019-05-24T15:52:02Z,Atom package - Activate POWER MODE to write your code in style.
19,CoffeeScript,hubot-scripts,3528,1988,CoffeeScript,https://github.com/github/hubot-scripts,github,0,2017-07-10T16:06:49Z,"DEPRECATED, see https://github.com/github/hubot-scripts/issues/1113 for details - optional scripts for hubot, opt in via hubot-scripts.json"
20,CoffeeScript,wintersmith,3488,345,CoffeeScript,https://github.com/jnordberg/wintersmith,jnordberg,14,2019-12-26T15:43:31Z,A flexible static site generator
21,CoffeeScript,pow,3459,265,CoffeeScript,https://github.com/basecamp/pow,basecamp,123,2018-04-12T12:15:45Z,Zero-configuration Rack server for Mac OS X
22,CoffeeScript,pivottable,3439,875,CoffeeScript,https://github.com/nicolaskruchten/pivottable,nicolaskruchten,263,2019-09-23T20:13:18Z,"Open-source Javascript Pivot Table (aka Pivot Grid, Pivot Chart, Cross-Tab) implementation with drag'n'drop."
23,CoffeeScript,taiga-front,3331,733,CoffeeScript,https://github.com/taigaio/taiga-front,taigaio,342,2020-04-13T12:11:46Z,Agile project management platform. Built on top of Django and AngularJS
24,CoffeeScript,Keypress,3183,319,CoffeeScript,https://github.com/dmauro/Keypress,dmauro,33,2018-09-27T02:21:46Z,A keyboard input capturing utility in which any key can be a modifier key.
25,CoffeeScript,dispatch-proxy,3161,212,CoffeeScript,https://github.com/alexkirsz/dispatch-proxy,alexkirsz,25,2019-07-13T20:04:51Z,"Combine internet connections, increase your download speed"
26,CoffeeScript,docpad,3007,249,CoffeeScript,https://github.com/docpad/docpad,docpad,23,2019-11-12T22:41:17Z,"Empower your website frontends with layouts, meta-data, pre-processors (markdown, jade, coffeescript, etc.), partials, skeletons, file watching, querying, and an amazing plugin system. DocPad will streamline your web development process allowing you to craft powerful static sites quicker than ever before."
27,CoffeeScript,sticky-kit,2971,558,CoffeeScript,https://github.com/leafo/sticky-kit,leafo,164,2019-11-12T01:06:22Z,A jQuery plugin for creating smart sticky elements
28,CoffeeScript,chaplin,2904,246,CoffeeScript,https://github.com/chaplinjs/chaplin,chaplinjs,46,2020-04-06T20:21:13Z,HTML5 application architecture using Backbone.js
29,CoffeeScript,noflo,2886,231,CoffeeScript,https://github.com/noflo/noflo,noflo,23,2020-04-22T03:52:44Z,Flow-based programming for JavaScript
30,CoffeeScript,engine,2878,128,CoffeeScript,https://github.com/gss/engine,gss,115,2019-12-17T00:22:16Z,GSS engine
31,CoffeeScript,talk-os,2755,844,CoffeeScript,https://github.com/jianliaoim/talk-os,jianliaoim,10,2017-09-05T02:27:58Z,Open source version of jianliao.com
32,CoffeeScript,pagedraw,2753,350,CoffeeScript,https://github.com/Pagedraw/pagedraw,Pagedraw,13,2020-04-05T10:48:34Z,a UI builder for React web apps
33,CoffeeScript,butterfly,2726,300,CoffeeScript,https://github.com/paradoxxxzero/butterfly,paradoxxxzero,79,2019-07-18T02:11:40Z,A web terminal based on websocket and tornado
34,CoffeeScript,angular-google-maps,2578,1085,CoffeeScript,https://github.com/angular-ui/angular-google-maps,angular-ui,337,2018-11-14T19:00:52Z,AngularJS directives for the Google Maps Javascript API
35,CoffeeScript,hallo,2478,341,CoffeeScript,https://github.com/bergie/hallo,bergie,110,2020-03-17T03:03:07Z,Simple rich text editor (contentEditable) for jQuery UI
36,CoffeeScript,cloudtunes,2406,234,CoffeeScript,https://github.com/jakubroztocil/cloudtunes,jakubroztocil,17,2018-03-20T18:40:05Z,"Web-based music player for the cloud :cloud: :notes: Play music from YouTube, Dropbox, etc."
37,CoffeeScript,oriDomi,2360,206,CoffeeScript,https://github.com/dmotz/oriDomi,dmotz,9,2018-07-14T18:10:28Z,Fold up DOM elements like paper
38,CoffeeScript,hubot-slack,2185,644,CoffeeScript,https://github.com/slackapi/hubot-slack,slackapi,41,2020-04-10T06:15:39Z,Slack Developer Kit for Hubot
39,CoffeeScript,QuoJS,2092,258,CoffeeScript,https://github.com/soyjavi/QuoJS,soyjavi,23,2018-09-03T00:16:56Z,Micro #JavaScript Library for Mobile Devices
40,CoffeeScript,js2coffee,2065,209,CoffeeScript,https://github.com/js2coffee/js2coffee,js2coffee,95,2018-02-21T04:17:31Z,Compile JavaScript to CoffeeScript
41,CoffeeScript,shadowsocks-gui,2032,1295,CoffeeScript,https://github.com/shadowsocks/shadowsocks-gui,shadowsocks,2,2018-09-24T04:39:12Z,Shadowsocks GUI client
42,CoffeeScript,CoffeeScriptRedux,1850,119,CoffeeScript,https://github.com/michaelficarra/CoffeeScriptRedux,michaelficarra,102,2019-10-14T18:59:47Z,:sweat: rewrite of the CoffeeScript compiler with proper compiler design principles and a focus on robustness and extensibility
43,CoffeeScript,ng-token-auth,1845,254,CoffeeScript,https://github.com/lynndylanhurley/ng-token-auth,lynndylanhurley,107,2019-11-04T17:43:14Z,Token based authentication module for angular.js.
44,CoffeeScript,BuckyClient,1780,101,CoffeeScript,https://github.com/HubSpot/BuckyClient,HubSpot,20,2016-08-05T20:07:08Z,Collect performance data from the client
45,CoffeeScript,vim-mode,1752,272,CoffeeScript,https://github.com/atom/vim-mode,atom,0,2017-06-15T20:06:24Z,Next generation vim support for atom
46,CoffeeScript,eco,1750,70,CoffeeScript,https://github.com/sstephenson/eco,sstephenson,33,2019-07-02T05:26:52Z,Embedded CoffeeScript templates
47,CoffeeScript,jquery.shapeshift,1701,338,CoffeeScript,https://github.com/AshesOfOwls/jquery.shapeshift,AshesOfOwls,88,2016-12-25T11:01:38Z,A dynamic grid system with drag and drop functionality.
48,CoffeeScript,psd.js,1693,263,CoffeeScript,https://github.com/meltingice/psd.js,meltingice,113,2020-02-28T15:50:15Z,A Photoshop PSD file parser for NodeJS and browsers
49,CoffeeScript,dnschain,1692,162,CoffeeScript,https://github.com/okTurtles/dnschain,okTurtles,45,2017-04-22T03:52:26Z,"A blockchain-based DNS + HTTP server that fixes HTTPS security, and more!"
50,CoffeeScript,please-wait,1607,161,CoffeeScript,https://github.com/Pathgather/please-wait,Pathgather,4,2016-08-20T10:31:00Z,A simple library to show your users a beautiful splash page while your application loads.
51,CoffeeScript,kartograph.js,1523,240,CoffeeScript,https://github.com/kartograph/kartograph.js,kartograph,36,2018-05-12T17:21:09Z,UNMAINTAINED Open source JavaScript renderer for Kartograph SVG maps
52,CoffeeScript,local_time,1523,102,CoffeeScript,https://github.com/basecamp/local_time,basecamp,18,2020-04-21T04:40:59Z,"Rails engine for cache-friendly, client-side local time"
53,CoffeeScript,cyclotron,1517,106,CoffeeScript,https://github.com/ExpediaInceCommercePlatform/cyclotron,ExpediaInceCommercePlatform,19,2019-12-27T13:37:56Z,A web platform for constructing dashboards.
54,CoffeeScript,squel,1508,214,CoffeeScript,https://github.com/hiddentao/squel,hiddentao,119,2019-11-04T20:55:17Z,:office: SQL query string builder for Javascript
55,CoffeeScript,roots,1475,136,CoffeeScript,https://github.com/jescalan/roots,jescalan,57,2020-04-14T14:25:53Z,a toolkit for rapid advanced front-end development
56,CoffeeScript,atom-beautify,1445,458,CoffeeScript,https://github.com/Glavin001/atom-beautify,Glavin001,261,2020-01-20T23:25:03Z,:lipstick: Universal beautification package for Atom editor (:warning: Currently migrating to https://github.com/Unibeautify/ and have very limited bandwidth for Atom-Beautify Issues. Thank you for your patience and understanding :heart: )
57,CoffeeScript,caniuse-cmd,1431,48,CoffeeScript,https://github.com/sgentle/caniuse-cmd,sgentle,14,2018-09-19T15:16:06Z,Caniuse command line tool
58,CoffeeScript,gulp-cheatsheet,1400,85,CoffeeScript,https://github.com/osscafe/gulp-cheatsheet,osscafe,4,2016-08-28T08:20:19Z,A cheatsheet for gulp.js
59,CoffeeScript,camo,1387,264,CoffeeScript,https://github.com/atmos/camo,atmos,24,2020-04-17T17:40:18Z,:lock: an http proxy to route images through SSL
60,CoffeeScript,atom-vim-mode-plus,1374,112,CoffeeScript,https://github.com/t9md/atom-vim-mode-plus,t9md,115,2020-01-01T01:11:10Z,vim-mode improved
61,CoffeeScript,VimFx,1365,189,CoffeeScript,https://github.com/akhodakivskiy/VimFx,akhodakivskiy,3,2020-03-19T16:52:36Z,Vim keyboard shortcuts for Firefox
62,CoffeeScript,repl.it,1360,222,CoffeeScript,https://github.com/replit-archive/repl.it,replit-archive,1,2016-04-11T20:47:38Z,https://repl.it/feedback Online REPL for 15+ languages.
63,CoffeeScript,pretty-error,1324,40,CoffeeScript,https://github.com/AriaMinaei/pretty-error,AriaMinaei,17,2020-03-13T15:29:59Z,See node.js errors with less clutter
64,CoffeeScript,atom-simplified-chinese-menu,1321,150,CoffeeScript,https://github.com/chinakids/atom-simplified-chinese-menu,chinakids,25,2018-08-06T02:41:40Z,"Atom 的简体中文汉化扩展,目前最全的汉化包。包含菜单汉化、右键菜单汉化以及设置汉化"
65,CoffeeScript,coffeekup,1282,91,CoffeeScript,https://github.com/mauricemach/coffeekup,mauricemach,39,2011-10-26T01:50:57Z,Markup as CoffeeScript.
66,CoffeeScript,qqbot,1250,391,CoffeeScript,https://github.com/xhan/qqbot,xhan,24,2016-02-15T03:31:44Z,基于WebQQ协议的QQ机器人。命令行工具，Hubot支持！
67,CoffeeScript,shadowsocks-nodejs,1240,786,CoffeeScript,https://github.com/shadowsocks/shadowsocks-nodejs,shadowsocks,5,2016-08-11T03:01:11Z,
68,CoffeeScript,mondrian,1235,116,CoffeeScript,https://github.com/artursapek/mondrian,artursapek,21,2017-10-30T03:18:15Z,Web-based vector graphics editor
69,CoffeeScript,cson,1231,58,CoffeeScript,https://github.com/bevry/cson,bevry,5,2020-03-25T22:18:44Z,CoffeeScript-Object-Notation. Same as JSON but for CoffeeScript objects.
70,CoffeeScript,greenscreen,1205,163,CoffeeScript,https://github.com/groupon/greenscreen,groupon,46,2017-05-17T00:29:05Z,
71,CoffeeScript,lineman,1199,87,CoffeeScript,https://github.com/linemanjs/lineman,linemanjs,30,2019-12-20T05:57:26Z,"Lineman helps you build fat-client JavaScript apps. It produces happiness by building assets, mocking servers, running specs on every file change"
72,CoffeeScript,tacofancy,1189,455,CoffeeScript,https://github.com/sinker/tacofancy,sinker,12,2019-10-08T20:47:22Z,community-driven taco repo. stars stars stars.
73,CoffeeScript,apm,1186,285,CoffeeScript,https://github.com/atom/apm,atom,178,2020-04-04T00:58:57Z,Atom Package Manager
74,CoffeeScript,aurora.js,1148,134,CoffeeScript,https://github.com/audiocogs/aurora.js,audiocogs,59,2019-04-17T12:19:58Z,JavaScript audio decoding framework
75,CoffeeScript,badges,1143,808,CoffeeScript,https://github.com/boennemann/badges,boennemann,9,2019-04-05T16:27:49Z,:flower_playing_cards: Readme Badges – Gotta catch 'em all
76,CoffeeScript,angular-masonry,1139,239,CoffeeScript,https://github.com/passy/angular-masonry,passy,54,2017-05-17T15:42:06Z,An AngularJS directive for Masonry.
77,CoffeeScript,git-time-machine,1129,49,CoffeeScript,https://github.com/littlebee/git-time-machine,littlebee,43,2018-12-21T00:33:44Z,Atom package that allows you to travel back in commit history
78,CoffeeScript,Heyoffline,1111,72,CoffeeScript,https://github.com/oskarkrawczyk/Heyoffline,oskarkrawczyk,3,2017-01-06T08:05:04Z,Warn your users when their network goes down. Make sure they don't lose anything.
79,CoffeeScript,hubble,1094,39,CoffeeScript,https://github.com/jaymedavis/hubble,jaymedavis,0,2018-10-11T01:39:44Z,A dashboard that displays in the terminal
80,CoffeeScript,pushd,1072,223,CoffeeScript,https://github.com/rs/pushd,rs,60,2019-10-01T20:13:55Z,Blazing fast multi-protocol mobile and web push notification service
81,CoffeeScript,stitch,1069,82,CoffeeScript,https://github.com/sstephenson/stitch,sstephenson,32,2012-11-02T14:08:32Z,Stitch your CommonJS modules together for the browser
82,CoffeeScript,octonode,1069,245,CoffeeScript,https://github.com/pksunkara/octonode,pksunkara,30,2020-02-17T08:18:53Z,github api v3 in nodejs
83,CoffeeScript,buckets,1066,165,CoffeeScript,https://github.com/bucketsio/buckets,bucketsio,7,2015-05-31T04:57:37Z,[DEPRECATED] Manage content better.
84,CoffeeScript,node-slug,1061,94,CoffeeScript,https://github.com/dodo/node-slug,dodo,44,2019-04-05T15:49:19Z,slugifies even utf-8 chars!
85,CoffeeScript,Coffee-Physics,1059,91,CoffeeScript,https://github.com/soulwire/Coffee-Physics,soulwire,8,2016-12-12T17:36:34Z,"A simple, lightweight physics engine written in CoffeeScript"
86,CoffeeScript,coffeelint,1053,179,CoffeeScript,https://github.com/clutchski/coffeelint,clutchski,85,2020-02-21T19:24:08Z,Lint your CoffeeScript.
87,CoffeeScript,node-cache,1039,98,CoffeeScript,https://github.com/node-cache/node-cache,node-cache,14,2020-04-22T21:37:47Z,a node internal caching module
88,CoffeeScript,jquery.turbolinks,1032,62,CoffeeScript,https://github.com/kossnocorp/jquery.turbolinks,kossnocorp,19,2017-09-03T12:15:16Z,💀 Deprecated ⚠️ jQuery plugin for drop-in fix binded events problem caused by Turbolinks
89,CoffeeScript,dploy,1010,91,CoffeeScript,https://github.com/lucasmotta/dploy,lucasmotta,61,2019-02-05T16:21:33Z,⛔️ currently unmaintained ⛔️
90,CoffeeScript,literallycanvas,976,283,CoffeeScript,https://github.com/literallycanvas/literallycanvas,literallycanvas,86,2019-10-24T17:14:34Z,A canvas in your browser. Literally.
91,CoffeeScript,zappa,970,88,CoffeeScript,https://github.com/mauricemach/zappa,mauricemach,33,2020-04-16T03:21:01Z,Node development for the lazy.
92,CoffeeScript,muplayer,953,235,CoffeeScript,https://github.com/Baidu-Music-FE/muplayer,Baidu-Music-FE,14,2019-10-31T00:11:49Z,"An open source web audio player from Baidu Music, support HTML5 and Flash engine on different platforms(百度音乐播放内核)"
93,CoffeeScript,node-neo4j,933,143,CoffeeScript,https://github.com/thingdom/node-neo4j,thingdom,46,2018-11-20T12:02:09Z,[RETIRED] Neo4j graph database driver (REST API client) for Node.js
94,CoffeeScript,omelette,921,26,CoffeeScript,https://github.com/f/omelette,f,13,2019-12-22T01:42:40Z,"Omelette is a simple, template based autocompletion tool for Node projects with super easy API. (For Bash, Zsh and Fish)"
95,CoffeeScript,node-rtsp-rtmp-server,914,251,CoffeeScript,https://github.com/iizukanao/node-rtsp-rtmp-server,iizukanao,76,2019-03-19T14:42:21Z,RTSP/RTMP/HTTP hybrid server
96,CoffeeScript,pt,907,65,CoffeeScript,https://github.com/williamngan/pt,williamngan,10,2018-02-13T09:06:59Z,"An experimental library on point, form, and space."
97,CoffeeScript,apparatus,893,52,CoffeeScript,https://github.com/cdglabs/apparatus,cdglabs,26,2018-02-06T10:37:56Z,A hybrid graphics editor and programming environment for creating interactive diagrams.
98,CoffeeScript,webgl-heatmap,882,135,CoffeeScript,https://github.com/pyalot/webgl-heatmap,pyalot,11,2015-06-05T22:50:19Z,A high performance WebGL/JS heatmap display library
99,CoffeeScript,jquery-endless-scroll,857,187,CoffeeScript,https://github.com/fredwu/jquery-endless-scroll,fredwu,28,2017-07-29T13:59:53Z,Endless/infinite scrolling/pagination.
100,CoffeeScript,meteor-admin,836,271,CoffeeScript,https://github.com/yogiben/meteor-admin,yogiben,177,2017-06-23T14:24:08Z,A complete admin dashboard solution
1,CSS,animate.css,66137,14162,CSS,https://github.com/daneden/animate.css,daneden,4,2020-04-22T09:52:14Z,🍿 A cross-browser library of CSS animations. As easy to use as an easy thing.
2,CSS,material-design-icons,40058,8226,CSS,https://github.com/google/material-design-icons,google,589,2020-01-24T21:59:28Z,Material Design icons by Google
3,CSS,bulma,39412,3337,CSS,https://github.com/jgthms/bulma,jgthms,306,2020-04-18T16:22:04Z,Modern CSS framework based on Flexbox
4,CSS,normalize.css,38558,8253,CSS,https://github.com/necolas/normalize.css,necolas,32,2020-01-26T08:57:04Z,A modern alternative to CSS resets
5,CSS,freecodecamp.cn,36830,1405,CSS,https://github.com/FreeCodeCampChina/freecodecamp.cn,FreeCodeCampChina,150,2020-01-22T11:01:21Z,FCC China open source codebase and curriculum. Learn to code and help nonprofits.
6,CSS,weui,24437,6199,CSS,https://github.com/Tencent/weui,Tencent,28,2020-03-05T05:36:57Z,"A UI library by WeChat official design team, includes the most useful widgets/modules in mobile web applications."
7,CSS,hangzhou_house_knowledge,23842,5102,CSS,https://github.com/houshanren/hangzhou_house_knowledge,houshanren,107,2019-12-13T11:32:25Z,"2017年买房经历总结出来的买房购房知识分享给大家，希望对大家有所帮助。买房不易，且买且珍惜。Sharing the knowledge of buy an own house that according  to the experience at hangzhou in 2017 to all the people. It's not easy to buy a own house, so I hope that it would be useful to everyone."
8,CSS,Hover,22637,4958,CSS,https://github.com/IanLunn/Hover,IanLunn,30,2019-11-27T22:08:02Z,"A collection of CSS3 powered hover effects to be applied to links, buttons, logos, SVG, featured images and so on. Easily apply to your own elements, modify or just use for inspiration. Available in CSS, Sass, and LESS."
9,CSS,tailwindcss,21871,986,CSS,https://github.com/tailwindcss/tailwindcss,tailwindcss,76,2020-04-23T06:25:29Z,A utility-first CSS framework for rapid UI development.
10,CSS,nerd-fonts,20850,1442,CSS,https://github.com/ryanoasis/nerd-fonts,ryanoasis,121,2020-04-22T10:52:45Z,"Iconic font aggregator, collection, & patcher. 3,600+ icons, 50+ patched fonts: Hack, Source Code Pro, more. Glyph collections: Font Awesome, Material Design Icons, Octicons, & more"
11,CSS,bootstrap-material-design,20136,3290,CSS,https://github.com/FezVrasta/bootstrap-material-design,FezVrasta,70,2020-03-13T22:41:18Z,Material design theme for Bootstrap 3 and 4
12,CSS,the-swift-programming-language-in-chinese,19320,5036,CSS,https://github.com/SwiftGGTeam/the-swift-programming-language-in-chinese,SwiftGGTeam,0,2020-04-08T16:31:25Z,中文版 Apple 官方 Swift 教程《The Swift Programming Language》
13,CSS,Skeleton,17432,2988,CSS,https://github.com/dhg/Skeleton,dhg,139,2019-12-11T01:57:46Z,"Skeleton: A Dead Simple, Responsive Boilerplate for Mobile-Friendly Development"
14,CSS,SpinKit,16770,1614,CSS,https://github.com/tobiasahlin/SpinKit,tobiasahlin,7,2020-02-10T13:10:16Z,A collection of loading indicators animated with CSS
15,CSS,my-mac-os,16747,746,CSS,https://github.com/nikitavoloboev/my-mac-os,nikitavoloboev,2,2020-04-16T17:07:53Z,List of applications and tools that make my macOS experience even more amazing
16,CSS,source-code-pro,16144,1431,CSS,https://github.com/adobe-fonts/source-code-pro,adobe-fonts,45,2019-10-04T17:33:56Z,Monospaced font family for user interface and coding environments
17,CSS,uikit,15636,2190,CSS,https://github.com/uikit/uikit,uikit,601,2020-04-23T10:02:34Z,A lightweight and modular front-end framework for developing fast and powerful web interfaces
18,CSS,hexo-theme-next,15195,3840,CSS,https://github.com/iissnan/hexo-theme-next,iissnan,70,2020-04-02T06:25:26Z,Elegant theme for Hexo. 
19,CSS,pace,14832,1930,CSS,https://github.com/HubSpot/pace,HubSpot,301,2019-09-23T07:38:17Z,Automatically add a progress bar to your site. #hubspot-open-source
20,CSS,Flat-UI,14702,2446,CSS,https://github.com/designmodo/Flat-UI,designmodo,9,2019-02-13T17:29:09Z,"Flat UI Free - Design Framework (html/css3/less/js). Flat UI is based on Bootstrap, a comfortable, responsive, and functional framework that simplifies the development of websites."
21,CSS,NES.css,14556,1207,CSS,https://github.com/nostalgic-css/NES.css,nostalgic-css,29,2020-04-16T12:30:51Z,NES-style CSS Framework | ファミコン風CSSフレームワーク
22,CSS,ratchet,14409,1509,CSS,https://github.com/twbs/ratchet,twbs,221,2019-09-05T06:31:48Z,"Build mobile apps with simple HTML, CSS, and JavaScript components. "
23,CSS,You-Dont-Need-JavaScript,13312,777,CSS,https://github.com/you-dont-need/You-Dont-Need-JavaScript,you-dont-need,27,2020-01-26T09:52:32Z,"CSS is powerful, you can do a lot of things without JS."
24,CSS,tomorrow-theme,12735,3120,CSS,https://github.com/chriskempson/tomorrow-theme,chriskempson,109,2019-06-08T11:18:32Z,Tomorrow Theme now lives on at https://github.com/chriskempson/base16
25,CSS,solved-by-flexbox,12614,1040,CSS,https://github.com/philipwalton/solved-by-flexbox,philipwalton,21,2019-12-02T21:11:47Z,"A showcase of problems once hard or impossible to solve with CSS alone, now made trivially easy with Flexbox."
26,CSS,weui-wxss,12448,4345,CSS,https://github.com/Tencent/weui-wxss,Tencent,29,2020-03-04T13:04:11Z,"A UI library by WeChat official design team, includes the most useful widgets/modules."
27,CSS,howto-make-more-money,11546,1248,CSS,https://github.com/easychen/howto-make-more-money,easychen,3,2020-04-12T02:27:49Z,"程序员如何优雅的挣零花钱，2.0版，升级为小书了。Most of this not work outside China , so no English translate"
28,CSS,hacker101,11215,1608,CSS,https://github.com/Hacker0x01/hacker101,Hacker0x01,22,2020-04-22T19:02:05Z,Hacker101
29,CSS,Effeckt.css,11133,1497,CSS,https://github.com/h5bp/Effeckt.css,h5bp,0,2019-03-01T16:28:55Z,This repo is archived. Thanks!
30,CSS,card,10909,1322,CSS,https://github.com/jessepollak/card,jessepollak,133,2020-04-07T11:41:17Z,:credit_card: make your credit card form better in one line of code
31,CSS,2048,10404,15754,CSS,https://github.com/gabrielecirulli/2048,gabrielecirulli,103,2020-02-17T01:48:43Z,A small clone of 1024 (https://play.google.com/store/apps/details?id=com.veewo.a1024)
32,CSS,spectre,10098,729,CSS,https://github.com/picturepan2/spectre,picturepan2,169,2020-04-01T15:54:18Z,"Spectre.css - A Lightweight, Responsive and Modern CSS Framework"
33,CSS,tachyons,9721,611,CSS,https://github.com/tachyons-css/tachyons,tachyons-css,72,2020-03-18T15:36:20Z,Functional css for humans
34,CSS,_s,9614,2922,CSS,https://github.com/Automattic/_s,Automattic,38,2020-04-23T09:00:33Z,"Hi. I'm a starter theme called _s, or underscores, if you like. I'm a theme meant for hacking so don't use me as a Parent Theme. Instead try turning me into the next, most awesome, WordPress theme out there. That's what I'm here for."
