rank,item,repo_name,stars,forks,language,repo_url,username,issues,last_commit,description
50,Python,funNLP,19493,5841,Python,https://github.com/fighting41love/funNLP,fighting41love,1,2020-04-08T03:06:58Z,"中英文敏感词、语言检测、中外手机/电话归属地/运营商查询、名字推断性别、手机号抽取、身份证抽取、邮箱抽取、中日文人名库、中文缩写库、拆字词典、词汇情感值、停用词、反动词表、暴恐词表、繁简体转换、英文模拟中文发音、汪峰歌词生成器、职业名称词库、同义词库、反义词库、否定词库、汽车品牌词库、汽车零件词库、连续英文切割、各种中文词向量、公司名字大全、古诗词库、IT词库、财经词库、成语词库、地名词库、历史名人词库、诗词词库、医学词库、饮食词库、法律词库、汽车词库、动物词库、中文聊天语料、中文谣言数据、百度中文问答数据集、句子相似度匹配算法集合、bert资源、文本生成&摘要相关工具、cocoNLP信息抽取工具、国内电话号码正则匹配、清华大学XLORE:中英文跨语言百科知识图谱、清华大学人工智能技术系列报告、自然语言生成、NLU太难了系列、自动对联数据及机器人、用户名黑名单列表、罪名法务名词及分类模型、微信公众号语料、cs224n深度学习自然语言处理课程、中文手写汉字识别、中文自然语言处理 语料/数据集、变量命名神器、分词语料库+代码、任务型对话英文数据集、ASR 语音数据集 + 基于深度学习的中文语音识别系统、笑声检测器、Microsoft多语言数字/单位/如日期时间识别包、中华新华字典数据库及api(包括常用歇后语、成语、词语和汉字)、文档图谱自动生成、SpaCy 中文模型、Common Voice语音识别数据集新版、神经网络关系抽取、基于bert的命名实体识别、关键词(Keyphrase)抽取包pke、基于医疗领域知识图谱的问答系统、基于依存句法与语义角色标注的事件三元组抽取、依存句法分析4万句高质量标注数据、cnocr：用来做中文OCR的Python3包、中文人物关系知识图谱项目、中文nlp竞赛项目及代码汇总、中文字符数据、speech-aligner: 从“人声语音”及其“语言文本”产生音素级别时间对齐标注的工具、AmpliGraph: 知识图谱表示学习(Python)库：知识图谱概念链接预测、Scattertext 文本可视化(python)、语言/知识表示工具：BERT & ERNIE、中文对比英文自然语言处理NLP的区别综述、Synonyms中文近义词工具包、HarvestText领域自适应文本挖掘工具（新词发现-情感分析-实体链接等）、word2word：(Python)方便易用的多语言词-词对集：62种语言/3,564个多语言对、语音识别语料生成工具：从具有音频/字幕的在线视频创建自动语音识别(ASR)语料库、构建医疗实体识别的模型（包含词典和语料标注）、单文档非监督的关键词抽取、Kashgari中使用gpt-2语言模型、开源的金融投资数据提取工具、文本自动摘要库TextTeaser: 仅支持英文、人民日报语料处理工具集、一些关于自然语言的基本模型、基于14W歌曲知识库的问答尝试--功能包括歌词接龙and已知歌词找歌曲以及歌曲歌手歌词三角关系的问答、基于Siamese bilstm模型的相似句子判定模型并提供训练数据集和测试数据集、用Transformer编解码模型实现的根据Hacker News文章标题自动生成评论、用BERT进行序列标记和文本分类的模板代码、LitBank：NLP数据集——支持自然语言处理和计算人文学科任务的100部带标记英文小说语料、百度开源的基准信息抽取系统、虚假新闻数据集、Facebook: LAMA语言模型分析，提供Transformer-XL/BERT/ELMo/GPT预训练语言模型的统一访问接口、CommonsenseQA：面向常识的英文QA挑战、中文知识图谱资料、数据及工具、各大公司内部里大牛分享的技术文档 PDF 或者 PPT、自然语言生成SQL语句（英文）、中文NLP数据增强（EDA）工具、英文NLP数据增强工具 、基于医药知识图谱的智能问答系统、京东商品知识图谱、基于mongodb存储的军事领域知识图谱问答项目、基于远监督的中文关系抽取、语音情感分析、中文ULMFiT-情感分析-文本分类-语料及模型、一个拍照做题程序、世界各国大规模人名库、一个利用有趣中文语料库 qingyun 训练出来的中文聊天机器人、中文聊天机器人seqGAN、省市区镇行政区划数据带拼音标注、教育行业新闻语料库包含自动文摘功能、开放了对话机器人-知识图谱-语义理解-自然语言处理工具及数据、中文知识图谱：基于百度百科中文页面-抽取三元组信息-构建中文知识图谱、masr: 中文语音识别-提供预训练模型-高识别率、Python音频数据增广库、中文全词覆盖BERT及两份阅读理解数据、ConvLab：开源多域端到端对话系统平台、中文自然语言处理数据集、基于最新版本rasa搭建的对话系统、基于TensorFlow和BERT的管道式实体及关系抽取、一个小型的证券知识图谱/知识库、复盘所有NLP比赛的TOP方案、OpenCLaP：多领域开源中文预训练语言模型仓库、UER：基于不同语料+编码器+目标任务的中文预训练模型仓库、中文自然语言处理向量合集、基于金融-司法领域(兼有闲聊性质)的聊天机器人、g2pC：基于上下文的汉语读音自动标记模块、Zincbase 知识图谱构建工具包、诗歌质量评价/细粒度情感诗歌语料库、快速转化「中文数字」和「阿拉伯数字」、百度知道问答语料库、基于知识图谱的问答系统、jieba_fast 加速版的jieba、正则表达式教程、中文阅读理解数据集、基于BERT等最新语言模型的抽取式摘要提取、Python利用深度学习进行文本摘要的综合指南、知识图谱深度学习相关资料整理、维基大规模平行文本语料、StanfordNLP 0.2.0：纯Python版自然语言处理包、NeuralNLP-NeuralClassifier：腾讯开源深度学习文本分类工具、端到端的封闭域对话系统、中文命名实体识别：NeuroNER vs. BertNER、新闻事件线索抽取、2019年百度的三元组抽取比赛：“科学空间队”源码、基于依存句法的开放域文本知识三元组抽取和知识库构建、中文的GPT2训练代码、ML-NLP - 机器学习(Machine Learning)NLP面试中常考到的知识点和代码实现、nlp4han:中文自然语言处理工具集(断句/分词/词性标注/组块/句法分析/语义分析/NER/N元语法/HMM/代词消解/情感分析/拼写检查、XLM：Facebook的跨语言预训练语言模型、用基于BERT的微调和特征提取方法来进行知识图谱百度百科人物词条属性抽取、中文自然语言处理相关的开放任务-数据集-当前最佳结果、CoupletAI - 基于CNN+Bi-LSTM+Attention 的自动对对联系统、抽象知识图谱、MiningZhiDaoQACorpus - 580万百度知道问答数据挖掘项目、brat rapid annotation tool: 序列标注工具、大规模中文知识图谱数据：1.4亿实体、数据增强在机器翻译及其他nlp任务中的应用及效果、allennlp阅读理解:支持多种数据和模型、PDF表格数据提取工具 、 Graphbrain：AI开源软件库和科研工具，目的是促进自动意义提取和文本理解以及知识的探索和推断、简历自动筛选系统、基于命名实体识别的简历自动摘要、中文语言理解测评基准，包括代表性的数据集&基准模型&语料库&排行榜、树洞 OCR 文字识别 、从包含表格的扫描图片中识别表格和文字、语声迁移、Python口语自然语言处理工具集(英文)、 similarity：相似度计算工具包，java编写、海量中文预训练ALBERT模型 、Transformers 2.0 、基于大规模音频数据集Audioset的音频增强 、Poplar：网页版自然语言标注工具、图片文字去除，可用于漫画翻译 、186种语言的数字叫法库、Amazon发布基于知识的人-人开放领域对话数据集 、中文文本纠错模块代码、繁简体转换 、 Python实现的多种文本可读性评价指标、类似于人名/地名/组织机构名的命名体识别数据集 、东南大学《知识图谱》研究生课程(资料)、. 英文拼写检查库 、 wwsearch是企业微信后台自研的全文检索引擎、CHAMELEON：深度学习新闻推荐系统元架构 、 8篇论文梳理BERT相关模型进展与反思、DocSearch：免费文档搜索引擎、 LIDA：轻量交互式对话标注工具 、aili - the fastest in-memory index in the East 东半球最快并发索引 、知识图谱车音工作项目、自然语言生成资源大全 、中日韩分词库mecab的Python接口库、中文文本摘要/关键词提取、汉字字符特征提取器 (featurizer)，提取汉字的特征（发音特征、字形特征）用做深度学习的特征、中文生成任务基准测评 、中文缩写数据集、中文任务基准测评 - 代表性的数据集-基准(预训练)模型-语料库-baseline-工具包-排行榜、PySS3：面向可解释AI的SS3文本分类器机器可视化工具 、中文NLP数据集列表、COPE - 格律诗编辑程序、doccano：基于网页的开源协同多语言文本标注工具 、PreNLP：自然语言预处理库、简单的简历解析器，用来从简历中提取关键信息、用于中文闲聊的GPT2模型：GPT2-chitchat、基于检索聊天机器人多轮响应选择相关资源列表(Leaderboards、Datasets、Papers)、(Colab)抽象文本摘要实现集锦(教程 、词语拼音数据、高效模糊搜索工具、NLP数据增广资源集、微软对话机器人框架 、 GitHub Typo Corpus：大规模GitHub多语言拼写错误/语法错误数据集、TextCluster：短文本聚类预处理模块 Short text cluster、面向语音识别的中文文本规范化、BLINK：最先进的实体链接库、BertPunc：基于BERT的最先进标点修复模型、Tokenizer：快速、可定制的文本词条化库、中文语言理解测评基准，包括代表性的数据集、基准(预训练)模型、语料库、排行榜、spaCy 医学文本挖掘与信息提取 、 NLP任务示例项目代码集、 python拼写检查库、chatbot-list - 行业内关于智能客服、聊天机器人的应用和架构、算法分享和介绍、语音质量评价指标(MOSNet, BSSEval, STOI, PESQ, SRMR)、 用138GB语料训练的法文RoBERTa预训练语言模型 、BERT-NER-Pytorch：三种不同模式的BERT中文NER实验、无道词典 - 有道词典的命令行版本，支持英汉互查和在线查询、2019年NLP亮点回顾、 Chinese medical dialogue data 中文医疗对话数据集 、最好的汉字数字(中文数字)-阿拉伯数字转换工具、 基于百科知识库的中文词语多词义/义项获取与特定句子词语语义消歧、awesome-nlp-sentiment-analysis - 情感分析、情绪原因识别、评价对象和评价词抽取、LineFlow：面向所有深度学习框架的NLP数据高效加载器、中文医学NLP公开资源整理 、MedQuAD：(英文)医学问答数据集、将自然语言数字串解析转换为整数和浮点数、Transfer Learning in Natural Language Processing (NLP) 、面向语音识别的中文/英文发音辞典、Tokenizers：注重性能与多功能性的最先进分词器、CLUENER 细粒度命名实体识别 Fine Grained Named Entity Recognition、 基于BERT的中文命名实体识别、中文谣言数据库、NLP数据集/基准任务大列表、nlp相关的一些论文及代码, 包括主题模型、词向量(Word Embedding)、命名实体识别(NER)、文本分类(Text Classificatin)、文本生成(Text Generation)、文本相似性(Text Similarity)计算等，涉及到各种与nlp相关的算法，基于keras和tensorflow 、Python文本挖掘/NLP实战示例、 Blackstone：面向非结构化法律文本的spaCy pipeline和NLP模型通过同义词替换实现文本“变脸” 、中文 预训练 ELECTREA 模型: 基于对抗学习 pretrain Chinese Model 、albert-chinese-ner - 用预训练语言模型ALBERT做中文NER 、基于GPT2的特定主题文本生成/文本增广、开源预训练语言模型合集、多语言句向量包、编码、标记和实现：一种可控高效的文本生成方法、 英文脏话大列表 、attnvis：GPT2、BERT等transformer语言模型注意力交互可视化、CoVoST：Facebook发布的多语种语音-文本翻译语料库，包括11种语言(法语、德语、荷兰语、俄语、西班牙语、意大利语、土耳其语、波斯语、瑞典语、蒙古语和中文)的语音、文字转录及英文译文、Jiagu自然语言处理工具 - 以BiLSTM等模型为基础，提供知识图谱关系抽取 中文分词 词性标注 命名实体识别 情感分析 新词发现 关键词 文本摘要 文本聚类等功能、用unet实现对文档表格的自动检测，表格重建、NLP事件提取文献资源列表 、 金融领域自然语言处理研究资源大列表、CLUEDatasetSearch - 中英文NLP数据集：搜索所有中文NLP数据集，附常用英文NLP数据集 、medical_NER - 中文医学知识图谱命名实体识别 、(哈佛)讲因果推理的免费书、知识图谱相关学习资料/数据集/工具资源大列表、Forte：灵活强大的自然语言处理pipeline工具集 、Python字符串相似性算法库、PyLaia：面向手写文档分析的深度学习工具包、TextFooler：针对文本分类/推理的对抗文本生成模块、Haystack：灵活、强大的可扩展问答(QA)框架、中文关键短语抽取工具"
51,Python,compose,19343,3089,Python,https://github.com/docker/compose,docker,356,2020-04-22T14:38:58Z,Define and run multi-container applications with Docker
52,Python,HanLP,19038,5263,Python,https://github.com/hankcs/HanLP,hankcs,8,2020-04-09T11:41:41Z,中文分词 词性标注 命名实体识别 依存句法分析 语义依存分析 新词发现 关键词短语提取 自动摘要 文本分类聚类 拼音简繁转换 自然语言处理
53,Python,tornado,19033,5175,Python,https://github.com/tornadoweb/tornado,tornadoweb,204,2020-04-07T04:02:29Z,"Tornado is a Python web framework and asynchronous networking library, originally developed at FriendFeed."
54,Python,cheat.sh,18587,919,Python,https://github.com/chubin/cheat.sh,chubin,61,2020-04-20T21:42:40Z,the only cheat sheet you need
55,Python,mitmproxy,18521,2408,Python,https://github.com/mitmproxy/mitmproxy,mitmproxy,267,2020-04-21T15:05:49Z,An interactive TLS-capable intercepting HTTP proxy for penetration testers and software developers.
56,Python,GitHub-Chinese-Top-Charts,18341,2429,Python,https://github.com/kon9chunkit/GitHub-Chinese-Top-Charts,kon9chunkit,64,2020-04-21T18:49:30Z,:cn: GitHub中文排行榜，帮助你发现高分优秀中文项目、更高效地吸收国人的优秀经验成果；榜单每周更新一次，敬请关注！（中国加油！世界加油！）
57,Python,data-science-ipython-notebooks,18330,5662,Python,https://github.com/donnemartin/data-science-ipython-notebooks,donnemartin,11,2019-10-25T10:21:39Z,"Data science Python notebooks: Deep learning (TensorFlow, Theano, Caffe, Keras), scikit-learn, Kaggle, big data (Spark, Hadoop MapReduce, HDFS), matplotlib, pandas, NumPy, SciPy, Python essentials, AWS, and various command lines."
58,Python,algo,18035,1519,Python,https://github.com/trailofbits/algo,trailofbits,70,2020-04-19T20:58:31Z,Set up a personal VPN in the cloud
59,Python,algorithms,17175,3450,Python,https://github.com/keon/algorithms,keon,106,2020-04-14T10:03:32Z,Minimal examples of data structures and algorithms in Python
60,Python,django-rest-framework,17134,4965,Python,https://github.com/encode/django-rest-framework,encode,235,2020-04-23T08:38:15Z,Web APIs for Django. 🎸
61,Python,Python,17030,8288,Python,https://github.com/geekcomputers/Python,geekcomputers,109,2020-04-17T05:51:36Z,My Python Examples
62,Python,sqlmap,16959,3691,Python,https://github.com/sqlmapproject/sqlmap,sqlmapproject,51,2020-04-20T23:26:36Z,Automatic SQL injection and database takeover tool
63,Python,d2l-zh,16939,4365,Python,https://github.com/d2l-ai/d2l-zh,d2l-ai,1,2020-04-20T01:15:29Z,《动手学深度学习》：面向中文读者、能运行、可讨论。英文版即伯克利“深度学习导论”教材。
64,Python,python-fire,16681,1026,Python,https://github.com/google/python-fire,google,57,2020-04-23T02:32:23Z,Python Fire is a library for automatically generating command line interfaces (CLIs) from absolutely any Python object.
65,Python,Real-Time-Voice-Cloning,16673,3049,Python,https://github.com/CorentinJ/Real-Time-Voice-Cloning,CorentinJ,145,2020-04-19T19:15:59Z,Clone a voice in 5 seconds to generate arbitrary speech in real-time
66,Python,Mask_RCNN,16460,7827,Python,https://github.com/matterport/Mask_RCNN,matterport,1381,2020-04-20T13:22:06Z,Mask R-CNN for object detection and instance segmentation on Keras and TensorFlow
67,Python,airflow,16443,6325,Python,https://github.com/apache/airflow,apache,417,2020-04-23T10:54:47Z,"Apache Airflow - A platform to programmatically author, schedule, and monitor workflows"
68,Python,pytorch-tutorial,16336,5182,Python,https://github.com/yunjey/pytorch-tutorial,yunjey,60,2020-03-04T13:50:10Z,PyTorch Tutorial for Deep Learning Researchers
69,Python,spaCy,16222,2886,Python,https://github.com/explosion/spaCy,explosion,201,2020-04-23T08:57:07Z,💫 Industrial-strength Natural Language Processing (NLP) with Python and Cython
70,Python,ML-From-Scratch,15918,3102,Python,https://github.com/eriklindernoren/ML-From-Scratch,eriklindernoren,29,2020-01-29T17:50:42Z,Machine Learning From Scratch. Bare bones NumPy implementations of machine learning models and algorithms with a focus on accessibility. Aims to cover everything from linear regression to deep learning.
71,Python,glances,15789,1035,Python,https://github.com/nicolargo/glances,nicolargo,160,2020-04-09T18:06:38Z,"Glances an Eye on your system. A top/htop alternative for GNU/Linux, BSD, Mac OS and Windows operating systems."
72,Python,macOS-Security-and-Privacy-Guide,15756,1124,Python,https://github.com/drduh/macOS-Security-and-Privacy-Guide,drduh,3,2020-02-07T01:06:12Z,Guide to securing and improving privacy on macOS
73,Python,black,15687,900,Python,https://github.com/psf/black,psf,299,2020-04-20T07:23:27Z,The uncompromising Python code formatter
74,Python,ZeroNet,15608,2031,Python,https://github.com/HelloZeroNet/ZeroNet,HelloZeroNet,640,2020-04-21T18:53:14Z,ZeroNet - Decentralized websites using Bitcoin crypto and BitTorrent network
75,Python,NLP-progress,15344,2605,Python,https://github.com/sebastianruder/NLP-progress,sebastianruder,23,2020-04-22T18:15:31Z,"Repository to track the progress in Natural Language Processing (NLP), including the datasets and the current state-of-the-art for the most common NLP tasks."
76,Python,reddit,15344,2822,Python,https://github.com/reddit-archive/reddit,reddit-archive,304,2017-10-17T19:57:07Z,historical code from reddit.com
77,Python,hosts,15064,1356,Python,https://github.com/StevenBlack/hosts,StevenBlack,36,2020-04-23T06:07:23Z,"Consolidating and Extending hosts files from several well-curated sources. You can optionally pick extensions to block Porn, Social Media, and other categories.."
78,Python,magenta,14948,3052,Python,https://github.com/tensorflow/magenta,tensorflow,243,2020-04-20T20:11:58Z,Magenta: Music and Art Generation with Machine Intelligence
79,Python,celery,14840,3666,Python,https://github.com/celery/celery,celery,438,2020-04-22T11:30:13Z,Distributed Task Queue (development branch)
80,Python,algo,14687,4612,Python,https://github.com/wangzheng0822/algo,wangzheng0822,101,2020-04-10T16:23:35Z,数据结构和算法必知必会的50个代码实现
81,Python,TensorFlow-Course,14323,2875,Python,https://github.com/machinelearningmindset/TensorFlow-Course,machinelearningmindset,0,2020-04-21T03:17:40Z,Simple and ready-to-use tutorials for TensorFlow 
82,Python,pyspider,14273,3469,Python,https://github.com/binux/pyspider,binux,268,2020-02-29T20:14:01Z,A Powerful Spider(Web Crawler) System in Python.
83,Python,tqdm,14151,733,Python,https://github.com/tqdm/tqdm,tqdm,245,2020-04-20T12:14:14Z,"A Fast, Extensible Progress Bar for Python and CLI"
84,Python,ipython,14132,3982,Python,https://github.com/ipython/ipython,ipython,1310,2020-04-23T06:55:34Z,"Official repository for IPython itself. Other repos in the IPython organization contain things like the website, documentation builds, etc."
85,Python,PayloadsAllTheThings,14104,4452,Python,https://github.com/swisskyrepo/PayloadsAllTheThings,swisskyrepo,6,2020-04-22T14:11:42Z,A list of useful payloads and bypass for Web Application Security and Pentest/CTF
86,Python,wechat_jump_game,13918,4622,Python,https://github.com/wangshub/wechat_jump_game,wangshub,30,2020-01-28T22:11:05Z,微信《跳一跳》Python 辅助
87,Python,Awesome-Linux-Software,13855,1425,Python,https://github.com/luong-komorebi/Awesome-Linux-Software,luong-komorebi,15,2020-04-15T06:46:09Z,"A list of awesome applications, software, tools and other materials for Linux distros. "
88,Python,sanic,13702,1263,Python,https://github.com/huge-success/sanic,huge-success,75,2020-04-23T09:58:04Z,Async Python 3.6+ web server/framework | Build fast. Run fast.
89,Python,DeepFaceLab,13616,3167,Python,https://github.com/iperov/DeepFaceLab,iperov,54,2020-04-20T14:40:18Z,DeepFaceLab is the leading software for creating deepfakes.
90,Python,PySnooper,13396,846,Python,https://github.com/cool-RR/PySnooper,cool-RR,14,2020-04-21T11:53:32Z,Never use print for debugging again
91,Python,bokeh,13235,3350,Python,https://github.com/bokeh/bokeh,bokeh,513,2020-04-23T10:17:27Z,"Interactive Data Visualization in the browser, from  Python"
92,Python,luigi,13202,2110,Python,https://github.com/spotify/luigi,spotify,57,2020-04-23T02:18:28Z,"Luigi is a Python module that helps you build complex pipelines of batch jobs. It handles dependency resolution, workflow management, visualization etc. It also comes with Hadoop support built in. "
93,Python,bitcoinbook,13197,3845,Python,https://github.com/bitcoinbook/bitcoinbook,bitcoinbook,88,2020-03-02T10:11:48Z,Mastering Bitcoin 2nd Edition - Programming the Open Blockchain
94,Python,nginx-proxy,12960,2345,Python,https://github.com/nginx-proxy/nginx-proxy,nginx-proxy,597,2020-04-19T13:37:40Z,Automated nginx proxy for Docker containers using docker-gen
95,Python,fastapi,12882,821,Python,https://github.com/tiangolo/fastapi,tiangolo,218,2020-04-23T03:56:57Z,"FastAPI framework, high performance, easy to learn, fast to code, ready for production"
96,Python,examples,12655,5958,Python,https://github.com/pytorch/examples,pytorch,248,2020-04-22T04:17:56Z,"A set of examples around pytorch in Vision, Text, Reinforcement Learning, etc."
97,Python,locust,12550,1782,Python,https://github.com/locustio/locust,locustio,35,2020-04-23T10:24:48Z,Scalable user load testing tool written in Python
98,Python,python-cheatsheet,12517,2504,Python,https://github.com/gto76/python-cheatsheet,gto76,9,2020-04-23T04:30:37Z,Comprehensive Python Cheatsheet
99,Python,CheatSheetSeries,12451,1761,Python,https://github.com/OWASP/CheatSheetSeries,OWASP,46,2020-04-15T18:39:41Z,The OWASP Cheat Sheet Series was created to provide a concise collection of high value information on specific application security topics.
100,Python,fabric,12196,1802,Python,https://github.com/fabric/fabric,fabric,405,2020-04-22T18:23:21Z,"Simple, Pythonic remote execution and deployment."
1,R,ggplot2,4356,1609,R,https://github.com/tidyverse/ggplot2,tidyverse,224,2020-04-22T11:17:22Z,An implementation of the Grammar of Graphics in R
2,R,awesome-R,3966,1304,R,https://github.com/qinwf/awesome-R,qinwf,0,2020-04-11T05:40:21Z,"A curated list of awesome R packages, frameworks and software."
3,R,shiny,3780,1605,R,https://github.com/rstudio/shiny,rstudio,528,2020-04-22T23:00:20Z,Easy interactive web applications with R
4,R,ML_for_Hackers,3549,2239,R,https://github.com/johnmyleswhite/ML_for_Hackers,johnmyleswhite,34,2019-05-26T16:52:29Z,"Code accompanying the book ""Machine Learning for Hackers"""
5,R,dplyr,3288,1227,R,https://github.com/tidyverse/dplyr,tidyverse,47,2020-04-22T18:01:30Z,dplyr: A grammar of data manipulation
6,R,swirl_courses,3216,6464,R,https://github.com/swirldev/swirl_courses,swirldev,137,2019-12-26T19:44:19Z,:mortar_board: A collection of interactive courses for the swirl R package.
7,R,AnomalyDetection,3168,701,R,https://github.com/twitter/AnomalyDetection,twitter,70,2019-08-30T19:49:16Z,Anomaly Detection with R
8,R,r4ds,2334,2915,R,https://github.com/hadley/r4ds,hadley,118,2020-04-21T20:19:31Z,R for data science: a book
9,R,devtools,1936,692,R,https://github.com/r-lib/devtools,r-lib,25,2020-04-09T16:09:28Z,Tools to make an R developer's life easier
10,R,knitr,1910,772,R,https://github.com/yihui/knitr,yihui,104,2020-04-22T20:08:41Z,A general-purpose tool for dynamic report generation in R
11,R,bookdown,1887,828,R,https://github.com/rstudio/bookdown,rstudio,112,2020-04-23T08:33:42Z,Authoring Books and Technical Documents with R Markdown
12,R,awesome-network-analysis,1870,404,R,https://github.com/briatte/awesome-network-analysis,briatte,16,2020-02-17T07:46:46Z,A curated list of awesome network analysis resources.
13,R,benchm-ml,1764,329,R,https://github.com/szilard/benchm-ml,szilard,10,2019-08-19T04:22:47Z,"A minimal benchmark for scalability, speed and accuracy of commonly used open source implementations (R packages, Python scikit-learn, H2O, xgboost, Spark MLlib etc.) of the top machine learning algorithms for binary classification (random forests, gradient boosted trees, deep neural networks etc.)."
