rank,item,repo_name,stars,forks,language,repo_url,username,issues,last_commit,description
1,top-100-stars,freeCodeCamp,303997,22285,JavaScript,https://github.com/freeCodeCamp/freeCodeCamp,freeCodeCamp,1324,2019-07-23T21:50:46Z,The https://www.freeCodeCamp.org open source codebase and curriculum. Learn to code for free together with millions of people.
2,top-100-stars,996.ICU,246744,21358,Rust,https://github.com/996icu/996.ICU,996icu,16709,2019-07-23T11:59:24Z,Repo for counting stars and contributing. Press F to pay respect to glorious developers.
3,top-100-stars,vue,144414,20980,JavaScript,https://github.com/vuejs/vue,vuejs,324,2019-07-23T02:17:54Z,"🖖 Vue.js is a progressive, incrementally-adoptable JavaScript framework for building UI on the web."
4,top-100-stars,tensorflow,131457,76304,C++,https://github.com/tensorflow/tensorflow,tensorflow,2648,2019-07-24T02:53:16Z,An Open Source Machine Learning Framework for Everyone
5,top-100-stars,You-Dont-Know-JS,105473,20916,,https://github.com/getify/You-Dont-Know-JS,getify,261,2019-07-15T12:35:17Z,A book series on JavaScript. @YDKJS on twitter.
6,top-100-stars,javascript,87343,16783,JavaScript,https://github.com/airbnb/javascript,airbnb,142,2019-07-22T16:28:04Z,JavaScript Style Guide
7,top-100-stars,gitignore,86952,43072,,https://github.com/github/gitignore,github,107,2019-07-24T00:52:12Z,A collection of useful .gitignore templates
8,top-100-stars,developer-roadmap,84980,13490,,https://github.com/kamranahmedse/developer-roadmap,kamranahmedse,185,2019-07-11T04:13:41Z,Roadmap to becoming a web developer in 2019
9,top-100-stars,coding-interview-university,80581,23811,,https://github.com/jwasham/coding-interview-university,jwasham,65,2019-07-22T01:26:14Z,A complete computer science study plan to become a software engineer.
10,top-100-stars,vscode,80121,11249,TypeScript,https://github.com/microsoft/vscode,microsoft,6137,2019-07-24T00:47:46Z,Visual Studio Code
11,top-100-stars,react-native,79289,17717,JavaScript,https://github.com/facebook/react-native,facebook,680,2019-07-24T01:45:30Z,A framework for building native apps with React.
12,top-100-stars,CS-Notes,72076,22650,Java,https://github.com/CyC2018/CS-Notes,CyC2018,10,2019-07-22T09:50:30Z,:books: Tech Interview Guide 技术面试必备基础知识、Leetcode 题解、Java、C++、Python、后端面试、操作系统、计算机网络、系统设计
13,top-100-stars,flutter,70973,8387,Dart,https://github.com/flutter/flutter,flutter,6942,2019-07-24T02:51:58Z,Flutter makes it easy and fast to build beautiful mobile apps.
14,top-100-stars,system-design-primer,69634,10876,Python,https://github.com/donnemartin/system-design-primer,donnemartin,105,2019-07-23T16:11:37Z,Learn how to design large-scale systems. Prep for the system design interview.  Includes Anki flashcards.
15,top-100-stars,node,62960,14318,JavaScript,https://github.com/nodejs/node,nodejs,1031,2019-07-24T01:07:38Z,Node.js JavaScript runtime :sparkles::turtle::rocket::sparkles:
16,top-100-stars,axios,62396,5118,JavaScript,https://github.com/axios/axios,axios,696,2019-07-22T14:48:41Z,Promise based HTTP client for the browser and node.js
17,top-100-stars,go,61164,8486,Go,https://github.com/golang/go,golang,4806,2019-07-23T23:44:02Z,The Go programming language
18,top-100-stars,animate.css,60946,12921,CSS,https://github.com/daneden/animate.css,daneden,17,2019-07-14T15:13:44Z,🍿 A cross-browser library of CSS animations. As easy to use as an easy thing.
19,top-100-stars,public-apis,59319,6278,Python,https://github.com/public-apis/public-apis,public-apis,64,2019-07-23T12:31:41Z,A collective list of free APIs for use in software and web development.
20,top-100-stars,kubernetes,55692,19364,Go,https://github.com/kubernetes/kubernetes,kubernetes,3247,2019-07-24T02:32:19Z,Production-Grade Container Scheduling and Management
21,top-100-stars,models,55674,34727,Python,https://github.com/tensorflow/models,tensorflow,1758,2019-07-24T02:05:48Z,Models and examples built with TensorFlow
22,top-100-stars,moby,54238,15646,Go,https://github.com/moby/moby,moby,3747,2019-07-24T02:05:30Z,Moby Project - a collaborative project for the container ecosystem to assemble container-based systems
23,top-100-stars,laravel,53704,16483,PHP,https://github.com/laravel/laravel,laravel,28,2019-07-18T13:20:34Z,A PHP framework for web artisans
24,top-100-stars,three.js,53306,20131,JavaScript,https://github.com/mrdoob/three.js,mrdoob,792,2019-07-24T02:25:45Z,JavaScript 3D library.
25,top-100-stars,jquery,51940,18343,JavaScript,https://github.com/jquery/jquery,jquery,82,2019-07-18T19:25:35Z,jQuery JavaScript Library
26,top-100-stars,Python-100-Days,50694,18810,Jupyter Notebook,https://github.com/jackfrued/Python-100-Days,jackfrued,161,2019-07-23T02:49:11Z,Python - 100天从新手到大师
27,top-100-stars,webpack,50109,6322,JavaScript,https://github.com/webpack/webpack,webpack,506,2019-07-24T02:18:13Z,"A bundler for javascript and friends. Packs many modules into a few bundled assets. Code Splitting allows for loading parts of the application on demand. Through ""loaders"", modules can be CommonJs, AMD, ES6 modules, CSS, Images, JSON, Coffeescript, LESS, ... and your custom stuff."
28,top-100-stars,angular,49803,13696,TypeScript,https://github.com/angular/angular,angular,3074,2019-07-24T00:23:34Z,One framework. Mobile & desktop.
29,top-100-stars,atom,49393,12249,JavaScript,https://github.com/atom/atom,atom,636,2019-07-23T13:35:18Z,:atom: The hackable text editor
30,top-100-stars,ant-design,49360,17462,TypeScript,https://github.com/ant-design/ant-design,ant-design,349,2019-07-24T02:51:34Z,🌈 A UI Design Language
31,top-100-stars,JavaGuide,49219,16043,Java,https://github.com/Snailclimb/JavaGuide,Snailclimb,37,2019-07-24T02:15:53Z,【Java学习+面试指南】 一份涵盖大部分Java程序员所需要掌握的核心知识。
32,top-100-stars,swift,48593,7790,C++,https://github.com/apple/swift,apple,572,2019-07-24T02:56:44Z,The Swift Programming Language
33,top-100-stars,awesome-vue,47179,6561,,https://github.com/vuejs/awesome-vue,vuejs,88,2019-07-23T06:51:17Z,🎉 A curated list of awesome things related to Vue.js
34,top-100-stars,30-seconds-of-code,47088,5309,JavaScript,https://github.com/30-seconds/30-seconds-of-code,30-seconds,8,2019-07-20T16:17:34Z,A curated collection of useful JavaScript snippets that you can understand in 30 seconds or less.
35,top-100-stars,awesome-go,46150,6074,Go,https://github.com/avelino/awesome-go,avelino,45,2019-07-23T16:26:44Z,"A curated list of awesome Go frameworks, libraries and software"
36,top-100-stars,Semantic-UI,45990,4850,JavaScript,https://github.com/Semantic-Org/Semantic-UI,Semantic-Org,919,2019-07-21T20:49:18Z,Semantic is a UI component framework based around useful principles from natural language.
37,top-100-stars,flask,45497,12748,Python,https://github.com/pallets/flask,pallets,17,2019-07-22T20:31:32Z,The Python micro framework for building web applications.
38,top-100-stars,thefuck,44968,2231,Python,https://github.com/nvbn/thefuck,nvbn,165,2019-07-22T02:05:22Z,Magnificent app which corrects your previous console command.
39,top-100-stars,Chart.js,44502,9762,JavaScript,https://github.com/chartjs/Chart.js,chartjs,455,2019-07-21T12:00:13Z,Simple HTML5 Charts using the <canvas> tag
40,top-100-stars,lantern,43765,9485,Go,https://github.com/getlantern/lantern,getlantern,2536,2019-07-15T13:46:59Z,蓝灯Windows下载 https://raw.githubusercontent.com/getlantern/lantern-binaries/master/lantern-installer.exe 蓝灯安卓下载 https://raw.githubusercontent.com/getlantern/lantern-binaries/master/lantern-installer.apk
41,top-100-stars,rails,43692,17572,Ruby,https://github.com/rails/rails,rails,1158,2019-07-23T23:18:27Z,Ruby on Rails
42,top-100-stars,django,42932,18459,Python,https://github.com/django/django,django,216,2019-07-24T02:42:01Z,The Web framework for perfectionists with deadlines.
43,top-100-stars,keras,42894,16352,Python,https://github.com/keras-team/keras,keras-team,2481,2019-07-23T22:52:03Z,Deep Learning for humans
44,top-100-stars,elasticsearch,42852,14351,Java,https://github.com/elastic/elasticsearch,elastic,2095,2019-07-24T02:28:08Z,"Open Source, Distributed, RESTful Search Engine"
45,top-100-stars,httpie,42401,2795,Python,https://github.com/jakubroztocil/httpie,jakubroztocil,161,2019-07-20T11:03:31Z,"As easy as httpie /aitch-tee-tee-pie/ 🥧 Modern command line HTTP client – user-friendly curl alternative with intuitive UI, JSON support, syntax highlighting, wget-like downloads, extensions, etc.  https://twitter.com/clihttp"
46,top-100-stars,moment,41827,6284,JavaScript,https://github.com/moment/moment,moment,357,2019-07-21T14:46:15Z,"Parse, validate, manipulate, and display dates in javascript."
47,top-100-stars,json-server,41560,3709,JavaScript,https://github.com/typicode/json-server,typicode,459,2019-07-19T18:57:37Z,Get a full fake REST API with zero coding in less than 30 seconds (seriously)
48,top-100-stars,Front-end-Developer-Interview-Questions,41554,8390,HTML,https://github.com/h5bp/Front-end-Developer-Interview-Questions,h5bp,7,2019-07-11T03:48:37Z,"A list of helpful front-end related questions you can use to interview potential candidates, test yourself or completely ignore."
49,top-100-stars,awesome-machine-learning,40945,10294,Python,https://github.com/josephmisiti/awesome-machine-learning,josephmisiti,2,2019-07-13T23:43:54Z,"A curated list of awesome Machine Learning frameworks, libraries and software."
50,top-100-stars,lodash,40455,4197,JavaScript,https://github.com/lodash/lodash,lodash,5,2019-07-23T20:58:02Z,"A modern JavaScript utility library delivering modularity, performance, & extras."
51,top-100-stars,spring-boot,40289,26030,Java,https://github.com/spring-projects/spring-boot,spring-projects,391,2019-07-23T19:56:35Z,Spring Boot
52,top-100-stars,RxJava,39901,6720,Java,https://github.com/ReactiveX/RxJava,ReactiveX,15,2019-07-23T16:13:37Z,RxJava – Reactive Extensions for the JVM – a library for composing asynchronous and event-based programs using observable sequences for the Java VM.
53,top-100-stars,netdata,39780,3536,C,https://github.com/netdata/netdata,netdata,542,2019-07-24T02:59:18Z,"Real-time performance monitoring, done right! https://my-netdata.io/"
54,top-100-stars,requests,39478,7200,Python,https://github.com/psf/requests,psf,246,2019-07-23T18:36:50Z,Python HTTP Requests for Humans™ ✨🍰✨
55,top-100-stars,bitcoin,39421,23710,C++,https://github.com/bitcoin/bitcoin,bitcoin,970,2019-07-24T01:18:33Z,Bitcoin Core integration/staging tree
56,top-100-stars,next.js,39309,4812,JavaScript,https://github.com/zeit/next.js,zeit,272,2019-07-24T01:49:32Z,The React Framework
57,top-100-stars,ionic,38647,13077,TypeScript,https://github.com/ionic-team/ionic,ionic-team,656,2019-07-24T00:44:43Z,Build amazing native and progressive web apps with open web technologies. One app running on everything 🎉
58,top-100-stars,material-design-icons,38417,7858,CSS,https://github.com/google/material-design-icons,google,555,2019-07-12T22:54:47Z,Material Design icons by Google
59,top-100-stars,jekyll,38245,8339,Ruby,https://github.com/jekyll/jekyll,jekyll,140,2019-07-23T14:43:48Z,:globe_with_meridians: Jekyll is a blog-aware static site generator in Ruby
60,top-100-stars,redis,37677,14521,C,https://github.com/antirez/redis,antirez,2315,2019-07-23T15:07:52Z,"Redis is an in-memory database that persists on disk. The data model is key-value, but many different kind of values are supported: Strings, Lists, Sets, Sorted Sets, Hashes, HyperLogLogs, Bitmaps."
61,top-100-stars,vue-element-admin,37554,12370,Vue,https://github.com/PanJiaChen/vue-element-admin,PanJiaChen,290,2019-07-20T03:53:12Z,:tada: A magical vue admin                                                                https://panjiachen.github.io/vue-element-admin
62,top-100-stars,react-router,37017,7563,JavaScript,https://github.com/ReactTraining/react-router,ReactTraining,59,2019-07-23T14:07:10Z,Declarative routing for React
63,top-100-stars,FiraCode,36892,1187,Clojure,https://github.com/tonsky/FiraCode,tonsky,203,2019-07-16T14:45:23Z,Monospaced font with programming ligatures
64,top-100-stars,hugo,36871,4118,Go,https://github.com/gohugoio/hugo,gohugoio,378,2019-07-23T22:09:29Z,The world’s fastest framework for building websites.
65,top-100-stars,interviews,36717,7503,Java,https://github.com/kdn251/interviews,kdn251,43,2019-06-25T17:24:26Z,Everything you need to know to get the job.
66,top-100-stars,yarn,36374,2236,JavaScript,https://github.com/yarnpkg/yarn,yarnpkg,1905,2019-07-24T00:51:37Z,"📦🐈 Fast, reliable, and secure dependency management."
67,top-100-stars,LeetCodeAnimation,36266,5961,Java,https://github.com/MisterBooo/LeetCodeAnimation,MisterBooo,0,2019-07-17T07:05:11Z,Demonstrate all the questions on LeetCode in the form of animation.（用动画的形式呈现解LeetCode题目的思路）
68,top-100-stars,scikit-learn,36245,17770,Python,https://github.com/scikit-learn/scikit-learn,scikit-learn,1959,2019-07-24T02:50:59Z,scikit-learn: machine learning in Python
69,top-100-stars,materialize,36155,4816,JavaScript,https://github.com/Dogfalo/materialize,Dogfalo,688,2019-07-22T18:04:37Z,"Materialize, a CSS Framework based on Material Design"
70,top-100-stars,nvm,36068,3401,Shell,https://github.com/nvm-sh/nvm,nvm-sh,285,2019-07-23T19:13:55Z,Node Version Manager - Simple bash script to manage multiple active node.js versions
71,top-100-stars,architect-awesome,35957,11114,,https://github.com/xingshaocheng/architect-awesome,xingshaocheng,41,2019-06-28T04:31:01Z,后端架构师技术图谱
72,top-100-stars,bulma,35811,2890,CSS,https://github.com/jgthms/bulma,jgthms,298,2019-07-24T00:42:44Z,Modern CSS framework based on Flexbox
73,top-100-stars,hacker-scripts,35753,6020,JavaScript,https://github.com/NARKOZ/hacker-scripts,NARKOZ,55,2019-05-02T05:23:36Z,Based on a true story
74,top-100-stars,incubator-echarts,35475,10665,JavaScript,https://github.com/apache/incubator-echarts,apache,2934,2019-07-24T02:25:28Z,"A powerful, interactive charting and visualization library for browser"
75,top-100-stars,node-v0.x-archive,35440,7775,,https://github.com/nodejs/node-v0.x-archive,nodejs,571,2018-04-04T08:28:02Z,Moved to https://github.com/nodejs/node
76,top-100-stars,papers-we-love,35437,3343,,https://github.com/papers-we-love/papers-we-love,papers-we-love,13,2019-07-15T11:12:20Z,Papers from the computer science community to read and discuss.
77,top-100-stars,awesome-android-ui,35386,9176,,https://github.com/wasabeef/awesome-android-ui,wasabeef,30,2019-06-19T02:03:03Z,A curated list of awesome Android UI/UX libraries
78,top-100-stars,freecodecamp.cn,35119,1320,CSS,https://github.com/FreeCodeCampChina/freecodecamp.cn,FreeCodeCampChina,127,2019-07-18T10:44:43Z,The FreeCodeCamp.cn(FCC China) open source codebase and curriculum. Learn to code and help nonprofits.
79,top-100-stars,awesome-public-datasets,34244,5834,,https://github.com/awesomedata/awesome-public-datasets,awesomedata,95,2019-07-02T11:13:30Z,A topic-centric list of HQ open datasets. PR ☛☛☛
80,top-100-stars,x64dbg,34060,1052,C++,https://github.com/x64dbg/x64dbg,x64dbg,377,2019-07-12T01:01:27Z,An open-source x64/x32 debugger for windows.
81,top-100-stars,babel,33970,3650,JavaScript,https://github.com/babel/babel,babel,794,2019-07-23T18:41:39Z,🐠 Babel is a compiler for writing next generation JavaScript.
82,top-100-stars,scrapy,33703,7921,Python,https://github.com/scrapy/scrapy,scrapy,757,2019-07-23T23:11:46Z,"Scrapy, a fast high-level web crawling & scraping framework for Python."
83,top-100-stars,android-architecture,33468,9353,Kotlin,https://github.com/googlesamples/android-architecture,googlesamples,124,2019-07-22T17:46:05Z,A collection of samples to discuss and showcase different architectural tools and patterns for Android apps.
84,top-100-stars,retrofit,33133,6152,Java,https://github.com/square/retrofit,square,71,2019-07-23T23:48:52Z,"Type-safe HTTP client for Android and Java by Square, Inc."
85,top-100-stars,prettier,32859,1836,JavaScript,https://github.com/prettier/prettier,prettier,667,2019-07-23T00:50:14Z,Prettier is an opinionated code formatter.
86,top-100-stars,awesome-ios,32407,5438,Swift,https://github.com/vsouza/awesome-ios,vsouza,0,2019-07-21T14:49:55Z,"A curated list of awesome iOS ecosystem, including Objective-C and Swift Projects "
87,top-100-stars,AFNetworking,32297,9800,Objective-C,https://github.com/AFNetworking/AFNetworking,AFNetworking,393,2019-07-20T13:01:15Z,"A delightful networking framework for iOS, macOS, watchOS, and tvOS."
88,top-100-stars,awesome-react,32264,3736,,https://github.com/enaqx/awesome-react,enaqx,11,2019-07-23T14:42:05Z,A collection of awesome things regarding React ecosystem
89,top-100-stars,anime,31823,2364,JavaScript,https://github.com/juliangarnier/anime,juliangarnier,100,2019-07-23T14:04:24Z,JavaScript animation engine
90,top-100-stars,awesome-nodejs,31705,3864,,https://github.com/sindresorhus/awesome-nodejs,sindresorhus,9,2019-07-23T06:32:08Z,:zap: Delightful Node.js packages and resources
91,top-100-stars,nodebestpractices,31507,2528,JavaScript,https://github.com/i0natan/nodebestpractices,i0natan,38,2019-07-23T12:42:16Z,:white_check_mark: The largest Node.js best practices list (July 2019)
92,top-100-stars,Alamofire,31479,5638,Swift,https://github.com/Alamofire/Alamofire,Alamofire,41,2019-07-23T13:58:44Z,Elegant HTTP Networking in Swift
93,top-100-stars,material-design-lite,31339,5323,HTML,https://github.com/google/material-design-lite,google,364,2019-02-05T08:00:36Z,Material Design Components in HTML/CSS/JS
94,top-100-stars,gulp,31334,4413,JavaScript,https://github.com/gulpjs/gulp,gulpjs,21,2019-07-19T08:13:03Z,The streaming build system
95,top-100-stars,build-web-application-with-golang,31302,8677,Go,https://github.com/astaxie/build-web-application-with-golang,astaxie,103,2019-07-23T14:46:48Z,A golang ebook intro how to build a web with golang
96,top-100-stars,spring-framework,30940,19882,Java,https://github.com/spring-projects/spring-framework,spring-projects,971,2019-07-23T15:59:49Z,Spring Framework
97,top-100-stars,Ghost,30462,6576,JavaScript,https://github.com/TryGhost/Ghost,TryGhost,87,2019-07-23T11:20:36Z,👻 The most popular headless Node.js CMS for professional publishing
98,top-100-stars,hyper,30425,2492,JavaScript,https://github.com/zeit/hyper,zeit,869,2019-07-11T13:18:50Z,A terminal built on web technologies
99,top-100-stars,awesome-mac,30268,3475,JavaScript,https://github.com/jaywcjlove/awesome-mac,jaywcjlove,38,2019-07-19T14:06:51Z," Now we have become very big, Different from the original idea. Collect premium software in various categories."
100,top-100-stars,awesome-courses,30219,6232,,https://github.com/prakhar1989/awesome-courses,prakhar1989,40,2019-05-08T21:26:26Z,:books: List of awesome university courses for learning Computer Science!
1,top-100-forks,datasharing,4796,196124,,https://github.com/jtleek/datasharing,jtleek,452,2019-07-11T17:01:41Z,The Leek group guide to data sharing 
2,top-100-forks,ProgrammingAssignment2,597,117449,R,https://github.com/rdpeng/ProgrammingAssignment2,rdpeng,2800,2019-07-23T20:44:59Z,Repository for Programming Assignment 2 for R Programming on Coursera
3,top-100-forks,Spoon-Knife,10145,104926,HTML,https://github.com/octocat/Spoon-Knife,octocat,13702,2019-07-24T02:45:29Z,This repo is for demonstration purposes only.
4,top-100-forks,bootstrap,134779,66248,JavaScript,https://github.com/twbs/bootstrap,twbs,354,2019-07-23T22:59:57Z,"The most popular HTML, CSS, and JavaScript framework for developing responsive, mobile first projects on the web."
5,top-100-forks,SmartThingsPublic,1327,57715,Groovy,https://github.com/SmartThingsCommunity/SmartThingsPublic,SmartThingsCommunity,1279,2019-07-24T02:58:21Z,SmartThings open-source DeviceTypeHandlers and SmartApps code
6,top-100-forks,ExData_Plotting1,174,49880,,https://github.com/rdpeng/ExData_Plotting1,rdpeng,612,2019-07-19T00:43:41Z,Plotting Assignment 1 for Exploratory Data Analysis
7,top-100-forks,models,55674,34727,Python,https://github.com/tensorflow/models,tensorflow,1758,2019-07-24T02:05:48Z,Models and examples built with TensorFlow
8,top-100-forks,RepData_PeerAssessment1,76,31952,,https://github.com/rdpeng/RepData_PeerAssessment1,rdpeng,273,2019-07-19T22:57:09Z,Peer Assessment 1 for Reproducible Research
9,top-100-forks,free-programming-books,125748,31392,,https://github.com/EbookFoundation/free-programming-books,EbookFoundation,41,2019-07-23T20:19:09Z,:books: Freely available programming books
10,top-100-forks,cgm-remote-monitor,850,29978,JavaScript,https://github.com/nightscout/cgm-remote-monitor,nightscout,223,2019-07-23T23:10:45Z,nightscout web monitor
11,top-100-forks,courses,3253,27797,HTML,https://github.com/DataScienceSpecialization/courses,DataScienceSpecialization,93,2019-06-11T17:55:24Z,Course materials for the Data Science Specialization: https://www.coursera.org/specialization/jhudatascience/1
12,top-100-forks,opencv,36765,27068,C++,https://github.com/opencv/opencv,opencv,1749,2019-07-24T02:47:32Z,Open Source Computer Vision Library
13,top-100-forks,jekyll-now,6155,24949,CSS,https://github.com/barryclark/jekyll-now,barryclark,210,2019-07-23T15:14:32Z,"Build a Jekyll blog in minutes, without touching the command line."
14,top-100-forks,react,133138,24702,JavaScript,https://github.com/facebook/react,facebook,783,2019-07-24T02:08:42Z,"A declarative, efficient, and flexible JavaScript library for building user interfaces."
15,top-100-forks,patchwork,897,24290,HTML,https://github.com/jlord/patchwork,jlord,790,2019-07-23T21:45:28Z,All the Git-it Workshop completers! 
16,top-100-forks,coding-interview-university,80581,23811,,https://github.com/jwasham/coding-interview-university,jwasham,65,2019-07-22T01:26:14Z,A complete computer science study plan to become a software engineer.
17,top-100-forks,recipes,65,22727,,https://github.com/LarryMad/recipes,LarryMad,2233,2019-07-22T18:54:43Z,
18,top-100-forks,CS-Notes,72076,22650,Java,https://github.com/CyC2018/CS-Notes,CyC2018,10,2019-07-22T09:50:30Z,:books: Tech Interview Guide 技术面试必备基础知识、Leetcode 题解、Java、C++、Python、后端面试、操作系统、计算机网络、系统设计
19,top-100-forks,freeCodeCamp,303997,22285,JavaScript,https://github.com/freeCodeCamp/freeCodeCamp,freeCodeCamp,1324,2019-07-23T21:50:46Z,The https://www.freeCodeCamp.org open source codebase and curriculum. Learn to code for free together with millions of people.
20,top-100-forks,996.ICU,246744,21358,Rust,https://github.com/996icu/996.ICU,996icu,16709,2019-07-23T11:59:24Z,Repo for counting stars and contributing. Press F to pay respect to glorious developers.
21,top-100-forks,d3,86163,21041,JavaScript,https://github.com/d3/d3,d3,9,2019-06-28T04:35:43Z,"Bring data to life with SVG, Canvas and HTML. :bar_chart::chart_with_upwards_trend::tada:"
22,top-100-forks,You-Dont-Know-JS,105473,20916,,https://github.com/getify/You-Dont-Know-JS,getify,261,2019-07-15T12:35:17Z,A book series on JavaScript. @YDKJS on twitter.
23,top-100-forks,three.js,53306,20131,JavaScript,https://github.com/mrdoob/three.js,mrdoob,792,2019-07-24T02:25:45Z,JavaScript 3D library.
24,top-100-forks,spring-framework,30940,19882,Java,https://github.com/spring-projects/spring-framework,spring-projects,971,2019-07-23T15:59:49Z,Spring Framework
25,top-100-forks,spark,22717,19571,Scala,https://github.com/apache/spark,apache,516,2019-07-24T02:41:04Z,Apache Spark
26,top-100-forks,kubernetes,55692,19364,Go,https://github.com/kubernetes/kubernetes,kubernetes,3247,2019-07-24T02:32:19Z,Production-Grade Container Scheduling and Management
27,top-100-forks,shadowsocks,30869,18827,Python,https://github.com/shadowsocks/shadowsocks,shadowsocks,448,2019-06-14T03:17:23Z,
28,top-100-forks,Python-100-Days,50694,18810,Jupyter Notebook,https://github.com/jackfrued/Python-100-Days,jackfrued,161,2019-07-23T02:49:11Z,Python - 100天从新手到大师
29,top-100-forks,dubbo,28103,18478,Java,https://github.com/apache/dubbo,apache,505,2019-07-24T02:39:10Z,"Apache Dubbo is a high-performance, java based, open source RPC framework."
30,top-100-forks,jquery,51940,18343,JavaScript,https://github.com/jquery/jquery,jquery,82,2019-07-18T19:25:35Z,jQuery JavaScript Library
31,top-100-forks,Complete-Python-3-Bootcamp,4981,18256,Jupyter Notebook,https://github.com/Pierian-Data/Complete-Python-3-Bootcamp,Pierian-Data,37,2019-07-04T02:33:06Z,Course Files for Complete Python 3 Bootcamp Course on Udemy
32,top-100-forks,DefinitelyTyped,23323,18227,TypeScript,https://github.com/DefinitelyTyped/DefinitelyTyped,DefinitelyTyped,2922,2019-07-24T02:21:22Z,The repository for high quality TypeScript type definitions.
33,top-100-forks,first-contributions,7201,18004,,https://github.com/firstcontributions/first-contributions,firstcontributions,1197,2019-07-24T02:34:36Z,🚀✨ Help beginners to contribute to open source projects
34,top-100-forks,ant-design,49360,17462,TypeScript,https://github.com/ant-design/ant-design,ant-design,349,2019-07-24T02:51:34Z,🌈 A UI Design Language
35,top-100-forks,caffe,28605,17297,C++,https://github.com/BVLC/caffe,BVLC,1031,2019-07-10T10:59:07Z,Caffe: a fast open framework for deep learning.
36,top-100-forks,free-programming-books-zh_CN,52727,17165,,https://github.com/justjavac/free-programming-books-zh_CN,justjavac,164,2019-07-20T02:55:30Z,:books: 免费的计算机编程类中文书籍，欢迎投稿
37,top-100-forks,git,28391,16388,C,https://github.com/git/git,git,56,2019-07-23T22:37:27Z,Git Source Code Mirror - This is a publish-only repository and all pull requests are ignored. Please follow Documentation/SubmittingPatches procedure for any of your improvements.
