rank,item,repo_name,stars,forks,language,repo_url,username,issues,last_commit,description
1,top-100-stars,vue,135016,19168,JavaScript,https://github.com/vuejs/vue,vuejs,254,2019-04-10T03:02:33Z,"🖖 Vue.js is a progressive, incrementally-adoptable JavaScript framework for building UI on the web."
2,top-100-stars,bootstrap,132388,64755,JavaScript,https://github.com/twbs/bootstrap,twbs,382,2019-04-09T23:55:59Z,"The most popular HTML, CSS, and JavaScript framework for developing responsive, mobile first projects on the web."
3,top-100-stars,react,126659,23028,JavaScript,https://github.com/facebook/react,facebook,641,2019-04-10T01:59:40Z,"A declarative, efficient, and flexible JavaScript library for building user interfaces."
4,top-100-stars,tensorflow,125122,73626,C++,https://github.com/tensorflow/tensorflow,tensorflow,2439,2019-04-10T03:56:59Z,An Open Source Machine Learning Framework for Everyone
5,top-100-stars,free-programming-books,121150,30189,,https://github.com/EbookFoundation/free-programming-books,EbookFoundation,28,2019-04-09T18:42:18Z,:books: Freely available programming books
6,top-100-stars,oh-my-zsh,86184,16385,Shell,https://github.com/robbyrussell/oh-my-zsh,robbyrussell,755,2019-04-09T21:10:14Z,"A delightful community-driven (with 1,300+ contributors) framework for managing your zsh configuration. Includes 200+ optional plugins (rails, git, OSX, hub, capistrano, brew, ant, php, python, etc), over 140 themes to spice up your morning, and an auto-update tool so that makes it easy to keep up with the latest updates from the community."
7,top-100-stars,javascript,83824,16029,JavaScript,https://github.com/airbnb/javascript,airbnb,135,2019-03-17T13:59:26Z,JavaScript Style Guide
8,top-100-stars,developer-roadmap,78209,12256,,https://github.com/kamranahmedse/developer-roadmap,kamranahmedse,174,2019-03-30T07:36:24Z,Roadmap to becoming a web developer in 2019
9,top-100-stars,coding-interview-university,76251,22333,,https://github.com/jwasham/coding-interview-university,jwasham,61,2019-04-09T02:28:35Z,A complete computer science study plan to become a software engineer.
10,top-100-stars,react-native,75906,16926,JavaScript,https://github.com/facebook/react-native,facebook,462,2019-04-10T03:22:44Z,A framework for building native apps with React.
11,top-100-stars,linux,72534,25653,C,https://github.com/torvalds/linux,torvalds,263,2019-04-10T03:44:09Z,Linux kernel source tree
12,top-100-stars,create-react-app,66045,14728,JavaScript,https://github.com/facebook/create-react-app,facebook,331,2019-04-09T21:34:29Z,Set up a modern web app by running one command.
13,top-100-stars,awesome-python,65528,12624,Python,https://github.com/vinta/awesome-python,vinta,486,2019-04-08T17:45:53Z,"A curated list of awesome Python frameworks, libraries, software and resources"
14,top-100-stars,system-design-primer,61064,9056,Python,https://github.com/donnemartin/system-design-primer,donnemartin,76,2019-04-10T00:47:01Z,Learn how to design large-scale systems. Prep for the system design interview.  Includes Anki flashcards.
15,top-100-stars,node,59971,13342,JavaScript,https://github.com/nodejs/node,nodejs,844,2019-04-10T03:53:39Z,Node.js JavaScript runtime :sparkles::turtle::rocket::sparkles:
16,top-100-stars,angular.js,59478,28920,JavaScript,https://github.com/angular/angular.js,angular,460,2019-04-09T22:35:49Z,AngularJS - HTML enhanced for web apps!
17,top-100-stars,Font-Awesome,59449,10026,JavaScript,https://github.com/FortAwesome/Font-Awesome,FortAwesome,4814,2019-03-29T20:56:54Z,"The iconic SVG, font, and CSS toolkit"
18,top-100-stars,animate.css,58692,12453,CSS,https://github.com/daneden/animate.css,daneden,19,2019-04-03T10:25:56Z,🍿 A cross-browser library of CSS animations. As easy to use as an easy thing.
19,top-100-stars,three.js,50392,18916,JavaScript,https://github.com/mrdoob/three.js,mrdoob,862,2019-04-09T23:29:35Z,JavaScript 3D library.
20,top-100-stars,youtube-dl,49010,8508,Python,https://github.com/ytdl-org/youtube-dl,ytdl-org,2773,2019-04-09T14:22:31Z,Command-line program to download videos from YouTube.com and other video sites
21,top-100-stars,redux,47950,12243,JavaScript,https://github.com/reduxjs/redux,reduxjs,30,2019-04-08T23:41:52Z,Predictable state container for JavaScript apps
22,top-100-stars,javascript-algorithms,47434,6626,JavaScript,https://github.com/trekhleb/javascript-algorithms,trekhleb,84,2019-04-07T01:55:07Z,📝 Algorithms and data structures implemented in JavaScript with explanations and links to further readings
23,top-100-stars,reveal.js,45631,13176,JavaScript,https://github.com/hakimel/reveal.js,hakimel,425,2019-04-08T08:36:40Z,The HTML Presentation Framework
24,top-100-stars,Chart.js,42840,9476,JavaScript,https://github.com/chartjs/Chart.js,chartjs,450,2019-04-08T07:43:13Z,Simple HTML5 Charts using the <canvas> tag
25,top-100-stars,thefuck,42592,2119,Python,https://github.com/nvbn/thefuck,nvbn,152,2019-04-09T16:08:01Z,Magnificent app which corrects your previous console command.
26,top-100-stars,lantern,41234,9036,Go,https://github.com/getlantern/lantern,getlantern,2543,2019-04-07T03:13:53Z,🔴蓝灯最新版本下载 https://github.com/getlantern/download 🔴 Lantern Latest Download https://github.com/getlantern/download 🔴
27,top-100-stars,meteor,40941,5033,JavaScript,https://github.com/meteor/meteor,meteor,300,2019-04-09T23:01:15Z,"Meteor, the JavaScript App Platform"
28,top-100-stars,computer-science,39908,5748,,https://github.com/ossu/computer-science,ossu,34,2019-04-03T04:20:49Z,:mortar_board: Path to a free self-taught education in Computer Science!
29,top-100-stars,the-art-of-command-line,39868,3941,,https://github.com/jlevy/the-art-of-command-line,jlevy,106,2019-04-01T14:31:08Z,"Master the command line, in one page"
30,top-100-stars,RxJava,38406,6497,Java,https://github.com/ReactiveX/RxJava,ReactiveX,31,2019-04-04T19:11:36Z,RxJava – Reactive Extensions for the JVM – a library for composing asynchronous and event-based programs using observable sequences for the Java VM.
31,top-100-stars,jekyll,37344,8128,Ruby,https://github.com/jekyll/jekyll,jekyll,138,2019-04-07T11:56:44Z,:globe_with_meridians: Jekyll is a blog-aware static site generator in Ruby
32,top-100-stars,ansible,36388,15030,Python,https://github.com/ansible/ansible,ansible,5521,2019-04-10T03:59:51Z,"Ansible is a radically simple IT automation platform that makes your applications and systems easier to deploy. Avoid writing scripts or custom code to deploy and update your applications — automate in a language that approaches plain English, using SSH, with no agents to install on remote systems. https://docs.ansible.com/ansible/"
33,top-100-stars,react-router,35733,7337,JavaScript,https://github.com/ReactTraining/react-router,ReactTraining,61,2019-04-09T23:49:53Z,Declarative routing for React
34,top-100-stars,shadowsocks-windows,35596,12132,C#,https://github.com/shadowsocks/shadowsocks-windows,shadowsocks,137,2019-04-09T10:31:14Z,"If you want to keep a secret, you must also hide it from yourself."
35,top-100-stars,materialize,35494,4745,JavaScript,https://github.com/Dogfalo/materialize,Dogfalo,636,2019-04-08T18:44:43Z,"Materialize, a CSS Framework based on Material Design"
36,top-100-stars,nw.js,35236,3786,C++,https://github.com/nwjs/nw.js,nwjs,745,2019-04-10T03:09:54Z,Call all Node.js modules directly from DOM/WebWorker and enable a new way of writing applications with all Web technologies.
37,top-100-stars,rust,35220,5624,Rust,https://github.com/rust-lang/rust,rust-lang,4797,2019-04-10T04:00:50Z,Empowering everyone to build reliable and efficient software.
38,top-100-stars,scikit-learn,34374,16824,Python,https://github.com/scikit-learn/scikit-learn,scikit-learn,1920,2019-04-10T01:34:51Z,scikit-learn: machine learning in Python
39,top-100-stars,awesome-android-ui,34162,8921,,https://github.com/wasabeef/awesome-android-ui,wasabeef,27,2019-03-15T20:35:19Z,A curated list of awesome Android UI/UX libraries
40,top-100-stars,papers-we-love,34109,3210,,https://github.com/papers-we-love/papers-we-love,papers-we-love,12,2019-04-05T00:26:26Z,Papers from the computer science community to read and discuss.
41,top-100-stars,x64dbg,33801,969,C++,https://github.com/x64dbg/x64dbg,x64dbg,368,2019-04-09T17:44:00Z,An open-source x64/x32 debugger for windows.
42,top-100-stars,gatsby,33609,4691,JavaScript,https://github.com/gatsbyjs/gatsby,gatsbyjs,515,2019-04-10T00:51:02Z,"Build blazing fast, modern apps and websites with React"
43,top-100-stars,protobuf,33327,9079,C++,https://github.com/protocolbuffers/protobuf,protocolbuffers,611,2019-04-10T03:05:58Z,Protocol Buffers - Google's data interchange format
44,top-100-stars,FiraCode,32938,1022,Clojure,https://github.com/tonsky/FiraCode,tonsky,192,2019-04-09T13:27:38Z,Monospaced font with programming ligatures
45,top-100-stars,deno,32794,1554,TypeScript,https://github.com/denoland/deno,denoland,204,2019-04-10T02:46:09Z,"A secure JavaScript/TypeScript runtime built with V8, Rust, and Tokio"
46,top-100-stars,big-list-of-naughty-strings,32311,1366,Python,https://github.com/minimaxir/big-list-of-naughty-strings,minimaxir,71,2019-03-03T04:08:47Z,The Big List of Naughty Strings is a list of strings which have a high probability of causing issues when used as user-input data.
47,top-100-stars,awesome-public-datasets,32172,5432,,https://github.com/awesomedata/awesome-public-datasets,awesomedata,90,2019-04-09T15:42:40Z,A topic-centric list of HQ open datasets. PR ☛☛☛
48,top-100-stars,AFNetworking,32063,9743,Objective-C,https://github.com/AFNetworking/AFNetworking,AFNetworking,363,2019-04-09T14:38:33Z,"A delightful networking framework for iOS, macOS, watchOS, and tvOS."
49,top-100-stars,prettier,31292,1694,JavaScript,https://github.com/prettier/prettier,prettier,607,2019-04-08T19:56:40Z,Prettier is an opinionated code formatter.
50,top-100-stars,parcel,30894,1395,JavaScript,https://github.com/parcel-bundler/parcel,parcel-bundler,654,2019-04-09T22:02:53Z,"📦🚀 Blazing fast, zero configuration web application bundler"
51,top-100-stars,awesome-react,30771,3563,,https://github.com/enaqx/awesome-react,enaqx,64,2019-04-08T16:41:03Z,A collection of awesome things regarding React ecosystem.
52,top-100-stars,awesome-selfhosted,30618,2483,JavaScript,https://github.com/Kickball/awesome-selfhosted,Kickball,48,2019-04-08T00:00:21Z,This is a list of Free Software network services and web applications which can be hosted locally. Selfhosting is the process of locally hosting and managing applications instead of renting from SaaS providers.
53,top-100-stars,vue-element-admin,30581,9635,Vue,https://github.com/PanJiaChen/vue-element-admin,PanJiaChen,115,2019-04-10T02:40:38Z,:tada: A magical vue admin                                                                http://panjiachen.github.io/vue-element-admin
54,top-100-stars,jQuery-File-Upload,29868,7963,JavaScript,https://github.com/blueimp/jQuery-File-Upload,blueimp,52,2019-03-06T15:19:04Z,"File Upload widget with multiple file selection, drag&drop support, progress bar, validation and preview images, audio and video for jQuery. Supports cross-domain, chunked and resumable file uploads. Works with any server-side platform (Google App Engine, PHP, Python, Ruby on Rails, Java, etc.) that supports standard HTML form file uploads."
55,top-100-stars,Apollo-11,29826,3741,Assembly,https://github.com/chrislgarry/Apollo-11,chrislgarry,42,2019-03-31T08:22:28Z,Original Apollo 11 Guidance Computer (AGC) source code for the command and lunar modules.
56,top-100-stars,git-flight-rules,29538,1956,,https://github.com/k88hudson/git-flight-rules,k88hudson,11,2019-01-30T08:11:57Z,Flight rules for git
57,top-100-stars,serverless,29279,3217,JavaScript,https://github.com/serverless/serverless,serverless,468,2019-04-09T11:38:17Z,"Serverless Framework – Build web, mobile and IoT applications with serverless architectures using AWS Lambda, Azure Functions, Google CloudFunctions & more! – "
58,top-100-stars,Awesome-Hacking,28878,4603,,https://github.com/Hack-with-Github/Awesome-Hacking,Hack-with-Github,2,2019-04-02T09:48:57Z,"A collection of various awesome lists for hackers, pentesters and security researchers"
59,top-100-stars,legacy-homebrew,28163,12610,,https://github.com/Homebrew/legacy-homebrew,Homebrew,0,2019-01-23T20:38:00Z,💀 The former home of Homebrew/homebrew (deprecated)
60,top-100-stars,foundation-sites,28060,5793,HTML,https://github.com/zurb/foundation-sites,zurb,413,2019-04-09T20:39:06Z,The most advanced responsive front-end framework in the world. Quickly create prototypes and production code for sites that work on any kind of device.
61,top-100-stars,grafana,27984,5182,TypeScript,https://github.com/grafana/grafana,grafana,1738,2019-04-09T23:04:04Z,"The tool for beautiful monitoring and metric analytics & dashboards for Graphite, InfluxDB & Prometheus & More"
62,top-100-stars,discourse,27920,6377,Ruby,https://github.com/discourse/discourse,discourse,19,2019-04-10T00:44:59Z,"A platform for community discussion. Free, open, simple."
63,top-100-stars,nocode,27859,2386,Dockerfile,https://github.com/kelseyhightower/nocode,kelseyhightower,2644,2019-04-04T18:44:21Z,The best way to write secure and reliable applications. Write nothing; deploy nowhere.
64,top-100-stars,AdminLTE,27833,10992,HTML,https://github.com/ColorlibHQ/AdminLTE,ColorlibHQ,348,2019-04-08T10:48:40Z,AdminLTE - Free Premium Admin control Panel Theme Based On Bootstrap 3.x
65,top-100-stars,caffe,27765,16698,C++,https://github.com/BVLC/caffe,BVLC,983,2019-03-20T16:21:57Z,Caffe: a fast open framework for deep learning.
66,top-100-stars,awesome-mac,27351,3195,JavaScript,https://github.com/jaywcjlove/awesome-mac,jaywcjlove,35,2019-04-05T12:50:37Z," Now we have become very big, Different from the original idea. Collect premium software in various categories."
67,top-100-stars,immutable-js,26995,1574,JavaScript,https://github.com/immutable-js/immutable-js,immutable-js,123,2019-03-08T14:05:52Z,Immutable persistent data collections for Javascript which increase efficiency and simplicity.
68,top-100-stars,git,26943,15472,C,https://github.com/git/git,git,178,2019-04-09T18:06:56Z,Git Source Code Mirror - This is a publish-only repository and all pull requests are ignored. Please follow Documentation/SubmittingPatches procedure for any of your improvements.
69,top-100-stars,33-js-concepts,26862,2525,JavaScript,https://github.com/leonardomso/33-js-concepts,leonardomso,5,2019-04-02T11:54:44Z,📜 33 concepts every JavaScript developer should know.
70,top-100-stars,nodebestpractices,26820,2045,JavaScript,https://github.com/i0natan/nodebestpractices,i0natan,33,2019-04-09T19:09:15Z,:white_check_mark: The largest Node.js best practices list (April 2019)
71,top-100-stars,tech-interview-handbook,26817,3595,JavaScript,https://github.com/yangshun/tech-interview-handbook,yangshun,7,2019-04-03T16:18:01Z,"💯 Algorithms study materials, behavioral content and tips for rocking your coding interview"
72,top-100-stars,phantomjs,26683,5650,HTML,https://github.com/ariya/phantomjs,ariya,1823,2018-09-13T22:03:20Z,Scriptable Headless Browser
73,top-100-stars,MPAndroidChart,26659,6957,Java,https://github.com/PhilJay/MPAndroidChart,PhilJay,1427,2019-04-07T14:37:15Z,"A powerful 🚀 Android chart view / graph view library, supporting line- bar- pie- radar- bubble- and candlestick charts as well as scaling, dragging and animations."
74,top-100-stars,hackathon-starter,26282,5283,JavaScript,https://github.com/sahat/hackathon-starter,sahat,14,2019-04-08T04:39:04Z,A boilerplate for Node.js web applications
75,top-100-stars,pdf.js,26131,6258,JavaScript,https://github.com/mozilla/pdf.js,mozilla,602,2019-04-10T01:05:36Z,PDF Reader in JavaScript
76,top-100-stars,hexo,25983,3477,JavaScript,https://github.com/hexojs/hexo,hexojs,212,2019-04-06T16:11:21Z,"A fast, simple & powerful blog framework, powered by Node.js."
77,top-100-stars,frontend-dev-bookmarks,25695,4206,,https://github.com/dypsilon/frontend-dev-bookmarks,dypsilon,108,2019-04-03T09:57:10Z,Manually curated collection of resources for frontend web developers.
78,top-100-stars,clipboard.js,25632,2947,JavaScript,https://github.com/zenorocha/clipboard.js,zenorocha,48,2019-03-26T10:59:33Z,:scissors: Modern copy to clipboard. No Flash. Just 3kb gzipped :clipboard:
79,top-100-stars,glide,25508,4783,Java,https://github.com/bumptech/glide,bumptech,138,2019-04-02T02:14:37Z,An image loading and caching library for Android focused on smooth scrolling
80,top-100-stars,async,25421,2309,JavaScript,https://github.com/caolan/async,caolan,7,2019-04-07T22:25:08Z,Async utilities for node and the browser
81,top-100-stars,android_guides,25207,6110,,https://github.com/codepath/android_guides,codepath,140,2018-12-21T18:33:49Z,Extensive Open-Source Guides for Android Developers
82,top-100-stars,lottie-android,24934,3897,Java,https://github.com/airbnb/lottie-android,airbnb,29,2019-04-09T08:58:28Z,"Render After Effects animations natively on Android and iOS, Web, and React Native"
83,top-100-stars,certbot,24790,2515,Python,https://github.com/certbot/certbot,certbot,780,2019-04-09T21:39:43Z,Certbot is EFF's tool to obtain certs from Let's Encrypt and (optionally) auto-enable HTTPS on your server.  It can also act as a client for any other CA that uses the ACME protocol.
84,top-100-stars,Python,24568,6884,Python,https://github.com/TheAlgorithms/Python,TheAlgorithms,159,2019-04-07T15:55:33Z,All Algorithms implemented in Python
85,top-100-stars,design-patterns-for-humans,24529,2365,,https://github.com/kamranahmedse/design-patterns-for-humans,kamranahmedse,11,2019-02-15T18:47:36Z,An ultra-simplified explanation to design patterns
86,top-100-stars,phaser,24408,5903,JavaScript,https://github.com/photonstorm/phaser,photonstorm,200,2019-04-09T22:43:52Z,"Phaser is a fun, free and fast 2D game framework for making HTML5 games for desktop and mobile web browsers, supporting Canvas and WebGL rendering."
87,top-100-stars,underscore,24363,5383,JavaScript,https://github.com/jashkenas/underscore,jashkenas,119,2019-03-25T17:26:39Z,JavaScript's utility _ belt
88,top-100-stars,realworld,24356,1632,JavaScript,https://github.com/gothinkster/realworld,gothinkster,128,2019-04-09T18:19:53Z,"""The mother of all demo apps"" — Exemplary fullstack Medium.com clone powered by React, Angular, Node, Django, and many more 🏅"
89,top-100-stars,angular-styleguide,24158,4510,,https://github.com/johnpapa/angular-styleguide,johnpapa,78,2019-01-11T11:03:26Z,Angular Style Guide: A starting point for Angular development teams to provide consistency through good practices.
90,top-100-stars,incubator-superset,23855,4453,JavaScript,https://github.com/apache/incubator-superset,apache,1110,2019-04-10T03:52:40Z,"Apache Superset (incubating) is a modern, enterprise-ready business intelligence web application"
91,top-100-stars,awesome-react-native,23763,2896,JavaScript,https://github.com/jondot/awesome-react-native,jondot,48,2019-04-05T16:32:23Z,"Awesome React Native components, news, tools, and learning material!"
92,top-100-stars,slick,23649,4705,JavaScript,https://github.com/kenwheeler/slick,kenwheeler,1067,2019-04-09T17:17:08Z,the last carousel you'll ever need
93,top-100-stars,DeepLearning-500-questions,23515,6442,,https://github.com/scutan90/DeepLearning-500-questions,scutan90,27,2019-04-10T03:45:46Z,深度学习500问，以问答形式对常用的概率知识、线性代数、机器学习、深度学习、计算机视觉等热点问题进行阐述，以帮助自己及有需要的读者。 全书分为18个章节，50余万字。由于水平有限，书中不妥之处恳请广大读者批评指正。   未完待续............ 如有意合作，联系scutjy2015@163.com                     版权所有，违权必究       Tan 2018.06
94,top-100-stars,what-happens-when,23508,1632,,https://github.com/alex/what-happens-when,alex,118,2019-04-05T03:18:08Z,"An attempt to answer the age old interview question ""What happens when you type google.com into your browser and press enter?"""
95,top-100-stars,select2,23451,5531,JavaScript,https://github.com/select2/select2,select2,109,2019-04-08T15:39:14Z,"Select2 is a jQuery based replacement for select boxes. It supports searching, remote data sets, and infinite scrolling of results."
96,top-100-stars,go-ethereum,23030,8184,Go,https://github.com/ethereum/go-ethereum,ethereum,696,2019-04-09T21:12:58Z,Official Go implementation of the Ethereum protocol
97,top-100-stars,proxyee-down,22829,4073,Java,https://github.com/proxyee-down-org/proxyee-down,proxyee-down-org,194,2018-11-15T08:08:28Z,http下载工具，基于http代理，支持多连接分块下载
98,top-100-stars,free-for-dev,22722,2439,HTML,https://github.com/ripienaar/free-for-dev,ripienaar,15,2019-04-09T08:53:25Z,"A list of SaaS, PaaS and IaaS offerings that have free tiers of interest to devops and infradev"
99,top-100-stars,clean-code-javascript,22676,2412,JavaScript,https://github.com/ryanmcdermott/clean-code-javascript,ryanmcdermott,26,2019-03-24T21:13:45Z,:bathtub: Clean Code concepts adapted for JavaScript
100,top-100-stars,shadowsocks-android,22386,8849,Kotlin,https://github.com/shadowsocks/shadowsocks-android,shadowsocks,15,2019-04-10T03:28:06Z,A shadowsocks client for Android
1,top-100-forks,datasharing,4683,194085,,https://github.com/jtleek/datasharing,jtleek,446,2019-01-22T19:51:28Z,The Leek group guide to data sharing 
2,top-100-forks,ProgrammingAssignment2,592,116132,R,https://github.com/rdpeng/ProgrammingAssignment2,rdpeng,2716,2019-04-05T07:15:14Z,Repository for Programming Assignment 2 for R Programming on Coursera
3,top-100-forks,Spoon-Knife,10113,103380,HTML,https://github.com/octocat/Spoon-Knife,octocat,13396,2019-04-10T02:07:58Z,This repo is for demonstration purposes only.
4,top-100-forks,tensorflow,125122,73626,C++,https://github.com/tensorflow/tensorflow,tensorflow,2439,2019-04-10T03:56:59Z,An Open Source Machine Learning Framework for Everyone
5,top-100-forks,bootstrap,132388,64755,JavaScript,https://github.com/twbs/bootstrap,twbs,382,2019-04-09T23:55:59Z,"The most popular HTML, CSS, and JavaScript framework for developing responsive, mobile first projects on the web."
6,top-100-forks,SmartThingsPublic,1242,53912,Groovy,https://github.com/SmartThingsCommunity/SmartThingsPublic,SmartThingsCommunity,1177,2019-04-09T23:03:43Z,SmartThings open-source DeviceTypeHandlers and SmartApps code
7,top-100-forks,ExData_Plotting1,169,49409,,https://github.com/rdpeng/ExData_Plotting1,rdpeng,609,2019-04-02T13:41:16Z,Plotting Assignment 1 for Exploratory Data Analysis
8,top-100-forks,gitignore,81947,39560,,https://github.com/github/gitignore,github,90,2019-04-09T15:45:14Z,A collection of useful .gitignore templates
9,top-100-forks,RepData_PeerAssessment1,85,31581,,https://github.com/rdpeng/RepData_PeerAssessment1,rdpeng,266,2019-01-30T08:47:00Z,Peer Assessment 1 for Reproducible Research
10,top-100-forks,models,51016,31323,Python,https://github.com/tensorflow/models,tensorflow,1542,2019-04-10T03:39:29Z,Models and examples built with TensorFlow
11,top-100-forks,free-programming-books,121150,30189,,https://github.com/EbookFoundation/free-programming-books,EbookFoundation,28,2019-04-09T18:42:18Z,:books: Freely available programming books
12,top-100-forks,angular.js,59478,28920,JavaScript,https://github.com/angular/angular.js,angular,460,2019-04-09T22:35:49Z,AngularJS - HTML enhanced for web apps!
13,top-100-forks,courses,3175,27477,HTML,https://github.com/DataScienceSpecialization/courses,DataScienceSpecialization,93,2019-02-22T08:01:12Z,Course materials for the Data Science Specialization: https://www.coursera.org/specialization/jhudatascience/1
14,top-100-forks,cgm-remote-monitor,717,25957,JavaScript,https://github.com/nightscout/cgm-remote-monitor,nightscout,209,2019-04-09T16:44:49Z,nightscout web monitor
15,top-100-forks,linux,72534,25653,C,https://github.com/torvalds/linux,torvalds,263,2019-04-10T03:44:09Z,Linux kernel source tree
16,top-100-forks,frontend-nanodegree-resume,1035,24817,JavaScript,https://github.com/udacity/frontend-nanodegree-resume,udacity,0,2018-11-27T21:09:19Z,This repository is used for one of the projects in Udacity's Front-End Web Developer Nanodegree program. Learn how to become a Front-End Developer today with line-by-line code reviewed projects and get a job with career services!
17,top-100-forks,opencv,33532,24207,C++,https://github.com/opencv/opencv,opencv,1675,2019-04-09T19:29:43Z,Open Source Computer Vision Library
18,top-100-forks,jekyll-now,5888,23934,CSS,https://github.com/barryclark/jekyll-now,barryclark,200,2019-04-08T02:49:10Z,"Build a Jekyll blog in minutes, without touching the command line."
19,top-100-forks,spring-boot,36343,23895,Java,https://github.com/spring-projects/spring-boot,spring-projects,411,2019-04-10T02:22:53Z,Spring Boot
20,top-100-forks,patchwork,864,23474,HTML,https://github.com/jlord/patchwork,jlord,699,2019-04-10T03:35:18Z,All the Git-it Workshop completers! 
21,top-100-forks,react,126659,23028,JavaScript,https://github.com/facebook/react,facebook,641,2019-04-10T01:59:40Z,"A declarative, efficient, and flexible JavaScript library for building user interfaces."
22,top-100-forks,recipes,62,22519,,https://github.com/LarryMad/recipes,LarryMad,2174,2019-04-09T21:38:39Z,
23,top-100-forks,bitcoin,37856,22436,C++,https://github.com/bitcoin/bitcoin,bitcoin,956,2019-04-10T03:58:47Z,Bitcoin Core integration/staging tree
24,top-100-forks,coding-interview-university,76251,22333,,https://github.com/jwasham/coding-interview-university,jwasham,61,2019-04-09T02:28:35Z,A complete computer science study plan to become a software engineer.
