rank,item,repo_name,stars,forks,language,repo_url,username,issues,last_commit,description
1,top-100-stars,freeCodeCamp,297551,20967,JavaScript,https://github.com/freeCodeCamp/freeCodeCamp,freeCodeCamp,4194,2019-02-25T02:48:25Z,The https://www.freeCodeCamp.org open source codebase and curriculum. Learn to code for free together with millions of people.
2,top-100-stars,bootstrap,131066,64114,JavaScript,https://github.com/twbs/bootstrap,twbs,326,2019-02-24T21:26:43Z,"The most popular HTML, CSS, and JavaScript framework for developing responsive, mobile first projects on the web."
3,top-100-stars,vue,128748,18342,JavaScript,https://github.com/vuejs/vue,vuejs,233,2019-02-25T03:28:07Z,"🖖 Vue.js is a progressive, incrementally-adoptable JavaScript framework for building UI on the web."
4,top-100-stars,react,123078,22320,JavaScript,https://github.com/facebook/react,facebook,541,2019-02-24T18:15:57Z,"A declarative, efficient, and flexible JavaScript library for building user interfaces."
5,top-100-stars,tensorflow,121188,72274,C++,https://github.com/tensorflow/tensorflow,tensorflow,2072,2019-02-24T23:42:46Z,An Open Source Machine Learning Framework for Everyone
6,top-100-stars,free-programming-books,117710,29591,,https://github.com/EbookFoundation/free-programming-books,EbookFoundation,26,2019-02-24T15:42:43Z,:books: Freely available programming books
7,top-100-stars,awesome,102522,13512,,https://github.com/sindresorhus/awesome,sindresorhus,185,2019-02-24T16:22:42Z,😎 Awesome lists about all kinds of interesting topics
8,top-100-stars,You-Dont-Know-JS,96825,18871,,https://github.com/getify/You-Dont-Know-JS,getify,224,2019-02-22T17:41:10Z,A book series on JavaScript. @YDKJS on twitter.
9,top-100-stars,oh-my-zsh,83782,16119,Shell,https://github.com/robbyrussell/oh-my-zsh,robbyrussell,990,2019-02-23T08:08:30Z,"A delightful community-driven (with 1,200+ contributors) framework for managing your zsh configuration. Includes 200+ optional plugins (rails, git, OSX, hub, capistrano, brew, ant, php, python, etc), over 140 themes to spice up your morning, and an auto-update tool so that makes it easy to keep up with the latest updates from the community."
10,top-100-stars,d3,82616,20411,JavaScript,https://github.com/d3/d3,d3,7,2019-02-22T22:59:07Z,"Bring data to life with SVG, Canvas and HTML. :bar_chart::chart_with_upwards_trend::tada:"
11,top-100-stars,javascript,82064,15706,JavaScript,https://github.com/airbnb/javascript,airbnb,139,2019-02-24T19:47:53Z,JavaScript Style Guide
12,top-100-stars,gitignore,79451,38099,,https://github.com/github/gitignore,github,80,2019-02-24T16:42:12Z,A collection of useful .gitignore templates
13,top-100-stars,coding-interview-university,74544,21797,,https://github.com/jwasham/coding-interview-university,jwasham,57,2019-02-14T05:25:18Z,A complete computer science study plan to become a software engineer.
14,top-100-stars,developer-roadmap,74533,11572,,https://github.com/kamranahmedse/developer-roadmap,kamranahmedse,170,2019-02-11T22:35:11Z,Roadmap to becoming a web developer in 2019
15,top-100-stars,react-native,74333,16519,JavaScript,https://github.com/facebook/react-native,facebook,713,2019-02-25T03:48:26Z,A framework for building native apps with React.
16,top-100-stars,electron,70362,9167,C++,https://github.com/electron/electron,electron,1189,2019-02-24T20:40:34Z,":electron: Build cross-platform desktop apps with JavaScript, HTML, and CSS"
17,top-100-stars,linux,69793,25000,C,https://github.com/torvalds/linux,torvalds,257,2019-02-25T00:50:49Z,Linux kernel source tree
18,top-100-stars,vscode,69759,9306,TypeScript,https://github.com/Microsoft/vscode,Microsoft,5183,2019-02-25T01:03:25Z,Visual Studio Code
19,top-100-stars,create-react-app,64003,14105,JavaScript,https://github.com/facebook/create-react-app,facebook,353,2019-02-24T23:56:46Z,Set up a modern web app by running one command.
20,top-100-stars,awesome-python,63036,12109,Python,https://github.com/vinta/awesome-python,vinta,463,2019-02-22T07:24:57Z,"A curated list of awesome Python frameworks, libraries, software and resources"
21,top-100-stars,angular.js,59393,28926,JavaScript,https://github.com/angular/angular.js,angular,463,2019-02-23T06:33:22Z,AngularJS - HTML enhanced for web apps!
22,top-100-stars,Font-Awesome,58894,9973,JavaScript,https://github.com/FortAwesome/Font-Awesome,FortAwesome,4767,2019-02-19T14:13:24Z,"The iconic SVG, font, and CSS toolkit"
23,top-100-stars,node,58426,12938,JavaScript,https://github.com/nodejs/node,nodejs,854,2019-02-25T03:06:56Z,Node.js JavaScript runtime :sparkles::turtle::rocket::sparkles:
24,top-100-stars,system-design-primer,57713,8411,Python,https://github.com/donnemartin/system-design-primer,donnemartin,75,2019-02-20T21:12:05Z,Learn how to design large-scale systems. Prep for the system design interview.  Includes Anki flashcards.
25,top-100-stars,animate.css,57565,12249,CSS,https://github.com/daneden/animate.css,daneden,18,2019-02-24T14:54:13Z,🍿 A cross-browser library of CSS animations. As easy to use as an easy thing.
26,top-100-stars,axios,55522,4309,JavaScript,https://github.com/axios/axios,axios,534,2019-02-24T14:43:26Z,Promise based HTTP client for the browser and node.js
27,top-100-stars,flutter,54128,5761,Dart,https://github.com/flutter/flutter,flutter,4293,2019-02-25T02:38:15Z,Flutter makes it easy and fast to build beautiful mobile apps.
28,top-100-stars,go,53584,7331,Go,https://github.com/golang/go,golang,4326,2019-02-24T22:22:50Z,The Go programming language
29,top-100-stars,moby,52282,15133,Go,https://github.com/moby/moby,moby,3620,2019-02-24T15:36:54Z,Moby Project - a collaborative project for the container ecosystem to assemble container-based systems
30,top-100-stars,public-apis,51815,5243,Python,https://github.com/toddmotto/public-apis,toddmotto,26,2019-02-23T11:57:55Z,A collective list of free APIs for use in software and web development.
31,top-100-stars,jquery,50966,17722,JavaScript,https://github.com/jquery/jquery,jquery,82,2019-02-19T12:20:58Z,jQuery JavaScript Library
32,top-100-stars,CS-Notes,50531,15562,,https://github.com/CyC2018/CS-Notes,CyC2018,6,2019-02-24T04:12:00Z,😋  技术面试必备基础知识
33,top-100-stars,laravel,50202,15356,PHP,https://github.com/laravel/laravel,laravel,27,2019-02-25T00:52:43Z,A PHP framework for web artisans
34,top-100-stars,three.js,48933,18364,JavaScript,https://github.com/mrdoob/three.js,mrdoob,830,2019-02-25T02:18:12Z,JavaScript 3D library.
35,top-100-stars,models,48722,29780,Python,https://github.com/tensorflow/models,tensorflow,1416,2019-02-24T20:59:09Z,Models and examples built with TensorFlow
36,top-100-stars,kubernetes,48637,16844,Go,https://github.com/kubernetes/kubernetes,kubernetes,3092,2019-02-25T03:58:46Z,Production-Grade Container Scheduling and Management
37,top-100-stars,atom,47897,11113,JavaScript,https://github.com/atom/atom,atom,716,2019-02-23T16:27:46Z,:atom: The hackable text editor
38,top-100-stars,youtube-dl,47543,8246,Python,https://github.com/rg3/youtube-dl,rg3,2766,2019-02-24T17:59:36Z,Command-line program to download videos from YouTube.com and other video sites
39,top-100-stars,webpack,47225,5955,JavaScript,https://github.com/webpack/webpack,webpack,506,2019-02-24T10:46:25Z,"A bundler for javascript and friends. Packs many modules into a few bundled assets. Code Splitting allows for loading parts of the application on demand. Through ""loaders"", modules can be CommonJs, AMD, ES6 modules, CSS, Images, JSON, Coffeescript, LESS, ... and your custom stuff."
40,top-100-stars,redux,47054,11965,JavaScript,https://github.com/reduxjs/redux,reduxjs,30,2019-02-24T16:10:03Z,Predictable state container for JavaScript apps
41,top-100-stars,swift,46747,7401,C++,https://github.com/apple/swift,apple,475,2019-02-25T03:50:12Z,The Swift Programming Language
42,top-100-stars,puppeteer,45783,4001,JavaScript,https://github.com/GoogleChrome/puppeteer,GoogleChrome,341,2019-02-25T03:31:36Z,Headless Chrome Node API
43,top-100-stars,angular,45582,11878,TypeScript,https://github.com/angular/angular,angular,2703,2019-02-25T03:30:19Z,One framework. Mobile & desktop.
44,top-100-stars,free-programming-books-zh_CN,45556,15191,,https://github.com/justjavac/free-programming-books-zh_CN,justjavac,150,2019-02-21T02:54:59Z,:books: 免费的计算机编程类中文书籍，欢迎投稿
45,top-100-stars,TypeScript,45458,6374,TypeScript,https://github.com/Microsoft/TypeScript,Microsoft,3577,2019-02-23T10:41:23Z,TypeScript is a superset of JavaScript that compiles to clean JavaScript output.
46,top-100-stars,socket.io,45279,8368,JavaScript,https://github.com/socketio/socket.io,socketio,360,2019-01-19T06:08:50Z,Realtime application framework (Node.JS server)
47,top-100-stars,javascript-algorithms,45214,6150,JavaScript,https://github.com/trekhleb/javascript-algorithms,trekhleb,85,2019-02-22T03:48:22Z,📝 Algorithms and data structures implemented in JavaScript with explanations and links to further readings
48,top-100-stars,reveal.js,44882,13001,JavaScript,https://github.com/hakimel/reveal.js,hakimel,412,2019-02-19T22:46:21Z,The HTML Presentation Framework
49,top-100-stars,java-design-patterns,44798,14520,Java,https://github.com/iluwatar/java-design-patterns,iluwatar,191,2019-02-18T17:08:41Z,Design patterns implemented in Java
50,top-100-stars,material-ui,44649,9217,JavaScript,https://github.com/mui-org/material-ui,mui-org,290,2019-02-25T00:39:45Z,React components that implement Google's Material Design.
51,top-100-stars,Semantic-UI,44570,4743,JavaScript,https://github.com/Semantic-Org/Semantic-UI,Semantic-Org,844,2019-01-22T05:37:47Z,Semantic is a UI component framework based around useful principles from natural language.
52,top-100-stars,ant-design,42867,14634,TypeScript,https://github.com/ant-design/ant-design,ant-design,277,2019-02-25T03:28:36Z,🌈 A UI Design Language
53,top-100-stars,awesome-vue,42666,5902,,https://github.com/vuejs/awesome-vue,vuejs,76,2019-02-22T16:48:21Z,🎉 A curated list of awesome things related to Vue.js
54,top-100-stars,express,42560,7269,JavaScript,https://github.com/expressjs/express,expressjs,177,2019-02-23T09:21:34Z,"Fast, unopinionated, minimalist web framework for node."
55,top-100-stars,build-your-own-x,42521,2795,,https://github.com/danistefanovic/build-your-own-x,danistefanovic,5,2019-02-20T08:52:05Z,🤓 Build your own (insert technology here)
56,top-100-stars,html5-boilerplate,42315,9999,JavaScript,https://github.com/h5bp/html5-boilerplate,h5bp,2,2019-02-21T05:29:13Z,"A professional front-end template for building fast, robust, and adaptable web apps or sites."
57,top-100-stars,rails,42265,17063,Ruby,https://github.com/rails/rails,rails,1104,2019-02-24T23:28:25Z,Ruby on Rails
58,top-100-stars,flask,42164,11974,Python,https://github.com/pallets/flask,pallets,46,2019-02-24T22:21:26Z,The Python micro framework for building web applications.
59,top-100-stars,Chart.js,41945,9352,JavaScript,https://github.com/chartjs/Chart.js,chartjs,452,2019-02-25T03:57:37Z,Simple HTML5 Charts using the <canvas> tag
60,top-100-stars,thefuck,41134,2045,Python,https://github.com/nvbn/thefuck,nvbn,144,2019-02-24T16:30:45Z,Magnificent app which corrects your previous console command.
61,top-100-stars,meteor,40806,5044,JavaScript,https://github.com/meteor/meteor,meteor,298,2019-02-24T06:51:17Z,"Meteor, the JavaScript App Platform"
62,top-100-stars,lantern,40421,8934,Go,https://github.com/getlantern/lantern,getlantern,2542,2019-02-21T13:34:28Z,🔴蓝灯最新版本下载 https://github.com/getlantern/download 🔴 Lantern Latest Download https://github.com/getlantern/download 🔴
63,top-100-stars,awesome-go,40306,5249,Go,https://github.com/avelino/awesome-go,avelino,24,2019-02-24T23:25:06Z,"A curated list of awesome Go frameworks, libraries and software"
64,top-100-stars,moment,40255,6049,JavaScript,https://github.com/moment/moment,moment,279,2019-02-21T05:45:26Z,"Parse, validate, manipulate, and display dates in javascript."
65,top-100-stars,httpie,39928,2619,Python,https://github.com/jakubroztocil/httpie,jakubroztocil,142,2019-02-07T09:09:46Z,"As easy as httpie /aitch-tee-tee-pie/ 🥧 Modern command line HTTP client – user-friendly curl alternative with intuitive UI, JSON support, syntax highlighting, wget-like downloads, extensions, etc.  https://twitter.com/clihttp"
66,top-100-stars,resume.github.com,39694,1048,JavaScript,https://github.com/resume/resume.github.com,resume,36,2018-12-29T23:17:05Z,Resumes generated using the GitHub informations
67,top-100-stars,django,39689,17100,Python,https://github.com/django/django,django,183,2019-02-24T21:10:38Z,The Web framework for perfectionists with deadlines.
68,top-100-stars,30-seconds-of-code,39624,4301,JavaScript,https://github.com/30-seconds/30-seconds-of-code,30-seconds,10,2019-02-23T17:14:17Z,Curated collection of useful JavaScript snippets that you can understand in 30 seconds or less.
69,top-100-stars,Front-end-Developer-Interview-Questions,39364,8015,HTML,https://github.com/h5bp/Front-end-Developer-Interview-Questions,h5bp,25,2019-02-24T11:03:11Z,"A list of helpful front-end related questions you can use to interview potential candidates, test yourself or completely ignore."
70,top-100-stars,the-art-of-command-line,39015,3867,,https://github.com/jlevy/the-art-of-command-line,jlevy,106,2019-01-15T03:04:39Z,"Master the command line, in one page"
71,top-100-stars,computer-science,38671,5569,,https://github.com/ossu/computer-science,ossu,42,2019-02-02T02:36:27Z,:mortar_board: Path to a free self-taught education in Computer Science!
72,top-100-stars,elasticsearch,38579,12925,Java,https://github.com/elastic/elasticsearch,elastic,1873,2019-02-25T03:32:46Z,"Open Source, Distributed, RESTful Search Engine"
73,top-100-stars,keras,38482,14683,Python,https://github.com/keras-team/keras,keras-team,2159,2019-02-24T23:49:59Z,Deep Learning for humans
74,top-100-stars,json-server,38343,3328,JavaScript,https://github.com/typicode/json-server,typicode,403,2019-02-21T14:40:12Z,Get a full fake REST API with zero coding in less than 30 seconds (seriously)
75,top-100-stars,awesome-machine-learning,38270,9459,Python,https://github.com/josephmisiti/awesome-machine-learning,josephmisiti,0,2019-02-24T00:06:53Z,"A curated list of awesome Machine Learning frameworks, libraries and software."
76,top-100-stars,RxJava,37730,6415,Java,https://github.com/ReactiveX/RxJava,ReactiveX,27,2019-02-23T08:59:02Z,RxJava – Reactive Extensions for the JVM – a library for composing asynchronous and event-based programs using observable sequences for the Java VM.
77,top-100-stars,lodash,37533,3881,JavaScript,https://github.com/lodash/lodash,lodash,6,2019-02-22T03:30:26Z,"A modern JavaScript utility library delivering modularity, performance, & extras."
78,top-100-stars,requests,37331,6801,Python,https://github.com/kennethreitz/requests,kennethreitz,159,2019-02-23T13:26:02Z,Python HTTP Requests for Humans™ ✨🍰✨
79,top-100-stars,material-design-icons,37227,7518,CSS,https://github.com/google/material-design-icons,google,539,2019-02-24T01:25:22Z,Material Design icons by Google
80,top-100-stars,bitcoin,37227,22120,C++,https://github.com/bitcoin/bitcoin,bitcoin,886,2019-02-25T02:55:40Z,Bitcoin Core integration/staging tree
81,top-100-stars,ionic,37114,12906,HTML,https://github.com/ionic-team/ionic,ionic-team,457,2019-02-24T23:51:45Z,Build amazing native and progressive web apps with open web technologies. One app running on everything 🎉
82,top-100-stars,jekyll,36935,8059,Ruby,https://github.com/jekyll/jekyll,jekyll,153,2019-02-21T11:36:49Z,:globe_with_meridians: Jekyll is a blog-aware static site generator in Ruby
83,top-100-stars,every-programmer-should-know,36723,3332,,https://github.com/mtdvio/every-programmer-should-know,mtdvio,26,2019-02-18T05:58:49Z,A collection of (mostly) technical things every software developer should know
84,top-100-stars,netdata,35912,3100,C,https://github.com/netdata/netdata,netdata,507,2019-02-24T20:53:08Z,"Real-time performance monitoring, done right! https://my-netdata.io/"
85,top-100-stars,markdown-here,35743,6051,JavaScript,https://github.com/adam-p/markdown-here,adam-p,228,2018-11-13T20:35:39Z,"Google Chrome, Firefox, and Thunderbird extension that lets you write email in Markdown and render it before sending."
86,top-100-stars,node-v0.x-archive,35604,7832,,https://github.com/nodejs/node-v0.x-archive,nodejs,571,2018-04-04T08:28:02Z,Moved to https://github.com/nodejs/node
87,top-100-stars,ansible,35543,14494,Python,https://github.com/ansible/ansible,ansible,5599,2019-02-25T03:59:46Z,"Ansible is a radically simple IT automation platform that makes your applications and systems easier to deploy. Avoid writing scripts or custom code to deploy and update your applications — automate in a language that approaches plain English, using SSH, with no agents to install on remote systems. https://docs.ansible.com/ansible/"
88,top-100-stars,element,35268,7015,Vue,https://github.com/ElemeFE/element,ElemeFE,748,2019-02-25T02:28:15Z,A Vue.js 2.0 UI Toolkit for Web
89,top-100-stars,materialize,35144,4708,JavaScript,https://github.com/Dogfalo/materialize,Dogfalo,628,2019-02-18T07:08:36Z,"Materialize, a CSS Framework based on Material Design"
90,top-100-stars,next.js,35108,3929,JavaScript,https://github.com/zeit/next.js,zeit,238,2019-02-24T21:08:40Z,The React Framework
91,top-100-stars,nw.js,35057,3798,C++,https://github.com/nwjs/nw.js,nwjs,736,2019-02-21T12:26:47Z,Call all Node.js modules directly from DOM/WebWorker and enable a new way of writing applications with all Web technologies.
92,top-100-stars,react-router,34932,7217,JavaScript,https://github.com/ReactTraining/react-router,ReactTraining,61,2019-02-22T18:55:03Z,Declarative routing for React
93,top-100-stars,yarn,34849,2084,JavaScript,https://github.com/yarnpkg/yarn,yarnpkg,1713,2019-02-23T12:25:04Z,"📦🐈 Fast, reliable, and secure dependency management."
94,top-100-stars,impress.js,34519,6797,JavaScript,https://github.com/impress/impress.js,impress,52,2019-02-24T15:57:20Z,It's a presentation framework based on the power of CSS3 transforms and transitions in modern browsers and inspired by the idea behind prezi.com.
95,top-100-stars,spring-boot,34496,23019,Java,https://github.com/spring-projects/spring-boot,spring-projects,375,2019-02-25T00:35:22Z,Spring Boot
96,top-100-stars,redis,34468,13172,C,https://github.com/antirez/redis,antirez,2101,2019-02-23T09:02:00Z,"Redis is an in-memory database that persists on disk. The data model is key-value, but many different kind of values are supported: Strings, Lists, Sets, Sorted Sets, Hashes, HyperLogLogs, Bitmaps."
97,top-100-stars,storybook,34214,2608,JavaScript,https://github.com/storybooks/storybook,storybooks,257,2019-02-25T01:04:11Z,"Interactive UI component dev & test: React, React Native, Vue, Angular, Ember"
98,top-100-stars,rust,34196,5550,Rust,https://github.com/rust-lang/rust,rust-lang,4760,2019-02-25T03:51:15Z,Empowering everyone to build reliable and efficient software.
99,top-100-stars,normalize.css,34071,6893,CSS,https://github.com/necolas/normalize.css,necolas,17,2019-01-03T11:33:37Z,A modern alternative to CSS resets
100,top-100-stars,awesome-android-ui,33646,8796,,https://github.com/wasabeef/awesome-android-ui,wasabeef,22,2019-02-07T11:01:02Z,A curated list of awesome Android UI/UX libraries
1,top-100-forks,datasharing,4643,193101,,https://github.com/jtleek/datasharing,jtleek,445,2019-01-22T19:51:28Z,The Leek group guide to data sharing 
2,top-100-forks,ProgrammingAssignment2,582,115414,R,https://github.com/rdpeng/ProgrammingAssignment2,rdpeng,2688,2019-02-24T14:44:50Z,Repository for Programming Assignment 2 for R Programming on Coursera
3,top-100-forks,Spoon-Knife,10095,102830,HTML,https://github.com/octocat/Spoon-Knife,octocat,13239,2019-02-25T01:41:24Z,This repo is for demonstration purposes only.
4,top-100-forks,tensorflow,121188,72274,C++,https://github.com/tensorflow/tensorflow,tensorflow,2072,2019-02-24T23:42:46Z,An Open Source Machine Learning Framework for Everyone
5,top-100-forks,bootstrap,131066,64114,JavaScript,https://github.com/twbs/bootstrap,twbs,326,2019-02-24T21:26:43Z,"The most popular HTML, CSS, and JavaScript framework for developing responsive, mobile first projects on the web."
6,top-100-forks,SmartThingsPublic,1197,52208,Groovy,https://github.com/SmartThingsCommunity/SmartThingsPublic,SmartThingsCommunity,1142,2019-02-24T00:57:28Z,SmartThings open-source DeviceTypeHandlers and SmartApps code
7,top-100-forks,ExData_Plotting1,164,49142,,https://github.com/rdpeng/ExData_Plotting1,rdpeng,605,2019-02-15T08:08:46Z,Plotting Assignment 1 for Exploratory Data Analysis
8,top-100-forks,gitignore,79451,38099,,https://github.com/github/gitignore,github,80,2019-02-24T16:42:12Z,A collection of useful .gitignore templates
9,top-100-forks,RepData_PeerAssessment1,80,31353,,https://github.com/rdpeng/RepData_PeerAssessment1,rdpeng,266,2019-01-30T08:47:00Z,Peer Assessment 1 for Reproducible Research
10,top-100-forks,models,48722,29780,Python,https://github.com/tensorflow/models,tensorflow,1416,2019-02-24T20:59:09Z,Models and examples built with TensorFlow
11,top-100-forks,free-programming-books,117710,29591,,https://github.com/EbookFoundation/free-programming-books,EbookFoundation,26,2019-02-24T15:42:43Z,:books: Freely available programming books
12,top-100-forks,angular.js,59393,28926,JavaScript,https://github.com/angular/angular.js,angular,463,2019-02-23T06:33:22Z,AngularJS - HTML enhanced for web apps!
13,top-100-forks,courses,3144,27267,HTML,https://github.com/DataScienceSpecialization/courses,DataScienceSpecialization,93,2019-02-22T08:01:12Z,Course materials for the Data Science Specialization: https://www.coursera.org/specialization/jhudatascience/1
14,top-100-forks,linux,69793,25000,C,https://github.com/torvalds/linux,torvalds,257,2019-02-25T00:50:49Z,Linux kernel source tree
15,top-100-forks,frontend-nanodegree-resume,1025,24948,JavaScript,https://github.com/udacity/frontend-nanodegree-resume,udacity,0,2018-11-27T21:09:19Z,This repository is used for one of the projects in Udacity's Front-End Web Developer Nanodegree program. Learn how to become a Front-End Developer today with line-by-line code reviewed projects and get a job with career services!
16,top-100-forks,cgm-remote-monitor,661,24430,JavaScript,https://github.com/nightscout/cgm-remote-monitor,nightscout,191,2019-02-25T03:14:13Z,nightscout web monitor
17,top-100-forks,jekyll-now,5726,23402,CSS,https://github.com/barryclark/jekyll-now,barryclark,187,2019-02-24T20:18:35Z,"Build a Jekyll blog in minutes, without touching the command line."
18,top-100-forks,spring-boot,34496,23019,Java,https://github.com/spring-projects/spring-boot,spring-projects,375,2019-02-25T00:35:22Z,Spring Boot
19,top-100-forks,patchwork,830,22999,HTML,https://github.com/jlord/patchwork,jlord,629,2019-02-24T12:57:20Z,All the Git-it Workshop completers! 
20,top-100-forks,opencv,32045,22963,C++,https://github.com/opencv/opencv,opencv,1624,2019-02-24T21:44:55Z,Open Source Computer Vision Library
21,top-100-forks,recipes,60,22479,,https://github.com/LarryMad/recipes,LarryMad,2152,2019-02-24T19:03:52Z,
22,top-100-forks,react,123078,22320,JavaScript,https://github.com/facebook/react,facebook,541,2019-02-24T18:15:57Z,"A declarative, efficient, and flexible JavaScript library for building user interfaces."
23,top-100-forks,bitcoin,37227,22120,C++,https://github.com/bitcoin/bitcoin,bitcoin,886,2019-02-25T02:55:40Z,Bitcoin Core integration/staging tree
24,top-100-forks,coding-interview-university,74544,21797,,https://github.com/jwasham/coding-interview-university,jwasham,57,2019-02-14T05:25:18Z,A complete computer science study plan to become a software engineer.
25,top-100-forks,freeCodeCamp,297551,20967,JavaScript,https://github.com/freeCodeCamp/freeCodeCamp,freeCodeCamp,4194,2019-02-25T02:48:25Z,The https://www.freeCodeCamp.org open source codebase and curriculum. Learn to code for free together with millions of people.
26,top-100-forks,d3,82616,20411,JavaScript,https://github.com/d3/d3,d3,7,2019-02-22T22:59:07Z,"Bring data to life with SVG, Canvas and HTML. :bar_chart::chart_with_upwards_trend::tada:"
27,top-100-forks,You-Dont-Know-JS,96825,18871,,https://github.com/getify/You-Dont-Know-JS,getify,224,2019-02-22T17:41:10Z,A book series on JavaScript. @YDKJS on twitter.
28,top-100-forks,three.js,48933,18364,JavaScript,https://github.com/mrdoob/three.js,mrdoob,830,2019-02-25T02:18:12Z,JavaScript 3D library.
29,top-100-forks,vue,128748,18342,JavaScript,https://github.com/vuejs/vue,vuejs,233,2019-02-25T03:28:07Z,"🖖 Vue.js is a progressive, incrementally-adoptable JavaScript framework for building UI on the web."
30,top-100-forks,spark,20702,18136,Scala,https://github.com/apache/spark,apache,461,2019-02-25T03:55:00Z,Apache Spark
31,top-100-forks,jquery,50966,17722,JavaScript,https://github.com/jquery/jquery,jquery,82,2019-02-19T12:20:58Z,jQuery JavaScript Library
32,top-100-forks,shadowsocks,28826,17633,Python,https://github.com/shadowsocks/shadowsocks,shadowsocks,416,2019-02-05T16:38:13Z,
33,top-100-forks,tutorials,11840,17503,Java,https://github.com/eugenp/tutorials,eugenp,43,2019-02-24T19:22:54Z,"The ""REST With Spring"" Course: "
34,top-100-forks,django,39689,17100,Python,https://github.com/django/django,django,183,2019-02-24T21:10:38Z,The Web framework for perfectionists with deadlines.
35,top-100-forks,spring-framework,26753,17078,Java,https://github.com/spring-projects/spring-framework,spring-projects,891,2019-02-24T10:45:22Z,Spring Framework
36,top-100-forks,rails,42265,17063,Ruby,https://github.com/rails/rails,rails,1104,2019-02-24T23:28:25Z,Ruby on Rails
37,top-100-forks,kubernetes,48637,16844,Go,https://github.com/kubernetes/kubernetes,kubernetes,3092,2019-02-25T03:58:46Z,Production-Grade Container Scheduling and Management
