rank,item,repo_name,stars,forks,language,repo_url,username,issues,last_commit,description
1,top-100-stars,freeCodeCamp,303404,22082,JavaScript,https://github.com/freeCodeCamp/freeCodeCamp,freeCodeCamp,1851,2019-06-14T20:40:58Z,The https://www.freeCodeCamp.org open source codebase and curriculum. Learn to code for free together with millions of people.
2,top-100-stars,996.ICU,245953,21355,Rust,https://github.com/996icu/996.ICU,996icu,16696,2019-06-14T12:50:27Z,Repo for counting stars and contributing. Press F to pay respect to glorious developers.
3,top-100-stars,bootstrap,134018,65692,JavaScript,https://github.com/twbs/bootstrap,twbs,378,2019-06-14T10:46:33Z,"The most popular HTML, CSS, and JavaScript framework for developing responsive, mobile first projects on the web."
4,top-100-stars,react,131048,24135,JavaScript,https://github.com/facebook/react,facebook,714,2019-06-15T01:08:24Z,"A declarative, efficient, and flexible JavaScript library for building user interfaces."
5,top-100-stars,free-programming-books,124222,30993,,https://github.com/EbookFoundation/free-programming-books,EbookFoundation,41,2019-06-10T16:49:10Z,:books: Freely available programming books
6,top-100-stars,awesome,110504,14553,,https://github.com/sindresorhus/awesome,sindresorhus,33,2019-06-14T15:28:54Z,😎 Awesome lists about all kinds of interesting topics
7,top-100-stars,You-Dont-Know-JS,103350,20377,,https://github.com/getify/You-Dont-Know-JS,getify,254,2019-06-14T07:36:39Z,A book series on JavaScript. @YDKJS on twitter.
8,top-100-stars,d3,85322,20891,JavaScript,https://github.com/d3/d3,d3,9,2019-05-02T14:23:43Z,"Bring data to life with SVG, Canvas and HTML. :bar_chart::chart_with_upwards_trend::tada:"
9,top-100-stars,gitignore,85180,41783,,https://github.com/github/gitignore,github,89,2019-06-14T15:23:27Z,A collection of useful .gitignore templates
10,top-100-stars,developer-roadmap,83011,13152,,https://github.com/kamranahmedse/developer-roadmap,kamranahmedse,179,2019-05-29T22:07:03Z,Roadmap to becoming a web developer in 2019
11,top-100-stars,coding-interview-university,78585,23220,,https://github.com/jwasham/coding-interview-university,jwasham,59,2019-05-26T02:56:08Z,A complete computer science study plan to become a software engineer.
12,top-100-stars,vscode,78160,10822,TypeScript,https://github.com/microsoft/vscode,microsoft,5889,2019-06-15T01:57:53Z,Visual Studio Code
13,top-100-stars,electron,74231,9687,C++,https://github.com/electron/electron,electron,1337,2019-06-14T23:26:13Z,":electron: Build cross-platform desktop apps with JavaScript, HTML, and CSS"
14,top-100-stars,awesome-python,68685,13361,Python,https://github.com/vinta/awesome-python,vinta,458,2019-06-13T17:55:40Z,"A curated list of awesome Python frameworks, libraries, software and resources"
15,top-100-stars,create-react-app,68579,15535,JavaScript,https://github.com/facebook/create-react-app,facebook,386,2019-06-14T18:14:07Z,Set up a modern web app by running one command.
16,top-100-stars,flutter,67239,7652,Dart,https://github.com/flutter/flutter,flutter,6182,2019-06-15T02:50:58Z,Flutter makes it easy and fast to build beautiful mobile apps.
17,top-100-stars,system-design-primer,64579,9918,Python,https://github.com/donnemartin/system-design-primer,donnemartin,88,2019-06-10T06:10:59Z,Learn how to design large-scale systems. Prep for the system design interview.  Includes Anki flashcards.
18,top-100-stars,node,62057,13932,JavaScript,https://github.com/nodejs/node,nodejs,958,2019-06-15T00:02:49Z,Node.js JavaScript runtime :sparkles::turtle::rocket::sparkles:
19,top-100-stars,axios,60735,4908,JavaScript,https://github.com/axios/axios,axios,652,2019-06-13T21:38:28Z,Promise based HTTP client for the browser and node.js
20,top-100-stars,Font-Awesome,60068,10159,JavaScript,https://github.com/FortAwesome/Font-Awesome,FortAwesome,4803,2019-06-05T13:56:25Z,"The iconic SVG, font, and CSS toolkit"
21,top-100-stars,public-apis,58129,6088,Python,https://github.com/public-apis/public-apis,public-apis,69,2019-06-13T18:44:40Z,A collective list of free APIs for use in software and web development.
22,top-100-stars,the-art-of-command-line,57104,6003,,https://github.com/jlevy/the-art-of-command-line,jlevy,148,2019-06-14T15:16:18Z,"Master the command line, in one page"
23,top-100-stars,kubernetes,53999,18706,Go,https://github.com/kubernetes/kubernetes,kubernetes,3223,2019-06-15T02:49:37Z,Production-Grade Container Scheduling and Management
24,top-100-stars,moby,53725,15498,Go,https://github.com/moby/moby,moby,3712,2019-06-14T15:11:16Z,Moby Project - a collaborative project for the container ecosystem to assemble container-based systems
25,top-100-stars,laravel,52938,16193,PHP,https://github.com/laravel/laravel,laravel,27,2019-06-13T12:51:23Z,A PHP framework for web artisans
26,top-100-stars,three.js,52369,19727,JavaScript,https://github.com/mrdoob/three.js,mrdoob,885,2019-06-14T20:39:41Z,JavaScript 3D library.
27,top-100-stars,jquery,51763,18226,JavaScript,https://github.com/jquery/jquery,jquery,82,2019-06-13T13:17:12Z,jQuery JavaScript Library
28,top-100-stars,youtube-dl,51485,8950,Python,https://github.com/ytdl-org/youtube-dl,ytdl-org,2879,2019-06-15T02:27:45Z,Command-line program to download videos from YouTube.com and other video sites
29,top-100-stars,free-programming-books-zh_CN,51195,16711,,https://github.com/justjavac/free-programming-books-zh_CN,justjavac,158,2019-06-10T03:33:40Z,:books: 免费的计算机编程类中文书籍，欢迎投稿
30,top-100-stars,TypeScript,50359,6969,TypeScript,https://github.com/microsoft/TypeScript,microsoft,3955,2019-06-14T23:07:48Z,TypeScript is a superset of JavaScript that compiles to clean JavaScript output.
31,top-100-stars,puppeteer,50292,4604,JavaScript,https://github.com/GoogleChrome/puppeteer,GoogleChrome,403,2019-06-15T02:31:48Z,Headless Chrome Node API
32,top-100-stars,webpack,49390,6204,JavaScript,https://github.com/webpack/webpack,webpack,503,2019-06-14T19:09:50Z,"A bundler for javascript and friends. Packs many modules into a few bundled assets. Code Splitting allows for loading parts of the application on demand. Through ""loaders"", modules can be CommonJs, AMD, ES6 modules, CSS, Images, JSON, Coffeescript, LESS, ... and your custom stuff."
33,top-100-stars,angular,49037,13239,TypeScript,https://github.com/angular/angular,angular,2878,2019-06-14T23:03:44Z,One framework. Mobile & desktop.
34,top-100-stars,atom,48997,11925,JavaScript,https://github.com/atom/atom,atom,663,2019-06-14T22:07:19Z,:atom: The hackable text editor
35,top-100-stars,java-design-patterns,48364,15667,Java,https://github.com/iluwatar/java-design-patterns,iluwatar,208,2019-06-12T09:48:41Z,Design patterns implemented in Java
36,top-100-stars,material-ui,47922,10670,JavaScript,https://github.com/mui-org/material-ui,mui-org,329,2019-06-14T23:00:22Z,"React components for faster and easier web development. Build your own design system, or start with Material Design."
37,top-100-stars,reveal.js,46837,13616,JavaScript,https://github.com/hakimel/reveal.js,hakimel,467,2019-06-10T05:41:13Z,The HTML Presentation Framework
38,top-100-stars,socket.io,46638,8530,JavaScript,https://github.com/socketio/socket.io,socketio,397,2019-06-10T14:01:52Z,Realtime application framework (Node.JS server)
39,top-100-stars,Semantic-UI,45712,4831,JavaScript,https://github.com/Semantic-Org/Semantic-UI,Semantic-Org,903,2019-06-03T08:44:31Z,Semantic is a UI component framework based around useful principles from natural language.
40,top-100-stars,build-your-own-x,45582,3094,,https://github.com/danistefanovic/build-your-own-x,danistefanovic,21,2019-06-09T21:20:52Z,🤓 Build your own (insert technology here)
41,top-100-stars,terminal,45015,4294,C++,https://github.com/microsoft/terminal,microsoft,423,2019-06-14T22:09:01Z,"The new Windows Terminal, and the original Windows console host -- all in the same place!"
42,top-100-stars,awesome-go,44862,5869,Go,https://github.com/avelino/awesome-go,avelino,41,2019-06-14T17:00:35Z,"A curated list of awesome Go frameworks, libraries and software"
43,top-100-stars,JavaGuide,44479,14100,Java,https://github.com/Snailclimb/JavaGuide,Snailclimb,23,2019-06-13T06:40:58Z,【Java学习+面试指南】 一份涵盖大部分Java程序员所需要掌握的核心知识。
44,top-100-stars,express,44298,7445,JavaScript,https://github.com/expressjs/express,expressjs,164,2019-06-14T20:45:17Z,"Fast, unopinionated, minimalist web framework for node."
45,top-100-stars,thefuck,44245,2208,Python,https://github.com/nvbn/thefuck,nvbn,163,2019-06-14T20:31:54Z,Magnificent app which corrects your previous console command.
46,top-100-stars,Chart.js,43926,9652,JavaScript,https://github.com/chartjs/Chart.js,chartjs,449,2019-06-14T23:33:41Z,Simple HTML5 Charts using the <canvas> tag
47,top-100-stars,rails,43359,17442,Ruby,https://github.com/rails/rails,rails,1152,2019-06-14T23:34:51Z,Ruby on Rails
48,top-100-stars,html5-boilerplate,42921,10213,JavaScript,https://github.com/h5bp/html5-boilerplate,h5bp,1,2019-06-11T02:34:21Z,"A professional front-end template for building fast, robust, and adaptable web apps or sites."
49,top-100-stars,django,42174,18146,Python,https://github.com/django/django,django,227,2019-06-14T21:30:27Z,The Web framework for perfectionists with deadlines.
50,top-100-stars,Python-100-Days,42119,14996,Jupyter Notebook,https://github.com/jackfrued/Python-100-Days,jackfrued,118,2019-06-14T07:12:28Z,Python - 100天从新手到大师
51,top-100-stars,keras,41945,15993,Python,https://github.com/keras-team/keras,keras-team,2409,2019-06-12T14:41:00Z,Deep Learning for humans
52,top-100-stars,httpie,41900,2755,Python,https://github.com/jakubroztocil/httpie,jakubroztocil,166,2019-05-18T08:28:46Z,"As easy as httpie /aitch-tee-tee-pie/ 🥧 Modern command line HTTP client – user-friendly curl alternative with intuitive UI, JSON support, syntax highlighting, wget-like downloads, extensions, etc.  https://twitter.com/clihttp"
53,top-100-stars,elasticsearch,41768,13969,Java,https://github.com/elastic/elasticsearch,elastic,1976,2019-06-15T01:56:32Z,"Open Source, Distributed, RESTful Search Engine"
54,top-100-stars,computer-science,41504,6041,,https://github.com/ossu/computer-science,ossu,35,2019-05-14T18:58:09Z,:mortar_board: Path to a free self-taught education in Computer Science!
55,top-100-stars,resume.github.com,41066,1090,JavaScript,https://github.com/resume/resume.github.com,resume,35,2018-12-29T23:17:05Z,Resumes generated using the GitHub informations
56,top-100-stars,Front-end-Developer-Interview-Questions,41049,8279,HTML,https://github.com/h5bp/Front-end-Developer-Interview-Questions,h5bp,5,2019-06-06T08:30:11Z,"A list of helpful front-end related questions you can use to interview potential candidates, test yourself or completely ignore."
57,top-100-stars,json-server,40754,3625,JavaScript,https://github.com/typicode/json-server,typicode,440,2019-06-05T12:50:48Z,Get a full fake REST API with zero coding in less than 30 seconds (seriously)
58,top-100-stars,awesome-machine-learning,40331,10097,Python,https://github.com/josephmisiti/awesome-machine-learning,josephmisiti,1,2019-06-12T19:11:47Z,"A curated list of awesome Machine Learning frameworks, libraries and software."
59,top-100-stars,lodash,39629,4115,JavaScript,https://github.com/lodash/lodash,lodash,7,2019-06-11T18:38:31Z,"A modern JavaScript utility library delivering modularity, performance, & extras."
60,top-100-stars,spring-boot,39038,25413,Java,https://github.com/spring-projects/spring-boot,spring-projects,378,2019-06-15T01:58:00Z,Spring Boot
61,top-100-stars,requests,38972,7114,Python,https://github.com/kennethreitz/requests,kennethreitz,232,2019-06-13T20:49:12Z,Python HTTP Requests for Humans™ ✨🍰✨
62,top-100-stars,netdata,38908,3428,C,https://github.com/netdata/netdata,netdata,543,2019-06-14T14:14:24Z,"Real-time performance monitoring, done right! https://my-netdata.io/"
63,top-100-stars,bitcoin,38789,23362,C++,https://github.com/bitcoin/bitcoin,bitcoin,983,2019-06-15T01:38:58Z,Bitcoin Core integration/staging tree
64,top-100-stars,storybook,38746,3174,JavaScript,https://github.com/storybookjs/storybook,storybookjs,381,2019-06-15T01:50:57Z,"UI component dev & test: React, Vue, Angular, React Native, Ember, Web Components & more!"
65,top-100-stars,markdown-here,38609,6616,JavaScript,https://github.com/adam-p/markdown-here,adam-p,241,2019-05-11T14:08:34Z,"Google Chrome, Firefox, and Thunderbird extension that lets you write email in Markdown and render it before sending."
66,top-100-stars,shadowsocks-windows,38534,12927,C#,https://github.com/shadowsocks/shadowsocks-windows,shadowsocks,144,2019-06-13T01:05:45Z,"If you want to keep a secret, you must also hide it from yourself."
67,top-100-stars,element,38461,7951,Vue,https://github.com/ElemeFE/element,ElemeFE,887,2019-06-14T08:03:26Z,A Vue.js 2.0 UI Toolkit for Web
68,top-100-stars,material-design-icons,38177,7766,CSS,https://github.com/google/material-design-icons,google,551,2019-04-12T18:02:27Z,Material Design icons by Google
69,top-100-stars,next.js,38128,4573,JavaScript,https://github.com/zeit/next.js,zeit,200,2019-06-14T18:48:58Z,The React Framework
70,top-100-stars,every-programmer-should-know,37758,3478,,https://github.com/mtdvio/every-programmer-should-know,mtdvio,28,2019-05-13T09:46:31Z,A collection of (mostly) technical things every software developer should know
71,top-100-stars,ansible,37719,15795,Python,https://github.com/ansible/ansible,ansible,5816,2019-06-15T02:24:08Z,"Ansible is a radically simple IT automation platform that makes your applications and systems easier to deploy. Avoid writing scripts or custom code to deploy and update your applications — automate in a language that approaches plain English, using SSH, with no agents to install on remote systems. https://docs.ansible.com/ansible/"
72,top-100-stars,redis,37013,14213,C,https://github.com/antirez/redis,antirez,2257,2019-06-14T14:56:18Z,"Redis is an in-memory database that persists on disk. The data model is key-value, but many different kind of values are supported: Strings, Lists, Sets, Sorted Sets, Hashes, HyperLogLogs, Bitmaps."
73,top-100-stars,yarn,36036,2199,JavaScript,https://github.com/yarnpkg/yarn,yarnpkg,1847,2019-06-14T18:38:49Z,"📦🐈 Fast, reliable, and secure dependency management."
74,top-100-stars,materialize,35941,4795,JavaScript,https://github.com/Dogfalo/materialize,Dogfalo,668,2019-06-11T09:55:30Z,"Materialize, a CSS Framework based on Material Design"
75,top-100-stars,hugo,35931,4031,Go,https://github.com/gohugoio/hugo,gohugoio,364,2019-06-14T19:31:45Z,The world’s fastest framework for building websites.
76,top-100-stars,opencv,35675,26019,C++,https://github.com/opencv/opencv,opencv,1727,2019-06-15T02:40:55Z,Open Source Computer Vision Library
77,top-100-stars,FiraCode,35636,1141,Clojure,https://github.com/tonsky/FiraCode,tonsky,190,2019-06-09T15:17:34Z,Monospaced font with programming ligatures
78,top-100-stars,gatsby,35570,5202,JavaScript,https://github.com/gatsbyjs/gatsby,gatsbyjs,517,2019-06-15T00:50:15Z,"Build blazing fast, modern apps and websites with React"
79,top-100-stars,nw.js,35535,3795,C++,https://github.com/nwjs/nw.js,nwjs,744,2019-06-15T02:54:32Z,Call all Node.js modules directly from DOM/WebWorker and enable a new way of writing applications with all Web technologies.
80,top-100-stars,node-v0.x-archive,35470,7781,,https://github.com/nodejs/node-v0.x-archive,nodejs,571,2018-04-04T08:28:02Z,Moved to https://github.com/nodejs/node
81,top-100-stars,hacker-scripts,35470,5990,JavaScript,https://github.com/NARKOZ/hacker-scripts,NARKOZ,53,2019-05-02T05:23:36Z,Based on a true story
82,top-100-stars,deno,35454,1680,TypeScript,https://github.com/denoland/deno,denoland,225,2019-06-14T22:38:21Z,"A secure JavaScript/TypeScript runtime built with V8, Rust, and Tokio"
83,top-100-stars,nvm,35286,3326,Shell,https://github.com/nvm-sh/nvm,nvm-sh,283,2019-06-11T04:31:10Z,Node Version Manager - Simple bash script to manage multiple active node.js versions
84,top-100-stars,normalize.css,35282,7138,CSS,https://github.com/necolas/normalize.css,necolas,26,2019-05-16T10:02:32Z,A modern alternative to CSS resets
85,top-100-stars,bulma,35207,2820,CSS,https://github.com/jgthms/bulma,jgthms,287,2019-06-10T11:36:21Z,Modern CSS framework based on Flexbox
86,top-100-stars,vue-element-admin,35119,11371,Vue,https://github.com/PanJiaChen/vue-element-admin,PanJiaChen,199,2019-06-06T09:46:01Z,:tada: A magical vue admin                                                                https://panjiachen.github.io/vue-element-admin
87,top-100-stars,interviews,35039,7090,Java,https://github.com/kdn251/interviews,kdn251,40,2019-04-30T08:16:26Z,Everything you need to know to get the job.
88,top-100-stars,awesome-android-ui,34967,9076,,https://github.com/wasabeef/awesome-android-ui,wasabeef,29,2019-06-10T17:41:06Z,A curated list of awesome Android UI/UX libraries
89,top-100-stars,impress.js,34861,6821,JavaScript,https://github.com/impress/impress.js,impress,55,2019-06-13T10:27:41Z,It's a presentation framework based on the power of CSS3 transforms and transitions in modern browsers and inspired by the idea behind prezi.com.
90,top-100-stars,incubator-echarts,34725,10340,JavaScript,https://github.com/apache/incubator-echarts,apache,3289,2019-06-14T05:14:34Z,"A powerful, interactive charting and visualization library for browser"
91,top-100-stars,Front-End-Checklist,34689,3348,JavaScript,https://github.com/thedaviddias/Front-End-Checklist,thedaviddias,5,2019-06-09T23:15:23Z,🗂 The perfect Front-End Checklist for modern websites and meticulous developers
92,top-100-stars,freecodecamp.cn,34408,1284,CSS,https://github.com/FreeCodeCampChina/freecodecamp.cn,FreeCodeCampChina,124,2018-10-24T10:40:34Z,The FreeCodeCamp.cn(FCC China) open source codebase and curriculum. Learn to code and help nonprofits.
93,top-100-stars,x64dbg,33971,1019,C++,https://github.com/x64dbg/x64dbg,x64dbg,382,2019-06-13T11:17:24Z,An open-source x64/x32 debugger for windows.
94,top-100-stars,babel,33444,3563,JavaScript,https://github.com/babel/babel,babel,772,2019-06-15T02:58:02Z,🐠 Babel is a compiler for writing next generation JavaScript.
95,top-100-stars,scrapy,33182,7826,Python,https://github.com/scrapy/scrapy,scrapy,820,2019-06-14T21:19:08Z,"Scrapy, a fast high-level web crawling & scraping framework for Python."
96,top-100-stars,architect-awesome,33054,10063,,https://github.com/xingshaocheng/architect-awesome,xingshaocheng,40,2019-06-13T12:36:34Z,后端架构师技术图谱
97,top-100-stars,android-architecture,32905,9226,,https://github.com/googlesamples/android-architecture,googlesamples,127,2019-05-06T13:30:54Z,A collection of samples to discuss and showcase different architectural tools and patterns for Android apps.
98,top-100-stars,okhttp,32874,7232,Java,https://github.com/square/okhttp,square,198,2019-06-15T02:48:13Z,An HTTP+HTTP/2 client for Android and Java applications.
99,top-100-stars,retrofit,32713,6079,Java,https://github.com/square/retrofit,square,65,2019-06-12T13:39:43Z,"Type-safe HTTP client for Android and Java by Square, Inc."
100,top-100-stars,big-list-of-naughty-strings,32523,1375,Python,https://github.com/minimaxir/big-list-of-naughty-strings,minimaxir,72,2019-03-03T04:08:47Z,The Big List of Naughty Strings is a list of strings which have a high probability of causing issues when used as user-input data.
1,top-100-forks,ProgrammingAssignment2,595,116903,R,https://github.com/rdpeng/ProgrammingAssignment2,rdpeng,2767,2019-06-14T16:01:57Z,Repository for Programming Assignment 2 for R Programming on Coursera
2,top-100-forks,Spoon-Knife,10130,104302,HTML,https://github.com/octocat/Spoon-Knife,octocat,13602,2019-06-14T13:10:25Z,This repo is for demonstration purposes only.
3,top-100-forks,tensorflow,129403,75464,C++,https://github.com/tensorflow/tensorflow,tensorflow,2563,2019-06-15T02:59:24Z,An Open Source Machine Learning Framework for Everyone
4,top-100-forks,bootstrap,134018,65692,JavaScript,https://github.com/twbs/bootstrap,twbs,378,2019-06-14T10:46:33Z,"The most popular HTML, CSS, and JavaScript framework for developing responsive, mobile first projects on the web."
5,top-100-forks,SmartThingsPublic,1304,56340,Groovy,https://github.com/SmartThingsCommunity/SmartThingsPublic,SmartThingsCommunity,1923,2019-06-15T01:41:53Z,SmartThings open-source DeviceTypeHandlers and SmartApps code
6,top-100-forks,ExData_Plotting1,174,49716,,https://github.com/rdpeng/ExData_Plotting1,rdpeng,611,2019-06-14T05:35:42Z,Plotting Assignment 1 for Exploratory Data Analysis
7,top-100-forks,RepData_PeerAssessment1,76,31806,,https://github.com/rdpeng/RepData_PeerAssessment1,rdpeng,269,2019-05-22T14:44:38Z,Peer Assessment 1 for Reproducible Research
8,top-100-forks,free-programming-books,124222,30993,,https://github.com/EbookFoundation/free-programming-books,EbookFoundation,41,2019-06-10T16:49:10Z,:books: Freely available programming books
9,top-100-forks,angular.js,59572,28865,JavaScript,https://github.com/angular/angular.js,angular,461,2019-06-06T08:34:15Z,AngularJS - HTML enhanced for web apps!
10,top-100-forks,linux,76276,26688,C,https://github.com/torvalds/linux,torvalds,272,2019-06-15T01:54:07Z,Linux kernel source tree
11,top-100-forks,opencv,35675,26019,C++,https://github.com/opencv/opencv,opencv,1727,2019-06-15T02:40:55Z,Open Source Computer Vision Library
12,top-100-forks,spring-boot,39038,25413,Java,https://github.com/spring-projects/spring-boot,spring-projects,378,2019-06-15T01:58:00Z,Spring Boot
13,top-100-forks,jekyll-now,6071,24696,CSS,https://github.com/barryclark/jekyll-now,barryclark,208,2019-06-13T11:54:57Z,"Build a Jekyll blog in minutes, without touching the command line."
14,top-100-forks,frontend-nanodegree-resume,1048,24673,JavaScript,https://github.com/udacity/frontend-nanodegree-resume,udacity,1,2019-06-03T11:42:29Z,This repository is used for one of the projects in Udacity's Front-End Web Developer Nanodegree program. Learn how to become a Front-End Developer today with line-by-line code reviewed projects and get a job with career services!
15,top-100-forks,react,131048,24135,JavaScript,https://github.com/facebook/react,facebook,714,2019-06-15T01:08:24Z,"A declarative, efficient, and flexible JavaScript library for building user interfaces."
16,top-100-forks,patchwork,890,24076,HTML,https://github.com/jlord/patchwork,jlord,766,2019-06-15T02:36:27Z,All the Git-it Workshop completers! 
17,top-100-forks,bitcoin,38789,23362,C++,https://github.com/bitcoin/bitcoin,bitcoin,983,2019-06-15T01:38:58Z,Bitcoin Core integration/staging tree
18,top-100-forks,coding-interview-university,78585,23220,,https://github.com/jwasham/coding-interview-university,jwasham,59,2019-05-26T02:56:08Z,A complete computer science study plan to become a software engineer.
19,top-100-forks,tutorials,14796,21734,Java,https://github.com/eugenp/tutorials,eugenp,29,2019-06-15T01:01:43Z,"The ""REST With Spring"" Course: "
20,top-100-forks,CS-Notes,66608,20491,Java,https://github.com/CyC2018/CS-Notes,CyC2018,9,2019-06-13T06:28:02Z,:books: 技术面试必备基础知识、Leetcode 题解、Java、C++、Python、后端面试、操作系统、计算机网络、系统设计
21,top-100-forks,vue,141329,20346,JavaScript,https://github.com/vuejs/vue,vuejs,298,2019-06-14T14:24:27Z,"🖖 Vue.js is a progressive, incrementally-adoptable JavaScript framework for building UI on the web."
22,top-100-forks,three.js,52369,19727,JavaScript,https://github.com/mrdoob/three.js,mrdoob,885,2019-06-14T20:39:41Z,JavaScript 3D library.
23,top-100-forks,spark,22243,19232,Scala,https://github.com/apache/spark,apache,499,2019-06-15T02:46:52Z,Apache Spark
24,top-100-forks,rails,43359,17442,Ruby,https://github.com/rails/rails,rails,1152,2019-06-14T23:34:51Z,Ruby on Rails
25,top-100-forks,react-native,78108,17431,JavaScript,https://github.com/facebook/react-native,facebook,534,2019-06-15T02:07:04Z,A framework for building native apps with React.
26,top-100-forks,scikit-learn,35619,17395,Python,https://github.com/scikit-learn/scikit-learn,scikit-learn,1949,2019-06-15T01:55:41Z,scikit-learn: machine learning in Python
27,top-100-forks,first-contributions,6898,17274,,https://github.com/firstcontributions/first-contributions,firstcontributions,1081,2019-06-14T23:32:04Z,🚀✨ Help beginners to contribute to open source projects
28,top-100-forks,caffe,28322,17094,C++,https://github.com/BVLC/caffe,BVLC,1018,2019-06-03T22:25:48Z,Caffe: a fast open framework for deep learning.
29,top-100-forks,oh-my-zsh,90234,16834,Shell,https://github.com/robbyrussell/oh-my-zsh,robbyrussell,637,2019-06-14T18:52:43Z,"🙃 A delightful community-driven (with 1,300+ contributors) framework for managing your zsh configuration. Includes 200+ optional plugins (rails, git, OSX, hub, capistrano, brew, ant, php, python, etc), over 140 themes to spice up your morning, and an auto-update tool so that makes it easy to keep up with the latest updates from the community."
30,top-100-forks,ant-design,47651,16751,TypeScript,https://github.com/ant-design/ant-design,ant-design,327,2019-06-15T00:38:34Z,🌈 A UI Design Language
31,top-100-forks,free-programming-books-zh_CN,51195,16711,,https://github.com/justjavac/free-programming-books-zh_CN,justjavac,158,2019-06-10T03:33:40Z,:books: 免费的计算机编程类中文书籍，欢迎投稿
32,top-100-forks,javascript,86173,16522,JavaScript,https://github.com/airbnb/javascript,airbnb,137,2019-06-10T20:51:23Z,JavaScript Style Guide
33,top-100-forks,laravel,52938,16193,PHP,https://github.com/laravel/laravel,laravel,27,2019-06-13T12:51:23Z,A PHP framework for web artisans
34,top-100-forks,git,27872,16037,C,https://github.com/git/git,git,107,2019-06-15T01:30:26Z,Git Source Code Mirror - This is a publish-only repository and all pull requests are ignored. Please follow Documentation/SubmittingPatches procedure for any of your improvements.
