rank,item,repo_name,stars,forks,language,repo_url,username,issues,last_commit,description
48,CPP,xbmc,8047,4848,C++,https://github.com/xbmc/xbmc,xbmc,215,2018-12-20T21:10:58Z,"Kodi is an award-winning free and open source home theater/media center software and entertainment hub for digital media. With its beautiful interface and powerful skinning engine, it's available for Android, BSD, Linux, macOS, iOS and Windows."
49,CPP,Catch2,8044,1296,C++,https://github.com/catchorg/Catch2,catchorg,201,2018-12-18T19:27:49Z,"A modern, C++-native, header-only, test framework for unit-tests, TDD and BDD - using C++11, C++14, C++17 and later (or C++03 on the Catch1.x branch)"
50,CPP,brpc,7991,1819,C++,https://github.com/brpc/brpc,brpc,65,2018-12-19T15:36:40Z,"Industrial-grade RPC framework used throughout Baidu, with 1,000,000+ instances and thousands kinds of services, called ""baidu-rpc"" inside Baidu."
51,CPP,openage,7970,799,C++,https://github.com/SFTtech/openage,SFTtech,195,2018-12-20T20:01:29Z,Free (as in freedom) open source clone of the Age of Empires II engine :rocket:
52,CPP,libphonenumber,7928,1038,C++,https://github.com/googlei18n/libphonenumber,googlei18n,78,2018-12-20T22:36:55Z,"Google's common Java, C++ and JavaScript library for parsing, formatting, and validating international phone numbers."
53,CPP,Paddle,7920,2154,C++,https://github.com/PaddlePaddle/Paddle,PaddlePaddle,717,2018-12-21T03:40:00Z,PArallel Distributed Deep LEarning （PaddlePaddle核心框架，高性能单机、分布式训练和跨平台部署）
54,CPP,turicreate,7917,738,C++,https://github.com/apple/turicreate,apple,261,2018-12-20T23:30:46Z,Turi Create simplifies the development of custom machine learning models.
55,CPP,mosh,7858,501,C++,https://github.com/mobile-shell/mosh,mobile-shell,199,2018-10-19T23:44:38Z,Mobile Shell
56,CPP,openalpr,7840,1705,C++,https://github.com/openalpr/openalpr,openalpr,358,2018-10-19T21:03:42Z,Automatic License Plate Recognition library
57,CPP,envoy,7686,1099,C++,https://github.com/envoyproxy/envoy,envoyproxy,389,2018-12-21T03:46:55Z,C++ front/service proxy
58,CPP,Karabiner-Elements,7662,501,C++,https://github.com/tekezo/Karabiner-Elements,tekezo,114,2018-12-20T11:43:22Z,Karabiner-Elements is a powerful utility for keyboard customization on macOS Sierra (10.12) or later.
59,CPP,wkhtmltopdf,7535,1073,C++,https://github.com/wkhtmltopdf/wkhtmltopdf,wkhtmltopdf,640,2018-11-25T21:00:15Z,Convert HTML to PDF using Webkit (QtWebKit)
60,CPP,LightGBM,7478,2003,C++,https://github.com/Microsoft/LightGBM,Microsoft,79,2018-12-20T15:08:55Z,"A fast, distributed, high performance gradient boosting (GBDT, GBRT, GBM or MART) framework based on decision tree algorithms, used for ranking, classification and many other machine learning tasks. It is under the umbrella of the DMTK(http://github.com/microsoft/dmtk) project of Microsoft."
61,CPP,watchman,7471,567,C++,https://github.com/facebook/watchman,facebook,62,2018-12-20T17:12:20Z,"Watches files and records, or triggers actions, when they change. "
62,CPP,Proton,7354,240,C++,https://github.com/ValveSoftware/Proton,ValveSoftware,1468,2018-12-19T00:39:57Z,Compatibility tool for Steam Play based on Wine and additional components
63,CPP,robomongo,7139,620,C++,https://github.com/Studio3T/robomongo,Studio3T,593,2018-12-19T20:30:46Z,Native cross-platform MongoDB management tool
64,CPP,vnpy,7077,3380,C++,https://github.com/vnpy/vnpy,vnpy,30,2018-12-20T04:38:16Z,基于Python的开源量化交易平台开发框架
65,CPP,rapidjson,7012,1979,C++,https://github.com/Tencent/rapidjson,Tencent,337,2018-12-21T00:31:57Z,A fast JSON parser/generator for C++ with both SAX/DOM style API
66,CPP,arangodb,6931,522,C++,https://github.com/arangodb/arangodb,arangodb,478,2018-12-21T00:39:35Z,"🥑 ArangoDB is a native multi-model database with flexible data models for documents, graphs, and key-values. Build high performance applications using a convenient SQL-like query language or JavaScript extensions."
67,CPP,notepad-plus-plus,6668,2039,C++,https://github.com/notepad-plus-plus/notepad-plus-plus,notepad-plus-plus,2498,2018-12-21T03:39:58Z,Notepad++ official repository
68,CPP,openFrameworks,6617,2182,C++,https://github.com/openframeworks/openFrameworks,openframeworks,885,2018-12-14T17:33:30Z,openFrameworks is a community-developed cross platform toolkit for creative coding in C++.
69,CPP,AirSim,6538,1719,C++,https://github.com/Microsoft/AirSim,Microsoft,362,2018-12-19T22:36:31Z,"Open source simulator for autonomous vehicles built on Unreal Engine / Unity, from Microsoft AI & Research"
70,CPP,OpenRCT2,6530,709,C++,https://github.com/OpenRCT2/OpenRCT2,OpenRCT2,1044,2018-12-21T04:00:27Z,An open source re-implementation of RollerCoaster Tycoon 2 🎢
71,CPP,synergy-core,6493,1562,C++,https://github.com/symless/synergy-core,symless,240,2018-11-05T06:09:49Z,"Open source core of Synergy, the keyboard and mouse sharing tool"
72,CPP,solidity,6451,1745,C++,https://github.com/ethereum/solidity,ethereum,575,2018-12-20T23:47:38Z,"Solidity, the Contract-Oriented Programming Language"
73,CPP,zeal,6425,509,C++,https://github.com/zealdocs/zeal,zealdocs,125,2018-12-07T15:38:56Z,Offline documentation browser inspired by Dash
74,CPP,AndFix,6389,1574,C++,https://github.com/alibaba/AndFix,alibaba,238,2017-10-18T13:56:12Z,AndFix is a library that offer hot-fix for Android App.
75,CPP,dlib,6244,1892,C++,https://github.com/davisking/dlib,davisking,47,2018-12-18T13:09:14Z,A toolkit for making real world machine learning and data analysis applications in C++
76,CPP,AudioKit,6154,936,C++,https://github.com/AudioKit/AudioKit,AudioKit,13,2018-12-17T19:14:31Z,"Swift audio synthesis, processing, & analysis platform for iOS, macOS and tvOS"
77,CPP,capnproto,6126,503,C++,https://github.com/capnproto/capnproto,capnproto,83,2018-12-12T00:38:13Z,Cap'n Proto serialization/RPC system - core tools and C++ library
78,CPP,Tars,6043,1507,C++,https://github.com/TarsCloud/Tars,TarsCloud,44,2018-12-13T13:43:28Z,Tars is a highly performance rpc framework based on naming service using tars protocol and provides a semi-automatic operation platform.
79,CPP,vowpal_wabbit,5995,1486,C++,https://github.com/VowpalWabbit/vowpal_wabbit,VowpalWabbit,65,2018-12-21T00:44:51Z,"Vowpal Wabbit is a machine learning system which pushes the frontier of machine learning with techniques such as online, hashing, allreduce, reductions, learning2search, active, and interactive learning."
80,CPP,yuzu,5966,373,C++,https://github.com/yuzu-emu/yuzu,yuzu-emu,79,2018-12-19T18:14:44Z,Nintendo Switch Emulator
81,CPP,Gource,5932,500,C++,https://github.com/acaudwell/Gource,acaudwell,62,2018-12-06T15:45:49Z,software version control visualization
82,CPP,rpcs3,5923,1054,C++,https://github.com/RPCS3/rpcs3,RPCS3,442,2018-12-20T12:08:57Z,PS3 emulator/debugger
83,CPP,tiled,5907,1191,C++,https://github.com/bjorn/tiled,bjorn,428,2018-12-20T20:44:52Z,A flexible level editor
84,CPP,proxygen,5898,1124,C++,https://github.com/facebook/proxygen,facebook,32,2018-12-21T03:54:58Z,A collection of C++ HTTP libraries including an easy to use HTTP server.
85,CPP,ssdb,5830,1202,C++,https://github.com/ideawu/ssdb,ideawu,357,2018-11-21T04:49:35Z,"SSDB - A fast NoSQL database, an alternative to Redis"
86,CPP,node-sass,5804,813,C++,https://github.com/sass/node-sass,sass,139,2018-12-16T17:58:51Z,:rainbow: Node.js bindings to libsass
87,CPP,shadowsocks-qt5,5787,1857,C++,https://github.com/shadowsocks/shadowsocks-qt5,shadowsocks,27,2018-08-27T20:43:44Z,A cross-platform shadowsocks GUI client
88,CPP,aseprite,5770,609,C++,https://github.com/aseprite/aseprite,aseprite,651,2018-12-19T19:00:14Z,"Animated sprite editor & pixel art tool (Windows, macOS, Linux)"
89,CPP,ClickHouse,5734,921,C++,https://github.com/yandex/ClickHouse,yandex,582,2018-12-21T03:18:45Z,ClickHouse is a free analytic DBMS for big data.
90,CPP,thrift,5653,2710,C++,https://github.com/apache/thrift,apache,13,2018-12-20T03:12:42Z,Apache Thrift
91,CPP,devilution,5631,674,C++,https://github.com/diasurgical/devilution,diasurgical,81,2018-12-20T20:20:12Z,Diablo devolved - magic behind the 1996 computer game
92,CPP,node-canvas,5551,749,C++,https://github.com/Automattic/node-canvas,Automattic,160,2018-12-20T22:51:48Z,Node canvas is a Cairo backed Canvas implementation for NodeJS.
93,CPP,LeetCodeAnimation,5541,539,C++,https://github.com/MisterBooo/LeetCodeAnimation,MisterBooo,0,2018-12-20T00:57:18Z,Demonstrate all the questions on LeetCode in the form of animation.（用动画的形式呈现解LeetCode题目的思路）
94,CPP,bgfx,5516,913,C++,https://github.com/bkaradzic/bgfx,bkaradzic,176,2018-12-21T02:35:51Z,"Cross-platform, graphics API agnostic, ""Bring Your Own Engine/Framework"" style rendering library."
95,CPP,tinyrenderer,5465,439,C++,https://github.com/ssloy/tinyrenderer,ssloy,1,2018-10-27T22:00:49Z,A brief computer graphics / rendering course
96,CPP,qBittorrent,5442,953,C++,https://github.com/qbittorrent/qBittorrent,qbittorrent,2293,2018-12-20T12:16:40Z,qBittorrent BitTorrent client
97,CPP,android-ndk,5425,2523,C++,https://github.com/googlesamples/android-ndk,googlesamples,31,2018-12-14T23:56:19Z,Android NDK samples with Android Studio
98,CPP,ceph,5421,2846,C++,https://github.com/ceph/ceph,ceph,643,2018-12-21T03:59:35Z,"Ceph is a distributed object, block, and file storage platform "
99,CPP,ConEmu,5410,379,C++,https://github.com/Maximus5/ConEmu,Maximus5,636,2018-12-11T11:08:51Z,"Customizable Windows terminal with tabs, splits, quake-style, hotkeys and more"
100,CPP,filament,5408,290,C++,https://github.com/google/filament,google,25,2018-12-21T00:08:50Z,"Filament is a real-time physically based rendering engine for Android, iOS, Windows, Linux, macOS and WASM/WebGL"
1,Clojure,FiraCode,29531,911,Clojure,https://github.com/tonsky/FiraCode,tonsky,169,2018-12-20T14:55:40Z,Monospaced font with programming ligatures
2,Clojure,LightTable,10377,890,Clojure,https://github.com/LightTable/LightTable,LightTable,159,2018-12-19T16:14:42Z,The Light Table IDE
3,Clojure,clojurescript,7930,700,Clojure,https://github.com/clojure/clojurescript,clojure,2,2018-12-14T23:53:11Z,Clojure to JS compiler
4,Clojure,om,6591,372,Clojure,https://github.com/omcljs/om,omcljs,74,2018-06-01T19:24:08Z,ClojureScript interface to Facebook's React
5,Clojure,leiningen,6199,1441,Clojure,https://github.com/technomancy/leiningen,technomancy,192,2018-12-17T21:14:09Z,Automate Clojure projects without setting your hair on fire.
6,Clojure,awesomo,6157,391,Clojure,https://github.com/lk-geimfari/awesomo,lk-geimfari,7,2018-12-14T08:03:54Z,"An extensive list of interesting open source projects written in С, C++, Clojure, Lisp, Elixir, Erlang, Elm, Golang, Haskell, JavaScript, Lua, OCaml, Python, R, Ruby, Rust, Scala etc."
7,Clojure,overtone,4496,402,Clojure,https://github.com/overtone/overtone,overtone,85,2018-11-17T23:00:11Z,Collaborative Programmable Music 
8,Clojure,icepick,3761,214,Clojure,https://github.com/frankiesardo/icepick,frankiesardo,24,2018-08-21T21:53:46Z,Android Instance State made easy
9,Clojure,riemann,3686,500,Clojure,https://github.com/riemann/riemann,riemann,19,2018-12-13T20:02:05Z,"A network event stream processing system, in Clojure."
10,Clojure,re-frame,3508,452,Clojure,https://github.com/Day8/re-frame,Day8,25,2018-12-08T00:04:16Z,"A Reagent Framework For Writing SPAs, in Clojurescript."
11,Clojure,compojure,3501,230,Clojure,https://github.com/weavejester/compojure,weavejester,3,2018-08-20T21:11:26Z,A concise routing library for Ring/Clojure
12,Clojure,jepsen,3477,406,Clojure,https://github.com/jepsen-io/jepsen,jepsen-io,29,2018-12-20T23:06:42Z,"A framework for distributed systems verification, with fault injection"
13,Clojure,reagent,3246,259,Clojure,https://github.com/reagent-project/reagent,reagent-project,44,2018-12-16T05:15:21Z,A minimalistic ClojureScript interface to React.js
14,Clojure,alda,3112,191,Clojure,https://github.com/alda-lang/alda,alda-lang,1,2018-12-10T11:33:30Z,A music programming language for musicians. :notes:
15,Clojure,datascript,3083,198,Clojure,https://github.com/tonsky/datascript,tonsky,56,2018-12-13T22:03:25Z,"Immutable database and Datalog query engine for Clojure, ClojureScript and JS"
16,Clojure,clojure-koans,3033,1764,Clojure,https://github.com/functional-koans/clojure-koans,functional-koans,4,2018-08-08T09:25:34Z,A set of exercises for learning Clojure
17,Clojure,mori,3031,144,Clojure,https://github.com/swannodette/mori,swannodette,63,2018-11-09T11:13:57Z,ClojureScript's persistent data structures and supporting API from the comfort of vanilla JavaScript
18,Clojure,modern-cljs,2737,306,Clojure,https://github.com/magomimmo/modern-cljs,magomimmo,35,2018-08-30T16:05:03Z,A series of tutorials on ClojureScript
19,Clojure,ring,2691,422,Clojure,https://github.com/ring-clojure/ring,ring-clojure,28,2018-10-27T21:14:08Z,Clojure HTTP server abstraction
20,Clojure,lein-figwheel,2628,214,Clojure,https://github.com/bhauman/lein-figwheel,bhauman,87,2018-12-20T22:41:34Z,Figwheel builds your ClojureScript code and hot loads it into the browser as you are coding!
21,Clojure,status-react,2514,615,Clojure,https://github.com/status-im/status-react,status-im,528,2018-12-20T22:14:32Z,"a free (libre) open source, mobile OS for Ethereum"
22,Clojure,quil,2221,147,Clojure,https://github.com/quil/quil,quil,27,2018-11-30T08:01:35Z,Main repo. Quil source code.
23,Clojure,clojure-cookbook,2072,388,Clojure,https://github.com/clojure-cookbook/clojure-cookbook,clojure-cookbook,39,2018-08-24T22:04:06Z,This is the home of O'Reilly's Clojure Cookbook - http://clojure-cookbook.com
24,Clojure,aleph,2066,192,Clojure,https://github.com/ztellman/aleph,ztellman,52,2018-12-16T18:43:54Z,asynchronous communication for clojure
25,Clojure,incanter,2043,278,Clojure,https://github.com/incanter/incanter,incanter,69,2018-12-05T13:22:55Z,"Clojure-based, R-like statistical computing and graphics environment for the JVM"
26,Clojure,instaparse,2040,124,Clojure,https://github.com/Engelberg/instaparse,Engelberg,28,2018-12-18T20:39:49Z,
27,Clojure,pedestal,1980,230,Clojure,https://github.com/pedestal/pedestal,pedestal,37,2018-12-19T20:20:04Z,The Pedestal Server-side Libraries
28,Clojure,schema,1906,231,Clojure,https://github.com/plumatic/schema,plumatic,21,2018-07-30T05:31:11Z,Clojure(Script) library for declarative data description and validation
29,Clojure,hiccup,1837,139,Clojure,https://github.com/weavejester/hiccup,weavejester,23,2018-10-08T12:02:47Z,Fast library for rendering HTML in Clojure
30,Clojure,onyx,1820,189,Clojure,https://github.com/onyx-platform/onyx,onyx-platform,77,2018-12-20T05:57:51Z,"Distributed, masterless, high performance, fault tolerant data processing"
31,Clojure,specter,1806,76,Clojure,https://github.com/nathanmarz/specter,nathanmarz,24,2018-12-14T02:23:04Z,Clojure(Script)'s missing piece
32,Clojure,klipse,1730,86,Clojure,https://github.com/viebel/klipse,viebel,71,2018-12-19T05:58:49Z,"A simple client-side code evaluator pluggable on any web page: clojure, ruby, javascript, python, scheme, es2017, jsx, brainfuck, c++, reagent, lua, ocaml, reasonml"
33,Clojure,transit-format,1596,33,Clojure,https://github.com/cognitect/transit-format,cognitect,9,2017-03-15T11:21:48Z,A data interchange format.
34,Clojure,component,1572,79,Clojure,https://github.com/stuartsierra/component,stuartsierra,0,2018-01-21T16:45:05Z,Managed lifecycle of stateful objects in Clojure
35,Clojure,core.async,1550,169,Clojure,https://github.com/clojure/core.async,clojure,2,2018-12-06T16:30:58Z,Facilities for async programming and communication in Clojure
36,Clojure,boot,1536,161,Clojure,https://github.com/boot-clj/boot,boot-clj,103,2018-10-12T00:14:30Z,Build tooling for Clojure.
37,Clojure,awesome-clojure,1534,130,Clojure,https://github.com/razum2um/awesome-clojure,razum2um,6,2018-12-08T16:42:22Z,A curated list of awesome Clojure libraries and resources. Inspired by awesome-... stuff
38,Clojure,lumo,1505,66,Clojure,https://github.com/anmonteiro/lumo,anmonteiro,77,2018-11-11T00:53:20Z,"Fast, cross-platform, standalone ClojureScript environment"
39,Clojure,enlive,1453,142,Clojure,https://github.com/cgrand/enlive,cgrand,27,2018-09-26T09:26:22Z,a selector-based (à la CSS) templating and transformation system for Clojure
40,Clojure,kibit,1452,113,Clojure,https://github.com/jonase/kibit,jonase,60,2018-08-09T04:58:21Z,There's a function for that!
41,Clojure,Midje,1434,124,Clojure,https://github.com/marick/Midje,marick,41,2018-12-18T22:00:19Z,"Midje provides a migration path from clojure.test to a more flexible, readable, abstract, and gracious style of testing"
42,Clojure,Korma,1391,226,Clojure,https://github.com/korma/Korma,korma,79,2018-08-17T15:20:06Z,Tasty SQL for Clojure.
43,Clojure,auto-parcel,1388,91,Clojure,https://github.com/frankiesardo/auto-parcel,frankiesardo,12,2017-02-12T15:10:29Z,Android Parcelable models made easy
44,Clojure,sente,1367,135,Clojure,https://github.com/ptaoussanis/sente,ptaoussanis,29,2018-12-02T11:56:11Z,Realtime web comms for Clojure/Script
45,Clojure,drake,1351,102,Clojure,https://github.com/Factual/drake,Factual,83,2018-12-12T22:36:59Z,"Data workflow tool, like a ""Make for data"""
46,Clojure,cascalog,1343,180,Clojure,https://github.com/nathanmarz/cascalog,nathanmarz,40,2016-05-06T07:14:10Z,Data processing on Hadoop without the hassle.
47,Clojure,plumbing,1340,110,Clojure,https://github.com/plumatic/plumbing,plumatic,10,2018-02-22T03:32:31Z,Prismatic's Clojure(Script) utility belt
48,Clojure,duckling_old,1294,228,Clojure,https://github.com/wit-ai/duckling_old,wit-ai,70,2017-06-25T20:07:09Z,Deprecated in favor of https://github.com/facebook/duckling
49,Clojure,clj-http,1289,328,Clojure,https://github.com/dakrone/clj-http,dakrone,26,2018-11-08T22:07:54Z,An idiomatic clojure http client wrapping the apache client. Offically supported version.
50,Clojure,Nightcode,1279,121,Clojure,https://github.com/oakes/Nightcode,oakes,32,2018-09-18T20:07:33Z,An IDE for Clojure
51,Clojure,yesql,1278,108,Clojure,https://github.com/krisajenkins/yesql,krisajenkins,68,2018-08-03T23:28:21Z,A Clojure library for using SQL.
52,Clojure,devcards,1263,99,Clojure,https://github.com/bhauman/devcards,bhauman,17,2018-11-25T04:25:09Z,Devcards aims to provide a visual REPL experience for ClojureScript
53,Clojure,seesaw,1241,137,Clojure,https://github.com/daveray/seesaw,daveray,60,2018-10-31T22:14:27Z,"Seesaw turns the Horror of Swing into a friendly, well-documented, Clojure library"
54,Clojure,chestnut,1218,95,Clojure,https://github.com/plexus/chestnut,plexus,9,2018-07-30T20:44:14Z,Application template for Clojure + ClojureScript web apps
55,Clojure,Arcadia,1175,81,Clojure,https://github.com/arcadia-unity/Arcadia,arcadia-unity,27,2018-12-20T23:59:29Z,Clojure in Unity
56,Clojure,liberator,1159,141,Clojure,https://github.com/clojure-liberator/liberator,clojure-liberator,62,2018-12-21T03:56:39Z,Liberator is a Clojure library for building RESTful applications.
57,Clojure,core.logic,1142,100,Clojure,https://github.com/clojure/core.logic,clojure,1,2018-03-06T19:43:22Z,
58,Clojure,friend,1134,121,Clojure,https://github.com/cemerick/friend,cemerick,31,2017-07-25T15:52:18Z,An extensible authentication and authorization library for Clojure Ring web applications and services. 
59,Clojure,ultra,1098,24,Clojure,https://github.com/venantius/ultra,venantius,8,2018-12-14T11:25:48Z,A Leiningen plugin for a superior development environment
60,Clojure,cortex,1088,96,Clojure,https://github.com/originrose/cortex,originrose,31,2018-09-10T20:29:23Z,Machine learning in Clojure
61,Clojure,timbre,1084,128,Clojure,https://github.com/ptaoussanis/timbre,ptaoussanis,25,2018-11-06T19:11:54Z,Pure Clojure/Script logging library
62,Clojure,lacinia,1082,84,Clojure,https://github.com/walmartlabs/lacinia,walmartlabs,14,2018-12-19T23:27:18Z,GraphQL implementation in pure Clojure
63,Clojure,asciinema-player,1073,114,Clojure,https://github.com/asciinema/asciinema-player,asciinema,39,2018-12-12T14:38:38Z,Web player for terminal session recordings ⏩
64,Clojure,cheshire,1072,113,Clojure,https://github.com/dakrone/cheshire,dakrone,26,2018-12-14T17:04:04Z,Clojure JSON and JSON SMILE (binary json format) encoding/decoding
65,Clojure,closh,1063,29,Clojure,https://github.com/dundalek/closh,dundalek,39,2018-12-13T15:37:58Z,Bash-like shell based on Clojure
66,Clojure,core.typed,1059,67,Clojure,https://github.com/clojure/core.typed,clojure,0,2018-11-30T13:19:23Z,An optional type system for Clojure
67,Clojure,lein-cljsbuild,1011,163,Clojure,https://github.com/emezeske/lein-cljsbuild,emezeske,50,2018-07-02T13:39:11Z,Leiningen plugin to make ClojureScript development easy.
68,Clojure,frak,1010,39,Clojure,https://github.com/noprompt/frak,noprompt,2,2018-11-16T15:40:25Z,Transform collections of strings into regular expressions.
69,Clojure,code-maat,1003,118,Clojure,https://github.com/adamtornhill/code-maat,adamtornhill,11,2017-12-19T20:41:21Z,A command line tool to mine and analyze data from version-control systems
70,Clojure,frontend,991,128,Clojure,https://github.com/circleci/frontend,circleci,19,2018-11-17T17:41:08Z,CircleCI's frontend
71,Clojure,lux,985,40,Clojure,https://github.com/LuxLang/lux,LuxLang,7,2018-12-16T04:16:43Z,The Lux Programming Language
72,Clojure,garden,968,59,Clojure,https://github.com/noprompt/garden,noprompt,35,2018-10-14T00:19:53Z,Generate CSS with Clojure
73,Clojure,hitchhiker-tree,931,64,Clojure,https://github.com/datacrypt-project/hitchhiker-tree,datacrypt-project,17,2018-07-22T21:01:33Z,"Functional, persistent, off-heap, high performance data structure"
74,Clojure,play-clj,915,67,Clojure,https://github.com/oakes/play-clj,oakes,9,2017-10-21T14:25:43Z,A Clojure game library
75,Clojure,markright,913,58,Clojure,https://github.com/dvcrn/markright,dvcrn,24,2017-03-01T01:38:59Z,➡ Electron powered markdown editor with live preview
76,Clojure,4clojure,900,195,Clojure,https://github.com/4clojure/4clojure,4clojure,80,2018-04-14T21:49:31Z,An interactive problem website for learning Clojure
77,Clojure,honeysql,893,98,Clojure,https://github.com/jkk/honeysql,jkk,9,2018-11-21T22:43:19Z,Turn Clojure data structures into SQL
78,Clojure,logic-tutorial,888,81,Clojure,https://github.com/swannodette/logic-tutorial,swannodette,14,2018-10-30T11:45:38Z,A Very Gentle Introduction to Relational Programming
79,Clojure,compojure-api,883,124,Clojure,https://github.com/metosin/compojure-api,metosin,23,2018-12-09T07:23:07Z,Sweet web apis with Compojure & Swagger
80,Clojure,criterium,876,42,Clojure,https://github.com/hugoduncan/criterium,hugoduncan,13,2017-02-28T09:44:26Z,Benchmarking library for clojure
81,Clojure,test.check,867,91,Clojure,https://github.com/clojure/test.check,clojure,0,2018-11-30T13:29:12Z,QuickCheck for Clojure
82,Clojure,core.match,863,50,Clojure,https://github.com/clojure/core.match,clojure,0,2018-01-05T17:21:58Z,
83,Clojure,eastwood,859,53,Clojure,https://github.com/jonase/eastwood,jonase,100,2018-12-01T20:29:19Z,Clojure lint tool
84,Clojure,clojurec,856,53,Clojure,https://github.com/schani/clojurec,schani,5,2018-04-25T22:28:20Z,A Clojure implementation on top of C
85,Clojure,lt-cljs-tutorial,856,128,Clojure,https://github.com/swannodette/lt-cljs-tutorial,swannodette,10,2015-10-08T07:16:26Z,A ClojureScript Programming Language Tutorial for Light Table Users
86,Clojure,mount,837,62,Clojure,https://github.com/tolitius/mount,tolitius,21,2018-12-04T17:17:31Z,managing Clojure and ClojureScript app state since (reset)
87,Clojure,bidi,834,90,Clojure,https://github.com/juxt/bidi,juxt,52,2018-11-15T12:20:46Z,Bidirectional URI routing
88,Clojure,carmine,833,90,Clojure,https://github.com/ptaoussanis/carmine,ptaoussanis,13,2018-11-03T13:04:28Z,Redis client and message queue for Clojure
89,Clojure,pulsar,833,50,Clojure,https://github.com/puniverse/pulsar,puniverse,9,2017-09-06T16:16:37Z,"Fibers, Channels and Actors for Clojure"
90,Clojure,hoplon,830,62,Clojure,https://github.com/hoplon/hoplon,hoplon,42,2018-12-17T07:52:41Z,Hoplon web development tools and libraries.
91,Clojure,cljs-devtools,827,32,Clojure,https://github.com/binaryage/cljs-devtools,binaryage,8,2018-11-27T17:26:54Z,A collection of Chrome DevTools enhancements for ClojureScript developers
92,Clojure,clara-rules,817,92,Clojure,https://github.com/cerner/clara-rules,cerner,66,2018-12-18T00:48:26Z,Forward-chaining rules in Clojure(Script)
93,Clojure,amazonica,802,168,Clojure,https://github.com/mcohen01/amazonica,mcohen01,28,2018-12-19T23:16:03Z,A comprehensive Clojure client for the entire Amazon AWS api.
94,Clojure,pallet,795,120,Clojure,https://github.com/pallet/pallet,pallet,126,2018-05-25T15:44:26Z,Automates controlling and provisioning cloud server instances. DevOps for the JVM.
95,Clojure,noir,765,85,Clojure,https://github.com/noir-clojure/noir,noir-clojure,24,2012-12-13T23:35:54Z,A framework for writing web applications in clojure.
96,Clojure,dommy,750,81,Clojure,https://github.com/plumatic/dommy,plumatic,17,2018-01-07T00:14:06Z,A tiny ClojureScript DOM manipulation and event library
97,Clojure,tesser,741,39,Clojure,https://github.com/aphyr/tesser,aphyr,3,2018-05-15T13:35:07Z,"Clojure reducers, but for parallel execution: locally and on distributed systems."
98,Clojure,Nightlight,741,33,Clojure,https://github.com/oakes/Nightlight,oakes,13,2018-07-01T23:57:12Z,An embedded editor for Clojure
99,Clojure,environ,738,60,Clojure,https://github.com/weavejester/environ,weavejester,15,2018-12-11T13:37:47Z,Library for managing environment variables in Clojure
100,Clojure,duct,733,39,Clojure,https://github.com/duct-framework/duct,duct-framework,3,2018-12-07T17:47:25Z,Server-side application framework for Clojure
1,CoffeeScript,coffeescript,15029,1995,CoffeeScript,https://github.com/jashkenas/coffeescript,jashkenas,38,2018-12-03T18:34:36Z,Unfancy JavaScript
