rank,item,repo_name,stars,forks,language,repo_url,username,issues,last_commit,description
99,JavaScript,CodeMirror,20047,4285,JavaScript,https://github.com/codemirror/CodeMirror,codemirror,362,2020-04-21T10:47:53Z,In-browser code editor
100,JavaScript,react-starter-kit,20047,3970,JavaScript,https://github.com/kriasoft/react-starter-kit,kriasoft,490,2020-03-24T09:26:20Z,"React Starter Kit — isomorphic web app boilerplate (Node.js, Express, GraphQL, React.js, Babel, PostCSS, Webpack, Browsersync)"
1,Lua,kong,25526,3268,Lua,https://github.com/Kong/kong,Kong,347,2020-04-22T22:34:34Z,🦍 The Cloud-Native API Gateway 
2,Lua,waifu2x,17969,2055,Lua,https://github.com/nagadomi/waifu2x,nagadomi,104,2020-03-26T01:59:38Z,Image Super-Resolution for Anime-Style Art
3,Lua,neural-style,17478,2709,Lua,https://github.com/jcjohnson/neural-style,jcjohnson,321,2018-02-23T01:21:20Z,Torch implementation of neural style algorithm
4,Lua,openface,13253,3331,Lua,https://github.com/cmusatyalab/openface,cmusatyalab,3,2019-11-30T12:13:11Z,Face recognition with deep neural networks.
5,Lua,char-rnn,10106,2386,Lua,https://github.com/karpathy/char-rnn,karpathy,108,2018-05-04T15:25:25Z,"Multi-layer Recurrent Neural Networks (LSTM, GRU, RNN) for character-level language models in Torch"
6,Lua,CycleGAN,9611,1605,Lua,https://github.com/junyanz/CycleGAN,junyanz,35,2019-08-13T03:42:02Z,"Software that can generate photos from paintings,  turn horses into zebras,  perform style transfer, and more."
7,Lua,pix2pix,7617,1347,Lua,https://github.com/phillipi/pix2pix,phillipi,67,2020-04-02T23:15:32Z,Image-to-image translation with conditional adversarial nets
8,Lua,koreader,6036,734,Lua,https://github.com/koreader/koreader,koreader,378,2020-04-22T14:16:17Z,"An ebook reader application supporting PDF, DjVu, EPUB, FB2 and many more formats, running on Cervantes, Kindle, Kobo, PocketBook and Android devices"
9,Lua,dockercraft,5809,334,Lua,https://github.com/docker/dockercraft,docker,16,2018-06-18T12:15:21Z,Docker + Minecraft = Dockercraft
10,Lua,VeryNginx,5301,851,Lua,https://github.com/alexazhou/VeryNginx,alexazhou,102,2019-10-29T02:43:57Z," A very powerful and friendly  nginx base on lua-nginx-module( openresty ) which provide WAF, Control Panel, and Dashboards. "
11,Lua,lsyncd,3993,375,Lua,https://github.com/axkibe/lsyncd,axkibe,109,2020-03-17T00:15:41Z,Lsyncd (Live Syncing Daemon) synchronizes local directories with remote targets
12,Lua,DenseNet,3930,938,Lua,https://github.com/liuzhuang13/DenseNet,liuzhuang13,27,2020-02-11T15:57:57Z,"Densely Connected Convolutional Networks, In CVPR 2017 (Best Paper Award)."
13,Lua,fairseq,3575,626,Lua,https://github.com/facebookresearch/fairseq,facebookresearch,13,2020-04-05T18:53:27Z,Facebook AI Research Sequence-to-Sequence Toolkit
14,Lua,fast-neural-style,3512,712,Lua,https://github.com/jcjohnson/fast-neural-style,jcjohnson,135,2019-11-02T19:22:22Z,Feedforward style transfer
15,Lua,ntopng,3252,412,Lua,https://github.com/ntop/ntopng,ntop,192,2020-04-23T10:21:48Z,Web-based Traffic and Security Network Traffic Monitoring
16,Lua,luvit,3166,329,Lua,https://github.com/luvit/luvit,luvit,65,2020-03-27T08:55:57Z,Lua + libUV + jIT = pure awesomesauce
17,Lua,awesome,3092,386,Lua,https://github.com/awesomeWM/awesome,awesomeWM,350,2020-04-23T06:29:34Z,awesome window manager
18,Lua,deepmask,3067,533,Lua,https://github.com/facebookresearch/deepmask,facebookresearch,48,2019-01-16T17:21:51Z,Torch implementation of DeepMask and SharpMask
19,Lua,ngx_lua_waf,2956,1214,Lua,https://github.com/loveshell/ngx_lua_waf,loveshell,78,2019-04-26T04:14:46Z,ngx_lua_waf是一个基于lua-nginx-module(openresty)的web应用防火墙
20,Lua,openresty-best-practices,2919,729,Lua,https://github.com/moonbingbing/openresty-best-practices,moonbingbing,8,2020-01-09T14:45:49Z,
21,Lua,articles,2841,750,Lua,https://github.com/Wscats/articles,Wscats,3,2020-03-15T03:25:21Z,🔖My Learning Notes and Memories - 分享我的学习片段和与你的回忆
22,Lua,snabb,2408,295,Lua,https://github.com/snabbco/snabb,snabbco,224,2020-04-17T13:31:41Z,Snabb: Simple and fast packet networking
23,Lua,moonscript,2356,166,Lua,https://github.com/leafo/moonscript,leafo,164,2020-02-17T19:59:51Z,:crescent_moon: A language that compiles to Lua
24,Lua,neuralart,2353,358,Lua,https://github.com/kaishengtai/neuralart,kaishengtai,6,2017-03-05T18:08:54Z,An implementation of the paper 'A Neural Algorithm of Artistic Style'.
25,Lua,tarantool,2338,236,Lua,https://github.com/tarantool/tarantool,tarantool,970,2020-04-23T10:50:21Z,Get your data in RAM. Get compute close to data. Enjoy the performance.
26,Lua,torch-rnn,2272,500,Lua,https://github.com/jcjohnson/torch-rnn,jcjohnson,111,2018-04-28T08:50:05Z,"Efficient, reusable RNNs and LSTMs for torch"
27,Lua,OpenNMT,2260,458,Lua,https://github.com/OpenNMT/OpenNMT,OpenNMT,48,2020-02-19T16:08:46Z,Open Source Neural Machine Translation in Torch (deprecated)
28,Lua,incubator-apisix,2224,416,Lua,https://github.com/apache/incubator-apisix,apache,173,2020-04-23T10:31:29Z,Cloud-Native Microservices API Gateway
29,Lua,CorsixTH,2176,258,Lua,https://github.com/CorsixTH/CorsixTH,CorsixTH,265,2020-04-21T22:13:31Z,Open source clone of Theme Hospital
30,Lua,Algorithm-Implementations,2091,508,Lua,https://github.com/kennyledet/Algorithm-Implementations,kennyledet,12,2019-11-06T17:35:19Z,"Share, discuss and learn about algorithm implementations!"
31,Lua,siggraph2016_colorization,2041,299,Lua,https://github.com/satoshiiizuka/siggraph2016_colorization,satoshiiizuka,13,2017-08-24T08:40:12Z,Code for the paper 'Let there be Color!: Joint End-to-end Learning of Global and Local Image Priors for Automatic Image Colorization with Simultaneous Classification'. 
32,Lua,nmap-vulners,2016,326,Lua,https://github.com/vulnersCom/nmap-vulners,vulnersCom,10,2019-12-03T05:09:25Z,NSE script based on Vulners.com API
33,Lua,orange,1982,521,Lua,https://github.com/orlabs/orange,orlabs,68,2020-04-22T15:38:08Z,OpenResty/Nginx Gateway for API Monitoring and Management.
34,Lua,ZeroBraneStudio,1972,449,Lua,https://github.com/pkulchenko/ZeroBraneStudio,pkulchenko,77,2020-04-17T01:38:31Z,"Lightweight Lua-based IDE for Lua with code completion, syntax highlighting, live coding, remote debugger, and code analyzer; supports Lua 5.1, 5.2, 5.3, LuaJIT and other Lua interpreters on Windows, macOS, and Linux"
35,Lua,awesome-copycats,1962,420,Lua,https://github.com/lcpz/awesome-copycats,lcpz,3,2019-11-26T15:44:55Z,Awesome WM themes
36,Lua,PathOfBuilding,1951,976,Lua,https://github.com/Openarl/PathOfBuilding,Openarl,822,2020-04-20T02:39:01Z,Offline build planner for Path of Exile.
37,Lua,fb.resnet.torch,1941,631,Lua,https://github.com/facebookarchive/fb.resnet.torch,facebookarchive,61,2019-10-29T17:21:00Z,Torch implementation of ResNet from http://arxiv.org/abs/1512.03385 and training scripts
38,Lua,DeepMind-Atari-Deep-Q-Learner,1781,548,Lua,https://github.com/kuz/DeepMind-Atari-Deep-Q-Learner,kuz,23,2018-01-23T03:06:50Z,The original code from the DeepMind article + my tweaks
39,Lua,luarocks,1771,313,Lua,https://github.com/luarocks/luarocks,luarocks,167,2020-04-22T20:10:27Z,LuaRocks is the package manager for the Lua programming language.
40,Lua,MemNN,1686,381,Lua,https://github.com/facebook/MemNN,facebook,13,2019-12-09T15:07:40Z,Memory Networks implementations
41,Lua,crnn,1659,477,Lua,https://github.com/bgshih/crnn,bgshih,85,2019-03-04T05:12:37Z,Convolutional Recurrent Neural Network (CRNN) for image-based sequence recognition.
42,Lua,ResNeXt,1646,272,Lua,https://github.com/facebookresearch/ResNeXt,facebookresearch,9,2020-01-14T19:58:44Z,Implementation of a classification framework from the paper Aggregated Residual Transformations for Deep Neural Networks
43,Lua,art-DCGAN,1574,279,Lua,https://github.com/robbiebarrat/art-DCGAN,robbiebarrat,14,2019-01-09T20:36:18Z,"Modified implementation of DCGAN focused on generative art. Includes pre-trained models for landscapes, nude-portraits, and others."
44,Lua,lua-resty-auto-ssl,1563,127,Lua,https://github.com/auto-ssl/lua-resty-auto-ssl,auto-ssl,73,2020-04-08T17:22:56Z,On the fly (and free) SSL registration and renewal inside OpenResty/nginx with Let's Encrypt.
45,Lua,z.lua,1556,68,Lua,https://github.com/skywind3000/z.lua,skywind3000,26,2020-03-28T11:48:31Z,:zap: A new cd command that helps you navigate faster by learning your habits 
46,Lua,Anycomplete,1531,46,Lua,https://github.com/nathancahill/Anycomplete,nathancahill,3,2017-04-04T18:29:04Z,The magic of Google Autocomplete while you're typing. Anywhere.
47,Lua,qipai_algorithm,1500,677,Lua,https://github.com/yuanfengyun/qipai_algorithm,yuanfengyun,15,2019-09-29T04:43:46Z,棋牌的胡牌算法，包括麻将、跑胡子、扑克。实现 lua 、c++ 、c# 、golang 、js 、java 、python 版本。( Mahjong  algorithm )
48,Lua,vulscan,1493,365,Lua,https://github.com/scipag/vulscan,scipag,11,2019-09-23T12:14:06Z,Advanced vulnerability scanning with Nmap NSE
49,Lua,luafun,1421,89,Lua,https://github.com/luafun/luafun,luafun,28,2019-11-05T17:20:32Z,Lua Fun is a high-performance functional programming library for Lua designed with LuaJIT's trace compiler in mind.
50,Lua,lua-resty-redis,1410,370,Lua,https://github.com/openresty/lua-resty-redis,openresty,62,2020-04-20T07:05:43Z,Lua redis client driver for the ngx_lua based on the cosocket API
51,Lua,docker-jitsi-meet,1381,465,Lua,https://github.com/jitsi/docker-jitsi-meet,jitsi,139,2020-04-23T10:16:29Z,Jitsi Meet on Docker
52,Lua,luakit,1380,222,Lua,https://github.com/luakit/luakit,luakit,198,2020-04-18T07:49:24Z,"Fast, small, webkit based browser framework extensible by Lua."
53,Lua,multipathnet,1358,295,Lua,https://github.com/facebookresearch/multipathnet,facebookresearch,23,2019-03-22T18:15:44Z,"A Torch implementation of the object detection network from ""A MultiPath Network for Object Detection"" (https://arxiv.org/abs/1604.02135)"
54,Lua,lua-resty-http,1326,456,Lua,https://github.com/ledgetech/lua-resty-http,ledgetech,31,2020-04-12T05:30:46Z,Lua HTTP client cosocket driver for OpenResty / ngx_lua.
55,Lua,nn,1237,962,Lua,https://github.com/torch/nn,torch,172,2018-10-04T01:47:39Z,
56,Lua,keyboard,1235,140,Lua,https://github.com/jasonrudolph/keyboard,jasonrudolph,6,2020-03-05T15:34:32Z,⌨ Toward a more useful keyboard
57,Lua,Faster-High-Res-Neural-Inpainting,1203,211,Lua,https://github.com/leehomyc/Faster-High-Res-Neural-Inpainting,leehomyc,11,2018-05-29T22:01:59Z,High-Resolution Image Inpainting using Multi-Scale Neural Patch Synthesis
58,Lua,dcgan.torch,1201,375,Lua,https://github.com/soumith/dcgan.torch,soumith,41,2018-12-19T21:28:23Z,A torch implementation of http://arxiv.org/abs/1511.06434
59,Lua,middleclass,1187,137,Lua,https://github.com/kikito/middleclass,kikito,2,2019-11-27T03:24:40Z,Object-orientation for Lua
60,Lua,luacheck,1187,194,Lua,https://github.com/mpeterv/luacheck,mpeterv,38,2019-11-12T02:02:17Z, A tool for linting and static analysis of Lua code. 
61,Lua,vlsub,1161,328,Lua,https://github.com/exebetche/vlsub,exebetche,84,2020-04-07T14:12:03Z,VLC extension to download subtitles from opensubtitles.org
62,Lua,nProbe,1145,35,Lua,https://github.com/ntop/nProbe,ntop,44,2020-01-16T16:55:14Z,Open source components and extensions for nProbe
63,Lua,seq2seq-attn,1134,286,Lua,https://github.com/harvardnlp/seq2seq-attn,harvardnlp,14,2018-02-13T05:27:41Z,Sequence-to-sequence model with LSTM encoder/decoders and attention
64,Lua,Penlight,1114,188,Lua,https://github.com/Tieske/Penlight,Tieske,37,2020-02-02T08:44:44Z,"A set of pure Lua libraries focusing on input data handling (such as reading configuration files), functional programming (such as map, reduce, placeholder expressions,etc), and OS path management.  Much of the functionality is inspired by the Python standard libraries."
65,Lua,texture_nets,1109,213,Lua,https://github.com/DmitryUlyanov/texture_nets,DmitryUlyanov,41,2018-01-07T06:56:34Z,"Code for ""Texture Networks: Feed-forward Synthesis of Textures and Stylized Images"" paper."
66,Lua,KikiAuth,1104,1,Lua,https://github.com/fossasia/KikiAuth,fossasia,0,2018-11-23T17:17:23Z,CommonsNet KikiAuth for OpenWrt
67,Lua,fbcunn,1077,262,Lua,https://github.com/facebookarchive/fbcunn,facebookarchive,38,2017-07-21T22:04:03Z,Facebook's extensions to torch/cunn.
68,Lua,wide-residual-networks,1062,259,Lua,https://github.com/szagoruyko/wide-residual-networks,szagoruyko,26,2019-08-20T08:37:42Z,3.8% and 18.3% on CIFAR-10 and CIFAR-100
69,Lua,Fennel,1001,63,Lua,https://github.com/bakpakin/Fennel,bakpakin,11,2020-04-20T01:02:26Z,Lua Lisp Language
70,Lua,torchnet,991,205,Lua,https://github.com/facebookarchive/torchnet,facebookarchive,3,2019-03-27T22:21:16Z,Torch on steroids
71,Lua,lsofgraph,941,30,Lua,https://github.com/zevv/lsofgraph,zevv,0,2019-04-20T19:38:03Z,lsof to graphviz
72,Lua,sile,928,65,Lua,https://github.com/sile-typesetter/sile,sile-typesetter,208,2020-04-22T15:04:50Z,Simon's Improved Layout Engine
73,Lua,rnn,923,318,Lua,https://github.com/Element-Research/rnn,Element-Research,79,2017-12-21T06:29:48Z,Recurrent Neural Network library for Torch7's nn
74,Lua,minetest_game,922,433,Lua,https://github.com/minetest/minetest_game,minetest,110,2020-04-23T01:54:17Z,Minetest Game - The default game for the Minetest engine [https://github.com/minetest/minetest/]
75,Lua,AdaIN-style,895,146,Lua,https://github.com/xunhuang1995/AdaIN-style,xunhuang1995,14,2017-10-30T11:38:53Z,Arbitrary Style Transfer in Real-time with Adaptive Instance Normalization
76,Lua,busted,882,138,Lua,https://github.com/Olivine-Labs/busted,Olivine-Labs,52,2020-03-02T14:49:38Z,Elegant Lua unit testing.
77,Lua,lor,881,167,Lua,https://github.com/sumory/lor,sumory,14,2020-02-18T14:29:56Z,"a fast, minimalist web framework for lua based on OpenResty"
78,Lua,sailor,864,127,Lua,https://github.com/sailorproject/sailor,sailorproject,46,2019-07-05T13:13:50Z,A Lua MVC Web Framework.
79,Lua,hawkthorne-journey,864,383,Lua,https://github.com/hawkthorne/hawkthorne-journey,hawkthorne,35,2020-04-21T23:42:16Z,Digital Estate Planning: The Game
80,Lua,doomrl,860,114,Lua,https://github.com/chaosforgeorg/doomrl,chaosforgeorg,19,2018-10-03T03:25:35Z,"D**m, the Roguelike"
81,Lua,QuestieDev,859,200,Lua,https://github.com/AeroScripts/QuestieDev,AeroScripts,83,2020-04-22T02:32:07Z,Questie: the vanilla quest helper
82,Lua,NAMAS,852,254,Lua,https://github.com/facebookarchive/NAMAS,facebookarchive,18,2018-04-25T14:40:20Z,Neural Attention Model for Abstractive Summarization
83,Lua,telegram-bot,839,520,Lua,https://github.com/yagop/telegram-bot,yagop,116,2018-10-14T09:09:36Z,UNMAINTAINED - A Telegram Bot based on plugins
84,Lua,Crepe,829,231,Lua,https://github.com/zhangxiangxiao/Crepe,zhangxiangxiao,2,2019-07-23T06:07:51Z,Character-level Convolutional Networks for Text Classification
85,Lua,openstar,828,342,Lua,https://github.com/starjun/openstar,starjun,3,2020-01-19T12:56:53Z,"lua waf,nginx+lua,openresty,luajit,waf+,cdn,nginx"
86,Lua,CNNMRF,828,143,Lua,https://github.com/chuanli11/CNNMRF,chuanli11,8,2019-10-12T20:14:46Z,"code for paper ""Combining Markov Random Fields and Convolutional Neural Networks for Image Synthesis"""
87,Lua,awesome-hammerspoon,814,131,Lua,https://github.com/ashfinal/awesome-hammerspoon,ashfinal,11,2019-02-08T06:13:28Z,awesome configuration for Hammerspoon.
88,Lua,bAbI-tasks,812,180,Lua,https://github.com/facebookarchive/bAbI-tasks,facebookarchive,5,2019-03-27T22:23:53Z,Task generation for testing text understanding and reasoning
89,Lua,lstm-char-cnn,810,225,Lua,https://github.com/yoonkim/lstm-char-cnn,yoonkim,14,2016-08-24T12:53:43Z,LSTM language model with CNN over characters
90,Lua,Neural-Dialogue-Generation,809,224,Lua,https://github.com/jiweil/Neural-Dialogue-Generation,jiweil,15,2017-07-12T12:18:28Z,
91,Lua,icml2016,803,194,Lua,https://github.com/reedscot/icml2016,reedscot,28,2018-09-05T16:45:56Z,Generative Adversarial Text-to-Image Synthesis
92,Lua,treelstm,782,235,Lua,https://github.com/stanfordnlp/treelstm,stanfordnlp,9,2017-07-30T21:01:43Z,Tree-structured Long Short-Term Memory networks (http://arxiv.org/abs/1503.00075)
93,Lua,nginx-lua-prometheus,780,127,Lua,https://github.com/knyar/nginx-lua-prometheus,knyar,2,2020-04-22T08:42:08Z,Prometheus metric library for Nginx written in Lua
94,Lua,XNOR-Net,768,234,Lua,https://github.com/allenai/XNOR-Net,allenai,27,2017-12-05T01:39:30Z,ImageNet classification using binary Convolutional Neural Networks
95,Lua,im2markup,766,139,Lua,https://github.com/harvardnlp/im2markup,harvardnlp,11,2017-04-28T15:20:33Z,Neural model for converting Image-to-Markup (by Yuntian Deng github.com/da03)
96,Lua,neuralconvo,765,360,Lua,https://github.com/macournoyer/neuralconvo,macournoyer,26,2019-05-31T08:42:14Z,Neural conversational model in Torch
97,Lua,MoonGen,758,175,Lua,https://github.com/emmericp/MoonGen,emmericp,38,2020-02-26T15:47:04Z,MoonGen is a fully scriptable high-speed packet generator built on DPDK and LuaJIT. It can saturate a 10 Gbit/s connection with 64 byte packets on a single CPU core while executing user-provided Lua scripts for each packet. Multi-core support allows for even higher rates. It also features precise and accurate timestamping and rate control.
98,Lua,lua-protobuf,758,191,Lua,https://github.com/starwing/lua-protobuf,starwing,10,2020-04-18T13:49:27Z,A Lua module to work with Google protobuf
99,Lua,nmap-nse-scripts,750,338,Lua,https://github.com/cldrn/nmap-nse-scripts,cldrn,3,2020-01-17T12:09:10Z,My collection of nmap NSE scripts
100,Lua,inspect.lua,746,141,Lua,https://github.com/kikito/inspect.lua,kikito,11,2020-03-13T15:35:15Z,Human-readable representation of Lua tables
1,MATLAB,deep-photo-styletransfer,9547,1408,Matlab,https://github.com/luanfujun/deep-photo-styletransfer,luanfujun,30,2017-08-12T08:07:42Z,"Code and data for paper ""Deep Photo Style Transfer"": https://arxiv.org/abs/1703.07511 "
2,MATLAB,PRMLT,4592,1900,MATLAB,https://github.com/PRML/PRMLT,PRML,0,2020-03-04T13:50:30Z,Matlab code for machine learning algorithms in book PRML
3,MATLAB,OpenFace,4394,1434,MATLAB,https://github.com/TadasBaltrusaitis/OpenFace,TadasBaltrusaitis,197,2020-03-29T23:17:50Z,"OpenFace – a state-of-the art tool intended for facial landmark detection, head pose estimation, facial action unit recognition, and eye-gaze estimation."
4,MATLAB,DeepLearnToolbox,3471,2225,Matlab,https://github.com/rasmusbergpalm/DeepLearnToolbox,rasmusbergpalm,83,2018-10-13T18:08:01Z,"Matlab/Octave toolbox for deep learning. Includes Deep Belief Nets, Stacked Autoencoders, Convolutional Neural Nets, Convolutional Autoencoders and vanilla Neural Nets. Each method has examples to get you started."
5,MATLAB,MTCNN_face_detection_alignment,2347,945,Matlab,https://github.com/kpzhang93/MTCNN_face_detection_alignment,kpzhang93,45,2018-04-04T03:17:19Z,Joint Face Detection and Alignment using Multi-task Cascaded Convolutional Neural Networks
6,MATLAB,faster_rcnn,2274,1178,Matlab,https://github.com/ShaoqingRen/faster_rcnn,ShaoqingRen,139,2018-07-26T04:26:32Z,Faster R-CNN
7,MATLAB,OpenTLD,2071,1300,Matlab,https://github.com/zk00006/OpenTLD,zk00006,38,2016-02-01T11:28:11Z,OpenTLD is an open source library for real-time 2D tracking of a single object in video. This repository is no longer under development. For latest version see: http://www.tldvision.com/tld2.html
8,MATLAB,rcnn,1991,905,Matlab,https://github.com/rbgirshick/rcnn,rbgirshick,55,2017-04-03T16:16:14Z,R-CNN: Regions with Convolutional Neural Network Features
9,MATLAB,eviltransform,1884,411,Matlab,https://github.com/googollee/eviltransform,googollee,14,2020-01-25T12:23:20Z,Transport coordinate between earth(WGS-84) and mars in china(GCJ-02).
10,MATLAB,Coding-Guide,1364,179,MATLAB,https://github.com/ecmadao/Coding-Guide,ecmadao,0,2020-04-08T03:28:07Z,自己随手记录的东西
11,MATLAB,crfasrnn,1307,480,MATLAB,https://github.com/torrvision/crfasrnn,torrvision,47,2019-11-30T13:17:39Z,This repository contains the source code for the semantic image segmentation method described in the ICCV 2015 paper: Conditional Random Fields as Recurrent Neural Networks. http://crfasrnn.torr.vision/
12,MATLAB,CAM,1208,352,Matlab,https://github.com/zhoubolei/CAM,zhoubolei,10,2018-05-02T19:30:19Z,Class Activation Mapping
13,MATLAB,R-FCN,1187,540,Matlab,https://github.com/daijifeng001/R-FCN,daijifeng001,30,2017-05-05T15:50:59Z,R-FCN: Object Detection via Region-based Fully Convolutional Networks
14,MATLAB,tiny,1052,303,MATLAB,https://github.com/peiyunh/tiny,peiyunh,3,2020-03-21T02:04:30Z,"Tiny Face Detector, CVPR 2017"
15,MATLAB,machine-learning-coursera-1,1048,923,,https://github.com/Borye/machine-learning-coursera-1,Borye,6,2019-07-28T13:49:39Z,This repo is specially created for all the work done my me as a part of Coursera's Machine Learning Course.
16,MATLAB,BPL,921,311,Matlab,https://github.com/brendenlake/BPL,brendenlake,0,2015-12-28T20:48:56Z,Bayesian Program Learning model for one-shot learning
17,MATLAB,matlab2tikz,914,215,MATLAB,https://github.com/matlab2tikz/matlab2tikz,matlab2tikz,218,2020-02-23T10:25:18Z,This program converts MATLAB®/Octave figures to TikZ/pgfplots figures for smooth integration into LaTeX.
18,MATLAB,omniglot,824,261,MATLAB,https://github.com/brendenlake/omniglot,brendenlake,1,2019-02-13T15:11:01Z,Omniglot data set for one-shot learning
19,MATLAB,export_fig,781,261,MATLAB,https://github.com/altmany/export_fig,altmany,43,2020-03-29T07:38:34Z,A MATLAB toolbox for exporting publication quality figures
20,MATLAB,DnCNN,743,389,MATLAB,https://github.com/cszn/DnCNN,cszn,21,2020-04-09T17:59:52Z,"Beyond a Gaussian Denoiser: Residual Learning of Deep CNN for Image Denoising (TIP, 2017)"
21,MATLAB,toolbox,730,483,Matlab,https://github.com/pdollar/toolbox,pdollar,38,2019-05-06T18:46:16Z,Piotr's Image & Video Matlab Toolbox
22,MATLAB,Octave,725,453,Matlab,https://github.com/schneems/Octave,schneems,12,2020-04-09T15:18:43Z,"my octave exercises for 2011 stanford machine learning class, posted after the due date of course"
23,MATLAB,face_verification_experiment,700,337,Matlab,https://github.com/AlfredXiangWu/face_verification_experiment,AlfredXiangWu,2,2017-02-10T09:19:33Z,Original Caffe Version for LightCNN-9. Highly recommend to use PyTorch Version (https://github.com/AlfredXiangWu/LightCNN) 
24,MATLAB,edges,656,338,Matlab,https://github.com/pdollar/edges,pdollar,18,2019-12-02T22:40:33Z,Structured Edge Detection Toolbox
25,MATLAB,Algorithms_MathModels,653,303,MATLAB,https://github.com/HuangCongQing/Algorithms_MathModels,HuangCongQing,1,2020-02-12T15:48:07Z,【国赛】【美赛】数学建模相关算法 MATLAB实现（2018年初整理）
26,MATLAB,convnet-burden,651,99,MATLAB,https://github.com/albanie/convnet-burden,albanie,4,2019-01-17T11:15:00Z,Memory consumption and FLOP count estimates for convnets
27,MATLAB,activityrecognition,617,289,MATLAB,https://github.com/jindongwang/activityrecognition,jindongwang,1,2019-08-20T05:46:37Z,Resources about activity recognition-行为识别资料
28,MATLAB,Gait-Tracking-With-x-IMU,572,325,Matlab,https://github.com/xioTechnologies/Gait-Tracking-With-x-IMU,xioTechnologies,14,2017-08-03T13:31:31Z,
29,MATLAB,CNN-for-Image-Retrieval,570,231,MATLAB,https://github.com/willard-yuan/CNN-for-Image-Retrieval,willard-yuan,1,2019-07-14T09:12:22Z,":sunrise:The code of post ""Image retrieval using MatconvNet and pre-trained imageNet"""
30,MATLAB,lrslibrary,558,302,MATLAB,https://github.com/andrewssobral/lrslibrary,andrewssobral,3,2020-03-11T15:25:14Z,Low-Rank and Sparse Tools for Background Modeling and Subtraction in Videos
31,MATLAB,machine-learning-octave,558,164,MATLAB,https://github.com/trekhleb/machine-learning-octave,trekhleb,0,2018-12-22T08:52:56Z,🤖 MatLab/Octave examples of popular machine learning algorithms with code examples and mathematics being explained
32,MATLAB,ICNet,555,189,MATLAB,https://github.com/hszhao/ICNet,hszhao,24,2019-09-09T13:49:55Z,"ICNet for Real-Time Semantic Segmentation on High-Resolution Images, ECCV2018"
33,MATLAB,mexopencv,552,289,Matlab,https://github.com/kyamagu/mexopencv,kyamagu,31,2018-12-16T22:07:19Z,Collection and a development kit of matlab mex functions for OpenCV library
34,MATLAB,siamese-fc,550,220,MATLAB,https://github.com/bertinetto/siamese-fc,bertinetto,33,2019-05-16T10:10:53Z,Arbitrary object tracking at 50-100 FPS with Fully Convolutional Siamese networks.
35,MATLAB,voc-dpm,537,307,Matlab,https://github.com/rbgirshick/voc-dpm,rbgirshick,16,2017-04-03T16:06:41Z,Object detection system using deformable part models (DPMs) and latent SVM (voc-release5). You may want to use the latest tarball on my website. The github code may include code changes that have not been tested as thoroughly and will not necessarily reproduce the results on the website.
36,MATLAB,matlab-schemer,507,150,Matlab,https://github.com/scottclowe/matlab-schemer,scottclowe,7,2019-09-05T05:43:15Z,Apply and save color schemes in MATLAB with ease.
37,MATLAB,VAD,505,155,MATLAB,https://github.com/jtkim-kaist/VAD,jtkim-kaist,27,2019-02-10T16:47:27Z,"Voice activity detection (VAD) toolkit including DNN, bDNN, LSTM and ACAM based VAD. We also provide our directly recorded dataset."
38,MATLAB,refinenet,500,149,MATLAB,https://github.com/guosheng/refinenet,guosheng,0,2019-06-01T05:40:49Z, RefineNet: Multi-Path Refinement Networks for High-Resolution Semantic Segmentation
39,MATLAB,Stanford-Machine-Learning-Course,494,354,Matlab,https://github.com/zhouxc/Stanford-Machine-Learning-Course,zhouxc,1,2011-12-25T10:04:23Z,machine learning course programming exercise
40,MATLAB,SemanticSoftSegmentation,493,135,Matlab,https://github.com/yaksoy/SemanticSoftSegmentation,yaksoy,7,2018-07-30T12:54:45Z,"Spectral segmentation described in Aksoy et al., ""Semantic Soft Segmentation"", ACM TOG (Proc. SIGGRAPH), 2018"
41,MATLAB,ECO,492,225,MATLAB,https://github.com/martin-danelljan/ECO,martin-danelljan,6,2019-10-24T11:11:11Z,Matlab implementation of the ECO tracker.
