rank,item,repo_name,stars,forks,language,repo_url,username,issues,last_commit,description
52,Python,macOS-Security-and-Privacy-Guide,14851,1036,Python,https://github.com/drduh/macOS-Security-and-Privacy-Guide,drduh,4,2019-05-21T03:52:04Z,Guide to securing and improving privacy on macOS
53,Python,wtfpython,14788,1375,Python,https://github.com/satwikkansal/wtfpython,satwikkansal,15,2019-06-10T19:13:56Z,A collection of surprising Python snippets and lesser-known features.
54,Python,source-code-pro,14661,1219,Python,https://github.com/adobe-fonts/source-code-pro,adobe-fonts,37,2019-06-10T07:39:30Z,Monospaced font family for user interface and coding environments
55,Python,django-rest-framework,14413,4270,Python,https://github.com/encode/django-rest-framework,encode,204,2019-06-14T22:35:52Z,Web APIs for Django. ⚡️
56,Python,sqlmap,14407,3121,Python,https://github.com/sqlmapproject/sqlmap,sqlmapproject,44,2019-06-14T10:20:45Z,Automatic SQL injection and database takeover tool
57,Python,python-fire,14243,845,Python,https://github.com/google/python-fire,google,57,2019-06-13T14:20:21Z,Python Fire is a library for automatically generating command line interfaces (CLIs) from absolutely any Python object.
58,Python,chinese-poetry,13974,2442,Python,https://github.com/chinese-poetry/chinese-poetry,chinese-poetry,28,2019-06-06T09:28:00Z,"最全中华古诗词数据库,  唐宋两朝近一万四千古诗人,  接近5.5万首唐诗加26万宋诗.  两宋时期1564位词人，21050首词。  "
59,Python,ZeroNet,13921,1799,Python,https://github.com/HelloZeroNet/ZeroNet,HelloZeroNet,583,2019-06-14T22:44:00Z,ZeroNet - Decentralized websites using Bitcoin crypto and BitTorrent network
60,Python,wechat_jump_game,13908,4684,Python,https://github.com/wangshub/wechat_jump_game,wangshub,25,2018-08-03T00:44:49Z,微信《跳一跳》Python 辅助
61,Python,ipython,13628,3832,Python,https://github.com/ipython/ipython,ipython,1187,2019-06-13T22:37:00Z,"Official repository for IPython itself. Other repos in the IPython organization contain things like the website, documentation builds, etc."
62,Python,glances,13605,918,Python,https://github.com/nicolargo/glances,nicolargo,112,2019-06-12T21:15:20Z,"Glances an Eye on your system. A top/htop alternative for GNU/Linux, BSD, Mac OS and Windows operating systems."
63,Python,spaCy,13590,2329,Python,https://github.com/explosion/spaCy,explosion,162,2019-06-14T07:31:07Z,💫 Industrial-strength Natural Language Processing (NLP) with Python and Cython
64,Python,algo,13508,1183,Python,https://github.com/trailofbits/algo,trailofbits,46,2019-06-14T09:08:30Z,Set up a personal IPSEC VPN in the cloud
65,Python,magenta,13359,2628,Python,https://github.com/tensorflow/magenta,tensorflow,198,2019-06-07T22:56:25Z,Magenta: Music and Art Generation with Machine Intelligence
66,Python,pyspider,13244,3252,Python,https://github.com/binux/pyspider,binux,236,2019-05-09T15:53:42Z,A Powerful Spider(Web Crawler) System in Python.
67,Python,HelloGitHub,13027,1422,Python,https://github.com/521xueweihan/HelloGitHub,521xueweihan,36,2019-06-13T15:21:36Z,:octocat: 分享 GitHub 上有趣、入门级的开源项目「每月28号更新」
68,Python,redash,12885,2123,Python,https://github.com/getredash/redash,getredash,464,2019-06-15T02:24:56Z,"Make Your Company Data Driven. Connect to any data source, easily visualize, dashboard and share your data."
69,Python,hosts,12847,1127,Python,https://github.com/StevenBlack/hosts,StevenBlack,52,2019-06-11T16:16:09Z,"Extending and consolidating hosts files from several well-curated sources like adaway.org, mvps.org, malwaredomainlist.com, someonewhocares.org, and potentially others.  You can optionally invoke extensions to block additional sites by category. "
70,Python,celery,12646,3299,Python,https://github.com/celery/celery,celery,416,2019-06-14T22:24:02Z,Distributed Task Queue (development branch)
71,Python,airflow,12619,4594,Python,https://github.com/apache/airflow,apache,309,2019-06-14T22:09:50Z,Apache Airflow
72,Python,Mask_RCNN,12479,5510,Python,https://github.com/matterport/Mask_RCNN,matterport,946,2019-06-13T00:55:10Z,Mask R-CNN for object detection and instance segmentation on Keras and TensorFlow
73,Python,sanic,12236,1157,Python,https://github.com/huge-success/sanic,huge-success,41,2019-06-11T08:21:52Z,Async Python 3.6+ web server/framework | Build fast. Run fast.
74,Python,TensorFlow-Course,12207,2304,Python,https://github.com/machinelearningmindset/TensorFlow-Course,machinelearningmindset,1,2019-05-16T05:36:38Z,Simple and ready-to-use tutorials for TensorFlow 
75,Python,bitcoinbook,11887,3462,Python,https://github.com/bitcoinbook/bitcoinbook,bitcoinbook,90,2019-05-27T09:05:06Z,Mastering Bitcoin 2nd Edition - Programming the Open Blockchain
76,Python,pytorch-tutorial,11879,3629,Python,https://github.com/yunjey/pytorch-tutorial,yunjey,45,2019-05-12T21:44:06Z,PyTorch Tutorial for Deep Learning Researchers
77,Python,luigi,11729,1946,Python,https://github.com/spotify/luigi,spotify,45,2019-06-14T22:16:43Z,"Luigi is a Python module that helps you build complex pipelines of batch jobs. It handles dependency resolution, workflow management, visualization etc. It also comes with Hadoop support built in. "
78,Python,ML-From-Scratch,11607,2074,Python,https://github.com/eriklindernoren/ML-From-Scratch,eriklindernoren,10,2019-06-09T02:21:59Z,Machine Learning From Scratch. Bare bones NumPy implementations of machine learning models and algorithms with a focus on accessibility. Aims to cover everything from linear regression to deep learning.
79,Python,PySnooper,11519,707,Python,https://github.com/cool-RR/PySnooper,cool-RR,12,2019-06-14T16:10:03Z,Never use print for debugging again
80,Python,Python,11481,6455,Python,https://github.com/geekcomputers/Python,geekcomputers,77,2019-05-17T16:45:23Z,My Python Examples
81,Python,fabric,11346,1719,Python,https://github.com/fabric/fabric,fabric,343,2019-06-12T06:32:53Z,"Simple, Pythonic remote execution and deployment."
82,Python,nginx-proxy,10968,2035,Python,https://github.com/jwilder/nginx-proxy,jwilder,527,2019-05-19T21:49:11Z,Automated nginx proxy for Docker containers using docker-gen
83,Python,material-theme,10897,785,Python,https://github.com/equinusocio/material-theme,equinusocio,3,2019-05-31T08:01:09Z,"Material Theme, the most epic theme for Sublime Text 3 by Mattia Astorino"
84,Python,Awesome-Linux-Software,10891,1006,Python,https://github.com/luong-komorebi/Awesome-Linux-Software,luong-komorebi,14,2019-06-10T03:27:31Z,"A list of awesome applications, software, tools and other materials for Linux distros. "
85,Python,black,10874,544,Python,https://github.com/python/black,python,171,2019-06-13T10:45:03Z,The uncompromising Python code formatter
86,Python,NLP-progress,10782,1742,Python,https://github.com/sebastianruder/NLP-progress,sebastianruder,17,2019-06-13T18:58:21Z,"Repository to track the progress in Natural Language Processing (NLP), including the datasets and the current state-of-the-art for the most common NLP tasks."
87,Python,awesome-algorithm,10500,2104,Python,https://github.com/apachecn/awesome-algorithm,apachecn,3,2019-06-13T08:34:53Z,Lisanaaa 小专栏
88,Python,tqdm,10428,552,Python,https://github.com/tqdm/tqdm,tqdm,211,2019-06-13T00:57:07Z,"A Fast, Extensible Progress Bar for Python and CLI"
89,Python,powerline,10427,805,Python,https://github.com/powerline/powerline,powerline,169,2019-06-12T22:27:54Z,"Powerline is a statusline plugin for vim, and provides statuslines and prompts for several other applications, including zsh, bash, tmux, IPython, Awesome and Qtile."
90,Python,manim,10287,1161,Python,https://github.com/3b1b/manim,3b1b,70,2019-06-14T05:49:08Z,Animation engine for explanatory math videos
91,Python,locust,10268,1476,Python,https://github.com/locustio/locust,locustio,170,2019-06-11T11:09:44Z,Scalable user load testing tool written in Python
92,Python,pix2code,10249,1053,Python,https://github.com/tonybeltramelli/pix2code,tonybeltramelli,0,2019-04-09T23:35:37Z,pix2code: Generating Code from a Graphical User Interface Screenshot
93,Python,salt,9987,4579,Python,https://github.com/saltstack/salt,saltstack,2614,2019-06-15T00:50:13Z,Software to automate the management and configuration of any infrastructure or application at scale. Get access to the Salt software package repository here: 
94,Python,zulip,9943,3059,Python,https://github.com/zulip/zulip,zulip,1342,2019-06-15T02:49:16Z,Zulip server - powerful open source team chat
95,Python,requests-html,9757,583,Python,https://github.com/kennethreitz/requests-html,kennethreitz,56,2019-05-31T17:23:28Z,Pythonic HTML Parsing for Humans™
96,Python,autojump,9722,480,Python,https://github.com/wting/autojump,wting,154,2019-05-31T07:43:20Z,A cd command that learns - easily navigate directories from the command line
97,Python,cookiecutter,9687,1057,Python,https://github.com/audreyr/cookiecutter,audreyr,239,2019-06-11T01:53:15Z,"A command-line utility that creates projects from cookiecutters (project templates). E.g. Python package projects, jQuery plugin projects."
98,Python,FastPhotoStyle,9658,933,Python,https://github.com/NVIDIA/FastPhotoStyle,NVIDIA,38,2019-05-14T09:40:36Z,"Style transfer, deep learning, feature transform"
99,Python,bokeh,9565,2569,Python,https://github.com/bokeh/bokeh,bokeh,404,2019-06-14T23:37:50Z,Interactive Web Plotting for Python
100,Python,matplotlib,9414,4241,Python,https://github.com/matplotlib/matplotlib,matplotlib,1473,2019-06-14T20:19:33Z,matplotlib: plotting with Python
1,R,ggplot2,3840,1432,R,https://github.com/tidyverse/ggplot2,tidyverse,172,2019-06-14T03:24:15Z,An implementation of the Grammar of Graphics in R
2,R,awesome-R,3543,1182,R,https://github.com/qinwf/awesome-R,qinwf,2,2019-06-10T10:45:17Z,"A curated list of awesome R packages, frameworks and software."
3,R,ML_for_Hackers,3504,2228,R,https://github.com/johnmyleswhite/ML_for_Hackers,johnmyleswhite,34,2019-05-26T16:52:29Z,"Code accompanying the book ""Machine Learning for Hackers"""
4,R,shiny,3434,1498,R,https://github.com/rstudio/shiny,rstudio,427,2019-06-14T21:26:31Z,Easy interactive web applications with R
5,R,dplyr,2949,1080,R,https://github.com/tidyverse/dplyr,tidyverse,103,2019-06-14T13:50:48Z,dplyr: A grammar of data manipulation
6,R,AnomalyDetection,2942,670,R,https://github.com/twitter/AnomalyDetection,twitter,67,2019-03-01T02:37:44Z,Anomaly Detection with R
7,R,swirl_courses,2934,6163,R,https://github.com/swirldev/swirl_courses,swirldev,127,2019-04-16T16:17:21Z,:mortar_board: A collection of interactive courses for the swirl R package.
8,R,r4ds,1939,2393,R,https://github.com/hadley/r4ds,hadley,98,2019-06-14T19:43:26Z,R for data science
9,R,devtools,1808,641,R,https://github.com/r-lib/devtools,r-lib,60,2019-06-05T14:25:48Z,Tools to make an R developer's life easier
10,R,knitr,1796,746,R,https://github.com/yihui/knitr,yihui,61,2019-05-18T13:55:02Z,A general-purpose tool for dynamic report generation in R
11,R,investing,1692,107,R,https://github.com/zonination/investing,zonination,0,2016-12-27T13:58:02Z,Investing Returns on the Market as a Whole
12,R,benchm-ml,1666,309,R,https://github.com/szilard/benchm-ml,szilard,10,2019-05-07T21:04:59Z,"A minimal benchmark for scalability, speed and accuracy of commonly used open source implementations (R packages, Python scikit-learn, H2O, xgboost, Spark MLlib etc.) of the top machine learning algorithms for binary classification (random forests, gradient boosted trees, deep neural networks etc.)."
13,R,stats337,1547,234,R,https://github.com/hadley/stats337,hadley,7,2018-06-21T15:57:29Z,Readings in applied data science
14,R,rmarkdown,1535,658,R,https://github.com/rstudio/rmarkdown,rstudio,102,2019-06-12T15:57:22Z,Dynamic Documents for R
15,R,nyc-taxi-data,1523,457,R,https://github.com/toddwschneider/nyc-taxi-data,toddwschneider,0,2019-04-08T10:56:34Z,"Import public NYC taxi and for-hire vehicle (Uber, Lyft, etc.) trip data into PostgreSQL database"
16,R,plotly,1515,525,R,https://github.com/ropensci/plotly,ropensci,272,2019-06-05T13:10:34Z,An interactive graphing library for R
17,R,bookdown,1488,642,R,https://github.com/rstudio/bookdown,rstudio,68,2019-05-28T23:04:40Z,Authoring Books and Technical Documents with R Markdown
18,R,awesome-network-analysis,1468,315,R,https://github.com/briatte/awesome-network-analysis,briatte,19,2019-06-14T13:01:19Z,A curated list of awesome network analysis resources.
19,R,DataScienceR,1330,724,R,https://github.com/ujjwalkarn/DataScienceR,ujjwalkarn,3,2018-04-18T00:01:52Z,"a curated list of R tutorials for Data Science, NLP and Machine Learning "
20,R,mlr,1262,349,R,https://github.com/mlr-org/mlr,mlr-org,414,2019-06-14T15:58:54Z,mlr: Machine Learning in R 
21,R,gganimate,1249,221,R,https://github.com/thomasp85/gganimate,thomasp85,79,2019-06-12T22:12:12Z,A Grammar of Animated Graphics
22,R,DiagrammeR,1180,182,R,https://github.com/rich-iannone/DiagrammeR,rich-iannone,99,2019-06-11T04:42:35Z,Graph and network visualization using tabular data in R
23,R,tensorflow,1136,311,R,https://github.com/rstudio/tensorflow,rstudio,9,2019-06-10T16:49:33Z,TensorFlow for R
24,R,rvest,1071,272,R,https://github.com/tidyverse/rvest,tidyverse,29,2019-05-15T22:00:24Z,Simple web scraping for R
25,R,caret,1067,515,R,https://github.com/topepo/caret,topepo,134,2019-05-22T21:22:25Z,caret (Classification And Regression Training) R package that contains misc functions for training and plotting classification and regression models
26,R,patchwork,1067,80,R,https://github.com/thomasp85/patchwork,thomasp85,36,2019-04-01T11:22:01Z,The Composer of ggplots
27,R,labs,1014,1432,R,https://github.com/genomicsclass/labs,genomicsclass,12,2018-10-29T20:05:09Z,Rmd source files for the HarvardX series PH525x
28,R,wesanderson,990,80,R,https://github.com/karthik/wesanderson,karthik,10,2019-02-01T23:29:59Z,A Wes Anderson color palette for R
29,R,ggthemes,985,194,R,https://github.com/jrnold/ggthemes,jrnold,3,2019-05-13T14:40:04Z,"Additional themes, scales, and geoms for ggplot2"
30,R,blogdown,957,215,R,https://github.com/rstudio/blogdown,rstudio,9,2019-06-14T21:08:25Z,Create Blogs and Websites with R Markdown
31,R,CausalImpact,955,161,R,https://github.com/google/CausalImpact,google,19,2019-04-17T12:47:39Z,An R package for causal inference in time series
32,R,reticulate,904,155,R,https://github.com/rstudio/reticulate,rstudio,202,2019-06-12T18:50:59Z,R Interface to Python
33,R,plumber,894,165,R,https://github.com/trestletech/plumber,trestletech,117,2019-06-11T18:15:32Z,Turn your R code into a web API.
34,R,tidytuesday,874,429,R,https://github.com/rfordatascience/tidytuesday,rfordatascience,45,2019-06-10T18:56:11Z,Official repo for the #tidytuesday project
35,R,drake,862,81,R,https://github.com/ropensci/drake,ropensci,6,2019-06-11T03:43:16Z,An R-focused pipeline toolkit for reproducibility and high-performance computing
36,R,broom,861,231,R,https://github.com/tidymodels/broom,tidymodels,146,2019-06-14T21:29:26Z,Convert statistical analysis objects from R into tidy format
37,R,swirl,819,540,R,https://github.com/swirldev/swirl,swirldev,175,2019-05-15T00:43:31Z,":cyclone: Learn R, in R."
38,R,bbplot,813,119,R,https://github.com/bbc/bbplot,bbc,11,2019-03-19T02:15:52Z,R package that helps create and export ggplot2 charts in the style used by the BBC News data team
39,R,slidify,809,349,R,https://github.com/ramnathv/slidify,ramnathv,180,2016-08-02T03:54:45Z,Generate reproducible html5 slides from R markdown
40,R,gt,800,54,R,https://github.com/rstudio/gt,rstudio,134,2019-06-13T17:17:17Z,"Easily generate information-rich, publication-quality tables from R"
41,R,rethinking,799,249,R,https://github.com/rmcelreath/rethinking,rmcelreath,92,2019-06-09T07:38:34Z,Statistical Rethinking course and book package
42,R,tofsims,796,5,R,https://github.com/fossasia/tofsims,fossasia,0,2017-11-29T19:16:12Z,
43,R,httr,785,1844,R,https://github.com/r-lib/httr,r-lib,17,2019-05-18T12:16:16Z,httr: a friendly http package for R
44,R,purrr,772,182,R,https://github.com/tidyverse/purrr,tidyverse,74,2019-06-14T13:07:08Z,A functional programming toolkit for R
45,R,tidytext,767,152,R,https://github.com/juliasilge/tidytext,juliasilge,8,2019-06-14T17:00:33Z,"Text mining using dplyr, ggplot2, and other tidy tools :sparkles::page_facing_up::sparkles::page_facing_up::sparkles:"
46,R,tidyr,766,299,R,https://github.com/tidyverse/tidyr,tidyverse,11,2019-06-05T15:23:56Z,Easily tidy data with spread and gather functions.
47,R,forecast,731,255,R,https://github.com/robjhyndman/forecast,robjhyndman,10,2019-06-11T00:10:24Z,forecast package for R
48,R,advanced-shiny,721,272,R,https://github.com/daattali/advanced-shiny,daattali,1,2019-05-20T07:34:57Z,Shiny tips & tricks for improving your apps and solving common problems
49,R,tidyverse,704,145,R,https://github.com/tidyverse/tidyverse,tidyverse,5,2019-05-15T19:50:10Z,Easily install and load packages from the tidyverse
50,R,readr,704,211,R,https://github.com/tidyverse/readr,tidyverse,83,2019-06-12T05:25:52Z,"Read flat files (csv, tsv, fwf) into R"
51,R,googlesheets,698,176,R,https://github.com/jennybc/googlesheets,jennybc,88,2019-05-28T23:50:21Z,Google Spreadsheets R API
52,R,rnaseq_tutorial,697,391,R,https://github.com/griffithlab/rnaseq_tutorial,griffithlab,11,2018-11-01T19:59:51Z,"Informatics for RNA-seq: A web resource for analysis on the cloud. Educational tutorials and working pipelines for RNA-seq analysis including an introduction to: cloud computing, critical file formats, reference genomes, gene annotation, expression, differential expression, alternative splicing, data visualization, and interpretation."
53,R,magrittr,697,129,R,https://github.com/tidyverse/magrittr,tidyverse,25,2019-01-05T16:37:00Z,Improve the readability of R code with the pipe
54,R,MLPB,667,255,R,https://github.com/ben519/MLPB,ben519,0,2019-06-04T17:32:17Z,Machine Learning Problem Bible | Problem Set Here >>
55,R,rayshader,659,49,R,https://github.com/tylermorganwall/rayshader,tylermorganwall,8,2019-04-06T03:39:22Z,"R Package for Producing and Visualizing Hillshaded Maps from Elevation Matrices, in 2D and 3D"
56,R,ggvis,659,180,R,https://github.com/rstudio/ggvis,rstudio,190,2018-10-01T16:22:08Z,Interactive grammar of graphics for R
57,R,esquisse,658,69,R,https://github.com/dreamRs/esquisse,dreamRs,14,2019-06-05T19:21:33Z,RStudio add-in to make plots with ggplot2
58,R,janitor,653,70,R,https://github.com/sfirke/janitor,sfirke,52,2019-05-22T20:43:37Z,simple tools for data cleaning in R
59,R,SparkR-pkg,652,347,R,https://github.com/amplab-extras/SparkR-pkg,amplab-extras,21,2016-06-10T21:42:55Z,R frontend for Spark
60,R,sparklyr,652,240,R,https://github.com/rstudio/sparklyr,rstudio,412,2019-06-14T20:06:44Z,R interface for Apache Spark
61,R,BanditsBook,642,225,R,https://github.com/johnmyleswhite/BanditsBook,johnmyleswhite,6,2018-04-05T06:34:29Z,Code for my book on Multi-Armed Bandit Algorithms
62,R,ggraph,635,73,R,https://github.com/thomasp85/ggraph,thomasp85,67,2019-03-07T01:43:09Z,Grammar of Graph Graphics
63,R,skimr,625,55,R,https://github.com/ropensci/skimr,ropensci,26,2019-06-14T18:34:24Z,"A frictionless, pipeable approach to dealing with summary statistics"
64,R,ggrepel,624,72,R,https://github.com/slowkow/ggrepel,slowkow,18,2019-04-30T00:50:57Z,:round_pushpin: Repel overlapping text labels away from each other.
65,R,htmlwidgets,620,180,R,https://github.com/ramnathv/htmlwidgets,ramnathv,106,2019-06-05T20:05:07Z,HTML Widgets for R
66,R,r-source,612,199,R,https://github.com/wch/r-source,wch,0,2019-06-14T13:07:26Z,"Read-only mirror of R source code from https://svn.r-project.org/R/, updated hourly. See the build instructions on the wiki page."
67,R,rappor,609,117,R,https://github.com/google/rappor,google,34,2019-01-10T13:19:15Z,RAPPOR: Privacy-Preserving Reporting Algorithms
68,R,testthat,604,245,R,https://github.com/r-lib/testthat,r-lib,30,2019-05-08T01:07:46Z,An R 📦 to make testing 😀
69,R,perceptions,601,76,R,https://github.com/zonination/perceptions,zonination,0,2017-08-25T14:34:20Z,Perceptions of Probability and Numbers
70,R,text2vec,599,101,R,https://github.com/dselivanov/text2vec,dselivanov,27,2019-02-25T17:27:57Z,"Fast vectorization, topic modeling, distances and GloVe word embeddings in R."
71,R,ProgrammingAssignment2,595,116903,R,https://github.com/rdpeng/ProgrammingAssignment2,rdpeng,2767,2019-06-14T16:01:57Z,Repository for Programming Assignment 2 for R Programming on Coursera
72,R,lintr,583,106,R,https://github.com/jimhester/lintr,jimhester,134,2019-05-31T21:50:41Z,Static Code Analysis for R
73,R,RStartHere,560,204,R,https://github.com/rstudio/RStartHere,rstudio,5,2018-04-02T18:39:27Z,A guide to some of the most useful R Packages that we know about
74,R,ggthemr,552,77,R,https://github.com/cttobin/ggthemr,cttobin,3,2019-05-17T20:17:09Z,Themes for ggplot2.
75,R,keras,550,192,R,https://github.com/rstudio/keras,rstudio,8,2019-06-14T13:15:00Z,R Interface to Keras
76,R,hrbrthemes,547,56,R,https://github.com/hrbrmstr/hrbrthemes,hrbrmstr,16,2019-04-09T12:46:39Z,":lock_with_ink_pen: Opinionated, typographic-centric ggplot2 themes and theme components"
77,R,ProjectTemplate,544,154,R,https://github.com/KentonWhite/ProjectTemplate,KentonWhite,17,2019-04-16T00:31:02Z,A template utility for R projects that provides a skeletal project.
78,R,brms,539,70,R,https://github.com/paul-buerkner/brms,paul-buerkner,47,2019-06-13T15:40:49Z,brms R package for Bayesian generalized multivariate non-linear multilevel models using Stan
79,R,ggstatsplot,527,55,R,https://github.com/IndrajeetPatil/ggstatsplot,IndrajeetPatil,16,2019-06-14T20:35:06Z,Collection of functions to enhance ggplot2 plots with results from statistical tests.
80,R,sf,526,135,R,https://github.com/r-spatial/sf,r-spatial,30,2019-06-14T14:40:14Z,Simple Features for R
81,R,asdfree,526,438,R,https://github.com/ajdamico/asdfree,ajdamico,91,2019-01-26T13:39:07Z,analyze survey data for free
82,R,ggmap,526,201,R,https://github.com/dkahle/ggmap,dkahle,80,2019-05-12T04:49:38Z,A package for plotting maps in R with ggplot2
83,R,book_sample,523,29,R,https://github.com/rnorm/book_sample,rnorm,1,2019-05-31T01:10:03Z,another book on data science
84,R,opencpu,508,95,R,https://github.com/opencpu/opencpu,opencpu,79,2019-05-12T08:39:30Z,OpenCPU system for embedded scientific computation and reproducible research
85,R,future,504,42,R,https://github.com/HenrikBengtsson/future,HenrikBengtsson,68,2019-06-14T23:52:08Z,:rocket: R package: future: Unified Parallel and Distributed Processing in R for Everyone
86,R,quanteda,501,118,R,https://github.com/quanteda/quanteda,quanteda,88,2019-06-14T19:24:07Z,An R package for the Quantitative Analysis of Textual Data
87,R,datapasta,495,38,R,https://github.com/MilesMcBain/datapasta,MilesMcBain,21,2019-03-03T04:07:03Z,"On top of spaghetti, all covered in cheese...."
88,R,networkD3,487,234,R,https://github.com/christophergandrud/networkD3,christophergandrud,70,2019-05-04T07:16:39Z,D3 JavaScript Network Graphs from R
89,R,addinslist,479,98,R,https://github.com/daattali/addinslist,daattali,2,2019-05-30T02:47:21Z,Discover and install useful RStudio addins 
90,R,formattable,479,65,R,https://github.com/renkun-ken/formattable,renkun-ken,45,2019-04-18T02:51:24Z,Formattable Data Structures
91,R,ballr,478,99,R,https://github.com/toddwschneider/ballr,toddwschneider,1,2019-05-23T23:24:29Z,Interactive NBA and NCAA Shot Charts with R and Shiny
92,R,plyr,476,121,R,https://github.com/hadley/plyr,hadley,30,2019-03-27T03:48:53Z,"A R package for splitting, applying and combining large problems into simpler problems"
93,R,ESL-CN,473,135,R,https://github.com/szcf-weiya/ESL-CN,szcf-weiya,95,2019-06-14T13:54:44Z,The Elements of Statistical Learning (ESL)的中文翻译、代码实现及其习题解答。
94,R,geocompr,469,211,R,https://github.com/Robinlovelace/geocompr,Robinlovelace,13,2019-06-14T19:31:55Z,Open source book: Geocomputation with R
95,R,engsoccerdata,449,130,R,https://github.com/jalapic/engsoccerdata,jalapic,14,2019-04-20T14:10:20Z,English and European soccer results 1871-2017
96,R,seurat,446,293,R,https://github.com/satijalab/seurat,satijalab,44,2019-06-14T20:41:45Z,R toolkit for single cell genomics
97,R,mindr,446,38,R,https://github.com/pzhaonet/mindr,pzhaonet,0,2019-05-02T12:02:48Z,"an R package which converts markdown files (.md, .Rmd) into mindmaps (brainstorms)"
98,R,waffle,443,63,R,https://github.com/hrbrmstr/waffle,hrbrmstr,29,2019-05-17T01:34:22Z,:maple_leaf: Make waffle (square pie) charts in R
99,R,highcharter,442,92,R,https://github.com/jbkunst/highcharter,jbkunst,147,2019-06-10T18:45:33Z,R wrapper for highcharts based on htmlwidgets 
100,R,renjin,442,74,R,https://github.com/bedatadriven/renjin,bedatadriven,69,2019-06-12T20:51:03Z,JVM-based interpreter for the R language for the statistical analysis.
1,Ruby,rails,43359,17442,Ruby,https://github.com/rails/rails,rails,1152,2019-06-14T23:34:51Z,Ruby on Rails
2,Ruby,jekyll,37961,8278,Ruby,https://github.com/jekyll/jekyll,jekyll,140,2019-06-14T16:12:00Z,:globe_with_meridians: Jekyll is a blog-aware static site generator in Ruby
3,Ruby,discourse,28430,6444,Ruby,https://github.com/discourse/discourse,discourse,25,2019-06-14T18:34:40Z,"A platform for community discussion. Free, open, simple."
4,Ruby,fastlane,25669,3921,Ruby,https://github.com/fastlane/fastlane,fastlane,215,2019-06-14T16:15:04Z,🚀 The easiest way to automate building and releasing your iOS and Android apps
5,Ruby,awesome-awesomeness,24401,3045,Ruby,https://github.com/bayandin/awesome-awesomeness,bayandin,7,2019-06-05T14:35:50Z,A curated list of awesome awesomeness
6,Ruby,gitlabhq,21848,5573,Ruby,https://github.com/gitlabhq/gitlabhq,gitlabhq,32,2019-06-15T00:52:30Z,GitLab CE Mirror | Please open new issues in our issue tracker on GitLab.com
7,Ruby,huginn,21538,2334,Ruby,https://github.com/huginn/huginn,huginn,361,2019-06-10T09:34:39Z,Create agents that monitor and act on your behalf.  Your agents are standing by!
