rank,item,repo_name,stars,forks,language,repo_url,username,issues,last_commit,description
95,Clojure,lt-cljs-tutorial,863,129,Clojure,https://github.com/swannodette/lt-cljs-tutorial,swannodette,10,2015-10-08T07:16:26Z,A ClojureScript Programming Language Tutorial for Light Table Users
96,Clojure,pulsar,861,50,Clojure,https://github.com/puniverse/pulsar,puniverse,10,2017-09-06T16:16:37Z,"Fibers, Channels and Actors for Clojure"
97,Clojure,amazonica,839,180,Clojure,https://github.com/mcohen01/amazonica,mcohen01,29,2019-08-28T04:02:57Z,A comprehensive Clojure client for the entire Amazon AWS api.
98,Clojure,pallet,806,122,Clojure,https://github.com/pallet/pallet,pallet,126,2018-05-25T15:44:26Z,Automates controlling and provisioning cloud server instances. DevOps for the JVM.
99,Clojure,environ,788,64,Clojure,https://github.com/weavejester/environ,weavejester,14,2019-01-10T12:38:44Z,Library for managing environment variables in Clojure
100,Clojure,Nightlight,788,36,Clojure,https://github.com/oakes/Nightlight,oakes,13,2019-09-22T12:50:45Z,An embedded editor for Clojure
1,CoffeeScript,cypress,15421,851,CoffeeScript,https://github.com/cypress-io/cypress,cypress-io,1102,2019-10-23T10:10:47Z,"Fast, easy and reliable testing for anything that runs in a browser."
2,CoffeeScript,coffeescript,15333,2006,CoffeeScript,https://github.com/jashkenas/coffeescript,jashkenas,41,2019-10-18T18:03:19Z,Unfancy JavaScript
3,CoffeeScript,trix,14125,679,CoffeeScript,https://github.com/basecamp/trix,basecamp,37,2019-10-17T14:48:41Z,A rich text editor for everyday writing
4,CoffeeScript,SwitchyOmega,13677,2276,CoffeeScript,https://github.com/FelisCatus/SwitchyOmega,FelisCatus,276,2019-10-13T16:52:37Z,Manage and switch between multiple proxies quickly & easily.
5,CoffeeScript,vimium,11663,1421,CoffeeScript,https://github.com/philc/vimium,philc,696,2019-10-21T02:39:59Z,The hacker's browser.
6,CoffeeScript,zxcvbn,10632,695,CoffeeScript,https://github.com/dropbox/zxcvbn,dropbox,94,2019-09-16T05:49:22Z,Low-Budget Password Strength Estimation
7,CoffeeScript,dynamics.js,7195,401,CoffeeScript,https://github.com/michaelvillar/dynamics.js,michaelvillar,10,2019-02-26T06:19:21Z,Javascript library to create physics-based animations
8,CoffeeScript,morris.js,6939,1268,CoffeeScript,https://github.com/morrisjs/morris.js,morrisjs,319,2019-08-10T03:04:54Z,Pretty time-series line graphs
9,CoffeeScript,codecombat,6918,3552,CoffeeScript,https://github.com/codecombat/codecombat,codecombat,404,2019-10-22T15:31:26Z,Game for learning how to code.
10,CoffeeScript,chinese-copywriting-guidelines,6323,1030,CoffeeScript,https://github.com/sparanoid/chinese-copywriting-guidelines,sparanoid,7,2019-09-14T07:09:41Z,Chinese copywriting guidelines for better written communication／中文文案排版指北
11,CoffeeScript,overleaf,5803,721,CoffeeScript,https://github.com/overleaf/overleaf,overleaf,153,2019-10-23T08:20:42Z,A web-based collaborative LaTeX editor
12,CoffeeScript,At.js,5186,687,CoffeeScript,https://github.com/ichord/At.js,ichord,156,2019-02-19T10:21:06Z,Add Github like mentions autocomplete to your application.
13,CoffeeScript,vibrant.js,4433,209,CoffeeScript,https://github.com/jariz/vibrant.js,jariz,2,2017-11-28T15:50:23Z,Extract prominent colors from an image. JS port of Android's Palette.
14,CoffeeScript,aglio,4364,476,CoffeeScript,https://github.com/danielgtaylor/aglio,danielgtaylor,138,2019-05-13T14:40:13Z,An API Blueprint renderer with theme support that outputs static HTML
15,CoffeeScript,bootstrap-tour,4289,914,CoffeeScript,https://github.com/sorich87/bootstrap-tour,sorich87,175,2019-07-02T19:56:41Z,Quick and easy product tours with Twitter Bootstrap Popovers
16,CoffeeScript,Log.io,4033,643,CoffeeScript,https://github.com/NarrativeScience/Log.io,NarrativeScience,90,2019-10-08T17:18:39Z,Real-time log monitoring in your browser
17,CoffeeScript,node-xml2js,3799,454,CoffeeScript,https://github.com/Leonidas-from-XIV/node-xml2js,Leonidas-from-XIV,157,2019-09-03T19:10:12Z,XML to JavaScript object converter.
18,CoffeeScript,yakyak,3696,331,CoffeeScript,https://github.com/yakyak/yakyak,yakyak,69,2019-10-22T06:06:25Z,Desktop chat client for Google Hangouts
19,CoffeeScript,jquery.payment,3647,709,CoffeeScript,https://github.com/stripe/jquery.payment,stripe,0,2017-08-02T14:10:57Z,"[DEPRECATED] A general purpose library for building credit card forms, validating inputs and formatting numbers.          "
20,CoffeeScript,turbolinks-classic,3600,466,CoffeeScript,https://github.com/turbolinks/turbolinks-classic,turbolinks,45,2017-12-06T23:33:26Z,Classic version of Turbolinks. Now deprecated in favor of Turbolinks 5.
21,CoffeeScript,activate-power-mode,3564,434,CoffeeScript,https://github.com/JoelBesada/activate-power-mode,JoelBesada,51,2019-05-24T15:52:02Z,Atom package - Activate POWER MODE to write your code in style.
22,CoffeeScript,hubot-scripts,3519,1990,CoffeeScript,https://github.com/github/hubot-scripts,github,0,2017-07-10T16:06:49Z,"DEPRECATED, see https://github.com/github/hubot-scripts/issues/1113 for details - optional scripts for hubot, opt in via hubot-scripts.json"
23,CoffeeScript,wintersmith,3484,345,CoffeeScript,https://github.com/jnordberg/wintersmith,jnordberg,14,2019-09-13T21:21:41Z,A flexible static site generator
24,CoffeeScript,pow,3469,262,CoffeeScript,https://github.com/basecamp/pow,basecamp,123,2018-04-12T12:15:45Z,Zero-configuration Rack server for Mac OS X
25,CoffeeScript,pivottable,3264,832,CoffeeScript,https://github.com/nicolaskruchten/pivottable,nicolaskruchten,240,2019-09-23T20:13:18Z,"Open-source Javascript Pivot Table (aka Pivot Grid, Pivot Chart, Cross-Tab) implementation with drag'n'drop."
26,CoffeeScript,taiga-front,3240,703,CoffeeScript,https://github.com/taigaio/taiga-front,taigaio,333,2019-10-22T11:50:13Z,Agile project management platform. Built on top of Django and AngularJS
27,CoffeeScript,Keypress,3185,322,CoffeeScript,https://github.com/dmauro/Keypress,dmauro,32,2018-09-27T02:21:46Z,A keyboard input capturing utility in which any key can be a modifier key.
28,CoffeeScript,dispatch-proxy,3087,194,CoffeeScript,https://github.com/alexkirsz/dispatch-proxy,alexkirsz,26,2019-07-13T20:04:51Z,"Combine internet connections, increase your download speed"
29,CoffeeScript,docpad,2993,248,CoffeeScript,https://github.com/docpad/docpad,docpad,23,2019-09-04T00:52:27Z,"Empower your website frontends with layouts, meta-data, pre-processors (markdown, jade, coffeescript, etc.), partials, skeletons, file watching, querying, and an amazing plugin system. DocPad will streamline your web development process allowing you to craft powerful static sites quicker than ever before."
30,CoffeeScript,sticky-kit,2973,559,CoffeeScript,https://github.com/leafo/sticky-kit,leafo,160,2019-07-10T14:57:39Z,A jQuery plugin for creating smart sticky elements
31,CoffeeScript,instafeed.js,2914,722,CoffeeScript,https://github.com/stevenschobert/instafeed.js,stevenschobert,2,2018-09-07T00:26:43Z,A simple Instagram javascript plugin
32,CoffeeScript,chaplin,2908,246,CoffeeScript,https://github.com/chaplinjs/chaplin,chaplinjs,46,2019-04-04T21:21:53Z,HTML5 application architecture using Backbone.js
33,CoffeeScript,noflo,2800,222,CoffeeScript,https://github.com/noflo/noflo,noflo,20,2019-10-18T21:11:54Z,Flow-based programming for JavaScript
34,CoffeeScript,talk-os,2746,848,CoffeeScript,https://github.com/jianliaoim/talk-os,jianliaoim,10,2017-09-05T02:27:58Z,Open source version of jianliao.com
35,CoffeeScript,butterfly,2666,294,CoffeeScript,https://github.com/paradoxxxzero/butterfly,paradoxxxzero,78,2019-07-18T02:11:40Z,A web terminal based on websocket and tornado
36,CoffeeScript,angular-google-maps,2591,1093,CoffeeScript,https://github.com/angular-ui/angular-google-maps,angular-ui,337,2018-11-14T19:00:52Z,AngularJS directives for the Google Maps Javascript API
37,CoffeeScript,pagedraw,2563,297,CoffeeScript,https://github.com/Pagedraw/pagedraw,Pagedraw,10,2019-10-21T18:09:24Z,a UI builder for React web apps
38,CoffeeScript,hallo,2483,346,CoffeeScript,https://github.com/bergie/hallo,bergie,109,2019-09-03T17:37:55Z,Simple rich text editor (contentEditable) for jQuery UI
39,CoffeeScript,cloudtunes,2373,237,CoffeeScript,https://github.com/jakubroztocil/cloudtunes,jakubroztocil,17,2018-03-20T18:40:05Z,"Web-based music player for the cloud :cloud: :notes: Play music from YouTube, Dropbox, etc."
40,CoffeeScript,oriDomi,2357,204,CoffeeScript,https://github.com/dmotz/oriDomi,dmotz,9,2018-07-14T18:10:28Z,Fold up DOM elements like paper
41,CoffeeScript,hubot-slack,2169,629,CoffeeScript,https://github.com/slackapi/hubot-slack,slackapi,42,2019-09-03T01:46:45Z,Slack Developer Kit for Hubot
42,CoffeeScript,QuoJS,2098,260,CoffeeScript,https://github.com/soyjavi/QuoJS,soyjavi,24,2018-09-03T00:16:56Z,Micro #JavaScript Library for Mobile Devices
43,CoffeeScript,js2coffee,2058,210,CoffeeScript,https://github.com/js2coffee/js2coffee,js2coffee,94,2018-02-21T04:17:31Z,Compile JavaScript to CoffeeScript
44,CoffeeScript,shadowsocks-gui,2015,1300,CoffeeScript,https://github.com/shadowsocks/shadowsocks-gui,shadowsocks,2,2018-09-24T04:39:12Z,Shadowsocks GUI client
45,CoffeeScript,CoffeeScriptRedux,1859,118,CoffeeScript,https://github.com/michaelficarra/CoffeeScriptRedux,michaelficarra,104,2019-10-14T18:59:47Z,:sweat: rewrite of the CoffeeScript compiler with proper compiler design principles and a focus on robustness and extensibility
46,CoffeeScript,ng-token-auth,1856,256,CoffeeScript,https://github.com/lynndylanhurley/ng-token-auth,lynndylanhurley,106,2019-10-16T18:35:58Z,Token based authentication module for angular.js.
47,CoffeeScript,BuckyClient,1782,102,CoffeeScript,https://github.com/HubSpot/BuckyClient,HubSpot,20,2016-08-05T20:07:08Z,Collect performance data from the client
48,CoffeeScript,vim-mode,1758,273,CoffeeScript,https://github.com/atom/vim-mode,atom,0,2017-06-15T20:06:24Z,Next generation vim support for atom
49,CoffeeScript,eco,1754,70,CoffeeScript,https://github.com/sstephenson/eco,sstephenson,33,2019-07-02T05:26:52Z,Embedded CoffeeScript templates
50,CoffeeScript,jquery.shapeshift,1697,346,CoffeeScript,https://github.com/AshesOfOwls/jquery.shapeshift,AshesOfOwls,88,2016-12-25T11:01:38Z,A dynamic grid system with drag and drop functionality.
51,CoffeeScript,dnschain,1695,159,CoffeeScript,https://github.com/okTurtles/dnschain,okTurtles,45,2017-04-22T03:52:26Z,"A blockchain-based DNS + HTTP server that fixes HTTPS security, and more!"
52,CoffeeScript,please-wait,1603,162,CoffeeScript,https://github.com/Pathgather/please-wait,Pathgather,4,2016-08-20T10:31:00Z,A simple library to show your users a beautiful splash page while your application loads.
53,CoffeeScript,psd.js,1549,242,CoffeeScript,https://github.com/meltingice/psd.js,meltingice,100,2019-07-03T00:32:57Z,A Photoshop PSD file parser for NodeJS and browsers
54,CoffeeScript,kartograph.js,1520,239,CoffeeScript,https://github.com/kartograph/kartograph.js,kartograph,36,2018-05-12T17:21:09Z,UNMAINTAINED Open source JavaScript renderer for Kartograph SVG maps
55,CoffeeScript,cyclotron,1500,103,CoffeeScript,https://github.com/ExpediaInceCommercePlatform/cyclotron,ExpediaInceCommercePlatform,15,2019-10-22T02:00:06Z,A web platform for constructing dashboards.
56,CoffeeScript,local_time,1493,100,CoffeeScript,https://github.com/basecamp/local_time,basecamp,11,2019-10-18T22:09:18Z,"Rails engine for cache-friendly, client-side local time"
57,CoffeeScript,squel,1481,211,CoffeeScript,https://github.com/hiddentao/squel,hiddentao,118,2019-08-02T03:23:04Z,:office: SQL query string builder for Javascript
58,CoffeeScript,roots,1479,135,CoffeeScript,https://github.com/jescalan/roots,jescalan,55,2018-02-03T16:40:23Z,a toolkit for rapid advanced front-end development
59,CoffeeScript,atom-beautify,1421,444,CoffeeScript,https://github.com/Glavin001/atom-beautify,Glavin001,199,2019-10-01T23:10:34Z,:lipstick: Universal beautification package for Atom editor (:warning: Currently migrating to https://github.com/Unibeautify/ and have very limited bandwidth for Atom-Beautify Issues. Thank you for your patience and understanding :heart: )
60,CoffeeScript,caniuse-cmd,1410,48,CoffeeScript,https://github.com/sgentle/caniuse-cmd,sgentle,14,2018-09-19T15:16:06Z,Caniuse command line tool
61,CoffeeScript,gulp-cheatsheet,1403,88,CoffeeScript,https://github.com/osscafe/gulp-cheatsheet,osscafe,4,2016-08-28T08:20:19Z,A cheatsheet for gulp.js
62,CoffeeScript,dropbox-js,1368,222,CoffeeScript,https://github.com/dropbox/dropbox-js,dropbox,85,2016-10-29T20:22:00Z,Deprecated JS library for API v1. Use our v2 SDK instead:
63,CoffeeScript,VimFx,1360,187,CoffeeScript,https://github.com/akhodakivskiy/VimFx,akhodakivskiy,2,2019-10-19T17:42:53Z,Vim keyboard shortcuts for Firefox
64,CoffeeScript,repl.it,1354,220,CoffeeScript,https://github.com/replit-archive/repl.it,replit-archive,1,2016-04-11T20:47:38Z,https://repl.it/feedback Online REPL for 15+ languages.
65,CoffeeScript,atom-vim-mode-plus,1338,107,CoffeeScript,https://github.com/t9md/atom-vim-mode-plus,t9md,109,2019-09-28T03:53:10Z,vim-mode improved
66,CoffeeScript,camo,1319,236,CoffeeScript,https://github.com/atmos/camo,atmos,20,2019-10-07T16:32:12Z,:lock: an http proxy to route images through SSL
67,CoffeeScript,atom-simplified-chinese-menu,1315,152,CoffeeScript,https://github.com/chinakids/atom-simplified-chinese-menu,chinakids,25,2018-08-06T02:41:40Z,"Atom 的简体中文汉化扩展,目前最全的汉化包。包含菜单汉化、右键菜单汉化以及设置汉化"
68,CoffeeScript,coffeekup,1285,90,CoffeeScript,https://github.com/mauricemach/coffeekup,mauricemach,39,2011-10-26T01:50:57Z,Markup as CoffeeScript.
69,CoffeeScript,pretty-error,1279,38,CoffeeScript,https://github.com/AriaMinaei/pretty-error,AriaMinaei,16,2018-04-14T01:55:57Z,See node.js errors with less clutter
70,CoffeeScript,mondrian,1235,117,CoffeeScript,https://github.com/artursapek/mondrian,artursapek,21,2017-10-30T03:18:15Z,Web-based vector graphics editor
71,CoffeeScript,shadowsocks-nodejs,1213,789,CoffeeScript,https://github.com/shadowsocks/shadowsocks-nodejs,shadowsocks,5,2016-08-11T03:01:11Z,
72,CoffeeScript,cson,1209,54,CoffeeScript,https://github.com/bevry/cson,bevry,4,2019-06-25T08:05:04Z,CoffeeScript-Object-Notation. Same as JSON but for CoffeeScript objects.
73,CoffeeScript,qqbot,1208,391,CoffeeScript,https://github.com/xhan/qqbot,xhan,24,2016-02-15T03:31:44Z,基于WebQQ协议的QQ机器人。命令行工具，Hubot支持！
74,CoffeeScript,lineman,1203,88,CoffeeScript,https://github.com/linemanjs/lineman,linemanjs,30,2018-08-29T17:59:10Z,"Lineman helps you build fat-client JavaScript apps. It produces happiness by building assets, mocking servers, running specs on every file change"
75,CoffeeScript,greenscreen,1192,162,CoffeeScript,https://github.com/groupon/greenscreen,groupon,47,2017-05-17T00:29:05Z,
76,CoffeeScript,apm,1180,278,CoffeeScript,https://github.com/atom/apm,atom,174,2019-10-05T14:37:21Z,Atom Package Manager
77,CoffeeScript,tacofancy,1171,457,CoffeeScript,https://github.com/sinker/tacofancy,sinker,12,2019-10-08T20:47:22Z,community-driven taco repo. stars stars stars.
78,CoffeeScript,angular-masonry,1143,240,CoffeeScript,https://github.com/passy/angular-masonry,passy,54,2017-05-17T15:42:06Z,An AngularJS directive for Masonry.
79,CoffeeScript,aurora.js,1135,133,CoffeeScript,https://github.com/audiocogs/aurora.js,audiocogs,57,2019-04-17T12:19:58Z,JavaScript audio decoding framework
80,CoffeeScript,git-time-machine,1120,49,CoffeeScript,https://github.com/littlebee/git-time-machine,littlebee,42,2018-12-21T00:33:44Z,Atom package that allows you to travel back in commit history
81,CoffeeScript,sync-settings,1118,113,CoffeeScript,https://github.com/atom-community/sync-settings,atom-community,77,2019-01-22T16:09:55Z,Synchronize all your settings and packages across atom instances
82,CoffeeScript,Heyoffline,1112,74,CoffeeScript,https://github.com/oskarkrawczyk/Heyoffline,oskarkrawczyk,3,2017-01-06T08:05:04Z,Warn your users when their network goes down. Make sure they don't lose anything.
83,CoffeeScript,badges,1103,787,CoffeeScript,https://github.com/boennemann/badges,boennemann,12,2019-04-05T16:27:49Z,:flower_playing_cards: Readme Badges – Gotta catch 'em all
84,CoffeeScript,hubble,1093,39,CoffeeScript,https://github.com/jaymedavis/hubble,jaymedavis,0,2018-10-11T01:39:44Z,A dashboard that displays in the terminal
85,CoffeeScript,stitch,1072,83,CoffeeScript,https://github.com/sstephenson/stitch,sstephenson,32,2012-11-02T14:08:32Z,Stitch your CommonJS modules together for the browser
86,CoffeeScript,buckets,1072,169,CoffeeScript,https://github.com/bucketsio/buckets,bucketsio,7,2015-05-31T04:57:37Z,[DEPRECATED] Manage content better.
87,CoffeeScript,pushd,1060,217,CoffeeScript,https://github.com/rs/pushd,rs,60,2019-10-01T20:13:55Z,Blazing fast multi-protocol mobile and web push notification service
88,CoffeeScript,Coffee-Physics,1053,90,CoffeeScript,https://github.com/soulwire/Coffee-Physics,soulwire,8,2016-12-12T17:36:34Z,"A simple, lightweight physics engine written in CoffeeScript"
89,CoffeeScript,node-slug,1049,93,CoffeeScript,https://github.com/dodo/node-slug,dodo,44,2019-04-05T15:49:19Z,slugifies even utf-8 chars!
90,CoffeeScript,jquery.turbolinks,1038,62,CoffeeScript,https://github.com/kossnocorp/jquery.turbolinks,kossnocorp,19,2017-09-03T12:15:16Z,💀 Deprecated ⚠️ jQuery plugin for drop-in fix binded events problem caused by Turbolinks
91,CoffeeScript,octonode,1037,240,CoffeeScript,https://github.com/pksunkara/octonode,pksunkara,26,2019-10-15T07:32:41Z,github api v3 in nodejs
92,CoffeeScript,coffeelint,1035,182,CoffeeScript,https://github.com/clutchski/coffeelint,clutchski,92,2019-10-12T02:18:41Z,Lint your CoffeeScript.
93,CoffeeScript,dploy,1018,92,CoffeeScript,https://github.com/lucasmotta/dploy,lucasmotta,61,2019-02-05T16:21:33Z,⛔️ currently unmaintained ⛔️
94,CoffeeScript,zappa,973,88,CoffeeScript,https://github.com/mauricemach/zappa,mauricemach,37,2019-10-15T12:50:51Z,Node development for the lazy.
95,CoffeeScript,muplayer,957,236,CoffeeScript,https://github.com/Baidu-Music-FE/muplayer,Baidu-Music-FE,14,2019-07-02T05:51:58Z,"An open source web audio player from Baidu Music, support HTML5 and Flash engine on different platforms(百度音乐播放内核)"
96,CoffeeScript,literallycanvas,933,277,CoffeeScript,https://github.com/literallycanvas/literallycanvas,literallycanvas,87,2018-10-23T16:47:12Z,A canvas in your browser. Literally.
97,CoffeeScript,node-neo4j,932,143,CoffeeScript,https://github.com/thingdom/node-neo4j,thingdom,46,2018-11-20T12:02:09Z,[RETIRED] Neo4j graph database driver (REST API client) for Node.js
98,CoffeeScript,pt,895,59,CoffeeScript,https://github.com/williamngan/pt,williamngan,10,2018-02-13T09:06:59Z,"An experimental library on point, form, and space."
99,CoffeeScript,node-cache,883,84,CoffeeScript,https://github.com/node-cache/node-cache,node-cache,5,2019-10-22T09:07:03Z,a node internal caching module
100,CoffeeScript,apparatus,881,51,CoffeeScript,https://github.com/cdglabs/apparatus,cdglabs,26,2018-02-06T10:37:56Z,A hybrid graphics editor and programming environment for creating interactive diagrams.
1,CSS,animate.css,62659,13275,CSS,https://github.com/daneden/animate.css,daneden,27,2019-10-16T19:07:47Z,🍿 A cross-browser library of CSS animations. As easy to use as an easy thing.
2,CSS,material-design-icons,39075,8013,CSS,https://github.com/google/material-design-icons,google,566,2019-08-24T11:59:35Z,Material Design icons by Google
3,CSS,bulma,37124,3046,CSS,https://github.com/jgthms/bulma,jgthms,302,2019-10-21T19:22:32Z,Modern CSS framework based on Flexbox
4,CSS,normalize.css,36618,7513,CSS,https://github.com/necolas/normalize.css,necolas,37,2019-10-23T04:44:37Z,A modern alternative to CSS resets
5,CSS,freecodecamp.cn,36521,1405,CSS,https://github.com/FreeCodeCampChina/freecodecamp.cn,FreeCodeCampChina,140,2019-10-02T09:52:28Z,The FreeCodeCamp.cn(FCC China) open source codebase and curriculum. Learn to code and help nonprofits.
6,CSS,weui,23369,5942,CSS,https://github.com/Tencent/weui,Tencent,15,2019-09-18T06:20:34Z,"A UI library by WeChat official design team, includes the most useful widgets/modules in mobile web applications."
7,CSS,hangzhou_house_knowledge,22287,4776,CSS,https://github.com/houshanren/hangzhou_house_knowledge,houshanren,106,2019-10-09T17:59:55Z,"2017年买房经历总结出来的买房购房知识分享给大家，希望对大家有所帮助。买房不易，且买且珍惜。Sharing the knowledge of buy an own house that according  to the experience at hangzhou in 2017 to all the people. It's not easy to buy a own house, so I hope that it would be useful to everyone."
8,CSS,Hover,21896,4750,CSS,https://github.com/IanLunn/Hover,IanLunn,29,2019-07-14T02:43:04Z,"A collection of CSS3 powered hover effects to be applied to links, buttons, logos, SVG, featured images and so on. Easily apply to your own elements, modify or just use for inspiration. Available in CSS, Sass, and LESS."
9,CSS,bootstrap-material-design,20038,3290,CSS,https://github.com/FezVrasta/bootstrap-material-design,FezVrasta,54,2019-10-09T15:10:53Z,Material design theme for Bootstrap 3 and 4
10,CSS,the-swift-programming-language-in-chinese,18948,5001,CSS,https://github.com/SwiftGGTeam/the-swift-programming-language-in-chinese,SwiftGGTeam,5,2019-10-21T13:45:38Z,中文版 Apple 官方 Swift 教程《The Swift Programming Language》
11,CSS,nerd-fonts,17312,1126,CSS,https://github.com/ryanoasis/nerd-fonts,ryanoasis,105,2019-10-22T13:43:26Z,"Iconic font aggregator, collection, & patcher. 3,600+ icons, 40+ patched fonts: Hack, Source Code Pro, more. Glyph collections: Font Awesome, Material Design Icons, Octicons, & more"
12,CSS,Skeleton,17046,2958,CSS,https://github.com/dhg/Skeleton,dhg,134,2019-10-02T18:33:40Z,"Skeleton: A Dead Simple, Responsive Boilerplate for Mobile-Friendly Development"
13,CSS,SpinKit,16344,1557,CSS,https://github.com/tobiasahlin/SpinKit,tobiasahlin,22,2019-07-18T17:54:54Z,A collection of loading indicators animated with CSS
14,CSS,my-mac-os,15636,657,CSS,https://github.com/nikitavoloboev/my-mac-os,nikitavoloboev,1,2019-10-22T13:36:25Z,List of applications and tools that make my macOS experience even more amazing
15,CSS,source-code-pro,15338,1293,CSS,https://github.com/adobe-fonts/source-code-pro,adobe-fonts,41,2019-10-04T17:33:56Z,Monospaced font family for user interface and coding environments
16,CSS,tailwindcss,15307,706,CSS,https://github.com/tailwindcss/tailwindcss,tailwindcss,50,2019-10-23T05:51:20Z,A utility-first CSS framework for rapid UI development.
17,CSS,uikit,15043,2139,CSS,https://github.com/uikit/uikit,uikit,606,2019-10-21T10:08:51Z,A lightweight and modular front-end framework for developing fast and powerful web interfaces
18,CSS,hexo-theme-next,14762,3801,CSS,https://github.com/iissnan/hexo-theme-next,iissnan,60,2019-08-12T04:01:30Z,Elegant theme for Hexo. 
19,CSS,pace,14634,1908,CSS,https://github.com/HubSpot/pace,HubSpot,301,2019-09-23T07:38:17Z,Automatically add a progress bar to your site. #hubspot-open-source
20,CSS,Flat-UI,14575,2453,CSS,https://github.com/designmodo/Flat-UI,designmodo,9,2019-02-13T17:29:09Z,"Flat UI Free - Design Framework (html/css3/less/js). Flat UI is based on Bootstrap, a comfortable, responsive, and functional framework that simplifies the development of websites."
21,CSS,ratchet,14397,1521,CSS,https://github.com/twbs/ratchet,twbs,223,2019-09-05T06:31:48Z,"Build mobile apps with simple HTML, CSS, and JavaScript components. "
22,CSS,NES.css,13874,1174,CSS,https://github.com/nostalgic-css/NES.css,nostalgic-css,21,2019-10-18T14:52:46Z,NES-style CSS Framework | ファミコン風CSSフレームワーク
23,CSS,tomorrow-theme,12559,3054,CSS,https://github.com/chriskempson/tomorrow-theme,chriskempson,111,2019-06-08T11:18:32Z,Tomorrow Theme now lives on at https://github.com/chriskempson/base16
24,CSS,You-Dont-Need-JavaScript,12422,731,CSS,https://github.com/you-dont-need/You-Dont-Need-JavaScript,you-dont-need,25,2019-10-05T09:24:51Z,"CSS is powerful, you can do a lot of things without JS."
25,CSS,solved-by-flexbox,12058,1000,CSS,https://github.com/philipwalton/solved-by-flexbox,philipwalton,20,2019-04-25T19:32:04Z,"A showcase of problems once hard or impossible to solve with CSS alone, now made trivially easy with Flexbox."
26,CSS,Effeckt.css,11180,1509,CSS,https://github.com/h5bp/Effeckt.css,h5bp,0,2019-03-01T16:28:55Z,This repo is archived. Thanks!
27,CSS,hacker101,10812,1334,CSS,https://github.com/Hacker0x01/hacker101,Hacker0x01,25,2019-10-22T16:51:49Z,Hacker101
28,CSS,card,10679,1291,CSS,https://github.com/jessepollak/card,jessepollak,120,2019-07-28T07:49:31Z,:credit_card: make your credit card form better in one line of code
29,CSS,2048,10235,15752,CSS,https://github.com/gabrielecirulli/2048,gabrielecirulli,101,2019-09-22T19:39:54Z,A small clone of 1024 (https://play.google.com/store/apps/details?id=com.veewo.a1024)
30,CSS,spectre,9684,689,CSS,https://github.com/picturepan2/spectre,picturepan2,158,2019-10-08T19:25:31Z,"Spectre.css - A Lightweight, Responsive and Modern CSS Framework"
31,CSS,loaders.css,9369,1156,CSS,https://github.com/ConnorAtherton/loaders.css,ConnorAtherton,10,2018-09-20T11:12:43Z,"Delightful, performance-focused pure css loading animations."
32,CSS,_s,9365,2865,CSS,https://github.com/Automattic/_s,Automattic,82,2019-09-17T21:01:01Z,"Hi. I'm a starter theme called _s, or underscores, if you like. I'm a theme meant for hacking so don't use me as a Parent Theme. Instead try turning me into the next, most awesome, WordPress theme out there. That's what I'm here for."
33,CSS,tachyons,9273,588,CSS,https://github.com/tachyons-css/tachyons,tachyons-css,64,2019-10-21T22:48:00Z,Functional css for humans
34,CSS,photon,9179,531,CSS,https://github.com/connors/photon,connors,82,2018-10-13T17:09:16Z,The fastest way to build beautiful Electron apps using simple HTML and CSS
