rank,item,repo_name,stars,forks,language,repo_url,username,issues,last_commit,description
48,CPP,envoy,9154,1369,C++,https://github.com/envoyproxy/envoy,envoyproxy,491,2019-04-11T03:36:33Z,Cloud-native high-performance edge/middle/service proxy
49,CPP,libphonenumber,8907,1127,C++,https://github.com/googlei18n/libphonenumber,googlei18n,79,2019-04-03T07:04:00Z,"Google's common Java, C++ and JavaScript library for parsing, formatting, and validating international phone numbers."
50,CPP,hardseed,8862,1926,C++,https://github.com/yangyangwithgnu/hardseed,yangyangwithgnu,34,2018-08-25T17:29:23Z,"SEX IS ZERO (0), so, who wanna be the ONE (1), aha?"
51,CPP,Catch2,8757,1455,C++,https://github.com/catchorg/Catch2,catchorg,187,2019-04-10T18:17:35Z,"A modern, C++-native, header-only, test framework for unit-tests, TDD and BDD - using C++11, C++14, C++17 and later (or C++03 on the Catch1.x branch)"
52,CPP,xbmc,8715,4971,C++,https://github.com/xbmc/xbmc,xbmc,429,2019-04-10T15:49:24Z,"Kodi is an award-winning free and open source home theater/media center software and entertainment hub for digital media. With its beautiful interface and powerful skinning engine, it's available for Android, BSD, Linux, macOS, iOS and Windows."
53,CPP,CRYENGINE,8634,1668,C++,https://github.com/CRYTEK/CRYENGINE,CRYTEK,127,2019-04-10T13:27:01Z,CRYENGINE is a powerful real-time game development platform created by Crytek.
54,CPP,napajs,8611,315,C++,https://github.com/Microsoft/napajs,Microsoft,61,2018-10-30T21:08:57Z,Napa.js: a multi-threaded JavaScript runtime
55,CPP,openage,8583,836,C++,https://github.com/SFTtech/openage,SFTtech,196,2019-04-08T19:47:37Z,Free (as in freedom) open source clone of the Age of Empires II engine :rocket:
56,CPP,turicreate,8472,807,C++,https://github.com/apple/turicreate,apple,367,2019-04-11T00:53:33Z,Turi Create simplifies the development of custom machine learning models.
57,CPP,Paddle,8414,2276,C++,https://github.com/PaddlePaddle/Paddle,PaddlePaddle,925,2019-04-11T03:49:55Z,PArallel Distributed Deep LEarning （PaddlePaddle核心框架，高性能单机、分布式训练和跨平台部署）
58,CPP,incubator-brpc,8409,1940,C++,https://github.com/apache/incubator-brpc,apache,101,2019-04-10T10:35:12Z,"Industrial-grade RPC framework used throughout Baidu, with 1,000,000+ instances and thousands kinds of services, called ""baidu-rpc"" inside Baidu."
59,CPP,openalpr,8300,1840,C++,https://github.com/openalpr/openalpr,openalpr,389,2019-03-26T12:25:17Z,Automatic License Plate Recognition library
60,CPP,Proton,8283,276,C++,https://github.com/ValveSoftware/Proton,ValveSoftware,1721,2019-04-04T21:10:37Z,Compatibility tool for Steam Play based on Wine and additional components
61,CPP,LightGBM,8253,2234,C++,https://github.com/Microsoft/LightGBM,Microsoft,88,2019-04-10T23:25:31Z,"A fast, distributed, high performance gradient boosting (GBDT, GBRT, GBM or MART) framework based on decision tree algorithms, used for ranking, classification and many other machine learning tasks. It is under the umbrella of the DMTK(http://github.com/microsoft/dmtk) project of Microsoft."
62,CPP,Karabiner-Elements,8252,517,C++,https://github.com/tekezo/Karabiner-Elements,tekezo,105,2019-04-10T02:49:20Z,Karabiner-Elements is a powerful utility for keyboard customization on macOS Sierra (10.12) or later.
63,CPP,mosh,8192,511,C++,https://github.com/mobile-shell/mosh,mobile-shell,208,2019-03-27T08:26:14Z,Mobile Shell
64,CPP,vnpy,8028,3728,C++,https://github.com/vnpy/vnpy,vnpy,12,2019-04-11T01:19:16Z,基于Python的开源量化交易平台开发框架
65,CPP,wkhtmltopdf,8018,1136,C++,https://github.com/wkhtmltopdf/wkhtmltopdf,wkhtmltopdf,731,2019-04-11T03:13:59Z,Convert HTML to PDF using Webkit (QtWebKit)
66,CPP,watchman,7860,599,C++,https://github.com/facebook/watchman,facebook,73,2019-04-11T03:39:18Z,"Watches files and records, or triggers actions, when they change. "
67,CPP,arangodb,7827,563,C++,https://github.com/arangodb/arangodb,arangodb,540,2019-04-10T21:28:14Z,"🥑 ArangoDB is a native multi-model database with flexible data models for documents, graphs, and key-values. Build high performance applications using a convenient SQL-like query language or JavaScript extensions."
68,CPP,rapidjson,7510,2069,C++,https://github.com/Tencent/rapidjson,Tencent,366,2019-04-09T05:21:59Z,A fast JSON parser/generator for C++ with both SAX/DOM style API
69,CPP,robomongo,7356,644,C++,https://github.com/Studio3T/robomongo,Studio3T,605,2019-04-04T06:52:46Z,Native cross-platform MongoDB management tool
70,CPP,AirSim,7326,1965,C++,https://github.com/Microsoft/AirSim,Microsoft,402,2019-04-10T03:04:53Z,"Open source simulator for autonomous vehicles built on Unreal Engine / Unity, from Microsoft AI & Research"
71,CPP,notepad-plus-plus,7284,2130,C++,https://github.com/notepad-plus-plus/notepad-plus-plus,notepad-plus-plus,2133,2019-04-10T22:38:31Z,Notepad++ official repository
72,CPP,dlib,6977,2087,C++,https://github.com/davisking/dlib,davisking,56,2019-04-07T18:27:04Z,A toolkit for making real world machine learning and data analysis applications in C++
73,CPP,MMKV,6924,679,C++,https://github.com/Tencent/MMKV,Tencent,1,2019-04-09T08:53:03Z,"An efficient, small mobile key-value storage framework developed by WeChat. Works on iOS, Android, macOS and Windows."
74,CPP,OpenRCT2,6889,753,C++,https://github.com/OpenRCT2/OpenRCT2,OpenRCT2,1059,2019-04-11T04:00:26Z,An open source re-implementation of RollerCoaster Tycoon 2 🎢
75,CPP,openFrameworks,6857,2228,C++,https://github.com/openframeworks/openFrameworks,openframeworks,898,2019-04-09T12:32:16Z,openFrameworks is a community-developed cross platform toolkit for creative coding in C++.
76,CPP,solidity,6835,1851,C++,https://github.com/ethereum/solidity,ethereum,624,2019-04-10T21:50:22Z,"Solidity, the Contract-Oriented Programming Language"
77,CPP,yuzu,6792,434,C++,https://github.com/yuzu-emu/yuzu,yuzu-emu,103,2019-04-11T01:17:36Z,Nintendo Switch Emulator
78,CPP,zeal,6736,525,C++,https://github.com/zealdocs/zeal,zealdocs,125,2019-04-11T00:21:34Z,Offline documentation browser inspired by Dash
79,CPP,synergy-core,6646,1648,C++,https://github.com/symless/synergy-core,symless,263,2019-04-10T15:59:36Z,"Open source core of Synergy, the keyboard and mouse sharing tool"
80,CPP,tinyrenderer,6623,513,C++,https://github.com/ssloy/tinyrenderer,ssloy,5,2019-02-20T13:41:57Z,A brief computer graphics / rendering course
81,CPP,ClickHouse,6616,1114,C++,https://github.com/yandex/ClickHouse,yandex,688,2019-04-10T22:10:56Z,ClickHouse is a free analytic DBMS for big data.
82,CPP,libfacedetection,6575,1792,C++,https://github.com/ShiqiYu/libfacedetection,ShiqiYu,78,2019-03-28T13:04:20Z,An open source library for face detection in images. The face detection speed can reach 1500FPS. 
83,CPP,Tars,6567,1620,C++,https://github.com/TarsCloud/Tars,TarsCloud,41,2019-04-10T00:18:19Z,Tars is a highly performance rpc framework based on naming service using tars protocol and provides a semi-automatic operation platform.
84,CPP,AudioKit,6514,1007,C++,https://github.com/AudioKit/AudioKit,AudioKit,9,2019-04-11T03:34:02Z,"Swift audio synthesis, processing, & analysis platform for iOS, macOS and tvOS"
85,CPP,simdjson,6504,321,C++,https://github.com/lemire/simdjson,lemire,39,2019-04-08T15:23:50Z,Parsing gigabytes of JSON per second 
86,CPP,AndFix,6492,1582,C++,https://github.com/alibaba/AndFix,alibaba,237,2017-10-18T13:56:12Z,AndFix is a library that offer hot-fix for Android App.
87,CPP,filament,6457,376,C++,https://github.com/google/filament,google,31,2019-04-11T03:11:34Z,"Filament is a real-time physically based rendering engine for Android, iOS, Windows, Linux, macOS and WASM/WebGL"
88,CPP,Sonoff-Tasmota,6448,1479,C++,https://github.com/arendst/Sonoff-Tasmota,arendst,41,2019-04-10T22:55:12Z,"Provide ESP8266 based itead Sonoff with Web, MQTT and OTA firmware using Arduino IDE or PlatformIO"
89,CPP,Gource,6445,529,C++,https://github.com/acaudwell/Gource,acaudwell,70,2019-02-28T22:57:04Z,software version control visualization
90,CPP,capnproto,6373,528,C++,https://github.com/capnproto/capnproto,capnproto,94,2019-04-08T17:01:25Z,Cap'n Proto serialization/RPC system - core tools and C++ library
91,CPP,rpcs3,6352,1107,C++,https://github.com/RPCS3/rpcs3,RPCS3,425,2019-04-10T21:03:27Z,PS3 emulator/debugger
92,CPP,shadowsocks-qt5,6303,1977,C++,https://github.com/shadowsocks/shadowsocks-qt5,shadowsocks,44,2019-01-01T20:28:17Z,A cross-platform shadowsocks GUI client
93,CPP,vowpal_wabbit,6227,1524,C++,https://github.com/VowpalWabbit/vowpal_wabbit,VowpalWabbit,75,2019-04-10T23:30:03Z,"Vowpal Wabbit is a machine learning system which pushes the frontier of machine learning with techniques such as online, hashing, allreduce, reductions, learning2search, active, and interactive learning."
94,CPP,faiss,6173,1170,C++,https://github.com/facebookresearch/faiss,facebookresearch,44,2019-04-10T21:08:11Z,A library for efficient similarity search and clustering of dense vectors.
95,CPP,tiled,6139,1224,C++,https://github.com/bjorn/tiled,bjorn,455,2019-04-03T19:38:19Z,A flexible level editor
96,CPP,thrift,6100,2839,C++,https://github.com/apache/thrift,apache,12,2019-04-06T07:53:59Z,Apache Thrift
97,CPP,node-sass,6098,849,C++,https://github.com/sass/node-sass,sass,154,2019-04-04T14:22:37Z,:rainbow: Node.js bindings to libsass
98,CPP,bgfx,6072,1001,C++,https://github.com/bkaradzic/bgfx,bkaradzic,205,2019-04-10T03:18:30Z,"Cross-platform, graphics API agnostic, ""Bring Your Own Engine/Framework"" style rendering library."
99,CPP,aseprite,6071,636,C++,https://github.com/aseprite/aseprite,aseprite,684,2019-04-10T10:06:40Z,"Animated sprite editor & pixel art tool (Windows, macOS, Linux)"
100,CPP,proxygen,6053,1161,C++,https://github.com/facebook/proxygen,facebook,33,2019-04-10T22:49:28Z,A collection of C++ HTTP libraries including an easy to use HTTP server.
1,Clojure,FiraCode,32976,1025,Clojure,https://github.com/tonsky/FiraCode,tonsky,192,2019-04-09T13:27:38Z,Monospaced font with programming ligatures
2,Clojure,metabase,14369,1902,Clojure,https://github.com/metabase/metabase,metabase,2105,2019-04-10T22:39:03Z,"The simplest, fastest way to get business intelligence and analytics  to everyone in your company :yum:"
3,Clojure,LightTable,10557,902,Clojure,https://github.com/LightTable/LightTable,LightTable,185,2019-04-09T15:49:54Z,The Light Table IDE ⛺
4,Clojure,clojurescript,8036,708,Clojure,https://github.com/clojure/clojurescript,clojure,2,2019-04-05T20:37:00Z,Clojure to JS compiler
5,Clojure,om,6618,373,Clojure,https://github.com/omcljs/om,omcljs,76,2019-02-17T20:19:25Z,ClojureScript interface to Facebook's React
6,Clojure,leiningen,6313,1478,Clojure,https://github.com/technomancy/leiningen,technomancy,199,2019-04-05T17:13:14Z,Automate Clojure projects without setting your hair on fire.
7,Clojure,overtone,4565,403,Clojure,https://github.com/overtone/overtone,overtone,85,2019-02-17T09:22:36Z,Collaborative Programmable Music 
8,Clojure,icepick,3795,215,Clojure,https://github.com/frankiesardo/icepick,frankiesardo,24,2018-08-21T21:53:46Z,Android Instance State made easy
9,Clojure,jepsen,3768,441,Clojure,https://github.com/jepsen-io/jepsen,jepsen-io,30,2019-04-11T01:11:01Z,"A framework for distributed systems verification, with fault injection"
10,Clojure,riemann,3746,508,Clojure,https://github.com/riemann/riemann,riemann,23,2019-01-31T19:44:57Z,"A network event stream processing system, in Clojure."
11,Clojure,re-frame,3666,482,Clojure,https://github.com/Day8/re-frame,Day8,29,2019-03-23T01:39:04Z,"A Reagent Framework For Writing SPAs, in Clojurescript."
12,Clojure,compojure,3563,237,Clojure,https://github.com/weavejester/compojure,weavejester,3,2018-08-20T21:11:26Z,A concise routing library for Ring/Clojure
13,Clojure,reagent,3384,275,Clojure,https://github.com/reagent-project/reagent,reagent-project,43,2019-03-03T13:51:38Z,A minimalistic ClojureScript interface to React.js
14,Clojure,alda,3262,196,Clojure,https://github.com/alda-lang/alda,alda-lang,1,2019-04-01T02:09:05Z,A music programming language for musicians. :notes:
15,Clojure,datascript,3250,207,Clojure,https://github.com/tonsky/datascript,tonsky,56,2019-03-11T20:00:54Z,"Immutable database and Datalog query engine for Clojure, ClojureScript and JS"
16,Clojure,clojure-koans,3090,1781,Clojure,https://github.com/functional-koans/clojure-koans,functional-koans,6,2019-03-02T17:22:26Z,A set of exercises for learning Clojure
17,Clojure,mori,3069,142,Clojure,https://github.com/swannodette/mori,swannodette,63,2018-11-09T11:13:57Z,ClojureScript's persistent data structures and supporting API from the comfort of vanilla JavaScript
18,Clojure,modern-cljs,2776,308,Clojure,https://github.com/magomimmo/modern-cljs,magomimmo,37,2018-08-30T16:05:03Z,A series of tutorials on ClojureScript
19,Clojure,ring,2764,426,Clojure,https://github.com/ring-clojure/ring,ring-clojure,30,2019-02-13T14:11:19Z,Clojure HTTP server abstraction
20,Clojure,lein-figwheel,2691,214,Clojure,https://github.com/bhauman/lein-figwheel,bhauman,93,2019-03-23T12:43:45Z,Figwheel builds your ClojureScript code and hot loads it into the browser as you are coding!
21,Clojure,status-react,2598,654,Clojure,https://github.com/status-im/status-react,status-im,405,2019-04-11T01:14:44Z,"a free (libre) open source, mobile OS for Ethereum"
22,Clojure,quil,2293,148,Clojure,https://github.com/quil/quil,quil,23,2019-04-10T03:41:20Z,Main repo. Quil source code.
23,Clojure,clojure-cookbook,2127,394,Clojure,https://github.com/clojure-cookbook/clojure-cookbook,clojure-cookbook,41,2018-12-27T14:38:31Z,This is the home of O'Reilly's Clojure Cookbook - http://clojure-cookbook.com
24,Clojure,aleph,2123,196,Clojure,https://github.com/ztellman/aleph,ztellman,70,2019-04-09T04:12:42Z,asynchronous communication for clojure
25,Clojure,instaparse,2096,123,Clojure,https://github.com/Engelberg/instaparse,Engelberg,28,2019-03-15T06:56:33Z,
26,Clojure,incanter,2073,279,Clojure,https://github.com/incanter/incanter,incanter,70,2019-02-13T09:57:05Z,"Clojure-based, R-like statistical computing and graphics environment for the JVM"
27,Clojure,pedestal,2043,229,Clojure,https://github.com/pedestal/pedestal,pedestal,43,2019-03-27T01:17:59Z,The Pedestal Server-side Libraries
28,Clojure,schema,1945,232,Clojure,https://github.com/plumatic/schema,plumatic,21,2019-01-21T05:45:28Z,Clojure(Script) library for declarative data description and validation
29,Clojure,hiccup,1894,143,Clojure,https://github.com/weavejester/hiccup,weavejester,27,2019-01-22T01:02:10Z,Fast library for rendering HTML in Clojure
30,Clojure,onyx,1864,195,Clojure,https://github.com/onyx-platform/onyx,onyx-platform,78,2019-02-27T05:53:01Z,"Distributed, masterless, high performance, fault tolerant data processing"
31,Clojure,specter,1850,76,Clojure,https://github.com/nathanmarz/specter,nathanmarz,24,2019-01-29T19:25:16Z,Clojure(Script)'s missing piece
32,Clojure,klipse,1835,89,Clojure,https://github.com/viebel/klipse,viebel,74,2019-03-12T05:31:01Z,"A simple client-side code evaluator pluggable on any web page: clojure, ruby, javascript, python, scheme, es2017, jsx, brainfuck, c++, reagent, lua, ocaml, reasonml, prolog, common lisp"
33,Clojure,awesome-clojure,1651,135,Clojure,https://github.com/razum2um/awesome-clojure,razum2um,6,2019-03-06T22:36:17Z,A curated list of awesome Clojure libraries and resources. Inspired by awesome-... stuff
34,Clojure,component,1617,85,Clojure,https://github.com/stuartsierra/component,stuartsierra,2,2019-02-14T12:43:28Z,Managed lifecycle of stateful objects in Clojure
35,Clojure,transit-format,1615,32,Clojure,https://github.com/cognitect/transit-format,cognitect,9,2017-03-15T11:21:48Z,A data interchange format.
36,Clojure,core.async,1598,176,Clojure,https://github.com/clojure/core.async,clojure,2,2018-12-06T16:30:58Z,Facilities for async programming and communication in Clojure
37,Clojure,boot,1566,168,Clojure,https://github.com/boot-clj/boot,boot-clj,115,2019-03-20T18:38:22Z,Build tooling for Clojure.
38,Clojure,lumo,1566,71,Clojure,https://github.com/anmonteiro/lumo,anmonteiro,78,2019-04-10T14:03:05Z,"Fast, cross-platform, standalone ClojureScript environment"
39,Clojure,kibit,1501,118,Clojure,https://github.com/jonase/kibit,jonase,63,2019-04-09T19:47:25Z,There's a function for that!
40,Clojure,Midje,1470,124,Clojure,https://github.com/marick/Midje,marick,37,2019-04-08T11:47:11Z,"Midje provides a migration path from clojure.test to a more flexible, readable, abstract, and gracious style of testing"
41,Clojure,enlive,1462,142,Clojure,https://github.com/cgrand/enlive,cgrand,28,2019-03-02T19:43:18Z,a selector-based (à la CSS) templating and transformation system for Clojure
42,Clojure,Korma,1409,228,Clojure,https://github.com/korma/Korma,korma,81,2018-08-17T15:20:06Z,Tasty SQL for Clojure.
43,Clojure,sente,1395,140,Clojure,https://github.com/ptaoussanis/sente,ptaoussanis,29,2019-04-05T16:02:44Z,Realtime web comms for Clojure/Script
44,Clojure,auto-parcel,1391,90,Clojure,https://github.com/frankiesardo/auto-parcel,frankiesardo,12,2017-02-12T15:10:29Z,Android Parcelable models made easy
45,Clojure,drake,1364,105,Clojure,https://github.com/Factual/drake,Factual,83,2018-12-12T22:36:59Z,"Data workflow tool, like a ""Make for data"""
46,Clojure,plumbing,1356,109,Clojure,https://github.com/plumatic/plumbing,plumatic,10,2018-02-22T03:32:31Z,Prismatic's Clojure(Script) utility belt
47,Clojure,cascalog,1351,177,Clojure,https://github.com/nathanmarz/cascalog,nathanmarz,40,2016-05-06T07:14:10Z,Data processing on Hadoop without the hassle.
48,Clojure,clj-http,1324,341,Clojure,https://github.com/dakrone/clj-http,dakrone,34,2019-04-10T23:38:13Z,An idiomatic clojure http client wrapping the apache client. Offically supported version.
49,Clojure,devcards,1305,100,Clojure,https://github.com/bhauman/devcards,bhauman,23,2019-02-05T15:29:01Z,Devcards aims to provide a visual REPL experience for ClojureScript
50,Clojure,Nightcode,1303,121,Clojure,https://github.com/oakes/Nightcode,oakes,31,2019-04-03T03:20:55Z,An IDE for Clojure
51,Clojure,duckling_old,1296,233,Clojure,https://github.com/wit-ai/duckling_old,wit-ai,72,2019-03-27T22:21:50Z,Deprecated in favor of https://github.com/facebook/duckling
52,Clojure,yesql,1295,109,Clojure,https://github.com/krisajenkins/yesql,krisajenkins,68,2018-08-03T23:28:21Z,A Clojure library for using SQL.
53,Clojure,Arcadia,1255,86,Clojure,https://github.com/arcadia-unity/Arcadia,arcadia-unity,40,2019-04-05T19:47:00Z,Clojure in Unity
54,Clojure,seesaw,1252,137,Clojure,https://github.com/daveray/seesaw,daveray,62,2019-01-09T06:57:10Z,"Seesaw turns the Horror of Swing into a friendly, well-documented, Clojure library"
55,Clojure,chestnut,1247,98,Clojure,https://github.com/plexus/chestnut,plexus,5,2019-04-03T20:11:35Z,Application template for Clojure + ClojureScript web apps
56,Clojure,asciinema-player,1176,129,Clojure,https://github.com/asciinema/asciinema-player,asciinema,40,2018-12-31T16:18:56Z,Web player for terminal session recordings ⏩
57,Clojure,lacinia,1176,92,Clojure,https://github.com/walmartlabs/lacinia,walmartlabs,14,2019-04-05T22:56:08Z,GraphQL implementation in pure Clojure
58,Clojure,liberator,1172,143,Clojure,https://github.com/clojure-liberator/liberator,clojure-liberator,57,2019-03-22T09:24:22Z,Liberator is a Clojure library for building RESTful applications.
59,Clojure,core.logic,1165,103,Clojure,https://github.com/clojure/core.logic,clojure,1,2018-03-06T19:43:22Z,
60,Clojure,ultra,1145,29,Clojure,https://github.com/venantius/ultra,venantius,7,2019-03-09T13:33:25Z,A Leiningen plugin for a superior development environment
61,Clojure,friend,1144,121,Clojure,https://github.com/cemerick/friend,cemerick,32,2017-07-25T15:52:18Z,An extensible authentication and authorization library for Clojure Ring web applications and services. 
62,Clojure,closh,1127,29,Clojure,https://github.com/dundalek/closh,dundalek,44,2019-04-09T20:26:48Z,Bash-like shell based on Clojure
63,Clojure,cortex,1121,95,Clojure,https://github.com/originrose/cortex,originrose,31,2018-09-10T20:29:23Z,Machine learning in Clojure
64,Clojure,timbre,1110,132,Clojure,https://github.com/ptaoussanis/timbre,ptaoussanis,32,2019-02-15T17:48:48Z,Pure Clojure/Script logging library
65,Clojure,cheshire,1100,115,Clojure,https://github.com/dakrone/cheshire,dakrone,27,2019-03-26T20:57:39Z,Clojure JSON and JSON SMILE (binary json format) encoding/decoding
66,Clojure,core.typed,1073,68,Clojure,https://github.com/clojure/core.typed,clojure,0,2018-11-30T13:19:23Z,An optional type system for Clojure
67,Clojure,code-maat,1073,123,Clojure,https://github.com/adamtornhill/code-maat,adamtornhill,11,2019-01-29T20:32:23Z,A command line tool to mine and analyze data from version-control systems
68,Clojure,frak,1023,40,Clojure,https://github.com/noprompt/frak,noprompt,1,2019-04-10T22:38:00Z,Transform collections of strings into regular expressions.
69,Clojure,lein-cljsbuild,1021,163,Clojure,https://github.com/emezeske/lein-cljsbuild,emezeske,50,2018-07-02T13:39:11Z,Leiningen plugin to make ClojureScript development easy.
70,Clojure,frontend,1021,130,Clojure,https://github.com/circleci/frontend,circleci,20,2018-12-25T18:26:30Z,CircleCI's frontend
71,Clojure,lux,1019,40,Clojure,https://github.com/LuxLang/lux,LuxLang,6,2019-04-09T22:59:52Z,The Lux Programming Language
72,Clojure,garden,1000,59,Clojure,https://github.com/noprompt/garden,noprompt,35,2019-04-10T22:38:13Z,Generate CSS with Clojure
73,Clojure,hitchhiker-tree,957,66,Clojure,https://github.com/datacrypt-project/hitchhiker-tree,datacrypt-project,17,2018-07-22T21:01:33Z,"Functional, persistent, off-heap, high performance data structure"
74,Clojure,honeysql,948,105,Clojure,https://github.com/jkk/honeysql,jkk,9,2019-04-07T03:31:39Z,Turn Clojure data structures into SQL
75,Clojure,compojure-api,926,128,Clojure,https://github.com/metosin/compojure-api,metosin,29,2019-04-01T23:11:53Z,Sweet web apis with Compojure & Swagger
76,Clojure,4clojure,919,196,Clojure,https://github.com/4clojure/4clojure,4clojure,80,2019-01-01T08:03:51Z,An interactive problem website for learning Clojure
77,Clojure,play-clj,917,70,Clojure,https://github.com/oakes/play-clj,oakes,9,2019-03-11T00:46:23Z,A Clojure game library
78,Clojure,markright,911,58,Clojure,https://github.com/dvcrn/markright,dvcrn,24,2017-03-01T01:38:59Z,➡ Electron powered markdown editor with live preview
79,Clojure,logic-tutorial,894,83,Clojure,https://github.com/swannodette/logic-tutorial,swannodette,14,2018-10-30T11:45:38Z,A Very Gentle Introduction to Relational Programming
80,Clojure,test.check,891,95,Clojure,https://github.com/clojure/test.check,clojure,0,2019-03-10T21:46:53Z,QuickCheck for Clojure
81,Clojure,criterium,886,43,Clojure,https://github.com/hugoduncan/criterium,hugoduncan,13,2017-02-28T09:44:26Z,Benchmarking library for clojure
82,Clojure,core.match,884,52,Clojure,https://github.com/clojure/core.match,clojure,0,2019-04-01T15:22:25Z,
83,Clojure,eastwood,884,58,Clojure,https://github.com/jonase/eastwood,jonase,104,2019-03-27T07:48:06Z,Clojure lint tool
84,Clojure,carmine,866,94,Clojure,https://github.com/ptaoussanis/carmine,ptaoussanis,19,2019-04-04T14:06:14Z,Redis client and message queue for Clojure
85,Clojure,clojurec,866,52,Clojure,https://github.com/schani/clojurec,schani,5,2018-04-25T22:28:20Z,A Clojure implementation on top of C
86,Clojure,swarmpit,862,86,Clojure,https://github.com/swarmpit/swarmpit,swarmpit,61,2019-04-10T17:40:45Z,Lightweight mobile-friendly Docker Swarm management UI
87,Clojure,mount,861,64,Clojure,https://github.com/tolitius/mount,tolitius,21,2019-01-28T15:44:09Z,managing Clojure and ClojureScript app state since (reset)
88,Clojure,lt-cljs-tutorial,858,128,Clojure,https://github.com/swannodette/lt-cljs-tutorial,swannodette,10,2015-10-08T07:16:26Z,A ClojureScript Programming Language Tutorial for Light Table Users
89,Clojure,bidi,856,91,Clojure,https://github.com/juxt/bidi,juxt,52,2019-03-25T10:20:15Z,Bidirectional URI routing
90,Clojure,cljs-devtools,852,32,Clojure,https://github.com/binaryage/cljs-devtools,binaryage,8,2018-11-27T17:26:54Z,A collection of Chrome DevTools enhancements for ClojureScript developers
91,Clojure,shadow-cljs,848,45,Clojure,https://github.com/thheller/shadow-cljs,thheller,42,2019-04-08T17:59:34Z,ClojureScript compilation made easy
92,Clojure,hoplon,845,64,Clojure,https://github.com/hoplon/hoplon,hoplon,41,2019-01-26T21:54:00Z,Hoplon web development tools and libraries.
93,Clojure,clara-rules,842,94,Clojure,https://github.com/cerner/clara-rules,cerner,72,2019-04-08T00:29:53Z,Forward-chaining rules in Clojure(Script)
94,Clojure,pulsar,841,51,Clojure,https://github.com/puniverse/pulsar,puniverse,9,2017-09-06T16:16:37Z,"Fibers, Channels and Actors for Clojure"
95,Clojure,amazonica,813,170,Clojure,https://github.com/mcohen01/amazonica,mcohen01,28,2019-03-20T18:44:21Z,A comprehensive Clojure client for the entire Amazon AWS api.
96,Clojure,pallet,799,121,Clojure,https://github.com/pallet/pallet,pallet,126,2018-05-25T15:44:26Z,Automates controlling and provisioning cloud server instances. DevOps for the JVM.
97,Clojure,duct,793,42,Clojure,https://github.com/duct-framework/duct,duct-framework,5,2019-04-03T16:33:23Z,Server-side application framework for Clojure
98,Clojure,Nightlight,762,33,Clojure,https://github.com/oakes/Nightlight,oakes,13,2019-03-23T22:05:42Z,An embedded editor for Clojure
99,Clojure,noir,759,84,Clojure,https://github.com/noir-clojure/noir,noir-clojure,24,2012-12-13T23:35:54Z,A framework for writing web applications in clojure.
100,Clojure,environ,758,61,Clojure,https://github.com/weavejester/environ,weavejester,14,2019-01-10T12:38:44Z,Library for managing environment variables in Clojure
1,CoffeeScript,coffeescript,15166,1994,CoffeeScript,https://github.com/jashkenas/coffeescript,jashkenas,35,2019-04-10T06:19:06Z,Unfancy JavaScript
