rank,item,repo_name,stars,forks,language,repo_url,username,issues,last_commit,description
84,Java,MaterialDesignLibrary,8964,2398,Java,https://github.com/navasmdc/MaterialDesignLibrary,navasmdc,264,2018-10-19T03:52:29Z,This is a library with components of Android L to you use in android 2.2
85,Java,recyclerview-animators,8864,1740,Java,https://github.com/wasabeef/recyclerview-animators,wasabeef,97,2018-11-16T07:20:43Z,An Android Animation library which easily add itemanimator to RecyclerView items.
86,Java,Arduino,8855,6430,Java,https://github.com/arduino/Arduino,arduino,1057,2019-01-28T17:33:04Z,open-source electronics prototyping platform
87,Java,GSYVideoPlayer,8780,1982,Java,https://github.com/CarGuo/GSYVideoPlayer,CarGuo,19,2019-01-15T03:20:20Z,"视频播放器（IJKplayer、ExoPlayer、MediaPlayer），HTTPS支持，支持弹幕，支持滤镜、水印、gif截图，片头广告、中间广告，多个同时播放，支持基本的拖动，声音、亮度调节，支持边播边缓存，支持视频本身自带rotation的旋转（90,270之类），重力旋转与手动旋转的同步支持，支持列表播放 ，直接添加控件为封面，列表全屏动画，视频加载速度，列表小窗口支持拖动，动画效果，调整比例，多分辨率切换，支持切换播放器，进度条小窗口预览，列表切换详情页面无缝播放，其他一些小动画效果，rtsp、concat、mpeg。项目解析： "
88,Java,Android-PullToRefresh,8776,5071,Java,https://github.com/chrisbanes/Android-PullToRefresh,chrisbanes,30,2017-10-13T08:40:58Z,DEPRECATED
89,Java,okhttp-OkGo,8757,2168,Java,https://github.com/jeasonlzy/okhttp-OkGo,jeasonlzy,335,2018-08-09T02:48:24Z,OkGo - 3.0 震撼来袭，该库是基于 Http 协议，封装了 OkHttp 的网络请求框架，比 Retrofit 更简单易用，支持 RxJava，RxJava2，支持自定义缓存，支持批量断点下载管理和批量上传管理功能
90,Java,ARouter,8750,1455,Java,https://github.com/alibaba/ARouter,alibaba,37,2019-01-24T17:40:19Z,💪 A framework for assisting in the renovation of Android componentization (帮助 Android App 进行组件化改造的路由框架)
91,Java,Matisse,8741,1305,Java,https://github.com/zhihu/Matisse,zhihu,247,2019-01-20T16:03:41Z,:fireworks: A well-designed local image and video selector for Android
92,Java,presto,8651,2932,Java,https://github.com/prestodb/presto,prestodb,1421,2019-02-02T03:47:39Z,Distributed SQL query engine for big data
93,Java,PermissionsDispatcher,8541,1202,Java,https://github.com/permissions-dispatcher/PermissionsDispatcher,permissions-dispatcher,0,2019-01-22T15:30:25Z,Simple annotation-based API to handle runtime permissions.
94,Java,hadoop,8540,5335,Java,https://github.com/apache/hadoop,apache,206,2019-02-02T03:12:59Z,Mirror of Apache Hadoop
95,Java,JiaoZiVideoPlayer,8474,2033,Java,https://github.com/lipangit/JiaoZiVideoPlayer,lipangit,60,2019-01-23T08:38:55Z,Android VideoPlayer MediaPlayer VideoView MediaView Float View And Fullscreen
96,Java,RxTool,8435,2125,Java,https://github.com/vondear/RxTool,vondear,117,2018-11-02T09:50:47Z,Android开发人员不得不收集的工具类集合 | 支付宝支付 | 微信支付（统一下单） | 微信分享 | Zip4j压缩（支持分卷压缩与加密） | 一键集成UCrop选择圆形头像 | 一键集成二维码和条形码的扫描与生成 | 常用Dialog | WebView的封装可播放视频 | 仿斗鱼滑动验证码 | Toast封装 | 震动 | GPS | Location定位 | 图片缩放 | Exif 图片添加地理位置信息（经纬度） | 蛛网等级 | 颜色选择器 | ArcGis | VTPK | 编译运行一下说不定会找到惊喜
97,Java,AppIntro,8336,1519,Java,https://github.com/AppIntro/AppIntro,AppIntro,67,2019-01-26T14:51:04Z,Make a cool intro for your Android app.
98,Java,AVLoadingIndicatorView,8334,1653,Java,https://github.com/81813780/AVLoadingIndicatorView,81813780,62,2018-04-24T02:59:27Z,DEPRECATED
99,Java,AndroidSlidingUpPanel,8247,2215,Java,https://github.com/umano/AndroidSlidingUpPanel,umano,278,2018-10-22T15:51:54Z,This library provides a simple way to add a draggable sliding up panel (popularized by Google Music and Google Maps) to your Android application. Brought to you by Umano.
100,Java,platform_frameworks_base,8238,5385,Java,https://github.com/aosp-mirror/platform_frameworks_base,aosp-mirror,0,2018-09-05T21:52:03Z,
1,JavaScript,freeCodeCamp,297229,20847,JavaScript,https://github.com/freeCodeCamp/freeCodeCamp,freeCodeCamp,4892,2019-02-02T03:31:31Z,The https://www.freeCodeCamp.org open source codebase and curriculum. Learn to code for free together with millions of people.
2,JavaScript,vue,126866,18087,JavaScript,https://github.com/vuejs/vue,vuejs,223,2019-02-01T12:50:20Z,"🖖 Vue.js is a progressive, incrementally-adoptable JavaScript framework for building UI on the web."
3,JavaScript,react,121267,21968,JavaScript,https://github.com/facebook/react,facebook,543,2019-02-01T21:05:14Z,"A declarative, efficient, and flexible JavaScript library for building user interfaces."
4,JavaScript,d3,82127,20340,JavaScript,https://github.com/d3/d3,d3,7,2019-01-28T17:59:45Z,"Bring data to life with SVG, Canvas and HTML. :bar_chart::chart_with_upwards_trend::tada:"
5,JavaScript,javascript,81266,15507,JavaScript,https://github.com/airbnb/javascript,airbnb,138,2019-01-30T04:11:58Z,JavaScript Style Guide
6,JavaScript,react-native,73425,16356,JavaScript,https://github.com/facebook/react-native,facebook,764,2019-02-02T02:19:16Z,A framework for building native apps with React.
7,JavaScript,create-react-app,62936,13824,JavaScript,https://github.com/facebook/create-react-app,facebook,349,2019-02-02T02:51:02Z,Set up a modern web app by running one command.
8,JavaScript,angular.js,59371,28945,JavaScript,https://github.com/angular/angular.js,angular,460,2019-01-26T10:32:23Z,AngularJS - HTML enhanced for web apps!
9,JavaScript,Font-Awesome,58664,9949,JavaScript,https://github.com/FortAwesome/Font-Awesome,FortAwesome,4722,2019-02-01T19:46:30Z,"The iconic SVG, font, and CSS toolkit"
10,JavaScript,node,57815,12806,JavaScript,https://github.com/nodejs/node,nodejs,830,2019-02-02T03:32:17Z,Node.js JavaScript runtime :sparkles::turtle::rocket::sparkles:
11,JavaScript,axios,54485,4227,JavaScript,https://github.com/axios/axios,axios,523,2019-02-01T07:48:20Z,Promise based HTTP client for the browser and node.js
12,JavaScript,jquery,50870,17668,JavaScript,https://github.com/jquery/jquery,jquery,89,2019-01-29T13:13:54Z,jQuery JavaScript Library
13,JavaScript,three.js,48460,18215,JavaScript,https://github.com/mrdoob/three.js,mrdoob,796,2019-02-02T03:48:26Z,JavaScript 3D library.
14,JavaScript,atom,47673,10902,JavaScript,https://github.com/atom/atom,atom,718,2019-02-02T01:02:23Z,:atom: The hackable text editor
15,JavaScript,webpack,46824,5913,JavaScript,https://github.com/webpack/webpack,webpack,488,2019-02-01T11:10:27Z,"A bundler for javascript and friends. Packs many modules into a few bundled assets. Code Splitting allows for loading parts of the application on demand. Through ""loaders"", modules can be CommonJs, AMD, ES6 modules, CSS, Images, JSON, Coffeescript, LESS, ... and your custom stuff."
16,JavaScript,redux,46606,11849,JavaScript,https://github.com/reduxjs/redux,reduxjs,30,2019-01-30T19:19:57Z,Predictable state container for JavaScript apps
17,JavaScript,socket.io,45083,8339,JavaScript,https://github.com/socketio/socket.io,socketio,358,2019-01-19T06:08:50Z,Realtime application framework (Node.JS server)
18,JavaScript,reveal.js,44496,12834,JavaScript,https://github.com/hakimel/reveal.js,hakimel,406,2019-02-01T10:09:10Z,The HTML Presentation Framework
19,JavaScript,Semantic-UI,44361,4727,JavaScript,https://github.com/Semantic-Org/Semantic-UI,Semantic-Org,830,2019-01-22T05:37:47Z,Semantic is a UI component framework based around useful principles from natural language.
20,JavaScript,material-ui,44086,8964,JavaScript,https://github.com/mui-org/material-ui,mui-org,294,2019-02-02T01:41:32Z,React components that implement Google's Material Design.
21,JavaScript,javascript-algorithms,43734,5893,JavaScript,https://github.com/trekhleb/javascript-algorithms,trekhleb,67,2019-02-01T14:23:46Z,📝 Algorithms and data structures implemented in JavaScript with explanations and links to further readings
22,JavaScript,Chart.js,41576,9318,JavaScript,https://github.com/chartjs/Chart.js,chartjs,462,2019-02-02T02:38:32Z,Simple HTML5 Charts using the <canvas> tag
23,JavaScript,meteor,40731,5036,JavaScript,https://github.com/meteor/meteor,meteor,277,2019-01-31T17:48:26Z,"Meteor, the JavaScript App Platform"
24,JavaScript,moment,40025,6004,JavaScript,https://github.com/moment/moment,moment,256,2019-01-31T13:23:59Z,"Parse, validate, manipulate, and display dates in javascript."
25,JavaScript,resume.github.com,39224,1043,JavaScript,https://github.com/resume/resume.github.com,resume,37,2018-12-29T23:17:05Z,Resumes generated using the GitHub informations
26,JavaScript,30-seconds-of-code,38186,4088,JavaScript,https://github.com/30-seconds/30-seconds-of-code,30-seconds,9,2019-01-26T06:09:46Z,Curated collection of useful JavaScript snippets that you can understand in 30 seconds or less.
27,JavaScript,json-server,37867,3281,JavaScript,https://github.com/typicode/json-server,typicode,399,2019-01-27T10:54:14Z,Get a full fake REST API with zero coding in less than 30 seconds (seriously)
28,JavaScript,lodash,37158,3843,JavaScript,https://github.com/lodash/lodash,lodash,7,2019-02-01T07:43:03Z,"A modern JavaScript utility library delivering modularity, performance, & extras."
29,JavaScript,markdown-here,35214,5950,JavaScript,https://github.com/adam-p/markdown-here,adam-p,226,2018-11-13T20:35:39Z,"Google Chrome, Firefox, and Thunderbird extension that lets you write email in Markdown and render it before sending."
30,JavaScript,materialize,34983,4693,JavaScript,https://github.com/Dogfalo/materialize,Dogfalo,613,2019-01-27T13:59:29Z,"Materialize, a CSS Framework based on Material Design"
31,JavaScript,yarn,34650,2060,JavaScript,https://github.com/yarnpkg/yarn,yarnpkg,1671,2019-02-01T10:57:57Z,"📦🐈 Fast, reliable, and secure dependency management."
32,JavaScript,react-router,34618,7167,JavaScript,https://github.com/ReactTraining/react-router,ReactTraining,64,2019-02-01T17:10:41Z,Declarative routing for React
33,JavaScript,impress.js,34439,6793,JavaScript,https://github.com/impress/impress.js,impress,53,2019-01-23T09:03:25Z,It's a presentation framework based on the power of CSS3 transforms and transitions in modern browsers and inspired by the idea behind prezi.com.
34,JavaScript,next.js,34192,3791,JavaScript,https://github.com/zeit/next.js,zeit,205,2019-02-01T20:20:23Z,The React Framework
35,JavaScript,storybook,33574,2522,JavaScript,https://github.com/storybooks/storybook,storybooks,237,2019-02-02T02:35:32Z,"Interactive UI component dev & test: React, React Native, Vue, Angular, Ember"
36,JavaScript,Front-End-Checklist,33279,3160,JavaScript,https://github.com/thedaviddias/Front-End-Checklist,thedaviddias,3,2019-01-29T21:48:26Z,🗂 The perfect Front-End Checklist for modern websites and meticulous developers
37,JavaScript,hacker-scripts,32713,5700,JavaScript,https://github.com/NARKOZ/hacker-scripts,NARKOZ,52,2018-10-09T05:16:03Z,Based on a true story
38,JavaScript,incubator-echarts,32345,9403,JavaScript,https://github.com/apache/incubator-echarts,apache,3198,2019-01-31T06:19:38Z,"A powerful, interactive charting and visualization library for browser"
39,JavaScript,babel,31717,3284,JavaScript,https://github.com/babel/babel,babel,801,2019-02-01T14:23:07Z,🐠 Babel is a compiler for writing next generation JavaScript.
40,JavaScript,gatsby,31027,4094,JavaScript,https://github.com/gatsbyjs/gatsby,gatsbyjs,721,2019-02-02T02:06:01Z,"Build blazing fast, modern apps and websites with React"
41,JavaScript,gulp,30871,4425,JavaScript,https://github.com/gulpjs/gulp,gulpjs,22,2018-12-28T09:21:01Z,The streaming build system
42,JavaScript,prettier,30064,1575,JavaScript,https://github.com/prettier/prettier,prettier,514,2019-02-01T13:29:32Z,Prettier is an opinionated code formatter.
43,JavaScript,jQuery-File-Upload,29672,7935,JavaScript,https://github.com/blueimp/jQuery-File-Upload,blueimp,52,2018-11-14T06:09:12Z,"File Upload widget with multiple file selection, drag&drop support, progress bar, validation and preview images, audio and video for jQuery. Supports cross-domain, chunked and resumable file uploads. Works with any server-side platform (Google App Engine, PHP, Python, Ruby on Rails, Java, etc.) that supports standard HTML form file uploads."
44,JavaScript,parcel,29617,1318,JavaScript,https://github.com/parcel-bundler/parcel,parcel-bundler,635,2019-02-02T00:28:56Z,"📦🚀 Blazing fast, zero configuration web application bundler"
45,JavaScript,brackets,29513,6383,JavaScript,https://github.com/adobe/brackets,adobe,2380,2019-01-27T17:37:33Z,"An open source code editor for the web, written in JavaScript, HTML and CSS."
46,JavaScript,anime,29089,2081,JavaScript,https://github.com/juliangarnier/anime,juliangarnier,48,2019-02-01T15:57:27Z,JavaScript animation engine
47,JavaScript,awesome-selfhosted,28876,2336,JavaScript,https://github.com/Kickball/awesome-selfhosted,Kickball,50,2019-01-31T20:11:35Z,This is a list of Free Software network services and web applications which can be hosted locally. Selfhosting is the process of locally hosting and managing applications instead of renting from SaaS providers.
48,JavaScript,Ghost,28847,6210,JavaScript,https://github.com/TryGhost/Ghost,TryGhost,85,2019-02-01T14:04:47Z,The platform for professional publishers
49,JavaScript,serverless,27822,3050,JavaScript,https://github.com/serverless/serverless,serverless,633,2019-01-31T23:50:47Z,"Serverless Framework – Build web, mobile and IoT applications with serverless architectures using AWS Lambda, Azure Functions, Google CloudFunctions & more! – "
50,JavaScript,backbone,27376,5725,JavaScript,https://github.com/jashkenas/backbone,jashkenas,81,2018-10-12T16:40:18Z,"Give your JS App some Backbone with Models, Views, Collections, and Events"
51,JavaScript,hyper,27294,2216,JavaScript,https://github.com/zeit/hyper,zeit,683,2019-01-30T23:43:02Z,A terminal built on web technologies
52,JavaScript,immutable-js,26368,1550,JavaScript,https://github.com/facebook/immutable-js,facebook,117,2019-01-30T10:34:36Z,Immutable persistent data collections for Javascript which increase efficiency and simplicity.
53,JavaScript,slate,25926,15682,JavaScript,https://github.com/lord/slate,lord,40,2019-01-29T18:07:06Z,Beautiful static documentation for your API
54,JavaScript,fullPage.js,25838,6278,JavaScript,https://github.com/alvarotrigo/fullPage.js,alvarotrigo,136,2019-01-31T11:36:49Z,fullPage plugin by Alvaro Trigo. Create full screen pages fast and simple
55,JavaScript,awesome-mac,25710,3031,JavaScript,https://github.com/jaywcjlove/awesome-mac,jaywcjlove,32,2019-02-01T09:08:23Z," Now we have become very big, Different from the original idea. Collect premium software in various categories."
56,JavaScript,hackathon-starter,25632,5068,JavaScript,https://github.com/sahat/hackathon-starter,sahat,14,2019-01-28T08:57:55Z,A boilerplate for Node.js web applications
57,JavaScript,tech-interview-handbook,25568,3307,JavaScript,https://github.com/yangshun/tech-interview-handbook,yangshun,6,2019-01-28T20:59:00Z,"💯 Algorithms study materials, behavioral content and tips for rocking your coding interview"
58,JavaScript,33-js-concepts,25313,2282,JavaScript,https://github.com/leonardomso/33-js-concepts,leonardomso,5,2019-01-29T17:52:11Z,📜 33 concepts every JavaScript developer should know.
59,JavaScript,pdf.js,25256,6095,JavaScript,https://github.com/mozilla/pdf.js,mozilla,669,2019-02-01T13:29:20Z,PDF Reader in JavaScript
60,JavaScript,async,25193,2285,JavaScript,https://github.com/caolan/async,caolan,15,2019-01-29T05:34:11Z,Async utilities for node and the browser
61,JavaScript,hexo,25127,3406,JavaScript,https://github.com/hexojs/hexo,hexojs,243,2019-02-01T17:04:44Z,"A fast, simple & powerful blog framework, powered by Node.js."
62,JavaScript,clipboard.js,24984,2830,JavaScript,https://github.com/zenorocha/clipboard.js,zenorocha,40,2018-11-18T12:57:10Z,:scissors: Modern copy to clipboard. No Flash. Just 3kb gzipped :clipboard:
63,JavaScript,todomvc,24901,13291,JavaScript,https://github.com/tastejs/todomvc,tastejs,154,2019-02-01T14:36:24Z,"Helping you select an MV* framework - Todo apps for React.js, Ember.js, Angular, and many more"
64,JavaScript,koa,24822,2249,JavaScript,https://github.com/koajs/koa,koajs,42,2019-02-02T01:44:12Z,Expressive middleware for node.js using ES2017 async functions
65,JavaScript,nodebestpractices,24756,1815,JavaScript,https://github.com/i0natan/nodebestpractices,i0natan,61,2019-02-01T05:31:02Z,The largest Node.js best practices list (January 2019)
66,JavaScript,nylas-mail,24241,1346,JavaScript,https://github.com/nylas/nylas-mail,nylas,1046,2019-01-10T07:27:22Z,:love_letter: An extensible desktop mail app built on the modern web.  Forks welcome!
67,JavaScript,underscore,24148,5361,JavaScript,https://github.com/jashkenas/underscore,jashkenas,118,2019-01-26T23:23:17Z,JavaScript's utility _ belt
68,JavaScript,Leaflet,23925,3947,JavaScript,https://github.com/Leaflet/Leaflet,Leaflet,383,2019-02-01T02:01:30Z, :leaves: JavaScript library for mobile-friendly interactive maps
69,JavaScript,video.js,23912,5846,JavaScript,https://github.com/videojs/video.js,videojs,187,2019-01-31T17:44:11Z,Video.js - open source HTML5 & Flash video player
70,JavaScript,phaser,23796,5845,JavaScript,https://github.com/photonstorm/phaser,photonstorm,179,2019-02-01T18:03:05Z,"Phaser is a fun, free and fast 2D game framework for making HTML5 games for desktop and mobile web browsers, supporting Canvas and WebGL rendering."
71,JavaScript,Modernizr,23363,3026,JavaScript,https://github.com/Modernizr/Modernizr,Modernizr,190,2019-01-25T13:32:21Z,Modernizr is a JavaScript library that detects HTML5 and CSS3 features in the user’s browser.
72,JavaScript,jest,23308,3156,JavaScript,https://github.com/facebook/jest,facebook,534,2019-02-01T22:00:47Z,Delightful JavaScript Testing.
73,JavaScript,slick,23270,4574,JavaScript,https://github.com/kenwheeler/slick,kenwheeler,1022,2019-02-01T10:24:37Z,the last carousel you'll ever need
74,JavaScript,select2,23224,5445,JavaScript,https://github.com/select2/select2,select2,465,2018-12-26T16:29:56Z,"Select2 is a jQuery based replacement for select boxes. It supports searching, remote data sets, and infinite scrolling of results."
75,JavaScript,incubator-superset,22971,4218,JavaScript,https://github.com/apache/incubator-superset,apache,1109,2019-02-02T02:42:04Z,"Apache Superset (incubating) is a modern, enterprise-ready business intelligence web application"
76,JavaScript,awesome-react-native,22871,2794,JavaScript,https://github.com/jondot/awesome-react-native,jondot,25,2019-01-30T18:53:20Z,"Awesome React Native components, news, tools, and learning material!"
77,JavaScript,realworld,22091,1463,JavaScript,https://github.com/gothinkster/realworld,gothinkster,122,2019-02-01T17:43:15Z,"""The mother of all demo apps"" — Exemplary fullstack Medium.com clone powered by React, Angular, Node, Django, and many more 🏅"
78,JavaScript,styled-components,21843,1309,JavaScript,https://github.com/styled-components/styled-components,styled-components,77,2019-02-01T16:07:16Z,Visual primitives for the component age. Use the best bits of ES6 and CSS to style your apps without stress 💅
79,JavaScript,pixi.js,21755,3148,JavaScript,https://github.com/pixijs/pixi.js,pixijs,354,2019-02-02T00:40:41Z,"The HTML5 Creation Engine: Create beautiful digital content with the fastest, most flexible 2D WebGL renderer."
80,JavaScript,request,21725,2560,JavaScript,https://github.com/request/request,request,304,2019-01-25T23:50:56Z,🏊🏾 Simplified HTTP request client.
81,JavaScript,clean-code-javascript,21646,2258,JavaScript,https://github.com/ryanmcdermott/clean-code-javascript,ryanmcdermott,28,2019-01-24T02:58:56Z,:bathtub: Clean Code concepts adapted for JavaScript
82,JavaScript,preact,21416,1098,JavaScript,https://github.com/developit/preact,developit,187,2019-01-22T17:49:53Z,⚛️ Fast 3kB React alternative with the same modern API. Components & Virtual DOM.
83,JavaScript,quill,21392,1572,JavaScript,https://github.com/quilljs/quill,quilljs,540,2019-01-30T06:05:58Z,Quill is a modern WYSIWYG editor built for compatibility and extensibility.
84,JavaScript,Rocket.Chat,21375,4581,JavaScript,https://github.com/RocketChat/Rocket.Chat,RocketChat,2137,2019-02-01T23:26:32Z,"Have your own Slack like online chat, built with Meteor."
85,JavaScript,fetch,21317,1924,JavaScript,https://github.com/github/fetch,github,11,2019-01-02T11:28:34Z,A window.fetch JavaScript polyfill.
86,JavaScript,react-boilerplate,21229,4114,JavaScript,https://github.com/react-boilerplate/react-boilerplate,react-boilerplate,23,2019-01-31T17:56:45Z,":fire: A highly scalable, offline-first foundation with the best developer experience and a focus on performance and best practices."
87,JavaScript,awesome-wechat-weapp,20923,4485,JavaScript,https://github.com/justjavac/awesome-wechat-weapp,justjavac,5,2019-01-16T12:20:10Z,微信小程序开发资源汇总 :100:
88,JavaScript,500lines,20777,4786,JavaScript,https://github.com/aosabook/500lines,aosabook,47,2018-10-19T15:15:57Z,500 Lines or Less
89,JavaScript,ember.js,20579,4104,JavaScript,https://github.com/emberjs/ember.js,emberjs,263,2019-02-02T03:28:24Z,Ember.js - A JavaScript framework for creating ambitious web applications
90,JavaScript,standard,20284,1527,JavaScript,https://github.com/standard/standard,standard,83,2019-01-21T14:13:10Z,"🌟 JavaScript Style Guide, with linter & automatic code fixer"
91,JavaScript,sails,20174,1834,JavaScript,https://github.com/balderdashy/sails,balderdashy,190,2019-01-31T04:52:04Z,Realtime MVC Framework for Node.js
92,JavaScript,postcss,20169,1117,JavaScript,https://github.com/postcss/postcss,postcss,14,2019-01-30T11:31:01Z,Transforming styles with JS plugins
93,JavaScript,gitbook,20121,2808,JavaScript,https://github.com/GitbookIO/gitbook,GitbookIO,991,2019-01-29T03:54:48Z,📝 Modern documentation format and toolchain using Git and Markdown
94,JavaScript,hammer.js,19636,2523,JavaScript,https://github.com/hammerjs/hammer.js,hammerjs,259,2018-06-07T10:29:26Z,A javascript library for multi-touch gestures :// You can touch this
95,JavaScript,RxJS,19542,2263,JavaScript,https://github.com/Reactive-Extensions/RxJS,Reactive-Extensions,288,2018-04-18T20:17:39Z,The Reactive Extensions for JavaScript
96,JavaScript,project-guidelines,19308,1814,JavaScript,https://github.com/elsewhencode/project-guidelines,elsewhencode,12,2018-10-29T10:58:22Z,A set of best practices for JavaScript projects
97,JavaScript,ace,19094,4256,JavaScript,https://github.com/ajaxorg/ace,ajaxorg,658,2019-01-28T21:31:35Z,Ace (Ajax.org Cloud9 Editor)
98,JavaScript,swiper,18895,6744,JavaScript,https://github.com/nolimits4web/swiper,nolimits4web,134,2019-02-01T14:56:58Z,Most modern mobile touch slider with hardware accelerated transitions
99,JavaScript,vuex,18791,6052,JavaScript,https://github.com/vuejs/vuex,vuejs,124,2019-01-31T13:55:18Z,🗃️ Centralized State Management for Vue.js.
100,JavaScript,vue-cli,18754,2995,JavaScript,https://github.com/vuejs/vue-cli,vuejs,293,2019-02-02T02:04:05Z,🛠️ Standard Tooling for Vue.js Development
1,Lua,kong,20059,2428,Lua,https://github.com/Kong/kong,Kong,292,2019-02-01T23:36:21Z,:gorilla: The Cloud-Native API Gateway & Service Mesh
2,Lua,neural-style,16520,2512,Lua,https://github.com/jcjohnson/neural-style,jcjohnson,310,2018-02-23T01:21:20Z,Torch implementation of neural style algorithm
3,Lua,waifu2x,13026,1493,Lua,https://github.com/nagadomi/waifu2x,nagadomi,75,2019-01-16T16:54:03Z,Image Super-Resolution for Anime-Style Art
4,Lua,openface,11505,2770,Lua,https://github.com/cmusatyalab/openface,cmusatyalab,11,2018-12-09T13:46:40Z,Face recognition with deep neural networks.
5,Lua,char-rnn,8995,2205,Lua,https://github.com/karpathy/char-rnn,karpathy,105,2018-05-04T15:25:25Z,"Multi-layer Recurrent Neural Networks (LSTM, GRU, RNN) for character-level language models in Torch"
6,Lua,CycleGAN,7873,1248,Lua,https://github.com/junyanz/CycleGAN,junyanz,26,2018-12-11T19:28:43Z,"Software that can generate photos from paintings,  turn horses into zebras,  perform style transfer, and more."
7,Lua,pix2pix,5742,931,Lua,https://github.com/phillipi/pix2pix,phillipi,42,2018-12-11T19:25:36Z,Image-to-image translation with conditional adversarial nets
8,Lua,dockercraft,5098,297,Lua,https://github.com/docker/dockercraft,docker,13,2018-06-18T12:15:21Z,Docker + Minecraft = Dockercraft
9,Lua,koreader,4572,610,Lua,https://github.com/koreader/koreader,koreader,364,2019-02-01T19:21:46Z,"An ebook reader application supporting PDF, DjVu, EPUB, FB2 and many more formats, running on Kindle, Kobo, PocketBook, Ubuntu Touch and Android devices"
10,Lua,VeryNginx,4517,697,Lua,https://github.com/alexazhou/VeryNginx,alexazhou,82,2019-02-01T11:43:45Z," A very powerful and friendly  nginx base on lua-nginx-module( openresty ) which provide WAF, Control Panel, and Dashboards. "
11,Lua,fairseq,3333,585,Lua,https://github.com/facebookresearch/fairseq,facebookresearch,8,2018-10-24T13:31:29Z,Facebook AI Research Sequence-to-Sequence Toolkit
12,Lua,lsyncd,3332,335,Lua,https://github.com/axkibe/lsyncd,axkibe,77,2018-12-05T21:42:23Z,Lsyncd (Live Syncing Daemon) synchronizes local directories with remote targets
13,Lua,DenseNet,3223,775,Lua,https://github.com/liuzhuang13/DenseNet,liuzhuang13,23,2018-04-25T23:37:39Z,"Densely Connected Convolutional Networks, In CVPR 2017 (Best Paper Award)."
