rank,item,repo_name,stars,forks,language,repo_url,username,issues,last_commit,description
62,Python,tqdm,9697,501,Python,https://github.com/tqdm/tqdm,tqdm,178,2019-03-21T14:05:56Z,"A fast, extensible progress bar for Python and CLI"
63,Python,zulip,9574,2985,Python,https://github.com/zulip/zulip,zulip,1326,2019-04-11T01:45:12Z,Zulip server - powerful open source team chat
64,Python,FastPhotoStyle,9488,894,Python,https://github.com/NVIDIA/FastPhotoStyle,NVIDIA,32,2019-04-05T18:41:46Z,"Style transfer, deep learning, feature transform"
65,Python,bokeh,9257,2484,Python,https://github.com/bokeh/bokeh,bokeh,385,2019-04-11T03:07:50Z,Interactive Web Plotting for Python
66,Python,autojump,9243,468,Python,https://github.com/wting/autojump,wting,145,2019-04-08T02:33:25Z,A cd command that learns - easily navigate directories from the command line
67,Python,cookiecutter,9242,1013,Python,https://github.com/audreyr/cookiecutter,audreyr,225,2019-04-09T15:43:40Z,"A command-line utility that creates projects from cookiecutters (project templates). E.g. Python package projects, jQuery plugin projects."
68,Python,neural-enhance,9093,969,Python,https://github.com/alexjc/neural-enhance,alexjc,118,2018-01-25T05:01:58Z,Super Resolution for images using deep learning.
69,Python,neural-doodle,9069,806,Python,https://github.com/alexjc/neural-doodle,alexjc,47,2016-12-28T15:58:48Z,"Turn your two-bit doodles into fine artworks with deep neural networks, generate seamless textures from photos, transfer style from one image to another, perform example-based upscaling, but wait... there's more! (An implementation of Semantic Style Transfer.)"
70,Python,kivy,9043,2044,Python,https://github.com/kivy/kivy,kivy,674,2019-04-10T22:18:17Z,"Open source UI framework written in Python, running on Windows, Linux, macOS, Android and iOS"
71,Python,matplotlib,9034,4087,Python,https://github.com/matplotlib/matplotlib,matplotlib,1455,2019-04-10T17:02:02Z,matplotlib: plotting with Python
72,Python,tflearn,9015,2271,Python,https://github.com/tflearn/tflearn,tflearn,551,2019-02-27T19:26:49Z,Deep learning library featuring a higher-level API for TensorFlow.
73,Python,gensim,8990,3320,Python,https://github.com/RaRe-Technologies/gensim,RaRe-Technologies,219,2019-04-09T20:02:09Z,Topic Modelling for Humans
74,Python,neural-networks-and-deep-learning,8949,4407,Python,https://github.com/mnielsen/neural-networks-and-deep-learning,mnielsen,4,2019-01-21T21:55:07Z,"Code samples for my book ""Neural Networks and Deep Learning"""
75,Python,Zappa,8938,969,Python,https://github.com/Miserlou/Zappa,Miserlou,529,2019-04-04T14:59:07Z,Serverless Python
76,Python,RocAlphaGo,8918,2479,Python,https://github.com/Rochester-NRT/RocAlphaGo,Rochester-NRT,30,2018-06-09T13:55:11Z,"An independent, student-led replication of DeepMind's 2016 Nature publication, ""Mastering the game of Go with deep neural networks and tree search"" (Nature 529, 484-489, 28 Jan 2016), details of which can be found on their website https://deepmind.com/publications.html."
77,Python,game-programmer,8709,1023,Python,https://github.com/miloyip/game-programmer,miloyip,15,2019-01-02T01:54:21Z,A Study Path for Game Programmer
78,Python,black,8673,432,Python,https://github.com/ambv/black,ambv,167,2019-03-28T01:15:46Z,The uncompromising Python code formatter
79,Python,inter,8666,161,Python,https://github.com/rsms/inter,rsms,17,2019-04-05T00:30:39Z,The Inter font family
80,Python,beets,8611,1500,Python,https://github.com/beetbox/beets,beetbox,645,2019-04-10T05:54:53Z,music library manager and MusicBrainz tagger
81,Python,stanford-tensorflow-tutorials,8389,3853,Python,https://github.com/chiphuyen/stanford-tensorflow-tutorials,chiphuyen,78,2019-03-02T17:44:57Z,This repository contains code examples for the Stanford's course: TensorFlow for Deep Learning Research. 
82,Python,examples,8302,3835,Python,https://github.com/pytorch/examples,pytorch,155,2019-04-10T15:02:54Z,"A set of examples around pytorch in Vision, Text, Reinforcement Learning, etc."
83,Python,ChatterBot,8089,2810,Python,https://github.com/gunthercox/ChatterBot,gunthercox,77,2019-04-10T14:18:03Z,"ChatterBot is a machine learning, conversational dialog engine for creating chat bots"
84,Python,prophet,8071,1881,Python,https://github.com/facebook/prophet,facebook,87,2019-04-04T10:42:50Z,Tool for producing high quality forecasts for time series data that has multiple seasonality with linear or non-linear growth.
85,Python,wxpy,8005,1443,Python,https://github.com/youfou/wxpy,youfou,250,2018-12-06T07:52:15Z,微信机器人 / 可能是最优雅的微信个人号 API ✨✨
86,Python,aws-cli,7864,1665,Python,https://github.com/aws/aws-cli,aws,541,2019-04-10T19:06:45Z,Universal Command Line Interface for Amazon Web Services
87,Python,pgcli,7799,349,Python,https://github.com/dbcli/pgcli,dbcli,117,2019-04-09T20:46:28Z,Postgres CLI with autocompletion and syntax highlighting
88,Python,Mailpile,7762,922,Python,https://github.com/mailpile/Mailpile,mailpile,384,2019-04-10T14:17:22Z,"A free & open modern, fast email client with user-friendly encryption and privacy features"
89,Python,fast-style-transfer,7717,1832,Python,https://github.com/lengstrom/fast-style-transfer,lengstrom,45,2019-04-08T23:50:42Z,TensorFlow CNN for fast style transfer ⚡🖥🎨🖼
90,Python,facenet,7705,3205,Python,https://github.com/davidsandberg/facenet,davidsandberg,367,2019-02-20T15:44:48Z,Face recognition using Tensorflow
91,Python,pytorch-CycleGAN-and-pix2pix,7638,1981,Python,https://github.com/junyanz/pytorch-CycleGAN-and-pix2pix,junyanz,89,2019-04-08T00:27:51Z,"Image-to-image translation in PyTorch (e.g., horse2zebra, edges2cats, and more)"
92,Python,nltk,7628,2096,Python,https://github.com/nltk/nltk,nltk,388,2019-04-04T19:13:16Z,NLTK Source
93,Python,DeepCreamPy,7617,764,Python,https://github.com/deeppomf/DeepCreamPy,deeppomf,6,2019-04-03T08:07:57Z,Decensoring Hentai with Deep Neural Networks
94,Python,InstaPy,7557,2022,Python,https://github.com/timgrossmann/InstaPy,timgrossmann,201,2019-04-09T20:53:08Z,📷 Instagram Bot - Tool for automated Instagram interactions
95,Python,chisel,7533,660,Python,https://github.com/facebook/chisel,facebook,31,2019-04-06T22:20:47Z,Chisel is a collection of LLDB commands to assist debugging iOS apps.
96,Python,sonnet,7467,1034,Python,https://github.com/deepmind/sonnet,deepmind,16,2019-04-03T13:34:59Z,TensorFlow-based neural network library
97,Python,awesome-python-applications,7451,1226,Python,https://github.com/mahmoud/awesome-python-applications,mahmoud,20,2019-04-06T06:48:52Z,"💿 Free software that works great, and also happens to be open-source Python. "
98,Python,d2l-zh,7441,2003,Python,https://github.com/d2l-ai/d2l-zh,d2l-ai,1,2019-04-10T18:27:07Z,《动手学深度学习》，英文版即伯克利深度学习（STAT 157，2019春）教材。面向中文读者、能运行、可讨论。
99,Python,tensor2tensor,7429,1883,Python,https://github.com/tensorflow/tensor2tensor,tensorflow,371,2019-04-11T00:31:56Z,Library of deep learning models and datasets designed to make deep learning more accessible and accelerate ML research.
100,Python,jupyter,7424,1708,Python,https://github.com/jupyter/jupyter,jupyter,137,2019-04-10T20:17:08Z,"Jupyter metapackage for installation, docs and chat"
1,R,ggplot2,3714,1395,R,https://github.com/tidyverse/ggplot2,tidyverse,190,2019-04-11T01:23:23Z,An implementation of the Grammar of Graphics in R
2,R,ML_for_Hackers,3475,2221,R,https://github.com/johnmyleswhite/ML_for_Hackers,johnmyleswhite,33,2017-10-18T01:53:18Z,"Code accompanying the book ""Machine Learning for Hackers"""
3,R,awesome-R,3431,1156,R,https://github.com/qinwf/awesome-R,qinwf,26,2019-04-08T09:59:13Z,"A curated list of awesome R packages, frameworks and software."
4,R,shiny,3343,1475,R,https://github.com/rstudio/shiny,rstudio,454,2019-04-11T03:09:05Z,Easy interactive web applications with R
5,R,dplyr,2880,1057,R,https://github.com/tidyverse/dplyr,tidyverse,128,2019-04-10T12:46:11Z,dplyr: A grammar of data manipulation
6,R,swirl_courses,2879,6125,R,https://github.com/swirldev/swirl_courses,swirldev,125,2019-03-16T20:03:11Z,:mortar_board: A collection of interactive courses for the swirl R package.
7,R,AnomalyDetection,2878,654,R,https://github.com/twitter/AnomalyDetection,twitter,66,2019-03-01T02:37:44Z,Anomaly Detection with R
8,R,r4ds,1848,2272,R,https://github.com/hadley/r4ds,hadley,87,2019-04-04T21:29:19Z,R for data science
9,R,devtools,1792,638,R,https://github.com/r-lib/devtools,r-lib,47,2019-04-10T13:24:47Z,Tools to make an R developer's life easier
10,R,knitr,1758,731,R,https://github.com/yihui/knitr,yihui,61,2019-04-08T00:06:28Z,A general-purpose tool for dynamic report generation in R
11,R,investing,1687,104,R,https://github.com/zonination/investing,zonination,0,2016-12-27T13:58:02Z,Investing Returns on the Market as a Whole
12,R,benchm-ml,1630,303,R,https://github.com/szilard/benchm-ml,szilard,10,2018-09-15T18:57:25Z,"A minimal benchmark for scalability, speed and accuracy of commonly used open source implementations (R packages, Python scikit-learn, H2O, xgboost, Spark MLlib etc.) of the top machine learning algorithms for binary classification (random forests, gradient boosted trees, deep neural networks etc.)."
13,R,stats337,1519,231,R,https://github.com/hadley/stats337,hadley,7,2018-06-21T15:57:29Z,Readings in applied data science
14,R,plotly,1482,520,R,https://github.com/ropensci/plotly,ropensci,253,2019-04-10T19:47:05Z,An interactive graphing library for R
15,R,nyc-taxi-data,1476,455,R,https://github.com/toddwschneider/nyc-taxi-data,toddwschneider,0,2019-04-08T10:56:34Z,"Import public NYC taxi and for-hire vehicle (Uber, Lyft, etc.) trip data into PostgreSQL database"
16,R,rmarkdown,1467,635,R,https://github.com/rstudio/rmarkdown,rstudio,99,2019-04-09T22:35:03Z,Dynamic Documents for R
17,R,awesome-network-analysis,1389,293,R,https://github.com/briatte/awesome-network-analysis,briatte,14,2019-03-12T05:34:18Z,A curated list of awesome network analysis resources.
18,R,bookdown,1383,618,R,https://github.com/rstudio/bookdown,rstudio,86,2019-04-04T12:07:52Z,Authoring Books and Technical Documents with R Markdown
19,R,DataScienceR,1281,694,R,https://github.com/ujjwalkarn/DataScienceR,ujjwalkarn,3,2018-04-18T00:01:52Z,"a curated list of R tutorials for Data Science, NLP and Machine Learning "
20,R,mlr,1211,335,R,https://github.com/mlr-org/mlr,mlr-org,453,2019-04-10T21:39:05Z,mlr: Machine Learning in R 
21,R,gganimate,1189,205,R,https://github.com/thomasp85/gganimate,thomasp85,63,2019-04-04T13:10:30Z,A Grammar of Animated Graphics
22,R,DiagrammeR,1153,176,R,https://github.com/rich-iannone/DiagrammeR,rich-iannone,93,2019-03-13T05:56:31Z,Graph and network visualization using tabular data in R
23,R,tensorflow,1126,307,R,https://github.com/rstudio/tensorflow,rstudio,5,2019-04-05T13:52:11Z,TensorFlow for R
24,R,rvest,1049,267,R,https://github.com/tidyverse/rvest,tidyverse,25,2019-03-30T18:04:38Z,Simple web scraping for R
25,R,caret,1041,500,R,https://github.com/topepo/caret,topepo,132,2019-04-03T17:58:20Z,caret (Classification And Regression Training) R package that contains misc functions for training and plotting classification and regression models
26,R,patchwork,1017,76,R,https://github.com/thomasp85/patchwork,thomasp85,32,2019-04-01T11:22:01Z,The Composer of ggplots
27,R,labs,998,1427,R,https://github.com/genomicsclass/labs,genomicsclass,15,2018-10-29T20:05:09Z,Rmd source files for the HarvardX series PH525x
28,R,ggthemes,969,192,R,https://github.com/jrnold/ggthemes,jrnold,2,2019-04-09T15:02:25Z,"Additional themes, scales, and geoms for ggplot2"
29,R,blogdown,931,207,R,https://github.com/rstudio/blogdown,rstudio,8,2019-03-19T21:43:48Z,Create Blogs and Websites with R Markdown
30,R,CausalImpact,921,156,R,https://github.com/google/CausalImpact,google,16,2018-03-28T14:22:21Z,An R package for causal inference in time series
31,R,wesanderson,919,75,R,https://github.com/karthik/wesanderson,karthik,10,2019-02-01T23:29:59Z,A Wes Anderson color palette for R
32,R,reticulate,864,150,R,https://github.com/rstudio/reticulate,rstudio,173,2019-04-09T20:19:49Z,R Interface to Python
33,R,plumber,852,151,R,https://github.com/trestletech/plumber,trestletech,97,2019-04-02T16:17:53Z,Turn your R code into a web API.
34,R,broom,842,232,R,https://github.com/tidymodels/broom,tidymodels,129,2019-04-11T04:01:03Z,Convert statistical analysis objects from R into tidy format
35,R,swirl,809,541,R,https://github.com/swirldev/swirl,swirldev,171,2018-10-11T16:05:05Z,":cyclone: Learn R, in R."
36,R,slidify,806,349,R,https://github.com/ramnathv/slidify,ramnathv,180,2016-08-02T03:54:45Z,Generate reproducible html5 slides from R markdown
37,R,tofsims,801,5,R,https://github.com/fossasia/tofsims,fossasia,0,2017-11-29T19:16:12Z,
38,R,httr,779,1835,R,https://github.com/r-lib/httr,r-lib,19,2019-04-10T15:23:38Z,httr: a friendly http package for R
39,R,drake,762,75,R,https://github.com/ropensci/drake,ropensci,11,2019-04-10T01:46:38Z,An R-focused pipeline toolkit for reproducibility and high-performance computing
40,R,bbplot,760,113,R,https://github.com/bbc/bbplot,bbc,11,2019-03-19T02:15:52Z,R package that helps create and export ggplot2 charts in the style used by the BBC News data team
41,R,purrr,755,175,R,https://github.com/tidyverse/purrr,tidyverse,62,2019-04-01T17:21:25Z,A functional programming toolkit for R
42,R,rethinking,752,234,R,https://github.com/rmcelreath/rethinking,rmcelreath,88,2019-04-09T13:02:38Z,Statistical Rethinking course and book package
43,R,gt,749,52,R,https://github.com/rstudio/gt,rstudio,108,2019-04-11T03:54:26Z,"Easily generate information-rich, publication-quality tables from R"
44,R,tidytext,745,149,R,https://github.com/juliasilge/tidytext,juliasilge,9,2019-02-11T21:12:40Z,"Text mining using dplyr, ggplot2, and other tidy tools :sparkles::page_facing_up::sparkles::page_facing_up::sparkles:"
45,R,tidyr,721,287,R,https://github.com/tidyverse/tidyr,tidyverse,23,2019-04-05T15:58:09Z,Easily tidy data with spread and gather functions.
46,R,forecast,710,249,R,https://github.com/robjhyndman/forecast,robjhyndman,9,2019-04-10T00:54:51Z,forecast package for R
47,R,readr,688,208,R,https://github.com/tidyverse/readr,tidyverse,80,2019-02-21T15:54:12Z,"Read flat files (csv, tsv, fwf) into R"
48,R,googlesheets,685,170,R,https://github.com/jennybc/googlesheets,jennybc,87,2018-06-29T17:30:23Z,Google Spreadsheets R API
49,R,advanced-shiny,682,257,R,https://github.com/daattali/advanced-shiny,daattali,1,2019-02-27T14:50:39Z,Shiny tips & tricks for improving your apps and solving common problems
50,R,magrittr,682,126,R,https://github.com/tidyverse/magrittr,tidyverse,24,2019-01-05T16:37:00Z,Improve the readability of R code with the pipe
51,R,tidytuesday,681,346,R,https://github.com/rfordatascience/tidytuesday,rfordatascience,28,2019-04-08T13:02:07Z,Official repo for the #tidytuesday project
52,R,tidyverse,672,139,R,https://github.com/tidyverse/tidyverse,tidyverse,17,2019-04-11T01:12:35Z,Easily install and load packages from the tidyverse
53,R,rnaseq_tutorial,663,372,R,https://github.com/griffithlab/rnaseq_tutorial,griffithlab,10,2018-11-01T19:59:51Z,"Informatics for RNA-seq: A web resource for analysis on the cloud. Educational tutorials and working pipelines for RNA-seq analysis including an introduction to: cloud computing, critical file formats, reference genomes, gene annotation, expression, differential expression, alternative splicing, data visualization, and interpretation."
54,R,ggvis,655,180,R,https://github.com/rstudio/ggvis,rstudio,192,2018-10-01T16:22:08Z,Interactive grammar of graphics for R
55,R,MLPB,651,248,R,https://github.com/ben519/MLPB,ben519,0,2017-12-15T20:25:45Z,Machine Learning Problem Bible | Problem Set Here >>
56,R,SparkR-pkg,650,347,R,https://github.com/amplab-extras/SparkR-pkg,amplab-extras,21,2016-06-10T21:42:55Z,R frontend for Spark
57,R,sparklyr,631,233,R,https://github.com/rstudio/sparklyr,rstudio,381,2019-04-06T00:57:33Z,R interface for Apache Spark
58,R,BanditsBook,625,218,R,https://github.com/johnmyleswhite/BanditsBook,johnmyleswhite,6,2018-04-05T06:34:29Z,Code for my book on Multi-Armed Bandit Algorithms
59,R,ggraph,620,71,R,https://github.com/thomasp85/ggraph,thomasp85,62,2019-03-07T01:43:09Z,Grammar of Graph Graphics
60,R,htmlwidgets,612,176,R,https://github.com/ramnathv/htmlwidgets,ramnathv,104,2019-04-10T22:04:45Z,HTML Widgets for R
61,R,janitor,609,67,R,https://github.com/sfirke/janitor,sfirke,51,2019-03-15T15:50:37Z,simple tools for data cleaning in R
62,R,ggrepel,606,72,R,https://github.com/slowkow/ggrepel,slowkow,22,2019-03-06T06:09:02Z,:round_pushpin: Repel overlapping text labels away from each other.
63,R,esquisse,601,60,R,https://github.com/dreamRs/esquisse,dreamRs,18,2019-03-04T21:49:51Z,RStudio add-in to make plots with ggplot2
64,R,perceptions,598,75,R,https://github.com/zonination/perceptions,zonination,0,2017-08-25T14:34:20Z,Perceptions of Probability and Numbers
65,R,rayshader,593,42,R,https://github.com/tylermorganwall/rayshader,tylermorganwall,8,2019-04-06T03:39:22Z,"R Package for Producing and Visualizing Hillshaded Maps from Elevation Matrices, in 2D and 3D"
66,R,ProgrammingAssignment2,592,116140,R,https://github.com/rdpeng/ProgrammingAssignment2,rdpeng,2716,2019-04-10T16:20:01Z,Repository for Programming Assignment 2 for R Programming on Coursera
67,R,r-source,586,190,R,https://github.com/wch/r-source,wch,0,2019-04-11T00:06:02Z,"Read-only mirror of R source code from https://svn.r-project.org/R/, updated hourly. See the build instructions on the wiki page."
68,R,text2vec,586,100,R,https://github.com/dselivanov/text2vec,dselivanov,28,2019-02-25T17:27:57Z,"Fast vectorization, topic modeling, distances and GloVe word embeddings in R."
69,R,testthat,586,242,R,https://github.com/r-lib/testthat,r-lib,20,2019-04-04T18:30:14Z,An R 📦 to make testing 😀
70,R,rappor,581,111,R,https://github.com/google/rappor,google,34,2019-01-10T13:19:15Z,RAPPOR: Privacy-Preserving Reporting Algorithms
71,R,lintr,559,100,R,https://github.com/jimhester/lintr,jimhester,130,2019-02-14T10:16:25Z,Static Code Analysis for R
72,R,RStartHere,555,198,R,https://github.com/rstudio/RStartHere,rstudio,6,2018-04-02T18:39:27Z,A guide to some of the most useful R Packages that we know about
73,R,rstan,543,179,R,https://github.com/stan-dev/rstan,stan-dev,141,2019-04-11T01:01:58Z,"RStan, the R interface to Stan"
74,R,ProjectTemplate,540,154,R,https://github.com/KentonWhite/ProjectTemplate,KentonWhite,18,2019-04-10T13:17:18Z,A template utility for R projects that provides a skeletal project.
75,R,keras,530,186,R,https://github.com/rstudio/keras,rstudio,11,2019-04-10T17:55:20Z,R Interface to Keras
76,R,asdfree,519,440,R,https://github.com/ajdamico/asdfree,ajdamico,90,2019-01-26T13:39:07Z,analyze survey data for free
77,R,hrbrthemes,515,55,R,https://github.com/hrbrmstr/hrbrthemes,hrbrmstr,15,2019-04-09T12:46:39Z,":lock_with_ink_pen: Opinionated, typographic-centric ggplot2 themes and theme components"
78,R,ggthemr,513,74,R,https://github.com/cttobin/ggthemr,cttobin,1,2019-02-18T16:57:33Z,Themes for ggplot2.
79,R,ggmap,510,204,R,https://github.com/dkahle/ggmap,dkahle,74,2019-03-07T19:30:48Z,A package for plotting maps in R with ggplot2
80,R,sf,498,123,R,https://github.com/r-spatial/sf,r-spatial,19,2019-04-09T12:07:12Z,Simple Features for R
81,R,opencpu,496,92,R,https://github.com/opencpu/opencpu,opencpu,79,2019-03-26T10:25:37Z,OpenCPU system for embedded scientific computation and reproducible research
82,R,brms,491,67,R,https://github.com/paul-buerkner/brms,paul-buerkner,38,2019-04-10T06:27:57Z,brms R package for Bayesian generalized multivariate non-linear multilevel models using Stan
83,R,quanteda,486,116,R,https://github.com/quanteda/quanteda,quanteda,104,2019-04-10T23:42:22Z,An R package for the Quantitative Analysis of Textual Data
84,R,networkD3,479,231,R,https://github.com/christophergandrud/networkD3,christophergandrud,69,2018-04-11T11:04:51Z,D3 JavaScript Network Graphs from R
85,R,future,477,40,R,https://github.com/HenrikBengtsson/future,HenrikBengtsson,61,2019-04-11T02:09:20Z,:rocket: R package: future: Unified Parallel and Distributed Processing in R for Everyone
86,R,plyr,474,121,R,https://github.com/hadley/plyr,hadley,28,2019-03-27T03:48:53Z,"A R package for splitting, applying and combining large problems into simpler problems"
87,R,datapasta,472,37,R,https://github.com/MilesMcBain/datapasta,MilesMcBain,18,2019-03-03T04:07:03Z,"On top of spaghetti, all covered in cheese...."
88,R,formattable,465,65,R,https://github.com/renkun-ken/formattable,renkun-ken,44,2019-04-02T14:42:50Z,Formattable Data Structures
89,R,ballr,461,96,R,https://github.com/toddwschneider/ballr,toddwschneider,1,2019-02-18T14:29:11Z,Interactive NBA and NCAA Shot Charts with R and Shiny
90,R,addinslist,455,94,R,https://github.com/daattali/addinslist,daattali,2,2019-04-07T20:35:14Z,Discover and install useful RStudio addins 
91,R,ggstatsplot,450,49,R,https://github.com/IndrajeetPatil/ggstatsplot,IndrajeetPatil,15,2019-04-11T02:27:22Z,Collection of functions to enhance ggplot2 plots with results from statistical tests.
92,R,renjin,437,73,R,https://github.com/bedatadriven/renjin,bedatadriven,64,2019-03-30T17:24:43Z,JVM-based interpreter for the R language for the statistical analysis.
93,R,engsoccerdata,437,125,R,https://github.com/jalapic/engsoccerdata,jalapic,14,2019-02-20T21:50:02Z,English and European soccer results 1871-2017
94,R,shinyjs,423,91,R,https://github.com/daattali/shinyjs,daattali,11,2019-03-15T05:50:09Z,Easily improve the user experience of your Shiny apps in seconds
95,R,mindr,422,36,R,https://github.com/pzhaonet/mindr,pzhaonet,1,2019-02-28T10:33:36Z,"an R package which converts markdown files (.md, .Rmd) into mindmaps (brainstorms)"
96,R,highcharter,421,89,R,https://github.com/jbkunst/highcharter,jbkunst,139,2019-03-28T00:31:05Z,R wrapper for highcharts based on htmlwidgets 
97,R,ggalt,420,61,R,https://github.com/hrbrmstr/ggalt,hrbrmstr,27,2019-03-22T14:15:10Z,":earth_americas: Extra Coordinate Systems, Geoms,  Statistical Transformations & Scales for 'ggplot2'"
98,R,lubridate,419,148,R,https://github.com/tidyverse/lubridate,tidyverse,72,2019-03-10T12:32:25Z,Make working with dates in R just that little bit easier
99,R,waffle,418,58,R,https://github.com/hrbrmstr/waffle,hrbrmstr,29,2019-01-10T13:05:16Z,:maple_leaf: Make waffle (square pie) charts in R
100,R,ESL-CN,408,112,R,https://github.com/szcf-weiya/ESL-CN,szcf-weiya,88,2019-04-09T15:39:43Z,The Elements of Statistical Learning (ESL)的中文翻译、代码实现及其习题解答。
1,Ruby,rails,42761,17228,Ruby,https://github.com/rails/rails,rails,1141,2019-04-11T01:42:54Z,Ruby on Rails
2,Ruby,jekyll,37352,8130,Ruby,https://github.com/jekyll/jekyll,jekyll,138,2019-04-11T02:34:39Z,:globe_with_meridians: Jekyll is a blog-aware static site generator in Ruby
3,Ruby,discourse,27929,6379,Ruby,https://github.com/discourse/discourse,discourse,15,2019-04-11T04:01:48Z,"A platform for community discussion. Free, open, simple."
4,Ruby,fastlane,25082,3828,Ruby,https://github.com/fastlane/fastlane,fastlane,240,2019-04-11T03:57:57Z,🚀 The easiest way to automate building and releasing your iOS and Android apps
5,Ruby,awesome-awesomeness,23990,3010,Ruby,https://github.com/bayandin/awesome-awesomeness,bayandin,6,2019-04-07T14:59:53Z,A curated list of awesome awesomeness
6,Ruby,gitlabhq,21699,5526,Ruby,https://github.com/gitlabhq/gitlabhq,gitlabhq,31,2019-04-11T03:47:11Z,GitLab CE Mirror | Please open new issues in our issue tracker on GitLab.com
7,Ruby,huginn,21018,2285,Ruby,https://github.com/huginn/huginn,huginn,360,2019-04-10T00:15:52Z,Create agents that monitor and act on your behalf.  Your agents are standing by!
8,Ruby,devdocs,20292,1312,Ruby,https://github.com/freeCodeCamp/devdocs,freeCodeCamp,112,2019-04-06T13:22:02Z,API Documentation Browser
9,Ruby,devise,19749,4653,Ruby,https://github.com/plataformatec/devise,plataformatec,29,2019-04-05T13:03:38Z,Flexible authentication solution for Rails with Warden.
10,Ruby,vagrant,18240,3685,Ruby,https://github.com/hashicorp/vagrant,hashicorp,398,2019-04-09T23:57:02Z,Vagrant is a tool for building and distributing development environments.
11,Ruby,mastodon,17309,3030,Ruby,https://github.com/tootsuite/mastodon,tootsuite,1171,2019-04-10T22:03:13Z,"Your self-hosted, globally interconnected microblogging community"
12,Ruby,brew,17114,3800,Ruby,https://github.com/Homebrew/brew,Homebrew,18,2019-04-10T20:51:26Z,🍺 The missing package manager for macOS (or Linux)
13,Ruby,metasploit-framework,15935,7973,Ruby,https://github.com/rapid7/metasploit-framework,rapid7,658,2019-04-10T22:31:59Z,Metasploit Framework
14,Ruby,ruby,15534,4136,Ruby,https://github.com/ruby/ruby,ruby,197,2019-04-11T03:49:44Z,The Ruby Programming Language [mirror]
15,Ruby,engineering-blogs,15113,1746,Ruby,https://github.com/kilimchoi/engineering-blogs,kilimchoi,24,2019-04-08T04:03:01Z,A curated list of engineering blogs
16,Ruby,homebrew-cask,15076,7111,Ruby,https://github.com/Homebrew/homebrew-cask,Homebrew,31,2019-04-11T03:39:14Z,🍻 A CLI workflow for the administration of macOS applications distributed as binaries
17,Ruby,bootstrap-sass,12757,3512,Ruby,https://github.com/twbs/bootstrap-sass,twbs,2,2019-04-08T19:58:45Z,Official Sass port of Bootstrap 2 and 3.
18,Ruby,diaspora,12197,2908,Ruby,https://github.com/diaspora/diaspora,diaspora,445,2019-03-30T14:06:48Z,"A privacy-aware, distributed, open source social network."
19,Ruby,CocoaPods,11467,2051,Ruby,https://github.com/CocoaPods/CocoaPods,CocoaPods,204,2019-04-11T00:41:55Z,The Cocoa Dependency Manager.
20,Ruby,capistrano,10962,1705,Ruby,https://github.com/capistrano/capistrano,capistrano,43,2019-02-18T19:43:08Z,Remote multi-server automation tool
