rank,item,repo_name,stars,forks,language,repo_url,username,issues,last_commit,description
1,top-100-stars,freeCodeCamp,309092,23769,JavaScript,https://github.com/freeCodeCamp/freeCodeCamp,freeCodeCamp,243,2020-03-10T10:43:43Z,freeCodeCamp.org's open source codebase and curriculum. Learn to code for free together with millions of people.
2,top-100-stars,996.ICU,249171,21204,Rust,https://github.com/996icu/996.ICU,996icu,16760,2020-03-09T15:42:49Z,Repo for counting stars and contributing. Press F to pay respect to glorious developers.
3,top-100-stars,vue,158962,23955,JavaScript,https://github.com/vuejs/vue,vuejs,462,2020-03-10T08:54:38Z,"🖖 Vue.js is a progressive, incrementally-adoptable JavaScript framework for building UI on the web."
4,top-100-stars,react,145022,27896,JavaScript,https://github.com/facebook/react,facebook,562,2020-03-10T10:46:13Z,"A declarative, efficient, and flexible JavaScript library for building user interfaces."
5,top-100-stars,tensorflow,141821,80254,C++,https://github.com/tensorflow/tensorflow,tensorflow,3437,2020-03-10T10:53:19Z,An Open Source Machine Learning Framework for Everyone
6,top-100-stars,bootstrap,139116,68342,JavaScript,https://github.com/twbs/bootstrap,twbs,416,2020-03-09T20:51:38Z,"The most popular HTML, CSS, and JavaScript framework for developing responsive, mobile first projects on the web."
7,top-100-stars,free-programming-books,138308,34146,,https://github.com/EbookFoundation/free-programming-books,EbookFoundation,37,2020-03-07T12:29:04Z,:books: Freely available programming books
8,top-100-stars,awesome,127912,17061,,https://github.com/sindresorhus/awesome,sindresorhus,31,2020-03-09T13:43:46Z,😎 Awesome lists about all kinds of interesting topics
9,top-100-stars,You-Dont-Know-JS,118708,23794,,https://github.com/getify/You-Dont-Know-JS,getify,109,2020-03-08T16:09:05Z,A book series on JavaScript. @YDKJS on twitter.
10,top-100-stars,ohmyzsh,104760,18948,Shell,https://github.com/ohmyzsh/ohmyzsh,ohmyzsh,681,2020-03-10T04:31:22Z,"🙃 A delightful community-driven (with 1500+ contributors) framework for managing your zsh configuration. Includes 200+ optional plugins (rails, git, OSX, hub, capistrano, brew, ant, php, python, etc), over 140 themes to spice up your morning, and an auto-update tool so that makes it easy to keep up with the latest updates from the community."
11,top-100-stars,coding-interview-university,100883,29634,,https://github.com/jwasham/coding-interview-university,jwasham,48,2020-03-06T04:57:37Z,A complete computer science study plan to become a software engineer.
12,top-100-stars,developer-roadmap,97197,15681,,https://github.com/kamranahmedse/developer-roadmap,kamranahmedse,11,2020-03-09T03:09:18Z,Roadmap to becoming a web developer in 2020
13,top-100-stars,gitignore,96227,50782,,https://github.com/github/gitignore,github,131,2020-03-10T05:53:37Z,A collection of useful .gitignore templates
14,top-100-stars,javascript,93542,18213,JavaScript,https://github.com/airbnb/javascript,airbnb,115,2020-03-10T06:30:44Z,JavaScript Style Guide
15,top-100-stars,CS-Notes,93530,30316,Java,https://github.com/CyC2018/CS-Notes,CyC2018,20,2020-03-08T02:21:49Z,:books: 技术面试必备基础知识、Leetcode、计算机操作系统、计算机网络、系统设计、Java、Python、C++
16,top-100-stars,vscode,92615,14221,TypeScript,https://github.com/microsoft/vscode,microsoft,4778,2020-03-10T10:53:53Z,Visual Studio Code
17,top-100-stars,d3,90304,21857,JavaScript,https://github.com/d3/d3,d3,4,2020-02-04T07:50:27Z,"Bring data to life with SVG, Canvas and HTML. :bar_chart::chart_with_upwards_trend::tada:"
18,top-100-stars,flutter,88054,11597,Dart,https://github.com/flutter/flutter,flutter,7479,2020-03-10T10:26:38Z,Flutter makes it easy and fast to build beautiful mobile apps.
19,top-100-stars,linux,87822,30658,C,https://github.com/torvalds/linux,torvalds,329,2020-03-09T23:20:57Z,Linux kernel source tree
20,top-100-stars,react-native,85419,19067,JavaScript,https://github.com/facebook/react-native,facebook,752,2020-03-10T09:19:10Z,A framework for building native apps with React.
21,top-100-stars,system-design-primer,84742,14373,Python,https://github.com/donnemartin/system-design-primer,donnemartin,140,2020-03-10T09:20:46Z,Learn how to design large-scale systems. Prep for the system design interview.  Includes Anki flashcards.
22,top-100-stars,electron,81212,10882,C++,https://github.com/electron/electron,electron,1187,2020-03-10T10:53:52Z,":electron: Build cross-platform desktop apps with JavaScript, HTML, and CSS"
23,top-100-stars,awesome-python,80073,15769,Python,https://github.com/vinta/awesome-python,vinta,57,2020-03-09T00:44:30Z,"A curated list of awesome Python frameworks, libraries, software and resources"
24,top-100-stars,Python-100-Days,79802,31895,Jupyter Notebook,https://github.com/jackfrued/Python-100-Days,jackfrued,327,2020-03-09T13:28:15Z,Python - 100天从新手到大师
25,top-100-stars,create-react-app,76711,18373,JavaScript,https://github.com/facebook/create-react-app,facebook,545,2020-03-09T17:20:43Z,Set up a modern web app by running one command.
26,top-100-stars,public-apis,71705,8192,Python,https://github.com/public-apis/public-apis,public-apis,87,2020-03-09T19:44:27Z,A collective list of free APIs for use in software and web development.
27,top-100-stars,JavaGuide,70992,24338,Java,https://github.com/Snailclimb/JavaGuide,Snailclimb,27,2020-03-10T09:24:33Z,【Java学习+面试指南】 一份涵盖大部分Java程序员所需要掌握的核心知识。
28,top-100-stars,axios,70421,6276,JavaScript,https://github.com/axios/axios,axios,365,2020-03-10T08:28:09Z,Promise based HTTP client for the browser and node.js
29,top-100-stars,go,69792,9949,Go,https://github.com/golang/go,golang,5609,2020-03-10T08:20:10Z,The Go programming language
30,top-100-stars,the-art-of-command-line,69630,7927,,https://github.com/jlevy/the-art-of-command-line,jlevy,170,2020-03-01T22:39:14Z,"Master the command line, in one page"
31,top-100-stars,node,68185,16362,JavaScript,https://github.com/nodejs/node,nodejs,1238,2020-03-10T10:03:45Z,Node.js JavaScript runtime :sparkles::turtle::rocket::sparkles:
32,top-100-stars,Python,67889,20536,Python,https://github.com/TheAlgorithms/Python,TheAlgorithms,31,2020-03-10T08:21:50Z,All Algorithms implemented in Python
33,top-100-stars,animate.css,65222,13955,CSS,https://github.com/daneden/animate.css,daneden,33,2020-03-07T14:31:53Z,🍿 A cross-browser library of CSS animations. As easy to use as an easy thing.
34,top-100-stars,free-programming-books-zh_CN,63983,19844,,https://github.com/justjavac/free-programming-books-zh_CN,justjavac,136,2020-02-16T03:26:38Z,:books: 免费的计算机编程类中文书籍，欢迎投稿
35,top-100-stars,kubernetes,63928,22733,Go,https://github.com/kubernetes/kubernetes,kubernetes,3011,2020-03-10T10:29:39Z,Production-Grade Container Scheduling and Management
36,top-100-stars,javascript-algorithms,63072,10318,JavaScript,https://github.com/trekhleb/javascript-algorithms,trekhleb,177,2020-03-07T03:41:45Z,📝 Algorithms and data structures implemented in JavaScript with explanations and links to further readings
37,top-100-stars,youtube-dl,62660,10864,Python,https://github.com/ytdl-org/youtube-dl,ytdl-org,3219,2020-03-10T08:35:39Z,Command-line program to download videos from YouTube.com and other video sites
38,top-100-stars,Font-Awesome,62269,10565,JavaScript,https://github.com/FortAwesome/Font-Awesome,FortAwesome,5179,2020-02-25T13:40:38Z,"The iconic SVG, font, and CSS toolkit"
39,top-100-stars,models,62199,39736,Python,https://github.com/tensorflow/models,tensorflow,1308,2020-03-10T04:24:09Z,Models and examples built with TensorFlow
40,top-100-stars,build-your-own-x,60917,4408,,https://github.com/danistefanovic/build-your-own-x,danistefanovic,68,2020-03-08T09:20:28Z,🤓 Build your own (insert technology here)
41,top-100-stars,angular.js,59639,28789,JavaScript,https://github.com/angular/angular.js,angular,466,2020-03-10T08:14:06Z,AngularJS - HTML enhanced for web apps!
42,top-100-stars,puppeteer,59200,5957,JavaScript,https://github.com/puppeteer/puppeteer,puppeteer,888,2020-03-06T22:24:48Z,Headless Chrome Node.js API
43,top-100-stars,three.js,58902,22638,JavaScript,https://github.com/mrdoob/three.js,mrdoob,595,2020-03-10T10:14:39Z,JavaScript 3D library.
44,top-100-stars,angular,58706,16082,TypeScript,https://github.com/angular/angular,angular,3444,2020-03-10T10:49:51Z,One framework. Mobile & desktop.
45,top-100-stars,TypeScript,58574,7934,TypeScript,https://github.com/microsoft/TypeScript,microsoft,4431,2020-03-10T10:42:50Z,TypeScript is a superset of JavaScript that compiles to clean JavaScript output.
46,top-100-stars,terminal,58513,5624,C++,https://github.com/microsoft/terminal,microsoft,898,2020-03-10T06:22:25Z,"The new Windows Terminal and the original Windows console host, all in the same place!"
47,top-100-stars,laravel,58032,18032,PHP,https://github.com/laravel/laravel,laravel,27,2020-03-09T03:19:45Z,A PHP framework for web artisans
48,top-100-stars,ant-design,57514,20718,TypeScript,https://github.com/ant-design/ant-design,ant-design,482,2020-03-10T10:39:13Z,🌈 A UI Design Language and React UI library
49,top-100-stars,moby,56556,16317,Go,https://github.com/moby/moby,moby,3732,2020-03-10T10:53:51Z,Moby Project - a collaborative project for the container ecosystem to assemble container-based systems
50,top-100-stars,computer-science,55970,8225,,https://github.com/ossu/computer-science,ossu,4,2020-03-06T09:08:27Z,:mortar_board: Path to a free self-taught education in Computer Science!
51,top-100-stars,java-design-patterns,55893,17999,Java,https://github.com/iluwatar/java-design-patterns,iluwatar,173,2020-03-07T12:26:38Z,Design patterns implemented in Java
52,top-100-stars,material-ui,55296,14791,JavaScript,https://github.com/mui-org/material-ui,mui-org,376,2020-03-10T09:51:03Z,"React components for faster and easier web development. Build your own design system, or start with Material Design."
53,top-100-stars,30-seconds-of-code,55031,6158,JavaScript,https://github.com/30-seconds/30-seconds-of-code,30-seconds,10,2020-03-10T08:44:47Z,Short JavaScript code snippets for all your development needs
54,top-100-stars,webpack,53207,6847,JavaScript,https://github.com/webpack/webpack,webpack,464,2020-03-10T09:40:52Z,"A bundler for javascript and friends. Packs many modules into a few bundled assets. Code Splitting allows for loading parts of the application on demand. Through ""loaders"", modules can be CommonJs, AMD, ES6 modules, CSS, Images, JSON, Coffeescript, LESS, ... and your custom stuff."
55,top-100-stars,jquery,53029,19116,JavaScript,https://github.com/jquery/jquery,jquery,85,2020-03-02T22:41:36Z,jQuery JavaScript Library
56,top-100-stars,awesome-go,52529,6956,Go,https://github.com/avelino/awesome-go,avelino,41,2020-03-09T17:41:56Z,"A curated list of awesome Go frameworks, libraries and software"
57,top-100-stars,awesome-vue,52522,7411,,https://github.com/vuejs/awesome-vue,vuejs,324,2020-03-10T08:47:26Z,🎉 A curated list of awesome things related to Vue.js
58,top-100-stars,thefuck,52473,2634,Python,https://github.com/nvbn/thefuck,nvbn,218,2020-03-05T02:21:27Z,Magnificent app which corrects your previous console command.
59,top-100-stars,redux,52467,13815,TypeScript,https://github.com/reduxjs/redux,reduxjs,40,2020-03-10T04:53:27Z,Predictable state container for JavaScript apps
60,top-100-stars,atom,51333,14176,JavaScript,https://github.com/atom/atom,atom,626,2020-03-10T06:57:24Z,:atom: The hackable text editor
61,top-100-stars,swift,50817,8230,C++,https://github.com/apple/swift,apple,434,2020-03-10T10:50:56Z,The Swift Programming Language
62,top-100-stars,LeetCodeAnimation,50754,9190,Java,https://github.com/MisterBooo/LeetCodeAnimation,MisterBooo,2,2020-03-03T12:09:53Z,Demonstrate all the questions on LeetCode in the form of animation.（用动画的形式呈现解LeetCode题目的思路）
63,top-100-stars,reveal.js,50632,14658,JavaScript,https://github.com/hakimel/reveal.js,hakimel,534,2020-03-10T09:42:28Z,The HTML Presentation Framework
64,top-100-stars,vue-element-admin,50403,17324,Vue,https://github.com/PanJiaChen/vue-element-admin,PanJiaChen,616,2020-03-10T07:18:30Z,:tada: A magical vue admin                                                                https://panjiachen.github.io/vue-element-admin
65,top-100-stars,flask,49305,13336,Python,https://github.com/pallets/flask,pallets,29,2020-03-05T10:34:32Z,The Python micro framework for building web applications.
66,top-100-stars,socket.io,48952,8930,JavaScript,https://github.com/socketio/socket.io,socketio,476,2020-02-23T13:33:13Z,Realtime application framework (Node.JS server)
67,top-100-stars,shadowsocks-windows,48081,15403,C#,https://github.com/shadowsocks/shadowsocks-windows,shadowsocks,54,2020-03-03T14:44:01Z,"If you want to keep a secret, you must also hide it from yourself."
68,top-100-stars,django,47681,20645,Python,https://github.com/django/django,django,241,2020-03-10T10:23:16Z,The Web framework for perfectionists with deadlines.
69,top-100-stars,express,47625,7974,JavaScript,https://github.com/expressjs/express,expressjs,196,2020-03-10T05:44:55Z,"Fast, unopinionated, minimalist web framework for node."
70,top-100-stars,Chart.js,47559,10218,JavaScript,https://github.com/chartjs/Chart.js,chartjs,364,2020-03-10T00:37:51Z,Simple HTML5 Charts using the <canvas> tag
71,top-100-stars,Semantic-UI,47475,5021,JavaScript,https://github.com/Semantic-Org/Semantic-UI,Semantic-Org,992,2020-02-19T07:06:58Z,Semantic is a UI component framework based around useful principles from natural language.
72,top-100-stars,elasticsearch,47435,16130,Java,https://github.com/elastic/elasticsearch,elastic,2550,2020-03-10T10:54:09Z,"Open Source, Distributed, RESTful Search Engine"
73,top-100-stars,keras,47136,17851,Python,https://github.com/keras-team/keras,keras-team,2925,2020-03-09T19:08:28Z,Deep Learning for humans
74,top-100-stars,Apollo-11,46830,6367,Assembly,https://github.com/chrislgarry/Apollo-11,chrislgarry,97,2020-03-04T19:08:50Z,Original Apollo 11 Guidance Computer (AGC) source code for the command and lunar modules.
75,top-100-stars,storybook,46315,4345,TypeScript,https://github.com/storybookjs/storybook,storybookjs,557,2020-03-10T10:50:53Z,"📓 UI component dev & test: React, Vue, Angular, React Native, Ember, Web Components & more!"
76,top-100-stars,httpie,46013,2971,Python,https://github.com/jakubroztocil/httpie,jakubroztocil,162,2020-03-06T02:46:14Z,"As easy as HTTPie /aitch-tee-tee-pie/  🥧 Modern command line HTTP client – user-friendly curl alternative with intuitive UI, JSON support, syntax highlighting, wget-like downloads, extensions, etc.  https://twitter.com/clihttp"
77,top-100-stars,spring-boot,45959,28947,Java,https://github.com/spring-projects/spring-boot,spring-projects,455,2020-03-10T09:26:27Z,Spring Boot
78,top-100-stars,json-server,45946,4245,JavaScript,https://github.com/typicode/json-server,typicode,514,2020-03-05T20:03:39Z,Get a full fake REST API with zero coding in less than 30 seconds (seriously)
79,top-100-stars,next.js,45700,6514,JavaScript,https://github.com/zeit/next.js,zeit,369,2020-03-10T10:50:47Z,The React Framework
80,top-100-stars,deno,45452,2121,TypeScript,https://github.com/denoland/deno,denoland,368,2020-03-10T10:30:00Z,A secure JavaScript and TypeScript runtime
81,top-100-stars,netdata,45343,4130,C,https://github.com/netdata/netdata,netdata,662,2020-03-10T10:59:12Z,"Real-time performance monitoring, done right! https://my-netdata.io/"
82,top-100-stars,rails,45159,18267,Ruby,https://github.com/rails/rails,rails,631,2020-03-10T10:41:09Z,Ruby on Rails
83,top-100-stars,FiraCode,45064,1698,Clojure,https://github.com/tonsky/FiraCode,tonsky,230,2020-03-06T10:56:34Z,Monospaced font with programming ligatures
84,top-100-stars,html5-boilerplate,44388,10624,JavaScript,https://github.com/h5bp/html5-boilerplate,h5bp,4,2020-02-22T15:21:37Z,"A professional front-end template for building fast, robust, and adaptable web apps or sites."
85,top-100-stars,markdown-here,44385,7865,JavaScript,https://github.com/adam-p/markdown-here,adam-p,266,2020-02-21T01:02:55Z,"Google Chrome, Firefox, and Thunderbird extension that lets you write email in Markdown and render it before sending."
86,top-100-stars,architect-awesome,44132,13836,,https://github.com/xingshaocheng/architect-awesome,xingshaocheng,57,2020-01-20T06:00:57Z,后端架构师技术图谱
87,top-100-stars,element,44107,10022,Vue,https://github.com/ElemeFE/element,ElemeFE,1620,2020-03-10T08:16:52Z,A Vue.js 2.0 UI Toolkit for Web
88,top-100-stars,Front-end-Developer-Interview-Questions,43838,8822,HTML,https://github.com/h5bp/Front-end-Developer-Interview-Questions,h5bp,5,2020-01-25T05:33:26Z,"A list of helpful front-end related questions you can use to interview potential candidates, test yourself or completely ignore."
89,top-100-stars,resume.github.com,43833,1157,JavaScript,https://github.com/resume/resume.github.com,resume,35,2018-12-29T23:17:05Z,Resumes generated using the GitHub informations
90,top-100-stars,lodash,43801,4735,JavaScript,https://github.com/lodash/lodash,lodash,68,2020-03-08T16:03:06Z,"A modern JavaScript utility library delivering modularity, performance, & extras."
91,top-100-stars,awesome-machine-learning,43778,11069,Python,https://github.com/josephmisiti/awesome-machine-learning,josephmisiti,1,2020-02-22T15:43:17Z,"A curated list of awesome Machine Learning frameworks, libraries and software."
92,top-100-stars,moment,43475,6539,JavaScript,https://github.com/moment/moment,moment,503,2020-03-05T15:33:43Z,"Parse, validate, manipulate, and display dates in javascript."
93,top-100-stars,rust,43128,6550,Rust,https://github.com/rust-lang/rust,rust-lang,5478,2020-03-10T10:59:03Z,Empowering everyone to build reliable and efficient software.
94,top-100-stars,gatsby,42752,7488,JavaScript,https://github.com/gatsbyjs/gatsby,gatsbyjs,761,2020-03-10T10:37:45Z,"Build blazing fast, modern apps and websites with React"
95,top-100-stars,opencv,42671,33385,C++,https://github.com/opencv/opencv,opencv,1771,2020-03-10T10:39:28Z,Open Source Computer Vision Library
96,top-100-stars,interviews,42561,8973,Java,https://github.com/kdn251/interviews,kdn251,67,2020-02-15T10:25:54Z,Everything you need to know to get the job.
97,top-100-stars,bitcoin,42507,25312,C++,https://github.com/bitcoin/bitcoin,bitcoin,1111,2020-03-10T08:14:23Z,Bitcoin Core integration/staging tree
98,top-100-stars,hugo,42185,4783,Go,https://github.com/gohugoio/hugo,gohugoio,468,2020-03-10T10:20:34Z,The world’s fastest framework for building websites.
99,top-100-stars,ansible,42143,18537,Python,https://github.com/ansible/ansible,ansible,6299,2020-03-10T10:31:50Z,"Ansible is a radically simple IT automation platform that makes your applications and systems easier to deploy. Avoid writing scripts or custom code to deploy and update your applications — automate in a language that approaches plain English, using SSH, with no agents to install on remote systems. https://docs.ansible.com/ansible/"
100,top-100-stars,RxJava,42070,7055,Java,https://github.com/ReactiveX/RxJava,ReactiveX,8,2020-03-08T21:24:21Z,RxJava – Reactive Extensions for the JVM – a library for composing asynchronous and event-based programs using observable sequences for the Java VM.
1,top-100-forks,tensorflow,141821,80254,C++,https://github.com/tensorflow/tensorflow,tensorflow,3437,2020-03-10T10:53:19Z,An Open Source Machine Learning Framework for Everyone
2,top-100-forks,SmartThingsPublic,1540,66712,Groovy,https://github.com/SmartThingsCommunity/SmartThingsPublic,SmartThingsCommunity,13238,2020-03-10T10:16:26Z,SmartThings open-source DeviceTypeHandlers and SmartApps code
3,top-100-forks,ExData_Plotting1,182,50698,,https://github.com/rdpeng/ExData_Plotting1,rdpeng,615,2020-02-24T23:24:23Z,Plotting Assignment 1 for Exploratory Data Analysis
4,top-100-forks,models,62199,39736,Python,https://github.com/tensorflow/models,tensorflow,1308,2020-03-10T04:24:09Z,Models and examples built with TensorFlow
5,top-100-forks,opencv,42671,33385,C++,https://github.com/opencv/opencv,opencv,1771,2020-03-10T10:39:28Z,Open Source Computer Vision Library
6,top-100-forks,RepData_PeerAssessment1,80,32460,,https://github.com/rdpeng/RepData_PeerAssessment1,rdpeng,275,2020-02-19T16:32:54Z,Peer Assessment 1 for Reproducible Research
7,top-100-forks,tutorials,19871,31099,Java,https://github.com/eugenp/tutorials,eugenp,66,2020-03-10T07:36:20Z,"Just Announced - ""Learn Spring Security OAuth"": "
8,top-100-forks,CS-Notes,93530,30316,Java,https://github.com/CyC2018/CS-Notes,CyC2018,20,2020-03-08T02:21:49Z,:books: 技术面试必备基础知识、Leetcode、计算机操作系统、计算机网络、系统设计、Java、Python、C++
9,top-100-forks,Complete-Python-3-Bootcamp,8390,29658,Jupyter Notebook,https://github.com/Pierian-Data/Complete-Python-3-Bootcamp,Pierian-Data,72,2020-03-10T00:07:16Z,Course Files for Complete Python 3 Bootcamp Course on Udemy
10,top-100-forks,coding-interview-university,100883,29634,,https://github.com/jwasham/coding-interview-university,jwasham,48,2020-03-06T04:57:37Z,A complete computer science study plan to become a software engineer.
11,top-100-forks,spring-boot,45959,28947,Java,https://github.com/spring-projects/spring-boot,spring-projects,455,2020-03-10T09:26:27Z,Spring Boot
12,top-100-forks,bitcoin,42507,25312,C++,https://github.com/bitcoin/bitcoin,bitcoin,1111,2020-03-10T08:14:23Z,Bitcoin Core integration/staging tree
13,top-100-forks,first-contributions,9668,25053,,https://github.com/firstcontributions/first-contributions,firstcontributions,2673,2020-03-10T10:59:52Z,🚀✨ Help beginners to contribute to open source projects
14,top-100-forks,JavaGuide,70992,24338,Java,https://github.com/Snailclimb/JavaGuide,Snailclimb,27,2020-03-10T09:24:33Z,【Java学习+面试指南】 一份涵盖大部分Java程序员所需要掌握的核心知识。
15,top-100-forks,frontend-nanodegree-resume,1075,24036,JavaScript,https://github.com/udacity/frontend-nanodegree-resume,udacity,2,2020-02-02T15:57:39Z,This repository is used for one of the projects in Udacity's Front-End Web Developer Nanodegree program. Learn how to become a Front-End Developer today with line-by-line code reviewed projects and get a job with career services!
16,top-100-forks,vue,158962,23955,JavaScript,https://github.com/vuejs/vue,vuejs,462,2020-03-10T08:54:38Z,"🖖 Vue.js is a progressive, incrementally-adoptable JavaScript framework for building UI on the web."
17,top-100-forks,You-Dont-Know-JS,118708,23794,,https://github.com/getify/You-Dont-Know-JS,getify,109,2020-03-08T16:09:05Z,A book series on JavaScript. @YDKJS on twitter.
18,top-100-forks,freeCodeCamp,309092,23769,JavaScript,https://github.com/freeCodeCamp/freeCodeCamp,freeCodeCamp,243,2020-03-10T10:43:43Z,freeCodeCamp.org's open source codebase and curriculum. Learn to code for free together with millions of people.
19,top-100-forks,recipes,67,22297,,https://github.com/LarryMad/recipes,LarryMad,2256,2020-02-01T12:51:33Z,
20,top-100-forks,d3,90304,21857,JavaScript,https://github.com/d3/d3,d3,4,2020-02-04T07:50:27Z,"Bring data to life with SVG, Canvas and HTML. :bar_chart::chart_with_upwards_trend::tada:"
21,top-100-forks,spark,25353,21281,Scala,https://github.com/apache/spark,apache,286,2020-03-10T10:31:15Z,Apache Spark
22,top-100-forks,ant-design,57514,20718,TypeScript,https://github.com/ant-design/ant-design,ant-design,482,2020-03-10T10:39:13Z,🌈 A UI Design Language and React UI library
23,top-100-forks,DefinitelyTyped,26858,20697,TypeScript,https://github.com/DefinitelyTyped/DefinitelyTyped,DefinitelyTyped,3351,2020-03-10T10:32:26Z,The repository for high quality TypeScript type definitions.
24,top-100-forks,free-programming-books-zh_CN,63983,19844,,https://github.com/justjavac/free-programming-books-zh_CN,justjavac,136,2020-02-16T03:26:38Z,:books: 免费的计算机编程类中文书籍，欢迎投稿
25,top-100-forks,shadowsocks,32414,19696,Python,https://github.com/shadowsocks/shadowsocks,shadowsocks,449,2019-11-06T02:01:03Z,
26,top-100-forks,scikit-learn,39689,19351,Python,https://github.com/scikit-learn/scikit-learn,scikit-learn,2152,2020-03-10T09:52:49Z,scikit-learn: machine learning in Python
27,top-100-forks,react-native,85419,19067,JavaScript,https://github.com/facebook/react-native,facebook,753,2020-03-10T11:00:08Z,A framework for building native apps with React.
28,top-100-forks,rails,45159,18267,Ruby,https://github.com/rails/rails,rails,631,2020-03-10T10:41:09Z,Ruby on Rails
29,top-100-forks,javascript,93542,18213,JavaScript,https://github.com/airbnb/javascript,airbnb,115,2020-03-10T06:30:44Z,JavaScript Style Guide
30,top-100-forks,laravel,58032,18032,PHP,https://github.com/laravel/laravel,laravel,27,2020-03-09T03:19:45Z,A PHP framework for web artisans
31,top-100-forks,java-design-patterns,55893,17999,Java,https://github.com/iluwatar/java-design-patterns,iluwatar,173,2020-03-07T12:26:38Z,Design patterns implemented in Java
32,top-100-forks,keras,47136,17851,Python,https://github.com/keras-team/keras,keras-team,2925,2020-03-09T19:08:28Z,Deep Learning for humans
33,top-100-forks,vue-element-admin,50403,17324,Vue,https://github.com/PanJiaChen/vue-element-admin,PanJiaChen,616,2020-03-10T07:18:30Z,:tada: A magical vue admin                                                                https://panjiachen.github.io/vue-element-admin
34,top-100-forks,awesome,127912,17061,,https://github.com/sindresorhus/awesome,sindresorhus,31,2020-03-09T13:43:46Z,😎 Awesome lists about all kinds of interesting topics
35,top-100-forks,redis,41489,16201,C,https://github.com/antirez/redis,antirez,2579,2020-03-09T19:54:12Z,"Redis is an in-memory database that persists on disk. The data model is key-value, but many different kind of values are supported: Strings, Lists, Sets, Sorted Sets, Hashes, Streams, HyperLogLogs, Bitmaps."
