rank,item,repo_name,stars,forks,language,repo_url,username,issues,last_commit,description
49,CPP,CRYENGINE,8472,1627,C++,https://github.com/CRYTEK/CRYENGINE,CRYTEK,262,2019-02-02T02:47:12Z,CRYENGINE is a powerful real-time game development platform created by Crytek.
50,CPP,openage,8362,824,C++,https://github.com/SFTtech/openage,SFTtech,195,2019-02-01T10:07:12Z,Free (as in freedom) open source clone of the Age of Empires II engine :rocket:
51,CPP,Catch2,8315,1362,C++,https://github.com/catchorg/Catch2,catchorg,187,2019-02-01T21:56:56Z,"A modern, C++-native, header-only, test framework for unit-tests, TDD and BDD - using C++11, C++14, C++17 and later (or C++03 on the Catch1.x branch)"
52,CPP,xbmc,8290,4901,C++,https://github.com/xbmc/xbmc,xbmc,290,2019-02-02T01:25:59Z,"Kodi is an award-winning free and open source home theater/media center software and entertainment hub for digital media. With its beautiful interface and powerful skinning engine, it's available for Android, BSD, Linux, macOS, iOS and Windows."
53,CPP,envoy,8223,1194,C++,https://github.com/envoyproxy/envoy,envoyproxy,447,2019-02-02T02:11:39Z,Cloud-native high-performance edge/middle/service proxy
54,CPP,brpc,8196,1868,C++,https://github.com/brpc/brpc,brpc,61,2019-01-31T05:28:00Z,"Industrial-grade RPC framework used throughout Baidu, with 1,000,000+ instances and thousands kinds of services, called ""baidu-rpc"" inside Baidu."
55,CPP,Paddle,8108,2201,C++,https://github.com/PaddlePaddle/Paddle,PaddlePaddle,723,2019-02-02T03:42:35Z,PArallel Distributed Deep LEarning （PaddlePaddle核心框架，高性能单机、分布式训练和跨平台部署）
56,CPP,turicreate,8095,764,C++,https://github.com/apple/turicreate,apple,272,2019-02-02T03:49:34Z,Turi Create simplifies the development of custom machine learning models.
57,CPP,libphonenumber,8094,1056,C++,https://github.com/googlei18n/libphonenumber,googlei18n,77,2019-01-25T01:41:59Z,"Google's common Java, C++ and JavaScript library for parsing, formatting, and validating international phone numbers."
58,CPP,openalpr,8038,1754,C++,https://github.com/openalpr/openalpr,openalpr,371,2018-10-19T21:03:42Z,Automatic License Plate Recognition library
59,CPP,mosh,7984,506,C++,https://github.com/mobile-shell/mosh,mobile-shell,203,2019-01-04T12:09:17Z,Mobile Shell
60,CPP,Karabiner-Elements,7880,503,C++,https://github.com/tekezo/Karabiner-Elements,tekezo,105,2019-02-01T16:49:21Z,Karabiner-Elements is a powerful utility for keyboard customization on macOS Sierra (10.12) or later.
61,CPP,Proton,7755,260,C++,https://github.com/ValveSoftware/Proton,ValveSoftware,1588,2019-01-31T23:16:08Z,Compatibility tool for Steam Play based on Wine and additional components
62,CPP,wkhtmltopdf,7734,1098,C++,https://github.com/wkhtmltopdf/wkhtmltopdf,wkhtmltopdf,669,2019-01-08T15:00:17Z,Convert HTML to PDF using Webkit (QtWebKit)
63,CPP,LightGBM,7718,2068,C++,https://github.com/Microsoft/LightGBM,Microsoft,86,2019-02-02T03:37:33Z,"A fast, distributed, high performance gradient boosting (GBDT, GBRT, GBM or MART) framework based on decision tree algorithms, used for ranking, classification and many other machine learning tasks. It is under the umbrella of the DMTK(http://github.com/microsoft/dmtk) project of Microsoft."
64,CPP,watchman,7592,575,C++,https://github.com/facebook/watchman,facebook,68,2019-02-01T10:24:38Z,"Watches files and records, or triggers actions, when they change. "
65,CPP,vnpy,7361,3484,C++,https://github.com/vnpy/vnpy,vnpy,28,2019-02-01T05:36:39Z,基于Python的开源量化交易平台开发框架
66,CPP,robomongo,7216,630,C++,https://github.com/Studio3T/robomongo,Studio3T,593,2019-02-01T19:53:53Z,Native cross-platform MongoDB management tool
67,CPP,rapidjson,7196,2000,C++,https://github.com/Tencent/rapidjson,Tencent,347,2019-02-01T06:29:24Z,A fast JSON parser/generator for C++ with both SAX/DOM style API
68,CPP,arangodb,7180,533,C++,https://github.com/arangodb/arangodb,arangodb,490,2019-02-02T00:16:30Z,"🥑 ArangoDB is a native multi-model database with flexible data models for documents, graphs, and key-values. Build high performance applications using a convenient SQL-like query language or JavaScript extensions."
69,CPP,notepad-plus-plus,6902,2087,C++,https://github.com/notepad-plus-plus/notepad-plus-plus,notepad-plus-plus,2572,2019-02-01T19:45:37Z,Notepad++ official repository
70,CPP,AirSim,6884,1808,C++,https://github.com/Microsoft/AirSim,Microsoft,381,2019-01-31T10:35:25Z,"Open source simulator for autonomous vehicles built on Unreal Engine / Unity, from Microsoft AI & Research"
71,CPP,openFrameworks,6714,2195,C++,https://github.com/openframeworks/openFrameworks,openframeworks,903,2019-02-01T21:49:54Z,openFrameworks is a community-developed cross platform toolkit for creative coding in C++.
72,CPP,OpenRCT2,6657,725,C++,https://github.com/OpenRCT2/OpenRCT2,OpenRCT2,1068,2019-02-01T20:57:16Z,An open source re-implementation of RollerCoaster Tycoon 2 🎢
73,CPP,solidity,6607,1792,C++,https://github.com/ethereum/solidity,ethereum,594,2019-02-02T02:15:56Z,"Solidity, the Contract-Oriented Programming Language"
74,CPP,zeal,6553,521,C++,https://github.com/zealdocs/zeal,zealdocs,131,2019-01-28T07:52:52Z,Offline documentation browser inspired by Dash
75,CPP,synergy-core,6548,1585,C++,https://github.com/symless/synergy-core,symless,246,2019-01-02T14:57:30Z,"Open source core of Synergy, the keyboard and mouse sharing tool"
76,CPP,dlib,6515,1970,C++,https://github.com/davisking/dlib,davisking,36,2019-01-26T20:17:04Z,A toolkit for making real world machine learning and data analysis applications in C++
77,CPP,AndFix,6425,1578,C++,https://github.com/alibaba/AndFix,alibaba,238,2017-10-18T13:56:12Z,AndFix is a library that offer hot-fix for Android App.
78,CPP,yuzu,6362,405,C++,https://github.com/yuzu-emu/yuzu,yuzu-emu,80,2019-02-01T19:15:18Z,Nintendo Switch Emulator
79,CPP,MMKV,6330,599,C++,https://github.com/Tencent/MMKV,Tencent,2,2019-01-29T14:56:12Z,"An efficient, small mobile key-value storage framework developed by WeChat. Works on iOS, Android, macOS and Windows."
80,CPP,AudioKit,6266,959,C++,https://github.com/AudioKit/AudioKit,AudioKit,10,2019-02-02T03:34:20Z,"Swift audio synthesis, processing, & analysis platform for iOS, macOS and tvOS"
81,CPP,Tars,6264,1554,C++,https://github.com/TarsCloud/Tars,TarsCloud,50,2019-01-02T11:16:40Z,Tars is a highly performance rpc framework based on naming service using tars protocol and provides a semi-automatic operation platform.
82,CPP,capnproto,6222,513,C++,https://github.com/capnproto/capnproto,capnproto,86,2019-01-23T19:45:50Z,Cap'n Proto serialization/RPC system - core tools and C++ library
83,CPP,tinyrenderer,6210,483,C++,https://github.com/ssloy/tinyrenderer,ssloy,2,2019-01-27T19:00:28Z,A brief computer graphics / rendering course
84,CPP,Gource,6112,514,C++,https://github.com/acaudwell/Gource,acaudwell,66,2018-12-06T15:45:49Z,software version control visualization
85,CPP,rpcs3,6102,1079,C++,https://github.com/RPCS3/rpcs3,RPCS3,426,2019-02-01T15:32:25Z,PS3 emulator/debugger
86,CPP,ClickHouse,6078,1001,C++,https://github.com/yandex/ClickHouse,yandex,601,2019-02-02T00:36:08Z,ClickHouse is a free analytic DBMS for big data.
87,CPP,vowpal_wabbit,6069,1500,C++,https://github.com/VowpalWabbit/vowpal_wabbit,VowpalWabbit,54,2019-02-02T03:50:05Z,"Vowpal Wabbit is a machine learning system which pushes the frontier of machine learning with techniques such as online, hashing, allreduce, reductions, learning2search, active, and interactive learning."
88,CPP,shadowsocks-qt5,5982,1900,C++,https://github.com/shadowsocks/shadowsocks-qt5,shadowsocks,34,2019-01-01T20:28:17Z,A cross-platform shadowsocks GUI client
89,CPP,tiled,5982,1198,C++,https://github.com/bjorn/tiled,bjorn,434,2019-01-30T22:19:52Z,A flexible level editor
90,CPP,proxygen,5970,1142,C++,https://github.com/facebook/proxygen,facebook,31,2019-02-02T02:44:46Z,A collection of C++ HTTP libraries including an easy to use HTTP server.
91,CPP,node-sass,5926,824,C++,https://github.com/sass/node-sass,sass,143,2019-01-30T16:09:14Z,:rainbow: Node.js bindings to libsass
92,CPP,ssdb,5908,1206,C++,https://github.com/ideawu/ssdb,ideawu,361,2019-01-24T04:20:23Z,"SSDB - A fast NoSQL database, an alternative to Redis"
93,CPP,aseprite,5901,614,C++,https://github.com/aseprite/aseprite,aseprite,664,2019-02-01T18:28:34Z,"Animated sprite editor & pixel art tool (Windows, macOS, Linux)"
94,CPP,thrift,5818,2761,C++,https://github.com/apache/thrift,apache,13,2019-02-02T00:18:52Z,Apache Thrift
95,CPP,filament,5779,324,C++,https://github.com/google/filament,google,30,2019-02-02T01:17:26Z,"Filament is a real-time physically based rendering engine for Android, iOS, Windows, Linux, macOS and WASM/WebGL"
96,CPP,bgfx,5762,948,C++,https://github.com/bkaradzic/bgfx,bkaradzic,191,2019-02-02T01:51:35Z,"Cross-platform, graphics API agnostic, ""Bring Your Own Engine/Framework"" style rendering library."
97,CPP,qBittorrent,5741,985,C++,https://github.com/qbittorrent/qBittorrent,qbittorrent,2355,2019-02-02T01:11:32Z,qBittorrent BitTorrent client
98,CPP,Sonoff-Tasmota,5702,1308,C++,https://github.com/arendst/Sonoff-Tasmota,arendst,21,2019-02-02T00:10:46Z,"Provide ESP8266 based itead Sonoff with Web, MQTT and OTA firmware using Arduino IDE or PlatformIO"
99,CPP,faiss,5680,1072,C++,https://github.com/facebookresearch/faiss,facebookresearch,43,2019-01-31T05:01:02Z,A library for efficient similarity search and clustering of dense vectors.
100,CPP,devilution,5678,679,C++,https://github.com/diasurgical/devilution,diasurgical,78,2019-01-31T03:45:44Z,Diablo devolved - magic behind the 1996 computer game
1,Clojure,FiraCode,30835,952,Clojure,https://github.com/tonsky/FiraCode,tonsky,181,2019-01-02T16:22:34Z,Monospaced font with programming ligatures
2,Clojure,LightTable,10419,895,Clojure,https://github.com/LightTable/LightTable,LightTable,160,2019-01-07T02:06:58Z,The Light Table IDE ⛺
3,Clojure,clojurescript,7966,701,Clojure,https://github.com/clojure/clojurescript,clojure,2,2019-01-31T15:13:50Z,Clojure to JS compiler
4,Clojure,om,6608,371,Clojure,https://github.com/omcljs/om,omcljs,74,2018-06-01T19:24:08Z,ClojureScript interface to Facebook's React
5,Clojure,leiningen,6231,1447,Clojure,https://github.com/technomancy/leiningen,technomancy,192,2019-01-23T02:34:29Z,Automate Clojure projects without setting your hair on fire.
6,Clojure,overtone,4520,401,Clojure,https://github.com/overtone/overtone,overtone,87,2019-01-26T01:35:25Z,Collaborative Programmable Music 
7,Clojure,icepick,3786,213,Clojure,https://github.com/frankiesardo/icepick,frankiesardo,24,2018-08-21T21:53:46Z,Android Instance State made easy
8,Clojure,riemann,3707,502,Clojure,https://github.com/riemann/riemann,riemann,20,2019-01-31T19:44:57Z,"A network event stream processing system, in Clojure."
9,Clojure,jepsen,3575,414,Clojure,https://github.com/jepsen-io/jepsen,jepsen-io,31,2019-01-31T16:35:08Z,"A framework for distributed systems verification, with fault injection"
10,Clojure,re-frame,3572,467,Clojure,https://github.com/Day8/re-frame,Day8,26,2019-01-10T21:57:32Z,"A Reagent Framework For Writing SPAs, in Clojurescript."
11,Clojure,compojure,3516,231,Clojure,https://github.com/weavejester/compojure,weavejester,2,2018-08-20T21:11:26Z,A concise routing library for Ring/Clojure
12,Clojure,reagent,3297,262,Clojure,https://github.com/reagent-project/reagent,reagent-project,39,2019-01-31T18:41:49Z,A minimalistic ClojureScript interface to React.js
13,Clojure,alda,3210,194,Clojure,https://github.com/alda-lang/alda,alda-lang,2,2019-01-29T02:17:14Z,A music programming language for musicians. :notes:
14,Clojure,datascript,3151,202,Clojure,https://github.com/tonsky/datascript,tonsky,55,2019-02-01T16:20:46Z,"Immutable database and Datalog query engine for Clojure, ClojureScript and JS"
15,Clojure,clojure-koans,3049,1768,Clojure,https://github.com/functional-koans/clojure-koans,functional-koans,4,2019-01-27T12:41:03Z,A set of exercises for learning Clojure
16,Clojure,mori,3037,144,Clojure,https://github.com/swannodette/mori,swannodette,63,2018-11-09T11:13:57Z,ClojureScript's persistent data structures and supporting API from the comfort of vanilla JavaScript
17,Clojure,modern-cljs,2749,308,Clojure,https://github.com/magomimmo/modern-cljs,magomimmo,35,2018-08-30T16:05:03Z,A series of tutorials on ClojureScript
18,Clojure,ring,2708,420,Clojure,https://github.com/ring-clojure/ring,ring-clojure,30,2019-02-01T14:51:36Z,Clojure HTTP server abstraction
19,Clojure,lein-figwheel,2653,214,Clojure,https://github.com/bhauman/lein-figwheel,bhauman,88,2018-12-28T16:11:32Z,Figwheel builds your ClojureScript code and hot loads it into the browser as you are coding!
20,Clojure,quil,2242,148,Clojure,https://github.com/quil/quil,quil,28,2019-01-07T18:32:06Z,Main repo. Quil source code.
21,Clojure,clojure-cookbook,2096,393,Clojure,https://github.com/clojure-cookbook/clojure-cookbook,clojure-cookbook,40,2018-12-27T14:38:31Z,This is the home of O'Reilly's Clojure Cookbook - http://clojure-cookbook.com
22,Clojure,aleph,2083,193,Clojure,https://github.com/ztellman/aleph,ztellman,60,2019-02-02T00:21:48Z,asynchronous communication for clojure
23,Clojure,instaparse,2065,124,Clojure,https://github.com/Engelberg/instaparse,Engelberg,28,2018-12-18T20:39:49Z,
24,Clojure,incanter,2055,278,Clojure,https://github.com/incanter/incanter,incanter,69,2018-12-05T13:22:55Z,"Clojure-based, R-like statistical computing and graphics environment for the JVM"
25,Clojure,pedestal,1990,229,Clojure,https://github.com/pedestal/pedestal,pedestal,38,2019-02-01T21:24:08Z,The Pedestal Server-side Libraries
26,Clojure,schema,1923,230,Clojure,https://github.com/plumatic/schema,plumatic,21,2019-01-21T05:45:28Z,Clojure(Script) library for declarative data description and validation
27,Clojure,hiccup,1852,140,Clojure,https://github.com/weavejester/hiccup,weavejester,24,2019-01-22T01:02:10Z,Fast library for rendering HTML in Clojure
28,Clojure,onyx,1839,192,Clojure,https://github.com/onyx-platform/onyx,onyx-platform,77,2018-12-20T05:57:51Z,"Distributed, masterless, high performance, fault tolerant data processing"
29,Clojure,specter,1823,76,Clojure,https://github.com/nathanmarz/specter,nathanmarz,24,2019-01-29T19:25:16Z,Clojure(Script)'s missing piece
30,Clojure,klipse,1768,86,Clojure,https://github.com/viebel/klipse,viebel,74,2019-01-10T12:27:14Z,"A simple client-side code evaluator pluggable on any web page: clojure, ruby, javascript, python, scheme, es2017, jsx, brainfuck, c++, reagent, lua, ocaml, reasonml, prolog, common lisp"
31,Clojure,transit-format,1599,33,Clojure,https://github.com/cognitect/transit-format,cognitect,9,2017-03-15T11:21:48Z,A data interchange format.
32,Clojure,component,1584,81,Clojure,https://github.com/stuartsierra/component,stuartsierra,1,2018-12-30T19:00:34Z,Managed lifecycle of stateful objects in Clojure
33,Clojure,awesome-clojure,1578,131,Clojure,https://github.com/razum2um/awesome-clojure,razum2um,6,2019-01-17T12:18:11Z,A curated list of awesome Clojure libraries and resources. Inspired by awesome-... stuff
34,Clojure,core.async,1568,173,Clojure,https://github.com/clojure/core.async,clojure,2,2018-12-06T16:30:58Z,Facilities for async programming and communication in Clojure
35,Clojure,boot,1549,164,Clojure,https://github.com/boot-clj/boot,boot-clj,112,2019-01-27T09:20:31Z,Build tooling for Clojure.
36,Clojure,lumo,1534,70,Clojure,https://github.com/anmonteiro/lumo,anmonteiro,81,2019-01-14T16:17:05Z,"Fast, cross-platform, standalone ClojureScript environment"
37,Clojure,kibit,1473,114,Clojure,https://github.com/jonase/kibit,jonase,61,2019-01-10T20:00:01Z,There's a function for that!
38,Clojure,enlive,1459,141,Clojure,https://github.com/cgrand/enlive,cgrand,27,2018-09-26T09:26:22Z,a selector-based (à la CSS) templating and transformation system for Clojure
39,Clojure,Midje,1448,124,Clojure,https://github.com/marick/Midje,marick,37,2019-01-17T13:03:08Z,"Midje provides a migration path from clojure.test to a more flexible, readable, abstract, and gracious style of testing"
40,Clojure,Korma,1393,227,Clojure,https://github.com/korma/Korma,korma,79,2018-08-17T15:20:06Z,Tasty SQL for Clojure.
41,Clojure,auto-parcel,1391,91,Clojure,https://github.com/frankiesardo/auto-parcel,frankiesardo,12,2017-02-12T15:10:29Z,Android Parcelable models made easy
42,Clojure,sente,1376,134,Clojure,https://github.com/ptaoussanis/sente,ptaoussanis,26,2019-01-23T18:59:48Z,Realtime web comms for Clojure/Script
43,Clojure,drake,1358,103,Clojure,https://github.com/Factual/drake,Factual,83,2018-12-12T22:36:59Z,"Data workflow tool, like a ""Make for data"""
44,Clojure,cascalog,1346,178,Clojure,https://github.com/nathanmarz/cascalog,nathanmarz,40,2016-05-06T07:14:10Z,Data processing on Hadoop without the hassle.
45,Clojure,plumbing,1345,109,Clojure,https://github.com/plumatic/plumbing,plumatic,10,2018-02-22T03:32:31Z,Prismatic's Clojure(Script) utility belt
46,Clojure,clj-http,1300,334,Clojure,https://github.com/dakrone/clj-http,dakrone,30,2019-01-30T11:13:57Z,An idiomatic clojure http client wrapping the apache client. Offically supported version.
47,Clojure,duckling_old,1295,229,Clojure,https://github.com/wit-ai/duckling_old,wit-ai,70,2017-06-25T20:07:09Z,Deprecated in favor of https://github.com/facebook/duckling
48,Clojure,Nightcode,1286,121,Clojure,https://github.com/oakes/Nightcode,oakes,30,2019-01-27T13:26:15Z,An IDE for Clojure
49,Clojure,yesql,1283,108,Clojure,https://github.com/krisajenkins/yesql,krisajenkins,68,2018-08-03T23:28:21Z,A Clojure library for using SQL.
50,Clojure,devcards,1282,101,Clojure,https://github.com/bhauman/devcards,bhauman,21,2019-01-22T18:39:28Z,Devcards aims to provide a visual REPL experience for ClojureScript
51,Clojure,seesaw,1247,137,Clojure,https://github.com/daveray/seesaw,daveray,61,2019-01-09T06:57:10Z,"Seesaw turns the Horror of Swing into a friendly, well-documented, Clojure library"
52,Clojure,chestnut,1226,95,Clojure,https://github.com/plexus/chestnut,plexus,4,2019-01-01T23:18:56Z,Application template for Clojure + ClojureScript web apps
53,Clojure,Arcadia,1211,83,Clojure,https://github.com/arcadia-unity/Arcadia,arcadia-unity,30,2019-01-14T23:38:58Z,Clojure in Unity
54,Clojure,liberator,1167,143,Clojure,https://github.com/clojure-liberator/liberator,clojure-liberator,55,2019-01-09T08:26:56Z,Liberator is a Clojure library for building RESTful applications.
55,Clojure,core.logic,1149,101,Clojure,https://github.com/clojure/core.logic,clojure,1,2018-03-06T19:43:22Z,
56,Clojure,friend,1138,121,Clojure,https://github.com/cemerick/friend,cemerick,31,2017-07-25T15:52:18Z,An extensible authentication and authorization library for Clojure Ring web applications and services. 
57,Clojure,lacinia,1115,87,Clojure,https://github.com/walmartlabs/lacinia,walmartlabs,24,2019-01-30T12:38:12Z,GraphQL implementation in pure Clojure
58,Clojure,asciinema-player,1111,119,Clojure,https://github.com/asciinema/asciinema-player,asciinema,40,2018-12-31T16:18:56Z,Web player for terminal session recordings ⏩
59,Clojure,ultra,1109,25,Clojure,https://github.com/venantius/ultra,venantius,8,2019-01-27T18:56:57Z,A Leiningen plugin for a superior development environment
60,Clojure,closh,1102,28,Clojure,https://github.com/dundalek/closh,dundalek,43,2019-01-21T20:47:22Z,Bash-like shell based on Clojure
61,Clojure,cortex,1098,95,Clojure,https://github.com/originrose/cortex,originrose,31,2018-09-10T20:29:23Z,Machine learning in Clojure
62,Clojure,timbre,1095,129,Clojure,https://github.com/ptaoussanis/timbre,ptaoussanis,26,2018-11-06T19:11:54Z,Pure Clojure/Script logging library
63,Clojure,cheshire,1083,113,Clojure,https://github.com/dakrone/cheshire,dakrone,27,2019-01-29T12:00:14Z,Clojure JSON and JSON SMILE (binary json format) encoding/decoding
64,Clojure,core.typed,1066,67,Clojure,https://github.com/clojure/core.typed,clojure,0,2018-11-30T13:19:23Z,An optional type system for Clojure
65,Clojure,code-maat,1023,119,Clojure,https://github.com/adamtornhill/code-maat,adamtornhill,11,2019-01-29T20:32:23Z,A command line tool to mine and analyze data from version-control systems
66,Clojure,frak,1018,39,Clojure,https://github.com/noprompt/frak,noprompt,2,2018-11-16T15:40:25Z,Transform collections of strings into regular expressions.
67,Clojure,lein-cljsbuild,1014,164,Clojure,https://github.com/emezeske/lein-cljsbuild,emezeske,50,2018-07-02T13:39:11Z,Leiningen plugin to make ClojureScript development easy.
68,Clojure,lux,1007,40,Clojure,https://github.com/LuxLang/lux,LuxLang,7,2019-01-25T03:50:10Z,The Lux Programming Language
69,Clojure,frontend,1007,129,Clojure,https://github.com/circleci/frontend,circleci,20,2018-12-25T18:26:30Z,CircleCI's frontend
70,Clojure,garden,978,59,Clojure,https://github.com/noprompt/garden,noprompt,36,2018-10-14T00:19:53Z,Generate CSS with Clojure
71,Clojure,hitchhiker-tree,938,66,Clojure,https://github.com/datacrypt-project/hitchhiker-tree,datacrypt-project,17,2018-07-22T21:01:33Z,"Functional, persistent, off-heap, high performance data structure"
72,Clojure,honeysql,915,101,Clojure,https://github.com/jkk/honeysql,jkk,9,2019-01-07T23:01:08Z,Turn Clojure data structures into SQL
73,Clojure,play-clj,915,69,Clojure,https://github.com/oakes/play-clj,oakes,9,2017-10-21T14:25:43Z,A Clojure game library
74,Clojure,markright,910,58,Clojure,https://github.com/dvcrn/markright,dvcrn,24,2017-03-01T01:38:59Z,➡ Electron powered markdown editor with live preview
75,Clojure,4clojure,906,194,Clojure,https://github.com/4clojure/4clojure,4clojure,81,2019-01-01T08:03:51Z,An interactive problem website for learning Clojure
76,Clojure,compojure-api,897,125,Clojure,https://github.com/metosin/compojure-api,metosin,26,2018-12-09T07:23:07Z,Sweet web apis with Compojure & Swagger
77,Clojure,logic-tutorial,890,82,Clojure,https://github.com/swannodette/logic-tutorial,swannodette,14,2018-10-30T11:45:38Z,A Very Gentle Introduction to Relational Programming
78,Clojure,criterium,878,42,Clojure,https://github.com/hugoduncan/criterium,hugoduncan,13,2017-02-28T09:44:26Z,Benchmarking library for clojure
79,Clojure,test.check,874,91,Clojure,https://github.com/clojure/test.check,clojure,0,2018-11-30T13:29:12Z,QuickCheck for Clojure
80,Clojure,core.match,872,51,Clojure,https://github.com/clojure/core.match,clojure,0,2018-01-05T17:21:58Z,
81,Clojure,eastwood,866,54,Clojure,https://github.com/jonase/eastwood,jonase,102,2019-01-26T19:53:02Z,Clojure lint tool
82,Clojure,clojurec,861,53,Clojure,https://github.com/schani/clojurec,schani,5,2018-04-25T22:28:20Z,A Clojure implementation on top of C
83,Clojure,lt-cljs-tutorial,854,127,Clojure,https://github.com/swannodette/lt-cljs-tutorial,swannodette,10,2015-10-08T07:16:26Z,A ClojureScript Programming Language Tutorial for Light Table Users
84,Clojure,mount,845,63,Clojure,https://github.com/tolitius/mount,tolitius,22,2019-01-28T15:44:09Z,managing Clojure and ClojureScript app state since (reset)
85,Clojure,bidi,844,90,Clojure,https://github.com/juxt/bidi,juxt,50,2018-12-28T07:12:40Z,Bidirectional URI routing
86,Clojure,carmine,841,89,Clojure,https://github.com/ptaoussanis/carmine,ptaoussanis,13,2019-02-01T14:00:09Z,Redis client and message queue for Clojure
87,Clojure,cljs-devtools,840,32,Clojure,https://github.com/binaryage/cljs-devtools,binaryage,8,2018-11-27T17:26:54Z,A collection of Chrome DevTools enhancements for ClojureScript developers
88,Clojure,pulsar,838,50,Clojure,https://github.com/puniverse/pulsar,puniverse,9,2017-09-06T16:16:37Z,"Fibers, Channels and Actors for Clojure"
89,Clojure,hoplon,834,63,Clojure,https://github.com/hoplon/hoplon,hoplon,41,2019-01-26T21:54:00Z,Hoplon web development tools and libraries.
90,Clojure,clara-rules,825,93,Clojure,https://github.com/cerner/clara-rules,cerner,69,2019-01-21T22:11:26Z,Forward-chaining rules in Clojure(Script)
91,Clojure,amazonica,805,171,Clojure,https://github.com/mcohen01/amazonica,mcohen01,26,2019-01-02T05:31:15Z,A comprehensive Clojure client for the entire Amazon AWS api.
92,Clojure,pallet,798,120,Clojure,https://github.com/pallet/pallet,pallet,126,2018-05-25T15:44:26Z,Automates controlling and provisioning cloud server instances. DevOps for the JVM.
93,Clojure,noir,763,85,Clojure,https://github.com/noir-clojure/noir,noir-clojure,24,2012-12-13T23:35:54Z,A framework for writing web applications in clojure.
94,Clojure,shadow-cljs,756,39,Clojure,https://github.com/thheller/shadow-cljs,thheller,41,2019-02-01T22:03:38Z,ClojureScript compilation made easy
95,Clojure,dommy,749,80,Clojure,https://github.com/plumatic/dommy,plumatic,17,2018-01-07T00:14:06Z,A tiny ClojureScript DOM manipulation and event library
96,Clojure,environ,747,61,Clojure,https://github.com/weavejester/environ,weavejester,14,2019-01-10T12:38:44Z,Library for managing environment variables in Clojure
97,Clojure,duct,747,42,Clojure,https://github.com/duct-framework/duct,duct-framework,4,2019-02-01T23:58:44Z,Server-side application framework for Clojure
98,Clojure,tesser,744,39,Clojure,https://github.com/aphyr/tesser,aphyr,3,2018-05-15T13:35:07Z,"Clojure reducers, but for parallel execution: locally and on distributed systems."
99,Clojure,Nightlight,743,33,Clojure,https://github.com/oakes/Nightlight,oakes,12,2019-01-27T13:30:12Z,An embedded editor for Clojure
100,Clojure,swarmpit,736,71,Clojure,https://github.com/swarmpit/swarmpit,swarmpit,55,2019-02-01T22:59:06Z,Lightweight Docker Swarm management UI
1,CoffeeScript,coffeescript,15086,1993,CoffeeScript,https://github.com/jashkenas/coffeescript,jashkenas,40,2019-01-30T21:28:02Z,Unfancy JavaScript
2,CoffeeScript,trix,13030,594,CoffeeScript,https://github.com/basecamp/trix,basecamp,32,2019-01-15T16:51:28Z,A rich text editor for everyday writing
