rank,item,repo_name,stars,forks,language,repo_url,username,issues,last_commit,description
7,Lua,pix2pix,6891,1197,Lua,https://github.com/phillipi/pix2pix,phillipi,61,2019-04-14T21:14:16Z,Image-to-image translation with conditional adversarial nets
8,Lua,dockercraft,5404,309,Lua,https://github.com/docker/dockercraft,docker,15,2018-06-18T12:15:21Z,Docker + Minecraft = Dockercraft
9,Lua,koreader,5225,668,Lua,https://github.com/koreader/koreader,koreader,333,2019-09-06T02:43:43Z,"An ebook reader application supporting PDF, DjVu, EPUB, FB2 and many more formats, running on Cervantes, Kindle, Kobo, PocketBook and Android devices"
10,Lua,VeryNginx,4936,780,Lua,https://github.com/alexazhou/VeryNginx,alexazhou,98,2019-08-26T06:47:13Z," A very powerful and friendly  nginx base on lua-nginx-module( openresty ) which provide WAF, Control Panel, and Dashboards. "
11,Lua,lsyncd,3691,354,Lua,https://github.com/axkibe/lsyncd,axkibe,97,2019-08-08T16:03:50Z,Lsyncd (Live Syncing Daemon) synchronizes local directories with remote targets
12,Lua,DenseNet,3652,882,Lua,https://github.com/liuzhuang13/DenseNet,liuzhuang13,26,2019-07-22T09:36:34Z,"Densely Connected Convolutional Networks, In CVPR 2017 (Best Paper Award)."
13,Lua,fairseq,3454,604,Lua,https://github.com/facebookresearch/fairseq,facebookresearch,8,2019-02-25T06:01:33Z,Facebook AI Research Sequence-to-Sequence Toolkit
14,Lua,fast-neural-style,3288,657,Lua,https://github.com/jcjohnson/fast-neural-style,jcjohnson,131,2019-07-09T05:36:53Z,Feedforward style transfer
15,Lua,luvit,3076,329,Lua,https://github.com/luvit/luvit,luvit,86,2019-07-25T20:42:28Z,Lua + libUV + jIT = pure awesomesauce
16,Lua,deepmask,3043,530,Lua,https://github.com/facebookresearch/deepmask,facebookresearch,48,2019-01-16T17:21:51Z,Torch implementation of DeepMask and SharpMask
17,Lua,ntopng,2851,343,Lua,https://github.com/ntop/ntopng,ntop,90,2019-09-06T10:34:24Z,Web-based Traffic and Security Network Traffic Monitoring
18,Lua,openresty-best-practices,2719,696,Lua,https://github.com/moonbingbing/openresty-best-practices,moonbingbing,7,2019-07-13T00:32:36Z,
19,Lua,awesome,2700,336,Lua,https://github.com/awesomeWM/awesome,awesomeWM,300,2019-09-04T17:10:02Z,awesome window manager
20,Lua,ngx_lua_waf,2675,1119,Lua,https://github.com/loveshell/ngx_lua_waf,loveshell,73,2019-04-26T04:14:46Z,ngx_lua_waf是一个基于lua-nginx-module(openresty)的web应用防火墙
21,Lua,snabb,2321,298,Lua,https://github.com/snabbco/snabb,snabbco,235,2019-08-19T10:49:34Z,Snabb: Simple and fast packet networking
22,Lua,neuralart,2300,348,Lua,https://github.com/kaishengtai/neuralart,kaishengtai,6,2017-03-05T18:08:54Z,An implementation of the paper 'A Neural Algorithm of Artistic Style'.
23,Lua,OpenNMT,2211,447,Lua,https://github.com/OpenNMT/OpenNMT,OpenNMT,49,2019-07-03T07:50:27Z,Open Source Neural Machine Translation in Torch
24,Lua,tarantool,2208,217,Lua,https://github.com/tarantool/tarantool,tarantool,814,2019-09-06T10:52:45Z,Get your data in RAM. Get compute close to data. Enjoy the performance.
25,Lua,moonscript,2199,158,Lua,https://github.com/leafo/moonscript,leafo,155,2019-08-15T21:37:55Z,:crescent_moon: A language that compiles to Lua
26,Lua,torch-rnn,2182,494,Lua,https://github.com/jcjohnson/torch-rnn,jcjohnson,108,2018-04-28T08:50:05Z,"Efficient, reusable RNNs and LSTMs for torch"
27,Lua,CorsixTH,2067,245,Lua,https://github.com/CorsixTH/CorsixTH,CorsixTH,281,2019-09-01T09:31:15Z,Open source clone of Theme Hospital
28,Lua,Algorithm-Implementations,2060,497,Lua,https://github.com/kennyledet/Algorithm-Implementations,kennyledet,9,2019-07-18T15:50:08Z,"Share, discuss and learn about algorithm implementations!"
29,Lua,siggraph2016_colorization,2003,282,Lua,https://github.com/satoshiiizuka/siggraph2016_colorization,satoshiiizuka,13,2017-08-24T08:40:12Z,Code for the paper 'Let there be Color!: Joint End-to-end Learning of Global and Local Image Priors for Automatic Image Colorization with Simultaneous Classification'. 
30,Lua,luci,1987,1027,Lua,https://github.com/openwrt/luci,openwrt,168,2019-09-05T22:42:23Z,LuCI - OpenWrt Configuration Interface
31,Lua,ZeroBraneStudio,1886,438,Lua,https://github.com/pkulchenko/ZeroBraneStudio,pkulchenko,86,2019-08-14T21:45:58Z,"Lightweight Lua-based IDE for Lua with code completion, syntax highlighting, live coding, remote debugger, and code analyzer; supports Lua 5.1, 5.2, 5.3, LuaJIT and other Lua interpreters on Windows, macOS, and Linux"
32,Lua,fb.resnet.torch,1848,609,Lua,https://github.com/facebook/fb.resnet.torch,facebook,62,2019-04-16T16:20:58Z,Torch implementation of ResNet from http://arxiv.org/abs/1512.03385 and training scripts
33,Lua,awesome-copycats,1802,394,Lua,https://github.com/lcpz/awesome-copycats,lcpz,1,2019-08-27T16:10:27Z,Awesome WM themes
34,Lua,DeepMind-Atari-Deep-Q-Learner,1753,546,Lua,https://github.com/kuz/DeepMind-Atari-Deep-Q-Learner,kuz,23,2018-01-23T03:06:50Z,The original code from the DeepMind article + my tweaks
35,Lua,orange,1740,475,Lua,https://github.com/orlabs/orange,orlabs,42,2019-08-24T00:19:09Z,OpenResty/Nginx Gateway for API Monitoring and Management.
36,Lua,MemNN,1622,378,Lua,https://github.com/facebook/MemNN,facebook,17,2019-03-27T22:45:51Z,Memory Networks implementations
37,Lua,nmap-vulners,1613,245,Lua,https://github.com/vulnersCom/nmap-vulners,vulnersCom,3,2019-08-15T15:08:10Z,NSE script based on Vulners.com API
38,Lua,PathOfBuilding,1586,631,Lua,https://github.com/Openarl/PathOfBuilding,Openarl,640,2019-09-04T14:40:32Z,Offline build planner for Path of Exile.
39,Lua,luarocks,1575,288,Lua,https://github.com/luarocks/luarocks,luarocks,156,2019-09-05T20:39:34Z,LuaRocks is the package manager for the Lua programming language.
40,Lua,ResNeXt,1538,252,Lua,https://github.com/facebookresearch/ResNeXt,facebookresearch,8,2019-01-16T00:47:02Z,Implementation of a classification framework from the paper Aggregated Residual Transformations for Deep Neural Networks
41,Lua,Anycomplete,1523,45,Lua,https://github.com/nathancahill/Anycomplete,nathancahill,3,2017-04-04T18:29:04Z,The magic of Google Autocomplete while you're typing. Anywhere.
42,Lua,crnn,1453,438,Lua,https://github.com/bgshih/crnn,bgshih,82,2019-03-04T05:12:37Z,Convolutional Recurrent Neural Network (CRNN) for image-based sequence recognition.
43,Lua,art-DCGAN,1381,237,Lua,https://github.com/robbiebarrat/art-DCGAN,robbiebarrat,13,2019-01-09T20:36:18Z,"Modified implementation of DCGAN focused on generative art. Includes pre-trained models for landscapes, nude-portraits, and others."
44,Lua,multipathnet,1357,296,Lua,https://github.com/facebookresearch/multipathnet,facebookresearch,23,2019-03-22T18:15:44Z,"A Torch implementation of the object detection network from ""A MultiPath Network for Object Detection"" (https://arxiv.org/abs/1604.02135)"
45,Lua,luafun,1357,84,Lua,https://github.com/luafun/luafun,luafun,26,2017-10-06T06:35:52Z,Lua Fun is a high-performance functional programming library for Lua designed with LuaJIT's trace compiler in mind.
46,Lua,luakit,1320,220,Lua,https://github.com/luakit/luakit,luakit,182,2019-08-14T03:46:40Z,"Fast, small, webkit based browser framework extensible by Lua."
47,Lua,lua-resty-redis,1295,349,Lua,https://github.com/openresty/lua-resty-redis,openresty,47,2019-09-01T19:47:13Z,Lua redis client driver for the ngx_lua based on the cosocket API
48,Lua,qipai_algorithm,1259,608,Lua,https://github.com/yuanfengyun/qipai_algorithm,yuanfengyun,14,2019-06-18T04:05:31Z,棋牌的胡牌算法，包括麻将、跑胡子、扑克。实现 lua 、c++ 、c# 、golang 、js 、java 、python 版本。( Mahjong  algorithm )
49,Lua,nn,1206,974,Lua,https://github.com/torch/nn,torch,172,2018-10-04T01:47:39Z,
50,Lua,z.lua,1192,43,Lua,https://github.com/skywind3000/z.lua,skywind3000,11,2019-09-05T17:21:37Z,A new cd command that helps you navigate faster by learning your habits :zap:
51,Lua,vulscan,1176,304,Lua,https://github.com/scipag/vulscan,scipag,5,2019-09-05T18:30:17Z,Advanced vulnerability scanning with Nmap NSE
52,Lua,lua-resty-http,1157,408,Lua,https://github.com/ledgetech/lua-resty-http,ledgetech,26,2019-08-20T17:21:05Z,Lua HTTP client cosocket driver for OpenResty / ngx_lua.
53,Lua,Faster-High-Res-Neural-Inpainting,1142,199,Lua,https://github.com/leehomyc/Faster-High-Res-Neural-Inpainting,leehomyc,10,2018-05-29T22:01:59Z,High-Resolution Image Inpainting using Multi-Scale Neural Patch Synthesis
54,Lua,middleclass,1122,129,Lua,https://github.com/kikito/middleclass,kikito,1,2018-03-10T11:39:21Z,Object-orientation for Lua
55,Lua,keyboard,1111,116,Lua,https://github.com/jasonrudolph/keyboard,jasonrudolph,7,2019-08-15T18:10:48Z,⌨ Toward a more useful keyboard
56,Lua,dcgan.torch,1111,346,Lua,https://github.com/soumith/dcgan.torch,soumith,41,2018-12-19T21:28:23Z,A torch implementation of http://arxiv.org/abs/1511.06434
57,Lua,vlsub,1109,315,Lua,https://github.com/exebetche/vlsub,exebetche,82,2019-03-06T10:24:52Z,VLC extension to download subtitles from opensubtitles.org
58,Lua,seq2seq-attn,1097,281,Lua,https://github.com/harvardnlp/seq2seq-attn,harvardnlp,14,2018-02-13T05:27:41Z,Sequence-to-sequence model with LSTM encoder/decoders and attention
59,Lua,fbcunn,1079,263,Lua,https://github.com/facebookarchive/fbcunn,facebookarchive,38,2017-07-21T22:04:03Z,Facebook's extensions to torch/cunn.
60,Lua,texture_nets,1058,201,Lua,https://github.com/DmitryUlyanov/texture_nets,DmitryUlyanov,41,2018-01-07T06:56:34Z,"Code for ""Texture Networks: Feed-forward Synthesis of Textures and Stylized Images"" paper."
61,Lua,nProbe,1049,30,Lua,https://github.com/ntop/nProbe,ntop,35,2019-06-20T10:25:16Z,Open source components and extensions for nProbe
62,Lua,luacheck,1047,179,Lua,https://github.com/mpeterv/luacheck,mpeterv,37,2019-08-23T11:29:48Z, A tool for linting and static analysis of Lua code. 
63,Lua,Penlight,1034,185,Lua,https://github.com/stevedonovan/Penlight,stevedonovan,31,2019-07-08T09:09:20Z,"A set of pure Lua libraries focusing on input data handling (such as reading configuration files), functional programming (such as map, reduce, placeholder expressions,etc), and OS path management.  Much of the functionality is inspired by the Python standard libraries."
64,Lua,wide-residual-networks,980,254,Lua,https://github.com/szagoruyko/wide-residual-networks,szagoruyko,26,2019-08-20T08:37:42Z,3.8% and 18.3% on CIFAR-10 and CIFAR-100
65,Lua,torchnet,976,201,Lua,https://github.com/torchnet/torchnet,torchnet,3,2019-03-27T22:21:16Z,Torch on steroids
66,Lua,rnn,911,317,Lua,https://github.com/Element-Research/rnn,Element-Research,79,2017-12-21T06:29:48Z,Recurrent Neural Network library for Torch7's nn
67,Lua,lsofgraph,910,27,Lua,https://github.com/zevv/lsofgraph,zevv,0,2019-04-20T19:38:03Z,lsof to graphviz
68,Lua,sailor,852,128,Lua,https://github.com/sailorproject/sailor,sailorproject,46,2019-07-05T13:13:50Z,A Lua MVC Web Framework.
69,Lua,Fennel,847,49,Lua,https://github.com/bakpakin/Fennel,bakpakin,4,2019-09-06T05:18:32Z,Lua Lisp Language
70,Lua,KikiAuth,845,1,Lua,https://github.com/fossasia/KikiAuth,fossasia,0,2018-11-23T17:17:23Z,CommonsNet KikiAuth for OpenWrt
71,Lua,hawkthorne-journey,843,370,Lua,https://github.com/hawkthorne/hawkthorne-journey,hawkthorne,34,2018-10-10T06:31:22Z,Digital Estate Planning: The Game
72,Lua,telegram-bot,842,523,Lua,https://github.com/yagop/telegram-bot,yagop,116,2018-10-14T09:09:36Z,UNMAINTAINED - A Telegram Bot based on plugins
73,Lua,minetest_game,834,406,Lua,https://github.com/minetest/minetest_game,minetest,105,2019-09-05T21:39:25Z,Minetest Game - The default game for the Minetest engine [https://github.com/minetest/minetest/]
74,Lua,busted,829,134,Lua,https://github.com/Olivine-Labs/busted,Olivine-Labs,50,2019-07-19T07:31:29Z,Elegant Lua unit testing.
75,Lua,NAMAS,826,252,Lua,https://github.com/facebookarchive/NAMAS,facebookarchive,18,2018-04-25T14:40:20Z,Neural Attention Model for Abstractive Summarization
76,Lua,doomrl,822,112,Lua,https://github.com/chaosforgeorg/doomrl,chaosforgeorg,19,2018-10-03T03:25:35Z,"D**m, the Roguelike"
77,Lua,lor,814,159,Lua,https://github.com/sumory/lor,sumory,14,2019-09-02T07:20:06Z,"a fast, minimalist web framework for lua based on OpenResty"
78,Lua,Crepe,813,232,Lua,https://github.com/zhangxiangxiao/Crepe,zhangxiangxiao,2,2019-07-23T06:07:51Z,Character-level Convolutional Networks for Text Classification
79,Lua,CNNMRF,796,142,Lua,https://github.com/chuanli11/CNNMRF,chuanli11,7,2018-03-28T19:17:58Z,"code for paper ""Combining Markov Random Fields and Convolutional Neural Networks for Image Synthesis"""
80,Lua,lstm-char-cnn,790,221,Lua,https://github.com/yoonkim/lstm-char-cnn,yoonkim,15,2016-08-24T12:53:43Z,LSTM language model with CNN over characters
81,Lua,Neural-Dialogue-Generation,789,226,Lua,https://github.com/jiweil/Neural-Dialogue-Generation,jiweil,15,2017-07-12T12:18:28Z,
82,Lua,bAbI-tasks,773,178,Lua,https://github.com/facebook/bAbI-tasks,facebook,5,2019-03-27T22:23:53Z,Task generation for testing text understanding and reasoning
83,Lua,sile,767,56,Lua,https://github.com/simoncozens/sile,simoncozens,152,2019-09-02T10:40:07Z,Simon's Improved Layout Engine
84,Lua,icml2016,765,185,Lua,https://github.com/reedscot/icml2016,reedscot,28,2018-09-05T16:45:56Z,Generative Adversarial Text-to-Image Synthesis
85,Lua,AdaIN-style,761,119,Lua,https://github.com/xunhuang1995/AdaIN-style,xunhuang1995,13,2017-10-30T11:38:53Z,Arbitrary Style Transfer in Real-time with Adaptive Instance Normalization
86,Lua,openstar,759,308,Lua,https://github.com/starjun/openstar,starjun,2,2019-08-20T03:43:44Z,"lua waf,nginx+lua,openresty,luajit,waf+,cdn,nginx"
87,Lua,apisix,757,132,Lua,https://github.com/iresty/apisix,iresty,46,2019-09-06T09:46:54Z,Cloud-Native Microservices API Gateway
88,Lua,neuralconvo,748,354,Lua,https://github.com/macournoyer/neuralconvo,macournoyer,26,2019-05-31T08:42:14Z,Neural conversational model in Torch
89,Lua,treelstm,744,227,Lua,https://github.com/stanfordnlp/treelstm,stanfordnlp,9,2017-07-30T21:01:43Z,Tree-structured Long Short-Term Memory networks (http://arxiv.org/abs/1503.00075)
90,Lua,XNOR-Net,719,221,Lua,https://github.com/allenai/XNOR-Net,allenai,27,2017-12-05T01:39:30Z,ImageNet classification using binary Convolutional Neural Networks
91,Lua,nmap-nse-scripts,716,316,Lua,https://github.com/cldrn/nmap-nse-scripts,cldrn,2,2019-08-05T06:26:44Z,My collection of nmap NSE scripts
92,Lua,MoonGen,707,164,Lua,https://github.com/emmericp/MoonGen,emmericp,31,2019-08-05T15:12:30Z,MoonGen is a fully scriptable high-speed packet generator built on DPDK and LuaJIT. It can saturate a 10 Gbit/s connection with 64 byte packets on a single CPU core while executing user-provided Lua scripts for each packet. Multi-core support allows for even higher rates. It also features precise and accurate timestamping and rate control.
93,Lua,awesome-hammerspoon,707,111,Lua,https://github.com/ashfinal/awesome-hammerspoon,ashfinal,11,2019-02-08T06:13:28Z,awesome configuration for Hammerspoon.
94,Lua,tiefvision,696,182,Lua,https://github.com/paucarre/tiefvision,paucarre,21,2017-03-30T16:28:08Z,End-to-end deep learning image-similarity search engine
95,Lua,resnet-1k-layers,695,209,Lua,https://github.com/KaimingHe/resnet-1k-layers,KaimingHe,1,2017-05-24T17:35:48Z,Deep Residual Networks with 1K Layers
96,Lua,inspect.lua,690,118,Lua,https://github.com/kikito/inspect.lua,kikito,9,2019-04-05T20:07:04Z,Human-readable representation of Lua tables
97,Lua,QuestieDev,681,134,Lua,https://github.com/AeroScripts/QuestieDev,AeroScripts,121,2019-09-06T10:05:57Z,Questie: the vanilla quest helper
98,Lua,im2markup,666,119,Lua,https://github.com/harvardnlp/im2markup,harvardnlp,7,2017-04-28T15:20:33Z,Neural model for converting Image-to-Markup (by Yuntian Deng github.com/da03)
99,Lua,nginx-lua-prometheus,665,98,Lua,https://github.com/knyar/nginx-lua-prometheus,knyar,2,2019-07-21T05:24:40Z,Prometheus metric library for Nginx written in Lua
100,Lua,lua-resty-template,654,154,Lua,https://github.com/bungle/lua-resty-template,bungle,12,2019-07-22T09:36:03Z,Templating Engine (HTML) for Lua and OpenResty.
1,MATLAB,deep-photo-styletransfer,9275,1342,Matlab,https://github.com/luanfujun/deep-photo-styletransfer,luanfujun,29,2017-08-12T08:07:42Z,"Code and data for paper ""Deep Photo Style Transfer"": https://arxiv.org/abs/1703.07511 "
2,MATLAB,PRMLT,4181,1788,MATLAB,https://github.com/PRML/PRMLT,PRML,0,2019-07-25T08:12:43Z,Matlab code for machine learning algorithms in book PRML
3,MATLAB,OpenFace,3866,1296,MATLAB,https://github.com/TadasBaltrusaitis/OpenFace,TadasBaltrusaitis,134,2019-09-01T23:34:23Z,"OpenFace – a state-of-the art tool intended for facial landmark detection, head pose estimation, facial action unit recognition, and eye-gaze estimation."
4,MATLAB,DeepLearnToolbox,3360,2178,Matlab,https://github.com/rasmusbergpalm/DeepLearnToolbox,rasmusbergpalm,82,2018-10-13T18:08:01Z,"Matlab/Octave toolbox for deep learning. Includes Deep Belief Nets, Stacked Autoencoders, Convolutional Neural Nets, Convolutional Autoencoders and vanilla Neural Nets. Each method has examples to get you started."
5,MATLAB,faster_rcnn,2127,1126,Matlab,https://github.com/ShaoqingRen/faster_rcnn,ShaoqingRen,139,2018-07-26T04:26:32Z,Faster R-CNN
6,MATLAB,MTCNN_face_detection_alignment,2092,852,Matlab,https://github.com/kpzhang93/MTCNN_face_detection_alignment,kpzhang93,42,2018-04-04T03:17:19Z,Joint Face Detection and Alignment using Multi-task Cascaded Convolutional Neural Networks
7,MATLAB,OpenTLD,2053,1287,Matlab,https://github.com/zk00006/OpenTLD,zk00006,38,2016-02-01T11:28:11Z,OpenTLD is an open source library for real-time 2D tracking of a single object in video. This repository is no longer under development. For latest version see: http://www.tldvision.com/tld2.html
8,MATLAB,rcnn,1872,884,Matlab,https://github.com/rbgirshick/rcnn,rbgirshick,55,2017-04-03T16:16:14Z,R-CNN: Regions with Convolutional Neural Network Features
9,MATLAB,eviltransform,1771,392,Matlab,https://github.com/googollee/eviltransform,googollee,13,2018-11-23T17:35:39Z,Transport coordinate between earth(WGS-84) and mars in china(GCJ-02).
10,MATLAB,Coding-Guide,1318,179,MATLAB,https://github.com/ecmadao/Coding-Guide,ecmadao,0,2019-05-15T06:25:51Z,自己随手记录的东西
11,MATLAB,crfasrnn,1268,472,MATLAB,https://github.com/torrvision/crfasrnn,torrvision,47,2019-06-05T10:13:53Z,This repository contains the source code for the semantic image segmentation method described in the ICCV 2015 paper: Conditional Random Fields as Recurrent Neural Networks. http://crfasrnn.torr.vision/
12,MATLAB,R-FCN,1129,518,Matlab,https://github.com/daijifeng001/R-FCN,daijifeng001,30,2017-05-05T15:50:59Z,R-FCN: Object Detection via Region-based Fully Convolutional Networks
13,MATLAB,CAM,1002,302,Matlab,https://github.com/metalbubble/CAM,metalbubble,8,2018-05-02T19:30:19Z,Class Activation Mapping
14,MATLAB,tiny,990,305,MATLAB,https://github.com/peiyunh/tiny,peiyunh,10,2019-07-30T19:46:58Z,"Tiny Face Detector, CVPR 2017"
15,MATLAB,machine-learning-coursera-1,934,831,,https://github.com/Borye/machine-learning-coursera-1,Borye,6,2019-07-28T13:49:39Z,This repo is specially created for all the work done my me as a part of Coursera's Machine Learning Course.
16,MATLAB,BPL,904,308,Matlab,https://github.com/brendenlake/BPL,brendenlake,0,2015-12-28T20:48:56Z,Bayesian Program Learning model for one-shot learning
17,MATLAB,matlab2tikz,796,191,MATLAB,https://github.com/matlab2tikz/matlab2tikz,matlab2tikz,209,2019-08-20T08:40:08Z,This program converts MATLAB®/Octave figures to TikZ/pgfplots figures for smooth integration into LaTeX.
18,MATLAB,toolbox,697,470,Matlab,https://github.com/pdollar/toolbox,pdollar,38,2019-05-06T18:46:16Z,Piotr's Image & Video Matlab Toolbox
19,MATLAB,face_verification_experiment,686,329,Matlab,https://github.com/AlfredXiangWu/face_verification_experiment,AlfredXiangWu,2,2017-02-10T09:19:33Z,Original Caffe Version for LightCNN-9. Highly recommend to use Pytorch Version (https://github.com/AlfredXiangWu/LightCNN) 
20,MATLAB,export_fig,684,234,MATLAB,https://github.com/altmany/export_fig,altmany,41,2019-08-06T13:52:13Z,A MATLAB toolbox for exporting publication quality figures
21,MATLAB,omniglot,671,216,MATLAB,https://github.com/brendenlake/omniglot,brendenlake,1,2019-02-13T15:11:01Z,Omniglot data set for one-shot learning
22,MATLAB,Octave,660,411,Matlab,https://github.com/schneems/Octave,schneems,10,2019-07-21T21:17:53Z,"my octave exercises for 2011 stanford machine learning class, posted after the due date of course"
23,MATLAB,edges,600,323,Matlab,https://github.com/pdollar/edges,pdollar,16,2016-07-06T17:58:06Z,Structured Edge Detection Toolbox
24,MATLAB,DnCNN,579,303,MATLAB,https://github.com/cszn/DnCNN,cszn,13,2019-03-30T02:50:05Z,"Beyond a Gaussian Denoiser: Residual Learning of Deep CNN for Image Denoising (TIP, 2017)"
25,MATLAB,convnet-burden,545,78,MATLAB,https://github.com/albanie/convnet-burden,albanie,4,2019-01-17T11:15:00Z,Memory consumption and FLOP count estimates for convnets
26,MATLAB,CNN-for-Image-Retrieval,528,219,MATLAB,https://github.com/willard-yuan/CNN-for-Image-Retrieval,willard-yuan,4,2019-07-14T09:12:22Z,":sunrise:The code of post ""Image retrieval using MatconvNet and pre-trained imageNet"""
27,MATLAB,mexopencv,523,278,Matlab,https://github.com/kyamagu/mexopencv,kyamagu,28,2018-12-16T22:07:19Z,Collection and a development kit of matlab mex functions for OpenCV library
28,MATLAB,voc-dpm,520,301,Matlab,https://github.com/rbgirshick/voc-dpm,rbgirshick,17,2017-04-03T16:06:41Z,Object detection system using deformable part models (DPMs) and latent SVM (voc-release5). You may want to use the latest tarball on my website. The github code may include code changes that have not been tested as thoroughly and will not necessarily reproduce the results on the website.
29,MATLAB,ICNet,509,177,Matlab,https://github.com/hszhao/ICNet,hszhao,23,2017-06-18T07:37:53Z,"ICNet for Real-Time Semantic Segmentation on High-Resolution Images, ECCV2018"
30,MATLAB,siamese-fc,503,208,MATLAB,https://github.com/bertinetto/siamese-fc,bertinetto,33,2019-05-16T10:10:53Z,Arbitrary object tracking at 50-100 FPS with Fully Convolutional Siamese networks.
31,MATLAB,lrslibrary,500,273,Matlab,https://github.com/andrewssobral/lrslibrary,andrewssobral,2,2018-04-08T18:49:08Z,Low-Rank and Sparse Tools for Background Modeling and Subtraction in Videos
32,MATLAB,Gait-Tracking-With-x-IMU,497,300,Matlab,https://github.com/xioTechnologies/Gait-Tracking-With-x-IMU,xioTechnologies,10,2017-08-03T13:31:31Z,
33,MATLAB,activityrecognition,496,252,MATLAB,https://github.com/jindongwang/activityrecognition,jindongwang,0,2019-08-20T05:46:37Z,Resources about activity recognition-行为识别资料
34,MATLAB,Stanford-Machine-Learning-Course,474,339,Matlab,https://github.com/zhouxc/Stanford-Machine-Learning-Course,zhouxc,1,2011-12-25T10:04:23Z,machine learning course programming exercise
35,MATLAB,Detect-Track,456,98,Matlab,https://github.com/feichtenhofer/Detect-Track,feichtenhofer,19,2018-07-03T16:38:41Z,"Code release for ""Detect to Track and Track to Detect"", ICCV 2017"
36,MATLAB,machine-learning-octave,452,112,MATLAB,https://github.com/trekhleb/machine-learning-octave,trekhleb,0,2018-12-22T08:52:56Z,🤖 MatLab/Octave examples of popular machine learning algorithms with code examples and mathematics being explained
37,MATLAB,SemanticSoftSegmentation,448,125,Matlab,https://github.com/yaksoy/SemanticSoftSegmentation,yaksoy,4,2018-07-30T12:54:45Z,"Spectral segmentation described in Aksoy et al., ""Semantic Soft Segmentation"", ACM TOG (Proc. SIGGRAPH), 2018"
38,MATLAB,ECO,441,207,MATLAB,https://github.com/martin-danelljan/ECO,martin-danelljan,8,2019-07-30T17:27:38Z,Matlab implementation of the ECO tracker.
39,MATLAB,refinenet,441,142,MATLAB,https://github.com/guosheng/refinenet,guosheng,0,2019-06-01T05:40:49Z, RefineNet: Multi-Path Refinement Networks for High-Resolution Semantic Segmentation
40,MATLAB,SFD,438,128,Matlab,https://github.com/sfzhang15/SFD,sfzhang15,0,2018-10-17T15:02:16Z,"S³FD: Single Shot Scale-invariant Face Detector, ICCV, 2017"
41,MATLAB,cfnet,430,135,Matlab,https://github.com/bertinetto/cfnet,bertinetto,22,2018-05-31T13:59:08Z,[CVPR'17] Training a Correlation Filter end-to-end allows lightweight networks of 2 layers (600 kB) to high performance at fast speed..
42,MATLAB,FaceVerification,418,233,Matlab,https://github.com/happynear/FaceVerification,happynear,54,2018-01-16T10:23:24Z,"An Experimental Implementation of Face Verification, 96.8% on LFW."
43,MATLAB,VAD,406,129,MATLAB,https://github.com/jtkim-kaist/VAD,jtkim-kaist,24,2019-02-10T16:47:27Z,"Voice activity detection (VAD) toolkit including DNN, bDNN, LSTM and ACAM based VAD. We also provide our directly recorded dataset."
44,MATLAB,hashing-baseline-for-image-retrieval,398,221,MATLAB,https://github.com/willard-yuan/hashing-baseline-for-image-retrieval,willard-yuan,2,2019-07-14T09:23:45Z,:octocat:Various hashing methods for image retrieval and serves as the baselines
45,MATLAB,exemplarsvm,395,160,Matlab,https://github.com/quantombone/exemplarsvm,quantombone,23,2015-10-24T17:52:03Z,Ensemble of Exemplar-SVMs for Object Detection and Beyond
46,MATLAB,AMSoftmax,393,112,Matlab,https://github.com/happynear/AMSoftmax,happynear,6,2018-08-03T02:13:10Z,A simple yet effective loss function for face verification.
47,MATLAB,Algorithms_MathModels,376,162,MATLAB,https://github.com/HuangCongQing/Algorithms_MathModels,HuangCongQing,0,2019-07-28T08:28:46Z,【国赛】【美赛】数学建模相关算法 MATLAB实现
48,MATLAB,SelfExSR,374,185,Matlab,https://github.com/jbhuang0604/SelfExSR,jbhuang0604,5,2016-05-31T16:29:23Z,Single Image Super-Resolution from Transformed Self-Exemplars (CVPR 2015)
49,MATLAB,fashion-detection,366,92,MATLAB,https://github.com/liuziwei7/fashion-detection,liuziwei7,5,2019-02-27T05:45:06Z,Fashion Detection in the Wild (Deep Clothes Detector)
