rank,item,repo_name,stars,forks,language,repo_url,username,issues,last_commit,description
75,Java,GSYVideoPlayer,10380,2341,Java,https://github.com/CarGuo/GSYVideoPlayer,CarGuo,16,2019-06-14T03:53:34Z,"视频播放器（IJKplayer、ExoPlayer、MediaPlayer），HTTPS支持，支持弹幕，支持滤镜、水印、gif截图，片头广告、中间广告，多个同时播放，支持基本的拖动，声音、亮度调节，支持边播边缓存，支持视频本身自带rotation的旋转（90,270之类），重力旋转与手动旋转的同步支持，支持列表播放 ，直接添加控件为封面，列表全屏动画，视频加载速度，列表小窗口支持拖动，动画效果，调整比例，多分辨率切换，支持切换播放器，进度条小窗口预览，列表切换详情页面无缝播放，其他一些小动画效果，rtsp、concat、mpeg。项目解析： "
76,Java,react-native-navigation,10358,2245,Java,https://github.com/wix/react-native-navigation,wix,151,2019-06-14T06:59:24Z,A complete native navigation solution for React Native
77,Java,HikariCP,10233,1560,Java,https://github.com/brettwooldridge/HikariCP,brettwooldridge,139,2019-06-14T16:41:41Z,"光 HikariCP・A solid, high-performance, JDBC connection pool at last."
78,Java,bytecode-viewer,10231,647,Java,https://github.com/Konloch/bytecode-viewer,Konloch,34,2019-06-14T13:41:20Z,"A Java 8+ Jar & Android APK Reverse Engineering Suite (Decompiler, Editor, Debugger & More)"
79,Java,Luban,10147,1771,Java,https://github.com/Curzibn/Luban,Curzibn,97,2019-05-03T01:10:03Z,Luban(鲁班)—Image compression with efficiency very close to WeChat Moments/可能是最接近微信朋友圈的图片压缩算法
80,Java,ViewPagerIndicator,10118,4236,Java,https://github.com/JakeWharton/ViewPagerIndicator,JakeWharton,215,2017-11-26T17:13:46Z,Paging indicator widgets compatible with the ViewPager from the Android Support Library and ActionBarSherlock.
81,Java,Android-PickerView,10062,2554,Java,https://github.com/Bigkoo/Android-PickerView,Bigkoo,244,2019-05-25T13:27:38Z,"This is a picker view for android , support linkage effect, timepicker and optionspicker.（时间选择器、省市区三级联动）"
82,Java,ARouter,9973,1667,Java,https://github.com/alibaba/ARouter,alibaba,57,2019-05-09T03:49:45Z,💪 A framework for assisting in the renovation of Android componentization (帮助 Android App 进行组件化改造的路由框架)
83,Java,VasSonic,9834,1359,Java,https://github.com/Tencent/VasSonic,Tencent,12,2019-06-12T14:10:15Z,"VasSonic is a lightweight and high-performance Hybrid framework developed by tencent VAS team, which is intended to speed up the first screen of websites working on Android and iOS platform. "
84,Java,vert.x,9758,1544,Java,https://github.com/eclipse-vertx/vert.x,eclipse-vertx,208,2019-06-14T13:06:54Z,Vert.x is a tool-kit for building reactive applications on the JVM
85,Java,springboot-learning-example,9673,5073,Java,https://github.com/JeffLi1993/springboot-learning-example,JeffLi1993,1,2019-06-12T16:40:02Z,spring boot 实践学习案例，是 spring boot 初学者及核心技术巩固的最佳实践。
86,Java,Matisse,9632,1447,Java,https://github.com/zhihu/Matisse,zhihu,280,2019-04-10T16:19:53Z,:fireworks: A well-designed local image and video selector for Android
87,Java,android-Ultra-Pull-To-Refresh,9620,2832,Java,https://github.com/liaohuqiu/android-Ultra-Pull-To-Refresh,liaohuqiu,174,2018-05-04T21:12:00Z,Ultra Pull to Refresh for Android. Support all the views.
88,Java,vlayout,9541,1649,Java,https://github.com/alibaba/vlayout,alibaba,140,2019-05-22T03:38:51Z,"Project vlayout is a powerfull LayoutManager extension for RecyclerView, it provides a group of layouts for RecyclerView. Make it able to handle a complicate situation when grid, list and other layouts in the same recyclerview. "
89,Java,cat,9511,3370,Java,https://github.com/dianping/cat,dianping,25,2019-05-31T06:17:59Z,"CAT 作为服务端项目基础组件，提供了 Java, C/C++, Node.js, Python, Go 等多语言客户端，已经在美团点评的基础架构中间件框架（MVC框架，RPC框架，数据库框架，缓存框架等，消息队列，配置系统等）深度集成，为美团点评各业务线提供系统丰富的性能指标、健康状况、实时告警等。"
90,Java,seata,9476,2294,Java,https://github.com/seata/seata,seata,175,2019-06-15T02:36:39Z,":fire: Seata is an easy-to-use, high-performance, open source distributed transaction solution."
91,Java,redisson,9452,2321,Java,https://github.com/redisson/redisson,redisson,168,2019-06-14T14:52:20Z,"Redisson - Redis Java client with features of In-Memory Data Grid. Supports over 30 objects and services: Set, Multimap, SortedSet, Map, List, Queue, Deque, Semaphore, Lock, AtomicLong, Map Reduce, Publish / Subscribe, Bloom filter, Spring Cache, Tomcat, Scheduler, JCache API, Hibernate, RPC."
92,Java,PocketHub,9424,3657,Java,https://github.com/pockethub/PocketHub,pockethub,113,2019-03-18T19:05:35Z,PocketHub Android App
93,Java,Android-ObservableScrollView,9372,2104,Java,https://github.com/ksoichiro/Android-ObservableScrollView,ksoichiro,178,2017-08-09T11:37:19Z,Android library to observe scroll events on scrollable views.
94,Java,graal,9352,584,Java,https://github.com/oracle/graal,oracle,378,2019-06-14T20:56:55Z,GraalVM: Run Programs Faster Anywhere :rocket:
95,Java,RxTool,9302,2304,Java,https://github.com/vondear/RxTool,vondear,107,2019-04-26T06:01:22Z,Android开发人员不得不收集的工具类集合 | 支付宝支付 | 微信支付（统一下单） | 微信分享 | Zip4j压缩（支持分卷压缩与加密） | 一键集成UCrop选择圆形头像 | 一键集成二维码和条形码的扫描与生成 | 常用Dialog | WebView的封装可播放视频 | 仿斗鱼滑动验证码 | Toast封装 | 震动 | GPS | Location定位 | 图片缩放 | Exif 图片添加地理位置信息（经纬度） | 蛛网等级 | 颜色选择器 | ArcGis | VTPK | 编译运行一下说不定会找到惊喜
96,Java,dbeaver,9297,774,Java,https://github.com/dbeaver/dbeaver,dbeaver,1193,2019-06-14T18:58:21Z,Free universal database tool and SQL client
97,Java,Arduino,9274,6526,Java,https://github.com/arduino/Arduino,arduino,1125,2019-06-14T17:01:29Z,open-source electronics prototyping platform
98,Java,okhttp-OkGo,9257,2252,Java,https://github.com/jeasonlzy/okhttp-OkGo,jeasonlzy,373,2019-04-03T01:41:41Z,OkGo - 3.0 震撼来袭，该库是基于 Http 协议，封装了 OkHttp 的网络请求框架，比 Retrofit 更简单易用，支持 RxJava，RxJava2，支持自定义缓存，支持批量断点下载管理和批量上传管理功能
99,Java,recyclerview-animators,9244,1792,Java,https://github.com/wasabeef/recyclerview-animators,wasabeef,99,2018-11-16T07:20:43Z,An Android Animation library which easily add itemanimator to RecyclerView items.
100,Java,JiaoZiVideoPlayer,9204,2177,Java,https://github.com/lipangit/JiaoZiVideoPlayer,lipangit,163,2019-06-14T17:30:19Z,Android VideoPlayer MediaPlayer VideoView MediaView Float View And Fullscreen.高度自定义的开源安卓视频框架
1,JavaScript,freeCodeCamp,303405,22082,JavaScript,https://github.com/freeCodeCamp/freeCodeCamp,freeCodeCamp,1851,2019-06-14T20:40:58Z,The https://www.freeCodeCamp.org open source codebase and curriculum. Learn to code for free together with millions of people.
2,JavaScript,vue,141329,20346,JavaScript,https://github.com/vuejs/vue,vuejs,298,2019-06-14T14:24:27Z,"🖖 Vue.js is a progressive, incrementally-adoptable JavaScript framework for building UI on the web."
3,JavaScript,bootstrap,134018,65692,JavaScript,https://github.com/twbs/bootstrap,twbs,378,2019-06-14T10:46:33Z,"The most popular HTML, CSS, and JavaScript framework for developing responsive, mobile first projects on the web."
4,JavaScript,react,131048,24135,JavaScript,https://github.com/facebook/react,facebook,714,2019-06-15T01:08:24Z,"A declarative, efficient, and flexible JavaScript library for building user interfaces."
5,JavaScript,javascript,86173,16522,JavaScript,https://github.com/airbnb/javascript,airbnb,137,2019-06-10T20:51:23Z,JavaScript Style Guide
6,JavaScript,d3,85322,20891,JavaScript,https://github.com/d3/d3,d3,9,2019-05-02T14:23:43Z,"Bring data to life with SVG, Canvas and HTML. :bar_chart::chart_with_upwards_trend::tada:"
7,JavaScript,react-native,78108,17431,JavaScript,https://github.com/facebook/react-native,facebook,534,2019-06-15T02:07:04Z,A framework for building native apps with React.
8,JavaScript,create-react-app,68579,15535,JavaScript,https://github.com/facebook/create-react-app,facebook,386,2019-06-14T18:14:07Z,Set up a modern web app by running one command.
9,JavaScript,node,62057,13932,JavaScript,https://github.com/nodejs/node,nodejs,958,2019-06-15T00:02:49Z,Node.js JavaScript runtime :sparkles::turtle::rocket::sparkles:
10,JavaScript,axios,60735,4908,JavaScript,https://github.com/axios/axios,axios,652,2019-06-13T21:38:28Z,Promise based HTTP client for the browser and node.js
11,JavaScript,Font-Awesome,60068,10159,JavaScript,https://github.com/FortAwesome/Font-Awesome,FortAwesome,4803,2019-06-05T13:56:25Z,"The iconic SVG, font, and CSS toolkit"
12,JavaScript,angular.js,59572,28865,JavaScript,https://github.com/angular/angular.js,angular,461,2019-06-06T08:34:15Z,AngularJS - HTML enhanced for web apps!
13,JavaScript,three.js,52369,19727,JavaScript,https://github.com/mrdoob/three.js,mrdoob,885,2019-06-14T20:39:41Z,JavaScript 3D library.
14,JavaScript,jquery,51763,18226,JavaScript,https://github.com/jquery/jquery,jquery,82,2019-06-13T13:17:12Z,jQuery JavaScript Library
15,JavaScript,puppeteer,50292,4604,JavaScript,https://github.com/GoogleChrome/puppeteer,GoogleChrome,403,2019-06-15T02:31:48Z,Headless Chrome Node API
16,JavaScript,javascript-algorithms,49735,7232,JavaScript,https://github.com/trekhleb/javascript-algorithms,trekhleb,94,2019-06-01T20:39:39Z,📝 Algorithms and data structures implemented in JavaScript with explanations and links to further readings
17,JavaScript,webpack,49390,6204,JavaScript,https://github.com/webpack/webpack,webpack,503,2019-06-14T19:09:50Z,"A bundler for javascript and friends. Packs many modules into a few bundled assets. Code Splitting allows for loading parts of the application on demand. Through ""loaders"", modules can be CommonJs, AMD, ES6 modules, CSS, Images, JSON, Coffeescript, LESS, ... and your custom stuff."
18,JavaScript,redux,49128,12640,JavaScript,https://github.com/reduxjs/redux,reduxjs,29,2019-06-07T19:18:05Z,Predictable state container for JavaScript apps
19,JavaScript,atom,48997,11925,JavaScript,https://github.com/atom/atom,atom,663,2019-06-14T22:07:19Z,:atom: The hackable text editor
20,JavaScript,material-ui,47922,10670,JavaScript,https://github.com/mui-org/material-ui,mui-org,329,2019-06-14T23:00:22Z,"React components for faster and easier web development. Build your own design system, or start with Material Design."
21,JavaScript,reveal.js,46837,13616,JavaScript,https://github.com/hakimel/reveal.js,hakimel,467,2019-06-10T05:41:13Z,The HTML Presentation Framework
22,JavaScript,socket.io,46638,8530,JavaScript,https://github.com/socketio/socket.io,socketio,397,2019-06-10T14:01:52Z,Realtime application framework (Node.JS server)
23,JavaScript,30-seconds-of-code,45878,5164,JavaScript,https://github.com/30-seconds/30-seconds-of-code,30-seconds,7,2019-06-14T15:58:22Z,A curated collection of useful JavaScript snippets that you can understand in 30 seconds or less.
24,JavaScript,Semantic-UI,45712,4831,JavaScript,https://github.com/Semantic-Org/Semantic-UI,Semantic-Org,903,2019-06-03T08:44:31Z,Semantic is a UI component framework based around useful principles from natural language.
25,JavaScript,express,44298,7445,JavaScript,https://github.com/expressjs/express,expressjs,164,2019-06-14T20:45:17Z,"Fast, unopinionated, minimalist web framework for node."
26,JavaScript,Chart.js,43926,9652,JavaScript,https://github.com/chartjs/Chart.js,chartjs,449,2019-06-14T23:33:41Z,Simple HTML5 Charts using the <canvas> tag
27,JavaScript,html5-boilerplate,42921,10213,JavaScript,https://github.com/h5bp/html5-boilerplate,h5bp,1,2019-06-11T02:34:21Z,"A professional front-end template for building fast, robust, and adaptable web apps or sites."
28,JavaScript,moment,41468,6232,JavaScript,https://github.com/moment/moment,moment,334,2019-06-13T09:12:18Z,"Parse, validate, manipulate, and display dates in javascript."
29,JavaScript,meteor,41122,5037,JavaScript,https://github.com/meteor/meteor,meteor,333,2019-06-12T12:17:29Z,"Meteor, the JavaScript App Platform"
30,JavaScript,resume.github.com,41066,1090,JavaScript,https://github.com/resume/resume.github.com,resume,35,2018-12-29T23:17:05Z,Resumes generated using the GitHub informations
31,JavaScript,json-server,40754,3625,JavaScript,https://github.com/typicode/json-server,typicode,440,2019-06-05T12:50:48Z,Get a full fake REST API with zero coding in less than 30 seconds (seriously)
32,JavaScript,lodash,39629,4115,JavaScript,https://github.com/lodash/lodash,lodash,7,2019-06-11T18:38:31Z,"A modern JavaScript utility library delivering modularity, performance, & extras."
33,JavaScript,storybook,38746,3174,JavaScript,https://github.com/storybookjs/storybook,storybookjs,381,2019-06-15T01:50:57Z,"UI component dev & test: React, Vue, Angular, React Native, Ember, Web Components & more!"
34,JavaScript,markdown-here,38609,6616,JavaScript,https://github.com/adam-p/markdown-here,adam-p,241,2019-05-11T14:08:34Z,"Google Chrome, Firefox, and Thunderbird extension that lets you write email in Markdown and render it before sending."
35,JavaScript,next.js,38128,4573,JavaScript,https://github.com/zeit/next.js,zeit,200,2019-06-14T18:48:58Z,The React Framework
36,JavaScript,react-router,36569,7508,JavaScript,https://github.com/ReactTraining/react-router,ReactTraining,58,2019-06-14T19:55:13Z,Declarative routing for React
37,JavaScript,yarn,36036,2199,JavaScript,https://github.com/yarnpkg/yarn,yarnpkg,1847,2019-06-14T18:38:49Z,"📦🐈 Fast, reliable, and secure dependency management."
38,JavaScript,materialize,35941,4795,JavaScript,https://github.com/Dogfalo/materialize,Dogfalo,668,2019-06-11T09:55:30Z,"Materialize, a CSS Framework based on Material Design"
39,JavaScript,gatsby,35570,5202,JavaScript,https://github.com/gatsbyjs/gatsby,gatsbyjs,517,2019-06-15T00:50:15Z,"Build blazing fast, modern apps and websites with React"
40,JavaScript,hacker-scripts,35470,5990,JavaScript,https://github.com/NARKOZ/hacker-scripts,NARKOZ,53,2019-05-02T05:23:36Z,Based on a true story
41,JavaScript,impress.js,34861,6821,JavaScript,https://github.com/impress/impress.js,impress,55,2019-06-13T10:27:41Z,It's a presentation framework based on the power of CSS3 transforms and transitions in modern browsers and inspired by the idea behind prezi.com.
42,JavaScript,incubator-echarts,34725,10340,JavaScript,https://github.com/apache/incubator-echarts,apache,3289,2019-06-14T05:14:34Z,"A powerful, interactive charting and visualization library for browser"
43,JavaScript,Front-End-Checklist,34689,3348,JavaScript,https://github.com/thedaviddias/Front-End-Checklist,thedaviddias,5,2019-06-09T23:15:23Z,🗂 The perfect Front-End Checklist for modern websites and meticulous developers
44,JavaScript,babel,33444,3563,JavaScript,https://github.com/babel/babel,babel,772,2019-06-15T02:58:02Z,🐠 Babel is a compiler for writing next generation JavaScript.
45,JavaScript,prettier,32323,1777,JavaScript,https://github.com/prettier/prettier,prettier,649,2019-06-14T17:08:04Z,Prettier is an opinionated code formatter.
46,JavaScript,awesome-selfhosted,32191,2603,JavaScript,https://github.com/Kickball/awesome-selfhosted,Kickball,60,2019-06-14T07:40:38Z,This is a list of Free Software network services and web applications which can be hosted locally. Selfhosting is the process of locally hosting and managing applications instead of renting from SaaS providers.
47,JavaScript,parcel,32032,1462,JavaScript,https://github.com/parcel-bundler/parcel,parcel-bundler,696,2019-06-14T20:59:12Z,"📦🚀 Blazing fast, zero configuration web application bundler"
48,JavaScript,anime,31407,2318,JavaScript,https://github.com/juliangarnier/anime,juliangarnier,104,2019-06-06T09:13:46Z,JavaScript animation engine
49,JavaScript,gulp,31262,4401,JavaScript,https://github.com/gulpjs/gulp,gulpjs,20,2019-06-14T06:28:03Z,The streaming build system
50,JavaScript,serverless,30422,3364,JavaScript,https://github.com/serverless/serverless,serverless,550,2019-06-15T00:18:25Z,"Serverless Framework – Build web, mobile and IoT applications with serverless architectures using AWS Lambda, Azure Functions, Google CloudFunctions & more! – "
51,JavaScript,nodebestpractices,30304,2378,JavaScript,https://github.com/i0natan/nodebestpractices,i0natan,43,2019-06-11T12:09:48Z,:white_check_mark: The largest Node.js best practices list (May 2019)
52,JavaScript,Ghost,30140,6512,JavaScript,https://github.com/TryGhost/Ghost,TryGhost,87,2019-06-14T13:23:51Z,👻 The most popular headless Node.js CMS for professional publishing
53,JavaScript,hyper,30048,2457,JavaScript,https://github.com/zeit/hyper,zeit,845,2019-06-13T23:28:28Z,A terminal built on web technologies
54,JavaScript,jQuery-File-Upload,30048,7984,JavaScript,https://github.com/blueimp/jQuery-File-Upload,blueimp,53,2019-06-13T02:41:52Z,"File Upload widget with multiple file selection, drag&drop support, progress bar, validation and preview images, audio and video for jQuery. Supports cross-domain, chunked and resumable file uploads. Works with any server-side platform (Google App Engine, PHP, Python, Ruby on Rails, Java, etc.) that supports standard HTML form file uploads."
55,JavaScript,brackets,29850,6410,JavaScript,https://github.com/adobe/brackets,adobe,2459,2019-06-05T06:14:45Z,"An open source code editor for the web, written in JavaScript, HTML and CSS."
56,JavaScript,pm2,29493,1983,JavaScript,https://github.com/Unitech/pm2,Unitech,699,2019-06-09T07:24:15Z,Node.js Production Process Manager with a built-in Load Balancer.
57,JavaScript,awesome-mac,29431,3363,JavaScript,https://github.com/jaywcjlove/awesome-mac,jaywcjlove,40,2019-06-07T15:45:47Z," Now we have become very big, Different from the original idea. Collect premium software in various categories."
58,JavaScript,tech-interview-handbook,28101,3888,JavaScript,https://github.com/yangshun/tech-interview-handbook,yangshun,8,2019-06-05T13:36:20Z,"💯 Algorithms study materials, behavioral content and tips for rocking your coding interview"
59,JavaScript,33-js-concepts,27789,2725,JavaScript,https://github.com/leonardomso/33-js-concepts,leonardomso,5,2019-06-14T12:49:36Z,📜 33 concepts every JavaScript developer should know.
60,JavaScript,immutable-js,27589,1602,JavaScript,https://github.com/immutable-js/immutable-js,immutable-js,135,2019-05-30T14:47:09Z,Immutable persistent data collections for Javascript which increase efficiency and simplicity.
61,JavaScript,backbone,27500,5716,JavaScript,https://github.com/jashkenas/backbone,jashkenas,82,2019-05-13T13:07:23Z,"Give your JS App some Backbone with Models, Views, Collections, and Events"
62,JavaScript,realworld,27227,1839,JavaScript,https://github.com/gothinkster/realworld,gothinkster,140,2019-06-14T18:51:27Z,"""The mother of all demo apps"" — Exemplary fullstack Medium.com clone powered by React, Angular, Node, Django, and many more 🏅"
63,JavaScript,slate,27199,16888,JavaScript,https://github.com/lord/slate,lord,29,2019-06-14T12:29:22Z,Beautiful static documentation for your API
64,JavaScript,pdf.js,26920,6408,JavaScript,https://github.com/mozilla/pdf.js,mozilla,618,2019-06-14T06:03:56Z,PDF Reader in JavaScript
65,JavaScript,hexo,26824,3568,JavaScript,https://github.com/hexojs/hexo,hexojs,204,2019-06-13T08:16:04Z,"A fast, simple & powerful blog framework, powered by Node.js."
66,JavaScript,hackathon-starter,26803,5498,JavaScript,https://github.com/sahat/hackathon-starter,sahat,16,2019-06-11T19:48:36Z,A boilerplate for Node.js web applications
67,JavaScript,fullPage.js,26747,6422,JavaScript,https://github.com/alvarotrigo/fullPage.js,alvarotrigo,148,2019-06-10T15:49:14Z,fullPage plugin by Alvaro Trigo. Create full screen pages fast and simple
68,JavaScript,koa,26354,2394,JavaScript,https://github.com/koajs/koa,koajs,44,2019-06-10T06:49:54Z,Expressive middleware for node.js using ES2017 async functions
69,JavaScript,clipboard.js,26221,3078,JavaScript,https://github.com/zenorocha/clipboard.js,zenorocha,66,2019-06-03T12:57:01Z,:scissors: Modern copy to clipboard. No Flash. Just 3kb gzipped :clipboard:
70,JavaScript,jest,25990,3528,JavaScript,https://github.com/facebook/jest,facebook,661,2019-06-15T01:07:46Z,Delightful JavaScript Testing.
71,JavaScript,async,25703,2326,JavaScript,https://github.com/caolan/async,caolan,7,2019-05-29T17:16:23Z,Async utilities for node and the browser
72,JavaScript,todomvc,25500,13420,JavaScript,https://github.com/tastejs/todomvc,tastejs,151,2019-05-27T23:23:50Z,"Helping you select an MV* framework - Todo apps for React.js, Ember.js, Angular, and many more"
73,JavaScript,video.js,25232,6009,JavaScript,https://github.com/videojs/video.js,videojs,207,2019-06-14T15:41:22Z,Video.js - open source HTML5 & Flash video player
74,JavaScript,Leaflet,25033,4094,JavaScript,https://github.com/Leaflet/Leaflet,Leaflet,436,2019-06-14T14:03:29Z, :leaves: JavaScript library for mobile-friendly interactive maps
75,JavaScript,phaser,24931,5962,JavaScript,https://github.com/photonstorm/phaser,photonstorm,208,2019-06-14T20:20:50Z,"Phaser is a fun, free and fast 2D game framework for making HTML5 games for desktop and mobile web browsers, supporting Canvas and WebGL rendering."
76,JavaScript,incubator-superset,24795,4744,JavaScript,https://github.com/apache/incubator-superset,apache,316,2019-06-14T20:39:49Z,"Apache Superset (incubating) is a modern, enterprise-ready business intelligence web application"
77,JavaScript,pixi.js,24687,3451,JavaScript,https://github.com/pixijs/pixi.js,pixijs,114,2019-06-14T18:10:08Z,"The HTML5 Creation Engine: Create beautiful digital content with the fastest, most flexible 2D WebGL renderer."
78,JavaScript,underscore,24579,5412,JavaScript,https://github.com/jashkenas/underscore,jashkenas,122,2019-05-28T13:42:14Z,JavaScript's utility _ belt
79,JavaScript,awesome-react-native,24446,2992,JavaScript,https://github.com/jondot/awesome-react-native,jondot,16,2019-06-12T20:31:58Z,"Awesome React Native components, news, tools, and learning material!"
80,JavaScript,nylas-mail,24376,1376,JavaScript,https://github.com/nylas/nylas-mail,nylas,1044,2019-05-27T23:06:25Z,:love_letter: An extensible desktop mail app built on the modern web.  Forks welcome!
81,JavaScript,styled-components,24299,1433,JavaScript,https://github.com/styled-components/styled-components,styled-components,72,2019-06-15T01:01:25Z,Visual primitives for the component age. Use the best bits of ES6 and CSS to style your apps without stress 💅
82,JavaScript,slick,23974,4810,JavaScript,https://github.com/kenwheeler/slick,kenwheeler,1097,2019-05-16T23:07:40Z,the last carousel you'll ever need
83,JavaScript,mermaid,23800,1417,JavaScript,https://github.com/knsv/mermaid,knsv,279,2019-06-14T14:30:27Z,Generation of diagram and flowchart from text in a similar manner as markdown
84,JavaScript,Modernizr,23703,3042,JavaScript,https://github.com/Modernizr/Modernizr,Modernizr,192,2019-06-13T09:56:47Z,Modernizr is a JavaScript library that detects HTML5 and CSS3 features in the user’s browser.
85,JavaScript,select2,23658,5620,JavaScript,https://github.com/select2/select2,select2,88,2019-06-06T19:55:23Z,"Select2 is a jQuery based replacement for select boxes. It supports searching, remote data sets, and infinite scrolling of results."
86,JavaScript,clean-code-javascript,23360,2535,JavaScript,https://github.com/ryanmcdermott/clean-code-javascript,ryanmcdermott,25,2019-03-24T21:13:45Z,:bathtub: Clean Code concepts adapted for JavaScript
87,JavaScript,quill,23071,1739,JavaScript,https://github.com/quilljs/quill,quilljs,574,2019-06-13T15:04:45Z,Quill is a modern WYSIWYG editor built for compatibility and extensibility.
88,JavaScript,Rocket.Chat,22994,4950,JavaScript,https://github.com/RocketChat/Rocket.Chat,RocketChat,2312,2019-06-15T01:46:03Z,The ultimate Free Open Source Solution for team communications.
89,JavaScript,preact,22884,1187,JavaScript,https://github.com/preactjs/preact,preactjs,119,2019-06-15T02:08:22Z,⚛️ Fast 3kB React alternative with the same modern API. Components & Virtual DOM.
90,JavaScript,request,22808,2677,JavaScript,https://github.com/request/request,request,252,2019-06-09T00:26:43Z,🏊🏾 Simplified HTTP request client.
91,JavaScript,react-boilerplate,22699,4527,JavaScript,https://github.com/react-boilerplate/react-boilerplate,react-boilerplate,16,2019-06-05T11:50:59Z,":fire: A highly scalable, offline-first foundation with the best developer experience and a focus on performance and best practices."
92,JavaScript,fetch,22175,2087,JavaScript,https://github.com/github/fetch,github,10,2019-05-24T11:04:10Z,A window.fetch JavaScript polyfill.
93,JavaScript,dayjs,21847,988,JavaScript,https://github.com/iamkun/dayjs,iamkun,43,2019-06-13T02:24:16Z,⏰ Day.js 2KB immutable date library alternative to Moment.js with the same modern API
94,JavaScript,500lines,21805,4972,JavaScript,https://github.com/aosabook/500lines,aosabook,47,2019-03-02T12:07:52Z,500 Lines or Less
95,JavaScript,standard,21320,1616,JavaScript,https://github.com/standard/standard,standard,90,2019-06-10T07:02:14Z,"🌟 JavaScript Style Guide, with linter & automatic code fixer"
96,JavaScript,vue-cli,21235,3527,JavaScript,https://github.com/vuejs/vue-cli,vuejs,379,2019-06-14T23:33:20Z,🛠️ Standard Tooling for Vue.js Development
97,JavaScript,ember.js,21035,4173,JavaScript,https://github.com/emberjs/ember.js,emberjs,267,2019-06-14T19:19:13Z,Ember.js - A JavaScript framework for creating ambitious web applications
