rank,item,repo_name,stars,forks,language,repo_url,username,issues,last_commit,description
85,Java,recyclerview-animators,8855,1742,Java,https://github.com/wasabeef/recyclerview-animators,wasabeef,97,2018-11-16T07:20:43Z,An Android Animation library which easily add itemanimator to RecyclerView items.
86,Java,Arduino,8841,6429,Java,https://github.com/arduino/Arduino,arduino,1043,2019-01-28T17:33:04Z,open-source electronics prototyping platform
87,Java,Android-PullToRefresh,8776,5071,Java,https://github.com/chrisbanes/Android-PullToRefresh,chrisbanes,30,2017-10-13T08:40:58Z,DEPRECATED
88,Java,GSYVideoPlayer,8756,1981,Java,https://github.com/CarGuo/GSYVideoPlayer,CarGuo,18,2019-01-15T03:20:20Z,"视频播放器（IJKplayer、ExoPlayer、MediaPlayer），HTTPS支持，支持弹幕，支持滤镜、水印、gif截图，片头广告、中间广告，多个同时播放，支持基本的拖动，声音、亮度调节，支持边播边缓存，支持视频本身自带rotation的旋转（90,270之类），重力旋转与手动旋转的同步支持，支持列表播放 ，直接添加控件为封面，列表全屏动画，视频加载速度，列表小窗口支持拖动，动画效果，调整比例，多分辨率切换，支持切换播放器，进度条小窗口预览，列表切换详情页面无缝播放，其他一些小动画效果，rtsp、concat、mpeg。项目解析： "
89,Java,okhttp-OkGo,8753,2170,Java,https://github.com/jeasonlzy/okhttp-OkGo,jeasonlzy,333,2018-08-09T02:48:24Z,OkGo - 3.0 震撼来袭，该库是基于 Http 协议，封装了 OkHttp 的网络请求框架，比 Retrofit 更简单易用，支持 RxJava，RxJava2，支持自定义缓存，支持批量断点下载管理和批量上传管理功能
90,Java,ARouter,8730,1449,Java,https://github.com/alibaba/ARouter,alibaba,36,2019-01-24T17:40:19Z,💪 A framework for assisting in the renovation of Android componentization (帮助 Android App 进行组件化改造的路由框架)
91,Java,Matisse,8725,1305,Java,https://github.com/zhihu/Matisse,zhihu,246,2019-01-20T16:03:41Z,:fireworks: A well-designed local image and video selector for Android
92,Java,presto,8626,2925,Java,https://github.com/prestodb/presto,prestodb,1430,2019-01-30T03:31:58Z,Distributed SQL query engine for big data
93,Java,PermissionsDispatcher,8533,1202,Java,https://github.com/permissions-dispatcher/PermissionsDispatcher,permissions-dispatcher,0,2019-01-22T15:30:25Z,Simple annotation-based API to handle runtime permissions.
94,Java,hadoop,8529,5328,Java,https://github.com/apache/hadoop,apache,202,2019-01-30T02:30:58Z,Mirror of Apache Hadoop
95,Java,JiaoZiVideoPlayer,8464,2033,Java,https://github.com/lipangit/JiaoZiVideoPlayer,lipangit,59,2019-01-23T08:38:55Z,Android VideoPlayer MediaPlayer VideoView MediaView Float View And Fullscreen
96,Java,RxTool,8424,2121,Java,https://github.com/vondear/RxTool,vondear,117,2018-11-02T09:50:47Z,Android开发人员不得不收集的工具类集合 | 支付宝支付 | 微信支付（统一下单） | 微信分享 | Zip4j压缩（支持分卷压缩与加密） | 一键集成UCrop选择圆形头像 | 一键集成二维码和条形码的扫描与生成 | 常用Dialog | WebView的封装可播放视频 | 仿斗鱼滑动验证码 | Toast封装 | 震动 | GPS | Location定位 | 图片缩放 | Exif 图片添加地理位置信息（经纬度） | 蛛网等级 | 颜色选择器 | ArcGis | VTPK | 编译运行一下说不定会找到惊喜
97,Java,AppIntro,8332,1516,Java,https://github.com/AppIntro/AppIntro,AppIntro,68,2019-01-26T14:51:04Z,Make a cool intro for your Android app.
98,Java,AVLoadingIndicatorView,8329,1655,Java,https://github.com/81813780/AVLoadingIndicatorView,81813780,62,2018-04-24T02:59:27Z,DEPRECATED
99,Java,AndroidSlidingUpPanel,8245,2214,Java,https://github.com/umano/AndroidSlidingUpPanel,umano,277,2018-10-22T15:51:54Z,This library provides a simple way to add a draggable sliding up panel (popularized by Google Music and Google Maps) to your Android application. Brought to you by Umano.
100,Java,platform_frameworks_base,8232,5385,Java,https://github.com/aosp-mirror/platform_frameworks_base,aosp-mirror,0,2018-09-05T21:52:03Z,
1,JavaScript,freeCodeCamp,297140,20821,JavaScript,https://github.com/freeCodeCamp/freeCodeCamp,freeCodeCamp,4924,2019-01-29T21:06:26Z,The https://www.freeCodeCamp.org open source codebase and curriculum. Learn to code for free together with millions of people.
2,JavaScript,vue,126577,18062,JavaScript,https://github.com/vuejs/vue,vuejs,222,2019-01-29T22:27:50Z,"🖖 Vue.js is a progressive, incrementally-adoptable JavaScript framework for building UI on the web."
3,JavaScript,react,121009,21907,JavaScript,https://github.com/facebook/react,facebook,534,2019-01-30T01:48:57Z,"A declarative, efficient, and flexible JavaScript library for building user interfaces."
4,JavaScript,d3,82050,20325,JavaScript,https://github.com/d3/d3,d3,7,2019-01-28T17:59:45Z,"Bring data to life with SVG, Canvas and HTML. :bar_chart::chart_with_upwards_trend::tada:"
5,JavaScript,javascript,81171,15475,JavaScript,https://github.com/airbnb/javascript,airbnb,137,2019-01-28T05:21:49Z,JavaScript Style Guide
6,JavaScript,react-native,73298,16345,JavaScript,https://github.com/facebook/react-native,facebook,766,2019-01-30T03:59:54Z,A framework for building native apps with React.
7,JavaScript,create-react-app,62796,13782,JavaScript,https://github.com/facebook/create-react-app,facebook,344,2019-01-29T13:28:10Z,Set up a modern web app by running one command.
8,JavaScript,angular.js,59369,28948,JavaScript,https://github.com/angular/angular.js,angular,459,2019-01-26T10:32:23Z,AngularJS - HTML enhanced for web apps!
9,JavaScript,Font-Awesome,58626,9944,JavaScript,https://github.com/FortAwesome/Font-Awesome,FortAwesome,4720,2019-01-28T22:41:45Z,"The iconic SVG, font, and CSS toolkit"
10,JavaScript,node,57720,12778,JavaScript,https://github.com/nodejs/node,nodejs,831,2019-01-30T02:36:33Z,Node.js JavaScript runtime :sparkles::turtle::rocket::sparkles:
11,JavaScript,axios,54337,4214,JavaScript,https://github.com/axios/axios,axios,520,2019-01-26T00:24:48Z,Promise based HTTP client for the browser and node.js
12,JavaScript,three.js,48379,18184,JavaScript,https://github.com/mrdoob/three.js,mrdoob,796,2019-01-30T03:19:28Z,JavaScript 3D library.
13,JavaScript,atom,47648,10879,JavaScript,https://github.com/atom/atom,atom,723,2019-01-30T00:48:18Z,:atom: The hackable text editor
14,JavaScript,webpack,46770,5915,JavaScript,https://github.com/webpack/webpack,webpack,488,2019-01-29T18:23:03Z,"A bundler for javascript and friends. Packs many modules into a few bundled assets. Code Splitting allows for loading parts of the application on demand. Through ""loaders"", modules can be CommonJs, AMD, ES6 modules, CSS, Images, JSON, Coffeescript, LESS, ... and your custom stuff."
15,JavaScript,redux,46548,11823,JavaScript,https://github.com/reduxjs/redux,reduxjs,30,2019-01-29T03:04:50Z,Predictable state container for JavaScript apps
16,JavaScript,socket.io,45043,8334,JavaScript,https://github.com/socketio/socket.io,socketio,354,2019-01-19T06:08:50Z,Realtime application framework (Node.JS server)
17,JavaScript,puppeteer,44752,3870,JavaScript,https://github.com/GoogleChrome/puppeteer,GoogleChrome,268,2019-01-29T01:19:54Z,Headless Chrome Node API
18,JavaScript,free-programming-books-zh_CN,44746,14988,JavaScript,https://github.com/justjavac/free-programming-books-zh_CN,justjavac,151,2018-12-23T11:54:19Z,:books: 免费的计算机编程类中文书籍，欢迎投稿
19,JavaScript,reveal.js,44450,12824,JavaScript,https://github.com/hakimel/reveal.js,hakimel,406,2019-01-29T15:40:58Z,The HTML Presentation Framework
20,JavaScript,Semantic-UI,44315,4725,JavaScript,https://github.com/Semantic-Org/Semantic-UI,Semantic-Org,830,2019-01-22T05:37:47Z,Semantic is a UI component framework based around useful principles from natural language.
21,JavaScript,material-ui,44007,8937,JavaScript,https://github.com/mui-org/material-ui,mui-org,308,2019-01-30T00:03:19Z,React components that implement Google's Material Design.
22,JavaScript,javascript-algorithms,43568,5876,JavaScript,https://github.com/trekhleb/javascript-algorithms,trekhleb,67,2019-01-28T12:57:14Z,📝 Algorithms and data structures implemented in JavaScript with explanations and links to further readings
23,JavaScript,express,42133,7238,JavaScript,https://github.com/expressjs/express,expressjs,165,2019-01-24T19:53:03Z,"Fast, unopinionated, minimalist web framework for node."
24,JavaScript,html5-boilerplate,42045,9970,JavaScript,https://github.com/h5bp/html5-boilerplate,h5bp,7,2019-01-29T16:09:40Z,"A professional front-end template for building fast, robust, and adaptable web apps or sites."
25,JavaScript,Chart.js,41526,9308,JavaScript,https://github.com/chartjs/Chart.js,chartjs,462,2019-01-30T01:58:49Z,Simple HTML5 Charts using the <canvas> tag
26,JavaScript,meteor,40729,5035,JavaScript,https://github.com/meteor/meteor,meteor,276,2019-01-23T08:30:12Z,"Meteor, the JavaScript App Platform"
27,JavaScript,moment,39997,5994,JavaScript,https://github.com/moment/moment,moment,252,2019-01-29T19:21:35Z,"Parse, validate, manipulate, and display dates in javascript."
28,JavaScript,resume.github.com,39193,1043,JavaScript,https://github.com/resume/resume.github.com,resume,37,2018-12-29T23:17:05Z,Resumes generated using the GitHub informations
29,JavaScript,30-seconds-of-code,37960,4064,JavaScript,https://github.com/30-seconds/30-seconds-of-code,30-seconds,7,2019-01-26T06:09:46Z,Curated collection of useful JavaScript snippets that you can understand in 30 seconds or less.
30,JavaScript,json-server,37791,3277,JavaScript,https://github.com/typicode/json-server,typicode,398,2019-01-27T10:54:14Z,Get a full fake REST API with zero coding in less than 30 seconds (seriously)
31,JavaScript,lodash,37090,3837,JavaScript,https://github.com/lodash/lodash,lodash,6,2019-01-28T15:53:29Z,"A modern JavaScript utility library delivering modularity, performance, & extras."
32,JavaScript,markdown-here,35106,5939,JavaScript,https://github.com/adam-p/markdown-here,adam-p,225,2018-11-13T20:35:39Z,"Google Chrome, Firefox, and Thunderbird extension that lets you write email in Markdown and render it before sending."
33,JavaScript,materialize,34958,4697,JavaScript,https://github.com/Dogfalo/materialize,Dogfalo,609,2019-01-27T13:59:29Z,"Materialize, a CSS Framework based on Material Design"
34,JavaScript,react-router,34584,7160,JavaScript,https://github.com/ReactTraining/react-router,ReactTraining,63,2019-01-18T16:15:41Z,Declarative routing for React
35,JavaScript,impress.js,34438,6796,JavaScript,https://github.com/impress/impress.js,impress,53,2019-01-23T09:03:25Z,It's a presentation framework based on the power of CSS3 transforms and transitions in modern browsers and inspired by the idea behind prezi.com.
36,JavaScript,next.js,34096,3765,JavaScript,https://github.com/zeit/next.js,zeit,202,2019-01-29T20:19:18Z,The React Framework
37,JavaScript,storybook,33467,2514,JavaScript,https://github.com/storybooks/storybook,storybooks,217,2019-01-30T02:49:46Z,"Interactive UI component dev & test: React, React Native, Vue, Angular, Ember"
38,JavaScript,Front-End-Checklist,33204,3153,JavaScript,https://github.com/thedaviddias/Front-End-Checklist,thedaviddias,3,2019-01-29T21:48:26Z,🗂 The perfect Front-End Checklist for modern websites and meticulous developers
39,JavaScript,hacker-scripts,32701,5696,JavaScript,https://github.com/NARKOZ/hacker-scripts,NARKOZ,52,2018-10-09T05:16:03Z,Based on a true story
40,JavaScript,incubator-echarts,32305,9396,JavaScript,https://github.com/apache/incubator-echarts,apache,3200,2019-01-29T09:39:34Z,"A powerful, interactive charting and visualization library for browser"
41,JavaScript,babel,31672,3280,JavaScript,https://github.com/babel/babel,babel,793,2019-01-29T16:21:56Z,🐠 Babel is a compiler for writing next generation JavaScript.
42,JavaScript,gatsby,30879,4063,JavaScript,https://github.com/gatsbyjs/gatsby,gatsbyjs,764,2019-01-30T02:38:30Z,"Build blazing fast, modern apps and websites with React"
43,JavaScript,prettier,30007,1575,JavaScript,https://github.com/prettier/prettier,prettier,522,2019-01-29T19:46:08Z,Prettier is an opinionated code formatter.
44,JavaScript,jQuery-File-Upload,29663,7935,JavaScript,https://github.com/blueimp/jQuery-File-Upload,blueimp,52,2018-11-14T06:09:12Z,"File Upload widget with multiple file selection, drag&drop support, progress bar, validation and preview images, audio and video for jQuery. Supports cross-domain, chunked and resumable file uploads. Works with any server-side platform (Google App Engine, PHP, Python, Ruby on Rails, Java, etc.) that supports standard HTML form file uploads."
45,JavaScript,parcel,29542,1317,JavaScript,https://github.com/parcel-bundler/parcel,parcel-bundler,630,2019-01-29T23:17:03Z,"📦🚀 Blazing fast, zero configuration web application bundler"
46,JavaScript,brackets,29504,6387,JavaScript,https://github.com/adobe/brackets,adobe,2380,2019-01-27T17:37:33Z,"An open source code editor for the web, written in JavaScript, HTML and CSS."
47,JavaScript,anime,28982,2076,JavaScript,https://github.com/juliangarnier/anime,juliangarnier,44,2019-01-28T14:14:37Z,JavaScript animation engine
48,JavaScript,awesome-selfhosted,28804,2327,JavaScript,https://github.com/Kickball/awesome-selfhosted,Kickball,48,2019-01-25T22:28:01Z,This is a list of Free Software network services and web applications which can be hosted locally. Selfhosting is the process of locally hosting and managing applications instead of renting from SaaS providers.
49,JavaScript,Ghost,28768,6206,JavaScript,https://github.com/TryGhost/Ghost,TryGhost,86,2019-01-30T01:50:05Z,The platform for professional publishers
50,JavaScript,pm2,27913,1931,JavaScript,https://github.com/Unitech/pm2,Unitech,599,2019-01-17T17:28:46Z,Node.js Production Process Manager with a built-in Load Balancer.
51,JavaScript,serverless,27771,3046,JavaScript,https://github.com/serverless/serverless,serverless,637,2019-01-29T21:33:19Z,"Serverless Framework – Build web, mobile and IoT applications with serverless architectures using AWS Lambda, Azure Functions, Google CloudFunctions & more! – "
52,JavaScript,backbone,27380,5723,JavaScript,https://github.com/jashkenas/backbone,jashkenas,81,2018-10-12T16:40:18Z,"Give your JS App some Backbone with Models, Views, Collections, and Events"
53,JavaScript,hyper,27259,2214,JavaScript,https://github.com/zeit/hyper,zeit,680,2019-01-27T05:41:41Z,A terminal built on web technologies
54,JavaScript,immutable-js,26339,1548,JavaScript,https://github.com/facebook/immutable-js,facebook,114,2019-01-29T18:42:19Z,Immutable persistent data collections for Javascript which increase efficiency and simplicity.
55,JavaScript,slate,25887,15634,JavaScript,https://github.com/lord/slate,lord,40,2019-01-29T18:07:06Z,Beautiful static documentation for your API
56,JavaScript,fullPage.js,25814,6272,JavaScript,https://github.com/alvarotrigo/fullPage.js,alvarotrigo,136,2019-01-21T12:32:47Z,fullPage plugin by Alvaro Trigo. Create full screen pages fast and simple
57,JavaScript,hackathon-starter,25619,5062,JavaScript,https://github.com/sahat/hackathon-starter,sahat,14,2019-01-28T08:57:55Z,A boilerplate for Node.js web applications
58,JavaScript,awesome-mac,25594,3023,JavaScript,https://github.com/jaywcjlove/awesome-mac,jaywcjlove,32,2019-01-29T05:22:14Z," Now we have become very big, Different from the original idea. Collect premium software in various categories."
59,JavaScript,tech-interview-handbook,25516,3296,JavaScript,https://github.com/yangshun/tech-interview-handbook,yangshun,6,2019-01-28T20:59:00Z,"💯 Algorithms study materials, behavioral content and tips for rocking your coding interview"
60,JavaScript,pdf.js,25228,6090,JavaScript,https://github.com/mozilla/pdf.js,mozilla,675,2019-01-29T21:48:57Z,PDF Reader in JavaScript
61,JavaScript,async,25188,2286,JavaScript,https://github.com/caolan/async,caolan,16,2019-01-29T05:34:11Z,Async utilities for node and the browser
62,JavaScript,33-js-concepts,25130,2251,JavaScript,https://github.com/leonardomso/33-js-concepts,leonardomso,5,2019-01-29T17:52:11Z,📜 33 concepts every JavaScript developer should know.
63,JavaScript,hexo,25096,3403,JavaScript,https://github.com/hexojs/hexo,hexojs,236,2019-01-27T17:17:38Z,"A fast, simple & powerful blog framework, powered by Node.js."
64,JavaScript,clipboard.js,24962,2822,JavaScript,https://github.com/zenorocha/clipboard.js,zenorocha,40,2018-11-18T12:57:10Z,:scissors: Modern copy to clipboard. No Flash. Just 3kb gzipped :clipboard:
65,JavaScript,koa,24776,2243,JavaScript,https://github.com/koajs/koa,koajs,42,2019-01-28T08:51:44Z,Expressive middleware for node.js using ES2017 async functions
66,JavaScript,nodebestpractices,24553,1797,JavaScript,https://github.com/i0natan/nodebestpractices,i0natan,63,2019-01-26T20:03:02Z,The largest Node.js best practices list (January 2019)
67,JavaScript,nylas-mail,24238,1346,JavaScript,https://github.com/nylas/nylas-mail,nylas,1047,2019-01-10T07:27:22Z,:love_letter: An extensible desktop mail app built on the modern web.  Forks welcome!
68,JavaScript,underscore,24140,5362,JavaScript,https://github.com/jashkenas/underscore,jashkenas,121,2019-01-26T23:23:17Z,JavaScript's utility _ belt
69,JavaScript,Leaflet,23879,3941,JavaScript,https://github.com/Leaflet/Leaflet,Leaflet,380,2019-01-25T12:35:23Z, :leaves: JavaScript library for mobile-friendly interactive maps
70,JavaScript,phaser,23776,5830,JavaScript,https://github.com/photonstorm/phaser,photonstorm,176,2019-01-30T03:07:52Z,"Phaser is a fun, free and fast 2D game framework for making HTML5 games for desktop and mobile web browsers, supporting Canvas and WebGL rendering."
71,JavaScript,Modernizr,23356,3025,JavaScript,https://github.com/Modernizr/Modernizr,Modernizr,189,2019-01-25T13:32:21Z,Modernizr is a JavaScript library that detects HTML5 and CSS3 features in the user’s browser.
72,JavaScript,slick,23259,4567,JavaScript,https://github.com/kenwheeler/slick,kenwheeler,1017,2019-01-18T15:38:08Z,the last carousel you'll ever need
73,JavaScript,select2,23217,5446,JavaScript,https://github.com/select2/select2,select2,462,2018-12-26T16:29:56Z,"Select2 is a jQuery based replacement for select boxes. It supports searching, remote data sets, and infinite scrolling of results."
74,JavaScript,jest,23216,3143,JavaScript,https://github.com/facebook/jest,facebook,532,2019-01-30T02:34:14Z,Delightful JavaScript Testing.
75,JavaScript,incubator-superset,22930,4202,JavaScript,https://github.com/apache/incubator-superset,apache,1098,2019-01-30T02:47:12Z,"Apache Superset (incubating) is a modern, enterprise-ready business intelligence web application"
76,JavaScript,awesome-react-native,22839,2786,JavaScript,https://github.com/jondot/awesome-react-native,jondot,23,2019-01-29T15:45:19Z,"Awesome React Native components, news, tools, and learning material!"
77,JavaScript,mermaid,21900,1260,JavaScript,https://github.com/knsv/mermaid,knsv,236,2019-01-20T22:36:01Z,Generation of diagram and flowchart from text in a similar manner as markdown
78,JavaScript,styled-components,21788,1305,JavaScript,https://github.com/styled-components/styled-components,styled-components,81,2019-01-29T18:57:31Z,Visual primitives for the component age. Use the best bits of ES6 and CSS to style your apps without stress 💅
79,JavaScript,realworld,21737,1447,JavaScript,https://github.com/gothinkster/realworld,gothinkster,121,2019-01-29T17:40:51Z,"""The mother of all demo apps"" — Exemplary fullstack Medium.com clone powered by React, Angular, Node, Django, and many more 🏅"
80,JavaScript,request,21705,2560,JavaScript,https://github.com/request/request,request,305,2019-01-25T23:50:56Z,🏊🏾 Simplified HTTP request client.
81,JavaScript,pixi.js,21697,3148,JavaScript,https://github.com/pixijs/pixi.js,pixijs,353,2019-01-29T23:11:31Z,"The HTML5 Creation Engine: Create beautiful digital content with the fastest, most flexible 2D WebGL renderer."
82,JavaScript,clean-code-javascript,21556,2245,JavaScript,https://github.com/ryanmcdermott/clean-code-javascript,ryanmcdermott,28,2019-01-24T02:58:56Z,:bathtub: Clean Code concepts adapted for JavaScript
83,JavaScript,preact,21401,1094,JavaScript,https://github.com/developit/preact,developit,186,2019-01-22T17:49:53Z,⚛️ Fast 3kB React alternative with the same modern API. Components & Virtual DOM.
84,JavaScript,Rocket.Chat,21354,4566,JavaScript,https://github.com/RocketChat/Rocket.Chat,RocketChat,2131,2019-01-29T20:40:01Z,"Have your own Slack like online chat, built with Meteor."
85,JavaScript,quill,21351,1573,JavaScript,https://github.com/quilljs/quill,quilljs,536,2019-01-19T23:55:00Z,Quill is a modern WYSIWYG editor built for compatibility and extensibility.
86,JavaScript,react-boilerplate,21197,4112,JavaScript,https://github.com/react-boilerplate/react-boilerplate,react-boilerplate,20,2019-01-24T20:10:06Z,":fire: A highly scalable, offline-first foundation with the best developer experience and a focus on performance and best practices."
87,JavaScript,awesome-wechat-weapp,20870,4480,JavaScript,https://github.com/justjavac/awesome-wechat-weapp,justjavac,5,2019-01-16T12:20:10Z,微信小程序开发资源汇总 :100:
88,JavaScript,500lines,20754,4782,JavaScript,https://github.com/aosabook/500lines,aosabook,47,2018-10-19T15:15:57Z,500 Lines or Less
89,JavaScript,ember.js,20551,4101,JavaScript,https://github.com/emberjs/ember.js,emberjs,251,2019-01-29T21:17:17Z,Ember.js - A JavaScript framework for creating ambitious web applications
90,JavaScript,standard,20267,1526,JavaScript,https://github.com/standard/standard,standard,82,2019-01-21T14:13:10Z,"🌟 JavaScript Style Guide, with linter & automatic code fixer"
91,JavaScript,sails,20156,1834,JavaScript,https://github.com/balderdashy/sails,balderdashy,190,2019-01-22T04:13:00Z,Realtime MVC Framework for Node.js
92,JavaScript,postcss,20152,1115,JavaScript,https://github.com/postcss/postcss,postcss,14,2019-01-25T12:15:21Z,Transforming styles with JS plugins
93,JavaScript,hammer.js,19622,2522,JavaScript,https://github.com/hammerjs/hammer.js,hammerjs,258,2018-06-07T10:29:26Z,A javascript library for multi-touch gestures :// You can touch this
94,JavaScript,RxJS,19542,2261,JavaScript,https://github.com/Reactive-Extensions/RxJS,Reactive-Extensions,288,2018-04-18T20:17:39Z,The Reactive Extensions for JavaScript
95,JavaScript,project-guidelines,19291,1811,JavaScript,https://github.com/elsewhencode/project-guidelines,elsewhencode,12,2018-10-29T10:58:22Z,A set of best practices for JavaScript projects
96,JavaScript,ace,19084,4252,JavaScript,https://github.com/ajaxorg/ace,ajaxorg,658,2019-01-28T21:31:35Z,Ace (Ajax.org Cloud9 Editor)
97,JavaScript,swiper,18862,6736,JavaScript,https://github.com/nolimits4web/swiper,nolimits4web,132,2019-01-29T07:57:42Z,Most modern mobile touch slider with hardware accelerated transitions
98,JavaScript,vuex,18748,6039,JavaScript,https://github.com/vuejs/vuex,vuejs,128,2019-01-30T03:09:10Z,🗃️ Centralized State Management for Vue.js.
99,JavaScript,react-starter-kit,18739,3775,JavaScript,https://github.com/kriasoft/react-starter-kit,kriasoft,504,2018-12-27T08:32:55Z,"React Starter Kit — isomorphic web app boilerplate (Node.js, Express, GraphQL, React.js, Babel, PostCSS, Webpack, Browsersync)"
100,JavaScript,vue-cli,18709,2985,JavaScript,https://github.com/vuejs/vue-cli,vuejs,299,2019-01-29T22:15:01Z,🛠️ Standard Tooling for Vue.js Development
1,Lua,kong,19988,2422,Lua,https://github.com/Kong/kong,Kong,294,2019-01-29T22:43:09Z,:gorilla: The Cloud-Native API Gateway & Service Mesh
2,Lua,neural-style,16509,2514,Lua,https://github.com/jcjohnson/neural-style,jcjohnson,310,2018-02-23T01:21:20Z,Torch implementation of neural style algorithm
3,Lua,waifu2x,13004,1489,Lua,https://github.com/nagadomi/waifu2x,nagadomi,75,2019-01-16T16:54:03Z,Image Super-Resolution for Anime-Style Art
4,Lua,openface,11496,2765,Lua,https://github.com/cmusatyalab/openface,cmusatyalab,11,2018-12-09T13:46:40Z,Face recognition with deep neural networks.
5,Lua,char-rnn,8989,2202,Lua,https://github.com/karpathy/char-rnn,karpathy,105,2018-05-04T15:25:25Z,"Multi-layer Recurrent Neural Networks (LSTM, GRU, RNN) for character-level language models in Torch"
6,Lua,CycleGAN,7855,1247,Lua,https://github.com/junyanz/CycleGAN,junyanz,26,2018-12-11T19:28:43Z,"Software that can generate photos from paintings,  turn horses into zebras,  perform style transfer, and more."
7,Lua,pix2pix,5730,929,Lua,https://github.com/phillipi/pix2pix,phillipi,42,2018-12-11T19:25:36Z,Image-to-image translation with conditional adversarial nets
8,Lua,dockercraft,5096,298,Lua,https://github.com/docker/dockercraft,docker,13,2018-06-18T12:15:21Z,Docker + Minecraft = Dockercraft
9,Lua,koreader,4563,608,Lua,https://github.com/koreader/koreader,koreader,365,2019-01-29T16:25:49Z,"An ebook reader application supporting PDF, DjVu, EPUB, FB2 and many more formats, running on Kindle, Kobo, PocketBook, Ubuntu Touch and Android devices"
10,Lua,VeryNginx,4514,695,Lua,https://github.com/alexazhou/VeryNginx,alexazhou,84,2018-12-27T01:55:18Z," A very powerful and friendly  nginx base on lua-nginx-module( openresty ) which provide WAF, Control Panel, and Dashboards. "
11,Lua,lsyncd,3329,334,Lua,https://github.com/axkibe/lsyncd,axkibe,77,2018-12-05T21:42:23Z,Lsyncd (Live Syncing Daemon) synchronizes local directories with remote targets
12,Lua,fairseq,3329,584,Lua,https://github.com/facebookresearch/fairseq,facebookresearch,8,2018-10-24T13:31:29Z,Facebook AI Research Sequence-to-Sequence Toolkit
13,Lua,DenseNet,3215,773,Lua,https://github.com/liuzhuang13/DenseNet,liuzhuang13,23,2018-04-25T23:37:39Z,"Densely Connected Convolutional Networks, In CVPR 2017 (Best Paper Award)."
