rank,item,repo_name,stars,forks,language,repo_url,username,issues,last_commit,description
62,Python,spaCy,12325,2069,Python,https://github.com/explosion/spaCy,explosion,164,2019-02-24T21:26:12Z,💫 Industrial-strength Natural Language Processing (NLP) with Python and Cython
63,Python,magenta,12294,2372,Python,https://github.com/tensorflow/magenta,tensorflow,169,2019-02-22T20:19:53Z,Magenta: Music and Art Generation with Machine Intelligence
64,Python,algo,12220,1054,Python,https://github.com/trailofbits/algo,trailofbits,53,2019-02-24T09:18:36Z,Set up a personal IPSEC VPN in the cloud
65,Python,hosts,11920,1040,Python,https://github.com/StevenBlack/hosts,StevenBlack,66,2019-02-20T06:39:40Z,"Extending and consolidating hosts files from several well-curated sources like adaway.org, mvps.org, malwaredomainlist.com, someonewhocares.org, and potentially others.  You can optionally invoke extensions to block additional sites by category. "
66,Python,redash,11787,1896,Python,https://github.com/getredash/redash,getredash,446,2019-02-24T21:42:04Z,"Make Your Company Data Driven. Connect to any data source, easily visualize, dashboard and share your data."
67,Python,celery,11657,3114,Python,https://github.com/celery/celery,celery,455,2019-02-22T16:02:19Z,Distributed Task Queue (development branch)
68,Python,bitcoinbook,11493,3308,Python,https://github.com/bitcoinbook/bitcoinbook,bitcoinbook,109,2019-02-16T01:00:23Z,Mastering Bitcoin 2nd Edition - Programming the Open Blockchain
69,Python,sanic,11464,1072,Python,https://github.com/huge-success/sanic,huge-success,104,2019-02-24T05:47:40Z,Async Python 3.5+ web server that's written to go fast
70,Python,airflow,11152,3940,Python,https://github.com/apache/airflow,apache,273,2019-02-24T23:01:19Z,Apache Airflow
71,Python,ML-From-Scratch,11044,1846,Python,https://github.com/eriklindernoren/ML-From-Scratch,eriklindernoren,11,2019-01-23T19:22:24Z,Machine Learning From Scratch. Bare bones NumPy implementations of machine learning models and algorithms with a focus on accessibility. Aims to cover everything from data mining to deep learning.
72,Python,fabric,11013,1682,Python,https://github.com/fabric/fabric,fabric,315,2019-02-02T17:03:22Z,"Simple, Pythonic remote execution and deployment."
73,Python,iTerm2-Color-Schemes,10997,3091,Python,https://github.com/mbadolato/iTerm2-Color-Schemes,mbadolato,13,2019-02-09T18:39:12Z,"Over 200 terminal color schemes/themes for iTerm/iTerm2 (with ports to Terminal, Konsole, PuTTY, Xresources, XRDB, Remina, Termite, XFCE, Tilda, FreeBSD VT, and Terminator)"
74,Python,luigi,10980,1843,Python,https://github.com/spotify/luigi,spotify,61,2019-02-21T19:30:47Z,"Luigi is a Python module that helps you build complex pipelines of batch jobs. It handles dependency resolution, workflow management, visualization etc. It also comes with Hadoop support built in. "
75,Python,material-theme,10776,777,Python,https://github.com/equinusocio/material-theme,equinusocio,4,2018-04-23T13:45:04Z,"Material Theme, the most epic theme for Sublime Text 3 by Mattia Astorino"
76,Python,Mask_RCNN,10444,4461,Python,https://github.com/matterport/Mask_RCNN,matterport,743,2019-02-22T01:29:25Z,Mask R-CNN for object detection and instance segmentation on Keras and TensorFlow
77,Python,TensorFlow-Course,10206,1726,Python,https://github.com/machinelearningmindset/TensorFlow-Course,machinelearningmindset,3,2019-02-19T21:32:11Z,Simple and ready-to-use tutorials for TensorFlow 
78,Python,Awesome-Linux-Software,10155,915,Python,https://github.com/luong-komorebi/Awesome-Linux-Software,luong-komorebi,12,2019-02-15T16:18:21Z,"A list of awesome applications, software, tools and other materials for Linux distros. "
79,Python,nginx-proxy,10136,1932,Python,https://github.com/jwilder/nginx-proxy,jwilder,493,2019-02-18T14:44:11Z,Automated nginx proxy for Docker containers using docker-gen
80,Python,pix2code,10030,1003,Python,https://github.com/tonybeltramelli/pix2code,tonybeltramelli,0,2017-12-13T08:36:56Z,pix2code: Generating Code from a Graphical User Interface Screenshot
81,Python,powerline,9933,777,Python,https://github.com/powerline/powerline,powerline,144,2019-02-15T11:50:16Z,"Powerline is a statusline plugin for vim, and provides statuslines and prompts for several other applications, including zsh, bash, tmux, IPython, Awesome and Qtile."
82,Python,pytorch-tutorial,9875,2985,Python,https://github.com/yunjey/pytorch-tutorial,yunjey,33,2019-02-24T02:02:56Z,PyTorch Tutorial for Deep Learning Researchers
83,Python,HelloGitHub,9803,1022,Python,https://github.com/521xueweihan/HelloGitHub,521xueweihan,48,2019-02-21T02:51:13Z,:octocat: 分享 GitHub 上有趣、入门级的开源项目，帮你找到编程的乐趣。欢迎推荐、自荐项目，让更多人知道你的项目⭐️
84,Python,Python,9787,5841,Python,https://github.com/geekcomputers/Python,geekcomputers,73,2019-02-23T21:20:10Z,My Python Examples
85,Python,salt,9682,4489,Python,https://github.com/saltstack/salt,saltstack,2302,2019-02-25T03:18:04Z,Software to automate the management and configuration of any infrastructure or application at scale. Get access to the Salt software package repository here: 
86,Python,locust,9395,1353,Python,https://github.com/locustio/locust,locustio,156,2019-02-22T05:42:41Z,Scalable user load testing tool written in Python
87,Python,FastPhotoStyle,9296,849,Python,https://github.com/NVIDIA/FastPhotoStyle,NVIDIA,29,2018-08-24T01:33:43Z,"Style transfer, deep learning, feature transform"
88,Python,zulip,9057,2820,Python,https://github.com/zulip/zulip,zulip,1265,2019-02-24T22:48:23Z,Zulip server - powerful open source team chat
89,Python,tqdm,9032,474,Python,https://github.com/tqdm/tqdm,tqdm,151,2019-02-23T19:09:56Z,"A fast, extensible progress bar for Python and CLI"
90,Python,bokeh,9011,2405,Python,https://github.com/bokeh/bokeh,bokeh,445,2019-02-22T21:00:00Z,Interactive Web Plotting for Python
91,Python,sshuttle,8996,666,Python,https://github.com/apenwarr/sshuttle,apenwarr,22,2018-02-15T13:16:12Z,Wrong project!  You should head over to http://github.com/sshuttle/sshuttle
92,Python,autojump,8975,457,Python,https://github.com/wting/autojump,wting,137,2019-02-11T21:52:23Z,A cd command that learns - easily navigate directories from the command line
93,Python,tflearn,8954,2240,Python,https://github.com/tflearn/tflearn,tflearn,545,2019-01-10T14:15:08Z,Deep learning library featuring a higher-level API for TensorFlow.
94,Python,neural-enhance,8939,937,Python,https://github.com/alexjc/neural-enhance,alexjc,116,2018-01-25T05:01:58Z,Super Resolution for images using deep learning.
95,Python,NLP-progress,8933,1359,Python,https://github.com/sebastianruder/NLP-progress,sebastianruder,10,2019-02-23T10:08:46Z,"Repository to track the progress in Natural Language Processing (NLP), including the datasets and the current state-of-the-art for the most common NLP tasks."
96,Python,cookiecutter,8932,985,Python,https://github.com/audreyr/cookiecutter,audreyr,219,2019-02-19T13:35:53Z,"A command-line utility that creates projects from cookiecutters (project templates). E.g. Python package projects, jQuery plugin projects."
97,Python,neural-doodle,8921,786,Python,https://github.com/alexjc/neural-doodle,alexjc,45,2016-12-28T15:58:48Z,"Turn your two-bit doodles into fine artworks with deep neural networks, generate seamless textures from photos, transfer style from one image to another, perform example-based upscaling, but wait... there's more! (An implementation of Semantic Style Transfer.)"
98,Python,awesome-algorithm,8919,1635,Python,https://github.com/apachecn/awesome-algorithm,apachecn,3,2019-02-25T03:01:18Z,"LeetCode, HackRank, 剑指offer, classic algorithm implementation"
99,Python,RocAlphaGo,8909,2490,Python,https://github.com/Rochester-NRT/RocAlphaGo,Rochester-NRT,30,2018-06-09T13:55:11Z,"An independent, student-led replication of DeepMind's 2016 Nature publication, ""Mastering the game of Go with deep neural networks and tree search"" (Nature 529, 484-489, 28 Jan 2016), details of which can be found on their website https://deepmind.com/publications.html."
100,Python,kivy,8826,2001,Python,https://github.com/kivy/kivy,kivy,673,2019-02-25T00:09:05Z,"Open source UI framework written in Python, running on Windows, Linux, macOS, Android and iOS"
1,R,ggplot2,3628,1371,R,https://github.com/tidyverse/ggplot2,tidyverse,176,2019-02-25T03:52:16Z,An implementation of the Grammar of Graphics in R
2,R,ML_for_Hackers,3465,2223,R,https://github.com/johnmyleswhite/ML_for_Hackers,johnmyleswhite,33,2017-10-18T01:53:18Z,"Code accompanying the book ""Machine Learning for Hackers"""
3,R,awesome-R,3359,1133,R,https://github.com/qinwf/awesome-R,qinwf,31,2019-01-20T22:59:45Z,"A curated list of awesome R packages, frameworks and software."
4,R,shiny,3269,1463,R,https://github.com/rstudio/shiny,rstudio,455,2019-02-21T20:04:41Z,Easy interactive web applications with R
5,R,swirl_courses,2835,6081,R,https://github.com/swirldev/swirl_courses,swirldev,124,2019-02-09T07:11:54Z,:mortar_board: A collection of interactive courses for the swirl R package.
6,R,AnomalyDetection,2825,648,R,https://github.com/twitter/AnomalyDetection,twitter,65,2018-04-16T21:53:31Z,Anomaly Detection with R
7,R,dplyr,2821,1034,R,https://github.com/tidyverse/dplyr,tidyverse,121,2019-02-24T17:48:43Z,dplyr: A grammar of data manipulation
8,R,devtools,1772,634,R,https://github.com/r-lib/devtools,r-lib,56,2019-02-15T13:00:00Z,Tools to make an R developer's life easier
9,R,r4ds,1769,2200,R,https://github.com/hadley/r4ds,hadley,83,2019-02-22T08:58:20Z,R for data science
10,R,knitr,1721,723,R,https://github.com/yihui/knitr,yihui,79,2019-02-24T22:03:49Z,A general-purpose tool for dynamic report generation in R
11,R,investing,1682,104,R,https://github.com/zonination/investing,zonination,0,2016-12-27T13:58:02Z,Investing Returns on the Market as a Whole
12,R,benchm-ml,1614,297,R,https://github.com/szilard/benchm-ml,szilard,10,2018-09-15T18:57:25Z,"A minimal benchmark for scalability, speed and accuracy of commonly used open source implementations (R packages, Python scikit-learn, H2O, xgboost, Spark MLlib etc.) of the top machine learning algorithms for binary classification (random forests, gradient boosted trees, deep neural networks etc.)."
13,R,stats337,1499,226,R,https://github.com/hadley/stats337,hadley,7,2018-06-21T15:57:29Z,Readings in applied data science
14,R,plotly,1451,504,R,https://github.com/ropensci/plotly,ropensci,243,2019-02-22T01:08:20Z,An interactive graphing library for R
15,R,nyc-taxi-data,1442,440,R,https://github.com/toddwschneider/nyc-taxi-data,toddwschneider,0,2019-02-18T14:24:57Z,"Import public NYC taxi and for-hire vehicle (Uber, Lyft, etc.) trip data into PostgreSQL database"
16,R,rmarkdown,1415,623,R,https://github.com/rstudio/rmarkdown,rstudio,113,2019-02-21T20:51:14Z,Dynamic Documents for R
17,R,bookdown,1323,599,R,https://github.com/rstudio/bookdown,rstudio,70,2019-01-30T22:14:07Z,Authoring Books and Technical Documents with R Markdown
18,R,awesome-network-analysis,1318,276,R,https://github.com/briatte/awesome-network-analysis,briatte,14,2018-12-28T11:02:41Z,A curated list of awesome network analysis resources.
19,R,DataScienceR,1253,681,R,https://github.com/ujjwalkarn/DataScienceR,ujjwalkarn,3,2018-04-18T00:01:52Z,"a curated list of R tutorials for Data Science, NLP and Machine Learning "
20,R,mlr,1175,329,R,https://github.com/mlr-org/mlr,mlr-org,463,2019-02-21T12:53:31Z,mlr: Machine Learning in R 
21,R,gganimate,1146,192,R,https://github.com/thomasp85/gganimate,thomasp85,52,2019-02-18T09:09:37Z,A Grammar of Animated Graphics
22,R,DiagrammeR,1118,175,R,https://github.com/rich-iannone/DiagrammeR,rich-iannone,88,2019-02-10T03:56:42Z,Graph and network visualization using tabular data in R
23,R,tensorflow,1114,305,R,https://github.com/rstudio/tensorflow,rstudio,9,2019-02-15T15:49:51Z,TensorFlow for R
24,R,rvest,1033,266,R,https://github.com/hadley/rvest,hadley,71,2019-01-23T19:39:39Z,Simple web scraping for R
25,R,caret,1010,490,R,https://github.com/topepo/caret,topepo,143,2019-02-19T23:10:46Z,caret (Classification And Regression Training) R package that contains misc functions for training and plotting classification and regression models
26,R,labs,986,1416,R,https://github.com/genomicsclass/labs,genomicsclass,15,2018-10-29T20:05:09Z,Rmd source files for the HarvardX series PH525x
27,R,patchwork,979,70,R,https://github.com/thomasp85/patchwork,thomasp85,30,2018-09-22T12:30:35Z,The Composer of ggplots
28,R,ggthemes,961,193,R,https://github.com/jrnold/ggthemes,jrnold,4,2019-02-19T16:27:34Z,"Additional themes, scales, and geoms for ggplot2"
29,R,CausalImpact,900,150,R,https://github.com/google/CausalImpact,google,13,2018-03-28T14:22:21Z,An R package for causal inference in time series
30,R,blogdown,899,204,R,https://github.com/rstudio/blogdown,rstudio,9,2019-02-22T22:45:30Z,Create Blogs and Websites with R Markdown
31,R,wesanderson,881,74,R,https://github.com/karthik/wesanderson,karthik,10,2019-02-01T23:29:59Z,A Wes Anderson color palette for R
32,R,reticulate,825,144,R,https://github.com/rstudio/reticulate,rstudio,156,2019-02-11T02:49:40Z,R Interface to Python
33,R,plumber,817,144,R,https://github.com/trestletech/plumber,trestletech,96,2019-02-23T23:48:40Z,Turn your R code into a web API.
34,R,broom,810,219,R,https://github.com/tidymodels/broom,tidymodels,149,2019-02-24T04:01:36Z,Convert statistical analysis objects from R into tidy format
35,R,slidify,804,348,R,https://github.com/ramnathv/slidify,ramnathv,179,2016-08-02T03:54:45Z,Generate reproducible html5 slides from R markdown
36,R,swirl,800,535,R,https://github.com/swirldev/swirl,swirldev,167,2018-10-11T16:05:05Z,":cyclone: Learn R, in R."
37,R,tofsims,784,5,R,https://github.com/fossasia/tofsims,fossasia,0,2017-11-29T19:16:12Z,
38,R,httr,764,1818,R,https://github.com/r-lib/httr,r-lib,14,2019-02-12T18:59:46Z,httr: a friendly http package for R
39,R,purrr,739,170,R,https://github.com/tidyverse/purrr,tidyverse,56,2019-02-15T12:08:01Z,A functional programming toolkit for R
40,R,tidytext,728,147,R,https://github.com/juliasilge/tidytext,juliasilge,9,2019-02-11T21:12:40Z,"Text mining using dplyr, ggplot2, and other tidy tools :sparkles::page_facing_up::sparkles::page_facing_up::sparkles:"
41,R,rethinking,704,222,R,https://github.com/rmcelreath/rethinking,rmcelreath,83,2019-02-24T09:50:37Z,Statistical Rethinking course and book package
42,R,gt,689,44,R,https://github.com/rstudio/gt,rstudio,84,2019-02-24T10:40:46Z,"Easily generate information-rich, publication-quality tables from R"
43,R,bbplot,686,89,R,https://github.com/bbc/bbplot,bbc,11,2019-02-11T20:13:17Z,R package that helps create and export ggplot2 charts in the style used by the BBC News data team
44,R,forecast,685,241,R,https://github.com/robjhyndman/forecast,robjhyndman,9,2019-02-21T23:24:27Z,forecast package for R
45,R,tidyr,683,263,R,https://github.com/tidyverse/tidyr,tidyverse,53,2019-02-23T16:48:17Z,Easily tidy data with spread and gather functions.
46,R,googlesheets,677,164,R,https://github.com/jennybc/googlesheets,jennybc,87,2018-06-29T17:30:23Z,Google Spreadsheets R API
47,R,magrittr,673,125,R,https://github.com/tidyverse/magrittr,tidyverse,21,2019-01-05T16:37:00Z,Improve the readability of R code with the pipe
48,R,readr,673,209,R,https://github.com/tidyverse/readr,tidyverse,66,2019-02-21T15:54:12Z,"Read flat files (csv, tsv, fwf) into R"
49,R,advanced-shiny,664,248,R,https://github.com/daattali/advanced-shiny,daattali,0,2018-06-02T15:42:50Z,Shiny tips & tricks for improving your apps and solving common problems
50,R,tidyverse,655,134,R,https://github.com/tidyverse/tidyverse,tidyverse,15,2019-02-14T22:14:31Z,Easily install and load packages from the tidyverse
51,R,ggvis,653,180,R,https://github.com/rstudio/ggvis,rstudio,192,2018-10-01T16:22:08Z,Interactive grammar of graphics for R
52,R,SparkR-pkg,652,348,R,https://github.com/amplab-extras/SparkR-pkg,amplab-extras,21,2016-06-10T21:42:55Z,R frontend for Spark
53,R,MLPB,639,241,R,https://github.com/ben519/MLPB,ben519,0,2017-12-15T20:25:45Z,Machine Learning Problem Bible | Problem Set Here >>
54,R,drake,636,55,R,https://github.com/ropensci/drake,ropensci,11,2019-02-25T03:59:05Z,An R-focused pipeline toolkit for reproducibility and high-performance computing
55,R,sparklyr,623,229,R,https://github.com/rstudio/sparklyr,rstudio,356,2019-02-22T23:23:36Z,R interface for Apache Spark
56,R,rnaseq_tutorial,621,359,R,https://github.com/griffithlab/rnaseq_tutorial,griffithlab,9,2018-11-01T19:59:51Z,"Informatics for RNA-seq: A web resource for analysis on the cloud. Educational tutorials and working pipelines for RNA-seq analysis including an introduction to: cloud computing, critical file formats, reference genomes, gene annotation, expression, differential expression, alternative splicing, data visualization, and interpretation."
57,R,BanditsBook,619,214,R,https://github.com/johnmyleswhite/BanditsBook,johnmyleswhite,5,2018-04-05T06:34:29Z,Code for my book on Multi-Armed Bandit Algorithms
58,R,htmlwidgets,605,177,R,https://github.com/ramnathv/htmlwidgets,ramnathv,106,2019-02-06T21:15:32Z,HTML Widgets for R
59,R,ggraph,601,70,R,https://github.com/thomasp85/ggraph,thomasp85,59,2019-01-29T11:55:40Z,Grammar of Graph Graphics
60,R,perceptions,595,74,R,https://github.com/zonination/perceptions,zonination,0,2017-08-25T14:34:20Z,Perceptions of Probability and Numbers
61,R,ggrepel,586,70,R,https://github.com/slowkow/ggrepel,slowkow,22,2019-02-24T15:27:11Z,:round_pushpin: Repel overlapping text labels away from each other.
62,R,ProgrammingAssignment2,582,115414,R,https://github.com/rdpeng/ProgrammingAssignment2,rdpeng,2688,2019-02-24T14:44:50Z,Repository for Programming Assignment 2 for R Programming on Coursera
63,R,janitor,578,66,R,https://github.com/sfirke/janitor,sfirke,54,2019-02-19T20:01:28Z,simple tools for data cleaning in R
64,R,text2vec,577,99,R,https://github.com/dselivanov/text2vec,dselivanov,29,2019-01-18T07:08:50Z,"Fast vectorization, topic modeling, distances and GloVe word embeddings in R."
65,R,testthat,577,232,R,https://github.com/r-lib/testthat,r-lib,97,2019-02-24T01:32:57Z,An R 📦 to make testing 😀
66,R,rappor,564,104,R,https://github.com/google/rappor,google,33,2019-01-10T13:19:15Z,RAPPOR: Privacy-Preserving Reporting Algorithms
67,R,r-source,562,188,R,https://github.com/wch/r-source,wch,0,2019-02-24T21:05:28Z,"Read-only mirror of R source code from https://svn.r-project.org/R/, updated hourly. See the build instructions on the wiki page."
68,R,tidytuesday,554,272,R,https://github.com/rfordatascience/tidytuesday,rfordatascience,24,2019-02-22T19:13:45Z,Official repo for the #tidytuesday project
69,R,RStartHere,549,200,R,https://github.com/rstudio/RStartHere,rstudio,6,2018-04-02T18:39:27Z,A guide to some of the most useful R Packages that we know about
70,R,rayshader,548,37,R,https://github.com/tylermorganwall/rayshader,tylermorganwall,7,2019-02-17T22:51:21Z,"R Package for Producing and Visualizing Hillshaded Maps from Elevation Matrices, in 2D and 3D"
71,R,ProjectTemplate,542,153,R,https://github.com/KentonWhite/ProjectTemplate,KentonWhite,16,2019-02-23T15:25:11Z,A template utility for R projects that provides a skeletal project.
72,R,lintr,540,99,R,https://github.com/jimhester/lintr,jimhester,127,2019-02-14T10:16:25Z,Static Code Analysis for R
73,R,rstan,531,177,R,https://github.com/stan-dev/rstan,stan-dev,154,2019-02-25T01:06:33Z,"RStan, the R interface to Stan"
74,R,esquisse,528,53,R,https://github.com/dreamRs/esquisse,dreamRs,17,2019-02-13T13:29:32Z,RStudio add-in to make plots with ggplot2
75,R,asdfree,514,440,R,https://github.com/ajdamico/asdfree,ajdamico,88,2019-01-26T13:39:07Z,analyze survey data for free
76,R,keras,511,177,R,https://github.com/rstudio/keras,rstudio,12,2019-02-12T20:14:10Z,R Interface to Keras
77,R,ggmap,495,200,R,https://github.com/dkahle/ggmap,dkahle,73,2019-02-13T22:59:34Z,a package for plotting maps in R with ggplot2
78,R,ggthemr,491,72,R,https://github.com/cttobin/ggthemr,cttobin,1,2019-02-18T16:57:33Z,Themes for ggplot2.
79,R,hrbrthemes,490,53,R,https://github.com/hrbrmstr/hrbrthemes,hrbrmstr,14,2019-02-11T09:36:59Z,":lock_with_ink_pen: Opinionated, typographic-centric ggplot2 themes and theme components"
80,R,opencpu,489,91,R,https://github.com/opencpu/opencpu,opencpu,74,2019-02-24T22:34:13Z,OpenCPU system for embedded scientific computation and reproducible research
81,R,sf,480,123,R,https://github.com/r-spatial/sf,r-spatial,36,2019-02-24T21:39:52Z,Simple Features for R
82,R,quanteda,473,111,R,https://github.com/quanteda/quanteda,quanteda,100,2019-02-25T00:13:36Z,An R package for the Quantitative Analysis of Textual Data
83,R,plyr,471,120,R,https://github.com/hadley/plyr,hadley,27,2018-12-05T19:23:26Z,"A R package for splitting, applying and combining large problems into simpler problems"
84,R,networkD3,465,227,R,https://github.com/christophergandrud/networkD3,christophergandrud,71,2018-04-11T11:04:51Z,D3 JavaScript Network Graphs from R
85,R,brms,463,59,R,https://github.com/paul-buerkner/brms,paul-buerkner,39,2019-02-24T12:28:19Z,brms R package for Bayesian generalized multivariate non-linear multilevel models using Stan
86,R,future,458,42,R,https://github.com/HenrikBengtsson/future,HenrikBengtsson,58,2019-02-19T10:27:07Z,:rocket: R package: future: Unified Parallel and Distributed Processing in R for Everyone
87,R,formattable,455,64,R,https://github.com/renkun-ken/formattable,renkun-ken,44,2017-10-04T03:09:59Z,Formattable Data Structures
88,R,ballr,448,92,R,https://github.com/toddwschneider/ballr,toddwschneider,1,2019-02-18T14:29:11Z,Interactive NBA and NCAA Shot Charts with R and Shiny
89,R,datapasta,444,34,R,https://github.com/MilesMcBain/datapasta,MilesMcBain,20,2019-02-24T19:14:05Z,"On top of spaghetti, all covered in cheese...."
90,R,addinslist,443,95,R,https://github.com/daattali/addinslist,daattali,2,2018-12-18T03:40:34Z,Discover and install useful RStudio addins 
91,R,renjin,431,71,R,https://github.com/bedatadriven/renjin,bedatadriven,65,2019-02-12T15:20:24Z,JVM-based interpreter for the R language for the statistical analysis.
92,R,engsoccerdata,417,123,R,https://github.com/jalapic/engsoccerdata,jalapic,13,2019-02-20T21:50:02Z,English and European soccer results 1871-2017
93,R,shinyjs,416,89,R,https://github.com/daattali/shinyjs,daattali,10,2018-11-14T08:37:29Z,Easily improve the user experience of your Shiny apps in seconds
94,R,mindr,413,37,R,https://github.com/pzhaonet/mindr,pzhaonet,0,2019-02-15T11:14:38Z,"an R package which converts markdown files (.md, .Rmd) into mindmaps (brainstorms)"
95,R,ggalt,410,59,R,https://github.com/hrbrmstr/ggalt,hrbrmstr,26,2019-02-23T11:42:29Z,":earth_americas: Extra Coordinate Systems, Geoms,  Statistical Transformations & Scales for 'ggplot2'"
96,R,lubridate,409,150,R,https://github.com/tidyverse/lubridate,tidyverse,62,2019-02-22T10:06:43Z,Make working with dates in R just that little bit easier
97,R,waffle,405,54,R,https://github.com/hrbrmstr/waffle,hrbrmstr,29,2019-01-10T13:05:16Z,:maple_leaf: Make waffle (square pie) charts in R
98,R,highcharter,401,85,R,https://github.com/jbkunst/highcharter,jbkunst,128,2019-02-03T06:37:42Z,R wrapper for highcharts based on htmlwidgets 
99,R,pkgdown,400,189,R,https://github.com/r-lib/pkgdown,r-lib,52,2019-02-19T23:00:50Z,Generate static html documentation for an R package
100,R,SIT,398,355,R,https://github.com/systematicinvestor/SIT,systematicinvestor,24,2018-10-19T01:25:00Z,Systematic Investor Toolkit
1,Ruby,rails,42265,17063,Ruby,https://github.com/rails/rails,rails,1104,2019-02-24T23:28:25Z,Ruby on Rails
2,Ruby,jekyll,36935,8059,Ruby,https://github.com/jekyll/jekyll,jekyll,153,2019-02-21T11:36:49Z,:globe_with_meridians: Jekyll is a blog-aware static site generator in Ruby
3,Ruby,discourse,27519,6340,Ruby,https://github.com/discourse/discourse,discourse,24,2019-02-25T03:31:55Z,"A platform for community discussion. Free, open, simple."
4,Ruby,fastlane,24649,3744,Ruby,https://github.com/fastlane/fastlane,fastlane,239,2019-02-25T01:58:07Z,🚀 The easiest way to automate building and releasing your iOS and Android apps
5,Ruby,awesome-awesomeness,23733,2976,Ruby,https://github.com/bayandin/awesome-awesomeness,bayandin,6,2019-02-11T19:45:57Z,A curated list of awesome awesomeness
6,Ruby,gitlabhq,21585,5525,Ruby,https://github.com/gitlabhq/gitlabhq,gitlabhq,30,2019-02-25T01:17:49Z,GitLab CE Mirror | Please open new issues in our issue tracker on GitLab.com
7,Ruby,huginn,20632,2244,Ruby,https://github.com/huginn/huginn,huginn,349,2019-02-23T11:36:20Z,Create agents that monitor and act on your behalf.  Your agents are standing by!
8,Ruby,devdocs,19966,1283,Ruby,https://github.com/freeCodeCamp/devdocs,freeCodeCamp,104,2019-02-18T19:08:42Z,API Documentation Browser
9,Ruby,devise,19609,4612,Ruby,https://github.com/plataformatec/devise,plataformatec,25,2019-02-24T10:57:26Z,Flexible authentication solution for Rails with Warden.
10,Ruby,vagrant,18001,3650,Ruby,https://github.com/hashicorp/vagrant,hashicorp,395,2019-02-22T20:45:43Z,Vagrant is a tool for building and distributing development environments.
11,Ruby,mastodon,16873,2969,Ruby,https://github.com/tootsuite/mastodon,tootsuite,1125,2019-02-25T03:51:03Z,"Your self-hosted, globally interconnected microblogging community"
12,Ruby,brew,16444,3635,Ruby,https://github.com/Homebrew/brew,Homebrew,28,2019-02-25T03:11:57Z,🍺 The missing package manager for macOS (or Linux)
13,Ruby,ruby,15385,4103,Ruby,https://github.com/ruby/ruby,ruby,181,2019-02-24T11:57:35Z,The Ruby Programming Language [mirror]
14,Ruby,metasploit-framework,15339,7813,Ruby,https://github.com/rapid7/metasploit-framework,rapid7,647,2019-02-24T18:11:41Z,Metasploit Framework
