rank,item,repo_name,stars,forks,language,repo_url,username,issues,last_commit,description
53,Python,hosts,12247,1077,Python,https://github.com/StevenBlack/hosts,StevenBlack,55,2019-04-08T00:48:21Z,"Extending and consolidating hosts files from several well-curated sources like adaway.org, mvps.org, malwaredomainlist.com, someonewhocares.org, and potentially others.  You can optionally invoke extensions to block additional sites by category. "
54,Python,redash,12244,1988,Python,https://github.com/getredash/redash,getredash,454,2019-04-10T03:46:33Z,"Make Your Company Data Driven. Connect to any data source, easily visualize, dashboard and share your data."
55,Python,airflow,11763,4199,Python,https://github.com/apache/airflow,apache,312,2019-04-10T03:49:30Z,Apache Airflow
56,Python,bitcoinbook,11668,3363,Python,https://github.com/bitcoinbook/bitcoinbook,bitcoinbook,111,2019-03-15T01:58:24Z,Mastering Bitcoin 2nd Edition - Programming the Open Blockchain
57,Python,Mask_RCNN,11325,4869,Python,https://github.com/matterport/Mask_RCNN,matterport,845,2019-04-07T22:20:20Z,Mask R-CNN for object detection and instance segmentation on Keras and TensorFlow
58,Python,fabric,11127,1705,Python,https://github.com/fabric/fabric,fabric,327,2019-04-04T21:48:41Z,"Simple, Pythonic remote execution and deployment."
59,Python,HelloGitHub,10983,1175,Python,https://github.com/521xueweihan/HelloGitHub,521xueweihan,30,2019-03-28T09:12:09Z,:octocat: 分享 GitHub 上有趣、入门级的开源项目，帮你找到编程的乐趣。欢迎推荐、自荐项目，让更多人知道你的项目⭐️
60,Python,material-theme,10849,779,Python,https://github.com/equinusocio/material-theme,equinusocio,3,2019-03-20T10:51:26Z,"Material Theme, the most epic theme for Sublime Text 3 by Mattia Astorino"
61,Python,Python,10728,6170,Python,https://github.com/geekcomputers/Python,geekcomputers,73,2019-04-02T20:31:10Z,My Python Examples
62,Python,Awesome-Linux-Software,10580,966,Python,https://github.com/luong-komorebi/Awesome-Linux-Software,luong-komorebi,10,2019-04-01T11:45:52Z,"A list of awesome applications, software, tools and other materials for Linux distros. "
63,Python,powerline,10158,791,Python,https://github.com/powerline/powerline,powerline,157,2019-04-07T18:40:01Z,"Powerline is a statusline plugin for vim, and provides statuslines and prompts for several other applications, including zsh, bash, tmux, IPython, Awesome and Qtile."
64,Python,pix2code,10126,1024,Python,https://github.com/tonybeltramelli/pix2code,tonybeltramelli,0,2019-04-09T23:35:37Z,pix2code: Generating Code from a Graphical User Interface Screenshot
65,Python,NLP-progress,9794,1536,Python,https://github.com/sebastianruder/NLP-progress,sebastianruder,12,2019-04-08T13:15:20Z,"Repository to track the progress in Natural Language Processing (NLP), including the datasets and the current state-of-the-art for the most common NLP tasks."
66,Python,locust,9785,1408,Python,https://github.com/locustio/locust,locustio,163,2019-04-08T20:36:22Z,Scalable user load testing tool written in Python
67,Python,zulip,9568,2987,Python,https://github.com/zulip/zulip,zulip,1323,2019-04-10T00:15:19Z,Zulip server - powerful open source team chat
68,Python,FastPhotoStyle,9481,894,Python,https://github.com/NVIDIA/FastPhotoStyle,NVIDIA,32,2019-04-05T18:41:46Z,"Style transfer, deep learning, feature transform"
69,Python,cookiecutter,9237,1012,Python,https://github.com/audreyr/cookiecutter,audreyr,225,2019-04-09T15:43:40Z,"A command-line utility that creates projects from cookiecutters (project templates). E.g. Python package projects, jQuery plugin projects."
70,Python,autojump,9236,467,Python,https://github.com/wting/autojump,wting,144,2019-04-08T02:33:25Z,A cd command that learns - easily navigate directories from the command line
71,Python,neural-doodle,9070,805,Python,https://github.com/alexjc/neural-doodle,alexjc,47,2016-12-28T15:58:48Z,"Turn your two-bit doodles into fine artworks with deep neural networks, generate seamless textures from photos, transfer style from one image to another, perform example-based upscaling, but wait... there's more! (An implementation of Semantic Style Transfer.)"
72,Python,kivy,9039,2045,Python,https://github.com/kivy/kivy,kivy,673,2019-04-09T08:34:38Z,"Open source UI framework written in Python, running on Windows, Linux, macOS, Android and iOS"
73,Python,matplotlib,9023,4085,Python,https://github.com/matplotlib/matplotlib,matplotlib,1460,2019-04-10T03:13:46Z,matplotlib: plotting with Python
74,Python,tflearn,9013,2271,Python,https://github.com/tflearn/tflearn,tflearn,551,2019-02-27T19:26:49Z,Deep learning library featuring a higher-level API for TensorFlow.
75,Python,gensim,8983,3319,Python,https://github.com/RaRe-Technologies/gensim,RaRe-Technologies,218,2019-04-09T20:02:09Z,Topic Modelling for Humans
76,Python,neural-networks-and-deep-learning,8937,4406,Python,https://github.com/mnielsen/neural-networks-and-deep-learning,mnielsen,4,2019-01-21T21:55:07Z,"Code samples for my book ""Neural Networks and Deep Learning"""
77,Python,Theano,8742,2480,Python,https://github.com/Theano/Theano,Theano,648,2019-03-03T22:52:50Z,"Theano is a Python library that allows you to define, optimize, and evaluate mathematical expressions involving multi-dimensional arrays efficiently. It can use GPUs and perform efficient symbolic differentiation."
78,Python,game-programmer,8705,1021,Python,https://github.com/miloyip/game-programmer,miloyip,15,2019-01-02T01:54:21Z,A Study Path for Game Programmer
79,Python,pelican,8688,1564,Python,https://github.com/getpelican/pelican,getpelican,163,2019-04-04T23:13:12Z,Static site generator that supports Markdown and reST syntax. Powered by Python.
80,Python,inter,8660,161,Python,https://github.com/rsms/inter,rsms,17,2019-04-05T00:30:39Z,The Inter font family
81,Python,black,8649,432,Python,https://github.com/ambv/black,ambv,165,2019-03-28T01:15:46Z,The uncompromising Python code formatter
82,Python,beets,8610,1499,Python,https://github.com/beetbox/beets,beetbox,645,2019-04-09T02:19:41Z,music library manager and MusicBrainz tagger
83,Python,dash,8587,853,Python,https://github.com/plotly/dash,plotly,140,2019-04-09T01:47:35Z,Analytical Web Apps for Python. No JavaScript Required.
84,Python,mackup,8431,679,Python,https://github.com/lra/mackup,lra,274,2019-04-03T16:04:54Z,Keep your application settings in sync (OS X/Linux)
85,Python,stanford-tensorflow-tutorials,8386,3853,Python,https://github.com/chiphuyen/stanford-tensorflow-tutorials,chiphuyen,78,2019-03-02T17:44:57Z,This repository contains code examples for the Stanford's course: TensorFlow for Deep Learning Research. 
86,Python,ChatterBot,8083,2807,Python,https://github.com/gunthercox/ChatterBot,gunthercox,77,2019-04-08T16:36:23Z,"ChatterBot is a machine learning, conversational dialog engine for creating chat bots"
87,Python,prophet,8061,1876,Python,https://github.com/facebook/prophet,facebook,86,2019-04-04T10:42:50Z,Tool for producing high quality forecasts for time series data that has multiple seasonality with linear or non-linear growth.
88,Python,mailinabox,8017,856,Python,https://github.com/mail-in-a-box/mailinabox,mail-in-a-box,231,2019-04-06T20:25:34Z,"Mail-in-a-Box helps individuals take back control of their email by defining a one-click, easy-to-deploy SMTP+everything else server: a mail server in a box."
89,Python,newspaper,7909,1326,Python,https://github.com/codelucas/newspaper,codelucas,289,2019-04-07T20:31:59Z,"News, full-text, and article metadata extraction in Python 3. Advanced docs:"
90,Python,speedtest-cli,7897,1096,Python,https://github.com/sivel/speedtest-cli,sivel,18,2019-03-13T21:08:08Z,Command line interface for testing internet bandwidth using speedtest.net
91,Python,aws-cli,7858,1664,Python,https://github.com/aws/aws-cli,aws,538,2019-04-10T01:12:08Z,Universal Command Line Interface for Amazon Web Services
92,Python,Mailpile,7761,922,Python,https://github.com/mailpile/Mailpile,mailpile,384,2019-04-08T01:03:55Z,"A free & open modern, fast email client with user-friendly encryption and privacy features"
93,Python,fast-style-transfer,7710,1833,Python,https://github.com/lengstrom/fast-style-transfer,lengstrom,45,2019-04-08T23:50:42Z,TensorFlow CNN for fast style transfer ⚡🖥🎨🖼
94,Python,facenet,7692,3196,Python,https://github.com/davidsandberg/facenet,davidsandberg,366,2019-02-20T15:44:48Z,Face recognition using Tensorflow
95,Python,termtosvg,7673,275,Python,https://github.com/nbedos/termtosvg,nbedos,6,2019-01-20T18:06:43Z,Record terminal sessions as SVG animations
96,Python,faker,7660,904,Python,https://github.com/joke2k/faker,joke2k,79,2019-04-02T19:24:13Z,Faker is a Python package that generates fake data for you.
97,Python,pytorch-CycleGAN-and-pix2pix,7621,1971,Python,https://github.com/junyanz/pytorch-CycleGAN-and-pix2pix,junyanz,89,2019-04-08T00:27:51Z,"Image-to-image translation in PyTorch (e.g., horse2zebra, edges2cats, and more)"
98,Python,DeepCreamPy,7608,763,Python,https://github.com/deeppomf/DeepCreamPy,deeppomf,7,2019-04-03T08:07:57Z,Decensoring Hentai with Deep Neural Networks
99,Python,InstaPy,7550,2018,Python,https://github.com/timgrossmann/InstaPy,timgrossmann,203,2019-04-09T20:53:08Z,📷 Instagram Bot - Tool for automated Instagram interactions
100,Python,sonnet,7467,1035,Python,https://github.com/deepmind/sonnet,deepmind,15,2019-04-03T13:34:59Z,TensorFlow-based neural network library
1,R,ggplot2,3712,1394,R,https://github.com/tidyverse/ggplot2,tidyverse,190,2019-04-08T08:09:24Z,An implementation of the Grammar of Graphics in R
2,R,ML_for_Hackers,3475,2221,R,https://github.com/johnmyleswhite/ML_for_Hackers,johnmyleswhite,33,2017-10-18T01:53:18Z,"Code accompanying the book ""Machine Learning for Hackers"""
3,R,awesome-R,3430,1155,R,https://github.com/qinwf/awesome-R,qinwf,26,2019-04-08T09:59:13Z,"A curated list of awesome R packages, frameworks and software."
4,R,shiny,3342,1474,R,https://github.com/rstudio/shiny,rstudio,450,2019-04-08T21:20:23Z,Easy interactive web applications with R
5,R,AnomalyDetection,2878,653,R,https://github.com/twitter/AnomalyDetection,twitter,66,2019-03-01T02:37:44Z,Anomaly Detection with R
6,R,dplyr,2878,1056,R,https://github.com/tidyverse/dplyr,tidyverse,128,2019-04-09T13:05:20Z,dplyr: A grammar of data manipulation
7,R,swirl_courses,2878,6125,R,https://github.com/swirldev/swirl_courses,swirldev,125,2019-03-16T20:03:11Z,:mortar_board: A collection of interactive courses for the swirl R package.
8,R,r4ds,1845,2269,R,https://github.com/hadley/r4ds,hadley,87,2019-04-04T21:29:19Z,R for data science
9,R,devtools,1792,638,R,https://github.com/r-lib/devtools,r-lib,50,2019-04-04T14:05:30Z,Tools to make an R developer's life easier
10,R,knitr,1758,731,R,https://github.com/yihui/knitr,yihui,61,2019-04-08T00:06:28Z,A general-purpose tool for dynamic report generation in R
11,R,investing,1687,104,R,https://github.com/zonination/investing,zonination,0,2016-12-27T13:58:02Z,Investing Returns on the Market as a Whole
12,R,benchm-ml,1630,303,R,https://github.com/szilard/benchm-ml,szilard,10,2018-09-15T18:57:25Z,"A minimal benchmark for scalability, speed and accuracy of commonly used open source implementations (R packages, Python scikit-learn, H2O, xgboost, Spark MLlib etc.) of the top machine learning algorithms for binary classification (random forests, gradient boosted trees, deep neural networks etc.)."
13,R,stats337,1519,231,R,https://github.com/hadley/stats337,hadley,7,2018-06-21T15:57:29Z,Readings in applied data science
14,R,plotly,1483,520,R,https://github.com/ropensci/plotly,ropensci,253,2019-04-09T21:44:41Z,An interactive graphing library for R
15,R,nyc-taxi-data,1476,454,R,https://github.com/toddwschneider/nyc-taxi-data,toddwschneider,0,2019-04-08T10:56:34Z,"Import public NYC taxi and for-hire vehicle (Uber, Lyft, etc.) trip data into PostgreSQL database"
16,R,rmarkdown,1467,634,R,https://github.com/rstudio/rmarkdown,rstudio,99,2019-04-09T22:35:03Z,Dynamic Documents for R
17,R,awesome-network-analysis,1389,293,R,https://github.com/briatte/awesome-network-analysis,briatte,14,2019-03-12T05:34:18Z,A curated list of awesome network analysis resources.
18,R,bookdown,1383,617,R,https://github.com/rstudio/bookdown,rstudio,86,2019-04-04T12:07:52Z,Authoring Books and Technical Documents with R Markdown
19,R,DataScienceR,1279,692,R,https://github.com/ujjwalkarn/DataScienceR,ujjwalkarn,3,2018-04-18T00:01:52Z,"a curated list of R tutorials for Data Science, NLP and Machine Learning "
20,R,mlr,1211,335,R,https://github.com/mlr-org/mlr,mlr-org,453,2019-04-09T20:00:41Z,mlr: Machine Learning in R 
21,R,gganimate,1189,205,R,https://github.com/thomasp85/gganimate,thomasp85,63,2019-04-04T13:10:30Z,A Grammar of Animated Graphics
22,R,DiagrammeR,1153,176,R,https://github.com/rich-iannone/DiagrammeR,rich-iannone,93,2019-03-13T05:56:31Z,Graph and network visualization using tabular data in R
23,R,tensorflow,1126,307,R,https://github.com/rstudio/tensorflow,rstudio,5,2019-04-05T13:52:11Z,TensorFlow for R
24,R,rvest,1049,266,R,https://github.com/tidyverse/rvest,tidyverse,25,2019-03-30T18:04:38Z,Simple web scraping for R
25,R,caret,1040,501,R,https://github.com/topepo/caret,topepo,132,2019-04-03T17:58:20Z,caret (Classification And Regression Training) R package that contains misc functions for training and plotting classification and regression models
26,R,patchwork,1017,76,R,https://github.com/thomasp85/patchwork,thomasp85,32,2019-04-01T11:22:01Z,The Composer of ggplots
27,R,labs,997,1426,R,https://github.com/genomicsclass/labs,genomicsclass,15,2018-10-29T20:05:09Z,Rmd source files for the HarvardX series PH525x
28,R,ggthemes,969,192,R,https://github.com/jrnold/ggthemes,jrnold,2,2019-04-09T15:02:25Z,"Additional themes, scales, and geoms for ggplot2"
29,R,blogdown,931,207,R,https://github.com/rstudio/blogdown,rstudio,7,2019-03-19T21:43:48Z,Create Blogs and Websites with R Markdown
30,R,CausalImpact,920,156,R,https://github.com/google/CausalImpact,google,16,2018-03-28T14:22:21Z,An R package for causal inference in time series
31,R,wesanderson,918,75,R,https://github.com/karthik/wesanderson,karthik,10,2019-02-01T23:29:59Z,A Wes Anderson color palette for R
32,R,reticulate,862,149,R,https://github.com/rstudio/reticulate,rstudio,172,2019-04-09T20:19:49Z,R Interface to Python
33,R,plumber,852,151,R,https://github.com/trestletech/plumber,trestletech,97,2019-04-02T16:17:53Z,Turn your R code into a web API.
34,R,broom,842,232,R,https://github.com/tidymodels/broom,tidymodels,132,2019-04-09T21:51:16Z,Convert statistical analysis objects from R into tidy format
35,R,swirl,809,541,R,https://github.com/swirldev/swirl,swirldev,171,2018-10-11T16:05:05Z,":cyclone: Learn R, in R."
36,R,slidify,806,349,R,https://github.com/ramnathv/slidify,ramnathv,179,2016-08-02T03:54:45Z,Generate reproducible html5 slides from R markdown
37,R,tofsims,800,5,R,https://github.com/fossasia/tofsims,fossasia,0,2017-11-29T19:16:12Z,
38,R,httr,779,1835,R,https://github.com/r-lib/httr,r-lib,19,2019-04-09T01:03:01Z,httr: a friendly http package for R
39,R,bbplot,760,113,R,https://github.com/bbc/bbplot,bbc,11,2019-03-19T02:15:52Z,R package that helps create and export ggplot2 charts in the style used by the BBC News data team
40,R,drake,758,75,R,https://github.com/ropensci/drake,ropensci,10,2019-04-10T01:46:38Z,An R-focused pipeline toolkit for reproducibility and high-performance computing
41,R,purrr,755,175,R,https://github.com/tidyverse/purrr,tidyverse,62,2019-04-01T17:21:25Z,A functional programming toolkit for R
42,R,rethinking,750,233,R,https://github.com/rmcelreath/rethinking,rmcelreath,88,2019-04-09T13:02:38Z,Statistical Rethinking course and book package
43,R,gt,747,52,R,https://github.com/rstudio/gt,rstudio,107,2019-04-09T20:32:06Z,"Easily generate information-rich, publication-quality tables from R"
44,R,tidytext,745,149,R,https://github.com/juliasilge/tidytext,juliasilge,9,2019-02-11T21:12:40Z,"Text mining using dplyr, ggplot2, and other tidy tools :sparkles::page_facing_up::sparkles::page_facing_up::sparkles:"
45,R,tidyr,720,287,R,https://github.com/tidyverse/tidyr,tidyverse,23,2019-04-05T15:58:09Z,Easily tidy data with spread and gather functions.
46,R,forecast,710,249,R,https://github.com/robjhyndman/forecast,robjhyndman,9,2019-04-10T00:54:51Z,forecast package for R
47,R,readr,688,208,R,https://github.com/tidyverse/readr,tidyverse,79,2019-02-21T15:54:12Z,"Read flat files (csv, tsv, fwf) into R"
48,R,googlesheets,685,170,R,https://github.com/jennybc/googlesheets,jennybc,87,2018-06-29T17:30:23Z,Google Spreadsheets R API
49,R,advanced-shiny,680,257,R,https://github.com/daattali/advanced-shiny,daattali,1,2019-02-27T14:50:39Z,Shiny tips & tricks for improving your apps and solving common problems
50,R,magrittr,680,126,R,https://github.com/tidyverse/magrittr,tidyverse,24,2019-01-05T16:37:00Z,Improve the readability of R code with the pipe
51,R,tidytuesday,679,343,R,https://github.com/rfordatascience/tidytuesday,rfordatascience,28,2019-04-08T13:02:07Z,Official repo for the #tidytuesday project
52,R,tidyverse,672,139,R,https://github.com/tidyverse/tidyverse,tidyverse,17,2019-04-08T15:55:29Z,Easily install and load packages from the tidyverse
53,R,rnaseq_tutorial,663,370,R,https://github.com/griffithlab/rnaseq_tutorial,griffithlab,9,2018-11-01T19:59:51Z,"Informatics for RNA-seq: A web resource for analysis on the cloud. Educational tutorials and working pipelines for RNA-seq analysis including an introduction to: cloud computing, critical file formats, reference genomes, gene annotation, expression, differential expression, alternative splicing, data visualization, and interpretation."
54,R,ggvis,655,180,R,https://github.com/rstudio/ggvis,rstudio,192,2018-10-01T16:22:08Z,Interactive grammar of graphics for R
55,R,SparkR-pkg,650,347,R,https://github.com/amplab-extras/SparkR-pkg,amplab-extras,21,2016-06-10T21:42:55Z,R frontend for Spark
56,R,MLPB,650,248,R,https://github.com/ben519/MLPB,ben519,0,2017-12-15T20:25:45Z,Machine Learning Problem Bible | Problem Set Here >>
57,R,sparklyr,631,233,R,https://github.com/rstudio/sparklyr,rstudio,381,2019-04-06T00:57:33Z,R interface for Apache Spark
58,R,BanditsBook,624,218,R,https://github.com/johnmyleswhite/BanditsBook,johnmyleswhite,6,2018-04-05T06:34:29Z,Code for my book on Multi-Armed Bandit Algorithms
59,R,ggraph,618,71,R,https://github.com/thomasp85/ggraph,thomasp85,62,2019-03-07T01:43:09Z,Grammar of Graph Graphics
60,R,htmlwidgets,612,176,R,https://github.com/ramnathv/htmlwidgets,ramnathv,105,2019-03-29T14:58:28Z,HTML Widgets for R
61,R,janitor,609,67,R,https://github.com/sfirke/janitor,sfirke,51,2019-03-15T15:50:37Z,simple tools for data cleaning in R
62,R,ggrepel,604,72,R,https://github.com/slowkow/ggrepel,slowkow,22,2019-03-06T06:09:02Z,:round_pushpin: Repel overlapping text labels away from each other.
63,R,esquisse,600,59,R,https://github.com/dreamRs/esquisse,dreamRs,18,2019-03-04T21:49:51Z,RStudio add-in to make plots with ggplot2
64,R,perceptions,598,75,R,https://github.com/zonination/perceptions,zonination,0,2017-08-25T14:34:20Z,Perceptions of Probability and Numbers
65,R,rayshader,592,42,R,https://github.com/tylermorganwall/rayshader,tylermorganwall,8,2019-04-06T03:39:22Z,"R Package for Producing and Visualizing Hillshaded Maps from Elevation Matrices, in 2D and 3D"
66,R,ProgrammingAssignment2,592,116132,R,https://github.com/rdpeng/ProgrammingAssignment2,rdpeng,2716,2019-04-05T07:15:14Z,Repository for Programming Assignment 2 for R Programming on Coursera
67,R,r-source,586,190,R,https://github.com/wch/r-source,wch,0,2019-04-09T20:06:07Z,"Read-only mirror of R source code from https://svn.r-project.org/R/, updated hourly. See the build instructions on the wiki page."
68,R,text2vec,586,100,R,https://github.com/dselivanov/text2vec,dselivanov,28,2019-02-25T17:27:57Z,"Fast vectorization, topic modeling, distances and GloVe word embeddings in R."
69,R,testthat,586,242,R,https://github.com/r-lib/testthat,r-lib,19,2019-04-04T18:30:14Z,An R 📦 to make testing 😀
70,R,rappor,581,110,R,https://github.com/google/rappor,google,34,2019-01-10T13:19:15Z,RAPPOR: Privacy-Preserving Reporting Algorithms
71,R,lintr,558,99,R,https://github.com/jimhester/lintr,jimhester,130,2019-02-14T10:16:25Z,Static Code Analysis for R
72,R,RStartHere,555,198,R,https://github.com/rstudio/RStartHere,rstudio,6,2018-04-02T18:39:27Z,A guide to some of the most useful R Packages that we know about
73,R,rstan,543,179,R,https://github.com/stan-dev/rstan,stan-dev,144,2019-04-09T21:23:08Z,"RStan, the R interface to Stan"
74,R,ProjectTemplate,540,154,R,https://github.com/KentonWhite/ProjectTemplate,KentonWhite,17,2019-02-26T19:01:33Z,A template utility for R projects that provides a skeletal project.
75,R,keras,530,186,R,https://github.com/rstudio/keras,rstudio,16,2019-04-10T01:54:01Z,R Interface to Keras
76,R,asdfree,519,440,R,https://github.com/ajdamico/asdfree,ajdamico,90,2019-01-26T13:39:07Z,analyze survey data for free
77,R,hrbrthemes,515,54,R,https://github.com/hrbrmstr/hrbrthemes,hrbrmstr,15,2019-04-09T12:46:39Z,":lock_with_ink_pen: Opinionated, typographic-centric ggplot2 themes and theme components"
78,R,ggthemr,513,74,R,https://github.com/cttobin/ggthemr,cttobin,1,2019-02-18T16:57:33Z,Themes for ggplot2.
79,R,ggmap,510,204,R,https://github.com/dkahle/ggmap,dkahle,74,2019-03-07T19:30:48Z,A package for plotting maps in R with ggplot2
80,R,sf,497,123,R,https://github.com/r-spatial/sf,r-spatial,17,2019-04-09T12:07:12Z,Simple Features for R
81,R,opencpu,496,92,R,https://github.com/opencpu/opencpu,opencpu,79,2019-03-26T10:25:37Z,OpenCPU system for embedded scientific computation and reproducible research
82,R,brms,491,67,R,https://github.com/paul-buerkner/brms,paul-buerkner,38,2019-04-09T22:56:35Z,brms R package for Bayesian generalized multivariate non-linear multilevel models using Stan
83,R,quanteda,486,115,R,https://github.com/quanteda/quanteda,quanteda,103,2019-04-05T11:09:03Z,An R package for the Quantitative Analysis of Textual Data
84,R,networkD3,479,230,R,https://github.com/christophergandrud/networkD3,christophergandrud,69,2018-04-11T11:04:51Z,D3 JavaScript Network Graphs from R
85,R,future,477,41,R,https://github.com/HenrikBengtsson/future,HenrikBengtsson,61,2019-04-05T02:34:33Z,:rocket: R package: future: Unified Parallel and Distributed Processing in R for Everyone
86,R,plyr,474,121,R,https://github.com/hadley/plyr,hadley,28,2019-03-27T03:48:53Z,"A R package for splitting, applying and combining large problems into simpler problems"
87,R,datapasta,472,37,R,https://github.com/MilesMcBain/datapasta,MilesMcBain,18,2019-03-03T04:07:03Z,"On top of spaghetti, all covered in cheese...."
88,R,formattable,465,65,R,https://github.com/renkun-ken/formattable,renkun-ken,44,2019-04-02T14:42:50Z,Formattable Data Structures
89,R,ballr,461,96,R,https://github.com/toddwschneider/ballr,toddwschneider,1,2019-02-18T14:29:11Z,Interactive NBA and NCAA Shot Charts with R and Shiny
90,R,addinslist,453,94,R,https://github.com/daattali/addinslist,daattali,2,2019-04-07T20:35:14Z,Discover and install useful RStudio addins 
91,R,ggstatsplot,449,49,R,https://github.com/IndrajeetPatil/ggstatsplot,IndrajeetPatil,17,2019-04-10T03:29:18Z,Collection of functions to enhance ggplot2 plots with results from statistical tests.
92,R,renjin,438,73,R,https://github.com/bedatadriven/renjin,bedatadriven,64,2019-03-30T17:24:43Z,JVM-based interpreter for the R language for the statistical analysis.
93,R,engsoccerdata,437,125,R,https://github.com/jalapic/engsoccerdata,jalapic,14,2019-02-20T21:50:02Z,English and European soccer results 1871-2017
94,R,shinyjs,423,91,R,https://github.com/daattali/shinyjs,daattali,11,2019-03-15T05:50:09Z,Easily improve the user experience of your Shiny apps in seconds
95,R,highcharter,421,89,R,https://github.com/jbkunst/highcharter,jbkunst,138,2019-03-28T00:31:05Z,R wrapper for highcharts based on htmlwidgets 
96,R,mindr,421,37,R,https://github.com/pzhaonet/mindr,pzhaonet,1,2019-02-28T10:33:36Z,"an R package which converts markdown files (.md, .Rmd) into mindmaps (brainstorms)"
97,R,ggalt,420,61,R,https://github.com/hrbrmstr/ggalt,hrbrmstr,27,2019-03-22T14:15:10Z,":earth_americas: Extra Coordinate Systems, Geoms,  Statistical Transformations & Scales for 'ggplot2'"
98,R,lubridate,419,148,R,https://github.com/tidyverse/lubridate,tidyverse,72,2019-03-10T12:32:25Z,Make working with dates in R just that little bit easier
99,R,waffle,418,58,R,https://github.com/hrbrmstr/waffle,hrbrmstr,29,2019-01-10T13:05:16Z,:maple_leaf: Make waffle (square pie) charts in R
100,R,ESL-CN,408,111,R,https://github.com/szcf-weiya/ESL-CN,szcf-weiya,88,2019-04-09T15:39:43Z,The Elements of Statistical Learning (ESL)的中文翻译、代码实现及其习题解答。
1,Ruby,rails,42757,17223,Ruby,https://github.com/rails/rails,rails,1133,2019-04-10T03:27:50Z,Ruby on Rails
2,Ruby,jekyll,37344,8128,Ruby,https://github.com/jekyll/jekyll,jekyll,138,2019-04-07T11:56:44Z,:globe_with_meridians: Jekyll is a blog-aware static site generator in Ruby
3,Ruby,discourse,27920,6377,Ruby,https://github.com/discourse/discourse,discourse,19,2019-04-10T00:44:59Z,"A platform for community discussion. Free, open, simple."
4,Ruby,fastlane,25067,3825,Ruby,https://github.com/fastlane/fastlane,fastlane,224,2019-04-10T02:09:53Z,🚀 The easiest way to automate building and releasing your iOS and Android apps
5,Ruby,awesome-awesomeness,23983,3010,Ruby,https://github.com/bayandin/awesome-awesomeness,bayandin,6,2019-04-07T14:59:53Z,A curated list of awesome awesomeness
6,Ruby,gitlabhq,21695,5525,Ruby,https://github.com/gitlabhq/gitlabhq,gitlabhq,31,2019-04-09T21:04:34Z,GitLab CE Mirror | Please open new issues in our issue tracker on GitLab.com
