rank,item,repo_name,stars,forks,language,repo_url,username,issues,last_commit,description
69,Java,ZhihuDailyPurify,4883,1018,Java,https://github.com/izzyleung/ZhihuDailyPurify,izzyleung,0,2018-11-20T03:46:58Z,Purified version of Zhihu Daily - 更纯净的知乎日报
70,Java,android-common,4868,2747,Java,https://github.com/Trinea/android-common,Trinea,17,2017-05-16T16:03:36Z,"Android common lib, include ImageCache, HttpCache, DropDownListView, DownloadManager, Utils and so on"
71,Java,RippleEffect,4834,1131,Java,https://github.com/traex/RippleEffect,traex,51,2018-05-03T20:19:17Z,Implementation of Ripple effect from Material Design for Android API 9+
72,Java,closure-compiler,4834,890,Java,https://github.com/google/closure-compiler,google,795,2019-04-09T20:28:52Z,A JavaScript checker and optimizer.
73,Java,gitpitch,4833,419,Java,https://github.com/gitpitch/gitpitch,gitpitch,14,2019-03-13T02:52:36Z,"The Markdown Presentation Service For Everyone on GitHub, GitLab, Bitbucket, GitBucket, Gitea, and Gogs."
74,Java,haven,4785,670,Java,https://github.com/guardianproject/haven,guardianproject,115,2019-03-28T19:50:38Z,"Haven is for people who need a way to protect their personal spaces and possessions without compromising their own privacy, through an Android app and on-device sensors"
75,Java,graylog2-server,4782,742,Java,https://github.com/Graylog2/graylog2-server,Graylog2,791,2019-04-09T11:27:09Z,Free and open source log management
76,Java,processing,4771,1284,Java,https://github.com/processing/processing,processing,537,2019-04-09T20:39:07Z,Source code for the Processing Core and Development Environment (PDE)
77,Java,AndroidStaggeredGrid,4767,1199,Java,https://github.com/etsy/AndroidStaggeredGrid,etsy,107,2018-05-03T21:01:13Z,An Android staggered grid view which supports multiple columns with rows of varying sizes.
78,Java,wechat,4689,2108,Java,https://github.com/motianhuo/wechat,motianhuo,39,2018-08-23T07:54:02Z,"A High Copy WeChat ,SNS APP (高仿微信)"
79,Java,FloatingActionButton,4670,1062,Java,https://github.com/Clans/FloatingActionButton,Clans,227,2019-01-29T05:42:45Z,Android Floating Action Button based on Material Design specification
80,Java,blade,4660,974,Java,https://github.com/lets-blade/blade,lets-blade,25,2019-04-01T07:14:09Z,:rocket: Lightning fast and elegant mvc framework for Java8
81,Java,disconf,4654,2150,Java,https://github.com/knightliao/disconf,knightliao,191,2019-01-29T08:55:59Z,Distributed Configuration Management Platform(分布式配置管理平台)
82,Java,error-prone,4608,486,Java,https://github.com/google/error-prone,google,296,2019-04-03T21:32:38Z,Catch common Java mistakes as compile-time errors
83,Java,barcodescanner,4577,1190,Java,https://github.com/dm77/barcodescanner,dm77,187,2019-02-28T12:24:36Z,Barcode Scanner Libraries for Android
84,Java,ctci,4513,2256,Java,https://github.com/careercup/ctci,careercup,76,2018-12-15T23:49:46Z,"Cracking the Coding Interview, 5th Edition"
85,Java,NavigationTabBar,4503,780,Java,https://github.com/Devlight/NavigationTabBar,Devlight,53,2018-05-21T21:34:31Z,Navigation tab bar with colorful interactions.
86,Java,RIBs,4469,429,Java,https://github.com/uber/RIBs,uber,41,2019-04-02T10:55:47Z,Uber's cross-platform mobile architecture framework.
87,Java,Transitions-Everywhere,4404,488,Java,https://github.com/andkulikov/Transitions-Everywhere,andkulikov,3,2019-04-05T08:35:21Z, Set of extra Transitions on top of Jetpack Transitions Library
88,Java,UltraViewPager,4404,596,Java,https://github.com/alibaba/UltraViewPager,alibaba,40,2019-01-02T06:23:49Z,UltraViewPager is an extension for ViewPager to provide multiple features in a single ViewPager.
89,Java,folding-cell-android,4390,777,Java,https://github.com/Ramotion/folding-cell-android,Ramotion,0,2019-04-02T08:29:18Z,:octocat: 📃  FoldingCell is a material design expanding content cell inspired by folding paper material made by @Ramotion - https://github.com/Ramotion/android-ui-animation-components-and-libraries
90,Java,walle,4350,618,Java,https://github.com/Meituan-Dianping/walle,Meituan-Dianping,52,2019-03-29T04:23:12Z,Android Signature V2 Scheme签名下的新一代渠道包打包神器
91,Java,k-9,4333,1985,Java,https://github.com/k9mail/k-9,k9mail,570,2019-04-09T19:26:49Z,K-9 Mail – Advanced Email for Android 📧
92,Java,otter,4306,1693,Java,https://github.com/alibaba/otter,alibaba,127,2019-04-03T04:15:17Z,阿里巴巴分布式数据库同步系统(解决中美异地机房)
93,Java,Android-Iconics,4207,524,Java,https://github.com/mikepenz/Android-Iconics,mikepenz,4,2019-04-02T09:02:19Z,"Android-Iconics - Use any icon font, or vector (.svg) as drawable in your application."
94,Java,algs4,4188,1787,Java,https://github.com/kevin-wayne/algs4,kevin-wayne,16,2019-02-12T19:34:47Z,"Algorithms, 4th edition textbook code and libraries"
95,Java,bottomsheet,4168,585,Java,https://github.com/Flipboard/bottomsheet,Flipboard,52,2019-03-13T10:10:01Z,Android component which presents a dismissible view from the bottom of the screen
96,Java,WilliamChart,4063,750,Java,https://github.com/diogobernardino/WilliamChart,diogobernardino,24,2018-10-15T04:25:32Z,Android library to create charts.
97,Java,FloatingActionButton,4031,891,Java,https://github.com/makovkastar/FloatingActionButton,makovkastar,78,2018-05-03T20:19:02Z,[DEPRECATED] Android floating action button
98,Java,SwitchButton,3985,806,Java,https://github.com/kyleduo/SwitchButton,kyleduo,24,2019-01-11T07:16:41Z,A cute widget of Switch Button for  you to create beautiful and friendly UI.
99,Java,roboguice,3864,889,Java,https://github.com/roboguice/roboguice,roboguice,149,2017-01-19T21:02:22Z,"Google Guice on Android, version 3.0 [RETIRED]"
100,Java,Dexter,3801,480,Java,https://github.com/Karumi/Dexter,Karumi,43,2019-03-10T13:52:49Z,Android library that simplifies the process of requesting permissions at runtime.
1,JavaScript,freeCodeCamp,301043,21482,JavaScript,https://github.com/freeCodeCamp/freeCodeCamp,freeCodeCamp,2733,2019-04-10T03:14:21Z,The https://www.freeCodeCamp.org open source codebase and curriculum. Learn to code for free together with millions of people.
2,JavaScript,vue,135016,19168,JavaScript,https://github.com/vuejs/vue,vuejs,254,2019-04-10T03:02:33Z,"🖖 Vue.js is a progressive, incrementally-adoptable JavaScript framework for building UI on the web."
3,JavaScript,bootstrap,132388,64755,JavaScript,https://github.com/twbs/bootstrap,twbs,382,2019-04-09T23:55:59Z,"The most popular HTML, CSS, and JavaScript framework for developing responsive, mobile first projects on the web."
4,JavaScript,react,126660,23028,JavaScript,https://github.com/facebook/react,facebook,641,2019-04-10T01:59:40Z,"A declarative, efficient, and flexible JavaScript library for building user interfaces."
5,JavaScript,d3,83834,20611,JavaScript,https://github.com/d3/d3,d3,7,2019-03-14T16:14:52Z,"Bring data to life with SVG, Canvas and HTML. :bar_chart::chart_with_upwards_trend::tada:"
6,JavaScript,javascript,83824,16029,JavaScript,https://github.com/airbnb/javascript,airbnb,135,2019-03-17T13:59:26Z,JavaScript Style Guide
7,JavaScript,react-native,75906,16926,JavaScript,https://github.com/facebook/react-native,facebook,462,2019-04-10T03:22:44Z,A framework for building native apps with React.
8,JavaScript,create-react-app,66045,14728,JavaScript,https://github.com/facebook/create-react-app,facebook,331,2019-04-09T21:34:29Z,Set up a modern web app by running one command.
9,JavaScript,node,59972,13342,JavaScript,https://github.com/nodejs/node,nodejs,844,2019-04-10T03:53:39Z,Node.js JavaScript runtime :sparkles::turtle::rocket::sparkles:
10,JavaScript,angular.js,59478,28920,JavaScript,https://github.com/angular/angular.js,angular,460,2019-04-09T22:35:49Z,AngularJS - HTML enhanced for web apps!
11,JavaScript,Font-Awesome,59449,10026,JavaScript,https://github.com/FortAwesome/Font-Awesome,FortAwesome,4814,2019-03-29T20:56:54Z,"The iconic SVG, font, and CSS toolkit"
12,JavaScript,axios,57734,4505,JavaScript,https://github.com/axios/axios,axios,586,2019-04-10T01:35:36Z,Promise based HTTP client for the browser and node.js
13,JavaScript,three.js,50392,18916,JavaScript,https://github.com/mrdoob/three.js,mrdoob,862,2019-04-09T23:29:35Z,JavaScript 3D library.
14,JavaScript,webpack,48135,6049,JavaScript,https://github.com/webpack/webpack,webpack,530,2019-04-10T00:55:51Z,"A bundler for javascript and friends. Packs many modules into a few bundled assets. Code Splitting allows for loading parts of the application on demand. Through ""loaders"", modules can be CommonJs, AMD, ES6 modules, CSS, Images, JSON, Coffeescript, LESS, ... and your custom stuff."
15,JavaScript,redux,47950,12243,JavaScript,https://github.com/reduxjs/redux,reduxjs,30,2019-04-08T23:41:52Z,Predictable state container for JavaScript apps
16,JavaScript,puppeteer,47739,4245,JavaScript,https://github.com/GoogleChrome/puppeteer,GoogleChrome,328,2019-04-09T06:20:03Z,Headless Chrome Node API
17,JavaScript,javascript-algorithms,47434,6626,JavaScript,https://github.com/trekhleb/javascript-algorithms,trekhleb,84,2019-04-07T01:55:07Z,📝 Algorithms and data structures implemented in JavaScript with explanations and links to further readings
18,JavaScript,socket.io,45894,8442,JavaScript,https://github.com/socketio/socket.io,socketio,373,2019-03-30T10:11:39Z,Realtime application framework (Node.JS server)
19,JavaScript,material-ui,45883,9767,JavaScript,https://github.com/mui-org/material-ui,mui-org,311,2019-04-10T02:26:43Z,"React components for faster and easier web development. Build your own design system, or start with Material Design."
20,JavaScript,reveal.js,45631,13176,JavaScript,https://github.com/hakimel/reveal.js,hakimel,425,2019-04-08T08:36:40Z,The HTML Presentation Framework
21,JavaScript,Semantic-UI,45046,4775,JavaScript,https://github.com/Semantic-Org/Semantic-UI,Semantic-Org,868,2019-04-02T15:32:27Z,Semantic is a UI component framework based around useful principles from natural language.
22,JavaScript,express,43236,7342,JavaScript,https://github.com/expressjs/express,expressjs,182,2019-04-05T01:35:48Z,"Fast, unopinionated, minimalist web framework for node."
23,JavaScript,Chart.js,42840,9476,JavaScript,https://github.com/chartjs/Chart.js,chartjs,450,2019-04-08T07:43:13Z,Simple HTML5 Charts using the <canvas> tag
24,JavaScript,html5-boilerplate,42588,10092,JavaScript,https://github.com/h5bp/html5-boilerplate,h5bp,0,2019-03-20T16:50:21Z,"A professional front-end template for building fast, robust, and adaptable web apps or sites."
25,JavaScript,30-seconds-of-code,42458,4673,JavaScript,https://github.com/30-seconds/30-seconds-of-code,30-seconds,7,2019-04-09T15:29:53Z,A curated collection of useful JavaScript snippets that you can understand in 30 seconds or less.
26,JavaScript,meteor,40941,5033,JavaScript,https://github.com/meteor/meteor,meteor,300,2019-04-09T23:01:15Z,"Meteor, the JavaScript App Platform"
27,JavaScript,moment,40761,6104,JavaScript,https://github.com/moment/moment,moment,312,2019-04-08T15:18:01Z,"Parse, validate, manipulate, and display dates in javascript."
28,JavaScript,resume.github.com,40217,1059,JavaScript,https://github.com/resume/resume.github.com,resume,36,2018-12-29T23:17:05Z,Resumes generated using the GitHub informations
29,JavaScript,markdown-here,37006,6293,JavaScript,https://github.com/adam-p/markdown-here,adam-p,233,2019-03-20T19:54:09Z,"Google Chrome, Firefox, and Thunderbird extension that lets you write email in Markdown and render it before sending."
30,JavaScript,next.js,36387,4191,JavaScript,https://github.com/zeit/next.js,zeit,197,2019-04-10T03:15:36Z,The React Framework
31,JavaScript,storybook,36252,2865,JavaScript,https://github.com/storybooks/storybook,storybooks,359,2019-04-10T03:55:47Z,"UI component dev & test: React, Vue, Angular, React Native, Ember & more!"
32,JavaScript,react-router,35733,7337,JavaScript,https://github.com/ReactTraining/react-router,ReactTraining,61,2019-04-09T23:49:53Z,Declarative routing for React
33,JavaScript,materialize,35494,4745,JavaScript,https://github.com/Dogfalo/materialize,Dogfalo,636,2019-04-08T18:44:43Z,"Materialize, a CSS Framework based on Material Design"
34,JavaScript,impress.js,34670,6809,JavaScript,https://github.com/impress/impress.js,impress,52,2019-04-08T16:37:54Z,It's a presentation framework based on the power of CSS3 transforms and transitions in modern browsers and inspired by the idea behind prezi.com.
35,JavaScript,Front-End-Checklist,34109,3238,JavaScript,https://github.com/thedaviddias/Front-End-Checklist,thedaviddias,4,2019-03-23T11:57:06Z,🗂 The perfect Front-End Checklist for modern websites and meticulous developers
36,JavaScript,hacker-scripts,33805,5746,JavaScript,https://github.com/NARKOZ/hacker-scripts,NARKOZ,54,2019-03-10T05:04:04Z,Based on a true story
37,JavaScript,gatsby,33609,4691,JavaScript,https://github.com/gatsbyjs/gatsby,gatsbyjs,515,2019-04-10T00:51:02Z,"Build blazing fast, modern apps and websites with React"
38,JavaScript,babel,32693,3440,JavaScript,https://github.com/babel/babel,babel,758,2019-04-10T01:45:20Z,🐠 Babel is a compiler for writing next generation JavaScript.
39,JavaScript,prettier,31292,1694,JavaScript,https://github.com/prettier/prettier,prettier,607,2019-04-08T19:56:40Z,Prettier is an opinionated code formatter.
40,JavaScript,parcel,30894,1395,JavaScript,https://github.com/parcel-bundler/parcel,parcel-bundler,654,2019-04-09T22:02:53Z,"📦🚀 Blazing fast, zero configuration web application bundler"
41,JavaScript,awesome-selfhosted,30618,2483,JavaScript,https://github.com/Kickball/awesome-selfhosted,Kickball,48,2019-04-08T00:00:21Z,This is a list of Free Software network services and web applications which can be hosted locally. Selfhosting is the process of locally hosting and managing applications instead of renting from SaaS providers.
42,JavaScript,anime,30597,2227,JavaScript,https://github.com/juliangarnier/anime,juliangarnier,91,2019-03-28T16:45:00Z,JavaScript animation engine
43,JavaScript,jQuery-File-Upload,29868,7963,JavaScript,https://github.com/blueimp/jQuery-File-Upload,blueimp,52,2019-03-06T15:19:04Z,"File Upload widget with multiple file selection, drag&drop support, progress bar, validation and preview images, audio and video for jQuery. Supports cross-domain, chunked and resumable file uploads. Works with any server-side platform (Google App Engine, PHP, Python, Ruby on Rails, Java, etc.) that supports standard HTML form file uploads."
44,JavaScript,brackets,29690,6398,JavaScript,https://github.com/adobe/brackets,adobe,2405,2019-04-09T18:35:40Z,"An open source code editor for the web, written in JavaScript, HTML and CSS."
45,JavaScript,serverless,29279,3217,JavaScript,https://github.com/serverless/serverless,serverless,468,2019-04-09T11:38:17Z,"Serverless Framework – Build web, mobile and IoT applications with serverless architectures using AWS Lambda, Azure Functions, Google CloudFunctions & more! – "
46,JavaScript,pm2,28683,1953,JavaScript,https://github.com/Unitech/pm2,Unitech,643,2019-04-09T21:24:42Z,Node.js Production Process Manager with a built-in Load Balancer.
47,JavaScript,awesome-mac,27351,3195,JavaScript,https://github.com/jaywcjlove/awesome-mac,jaywcjlove,35,2019-04-05T12:50:37Z," Now we have become very big, Different from the original idea. Collect premium software in various categories."
48,JavaScript,immutable-js,26995,1574,JavaScript,https://github.com/immutable-js/immutable-js,immutable-js,123,2019-03-08T14:05:52Z,Immutable persistent data collections for Javascript which increase efficiency and simplicity.
49,JavaScript,33-js-concepts,26862,2525,JavaScript,https://github.com/leonardomso/33-js-concepts,leonardomso,5,2019-04-02T11:54:44Z,📜 33 concepts every JavaScript developer should know.
50,JavaScript,nodebestpractices,26820,2045,JavaScript,https://github.com/i0natan/nodebestpractices,i0natan,33,2019-04-09T19:09:15Z,:white_check_mark: The largest Node.js best practices list (April 2019)
51,JavaScript,tech-interview-handbook,26817,3595,JavaScript,https://github.com/yangshun/tech-interview-handbook,yangshun,7,2019-04-03T16:18:01Z,"💯 Algorithms study materials, behavioral content and tips for rocking your coding interview"
52,JavaScript,slate,26654,16338,JavaScript,https://github.com/lord/slate,lord,41,2019-04-05T21:15:33Z,Beautiful static documentation for your API
53,JavaScript,hackathon-starter,26282,5283,JavaScript,https://github.com/sahat/hackathon-starter,sahat,14,2019-04-08T04:39:04Z,A boilerplate for Node.js web applications
54,JavaScript,fullPage.js,26257,6341,JavaScript,https://github.com/alvarotrigo/fullPage.js,alvarotrigo,150,2019-04-10T01:03:43Z,fullPage plugin by Alvaro Trigo. Create full screen pages fast and simple
55,JavaScript,pdf.js,26131,6258,JavaScript,https://github.com/mozilla/pdf.js,mozilla,602,2019-04-10T01:05:36Z,PDF Reader in JavaScript
56,JavaScript,hexo,25983,3477,JavaScript,https://github.com/hexojs/hexo,hexojs,212,2019-04-06T16:11:21Z,"A fast, simple & powerful blog framework, powered by Node.js."
57,JavaScript,clipboard.js,25632,2947,JavaScript,https://github.com/zenorocha/clipboard.js,zenorocha,48,2019-03-26T10:59:33Z,:scissors: Modern copy to clipboard. No Flash. Just 3kb gzipped :clipboard:
58,JavaScript,koa,25616,2312,JavaScript,https://github.com/koajs/koa,koajs,41,2019-04-07T00:50:50Z,Expressive middleware for node.js using ES2017 async functions
59,JavaScript,async,25421,2309,JavaScript,https://github.com/caolan/async,caolan,7,2019-04-07T22:25:08Z,Async utilities for node and the browser
60,JavaScript,jest,24837,3402,JavaScript,https://github.com/facebook/jest,facebook,588,2019-04-10T03:05:17Z,Delightful JavaScript Testing.
61,JavaScript,Leaflet,24479,4019,JavaScript,https://github.com/Leaflet/Leaflet,Leaflet,417,2019-04-08T14:49:51Z, :leaves: JavaScript library for mobile-friendly interactive maps
62,JavaScript,phaser,24408,5903,JavaScript,https://github.com/photonstorm/phaser,photonstorm,200,2019-04-09T22:43:52Z,"Phaser is a fun, free and fast 2D game framework for making HTML5 games for desktop and mobile web browsers, supporting Canvas and WebGL rendering."
63,JavaScript,underscore,24363,5383,JavaScript,https://github.com/jashkenas/underscore,jashkenas,119,2019-03-25T17:26:39Z,JavaScript's utility _ belt
64,JavaScript,realworld,24356,1632,JavaScript,https://github.com/gothinkster/realworld,gothinkster,128,2019-04-09T18:19:53Z,"""The mother of all demo apps"" — Exemplary fullstack Medium.com clone powered by React, Angular, Node, Django, and many more 🏅"
65,JavaScript,nylas-mail,24302,1359,JavaScript,https://github.com/nylas/nylas-mail,nylas,1045,2019-01-10T07:27:22Z,:love_letter: An extensible desktop mail app built on the modern web.  Forks welcome!
66,JavaScript,incubator-superset,23855,4453,JavaScript,https://github.com/apache/incubator-superset,apache,1110,2019-04-10T03:52:40Z,"Apache Superset (incubating) is a modern, enterprise-ready business intelligence web application"
67,JavaScript,awesome-react-native,23763,2896,JavaScript,https://github.com/jondot/awesome-react-native,jondot,48,2019-04-05T16:32:23Z,"Awesome React Native components, news, tools, and learning material!"
68,JavaScript,slick,23649,4705,JavaScript,https://github.com/kenwheeler/slick,kenwheeler,1067,2019-04-09T17:17:08Z,the last carousel you'll ever need
69,JavaScript,Modernizr,23533,3029,JavaScript,https://github.com/Modernizr/Modernizr,Modernizr,186,2019-03-22T15:45:25Z,Modernizr is a JavaScript library that detects HTML5 and CSS3 features in the user’s browser.
70,JavaScript,select2,23451,5531,JavaScript,https://github.com/select2/select2,select2,109,2019-04-08T15:39:14Z,"Select2 is a jQuery based replacement for select boxes. It supports searching, remote data sets, and infinite scrolling of results."
71,JavaScript,mermaid,22966,1340,JavaScript,https://github.com/knsv/mermaid,knsv,264,2019-03-18T10:48:25Z,Generation of diagram and flowchart from text in a similar manner as markdown
72,JavaScript,clean-code-javascript,22676,2412,JavaScript,https://github.com/ryanmcdermott/clean-code-javascript,ryanmcdermott,26,2019-03-24T21:13:45Z,:bathtub: Clean Code concepts adapted for JavaScript
73,JavaScript,pixi.js,22476,3203,JavaScript,https://github.com/pixijs/pixi.js,pixijs,52,2019-04-09T15:53:27Z,"The HTML5 Creation Engine: Create beautiful digital content with the fastest, most flexible 2D WebGL renderer."
74,JavaScript,request,22311,2629,JavaScript,https://github.com/request/request,request,278,2019-04-04T00:30:36Z,🏊🏾 Simplified HTTP request client.
75,JavaScript,quill,22258,1651,JavaScript,https://github.com/quilljs/quill,quilljs,532,2019-04-08T07:24:59Z,Quill is a modern WYSIWYG editor built for compatibility and extensibility.
76,JavaScript,preact,22211,1152,JavaScript,https://github.com/developit/preact,developit,151,2019-04-09T18:15:02Z,⚛️ Fast 3kB React alternative with the same modern API. Components & Virtual DOM.
77,JavaScript,Rocket.Chat,22163,4810,JavaScript,https://github.com/RocketChat/Rocket.Chat,RocketChat,2180,2019-04-10T00:12:21Z,"Have your own Slack like online chat, built with Meteor."
78,JavaScript,react-boilerplate,21917,4324,JavaScript,https://github.com/react-boilerplate/react-boilerplate,react-boilerplate,15,2019-04-08T18:11:58Z,":fire: A highly scalable, offline-first foundation with the best developer experience and a focus on performance and best practices."
79,JavaScript,500lines,21349,4878,JavaScript,https://github.com/aosabook/500lines,aosabook,47,2019-03-02T12:07:52Z,500 Lines or Less
80,JavaScript,standard,20847,1574,JavaScript,https://github.com/standard/standard,standard,83,2019-04-02T05:18:46Z,"🌟 JavaScript Style Guide, with linter & automatic code fixer"
81,JavaScript,postcss,20564,1122,JavaScript,https://github.com/postcss/postcss,postcss,14,2019-04-09T07:19:57Z,Transforming styles with JS plugins
82,JavaScript,sails,20389,1836,JavaScript,https://github.com/balderdashy/sails,balderdashy,327,2019-03-25T22:57:36Z,Realtime MVC Framework for Node.js
83,JavaScript,vue-cli,20062,3282,JavaScript,https://github.com/vuejs/vue-cli,vuejs,348,2019-04-09T14:22:59Z,🛠️ Standard Tooling for Vue.js Development
84,JavaScript,vuex,19768,6349,JavaScript,https://github.com/vuejs/vuex,vuejs,125,2019-04-09T02:46:23Z,🗃️ Centralized State Management for Vue.js.
85,JavaScript,RxJS,19610,2277,JavaScript,https://github.com/Reactive-Extensions/RxJS,Reactive-Extensions,288,2018-04-18T20:17:39Z,The Reactive Extensions for JavaScript
86,JavaScript,swiper,19510,7027,JavaScript,https://github.com/nolimits4web/swiper,nolimits4web,162,2019-04-06T21:49:26Z,Most modern mobile touch slider with hardware accelerated transitions
87,JavaScript,project-guidelines,19494,1859,JavaScript,https://github.com/elsewhencode/project-guidelines,elsewhencode,13,2019-03-16T16:51:30Z,A set of best practices for JavaScript projects
88,JavaScript,nuxt.js,19341,1636,JavaScript,https://github.com/nuxt/nuxt.js,nuxt,140,2019-04-09T23:45:14Z,The Vue.js Framework
89,JavaScript,carbon,19190,923,JavaScript,https://github.com/dawnlabs/carbon,dawnlabs,18,2019-04-09T06:51:30Z,🎨 Create and share beautiful images of your source code
90,JavaScript,webtorrent,19166,1835,JavaScript,https://github.com/webtorrent/webtorrent,webtorrent,90,2019-04-09T21:45:54Z,⚡️ Streaming torrent client for the web
91,JavaScript,mobx,19040,1139,JavaScript,https://github.com/mobxjs/mobx,mobxjs,32,2019-04-03T17:12:37Z,"Simple, scalable state management."
92,JavaScript,react-starter-kit,19001,3831,JavaScript,https://github.com/kriasoft/react-starter-kit,kriasoft,509,2019-04-09T16:17:06Z,"React Starter Kit — isomorphic web app boilerplate (Node.js, Express, GraphQL, React.js, Babel, PostCSS, Webpack, Browsersync)"
93,JavaScript,marked,18955,2513,JavaScript,https://github.com/markedjs/marked,markedjs,71,2019-04-09T19:35:11Z,A markdown parser and compiler. Built for speed.
94,JavaScript,dragula,18828,1597,JavaScript,https://github.com/bevacqua/dragula,bevacqua,210,2019-01-23T22:25:06Z,:ok_hand: Drag and drop so simple it hurts
95,JavaScript,front-end-interview-handbook,18827,2322,JavaScript,https://github.com/yangshun/front-end-interview-handbook,yangshun,20,2019-04-01T07:13:17Z,"🕸 Almost complete answers to ""Front-end Job Interview Questions"" which you can use to interview potential candidates, test yourself or completely ignore"
96,JavaScript,particles.js,18761,3179,JavaScript,https://github.com/VincentGarreau/particles.js,VincentGarreau,264,2019-01-23T06:24:29Z,A lightweight JavaScript library for creating particles
97,JavaScript,nprogress,18555,1562,JavaScript,https://github.com/rstacruz/nprogress,rstacruz,113,2019-01-22T08:47:20Z,"For slim progress bars like on YouTube, Medium, etc"
98,JavaScript,mongoose,18328,2581,JavaScript,https://github.com/Automattic/mongoose,Automattic,316,2019-04-09T18:12:09Z,MongoDB object modeling designed to work in an asynchronous environment.
99,JavaScript,PhotoSwipe,18325,2725,JavaScript,https://github.com/dimsemenov/PhotoSwipe,dimsemenov,512,2019-03-09T10:24:36Z,"JavaScript image gallery for mobile and desktop, modular, framework independent"
100,JavaScript,faker.js,18322,1462,JavaScript,https://github.com/Marak/faker.js,Marak,230,2019-04-04T07:13:38Z,generate massive amounts of realistic fake data in Node.js and the browser
1,Lua,kong,21019,2538,Lua,https://github.com/Kong/kong,Kong,336,2019-04-09T19:55:09Z,:gorilla: The Cloud-Native API Gateway 
2,Lua,neural-style,16712,2534,Lua,https://github.com/jcjohnson/neural-style,jcjohnson,313,2018-02-23T01:21:20Z,Torch implementation of neural style algorithm
3,Lua,waifu2x,14094,1600,Lua,https://github.com/nagadomi/waifu2x,nagadomi,79,2019-03-16T10:36:17Z,Image Super-Resolution for Anime-Style Art
