rank,item,repo_name,stars,forks,language,repo_url,username,issues,last_commit,description
48,Python,cheat.sh,17620,848,Python,https://github.com/chubin/cheat.sh,chubin,50,2019-10-21T16:44:03Z,the only cheat sheet you need
49,Python,data-science-ipython-notebooks,17417,5347,Python,https://github.com/donnemartin/data-science-ipython-notebooks,donnemartin,10,2019-10-23T05:58:18Z,"Data science Python notebooks: Deep learning (TensorFlow, Theano, Caffe, Keras), scikit-learn, Kaggle, big data (Spark, Hadoop MapReduce, HDFS), matplotlib, pandas, NumPy, SciPy, Python essentials, AWS, and various command lines."
50,Python,12306,17274,5409,Python,https://github.com/testerSunshine/12306,testerSunshine,65,2019-10-23T04:21:41Z,12306智能刷票，订票
51,Python,mitmproxy,16590,2149,Python,https://github.com/mitmproxy/mitmproxy,mitmproxy,289,2019-10-17T13:31:58Z,An interactive TLS-capable intercepting HTTP proxy for penetration testers and software developers.
52,Python,algorithms,16122,3155,Python,https://github.com/keon/algorithms,keon,84,2019-10-23T06:20:03Z,Minimal examples of data structures and algorithms in Python
53,Python,HelloGitHub,16105,1804,Python,https://github.com/521xueweihan/HelloGitHub,521xueweihan,5,2019-09-28T12:27:05Z,:octocat: Find pearls on open-source seashore 分享 GitHub 上有趣、入门级的开源项目
54,Python,wtfpython,16088,1553,Python,https://github.com/satwikkansal/wtfpython,satwikkansal,25,2019-10-20T13:55:28Z,A collection of surprising Python snippets and lesser-known features.
55,Python,transformers,15657,3603,Python,https://github.com/huggingface/transformers,huggingface,307,2019-10-23T09:35:10Z,🤗 Transformers: State-of-the-art Natural Language Processing for TensorFlow 2.0 and PyTorch.
56,Python,django-rest-framework,15637,4590,Python,https://github.com/encode/django-rest-framework,encode,232,2019-10-22T21:39:02Z,Web APIs for Django. 🎸
57,Python,python-fire,15524,943,Python,https://github.com/google/python-fire,google,61,2019-10-11T17:09:49Z,Python Fire is a library for automatically generating command line interfaces (CLIs) from absolutely any Python object.
58,Python,odoo,15475,11103,Python,https://github.com/odoo/odoo,odoo,2490,2019-10-23T11:01:04Z,Odoo. Open Source Apps To Grow Your Business.
59,Python,sqlmap,15418,3348,Python,https://github.com/sqlmapproject/sqlmap,sqlmapproject,48,2019-10-22T12:43:35Z,Automatic SQL injection and database takeover tool
60,Python,macOS-Security-and-Privacy-Guide,15254,1074,Python,https://github.com/drduh/macOS-Security-and-Privacy-Guide,drduh,3,2019-10-16T18:26:55Z,Guide to securing and improving privacy on macOS
61,Python,algo,15154,1308,Python,https://github.com/trailofbits/algo,trailofbits,57,2019-10-23T05:25:07Z,Set up a personal VPN in the cloud
62,Python,reddit,15135,2779,Python,https://github.com/reddit-archive/reddit,reddit-archive,304,2017-10-17T19:57:07Z,historical code from reddit.com
63,Python,spaCy,14897,2587,Python,https://github.com/explosion/spaCy,explosion,125,2019-10-23T09:39:41Z,💫 Industrial-strength Natural Language Processing (NLP) with Python and Cython
64,Python,ZeroNet,14750,1903,Python,https://github.com/HelloZeroNet/ZeroNet,HelloZeroNet,619,2019-10-22T15:33:11Z,ZeroNet - Decentralized websites using Bitcoin crypto and BitTorrent network
65,Python,Python,14536,7378,Python,https://github.com/geekcomputers/Python,geekcomputers,104,2019-10-23T08:54:59Z,My Python Examples
66,Python,Mask_RCNN,14456,6584,Python,https://github.com/matterport/Mask_RCNN,matterport,1142,2019-10-22T21:50:36Z,Mask R-CNN for object detection and instance segmentation on Keras and TensorFlow
67,Python,manim,14355,1674,Python,https://github.com/3b1b/manim,3b1b,142,2019-10-16T18:04:32Z,Animation engine for explanatory math videos
68,Python,airflow,14347,5390,Python,https://github.com/apache/airflow,apache,306,2019-10-23T10:54:17Z,Apache Airflow
69,Python,glances,14340,968,Python,https://github.com/nicolargo/glances,nicolargo,122,2019-10-21T07:34:05Z,"Glances an Eye on your system. A top/htop alternative for GNU/Linux, BSD, Mac OS and Windows operating systems."
70,Python,d2l-zh,14220,3590,Python,https://github.com/d2l-ai/d2l-zh,d2l-ai,6,2019-10-21T23:56:39Z,《动手学深度学习》：面向中文读者、能运行、可讨论。英文版即伯克利“深度学习导论”教材。
71,Python,magenta,14105,2831,Python,https://github.com/tensorflow/magenta,tensorflow,219,2019-10-22T23:58:59Z,Magenta: Music and Art Generation with Machine Intelligence
72,Python,redash,14065,2396,Python,https://github.com/getredash/redash,getredash,476,2019-10-23T10:41:37Z,"Make Your Company Data Driven. Connect to any data source, easily visualize, dashboard and share your data."
73,Python,wechat_jump_game,13931,4659,Python,https://github.com/wangshub/wechat_jump_game,wangshub,29,2019-10-22T20:51:50Z,微信《跳一跳》Python 辅助
74,Python,ipython,13830,3898,Python,https://github.com/ipython/ipython,ipython,1236,2019-10-23T00:24:22Z,"Official repository for IPython itself. Other repos in the IPython organization contain things like the website, documentation builds, etc."
75,Python,pytorch-tutorial,13787,4321,Python,https://github.com/yunjey/pytorch-tutorial,yunjey,56,2019-09-15T19:12:19Z,PyTorch Tutorial for Deep Learning Researchers
76,Python,hosts,13774,1225,Python,https://github.com/StevenBlack/hosts,StevenBlack,58,2019-10-19T07:07:20Z,"Extending and consolidating hosts files from several well-curated sources like adaway.org, mvps.org, malwaredomainlist.com, someonewhocares.org, and potentially others.  You can optionally invoke extensions to block additional sites by category. "
77,Python,pyspider,13741,3371,Python,https://github.com/binux/pyspider,binux,250,2019-10-18T17:40:34Z,A Powerful Spider(Web Crawler) System in Python.
78,Python,celery,13673,3478,Python,https://github.com/celery/celery,celery,361,2019-10-23T06:02:03Z,Distributed Task Queue (development branch)
79,Python,funNLP,13623,4029,Python,https://github.com/fighting41love/funNLP,fighting41love,2,2019-10-15T13:35:10Z,"中英文敏感词、语言检测、中外手机/电话归属地/运营商查询、名字推断性别、手机号抽取、身份证抽取、邮箱抽取、中日文人名库、中文缩写库、拆字词典、词汇情感值、停用词、反动词表、暴恐词表、繁简体转换、英文模拟中文发音、汪峰歌词生成器、职业名称词库、同义词库、反义词库、否定词库、汽车品牌词库、汽车零件词库、连续英文切割、各种中文词向量、公司名字大全、古诗词库、IT词库、财经词库、成语词库、地名词库、历史名人词库、诗词词库、医学词库、饮食词库、法律词库、汽车词库、动物词库、中文聊天语料、中文谣言数据、百度中文问答数据集、句子相似度匹配算法集合、bert资源、文本生成&摘要相关工具、cocoNLP信息抽取工具、国内电话号码正则匹配、清华大学XLORE:中英文跨语言百科知识图谱、清华大学人工智能技术系列报告、自然语言生成、NLU太难了系列、自动对联数据及机器人、用户名黑名单列表、罪名法务名词及分类模型、微信公众号语料、cs224n深度学习自然语言处理课程、中文手写汉字识别、中文自然语言处理 语料/数据集、变量命名神器、分词语料库+代码、任务型对话英文数据集、ASR 语音数据集 + 基于深度学习的中文语音识别系统、笑声检测器、Microsoft多语言数字/单位/如日期时间识别包、中华新华字典数据库及api(包括常用歇后语、成语、词语和汉字)、文档图谱自动生成、SpaCy 中文模型、Common Voice语音识别数据集新版、神经网络关系抽取、基于bert的命名实体识别、关键词(Keyphrase)抽取包pke、基于医疗领域知识图谱的问答系统、基于依存句法与语义角色标注的事件三元组抽取、依存句法分析4万句高质量标注数据、cnocr：用来做中文OCR的Python3包、中文人物关系知识图谱项目、中文nlp竞赛项目及代码汇总、中文字符数据、speech-aligner: 从“人声语音”及其“语言文本”产生音素级别时间对齐标注的工具、AmpliGraph: 知识图谱表示学习(Python)库：知识图谱概念链接预测、Scattertext 文本可视化(python)、语言/知识表示工具：BERT & ERNIE、中文对比英文自然语言处理NLP的区别综述、Synonyms中文近义词工具包、HarvestText领域自适应文本挖掘工具（新词发现-情感分析-实体链接等）、word2word：(Python)方便易用的多语言词-词对集：62种语言/3,564个多语言对、语音识别语料生成工具：从具有音频/字幕的在线视频创建自动语音识别(ASR)语料库、构建医疗实体识别的模型（包含词典和语料标注）、单文档非监督的关键词抽取、Kashgari中使用gpt-2语言模型、开源的金融投资数据提取工具、文本自动摘要库TextTeaser: 仅支持英文、人民日报语料处理工具集、一些关于自然语言的基本模型、基于14W歌曲知识库的问答尝试--功能包括歌词接龙and已知歌词找歌曲以及歌曲歌手歌词三角关系的问答、基于Siamese bilstm模型的相似句子判定模型并提供训练数据集和测试数据集、用Transformer编解码模型实现的根据Hacker News文章标题自动生成评论、用BERT进行序列标记和文本分类的模板代码、LitBank：NLP数据集——支持自然语言处理和计算人文学科任务的100部带标记英文小说语料、百度开源的基准信息抽取系统、虚假新闻数据集、Facebook: LAMA语言模型分析，提供Transformer-XL/BERT/ELMo/GPT预训练语言模型的统一访问接口、CommonsenseQA：面向常识的英文QA挑战、中文知识图谱资料、数据及工具、各大公司内部里大牛分享的技术文档 PDF 或者 PPT、自然语言生成SQL语句（英文）、中文NLP数据增强（EDA）工具、英文NLP数据增强工具 、基于医药知识图谱的智能问答系统、京东商品知识图谱、基于mongodb存储的军事领域知识图谱问答项目、基于远监督的中文关系抽取、语音情感分析、中文ULMFiT-情感分析-文本分类-语料及模型、一个拍照做题程序、世界各国大规模人名库、一个利用有趣中文语料库 qingyun 训练出来的中文聊天机器人、中文聊天机器人seqGAN、省市区镇行政区划数据带拼音标注、教育行业新闻语料库包含自动文摘功能、开放了对话机器人-知识图谱-语义理解-自然语言处理工具及数据、中文知识图谱：基于百度百科中文页面-抽取三元组信息-构建中文知识图谱、masr: 中文语音识别-提供预训练模型-高识别率、Python音频数据增广库、中文全词覆盖BERT及两份阅读理解数据、ConvLab：开源多域端到端对话系统平台、中文自然语言处理数据集、基于最新版本rasa搭建的对话系统、基于TensorFlow和BERT的管道式实体及关系抽取、一个小型的证券知识图谱/知识库、复盘所有NLP比赛的TOP方案、OpenCLaP：多领域开源中文预训练语言模型仓库、中文自然语言处理向量合集、基于金融-司法领域(兼有闲聊性质)的聊天机器人、g2pC：基于上下文的汉语读音自动标记模块、Zincbase 知识图谱构建工具包、诗歌质量评价/细粒度情感诗歌语料库。"
80,Python,TensorFlow-Course,13586,2698,Python,https://github.com/machinelearningmindset/TensorFlow-Course,machinelearningmindset,2,2019-09-22T02:43:52Z,Simple and ready-to-use tutorials for TensorFlow 
81,Python,ML-From-Scratch,13393,2477,Python,https://github.com/eriklindernoren/ML-From-Scratch,eriklindernoren,13,2019-10-18T21:42:17Z,Machine Learning From Scratch. Bare bones NumPy implementations of machine learning models and algorithms with a focus on accessibility. Aims to cover everything from linear regression to deep learning.
82,Python,black,13055,689,Python,https://github.com/psf/black,psf,222,2019-10-21T18:58:04Z,The uncompromising Python code formatter
83,Python,sanic,12943,1213,Python,https://github.com/huge-success/sanic,huge-success,58,2019-10-22T15:42:53Z,Async Python 3.6+ web server/framework | Build fast. Run fast.
84,Python,PySnooper,12779,796,Python,https://github.com/cool-RR/PySnooper,cool-RR,16,2019-10-23T08:03:34Z,Never use print for debugging again
85,Python,bitcoinbook,12407,3614,Python,https://github.com/bitcoinbook/bitcoinbook,bitcoinbook,73,2019-10-12T04:48:07Z,Mastering Bitcoin 2nd Edition - Programming the Open Blockchain
86,Python,NLP-progress,12390,2132,Python,https://github.com/sebastianruder/NLP-progress,sebastianruder,24,2019-10-22T18:33:03Z,"Repository to track the progress in Natural Language Processing (NLP), including the datasets and the current state-of-the-art for the most common NLP tasks."
87,Python,luigi,12364,2027,Python,https://github.com/spotify/luigi,spotify,63,2019-10-17T17:54:15Z,"Luigi is a Python module that helps you build complex pipelines of batch jobs. It handles dependency resolution, workflow management, visualization etc. It also comes with Hadoop support built in. "
88,Python,tqdm,12025,624,Python,https://github.com/tqdm/tqdm,tqdm,216,2019-10-22T23:46:36Z,"A Fast, Extensible Progress Bar for Python and CLI"
89,Python,bokeh,11811,2949,Python,https://github.com/bokeh/bokeh,bokeh,445,2019-10-23T01:35:54Z,"Interactive Data Visualization in the browser, from  Python"
90,Python,nginx-proxy,11781,2159,Python,https://github.com/jwilder/nginx-proxy,jwilder,558,2019-10-08T13:07:56Z,Automated nginx proxy for Docker containers using docker-gen
91,Python,fabric,11770,1776,Python,https://github.com/fabric/fabric,fabric,371,2019-10-15T04:02:50Z,"Simple, Pythonic remote execution and deployment."
92,Python,Awesome-Linux-Software,11640,1115,Python,https://github.com/luong-komorebi/Awesome-Linux-Software,luong-komorebi,11,2019-10-14T11:07:27Z,"A list of awesome applications, software, tools and other materials for Linux distros. "
93,Python,locust,11147,1605,Python,https://github.com/locustio/locust,locustio,81,2019-10-23T10:00:57Z,Scalable user load testing tool written in Python
94,Python,wxpy,11023,1938,Python,https://github.com/youfou/wxpy,youfou,278,2019-07-14T17:59:47Z,微信机器人 / 可能是最优雅的微信个人号 API ✨✨
95,Python,material-theme,10995,789,Python,https://github.com/equinusocio/material-theme,equinusocio,3,2019-08-20T19:59:53Z,"Material Theme, the most epic theme for Sublime Text 3 by Mattia Astorino"
96,Python,powerline,10828,830,Python,https://github.com/powerline/powerline,powerline,160,2019-10-20T07:09:40Z,"Powerline is a statusline plugin for vim, and provides statuslines and prompts for several other applications, including zsh, bash, tmux, IPython, Awesome and Qtile."
97,Python,zulip,10537,3271,Python,https://github.com/zulip/zulip,zulip,1351,2019-10-23T08:24:22Z,Zulip server - powerful open source team chat
98,Python,examples,10514,4890,Python,https://github.com/pytorch/examples,pytorch,193,2019-10-22T21:45:46Z,"A set of examples around pytorch in Vision, Text, Reinforcement Learning, etc."
99,Python,pix2code,10506,1107,Python,https://github.com/tonybeltramelli/pix2code,tonybeltramelli,0,2019-04-09T23:35:37Z,pix2code: Generating Code from a Graphical User Interface Screenshot
100,Python,cookiecutter,10478,1161,Python,https://github.com/cookiecutter/cookiecutter,cookiecutter,205,2019-10-16T00:35:56Z,"A command-line utility that creates projects from cookiecutters (project templates). E.g. Python package projects, jQuery plugin projects."
1,R,ggplot2,4066,1513,R,https://github.com/tidyverse/ggplot2,tidyverse,165,2019-10-23T06:01:01Z,An implementation of the Grammar of Graphics in R
2,R,awesome-R,3722,1236,R,https://github.com/qinwf/awesome-R,qinwf,14,2019-10-18T13:25:56Z,"A curated list of awesome R packages, frameworks and software."
3,R,shiny,3583,1540,R,https://github.com/rstudio/shiny,rstudio,463,2019-10-22T21:27:13Z,Easy interactive web applications with R
4,R,ML_for_Hackers,3536,2234,R,https://github.com/johnmyleswhite/ML_for_Hackers,johnmyleswhite,34,2019-05-26T16:52:29Z,"Code accompanying the book ""Machine Learning for Hackers"""
5,R,dplyr,3099,1131,R,https://github.com/tidyverse/dplyr,tidyverse,165,2019-10-22T14:34:44Z,dplyr: A grammar of data manipulation
6,R,swirl_courses,3055,6304,R,https://github.com/swirldev/swirl_courses,swirldev,132,2019-09-20T22:50:29Z,:mortar_board: A collection of interactive courses for the swirl R package.
7,R,AnomalyDetection,3044,690,R,https://github.com/twitter/AnomalyDetection,twitter,68,2019-08-30T19:49:16Z,Anomaly Detection with R
8,R,r4ds,2121,2671,R,https://github.com/hadley/r4ds,hadley,123,2019-10-14T13:03:31Z,R for data science: a book
9,R,devtools,1872,665,R,https://github.com/r-lib/devtools,r-lib,24,2019-10-03T15:01:38Z,Tools to make an R developer's life easier
10,R,knitr,1839,764,R,https://github.com/yihui/knitr,yihui,74,2019-10-15T19:38:48Z,A general-purpose tool for dynamic report generation in R
11,R,benchm-ml,1704,321,R,https://github.com/szilard/benchm-ml,szilard,10,2019-08-19T04:22:47Z,"A minimal benchmark for scalability, speed and accuracy of commonly used open source implementations (R packages, Python scikit-learn, H2O, xgboost, Spark MLlib etc.) of the top machine learning algorithms for binary classification (random forests, gradient boosted trees, deep neural networks etc.)."
12,R,investing,1694,108,R,https://github.com/zonination/investing,zonination,0,2016-12-27T13:58:02Z,Investing Returns on the Market as a Whole
13,R,bookdown,1638,740,R,https://github.com/rstudio/bookdown,rstudio,93,2019-10-17T01:34:48Z,Authoring Books and Technical Documents with R Markdown
14,R,rmarkdown,1636,695,R,https://github.com/rstudio/rmarkdown,rstudio,134,2019-10-22T08:57:24Z,Dynamic Documents for R
15,R,awesome-network-analysis,1624,347,R,https://github.com/briatte/awesome-network-analysis,briatte,19,2019-08-26T11:37:17Z,A curated list of awesome network analysis resources.
16,R,nyc-taxi-data,1594,484,R,https://github.com/toddwschneider/nyc-taxi-data,toddwschneider,1,2019-09-23T23:09:47Z,"Import public NYC taxi and for-hire vehicle (Uber, Lyft, etc.) trip data into PostgreSQL database"
17,R,stats337,1576,238,R,https://github.com/hadley/stats337,hadley,7,2018-06-21T15:57:29Z,Readings in applied data science
18,R,plotly,1561,534,R,https://github.com/ropensci/plotly,ropensci,299,2019-10-23T00:20:12Z,An interactive graphing library for R
19,R,DataScienceR,1389,762,R,https://github.com/ujjwalkarn/DataScienceR,ujjwalkarn,3,2018-04-18T00:01:52Z,"a curated list of R tutorials for Data Science, NLP and Machine Learning "
20,R,gganimate,1332,247,R,https://github.com/thomasp85/gganimate,thomasp85,93,2019-10-03T07:23:11Z,A Grammar of Animated Graphics
21,R,mlr,1327,365,R,https://github.com/mlr-org/mlr,mlr-org,355,2019-10-23T09:30:56Z,mlr: Machine Learning in R 
22,R,tidytuesday,1246,570,R,https://github.com/rfordatascience/tidytuesday,rfordatascience,65,2019-10-21T14:27:41Z,Official repo for the #tidytuesday project
23,R,DiagrammeR,1232,186,R,https://github.com/rich-iannone/DiagrammeR,rich-iannone,108,2019-08-22T04:39:32Z,Graph and network visualization using tabular data in R.
24,R,tensorflow,1155,316,R,https://github.com/rstudio/tensorflow,rstudio,5,2019-10-22T15:07:19Z,TensorFlow for R
25,R,patchwork,1141,90,R,https://github.com/thomasp85/patchwork,thomasp85,30,2019-09-06T14:58:37Z,The Composer of ggplots
26,R,caret,1120,534,R,https://github.com/topepo/caret,topepo,147,2019-09-20T17:17:37Z,caret (Classification And Regression Training) R package that contains misc functions for training and plotting classification and regression models
27,R,rvest,1111,276,R,https://github.com/tidyverse/rvest,tidyverse,33,2019-09-14T13:51:28Z,Simple web scraping for R
28,R,labs,1077,1483,R,https://github.com/genomicsclass/labs,genomicsclass,16,2019-10-16T17:42:14Z,Rmd source files for the HarvardX series PH525x
29,R,wesanderson,1052,88,R,https://github.com/karthik/wesanderson,karthik,10,2019-02-01T23:29:59Z,A Wes Anderson color palette for R
30,R,blogdown,1035,236,R,https://github.com/rstudio/blogdown,rstudio,12,2019-10-08T13:53:28Z,Create Blogs and Websites with R Markdown
31,R,CausalImpact,1013,168,R,https://github.com/google/CausalImpact,google,20,2019-04-17T12:47:39Z,An R package for causal inference in time series
32,R,ggthemes,1008,197,R,https://github.com/jrnold/ggthemes,jrnold,2,2019-05-13T14:40:04Z,"Additional themes, scales, and geoms for ggplot2"
33,R,reticulate,979,181,R,https://github.com/rstudio/reticulate,rstudio,232,2019-10-22T18:22:42Z,R Interface to Python
34,R,tofsims,953,5,R,https://github.com/fossasia/tofsims,fossasia,0,2017-11-29T19:16:12Z,
35,R,drake,950,104,R,https://github.com/ropensci/drake,ropensci,1,2019-10-23T02:16:54Z,An R-focused pipeline toolkit for reproducibility and high-performance computing
36,R,plumber,927,176,R,https://github.com/rstudio/plumber,rstudio,133,2019-10-22T22:46:22Z,Turn your R code into a web API.
37,R,broom,904,247,R,https://github.com/tidymodels/broom,tidymodels,145,2019-10-21T16:39:10Z,Convert statistical analysis objects from R into tidy format
38,R,bbplot,904,146,R,https://github.com/bbc/bbplot,bbc,11,2019-03-19T02:15:52Z,R package that helps create and export ggplot2 charts in the style used by the BBC News data team
39,R,gt,901,66,R,https://github.com/rstudio/gt,rstudio,149,2019-10-04T15:19:49Z,"Easily generate information-rich, publication-quality tables from R"
40,R,rethinking,871,277,R,https://github.com/rmcelreath/rethinking,rmcelreath,99,2019-10-01T11:55:41Z,Statistical Rethinking course and book package
41,R,rayshader,862,81,R,https://github.com/tylermorganwall/rayshader,tylermorganwall,20,2019-09-15T00:47:26Z,R Package for 2D and 3D mapping and data visualization
42,R,swirl,836,551,R,https://github.com/swirldev/swirl,swirldev,191,2019-07-19T18:09:49Z,":cyclone: Learn R, in R."
43,R,tidytext,821,161,R,https://github.com/juliasilge/tidytext,juliasilge,5,2019-09-24T04:49:16Z,"Text mining using dplyr, ggplot2, and other tidy tools :sparkles::page_facing_up::sparkles::page_facing_up::sparkles:"
44,R,purrr,817,191,R,https://github.com/tidyverse/purrr,tidyverse,84,2019-10-18T21:28:58Z,A functional programming toolkit for R
45,R,slidify,813,353,R,https://github.com/ramnathv/slidify,ramnathv,180,2016-08-02T03:54:45Z,Generate reproducible html5 slides from R markdown
46,R,tidyr,811,330,R,https://github.com/tidyverse/tidyr,tidyverse,43,2019-10-19T13:47:06Z,Easily tidy data with spread and gather functions.
47,R,httr,808,1866,R,https://github.com/r-lib/httr,r-lib,35,2019-10-15T23:47:25Z,httr: a friendly http package for R
48,R,rnaseq_tutorial,796,433,R,https://github.com/griffithlab/rnaseq_tutorial,griffithlab,11,2019-08-06T13:22:55Z,"Informatics for RNA-seq: A web resource for analysis on the cloud. Educational tutorials and working pipelines for RNA-seq analysis including an introduction to: cloud computing, critical file formats, reference genomes, gene annotation, expression, differential expression, alternative splicing, data visualization, and interpretation."
49,R,advanced-shiny,788,286,R,https://github.com/daattali/advanced-shiny,daattali,1,2019-05-20T07:34:57Z,Shiny tips & tricks for improving your apps and solving common problems
50,R,esquisse,787,88,R,https://github.com/dreamRs/esquisse,dreamRs,25,2019-09-18T08:41:15Z,RStudio add-in to make plots with ggplot2
51,R,tidyverse,765,161,R,https://github.com/tidyverse/tidyverse,tidyverse,6,2019-09-23T12:30:44Z,Easily install and load packages from the tidyverse
52,R,forecast,762,269,R,https://github.com/robjhyndman/forecast,robjhyndman,12,2019-10-16T06:55:16Z,forecast package for R
53,R,readr,730,223,R,https://github.com/tidyverse/readr,tidyverse,94,2019-10-22T14:08:56Z,"Read flat files (csv, tsv, fwf) into R"
54,R,janitor,725,74,R,https://github.com/sfirke/janitor,sfirke,55,2019-08-11T11:15:55Z,simple tools for data cleaning in R
55,R,googlesheets,719,178,R,https://github.com/jennybc/googlesheets,jennybc,91,2019-10-18T15:17:07Z,Google Spreadsheets R API
56,R,magrittr,713,133,R,https://github.com/tidyverse/magrittr,tidyverse,28,2019-01-05T16:37:00Z,Improve the readability of R code with the pipe
57,R,sparklyr,702,257,R,https://github.com/rstudio/sparklyr,rstudio,461,2019-10-23T06:23:22Z,R interface for Apache Spark
58,R,MLPB,691,271,R,https://github.com/ben519/MLPB,ben519,0,2019-06-04T17:32:17Z,Machine Learning Problem Bible | Problem Set Here >>
59,R,skimr,684,57,R,https://github.com/ropensci/skimr,ropensci,17,2019-10-21T19:30:33Z,"A frictionless, pipeable approach to dealing with summary statistics"
60,R,ggraph,679,79,R,https://github.com/thomasp85/ggraph,thomasp85,35,2019-10-03T09:20:33Z,Grammar of Graph Graphics
61,R,BanditsBook,667,231,R,https://github.com/johnmyleswhite/BanditsBook,johnmyleswhite,6,2018-04-05T06:34:29Z,Code for my book on Multi-Armed Bandit Algorithms
62,R,ggrepel,662,73,R,https://github.com/slowkow/ggrepel,slowkow,21,2019-04-30T00:50:57Z,:round_pushpin: Repel overlapping text labels away from each other.
63,R,ggvis,656,182,R,https://github.com/rstudio/ggvis,rstudio,191,2019-10-11T21:35:19Z,Interactive grammar of graphics for R
64,R,SparkR-pkg,653,345,R,https://github.com/amplab-extras/SparkR-pkg,amplab-extras,21,2016-06-10T21:42:55Z,R frontend for Spark
65,R,rappor,650,125,R,https://github.com/google/rappor,google,35,2019-08-23T22:12:08Z,RAPPOR: Privacy-Preserving Reporting Algorithms
66,R,r-source,649,207,R,https://github.com/wch/r-source,wch,0,2019-10-23T00:07:48Z,"Read-only mirror of R source code from https://svn.r-project.org/R/, updated hourly. See the build instructions on the wiki page."
67,R,lintr,640,112,R,https://github.com/jimhester/lintr,jimhester,61,2019-10-17T11:42:05Z,Static Code Analysis for R
