rank,item,repo_name,stars,forks,language,repo_url,username,issues,last_commit,description
34,CPP,yoga,11627,882,C++,https://github.com/facebook/yoga,facebook,196,2019-04-09T10:12:36Z,Yoga is a cross-platform layout engine which implements Flexbox. Follow https://twitter.com/yogalayout for updates.
35,CPP,googletest,11163,4595,C++,https://github.com/google/googletest,google,97,2019-04-10T00:31:31Z,Googletest - Google Testing and Mocking Framework
36,CPP,sqlitebrowser,11064,1273,C++,https://github.com/sqlitebrowser/sqlitebrowser,sqlitebrowser,324,2019-04-08T17:31:20Z,"Official home of the DB Browser for SQLite (DB4S) project. Previously known as ""SQLite Database Browser"" and ""Database Browser for SQLite"". Website at: "
37,CPP,uWebSockets,10409,964,C++,https://github.com/uNetworking/uWebSockets,uNetworking,15,2019-04-03T22:32:37Z,"Simple, secure & standards compliant web I/O for the most demanding of applications"
38,CPP,DeepSpeech,9879,1778,C++,https://github.com/mozilla/DeepSpeech,mozilla,116,2019-04-09T22:36:26Z,A TensorFlow implementation of Baidu's DeepSpeech architecture
39,CPP,foundationdb,9179,703,C++,https://github.com/apple/foundationdb,apple,199,2019-04-10T03:48:43Z,"FoundationDB - the open source, distributed, transactional key-value store"
40,CPP,envoy,9138,1369,C++,https://github.com/envoyproxy/envoy,envoyproxy,486,2019-04-10T03:58:54Z,Cloud-native high-performance edge/middle/service proxy
41,CPP,libphonenumber,8903,1128,C++,https://github.com/googlei18n/libphonenumber,googlei18n,79,2019-04-03T07:04:00Z,"Google's common Java, C++ and JavaScript library for parsing, formatting, and validating international phone numbers."
42,CPP,hardseed,8862,1926,C++,https://github.com/yangyangwithgnu/hardseed,yangyangwithgnu,34,2018-08-25T17:29:23Z,"SEX IS ZERO (0), so, who wanna be the ONE (1), aha?"
43,CPP,Catch2,8748,1450,C++,https://github.com/catchorg/Catch2,catchorg,196,2019-04-09T09:51:20Z,"A modern, C++-native, header-only, test framework for unit-tests, TDD and BDD - using C++11, C++14, C++17 and later (or C++03 on the Catch1.x branch)"
44,CPP,xbmc,8704,4970,C++,https://github.com/xbmc/xbmc,xbmc,429,2019-04-09T22:55:24Z,"Kodi is an award-winning free and open source home theater/media center software and entertainment hub for digital media. With its beautiful interface and powerful skinning engine, it's available for Android, BSD, Linux, macOS, iOS and Windows."
45,CPP,CRYENGINE,8631,1666,C++,https://github.com/CRYTEK/CRYENGINE,CRYTEK,127,2019-04-09T16:23:35Z,CRYENGINE is a powerful real-time game development platform created by Crytek.
46,CPP,napajs,8608,315,C++,https://github.com/Microsoft/napajs,Microsoft,61,2018-10-30T21:08:57Z,Napa.js: a multi-threaded JavaScript runtime
47,CPP,openage,8580,835,C++,https://github.com/SFTtech/openage,SFTtech,196,2019-04-08T19:47:37Z,Free (as in freedom) open source clone of the Age of Empires II engine :rocket:
48,CPP,turicreate,8461,807,C++,https://github.com/apple/turicreate,apple,366,2019-04-10T03:25:55Z,Turi Create simplifies the development of custom machine learning models.
49,CPP,Paddle,8410,2275,C++,https://github.com/PaddlePaddle/Paddle,PaddlePaddle,908,2019-04-10T03:35:30Z,PArallel Distributed Deep LEarning （PaddlePaddle核心框架，高性能单机、分布式训练和跨平台部署）
50,CPP,incubator-brpc,8402,1940,C++,https://github.com/apache/incubator-brpc,apache,100,2019-04-09T14:22:06Z,"Industrial-grade RPC framework used throughout Baidu, with 1,000,000+ instances and thousands kinds of services, called ""baidu-rpc"" inside Baidu."
51,CPP,openalpr,8297,1837,C++,https://github.com/openalpr/openalpr,openalpr,389,2019-03-26T12:25:17Z,Automatic License Plate Recognition library
52,CPP,Proton,8264,276,C++,https://github.com/ValveSoftware/Proton,ValveSoftware,1720,2019-04-04T21:10:37Z,Compatibility tool for Steam Play based on Wine and additional components
53,CPP,Karabiner-Elements,8247,517,C++,https://github.com/tekezo/Karabiner-Elements,tekezo,103,2019-04-10T02:49:20Z,Karabiner-Elements is a powerful utility for keyboard customization on macOS Sierra (10.12) or later.
54,CPP,LightGBM,8239,2229,C++,https://github.com/Microsoft/LightGBM,Microsoft,98,2019-04-09T16:17:37Z,"A fast, distributed, high performance gradient boosting (GBDT, GBRT, GBM or MART) framework based on decision tree algorithms, used for ranking, classification and many other machine learning tasks. It is under the umbrella of the DMTK(http://github.com/microsoft/dmtk) project of Microsoft."
55,CPP,mosh,8189,511,C++,https://github.com/mobile-shell/mosh,mobile-shell,208,2019-03-27T08:26:14Z,Mobile Shell
56,CPP,vnpy,8025,3726,C++,https://github.com/vnpy/vnpy,vnpy,14,2019-04-10T02:21:48Z,基于Python的开源量化交易平台开发框架
57,CPP,wkhtmltopdf,8011,1136,C++,https://github.com/wkhtmltopdf/wkhtmltopdf,wkhtmltopdf,736,2019-03-24T17:03:37Z,Convert HTML to PDF using Webkit (QtWebKit)
58,CPP,watchman,7858,599,C++,https://github.com/facebook/watchman,facebook,73,2019-04-09T19:40:38Z,"Watches files and records, or triggers actions, when they change. "
59,CPP,arangodb,7816,563,C++,https://github.com/arangodb/arangodb,arangodb,544,2019-04-09T23:34:11Z,"🥑 ArangoDB is a native multi-model database with flexible data models for documents, graphs, and key-values. Build high performance applications using a convenient SQL-like query language or JavaScript extensions."
60,CPP,rapidjson,7503,2069,C++,https://github.com/Tencent/rapidjson,Tencent,366,2019-04-09T05:21:59Z,A fast JSON parser/generator for C++ with both SAX/DOM style API
61,CPP,AirSim,7317,1962,C++,https://github.com/Microsoft/AirSim,Microsoft,404,2019-04-10T03:04:53Z,"Open source simulator for autonomous vehicles built on Unreal Engine / Unity, from Microsoft AI & Research"
62,CPP,notepad-plus-plus,7276,2128,C++,https://github.com/notepad-plus-plus/notepad-plus-plus,notepad-plus-plus,2242,2019-04-09T11:13:32Z,Notepad++ official repository
63,CPP,MMKV,6910,677,C++,https://github.com/Tencent/MMKV,Tencent,1,2019-04-09T08:53:03Z,"An efficient, small mobile key-value storage framework developed by WeChat. Works on iOS, Android, macOS and Windows."
64,CPP,OpenRCT2,6886,753,C++,https://github.com/OpenRCT2/OpenRCT2,OpenRCT2,1056,2019-04-10T04:00:24Z,An open source re-implementation of RollerCoaster Tycoon 2 🎢
65,CPP,solidity,6834,1848,C++,https://github.com/ethereum/solidity,ethereum,624,2019-04-09T19:47:26Z,"Solidity, the Contract-Oriented Programming Language"
66,CPP,yuzu,6788,433,C++,https://github.com/yuzu-emu/yuzu,yuzu-emu,99,2019-04-10T03:36:50Z,Nintendo Switch Emulator
67,CPP,zeal,6736,525,C++,https://github.com/zealdocs/zeal,zealdocs,124,2019-04-09T05:24:15Z,Offline documentation browser inspired by Dash
68,CPP,tinyrenderer,6619,513,C++,https://github.com/ssloy/tinyrenderer,ssloy,5,2019-02-20T13:41:57Z,A brief computer graphics / rendering course
69,CPP,ClickHouse,6604,1112,C++,https://github.com/yandex/ClickHouse,yandex,678,2019-04-09T22:32:16Z,ClickHouse is a free analytic DBMS for big data.
70,CPP,Tars,6557,1619,C++,https://github.com/TarsCloud/Tars,TarsCloud,41,2019-04-10T00:18:19Z,Tars is a highly performance rpc framework based on naming service using tars protocol and provides a semi-automatic operation platform.
71,CPP,libfacedetection,6555,1790,C++,https://github.com/ShiqiYu/libfacedetection,ShiqiYu,78,2019-03-28T13:04:20Z,An open source library for face detection in images. The face detection speed can reach 1500FPS. 
72,CPP,AudioKit,6510,1007,C++,https://github.com/AudioKit/AudioKit,AudioKit,9,2019-04-09T22:59:43Z,"Swift audio synthesis, processing, & analysis platform for iOS, macOS and tvOS"
73,CPP,simdjson,6501,320,C++,https://github.com/lemire/simdjson,lemire,39,2019-04-08T15:23:50Z,Parsing gigabytes of JSON per second 
74,CPP,Gource,6443,530,C++,https://github.com/acaudwell/Gource,acaudwell,70,2019-02-28T22:57:04Z,software version control visualization
75,CPP,filament,6439,375,C++,https://github.com/google/filament,google,32,2019-04-10T03:53:24Z,"Filament is a real-time physically based rendering engine for Android, iOS, Windows, Linux, macOS and WASM/WebGL"
76,CPP,Sonoff-Tasmota,6431,1476,C++,https://github.com/arendst/Sonoff-Tasmota,arendst,36,2019-04-10T00:57:52Z,"Provide ESP8266 based itead Sonoff with Web, MQTT and OTA firmware using Arduino IDE or PlatformIO"
77,CPP,capnproto,6373,528,C++,https://github.com/capnproto/capnproto,capnproto,94,2019-04-08T17:01:25Z,Cap'n Proto serialization/RPC system - core tools and C++ library
78,CPP,rpcs3,6349,1107,C++,https://github.com/RPCS3/rpcs3,RPCS3,428,2019-04-10T03:48:55Z,PS3 emulator/debugger
79,CPP,shadowsocks-qt5,6300,1977,C++,https://github.com/shadowsocks/shadowsocks-qt5,shadowsocks,44,2019-01-01T20:28:17Z,A cross-platform shadowsocks GUI client
80,CPP,vowpal_wabbit,6222,1523,C++,https://github.com/VowpalWabbit/vowpal_wabbit,VowpalWabbit,71,2019-04-09T22:09:54Z,"Vowpal Wabbit is a machine learning system which pushes the frontier of machine learning with techniques such as online, hashing, allreduce, reductions, learning2search, active, and interactive learning."
81,CPP,faiss,6159,1167,C++,https://github.com/facebookresearch/faiss,facebookresearch,46,2019-04-09T11:00:33Z,A library for efficient similarity search and clustering of dense vectors.
82,CPP,node-sass,6092,847,C++,https://github.com/sass/node-sass,sass,154,2019-04-04T14:22:37Z,:rainbow: Node.js bindings to libsass
83,CPP,thrift,6088,2834,C++,https://github.com/apache/thrift,apache,12,2019-04-06T07:53:59Z,Apache Thrift
84,CPP,aseprite,6068,635,C++,https://github.com/aseprite/aseprite,aseprite,683,2019-04-05T16:43:18Z,"Animated sprite editor & pixel art tool (Windows, macOS, Linux)"
85,CPP,bgfx,6062,1001,C++,https://github.com/bkaradzic/bgfx,bkaradzic,204,2019-04-10T03:18:30Z,"Cross-platform, graphics API agnostic, ""Bring Your Own Engine/Framework"" style rendering library."
86,CPP,qBittorrent,6042,1023,C++,https://github.com/qbittorrent/qBittorrent,qbittorrent,2420,2019-04-09T16:47:13Z,qBittorrent BitTorrent client
87,CPP,ssdb,6038,1226,C++,https://github.com/ideawu/ssdb,ideawu,367,2019-01-24T04:20:23Z,"SSDB - A fast NoSQL database, an alternative to Redis"
88,CPP,ncnn,6008,1584,C++,https://github.com/Tencent/ncnn,Tencent,108,2019-04-07T14:03:20Z,ncnn is a high-performance neural network inference framework optimized for the mobile platform
89,CPP,ceph,5931,3059,C++,https://github.com/ceph/ceph,ceph,621,2019-04-10T03:29:17Z,"Ceph is a distributed object, block, and file storage platform "
90,CPP,horovod,5918,838,C++,https://github.com/horovod/horovod,horovod,291,2019-04-09T23:06:41Z,"Distributed training framework for TensorFlow, Keras, PyTorch, and Apache MXNet."
91,CPP,ConEmu,5832,401,C++,https://github.com/Maximus5/ConEmu,Maximus5,671,2019-04-07T15:02:59Z,"Customizable Windows terminal with tabs, splits, quake-style, hotkeys and more"
92,CPP,android-ndk,5832,2696,C++,https://github.com/googlesamples/android-ndk,googlesamples,27,2019-03-18T18:12:13Z,Android NDK samples with Android Studio
93,CPP,devilution,5811,690,C++,https://github.com/diasurgical/devilution,diasurgical,71,2019-04-10T03:10:42Z,Diablo devolved - magic behind the 1996 computer game
94,CPP,node-canvas,5803,781,C++,https://github.com/Automattic/node-canvas,Automattic,155,2019-04-07T11:43:53Z,Node canvas is a Cairo backed Canvas implementation for NodeJS.
95,CPP,fmt,5643,683,C++,https://github.com/fmtlib/fmt,fmtlib,20,2019-04-09T13:09:50Z,A modern formatting library
96,CPP,muduo,5598,2869,C++,https://github.com/chenshuo/muduo,chenshuo,36,2019-03-15T15:21:57Z,A C++ non-blocking network library for multi-threaded server in Linux
97,CPP,sysdig,5563,507,C++,https://github.com/draios/sysdig,draios,251,2019-04-10T01:06:31Z,Linux system exploration and troubleshooting tool with first class support for containers
98,CPP,srs,5561,2212,C++,https://github.com/ossrs/srs,ossrs,319,2019-04-10T01:11:30Z,"SRS is a simple live streaming cluster, a simple joy."
99,CPP,spdlog,5516,1197,C++,https://github.com/gabime/spdlog,gabime,48,2019-04-10T03:51:29Z,Fast C++ logging library.
100,CPP,keepassxc,5379,396,C++,https://github.com/keepassxreboot/keepassxc,keepassxreboot,559,2019-04-10T02:34:13Z,KeePassXC is a cross-platform community-driven port of the Windows application “Keepass Password Safe”.
1,Clojure,FiraCode,32938,1022,Clojure,https://github.com/tonsky/FiraCode,tonsky,192,2019-04-09T13:27:38Z,Monospaced font with programming ligatures
2,Clojure,metabase,14348,1899,Clojure,https://github.com/metabase/metabase,metabase,2121,2019-04-10T03:34:05Z,"The simplest, fastest way to get business intelligence and analytics  to everyone in your company :yum:"
3,Clojure,LightTable,10553,903,Clojure,https://github.com/LightTable/LightTable,LightTable,185,2019-04-09T15:49:54Z,The Light Table IDE ⛺
4,Clojure,clojurescript,8034,708,Clojure,https://github.com/clojure/clojurescript,clojure,2,2019-04-05T20:37:00Z,Clojure to JS compiler
5,Clojure,om,6618,373,Clojure,https://github.com/omcljs/om,omcljs,76,2019-02-17T20:19:25Z,ClojureScript interface to Facebook's React
6,Clojure,leiningen,6313,1478,Clojure,https://github.com/technomancy/leiningen,technomancy,198,2019-04-05T17:13:14Z,Automate Clojure projects without setting your hair on fire.
7,Clojure,overtone,4565,403,Clojure,https://github.com/overtone/overtone,overtone,85,2019-02-17T09:22:36Z,Collaborative Programmable Music 
8,Clojure,icepick,3795,215,Clojure,https://github.com/frankiesardo/icepick,frankiesardo,24,2018-08-21T21:53:46Z,Android Instance State made easy
9,Clojure,jepsen,3764,441,Clojure,https://github.com/jepsen-io/jepsen,jepsen-io,31,2019-04-10T02:34:46Z,"A framework for distributed systems verification, with fault injection"
10,Clojure,riemann,3746,508,Clojure,https://github.com/riemann/riemann,riemann,23,2019-01-31T19:44:57Z,"A network event stream processing system, in Clojure."
11,Clojure,re-frame,3664,481,Clojure,https://github.com/Day8/re-frame,Day8,29,2019-03-23T01:39:04Z,"A Reagent Framework For Writing SPAs, in Clojurescript."
12,Clojure,compojure,3563,237,Clojure,https://github.com/weavejester/compojure,weavejester,3,2018-08-20T21:11:26Z,A concise routing library for Ring/Clojure
13,Clojure,reagent,3384,275,Clojure,https://github.com/reagent-project/reagent,reagent-project,43,2019-03-03T13:51:38Z,A minimalistic ClojureScript interface to React.js
14,Clojure,alda,3261,196,Clojure,https://github.com/alda-lang/alda,alda-lang,1,2019-04-01T02:09:05Z,A music programming language for musicians. :notes:
15,Clojure,datascript,3250,207,Clojure,https://github.com/tonsky/datascript,tonsky,56,2019-03-11T20:00:54Z,"Immutable database and Datalog query engine for Clojure, ClojureScript and JS"
16,Clojure,clojure-koans,3089,1781,Clojure,https://github.com/functional-koans/clojure-koans,functional-koans,6,2019-03-02T17:22:26Z,A set of exercises for learning Clojure
17,Clojure,mori,3070,142,Clojure,https://github.com/swannodette/mori,swannodette,63,2018-11-09T11:13:57Z,ClojureScript's persistent data structures and supporting API from the comfort of vanilla JavaScript
18,Clojure,modern-cljs,2775,308,Clojure,https://github.com/magomimmo/modern-cljs,magomimmo,37,2018-08-30T16:05:03Z,A series of tutorials on ClojureScript
19,Clojure,ring,2764,425,Clojure,https://github.com/ring-clojure/ring,ring-clojure,29,2019-02-13T14:11:19Z,Clojure HTTP server abstraction
20,Clojure,lein-figwheel,2691,214,Clojure,https://github.com/bhauman/lein-figwheel,bhauman,93,2019-03-23T12:43:45Z,Figwheel builds your ClojureScript code and hot loads it into the browser as you are coding!
21,Clojure,status-react,2598,654,Clojure,https://github.com/status-im/status-react,status-im,411,2019-04-09T22:06:16Z,"a free (libre) open source, mobile OS for Ethereum"
22,Clojure,quil,2292,148,Clojure,https://github.com/quil/quil,quil,23,2019-04-10T03:41:20Z,Main repo. Quil source code.
23,Clojure,clojure-cookbook,2125,394,Clojure,https://github.com/clojure-cookbook/clojure-cookbook,clojure-cookbook,41,2018-12-27T14:38:31Z,This is the home of O'Reilly's Clojure Cookbook - http://clojure-cookbook.com
24,Clojure,aleph,2123,196,Clojure,https://github.com/ztellman/aleph,ztellman,70,2019-04-09T04:12:42Z,asynchronous communication for clojure
25,Clojure,instaparse,2095,123,Clojure,https://github.com/Engelberg/instaparse,Engelberg,27,2019-03-15T06:56:33Z,
26,Clojure,incanter,2073,279,Clojure,https://github.com/incanter/incanter,incanter,70,2019-02-13T09:57:05Z,"Clojure-based, R-like statistical computing and graphics environment for the JVM"
27,Clojure,pedestal,2043,229,Clojure,https://github.com/pedestal/pedestal,pedestal,43,2019-03-27T01:17:59Z,The Pedestal Server-side Libraries
28,Clojure,schema,1945,232,Clojure,https://github.com/plumatic/schema,plumatic,21,2019-01-21T05:45:28Z,Clojure(Script) library for declarative data description and validation
29,Clojure,hiccup,1892,143,Clojure,https://github.com/weavejester/hiccup,weavejester,27,2019-01-22T01:02:10Z,Fast library for rendering HTML in Clojure
30,Clojure,onyx,1864,195,Clojure,https://github.com/onyx-platform/onyx,onyx-platform,78,2019-02-27T05:53:01Z,"Distributed, masterless, high performance, fault tolerant data processing"
31,Clojure,specter,1850,76,Clojure,https://github.com/nathanmarz/specter,nathanmarz,24,2019-01-29T19:25:16Z,Clojure(Script)'s missing piece
32,Clojure,klipse,1834,88,Clojure,https://github.com/viebel/klipse,viebel,74,2019-03-12T05:31:01Z,"A simple client-side code evaluator pluggable on any web page: clojure, ruby, javascript, python, scheme, es2017, jsx, brainfuck, c++, reagent, lua, ocaml, reasonml, prolog, common lisp"
33,Clojure,awesome-clojure,1650,135,Clojure,https://github.com/razum2um/awesome-clojure,razum2um,6,2019-03-06T22:36:17Z,A curated list of awesome Clojure libraries and resources. Inspired by awesome-... stuff
34,Clojure,component,1617,85,Clojure,https://github.com/stuartsierra/component,stuartsierra,2,2019-02-14T12:43:28Z,Managed lifecycle of stateful objects in Clojure
35,Clojure,transit-format,1615,32,Clojure,https://github.com/cognitect/transit-format,cognitect,9,2017-03-15T11:21:48Z,A data interchange format.
36,Clojure,core.async,1597,176,Clojure,https://github.com/clojure/core.async,clojure,2,2018-12-06T16:30:58Z,Facilities for async programming and communication in Clojure
37,Clojure,boot,1566,168,Clojure,https://github.com/boot-clj/boot,boot-clj,115,2019-03-20T18:38:22Z,Build tooling for Clojure.
38,Clojure,lumo,1566,71,Clojure,https://github.com/anmonteiro/lumo,anmonteiro,80,2019-04-10T00:07:15Z,"Fast, cross-platform, standalone ClojureScript environment"
39,Clojure,kibit,1501,117,Clojure,https://github.com/jonase/kibit,jonase,63,2019-04-09T19:47:25Z,There's a function for that!
40,Clojure,Midje,1468,124,Clojure,https://github.com/marick/Midje,marick,37,2019-04-08T11:47:11Z,"Midje provides a migration path from clojure.test to a more flexible, readable, abstract, and gracious style of testing"
41,Clojure,enlive,1462,142,Clojure,https://github.com/cgrand/enlive,cgrand,28,2019-03-02T19:43:18Z,a selector-based (à la CSS) templating and transformation system for Clojure
42,Clojure,Korma,1409,228,Clojure,https://github.com/korma/Korma,korma,81,2018-08-17T15:20:06Z,Tasty SQL for Clojure.
43,Clojure,sente,1395,140,Clojure,https://github.com/ptaoussanis/sente,ptaoussanis,29,2019-04-05T16:02:44Z,Realtime web comms for Clojure/Script
44,Clojure,auto-parcel,1391,90,Clojure,https://github.com/frankiesardo/auto-parcel,frankiesardo,12,2017-02-12T15:10:29Z,Android Parcelable models made easy
45,Clojure,drake,1363,105,Clojure,https://github.com/Factual/drake,Factual,83,2018-12-12T22:36:59Z,"Data workflow tool, like a ""Make for data"""
46,Clojure,plumbing,1356,109,Clojure,https://github.com/plumatic/plumbing,plumatic,10,2018-02-22T03:32:31Z,Prismatic's Clojure(Script) utility belt
47,Clojure,cascalog,1351,177,Clojure,https://github.com/nathanmarz/cascalog,nathanmarz,40,2016-05-06T07:14:10Z,Data processing on Hadoop without the hassle.
48,Clojure,clj-http,1323,339,Clojure,https://github.com/dakrone/clj-http,dakrone,33,2019-03-11T22:58:09Z,An idiomatic clojure http client wrapping the apache client. Offically supported version.
49,Clojure,devcards,1304,100,Clojure,https://github.com/bhauman/devcards,bhauman,23,2019-02-05T15:29:01Z,Devcards aims to provide a visual REPL experience for ClojureScript
50,Clojure,Nightcode,1303,121,Clojure,https://github.com/oakes/Nightcode,oakes,31,2019-04-03T03:20:55Z,An IDE for Clojure
51,Clojure,yesql,1295,109,Clojure,https://github.com/krisajenkins/yesql,krisajenkins,68,2018-08-03T23:28:21Z,A Clojure library for using SQL.
52,Clojure,duckling_old,1295,232,Clojure,https://github.com/wit-ai/duckling_old,wit-ai,72,2019-03-27T22:21:50Z,Deprecated in favor of https://github.com/facebook/duckling
53,Clojure,Arcadia,1253,86,Clojure,https://github.com/arcadia-unity/Arcadia,arcadia-unity,40,2019-04-05T19:47:00Z,Clojure in Unity
54,Clojure,seesaw,1251,137,Clojure,https://github.com/daveray/seesaw,daveray,62,2019-01-09T06:57:10Z,"Seesaw turns the Horror of Swing into a friendly, well-documented, Clojure library"
55,Clojure,chestnut,1247,98,Clojure,https://github.com/plexus/chestnut,plexus,6,2019-04-03T20:11:35Z,Application template for Clojure + ClojureScript web apps
56,Clojure,lacinia,1176,92,Clojure,https://github.com/walmartlabs/lacinia,walmartlabs,14,2019-04-05T22:56:08Z,GraphQL implementation in pure Clojure
57,Clojure,asciinema-player,1175,128,Clojure,https://github.com/asciinema/asciinema-player,asciinema,40,2018-12-31T16:18:56Z,Web player for terminal session recordings ⏩
58,Clojure,liberator,1172,143,Clojure,https://github.com/clojure-liberator/liberator,clojure-liberator,57,2019-03-22T09:24:22Z,Liberator is a Clojure library for building RESTful applications.
59,Clojure,core.logic,1165,103,Clojure,https://github.com/clojure/core.logic,clojure,1,2018-03-06T19:43:22Z,
60,Clojure,ultra,1145,29,Clojure,https://github.com/venantius/ultra,venantius,7,2019-03-09T13:33:25Z,A Leiningen plugin for a superior development environment
61,Clojure,friend,1144,121,Clojure,https://github.com/cemerick/friend,cemerick,32,2017-07-25T15:52:18Z,An extensible authentication and authorization library for Clojure Ring web applications and services. 
62,Clojure,closh,1127,29,Clojure,https://github.com/dundalek/closh,dundalek,43,2019-04-09T20:26:48Z,Bash-like shell based on Clojure
63,Clojure,cortex,1120,95,Clojure,https://github.com/originrose/cortex,originrose,31,2018-09-10T20:29:23Z,Machine learning in Clojure
64,Clojure,timbre,1110,132,Clojure,https://github.com/ptaoussanis/timbre,ptaoussanis,32,2019-02-15T17:48:48Z,Pure Clojure/Script logging library
65,Clojure,cheshire,1100,115,Clojure,https://github.com/dakrone/cheshire,dakrone,27,2019-03-26T20:57:39Z,Clojure JSON and JSON SMILE (binary json format) encoding/decoding
66,Clojure,core.typed,1073,68,Clojure,https://github.com/clojure/core.typed,clojure,0,2018-11-30T13:19:23Z,An optional type system for Clojure
67,Clojure,code-maat,1073,123,Clojure,https://github.com/adamtornhill/code-maat,adamtornhill,11,2019-01-29T20:32:23Z,A command line tool to mine and analyze data from version-control systems
68,Clojure,frak,1023,40,Clojure,https://github.com/noprompt/frak,noprompt,2,2018-11-16T15:40:25Z,Transform collections of strings into regular expressions.
69,Clojure,lein-cljsbuild,1021,163,Clojure,https://github.com/emezeske/lein-cljsbuild,emezeske,50,2018-07-02T13:39:11Z,Leiningen plugin to make ClojureScript development easy.
70,Clojure,frontend,1020,129,Clojure,https://github.com/circleci/frontend,circleci,20,2018-12-25T18:26:30Z,CircleCI's frontend
71,Clojure,lux,1019,40,Clojure,https://github.com/LuxLang/lux,LuxLang,6,2019-04-09T22:59:52Z,The Lux Programming Language
72,Clojure,garden,999,59,Clojure,https://github.com/noprompt/garden,noprompt,40,2019-02-26T18:38:57Z,Generate CSS with Clojure
73,Clojure,hitchhiker-tree,957,66,Clojure,https://github.com/datacrypt-project/hitchhiker-tree,datacrypt-project,17,2018-07-22T21:01:33Z,"Functional, persistent, off-heap, high performance data structure"
74,Clojure,honeysql,947,105,Clojure,https://github.com/jkk/honeysql,jkk,9,2019-04-07T03:31:39Z,Turn Clojure data structures into SQL
75,Clojure,compojure-api,926,128,Clojure,https://github.com/metosin/compojure-api,metosin,29,2019-04-01T23:11:53Z,Sweet web apis with Compojure & Swagger
76,Clojure,4clojure,918,195,Clojure,https://github.com/4clojure/4clojure,4clojure,80,2019-01-01T08:03:51Z,An interactive problem website for learning Clojure
77,Clojure,play-clj,917,70,Clojure,https://github.com/oakes/play-clj,oakes,9,2019-03-11T00:46:23Z,A Clojure game library
78,Clojure,markright,911,58,Clojure,https://github.com/dvcrn/markright,dvcrn,24,2017-03-01T01:38:59Z,➡ Electron powered markdown editor with live preview
79,Clojure,logic-tutorial,893,83,Clojure,https://github.com/swannodette/logic-tutorial,swannodette,14,2018-10-30T11:45:38Z,A Very Gentle Introduction to Relational Programming
80,Clojure,test.check,891,95,Clojure,https://github.com/clojure/test.check,clojure,0,2019-03-10T21:46:53Z,QuickCheck for Clojure
81,Clojure,criterium,886,43,Clojure,https://github.com/hugoduncan/criterium,hugoduncan,13,2017-02-28T09:44:26Z,Benchmarking library for clojure
82,Clojure,core.match,884,52,Clojure,https://github.com/clojure/core.match,clojure,0,2019-04-01T15:22:25Z,
83,Clojure,eastwood,882,58,Clojure,https://github.com/jonase/eastwood,jonase,104,2019-03-27T07:48:06Z,Clojure lint tool
84,Clojure,clojurec,866,52,Clojure,https://github.com/schani/clojurec,schani,5,2018-04-25T22:28:20Z,A Clojure implementation on top of C
85,Clojure,carmine,865,94,Clojure,https://github.com/ptaoussanis/carmine,ptaoussanis,19,2019-04-04T14:06:14Z,Redis client and message queue for Clojure
