rank,item,repo_name,stars,forks,language,repo_url,username,issues,last_commit,description
76,Java,Android-PickerView,10313,2620,Java,https://github.com/Bigkoo/Android-PickerView,Bigkoo,253,2019-05-25T13:27:38Z,"This is a picker view for android , support linkage effect, timepicker and optionspicker.（时间选择器、省市区三级联动）"
77,Java,ARouter,10285,1724,Java,https://github.com/alibaba/ARouter,alibaba,30,2019-07-02T06:44:17Z,💪 A framework for assisting in the renovation of Android componentization (帮助 Android App 进行组件化改造的路由框架)
78,Java,ViewPagerIndicator,10135,4237,Java,https://github.com/JakeWharton/ViewPagerIndicator,JakeWharton,215,2017-11-26T17:13:46Z,Paging indicator widgets compatible with the ViewPager from the Android Support Library and ActionBarSherlock.
79,Java,VasSonic,9997,1382,Java,https://github.com/Tencent/VasSonic,Tencent,16,2019-06-12T14:10:15Z,"VasSonic is a lightweight and high-performance Hybrid framework developed by tencent VAS team, which is intended to speed up the first screen of websites working on Android and iOS platform. "
80,Java,redisson,9937,2431,Java,https://github.com/redisson/redisson,redisson,184,2019-07-23T14:50:20Z,"Redisson - Redis Java client with features of In-Memory Data Grid. Supports over 30 objects and services: Set, Multimap, SortedSet, Map, List, Queue, Deque, Semaphore, Lock, AtomicLong, Map Reduce, Publish / Subscribe, Bloom filter, Spring Cache, Tomcat, Scheduler, JCache API, Hibernate, RPC."
81,Java,vert.x,9927,1554,Java,https://github.com/eclipse-vertx/vert.x,eclipse-vertx,209,2019-07-17T13:05:43Z,Vert.x is a tool-kit for building reactive applications on the JVM
82,Java,Matisse,9877,1484,Java,https://github.com/zhihu/Matisse,zhihu,287,2019-07-17T07:22:44Z,:fireworks: A well-designed local image and video selector for Android
83,Java,graal,9743,621,Java,https://github.com/oracle/graal,oracle,432,2019-07-24T02:25:53Z,GraalVM: Run Programs Faster Anywhere :rocket:
84,Java,dbeaver,9728,816,Java,https://github.com/dbeaver/dbeaver,dbeaver,1282,2019-07-23T19:24:47Z,Free universal database tool and SQL client
85,Java,android-Ultra-Pull-To-Refresh,9660,2827,Java,https://github.com/liaohuqiu/android-Ultra-Pull-To-Refresh,liaohuqiu,173,2018-05-04T21:12:00Z,Ultra Pull to Refresh for Android. Support all the views.
86,Java,vlayout,9638,1670,Java,https://github.com/alibaba/vlayout,alibaba,143,2019-07-22T03:40:00Z,"Project vlayout is a powerfull LayoutManager extension for RecyclerView, it provides a group of layouts for RecyclerView. Make it able to handle a complicate situation when grid, list and other layouts in the same recyclerview. "
87,Java,canal,9621,3306,Java,https://github.com/alibaba/canal,alibaba,158,2019-07-22T01:15:15Z,阿里巴巴 MySQL binlog 增量订阅&消费组件 
88,Java,RxTool,9560,2385,Java,https://github.com/Tamsiree/RxTool,Tamsiree,112,2019-07-18T04:32:22Z,Android开发人员不得不收集的工具类集合 | 支付宝支付 | 微信支付（统一下单） | 微信分享 | Zip4j压缩（支持分卷压缩与加密） | 一键集成UCrop选择圆形头像 | 一键集成二维码和条形码的扫描与生成 | 常用Dialog | WebView的封装可播放视频 | 仿斗鱼滑动验证码 | Toast封装 | 震动 | GPS | Location定位 | 图片缩放 | Exif 图片添加地理位置信息（经纬度） | 蛛网等级 | 颜色选择器 | ArcGis | VTPK | 编译运行一下说不定会找到惊喜
89,Java,flink,9557,5112,Java,https://github.com/apache/flink,apache,512,2019-07-24T00:53:58Z,Apache Flink
90,Java,PocketHub,9431,3655,Java,https://github.com/pockethub/PocketHub,pockethub,116,2019-07-01T10:53:17Z,PocketHub Android App
91,Java,JiaoZiVideoPlayer,9416,2219,Java,https://github.com/lipangit/JiaoZiVideoPlayer,lipangit,185,2019-07-14T13:12:38Z,Android VideoPlayer MediaPlayer VideoView MediaView Float View And Fullscreen.高度自定义的开源安卓视频框架
92,Java,Android-ObservableScrollView,9401,2109,Java,https://github.com/ksoichiro/Android-ObservableScrollView,ksoichiro,179,2017-08-09T11:37:19Z,Android library to observe scroll events on scrollable views.
93,Java,Arduino,9383,6545,Java,https://github.com/arduino/Arduino,arduino,1135,2019-07-23T12:15:04Z,open-source electronics prototyping platform
94,Java,okhttp-OkGo,9372,2291,Java,https://github.com/jeasonlzy/okhttp-OkGo,jeasonlzy,378,2019-07-03T10:54:14Z,OkGo - 3.0 震撼来袭，该库是基于 Http 协议，封装了 OkHttp 的网络请求框架，比 Retrofit 更简单易用，支持 RxJava，RxJava2，支持自定义缓存，支持批量断点下载管理和批量上传管理功能
95,Java,presto,9362,3178,Java,https://github.com/prestodb/presto,prestodb,981,2019-07-24T02:58:24Z,The official home of the Presto distributed SQL query engine for big data
96,Java,recyclerview-animators,9359,1804,Java,https://github.com/wasabeef/recyclerview-animators,wasabeef,99,2019-06-26T06:33:54Z,An Android Animation library which easily add itemanimator to RecyclerView items.
97,Java,hadoop,9340,5821,Java,https://github.com/apache/hadoop,apache,296,2019-07-24T02:09:38Z,Apache Hadoop
98,Java,skywalking,9296,2707,Java,https://github.com/apache/skywalking,apache,65,2019-07-24T02:58:18Z,"APM, Application Performance Monitoring System"
99,Java,SpringCloudLearning,9204,4908,Java,https://github.com/forezp/SpringCloudLearning,forezp,35,2019-06-26T14:57:31Z,《史上最简单的Spring Cloud教程源码》
100,Java,PermissionsDispatcher,9198,1255,Java,https://github.com/permissions-dispatcher/PermissionsDispatcher,permissions-dispatcher,3,2019-06-30T15:18:23Z,Simple annotation-based API to handle runtime permissions.
1,JavaScript,node,62960,14318,JavaScript,https://github.com/nodejs/node,nodejs,1031,2019-07-24T01:07:38Z,Node.js JavaScript runtime :sparkles::turtle::rocket::sparkles:
2,JavaScript,three.js,53306,20131,JavaScript,https://github.com/mrdoob/three.js,mrdoob,792,2019-07-24T02:25:45Z,JavaScript 3D library.
3,JavaScript,atom,49393,12249,JavaScript,https://github.com/atom/atom,atom,636,2019-07-23T13:35:18Z,:atom: The hackable text editor
4,JavaScript,Chart.js,44502,9762,JavaScript,https://github.com/chartjs/Chart.js,chartjs,455,2019-07-21T12:00:13Z,Simple HTML5 Charts using the <canvas> tag
5,JavaScript,lodash,40455,4197,JavaScript,https://github.com/lodash/lodash,lodash,5,2019-07-23T20:58:02Z,"A modern JavaScript utility library delivering modularity, performance, & extras."
6,JavaScript,materialize,36155,4816,JavaScript,https://github.com/Dogfalo/materialize,Dogfalo,688,2019-07-22T18:04:37Z,"Materialize, a CSS Framework based on Material Design"
7,JavaScript,incubator-echarts,35475,10666,JavaScript,https://github.com/apache/incubator-echarts,apache,2934,2019-07-24T02:25:28Z,"A powerful, interactive charting and visualization library for browser"
8,JavaScript,nodebestpractices,31507,2528,JavaScript,https://github.com/i0natan/nodebestpractices,i0natan,38,2019-07-23T12:42:16Z,:white_check_mark: The largest Node.js best practices list (July 2019)
9,JavaScript,realworld,29477,2074,JavaScript,https://github.com/gothinkster/realworld,gothinkster,157,2019-07-23T19:10:52Z,"""The mother of all demo apps"" — Exemplary fullstack Medium.com clone powered by React, Angular, Node, Django, and many more 🏅"
10,JavaScript,tech-interview-handbook,29144,4089,JavaScript,https://github.com/yangshun/tech-interview-handbook,yangshun,5,2019-07-21T04:59:59Z,💯 Materials to help you rock your next coding interview
11,JavaScript,immutable-js,27887,1617,JavaScript,https://github.com/immutable-js/immutable-js,immutable-js,141,2019-05-30T14:47:09Z,Immutable persistent data collections for Javascript which increase efficiency and simplicity.
12,JavaScript,backbone,27513,5691,JavaScript,https://github.com/jashkenas/backbone,jashkenas,85,2019-05-13T13:07:23Z,"Give your JS App some Backbone with Models, Views, Collections, and Events"
13,JavaScript,clipboard.js,26566,3155,JavaScript,https://github.com/zenorocha/clipboard.js,zenorocha,66,2019-06-03T12:57:01Z,:scissors: Modern copy to clipboard. No Flash. Just 3kb gzipped :clipboard:
14,JavaScript,styled-components,24898,1470,JavaScript,https://github.com/styled-components/styled-components,styled-components,87,2019-07-10T23:59:35Z,Visual primitives for the component age. Use the best bits of ES6 and CSS to style your apps without stress 💅
15,JavaScript,awesome-react-native,24801,3030,JavaScript,https://github.com/jondot/awesome-react-native,jondot,18,2019-07-18T20:02:40Z,"Awesome React Native components, news, tools, and learning material!"
16,JavaScript,underscore,24705,5407,JavaScript,https://github.com/jashkenas/underscore,jashkenas,123,2019-05-28T13:42:14Z,JavaScript's utility _ belt
17,JavaScript,slick,24174,4884,JavaScript,https://github.com/kenwheeler/slick,kenwheeler,1070,2019-07-18T11:05:41Z,the last carousel you'll ever need
18,JavaScript,quill,23493,1794,JavaScript,https://github.com/quilljs/quill,quilljs,602,2019-07-12T21:33:31Z,Quill is a modern WYSIWYG editor built for compatibility and extensibility.
19,JavaScript,react-boilerplate,23018,4619,JavaScript,https://github.com/react-boilerplate/react-boilerplate,react-boilerplate,17,2019-07-19T10:02:50Z,":fire: A highly scalable, offline-first foundation with the best developer experience and a focus on performance and best practices."
20,JavaScript,dayjs,22469,1052,JavaScript,https://github.com/iamkun/dayjs,iamkun,51,2019-07-18T17:32:23Z,⏰ Day.js 2KB immutable date library alternative to Moment.js with the same modern API
21,JavaScript,ember.js,21116,4171,JavaScript,https://github.com/emberjs/ember.js,emberjs,288,2019-07-23T15:16:12Z,Ember.js - A JavaScript framework for creating ambitious web applications
22,JavaScript,hammer.js,20300,2544,JavaScript,https://github.com/hammerjs/hammer.js,hammerjs,271,2019-07-09T18:30:30Z,A javascript library for multi-touch gestures :// You can touch this
23,JavaScript,front-end-interview-handbook,20279,2636,JavaScript,https://github.com/yangshun/front-end-interview-handbook,yangshun,21,2019-06-07T07:11:12Z,"🕸 Almost complete answers to ""Front-end Job Interview Questions"" which you can use to interview potential candidates, test yourself or completely ignore"
24,JavaScript,ace,20092,4412,JavaScript,https://github.com/ajaxorg/ace,ajaxorg,656,2019-07-19T15:06:09Z,Ace (Ajax.org Cloud9 Editor)
25,JavaScript,webtorrent,19945,1910,JavaScript,https://github.com/webtorrent/webtorrent,webtorrent,97,2019-07-23T23:58:54Z,⚡️ Streaming torrent client for the web
26,JavaScript,date-fns,18603,767,JavaScript,https://github.com/date-fns/date-fns,date-fns,145,2019-07-23T20:03:40Z,⏳ Modern JavaScript date utility library ⌛️
27,JavaScript,pug,18452,1902,JavaScript,https://github.com/pugjs/pug,pugjs,219,2019-07-22T01:49:48Z,"Pug – robust, elegant, feature rich template engine for Node.js"
28,JavaScript,bluebird,18421,2286,JavaScript,https://github.com/petkaantonov/bluebird,petkaantonov,83,2019-07-16T14:36:00Z,:bird: :zap: Bluebird is a full featured promise library with unmatched performance.
29,JavaScript,ramda,16710,1069,JavaScript,https://github.com/ramda/ramda,ramda,264,2019-07-18T14:26:12Z,:ram: Practical functional Javascript
30,JavaScript,react-native-elements,16613,2979,JavaScript,https://github.com/react-native-training/react-native-elements,react-native-training,110,2019-07-24T02:09:03Z,Cross Platform React Native UI Toolkit
31,JavaScript,mostly-adequate-guide,16337,1340,JavaScript,https://github.com/MostlyAdequate/mostly-adequate-guide,MostlyAdequate,43,2019-07-21T08:06:46Z,Mostly adequate guide to FP (in javascript)
32,JavaScript,monaco-editor,16151,1411,JavaScript,https://github.com/microsoft/monaco-editor,microsoft,616,2019-07-12T14:37:24Z,A browser based code editor
33,JavaScript,strapi,16116,1824,JavaScript,https://github.com/strapi/strapi,strapi,184,2019-07-23T17:58:31Z,🚀 Open source Node.js Headless CMS to easily build customisable APIs
34,JavaScript,typeahead.js,15759,3365,JavaScript,https://github.com/twitter/typeahead.js,twitter,496,2019-01-23T13:54:27Z,typeahead.js is a fast and fully-featured autocomplete library
35,JavaScript,etcher,15241,903,JavaScript,https://github.com/balena-io/etcher,balena-io,158,2019-07-23T17:32:00Z,"Flash OS images to SD cards & USB drives, safely and easily."
36,JavaScript,node-lessons,14927,4727,JavaScript,https://github.com/alsotang/node-lessons,alsotang,91,2019-05-28T15:32:10Z,:closed_book:《Node.js 包教不包会》 by alsotang
37,JavaScript,stackedit,14755,2209,JavaScript,https://github.com/benweet/stackedit,benweet,458,2019-07-08T12:57:12Z,In-browser Markdown editor
38,JavaScript,wekan,14648,2146,JavaScript,https://github.com/wekan/wekan,wekan,497,2019-07-23T18:07:26Z,"The open-source kanban (built with Meteor). NOTE: All Pull Requests should be done to master branch. Keep variable/table/field names camelCase. Old devel branch will be removed in near future. For translations, only add PR changes to wekan/i18n/en.i18n.json , other translations are done at https://transifex.com/wekan/wekan only."
39,JavaScript,dropzone,14432,3211,JavaScript,https://github.com/enyo/dropzone,enyo,897,2019-05-24T12:11:22Z,Dropzone is an easy to use drag'n'drop library. It supports image previews and shows nice progress bars.
40,JavaScript,mysql,14320,1983,JavaScript,https://github.com/mysqljs/mysql,mysqljs,143,2019-06-28T09:52:18Z,A pure node.js JavaScript Client implementing the MySQL protocol.
41,JavaScript,graphql-js,14266,1232,JavaScript,https://github.com/graphql/graphql-js,graphql,83,2019-07-23T15:21:12Z,A reference implementation of GraphQL for JavaScript
42,JavaScript,recompose,14010,1244,JavaScript,https://github.com/acdlite/recompose,acdlite,70,2019-03-28T10:15:23Z,A React utility belt for function components and higher-order components.
43,JavaScript,riot,13808,1022,JavaScript,https://github.com/riot/riot,riot,9,2019-07-10T20:59:33Z,Simple and elegant component-based UI library
44,JavaScript,winston,13717,1262,JavaScript,https://github.com/winstonjs/winston,winstonjs,255,2019-07-22T12:54:14Z,A logger for just about everything.
45,JavaScript,prepack,13701,462,JavaScript,https://github.com/facebook/prepack,facebook,222,2019-05-19T13:57:12Z,A JavaScript bundle optimizer.
46,JavaScript,dva,13562,2524,JavaScript,https://github.com/dvajs/dva,dvajs,32,2019-07-12T06:38:24Z,"🌱 React and redux based, lightweight and elm-style framework. (Inspired by elm and choo)"
47,JavaScript,electron-react-boilerplate,12445,2066,JavaScript,https://github.com/electron-react-boilerplate/electron-react-boilerplate,electron-react-boilerplate,57,2019-07-23T09:39:36Z,A Foundation for Scalable Cross-Platform Apps
48,JavaScript,Motrix,12139,1236,JavaScript,https://github.com/agalwood/Motrix,agalwood,81,2019-07-24T02:46:58Z,A full-featured download manager.
49,JavaScript,sass,12021,1925,JavaScript,https://github.com/sass/sass,sass,89,2019-07-17T13:01:32Z,Sass makes CSS fun!
50,JavaScript,ws,11965,1549,JavaScript,https://github.com/websockets/ws,websockets,8,2019-07-22T15:23:52Z,"Simple to use, blazing fast and thoroughly tested WebSocket client and server for Node.js"
51,JavaScript,ink,11763,278,JavaScript,https://github.com/vadimdemedes/ink,vadimdemedes,41,2019-06-29T11:23:58Z,🌈 React for interactive command-line apps
52,JavaScript,lazysizes,11626,952,JavaScript,https://github.com/aFarkas/lazysizes,aFarkas,129,2019-07-18T17:53:53Z,"High performance and SEO friendly lazy loader for images (responsive and normal), iframes and more, that detects any visibility changes triggered through user interaction, CSS or JavaScript without configuration."
53,JavaScript,hapi,11296,1158,JavaScript,https://github.com/hapijs/hapi,hapijs,17,2019-07-23T17:14:07Z,:office: Server Framework  for Node.js
54,JavaScript,es6-cheatsheet,11268,894,JavaScript,https://github.com/DrkSephy/es6-cheatsheet,DrkSephy,5,2018-09-08T17:33:22Z,"ES2015 [ES6] cheatsheet containing tips, tricks, best practices and code snippets"
55,JavaScript,JSVerbalExpressions,11242,503,JavaScript,https://github.com/VerbalExpressions/JSVerbalExpressions,VerbalExpressions,18,2019-07-20T20:24:12Z,JavaScript Regular expressions made easy
56,JavaScript,dashing,11147,1259,JavaScript,https://github.com/Shopify/dashing,Shopify,252,2019-04-29T15:20:09Z,The exceptionally handsome dashboard framework in Ruby and Coffeescript.
57,JavaScript,smartcrop.js,11071,554,JavaScript,https://github.com/jwagner/smartcrop.js,jwagner,12,2019-05-25T21:44:20Z,Content aware image cropping
58,JavaScript,lowdb,11036,490,JavaScript,https://github.com/typicode/lowdb,typicode,67,2019-07-10T22:21:44Z,"⚡️ lowdb is a small local JSON database powered by Lodash (supports Node, Electron and the browser)"
59,JavaScript,browsh,11029,308,JavaScript,https://github.com/browsh-org/browsh,browsh-org,116,2019-06-28T10:06:12Z,"A fully-modern text-based browser, rendering to TTY and browsers"
60,JavaScript,redux-devtools,10921,805,JavaScript,https://github.com/reduxjs/redux-devtools,reduxjs,46,2019-07-15T18:29:53Z,"DevTools for Redux with hot reloading, action replay, and customizable UI"
61,JavaScript,marktext,10803,785,JavaScript,https://github.com/marktext/marktext,marktext,110,2019-07-24T02:59:50Z,"📝A simple and elegant markdown editor, available for Linux, macOS and Windows."
62,JavaScript,co,10795,748,JavaScript,https://github.com/tj/co,tj,44,2019-06-11T20:53:51Z,"The ultimate generator based flow-control goodness for nodejs (supports thunks, promises, etc)"
63,JavaScript,Magnific-Popup,10791,3054,JavaScript,https://github.com/dimsemenov/Magnific-Popup,dimsemenov,640,2019-02-28T20:14:59Z,Light and responsive lightbox script with focus on performance.
64,JavaScript,browser-sync,10766,689,JavaScript,https://github.com/BrowserSync/browser-sync,BrowserSync,449,2019-06-13T19:39:12Z,Keep multiple browsers & devices in sync when building websites. http://browsersync.io
65,JavaScript,karma,10761,1608,JavaScript,https://github.com/karma-runner/karma,karma-runner,379,2019-07-17T23:58:49Z,Spectacular Test Runner for JavaScript
66,JavaScript,Inquirer.js,10615,666,JavaScript,https://github.com/SBoudrias/Inquirer.js,SBoudrias,124,2019-07-24T00:53:11Z,A collection of common interactive command line user interfaces.
67,JavaScript,plotly.js,10491,1214,JavaScript,https://github.com/plotly/plotly.js,plotly,602,2019-07-24T00:12:05Z,Open-source JavaScript charting library behind Plotly and Dash
68,JavaScript,insomnia,10321,601,JavaScript,https://github.com/getinsomnia/insomnia,getinsomnia,152,2019-07-15T23:18:28Z,Cross-platform HTTP and GraphQL Client
69,JavaScript,weui-wxss,10315,3571,JavaScript,https://github.com/Tencent/weui-wxss,Tencent,67,2018-12-31T19:09:15Z,"A UI library by WeChat official design team, includes the most useful widgets/modules."
70,JavaScript,UglifyJS2,10107,1079,JavaScript,https://github.com/mishoo/UglifyJS2,mishoo,65,2019-07-21T07:45:31Z, JavaScript parser / mangler / compressor / beautifier toolkit
71,JavaScript,knex,10093,1243,JavaScript,https://github.com/tgriesser/knex,tgriesser,379,2019-07-23T18:46:42Z,"A query builder for PostgreSQL, MySQL and SQLite3, designed to be flexible, portable, and fun to use."
72,JavaScript,waypoints,9806,1310,JavaScript,https://github.com/imakewebthings/waypoints,imakewebthings,92,2018-10-11T18:24:39Z,Waypoints is a library that makes it easy to execute a function whenever you scroll to an element.
73,JavaScript,lib-flexible,9651,2908,JavaScript,https://github.com/amfe/lib-flexible,amfe,12,2018-03-14T07:23:35Z,可伸缩布局方案
74,JavaScript,vant,9531,2919,JavaScript,https://github.com/youzan/vant,youzan,22,2019-07-23T12:50:32Z,Lightweight Mobile UI Components built on Vue
75,JavaScript,fullcalendar,9510,2692,JavaScript,https://github.com/fullcalendar/fullcalendar,fullcalendar,685,2019-07-18T11:21:01Z,Full-sized drag & drop event calendar
76,JavaScript,jquery-validation,9488,2716,JavaScript,https://github.com/jquery-validation/jquery-validation,jquery-validation,89,2019-07-11T13:52:21Z,jQuery Validation Plugin library sources
77,JavaScript,bootstrap-table,9475,3894,JavaScript,https://github.com/wenzhixin/bootstrap-table,wenzhixin,63,2019-07-18T15:41:20Z,"An extended table to integration with some of the most widely used CSS frameworks. (Supports Bootstrap, Semantic UI, Bulma, Material Design, Foundation)"
78,JavaScript,nightwatch,9470,937,JavaScript,https://github.com/nightwatchjs/nightwatch,nightwatchjs,133,2019-07-16T18:46:21Z,Automated testing and continuous integration framework based on Node.js and using the Webdriver protocol
79,JavaScript,rxdb,9419,438,JavaScript,https://github.com/pubkey/rxdb,pubkey,10,2019-07-24T00:39:18Z,⛁ A realtime Database for JavaScript Applications
80,JavaScript,netlify-cms,9106,1263,JavaScript,https://github.com/netlify/netlify-cms,netlify,470,2019-07-23T22:20:41Z,A CMS for Static Site Generators
81,JavaScript,trianglify,8902,654,JavaScript,https://github.com/qrohlf/trianglify,qrohlf,11,2019-07-02T14:21:10Z,Algorithmically generated triangle art
82,JavaScript,linux-dash,8900,1107,JavaScript,https://github.com/afaqurk/linux-dash,afaqurk,26,2018-06-13T11:26:49Z,A beautiful web dashboard for Linux
83,JavaScript,matter-js,8887,999,JavaScript,https://github.com/liabru/matter-js,liabru,175,2019-07-17T07:03:17Z,a 2D rigid body physics engine for the web ▲● ■
84,JavaScript,carlo,8743,278,JavaScript,https://github.com/GoogleChromeLabs/carlo,GoogleChromeLabs,48,2019-06-21T19:04:56Z,Web rendering surface for Node applications
85,JavaScript,natural,8731,816,JavaScript,https://github.com/NaturalNode/natural,NaturalNode,77,2019-07-09T10:09:55Z,general natural language facilities for node
86,JavaScript,jquery-cookie,8633,4000,JavaScript,https://github.com/carhartl/jquery-cookie,carhartl,0,2017-06-19T08:44:42Z,"No longer maintained, superseded by JS Cookie:"
87,JavaScript,uncss,8516,383,JavaScript,https://github.com/uncss/uncss,uncss,25,2019-06-16T15:53:40Z,Remove unused styles from CSS
88,JavaScript,art-template,8396,2542,JavaScript,https://github.com/aui/art-template,aui,56,2019-07-23T03:38:58Z,High performance JavaScript templating engine
89,JavaScript,warriorjs,8359,481,JavaScript,https://github.com/olistic/warriorjs,olistic,23,2019-06-26T13:27:12Z,🏰 An exciting game of programming and Artificial Intelligence
90,JavaScript,favico.js,8290,613,JavaScript,https://github.com/ejci/favico.js,ejci,50,2017-10-05T14:56:42Z,"Make use of your favicon with badges, images or videos"
91,JavaScript,relax,8270,647,JavaScript,https://github.com/relax/relax,relax,81,2018-03-10T23:26:14Z,"New generation CMS on top of React, Redux and GraphQL"
92,JavaScript,UglifyJS,8120,762,JavaScript,https://github.com/mishoo/UglifyJS,mishoo,151,2019-02-08T11:21:38Z,JavaScript parser / mangler / compressor / beautifier library for NodeJS
93,JavaScript,restangular,8118,963,JavaScript,https://github.com/mgonto/restangular,mgonto,263,2018-10-30T19:33:43Z,AngularJS service to handle Rest API Restful Resources properly and easily
94,JavaScript,wangEditor,8047,1791,JavaScript,https://github.com/wangfupeng1988/wangEditor,wangfupeng1988,417,2019-05-23T14:00:46Z,wangEditor —— 轻量级web富文本框
95,JavaScript,tracking.js,8038,1246,JavaScript,https://github.com/eduardolundgren/tracking.js,eduardolundgren,210,2019-04-29T03:51:03Z,A modern approach for Computer Vision on the web
96,JavaScript,ng-file-upload,8022,1694,JavaScript,https://github.com/danialfarid/ng-file-upload,danialfarid,317,2019-05-07T13:48:54Z,Lightweight Angular directive to upload files with optional FileAPI shim for cross browser support
97,JavaScript,traceur-compiler,7963,598,JavaScript,https://github.com/google/traceur-compiler,google,296,2018-05-28T04:37:54Z,Traceur is a JavaScript.next-to-JavaScript-of-today compiler
98,JavaScript,etherpad-lite,7886,1683,JavaScript,https://github.com/ether/etherpad-lite,ether,335,2019-07-16T12:14:35Z,Etherpad: Really real-time collaborative document editing
99,JavaScript,debug,7826,672,JavaScript,https://github.com/visionmedia/debug,visionmedia,32,2019-07-05T23:18:18Z,A tiny JavaScript debugging utility modelled after Node.js core's debugging technique. Works in Node.js and web browsers
100,JavaScript,gtop,7721,298,JavaScript,https://github.com/aksakalli/gtop,aksakalli,30,2018-10-04T11:20:27Z,System monitoring dashboard for terminal
1,Lua,kong,22720,2795,Lua,https://github.com/Kong/kong,Kong,360,2019-07-23T23:35:23Z,:gorilla: The Cloud-Native API Gateway 
2,Lua,neural-style,16933,2592,Lua,https://github.com/jcjohnson/neural-style,jcjohnson,314,2018-02-23T01:21:20Z,Torch implementation of neural style algorithm
3,Lua,waifu2x,15267,1752,Lua,https://github.com/nagadomi/waifu2x,nagadomi,85,2019-07-08T03:35:35Z,Image Super-Resolution for Anime-Style Art
4,Lua,openface,12400,3042,Lua,https://github.com/cmusatyalab/openface,cmusatyalab,4,2019-06-24T11:41:33Z,Face recognition with deep neural networks.
5,Lua,char-rnn,9534,2293,Lua,https://github.com/karpathy/char-rnn,karpathy,106,2018-05-04T15:25:25Z,"Multi-layer Recurrent Neural Networks (LSTM, GRU, RNN) for character-level language models in Torch"
6,Lua,CycleGAN,8757,1440,Lua,https://github.com/junyanz/CycleGAN,junyanz,33,2019-06-04T18:03:35Z,"Software that can generate photos from paintings,  turn horses into zebras,  perform style transfer, and more."
7,Lua,pix2pix,6727,1141,Lua,https://github.com/phillipi/pix2pix,phillipi,58,2019-04-14T21:14:16Z,Image-to-image translation with conditional adversarial nets
8,Lua,dockercraft,5302,302,Lua,https://github.com/docker/dockercraft,docker,14,2018-06-18T12:15:21Z,Docker + Minecraft = Dockercraft
9,Lua,koreader,5085,651,Lua,https://github.com/koreader/koreader,koreader,368,2019-07-23T10:08:14Z,"An ebook reader application supporting PDF, DjVu, EPUB, FB2 and many more formats, running on Cervantes, Kindle, Kobo, PocketBook and Android devices"
