rank,item,repo_name,stars,forks,language,repo_url,username,issues,last_commit,description
97,Clojure,lt-cljs-tutorial,861,129,Clojure,https://github.com/swannodette/lt-cljs-tutorial,swannodette,10,2015-10-08T07:16:26Z,A ClojureScript Programming Language Tutorial for Light Table Users
98,Clojure,crux,826,57,Clojure,https://github.com/juxt/crux,juxt,116,2020-03-10T09:22:16Z,Open Time Store
99,Clojure,cats,806,69,Clojure,https://github.com/funcool/cats,funcool,28,2020-03-02T18:46:54Z,Category Theory and Algebraic abstractions for Clojure and ClojureScript.
100,Clojure,environ,805,65,Clojure,https://github.com/weavejester/environ,weavejester,14,2019-01-10T12:38:44Z,Library for managing environment variables in Clojure
1,CoffeeScript,coffeescript,15500,2013,CoffeeScript,https://github.com/jashkenas/coffeescript,jashkenas,44,2020-03-10T07:35:57Z,Unfancy JavaScript
2,CoffeeScript,SwitchyOmega,14756,2451,CoffeeScript,https://github.com/FelisCatus/SwitchyOmega,FelisCatus,345,2020-02-22T05:47:44Z,Manage and switch between multiple proxies quickly & easily.
3,CoffeeScript,trix,14745,750,CoffeeScript,https://github.com/basecamp/trix,basecamp,37,2020-03-09T22:33:46Z,A rich text editor for everyday writing
4,CoffeeScript,vimium,12751,1525,CoffeeScript,https://github.com/philc/vimium,philc,658,2020-03-03T13:37:33Z,The hacker's browser.
5,CoffeeScript,zxcvbn,11007,729,CoffeeScript,https://github.com/dropbox/zxcvbn,dropbox,101,2020-03-06T17:54:25Z,Low-Budget Password Strength Estimation
6,CoffeeScript,chinese-copywriting-guidelines,7382,1156,CoffeeScript,https://github.com/sparanoid/chinese-copywriting-guidelines,sparanoid,21,2020-01-24T09:15:51Z,Chinese copywriting guidelines for better written communication／中文文案排版指北
7,CoffeeScript,dynamics.js,7229,408,CoffeeScript,https://github.com/michaelvillar/dynamics.js,michaelvillar,9,2019-02-26T06:19:21Z,Javascript library to create physics-based animations
8,CoffeeScript,codecombat,7050,3678,CoffeeScript,https://github.com/codecombat/codecombat,codecombat,444,2020-03-09T20:03:42Z,Game for learning how to code.
9,CoffeeScript,morris.js,6957,1283,CoffeeScript,https://github.com/morrisjs/morris.js,morrisjs,324,2020-03-07T09:14:25Z,Pretty time-series line graphs
10,CoffeeScript,overleaf,6434,755,CoffeeScript,https://github.com/overleaf/overleaf,overleaf,134,2020-03-09T12:15:44Z,A web-based collaborative LaTeX editor
11,CoffeeScript,At.js,5211,698,CoffeeScript,https://github.com/ichord/At.js,ichord,156,2019-02-19T10:21:06Z,Add Github like mentions autocomplete to your application.
12,CoffeeScript,vibrant.js,4471,215,CoffeeScript,https://github.com/jariz/vibrant.js,jariz,2,2017-11-28T15:50:23Z,Extract prominent colors from an image. JS port of Android's Palette.
13,CoffeeScript,aglio,4446,479,CoffeeScript,https://github.com/danielgtaylor/aglio,danielgtaylor,140,2019-05-13T14:40:13Z,An API Blueprint renderer with theme support that outputs static HTML
14,CoffeeScript,bootstrap-tour,4314,921,CoffeeScript,https://github.com/sorich87/bootstrap-tour,sorich87,177,2019-11-02T05:43:03Z,Quick and easy product tours with Twitter Bootstrap Popovers
15,CoffeeScript,node-xml2js,3917,469,CoffeeScript,https://github.com/Leonidas-from-XIV/node-xml2js,Leonidas-from-XIV,172,2020-02-26T06:40:01Z,XML to JavaScript object converter.
16,CoffeeScript,yakyak,3734,338,CoffeeScript,https://github.com/yakyak/yakyak,yakyak,62,2020-03-10T09:27:20Z,Desktop chat client for Google Hangouts
17,CoffeeScript,jquery.payment,3633,707,CoffeeScript,https://github.com/stripe/jquery.payment,stripe,0,2017-08-02T14:10:57Z,"[DEPRECATED] A general purpose library for building credit card forms, validating inputs and formatting numbers.          "
18,CoffeeScript,turbolinks-classic,3602,450,CoffeeScript,https://github.com/turbolinks/turbolinks-classic,turbolinks,45,2017-12-06T23:33:26Z,Classic version of Turbolinks. Now deprecated in favor of Turbolinks 5.
19,CoffeeScript,activate-power-mode,3570,430,CoffeeScript,https://github.com/JoelBesada/activate-power-mode,JoelBesada,51,2019-05-24T15:52:02Z,Atom package - Activate POWER MODE to write your code in style.
20,CoffeeScript,hubot-scripts,3530,1991,CoffeeScript,https://github.com/github/hubot-scripts,github,0,2017-07-10T16:06:49Z,"DEPRECATED, see https://github.com/github/hubot-scripts/issues/1113 for details - optional scripts for hubot, opt in via hubot-scripts.json"
21,CoffeeScript,wintersmith,3487,346,CoffeeScript,https://github.com/jnordberg/wintersmith,jnordberg,14,2019-12-26T15:43:31Z,A flexible static site generator
22,CoffeeScript,pow,3465,264,CoffeeScript,https://github.com/basecamp/pow,basecamp,123,2018-04-12T12:15:45Z,Zero-configuration Rack server for Mac OS X
23,CoffeeScript,pivottable,3412,867,CoffeeScript,https://github.com/nicolaskruchten/pivottable,nicolaskruchten,252,2019-09-23T20:13:18Z,"Open-source Javascript Pivot Table (aka Pivot Grid, Pivot Chart, Cross-Tab) implementation with drag'n'drop."
24,CoffeeScript,taiga-front,3310,726,CoffeeScript,https://github.com/taigaio/taiga-front,taigaio,338,2020-02-26T17:05:14Z,Agile project management platform. Built on top of Django and AngularJS
25,CoffeeScript,Keypress,3181,319,CoffeeScript,https://github.com/dmauro/Keypress,dmauro,33,2018-09-27T02:21:46Z,A keyboard input capturing utility in which any key can be a modifier key.
26,CoffeeScript,dispatch-proxy,3138,205,CoffeeScript,https://github.com/alexkirsz/dispatch-proxy,alexkirsz,26,2019-07-13T20:04:51Z,"Combine internet connections, increase your download speed"
27,CoffeeScript,docpad,3005,249,CoffeeScript,https://github.com/docpad/docpad,docpad,23,2019-11-12T22:41:17Z,"Empower your website frontends with layouts, meta-data, pre-processors (markdown, jade, coffeescript, etc.), partials, skeletons, file watching, querying, and an amazing plugin system. DocPad will streamline your web development process allowing you to craft powerful static sites quicker than ever before."
28,CoffeeScript,sticky-kit,2977,561,CoffeeScript,https://github.com/leafo/sticky-kit,leafo,163,2019-11-12T01:06:22Z,A jQuery plugin for creating smart sticky elements
29,CoffeeScript,instafeed.js,2975,739,CoffeeScript,https://github.com/stevenschobert/instafeed.js,stevenschobert,4,2020-02-25T09:06:34Z,A simple Instagram javascript plugin
30,CoffeeScript,chaplin,2904,245,CoffeeScript,https://github.com/chaplinjs/chaplin,chaplinjs,46,2019-04-04T21:21:53Z,HTML5 application architecture using Backbone.js
31,CoffeeScript,engine,2874,127,CoffeeScript,https://github.com/gss/engine,gss,115,2019-12-17T00:22:16Z,GSS engine
32,CoffeeScript,noflo,2866,227,CoffeeScript,https://github.com/noflo/noflo,noflo,23,2020-02-28T03:28:22Z,Flow-based programming for JavaScript
33,CoffeeScript,talk-os,2754,846,CoffeeScript,https://github.com/jianliaoim/talk-os,jianliaoim,10,2017-09-05T02:27:58Z,Open source version of jianliao.com
34,CoffeeScript,butterfly,2717,298,CoffeeScript,https://github.com/paradoxxxzero/butterfly,paradoxxxzero,78,2019-07-18T02:11:40Z,A web terminal based on websocket and tornado
35,CoffeeScript,pagedraw,2713,335,CoffeeScript,https://github.com/Pagedraw/pagedraw,Pagedraw,12,2019-12-29T08:31:30Z,a UI builder for React web apps
36,CoffeeScript,angular-google-maps,2583,1092,CoffeeScript,https://github.com/angular-ui/angular-google-maps,angular-ui,337,2018-11-14T19:00:52Z,AngularJS directives for the Google Maps Javascript API
37,CoffeeScript,hallo,2479,342,CoffeeScript,https://github.com/bergie/hallo,bergie,109,2019-09-03T17:37:55Z,Simple rich text editor (contentEditable) for jQuery UI
38,CoffeeScript,cloudtunes,2398,237,CoffeeScript,https://github.com/jakubroztocil/cloudtunes,jakubroztocil,17,2018-03-20T18:40:05Z,"Web-based music player for the cloud :cloud: :notes: Play music from YouTube, Dropbox, etc."
39,CoffeeScript,oriDomi,2357,204,CoffeeScript,https://github.com/dmotz/oriDomi,dmotz,9,2018-07-14T18:10:28Z,Fold up DOM elements like paper
40,CoffeeScript,hubot-slack,2181,642,CoffeeScript,https://github.com/slackapi/hubot-slack,slackapi,45,2020-02-22T13:27:16Z,Slack Developer Kit for Hubot
41,CoffeeScript,QuoJS,2096,258,CoffeeScript,https://github.com/soyjavi/QuoJS,soyjavi,23,2018-09-03T00:16:56Z,Micro #JavaScript Library for Mobile Devices
42,CoffeeScript,js2coffee,2065,209,CoffeeScript,https://github.com/js2coffee/js2coffee,js2coffee,95,2018-02-21T04:17:31Z,Compile JavaScript to CoffeeScript
43,CoffeeScript,shadowsocks-gui,2032,1296,CoffeeScript,https://github.com/shadowsocks/shadowsocks-gui,shadowsocks,2,2018-09-24T04:39:12Z,Shadowsocks GUI client
44,CoffeeScript,CoffeeScriptRedux,1854,119,CoffeeScript,https://github.com/michaelficarra/CoffeeScriptRedux,michaelficarra,102,2019-10-14T18:59:47Z,:sweat: rewrite of the CoffeeScript compiler with proper compiler design principles and a focus on robustness and extensibility
45,CoffeeScript,ng-token-auth,1846,255,CoffeeScript,https://github.com/lynndylanhurley/ng-token-auth,lynndylanhurley,107,2019-11-04T17:43:14Z,Token based authentication module for angular.js.
46,CoffeeScript,BuckyClient,1781,101,CoffeeScript,https://github.com/HubSpot/BuckyClient,HubSpot,20,2016-08-05T20:07:08Z,Collect performance data from the client
47,CoffeeScript,vim-mode,1753,272,CoffeeScript,https://github.com/atom/vim-mode,atom,0,2017-06-15T20:06:24Z,Next generation vim support for atom
48,CoffeeScript,eco,1753,69,CoffeeScript,https://github.com/sstephenson/eco,sstephenson,33,2019-07-02T05:26:52Z,Embedded CoffeeScript templates
49,CoffeeScript,jquery.shapeshift,1699,340,CoffeeScript,https://github.com/AshesOfOwls/jquery.shapeshift,AshesOfOwls,88,2016-12-25T11:01:38Z,A dynamic grid system with drag and drop functionality.
50,CoffeeScript,dnschain,1691,161,CoffeeScript,https://github.com/okTurtles/dnschain,okTurtles,45,2017-04-22T03:52:26Z,"A blockchain-based DNS + HTTP server that fixes HTTPS security, and more!"
51,CoffeeScript,psd.js,1661,256,CoffeeScript,https://github.com/meltingice/psd.js,meltingice,109,2020-02-28T15:50:15Z,A Photoshop PSD file parser for NodeJS and browsers
52,CoffeeScript,please-wait,1607,161,CoffeeScript,https://github.com/Pathgather/please-wait,Pathgather,4,2016-08-20T10:31:00Z,A simple library to show your users a beautiful splash page while your application loads.
53,CoffeeScript,kartograph.js,1525,239,CoffeeScript,https://github.com/kartograph/kartograph.js,kartograph,36,2018-05-12T17:21:09Z,UNMAINTAINED Open source JavaScript renderer for Kartograph SVG maps
54,CoffeeScript,local_time,1515,101,CoffeeScript,https://github.com/basecamp/local_time,basecamp,17,2020-02-29T05:14:04Z,"Rails engine for cache-friendly, client-side local time"
55,CoffeeScript,cyclotron,1512,107,CoffeeScript,https://github.com/ExpediaInceCommercePlatform/cyclotron,ExpediaInceCommercePlatform,18,2019-12-27T13:37:56Z,A web platform for constructing dashboards.
56,CoffeeScript,squel,1503,213,CoffeeScript,https://github.com/hiddentao/squel,hiddentao,119,2019-11-04T20:55:17Z,:office: SQL query string builder for Javascript
57,CoffeeScript,roots,1475,135,CoffeeScript,https://github.com/jescalan/roots,jescalan,55,2018-02-03T16:40:23Z,a toolkit for rapid advanced front-end development
58,CoffeeScript,atom-beautify,1438,455,CoffeeScript,https://github.com/Glavin001/atom-beautify,Glavin001,243,2020-01-20T23:25:03Z,:lipstick: Universal beautification package for Atom editor (:warning: Currently migrating to https://github.com/Unibeautify/ and have very limited bandwidth for Atom-Beautify Issues. Thank you for your patience and understanding :heart: )
59,CoffeeScript,caniuse-cmd,1420,49,CoffeeScript,https://github.com/sgentle/caniuse-cmd,sgentle,14,2018-09-19T15:16:06Z,Caniuse command line tool
60,CoffeeScript,gulp-cheatsheet,1400,87,CoffeeScript,https://github.com/osscafe/gulp-cheatsheet,osscafe,4,2016-08-28T08:20:19Z,A cheatsheet for gulp.js
61,CoffeeScript,camo,1372,254,CoffeeScript,https://github.com/atmos/camo,atmos,24,2020-02-14T11:02:21Z,:lock: an http proxy to route images through SSL
62,CoffeeScript,VimFx,1363,187,CoffeeScript,https://github.com/akhodakivskiy/VimFx,akhodakivskiy,2,2020-01-05T21:12:51Z,Vim keyboard shortcuts for Firefox
63,CoffeeScript,dropbox-js,1361,221,CoffeeScript,https://github.com/dropbox/dropbox-js,dropbox,83,2016-10-29T20:22:00Z,Deprecated JS library for API v1. Use our v2 SDK instead:
64,CoffeeScript,atom-vim-mode-plus,1360,111,CoffeeScript,https://github.com/t9md/atom-vim-mode-plus,t9md,115,2020-01-01T01:11:10Z,vim-mode improved
65,CoffeeScript,repl.it,1352,221,CoffeeScript,https://github.com/replit-archive/repl.it,replit-archive,1,2016-04-11T20:47:38Z,https://repl.it/feedback Online REPL for 15+ languages.
66,CoffeeScript,atom-simplified-chinese-menu,1319,153,CoffeeScript,https://github.com/chinakids/atom-simplified-chinese-menu,chinakids,25,2018-08-06T02:41:40Z,"Atom 的简体中文汉化扩展,目前最全的汉化包。包含菜单汉化、右键菜单汉化以及设置汉化"
67,CoffeeScript,pretty-error,1310,38,CoffeeScript,https://github.com/AriaMinaei/pretty-error,AriaMinaei,16,2018-04-14T01:55:57Z,See node.js errors with less clutter
68,CoffeeScript,coffeekup,1282,90,CoffeeScript,https://github.com/mauricemach/coffeekup,mauricemach,39,2011-10-26T01:50:57Z,Markup as CoffeeScript.
69,CoffeeScript,shadowsocks-nodejs,1239,787,CoffeeScript,https://github.com/shadowsocks/shadowsocks-nodejs,shadowsocks,5,2016-08-11T03:01:11Z,
70,CoffeeScript,mondrian,1236,116,CoffeeScript,https://github.com/artursapek/mondrian,artursapek,21,2017-10-30T03:18:15Z,Web-based vector graphics editor
71,CoffeeScript,qqbot,1232,389,CoffeeScript,https://github.com/xhan/qqbot,xhan,23,2016-02-15T03:31:44Z,基于WebQQ协议的QQ机器人。命令行工具，Hubot支持！
72,CoffeeScript,cson,1224,58,CoffeeScript,https://github.com/bevry/cson,bevry,5,2020-01-29T16:48:45Z,CoffeeScript-Object-Notation. Same as JSON but for CoffeeScript objects.
73,CoffeeScript,greenscreen,1205,164,CoffeeScript,https://github.com/groupon/greenscreen,groupon,46,2017-05-17T00:29:05Z,
74,CoffeeScript,lineman,1200,87,CoffeeScript,https://github.com/linemanjs/lineman,linemanjs,30,2019-12-20T05:57:26Z,"Lineman helps you build fat-client JavaScript apps. It produces happiness by building assets, mocking servers, running specs on every file change"
75,CoffeeScript,tacofancy,1183,455,CoffeeScript,https://github.com/sinker/tacofancy,sinker,12,2019-10-08T20:47:22Z,community-driven taco repo. stars stars stars.
76,CoffeeScript,apm,1179,280,CoffeeScript,https://github.com/atom/apm,atom,176,2019-11-27T20:41:11Z,Atom Package Manager
77,CoffeeScript,aurora.js,1147,135,CoffeeScript,https://github.com/audiocogs/aurora.js,audiocogs,59,2019-04-17T12:19:58Z,JavaScript audio decoding framework
78,CoffeeScript,angular-masonry,1140,240,CoffeeScript,https://github.com/passy/angular-masonry,passy,54,2017-05-17T15:42:06Z,An AngularJS directive for Masonry.
79,CoffeeScript,badges,1134,797,CoffeeScript,https://github.com/boennemann/badges,boennemann,9,2019-04-05T16:27:49Z,:flower_playing_cards: Readme Badges – Gotta catch 'em all
80,CoffeeScript,git-time-machine,1122,49,CoffeeScript,https://github.com/littlebee/git-time-machine,littlebee,42,2018-12-21T00:33:44Z,Atom package that allows you to travel back in commit history
81,CoffeeScript,Heyoffline,1110,73,CoffeeScript,https://github.com/oskarkrawczyk/Heyoffline,oskarkrawczyk,3,2017-01-06T08:05:04Z,Warn your users when their network goes down. Make sure they don't lose anything.
82,CoffeeScript,hubble,1092,39,CoffeeScript,https://github.com/jaymedavis/hubble,jaymedavis,0,2018-10-11T01:39:44Z,A dashboard that displays in the terminal
83,CoffeeScript,pushd,1069,219,CoffeeScript,https://github.com/rs/pushd,rs,60,2019-10-01T20:13:55Z,Blazing fast multi-protocol mobile and web push notification service
84,CoffeeScript,stitch,1069,83,CoffeeScript,https://github.com/sstephenson/stitch,sstephenson,32,2012-11-02T14:08:32Z,Stitch your CommonJS modules together for the browser
85,CoffeeScript,buckets,1066,167,CoffeeScript,https://github.com/bucketsio/buckets,bucketsio,7,2015-05-31T04:57:37Z,[DEPRECATED] Manage content better.
86,CoffeeScript,octonode,1060,245,CoffeeScript,https://github.com/pksunkara/octonode,pksunkara,29,2020-02-17T08:18:53Z,github api v3 in nodejs
87,CoffeeScript,node-slug,1059,94,CoffeeScript,https://github.com/dodo/node-slug,dodo,44,2019-04-05T15:49:19Z,slugifies even utf-8 chars!
88,CoffeeScript,Coffee-Physics,1058,91,CoffeeScript,https://github.com/soulwire/Coffee-Physics,soulwire,8,2016-12-12T17:36:34Z,"A simple, lightweight physics engine written in CoffeeScript"
89,CoffeeScript,coffeelint,1051,179,CoffeeScript,https://github.com/clutchski/coffeelint,clutchski,85,2020-02-21T19:24:08Z,Lint your CoffeeScript.
90,CoffeeScript,jquery.turbolinks,1035,62,CoffeeScript,https://github.com/kossnocorp/jquery.turbolinks,kossnocorp,19,2017-09-03T12:15:16Z,💀 Deprecated ⚠️ jQuery plugin for drop-in fix binded events problem caused by Turbolinks
91,CoffeeScript,dploy,1015,91,CoffeeScript,https://github.com/lucasmotta/dploy,lucasmotta,61,2019-02-05T16:21:33Z,⛔️ currently unmaintained ⛔️
92,CoffeeScript,node-cache,991,93,CoffeeScript,https://github.com/node-cache/node-cache,node-cache,10,2020-03-05T16:25:49Z,a node internal caching module
93,CoffeeScript,zappa,970,88,CoffeeScript,https://github.com/mauricemach/zappa,mauricemach,35,2019-10-15T12:50:51Z,Node development for the lazy.
94,CoffeeScript,literallycanvas,958,281,CoffeeScript,https://github.com/literallycanvas/literallycanvas,literallycanvas,84,2019-10-24T17:14:34Z,A canvas in your browser. Literally.
95,CoffeeScript,muplayer,953,234,CoffeeScript,https://github.com/Baidu-Music-FE/muplayer,Baidu-Music-FE,14,2019-10-31T00:11:49Z,"An open source web audio player from Baidu Music, support HTML5 and Flash engine on different platforms(百度音乐播放内核)"
96,CoffeeScript,node-neo4j,935,143,CoffeeScript,https://github.com/thingdom/node-neo4j,thingdom,46,2018-11-20T12:02:09Z,[RETIRED] Neo4j graph database driver (REST API client) for Node.js
97,CoffeeScript,omelette,912,27,CoffeeScript,https://github.com/f/omelette,f,13,2019-12-22T01:42:40Z,"Omelette is a simple, template based autocompletion tool for Node projects with super easy API. (For Bash, Zsh and Fish)"
98,CoffeeScript,node-rtsp-rtmp-server,901,247,CoffeeScript,https://github.com/iizukanao/node-rtsp-rtmp-server,iizukanao,73,2019-03-19T14:42:21Z,RTSP/RTMP/HTTP hybrid server
99,CoffeeScript,pt,901,61,CoffeeScript,https://github.com/williamngan/pt,williamngan,10,2018-02-13T09:06:59Z,"An experimental library on point, form, and space."
100,CoffeeScript,apparatus,891,52,CoffeeScript,https://github.com/cdglabs/apparatus,cdglabs,26,2018-02-06T10:37:56Z,A hybrid graphics editor and programming environment for creating interactive diagrams.
1,CSS,animate.css,65222,13955,CSS,https://github.com/daneden/animate.css,daneden,33,2020-03-07T14:31:53Z,🍿 A cross-browser library of CSS animations. As easy to use as an easy thing.
2,CSS,material-design-icons,39783,8182,CSS,https://github.com/google/material-design-icons,google,586,2020-01-24T21:59:28Z,Material Design icons by Google
3,CSS,bulma,38791,3270,CSS,https://github.com/jgthms/bulma,jgthms,298,2020-03-09T07:40:21Z,Modern CSS framework based on Flexbox
4,CSS,normalize.css,37999,8107,CSS,https://github.com/necolas/normalize.css,necolas,33,2020-01-26T08:57:04Z,A modern alternative to CSS resets
5,CSS,freecodecamp.cn,36893,1413,CSS,https://github.com/FreeCodeCampChina/freecodecamp.cn,FreeCodeCampChina,149,2020-01-22T11:01:21Z,FCC China open source codebase and curriculum. Learn to code and help nonprofits.
6,CSS,weui,24190,6166,CSS,https://github.com/Tencent/weui,Tencent,25,2020-03-05T05:36:57Z,"A UI library by WeChat official design team, includes the most useful widgets/modules in mobile web applications."
7,CSS,hangzhou_house_knowledge,23675,5069,CSS,https://github.com/houshanren/hangzhou_house_knowledge,houshanren,107,2019-12-13T11:32:25Z,"2017年买房经历总结出来的买房购房知识分享给大家，希望对大家有所帮助。买房不易，且买且珍惜。Sharing the knowledge of buy an own house that according  to the experience at hangzhou in 2017 to all the people. It's not easy to buy a own house, so I hope that it would be useful to everyone."
8,CSS,Hover,22462,4904,CSS,https://github.com/IanLunn/Hover,IanLunn,30,2019-11-27T22:08:02Z,"A collection of CSS3 powered hover effects to be applied to links, buttons, logos, SVG, featured images and so on. Easily apply to your own elements, modify or just use for inspiration. Available in CSS, Sass, and LESS."
9,CSS,tailwindcss,20544,917,CSS,https://github.com/tailwindcss/tailwindcss,tailwindcss,73,2020-03-05T06:17:59Z,A utility-first CSS framework for rapid UI development.
10,CSS,bootstrap-material-design,20118,3296,CSS,https://github.com/FezVrasta/bootstrap-material-design,FezVrasta,66,2020-02-29T11:27:01Z,Material design theme for Bootstrap 3 and 4
11,CSS,nerd-fonts,19972,1361,CSS,https://github.com/ryanoasis/nerd-fonts,ryanoasis,116,2020-03-07T13:02:39Z,"Iconic font aggregator, collection, & patcher. 3,600+ icons, 50+ patched fonts: Hack, Source Code Pro, more. Glyph collections: Font Awesome, Material Design Icons, Octicons, & more"
12,CSS,the-swift-programming-language-in-chinese,19231,5031,CSS,https://github.com/SwiftGGTeam/the-swift-programming-language-in-chinese,SwiftGGTeam,2,2020-02-16T05:03:10Z,中文版 Apple 官方 Swift 教程《The Swift Programming Language》
13,CSS,Skeleton,17330,2969,CSS,https://github.com/dhg/Skeleton,dhg,139,2019-12-11T01:57:46Z,"Skeleton: A Dead Simple, Responsive Boilerplate for Mobile-Friendly Development"
14,CSS,SpinKit,16656,1606,CSS,https://github.com/tobiasahlin/SpinKit,tobiasahlin,7,2020-02-10T13:10:16Z,A collection of loading indicators animated with CSS
15,CSS,my-mac-os,16130,698,CSS,https://github.com/nikitavoloboev/my-mac-os,nikitavoloboev,1,2020-03-01T19:23:53Z,List of applications and tools that make my macOS experience even more amazing
16,CSS,source-code-pro,15952,1398,CSS,https://github.com/adobe-fonts/source-code-pro,adobe-fonts,44,2019-10-04T17:33:56Z,Monospaced font family for user interface and coding environments
17,CSS,uikit,15490,2186,CSS,https://github.com/uikit/uikit,uikit,669,2020-03-09T12:33:54Z,A lightweight and modular front-end framework for developing fast and powerful web interfaces
18,CSS,hexo-theme-next,15063,3818,CSS,https://github.com/iissnan/hexo-theme-next,iissnan,68,2019-08-12T04:01:30Z,Elegant theme for Hexo. 
19,CSS,pace,14800,1929,CSS,https://github.com/HubSpot/pace,HubSpot,301,2019-09-23T07:38:17Z,Automatically add a progress bar to your site. #hubspot-open-source
20,CSS,Flat-UI,14670,2448,CSS,https://github.com/designmodo/Flat-UI,designmodo,9,2019-02-13T17:29:09Z,"Flat UI Free - Design Framework (html/css3/less/js). Flat UI is based on Bootstrap, a comfortable, responsive, and functional framework that simplifies the development of websites."
21,CSS,ratchet,14416,1514,CSS,https://github.com/twbs/ratchet,twbs,222,2019-09-05T06:31:48Z,"Build mobile apps with simple HTML, CSS, and JavaScript components. "
22,CSS,NES.css,14329,1197,CSS,https://github.com/nostalgic-css/NES.css,nostalgic-css,27,2020-02-05T20:22:04Z,NES-style CSS Framework | ファミコン風CSSフレームワーク
23,CSS,You-Dont-Need-JavaScript,13109,767,CSS,https://github.com/you-dont-need/You-Dont-Need-JavaScript,you-dont-need,27,2020-01-26T09:52:32Z,"CSS is powerful, you can do a lot of things without JS."
24,CSS,tomorrow-theme,12671,3091,CSS,https://github.com/chriskempson/tomorrow-theme,chriskempson,112,2019-06-08T11:18:32Z,Tomorrow Theme now lives on at https://github.com/chriskempson/base16
25,CSS,solved-by-flexbox,12575,1031,CSS,https://github.com/philipwalton/solved-by-flexbox,philipwalton,21,2019-12-02T21:11:47Z,"A showcase of problems once hard or impossible to solve with CSS alone, now made trivially easy with Flexbox."
26,CSS,weui-wxss,12122,4207,CSS,https://github.com/Tencent/weui-wxss,Tencent,24,2020-03-04T13:04:11Z,"A UI library by WeChat official design team, includes the most useful widgets/modules."
27,CSS,Effeckt.css,11146,1502,CSS,https://github.com/h5bp/Effeckt.css,h5bp,0,2019-03-01T16:28:55Z,This repo is archived. Thanks!
28,CSS,hacker101,11106,1528,CSS,https://github.com/Hacker0x01/hacker101,Hacker0x01,25,2020-02-26T18:41:14Z,Hacker101
29,CSS,card,10849,1315,CSS,https://github.com/jessepollak/card,jessepollak,129,2020-02-15T14:27:39Z,:credit_card: make your credit card form better in one line of code
30,CSS,2048,10372,15764,CSS,https://github.com/gabrielecirulli/2048,gabrielecirulli,105,2020-02-17T01:48:43Z,A small clone of 1024 (https://play.google.com/store/apps/details?id=com.veewo.a1024)
31,CSS,spectre,9977,712,CSS,https://github.com/picturepan2/spectre,picturepan2,165,2020-02-19T07:24:43Z,"Spectre.css - A Lightweight, Responsive and Modern CSS Framework"
32,CSS,tachyons,9626,605,CSS,https://github.com/tachyons-css/tachyons,tachyons-css,69,2020-02-26T01:59:51Z,Functional css for humans
33,CSS,_s,9550,2905,CSS,https://github.com/Automattic/_s,Automattic,82,2020-03-05T12:59:38Z,"Hi. I'm a starter theme called _s, or underscores, if you like. I'm a theme meant for hacking so don't use me as a Parent Theme. Instead try turning me into the next, most awesome, WordPress theme out there. That's what I'm here for."
34,CSS,loaders.css,9500,1169,CSS,https://github.com/ConnorAtherton/loaders.css,ConnorAtherton,10,2018-09-20T11:12:43Z,"Delightful, performance-focused pure css loading animations."
35,CSS,photon,9309,551,CSS,https://github.com/connors/photon,connors,83,2018-10-13T17:09:16Z,The fastest way to build beautiful Electron apps using simple HTML and CSS
36,CSS,css,8959,710,CSS,https://github.com/primer/css,primer,80,2020-03-10T08:48:12Z,The CSS design system that powers GitHub
