rank,item,repo_name,stars,forks,language,repo_url,username,issues,last_commit,description
45,Python,funNLP,17583,5253,Python,https://github.com/fighting41love/funNLP,fighting41love,0,2020-03-02T03:22:11Z,"中英文敏感词、语言检测、中外手机/电话归属地/运营商查询、名字推断性别、手机号抽取、身份证抽取、邮箱抽取、中日文人名库、中文缩写库、拆字词典、词汇情感值、停用词、反动词表、暴恐词表、繁简体转换、英文模拟中文发音、汪峰歌词生成器、职业名称词库、同义词库、反义词库、否定词库、汽车品牌词库、汽车零件词库、连续英文切割、各种中文词向量、公司名字大全、古诗词库、IT词库、财经词库、成语词库、地名词库、历史名人词库、诗词词库、医学词库、饮食词库、法律词库、汽车词库、动物词库、中文聊天语料、中文谣言数据、百度中文问答数据集、句子相似度匹配算法集合、bert资源、文本生成&摘要相关工具、cocoNLP信息抽取工具、国内电话号码正则匹配、清华大学XLORE:中英文跨语言百科知识图谱、清华大学人工智能技术系列报告、自然语言生成、NLU太难了系列、自动对联数据及机器人、用户名黑名单列表、罪名法务名词及分类模型、微信公众号语料、cs224n深度学习自然语言处理课程、中文手写汉字识别、中文自然语言处理 语料/数据集、变量命名神器、分词语料库+代码、任务型对话英文数据集、ASR 语音数据集 + 基于深度学习的中文语音识别系统、笑声检测器、Microsoft多语言数字/单位/如日期时间识别包、中华新华字典数据库及api(包括常用歇后语、成语、词语和汉字)、文档图谱自动生成、SpaCy 中文模型、Common Voice语音识别数据集新版、神经网络关系抽取、基于bert的命名实体识别、关键词(Keyphrase)抽取包pke、基于医疗领域知识图谱的问答系统、基于依存句法与语义角色标注的事件三元组抽取、依存句法分析4万句高质量标注数据、cnocr：用来做中文OCR的Python3包、中文人物关系知识图谱项目、中文nlp竞赛项目及代码汇总、中文字符数据、speech-aligner: 从“人声语音”及其“语言文本”产生音素级别时间对齐标注的工具、AmpliGraph: 知识图谱表示学习(Python)库：知识图谱概念链接预测、Scattertext 文本可视化(python)、语言/知识表示工具：BERT & ERNIE、中文对比英文自然语言处理NLP的区别综述、Synonyms中文近义词工具包、HarvestText领域自适应文本挖掘工具（新词发现-情感分析-实体链接等）、word2word：(Python)方便易用的多语言词-词对集：62种语言/3,564个多语言对、语音识别语料生成工具：从具有音频/字幕的在线视频创建自动语音识别(ASR)语料库、构建医疗实体识别的模型（包含词典和语料标注）、单文档非监督的关键词抽取、Kashgari中使用gpt-2语言模型、开源的金融投资数据提取工具、文本自动摘要库TextTeaser: 仅支持英文、人民日报语料处理工具集、一些关于自然语言的基本模型、基于14W歌曲知识库的问答尝试--功能包括歌词接龙and已知歌词找歌曲以及歌曲歌手歌词三角关系的问答、基于Siamese bilstm模型的相似句子判定模型并提供训练数据集和测试数据集、用Transformer编解码模型实现的根据Hacker News文章标题自动生成评论、用BERT进行序列标记和文本分类的模板代码、LitBank：NLP数据集——支持自然语言处理和计算人文学科任务的100部带标记英文小说语料、百度开源的基准信息抽取系统、虚假新闻数据集、Facebook: LAMA语言模型分析，提供Transformer-XL/BERT/ELMo/GPT预训练语言模型的统一访问接口、CommonsenseQA：面向常识的英文QA挑战、中文知识图谱资料、数据及工具、各大公司内部里大牛分享的技术文档 PDF 或者 PPT、自然语言生成SQL语句（英文）、中文NLP数据增强（EDA）工具、英文NLP数据增强工具 、基于医药知识图谱的智能问答系统、京东商品知识图谱、基于mongodb存储的军事领域知识图谱问答项目、基于远监督的中文关系抽取、语音情感分析、中文ULMFiT-情感分析-文本分类-语料及模型、一个拍照做题程序、世界各国大规模人名库、一个利用有趣中文语料库 qingyun 训练出来的中文聊天机器人、中文聊天机器人seqGAN、省市区镇行政区划数据带拼音标注、教育行业新闻语料库包含自动文摘功能、开放了对话机器人-知识图谱-语义理解-自然语言处理工具及数据、中文知识图谱：基于百度百科中文页面-抽取三元组信息-构建中文知识图谱、masr: 中文语音识别-提供预训练模型-高识别率、Python音频数据增广库、中文全词覆盖BERT及两份阅读理解数据、ConvLab：开源多域端到端对话系统平台、中文自然语言处理数据集、基于最新版本rasa搭建的对话系统、基于TensorFlow和BERT的管道式实体及关系抽取、一个小型的证券知识图谱/知识库、复盘所有NLP比赛的TOP方案、OpenCLaP：多领域开源中文预训练语言模型仓库、UER：基于不同语料+编码器+目标任务的中文预训练模型仓库、中文自然语言处理向量合集、基于金融-司法领域(兼有闲聊性质)的聊天机器人、g2pC：基于上下文的汉语读音自动标记模块、Zincbase 知识图谱构建工具包、诗歌质量评价/细粒度情感诗歌语料库、快速转化「中文数字」和「阿拉伯数字」、百度知道问答语料库、基于知识图谱的问答系统、jieba_fast 加速版的jieba、正则表达式教程、中文阅读理解数据集、基于BERT等最新语言模型的抽取式摘要提取、Python利用深度学习进行文本摘要的综合指南、知识图谱深度学习相关资料整理、维基大规模平行文本语料、StanfordNLP 0.2.0：纯Python版自然语言处理包、NeuralNLP-NeuralClassifier：腾讯开源深度学习文本分类工具、端到端的封闭域对话系统、中文命名实体识别：NeuroNER vs. BertNER、新闻事件线索抽取、2019年百度的三元组抽取比赛：“科学空间队”源码、基于依存句法的开放域文本知识三元组抽取和知识库构建、中文的GPT2训练代码、ML-NLP - 机器学习(Machine Learning)NLP面试中常考到的知识点和代码实现、nlp4han:中文自然语言处理工具集(断句/分词/词性标注/组块/句法分析/语义分析/NER/N元语法/HMM/代词消解/情感分析/拼写检查、XLM：Facebook的跨语言预训练语言模型、用基于BERT的微调和特征提取方法来进行知识图谱百度百科人物词条属性抽取、中文自然语言处理相关的开放任务-数据集-当前最佳结果、CoupletAI - 基于CNN+Bi-LSTM+Attention 的自动对对联系统、抽象知识图谱、MiningZhiDaoQACorpus - 580万百度知道问答数据挖掘项目、brat rapid annotation tool: 序列标注工具、大规模中文知识图谱数据：1.4亿实体、数据增强在机器翻译及其他nlp任务中的应用及效果、allennlp阅读理解:支持多种数据和模型、PDF表格数据提取工具 、 Graphbrain：AI开源软件库和科研工具，目的是促进自动意义提取和文本理解以及知识的探索和推断、简历自动筛选系统、基于命名实体识别的简历自动摘要、中文语言理解测评基准，包括代表性的数据集&基准模型&语料库&排行榜、树洞 OCR 文字识别 、从包含表格的扫描图片中识别表格和文字、语声迁移、Python口语自然语言处理工具集(英文)、 similarity：相似度计算工具包，java编写、海量中文预训练ALBERT模型 、Transformers 2.0 、基于大规模音频数据集Audioset的音频增强 、Poplar：网页版自然语言标注工具、图片文字去除，可用于漫画翻译 、186种语言的数字叫法库、Amazon发布基于知识的人-人开放领域对话数据集 、中文文本纠错模块代码、繁简体转换 、 Python实现的多种文本可读性评价指标、类似于人名/地名/组织机构名的命名体识别数据集 、东南大学《知识图谱》研究生课程(资料)、. 英文拼写检查库 、 wwsearch是企业微信后台自研的全文检索引擎、CHAMELEON：深度学习新闻推荐系统元架构 、 8篇论文梳理BERT相关模型进展与反思、DocSearch：免费文档搜索引擎、 LIDA：轻量交互式对话标注工具 、aili - the fastest in-memory index in the East 东半球最快并发索引 、知识图谱车音工作项目、自然语言生成资源大全 、中日韩分词库mecab的Python接口库、中文文本摘要/关键词提取、汉字字符特征提取器 (featurizer)，提取汉字的特征（发音特征、字形特征）用做深度学习的特征、中文生成任务基准测评 、中文缩写数据集、中文任务基准测评 - 代表性的数据集-基准(预训练)模型-语料库-baseline-工具包-排行榜、PySS3：面向可解释AI的SS3文本分类器机器可视化工具 、中文NLP数据集列表、COPE - 格律诗编辑程序、doccano：基于网页的开源协同多语言文本标注工具 、PreNLP：自然语言预处理库、简单的简历解析器，用来从简历中提取关键信息、用于中文闲聊的GPT2模型：GPT2-chitchat、基于检索聊天机器人多轮响应选择相关资源列表(Leaderboards、Datasets、Papers)、(Colab)抽象文本摘要实现集锦(教程 、词语拼音数据、高效模糊搜索工具、NLP数据增广资源集、微软对话机器人框架 、 GitHub Typo Corpus：大规模GitHub多语言拼写错误/语法错误数据集、TextCluster：短文本聚类预处理模块 Short text cluster、面向语音识别的中文文本规范化、BLINK：最先进的实体链接库、BertPunc：基于BERT的最先进标点修复模型、Tokenizer：快速、可定制的文本词条化库、中文语言理解测评基准，包括代表性的数据集、基准(预训练)模型、语料库、排行榜、spaCy 医学文本挖掘与信息提取 、 NLP任务示例项目代码集、 python拼写检查库、chatbot-list - 行业内关于智能客服、聊天机器人的应用和架构、算法分享和介绍、语音质量评价指标(MOSNet, BSSEval, STOI, PESQ, SRMR)、 用138GB语料训练的法文RoBERTa预训练语言模型 、BERT-NER-Pytorch：三种不同模式的BERT中文NER实验、无道词典 - 有道词典的命令行版本，支持英汉互查和在线查询、2019年NLP亮点回顾、 Chinese medical dialogue data 中文医疗对话数据集 、最好的汉字数字(中文数字)-阿拉伯数字转换工具、 基于百科知识库的中文词语多词义/义项获取与特定句子词语语义消歧、awesome-nlp-sentiment-analysis - 情感分析、情绪原因识别、评价对象和评价词抽取、LineFlow：面向所有深度学习框架的NLP数据高效加载器、中文医学NLP公开资源整理 、MedQuAD：(英文)医学问答数据集、将自然语言数字串解析转换为整数和浮点数、Transfer Learning in Natural Language Processing (NLP) 、面向语音识别的中文/英文发音辞典、Tokenizers：注重性能与多功能性的最先进分词器、CLUENER 细粒度命名实体识别 Fine Grained Named Entity Recognition、 基于BERT的中文命名实体识别、中文谣言数据库、NLP数据集/基准任务大列表、nlp相关的一些论文及代码, 包括主题模型、词向量(Word Embedding)、命名实体识别(NER)、文本分类(Text Classificatin)、文本生成(Text Generation)、文本相似性(Text Similarity)计算等，涉及到各种与nlp相关的算法，基于keras和tensorflow 、Python文本挖掘/NLP实战示例、 Blackstone：面向非结构化法律文本的spaCy pipeline和NLP模型通过同义词替换实现文本“变脸” 、中文 预训练 ELECTREA 模型: 基于对抗学习 pretrain Chinese Model 、albert-chinese-ner - 用预训练语言模型ALBERT做中文NER 、基于GPT2的特定主题文本生成/文本增广、开源预训练语言模型合集、多语言句向量包、编码、标记和实现：一种可控高效的文本生成方法、 英文脏话大列表 、attnvis：GPT2、BERT等transformer语言模型注意力交互可视化、CoVoST：Facebook发布的多语种语音-文本翻译语料库，包括11种语言(法语、德语、荷兰语、俄语、西班牙语、意大利语、土耳其语、波斯语、瑞典语、蒙古语和中文)的语音、文字转录及英文译文、Jiagu自然语言处理工具 - 以BiLSTM等模型为基础，提供知识图谱关系抽取 中文分词 词性标注 命名实体识别 情感分析 新词发现 关键词 文本摘要 文本聚类等功能、用unet实现对文档表格的自动检测，表格重建、NLP事件提取文献资源列表 、 金融领域自然语言处理研究资源大列表、CLUEDatasetSearch - 中英文NLP数据集：搜索所有中文NLP数据集，附常用英文NLP数据集 、medical_NER - 中文医学知识图谱命名实体识别 、(哈佛)讲因果推理的免费书、知识图谱相关学习资料/数据集/工具资源大列表、Forte：灵活强大的自然语言处理pipeline工具集 、Python字符串相似性算法库、PyLaia：面向手写文档分析的深度学习工具包、TextFooler：针对文本分类/推理的对抗文本生成模块、Haystack：灵活、强大的可扩展问答(QA)框架、中文关键短语抽取工具"
46,Python,manim,17536,2107,Python,https://github.com/3b1b/manim,3b1b,200,2020-03-08T09:40:33Z,Animation engine for explanatory math videos
47,Python,algo,17445,1473,Python,https://github.com/trailofbits/algo,trailofbits,75,2020-03-06T20:57:12Z,Set up a personal VPN in the cloud
48,Python,algorithms,16918,3390,Python,https://github.com/keon/algorithms,keon,101,2020-03-07T08:38:22Z,Minimal examples of data structures and algorithms in Python
49,Python,django-rest-framework,16771,4876,Python,https://github.com/encode/django-rest-framework,encode,241,2020-03-09T17:59:53Z,Web APIs for Django. 🎸
50,Python,sqlmap,16597,3598,Python,https://github.com/sqlmapproject/sqlmap,sqlmapproject,49,2020-03-09T09:44:18Z,Automatic SQL injection and database takeover tool
51,Python,Python,16529,8133,Python,https://github.com/geekcomputers/Python,geekcomputers,112,2020-03-01T10:38:38Z,My Python Examples
52,Python,d2l-zh,16449,4198,Python,https://github.com/d2l-ai/d2l-zh,d2l-ai,1,2020-03-09T20:45:38Z,《动手学深度学习》：面向中文读者、能运行、可讨论。英文版即伯克利“深度学习导论”教材。
53,Python,spaCy,15981,2824,Python,https://github.com/explosion/spaCy,explosion,185,2020-03-10T09:44:45Z,💫 Industrial-strength Natural Language Processing (NLP) with Python and Cython
54,Python,Mask_RCNN,15957,7506,Python,https://github.com/matterport/Mask_RCNN,matterport,1310,2020-03-05T18:59:57Z,Mask R-CNN for object detection and instance segmentation on Keras and TensorFlow
55,Python,airflow,15955,6074,Python,https://github.com/apache/airflow,apache,268,2020-03-10T10:51:43Z,"Apache Airflow - A platform to programmatically author, schedule, and monitor workflows"
56,Python,pytorch-tutorial,15799,4983,Python,https://github.com/yunjey/pytorch-tutorial,yunjey,58,2020-03-04T13:50:10Z,PyTorch Tutorial for Deep Learning Researchers
57,Python,ML-From-Scratch,15665,3021,Python,https://github.com/eriklindernoren/ML-From-Scratch,eriklindernoren,29,2020-01-29T17:50:42Z,Machine Learning From Scratch. Bare bones NumPy implementations of machine learning models and algorithms with a focus on accessibility. Aims to cover everything from linear regression to deep learning.
58,Python,macOS-Security-and-Privacy-Guide,15615,1119,Python,https://github.com/drduh/macOS-Security-and-Privacy-Guide,drduh,2,2020-02-07T01:06:12Z,Guide to securing and improving privacy on macOS
59,Python,ZeroNet,15457,2005,Python,https://github.com/HelloZeroNet/ZeroNet,HelloZeroNet,627,2020-03-09T14:54:56Z,ZeroNet - Decentralized websites using Bitcoin crypto and BitTorrent network
60,Python,glances,15393,1024,Python,https://github.com/nicolargo/glances,nicolargo,141,2020-03-05T22:03:19Z,"Glances an Eye on your system. A top/htop alternative for GNU/Linux, BSD, Mac OS and Windows operating systems."
61,Python,reddit,15312,2813,Python,https://github.com/reddit-archive/reddit,reddit-archive,304,2017-10-17T19:57:07Z,historical code from reddit.com
62,Python,NLP-progress,14856,2528,Python,https://github.com/sebastianruder/NLP-progress,sebastianruder,23,2020-03-09T22:42:48Z,"Repository to track the progress in Natural Language Processing (NLP), including the datasets and the current state-of-the-art for the most common NLP tasks."
63,Python,hosts,14768,1318,Python,https://github.com/StevenBlack/hosts,StevenBlack,35,2020-03-07T19:58:25Z,"Extending and consolidating hosts files from several well-curated sources like adaway.org, mvps.org, malwaredomainlist.com, someonewhocares.org, and potentially others.  You can optionally invoke extensions to block additional sites by category. "
64,Python,GitHub-Chinese-Top-Charts,14762,1955,Python,https://github.com/kon9chunkit/GitHub-Chinese-Top-Charts,kon9chunkit,47,2020-01-18T14:32:14Z,:cn: GitHub中文排行榜，帮助你发现高分优秀中文项目、更高效地吸收国人的优秀经验成果；榜单每周更新一次，敬请关注！（提前祝贺大家春节快乐，春运一路畅通！）
65,Python,celery,14549,3628,Python,https://github.com/celery/celery,celery,412,2020-03-10T05:01:35Z,Distributed Task Queue (development branch)
66,Python,pyspider,14148,3456,Python,https://github.com/binux/pyspider,binux,265,2020-02-29T20:14:01Z,A Powerful Spider(Web Crawler) System in Python.
67,Python,TensorFlow-Course,14097,2815,Python,https://github.com/machinelearningmindset/TensorFlow-Course,machinelearningmindset,0,2020-03-04T02:03:32Z,Simple and ready-to-use tutorials for TensorFlow 
68,Python,ipython,14055,3964,Python,https://github.com/ipython/ipython,ipython,1283,2020-03-10T10:58:51Z,"Official repository for IPython itself. Other repos in the IPython organization contain things like the website, documentation builds, etc."
69,Python,algo,13988,4347,Python,https://github.com/wangzheng0822/algo,wangzheng0822,91,2020-03-03T04:31:33Z,数据结构和算法必知必会的50个代码实现
70,Python,Awesome-Linux-Software,13639,1390,Python,https://github.com/luong-komorebi/Awesome-Linux-Software,luong-komorebi,14,2020-03-08T07:26:28Z,"A list of awesome applications, software, tools and other materials for Linux distros. "
71,Python,sanic,13557,1265,Python,https://github.com/huge-success/sanic,huge-success,66,2020-03-09T16:36:34Z,Async Python 3.6+ web server/framework | Build fast. Run fast.
72,Python,PySnooper,13306,836,Python,https://github.com/cool-RR/PySnooper,cool-RR,13,2019-12-14T13:35:08Z,Never use print for debugging again
73,Python,bitcoinbook,13075,3798,Python,https://github.com/bitcoinbook/bitcoinbook,bitcoinbook,87,2020-03-02T10:11:48Z,Mastering Bitcoin 2nd Edition - Programming the Open Blockchain
74,Python,PayloadsAllTheThings,13049,4083,Python,https://github.com/swisskyrepo/PayloadsAllTheThings,swisskyrepo,13,2020-03-09T19:06:34Z,A list of useful payloads and bypass for Web Application Security and Pentest/CTF
75,Python,luigi,13023,2098,Python,https://github.com/spotify/luigi,spotify,62,2020-03-10T09:25:27Z,"Luigi is a Python module that helps you build complex pipelines of batch jobs. It handles dependency resolution, workflow management, visualization etc. It also comes with Hadoop support built in. "
76,Python,fabric,12107,1793,Python,https://github.com/fabric/fabric,fabric,396,2020-01-28T23:52:26Z,"Simple, Pythonic remote execution and deployment."
77,Python,wxpy,11909,2110,Python,https://github.com/youfou/wxpy,youfou,297,2019-07-14T17:59:47Z,微信机器人 / 可能是最优雅的微信个人号 API ✨✨
78,Python,cookiecutter,11384,1233,Python,https://github.com/cookiecutter/cookiecutter,cookiecutter,185,2020-03-07T05:35:43Z,"A command-line utility that creates projects from cookiecutters (project templates), e.g. Python package projects, VueJS projects."
79,Python,powerline,11312,863,Python,https://github.com/powerline/powerline,powerline,181,2020-03-06T14:36:59Z,"Powerline is a statusline plugin for vim, and provides statuslines and prompts for several other applications, including zsh, bash, tmux, IPython, Awesome and Qtile."
80,Python,zulip,11263,3612,Python,https://github.com/zulip/zulip,zulip,1471,2020-03-10T10:22:34Z,Zulip server - powerful open source team chat
81,Python,gpt-2,11215,2705,Python,https://github.com/openai/gpt-2,openai,89,2020-02-18T00:22:20Z,"Code for the paper ""Language Models are Unsupervised Multitask Learners"""
82,Python,dash,11106,1135,Python,https://github.com/plotly/dash,plotly,289,2020-03-06T14:29:29Z,Analytical Web Apps for Python & R. No JavaScript Required.
83,Python,awesome-python-login-model,11067,2341,Python,https://github.com/Kr1s77/awesome-python-login-model,Kr1s77,70,2019-11-24T15:08:59Z,😮python模拟登陆一些大型网站，还有一些简单的爬虫，希望对你们有所帮助❤️，如果喜欢记得给个star哦🌟
84,Python,material-theme,11061,800,Python,https://github.com/equinusocio/material-theme,equinusocio,3,2019-08-20T19:59:53Z,"Material Theme, the most epic theme for Sublime Text 3 by Mattia Astorino"
85,Python,autojump,10860,539,Python,https://github.com/wting/autojump,wting,160,2019-11-30T19:12:16Z,A cd command that learns - easily navigate directories from the command line
86,Python,neural-networks-and-deep-learning,10824,5100,Python,https://github.com/mnielsen/neural-networks-and-deep-learning,mnielsen,6,2019-11-27T08:47:49Z,"Code samples for my book ""Neural Networks and Deep Learning"""
87,Python,sherlock,10801,1025,Python,https://github.com/sherlock-project/sherlock,sherlock-project,62,2020-03-09T19:22:20Z,🔎 Hunt down social media accounts by username across social networks
88,Python,kivy,10781,2350,Python,https://github.com/kivy/kivy,kivy,744,2020-03-04T16:28:40Z,"Open source UI framework written in Python, running on Windows, Linux, macOS, Android and iOS"
89,Python,pix2code,10776,1174,Python,https://github.com/tonybeltramelli/pix2code,tonybeltramelli,1,2020-01-28T22:22:25Z,pix2code: Generating Code from a Graphical User Interface Screenshot
90,Python,ray,10719,1562,Python,https://github.com/ray-project/ray,ray-project,908,2020-03-10T10:47:16Z,"A fast and simple framework for building and running distributed applications. Ray is packaged with RLlib, a scalable reinforcement learning library, and Tune, a scalable hyperparameter tuning library."
91,Python,requests-html,10711,680,Python,https://github.com/psf/requests-html,psf,106,2020-02-29T19:45:31Z,Pythonic HTML Parsing for Humans™
92,Python,salt,10697,4802,Python,https://github.com/saltstack/salt,saltstack,2004,2020-03-10T06:37:40Z,Software to automate the management and configuration of any infrastructure or application at scale. Get access to the Salt software package repository here: 
93,Python,zipline,10678,3134,Python,https://github.com/quantopian/zipline,quantopian,290,2020-03-09T14:24:36Z,"Zipline, a Pythonic Algorithmic Trading Library"
94,Python,cascadia-code,10511,288,Python,https://github.com/microsoft/cascadia-code,microsoft,49,2019-12-30T08:19:21Z,"This is a fun, new monospaced font that includes programming ligatures and is designed to enhance the modern look and feel of the Windows Terminal."
95,Python,inter,10477,225,Python,https://github.com/rsms/inter,rsms,40,2020-03-08T00:10:09Z,The Inter font family
96,Python,game-programmer,10384,1278,Python,https://github.com/miloyip/game-programmer,miloyip,19,2019-10-26T03:01:04Z,A Study Path for Game Programmer
97,Python,yapf,10335,703,Python,https://github.com/google/yapf,google,266,2020-03-04T03:24:36Z,A formatter for Python files
98,Python,Zappa,10329,1137,Python,https://github.com/Miserlou/Zappa,Miserlou,604,2020-03-09T13:48:54Z,Serverless Python
99,Python,magic-wormhole,10227,392,Python,https://github.com/warner/magic-wormhole,warner,111,2020-02-20T17:19:37Z,"get things from one computer to another, safely"
100,Python,awesome-algorithm,10216,2150,Python,https://github.com/apachecn/awesome-algorithm,apachecn,2,2019-07-17T07:48:02Z,项目永久冻结，迁移至新地址：
1,R,ggplot2,4274,1586,R,https://github.com/tidyverse/ggplot2,tidyverse,202,2020-03-10T06:14:57Z,An implementation of the Grammar of Graphics in R
2,R,awesome-R,3882,1289,R,https://github.com/qinwf/awesome-R,qinwf,1,2020-03-07T11:37:07Z,"A curated list of awesome R packages, frameworks and software."
3,R,ML_for_Hackers,3545,2245,R,https://github.com/johnmyleswhite/ML_for_Hackers,johnmyleswhite,34,2019-05-26T16:52:29Z,"Code accompanying the book ""Machine Learning for Hackers"""
4,R,dplyr,3219,1192,R,https://github.com/tidyverse/dplyr,tidyverse,30,2020-03-10T10:28:10Z,dplyr: A grammar of data manipulation
5,R,swirl_courses,3156,6401,R,https://github.com/swirldev/swirl_courses,swirldev,137,2019-12-26T19:44:19Z,:mortar_board: A collection of interactive courses for the swirl R package.
6,R,AnomalyDetection,3134,701,R,https://github.com/twitter/AnomalyDetection,twitter,69,2019-08-30T19:49:16Z,Anomaly Detection with R
7,R,r4ds,2265,2864,R,https://github.com/hadley/r4ds,hadley,110,2020-03-09T14:50:11Z,R for data science: a book
8,R,devtools,1925,696,R,https://github.com/r-lib/devtools,r-lib,36,2020-03-09T16:09:23Z,Tools to make an R developer's life easier
