rank,item,repo_name,stars,forks,language,repo_url,username,issues,last_commit,description
83,Java,MaterialDesignLibrary,8961,2400,Java,https://github.com/navasmdc/MaterialDesignLibrary,navasmdc,264,2018-10-19T03:52:29Z,This is a library with components of Android L to you use in android 2.2
84,Java,HikariCP,8944,1361,Java,https://github.com/brettwooldridge/HikariCP,brettwooldridge,105,2019-01-25T08:11:58Z,"光 HikariCP・A solid, high-performance, JDBC connection pool at last."
85,Java,recyclerview-animators,8848,1741,Java,https://github.com/wasabeef/recyclerview-animators,wasabeef,97,2018-11-16T07:20:43Z,An Android Animation library which easily add itemanimator to RecyclerView items.
86,Java,Arduino,8833,6422,Java,https://github.com/arduino/Arduino,arduino,1054,2019-01-25T08:33:25Z,open-source electronics prototyping platform
87,Java,Android-PullToRefresh,8775,5071,Java,https://github.com/chrisbanes/Android-PullToRefresh,chrisbanes,30,2017-10-13T08:40:58Z,DEPRECATED
88,Java,okhttp-OkGo,8743,2171,Java,https://github.com/jeasonlzy/okhttp-OkGo,jeasonlzy,330,2018-08-09T02:48:24Z,OkGo - 3.0 震撼来袭，该库是基于 Http 协议，封装了 OkHttp 的网络请求框架，比 Retrofit 更简单易用，支持 RxJava，RxJava2，支持自定义缓存，支持批量断点下载管理和批量上传管理功能
89,Java,GSYVideoPlayer,8723,1976,Java,https://github.com/CarGuo/GSYVideoPlayer,CarGuo,20,2019-01-15T03:20:20Z,"视频播放器（IJKplayer、ExoPlayer、MediaPlayer），HTTPS支持，支持弹幕，支持滤镜、水印、gif截图，片头广告、中间广告，多个同时播放，支持基本的拖动，声音、亮度调节，支持边播边缓存，支持视频本身自带rotation的旋转（90,270之类），重力旋转与手动旋转的同步支持，支持列表播放 ，直接添加控件为封面，列表全屏动画，视频加载速度，列表小窗口支持拖动，动画效果，调整比例，多分辨率切换，支持切换播放器，进度条小窗口预览，列表切换详情页面无缝播放，其他一些小动画效果，rtsp、concat、mpeg。项目解析： "
90,Java,Matisse,8697,1301,Java,https://github.com/zhihu/Matisse,zhihu,245,2019-01-20T16:03:41Z,:fireworks: A well-designed local image and video selector for Android
91,Java,ARouter,8697,1445,Java,https://github.com/alibaba/ARouter,alibaba,37,2019-01-24T17:40:19Z,💪 A framework for assisting in the renovation of Android componentization (帮助 Android App 进行组件化改造的路由框架)
92,Java,presto,8610,2928,Java,https://github.com/prestodb/presto,prestodb,1433,2019-01-26T23:05:24Z,Distributed SQL query engine for big data
93,Java,PermissionsDispatcher,8519,1199,Java,https://github.com/permissions-dispatcher/PermissionsDispatcher,permissions-dispatcher,0,2019-01-22T15:30:25Z,Simple annotation-based API to handle runtime permissions.
94,Java,hadoop,8514,5317,Java,https://github.com/apache/hadoop,apache,199,2019-01-26T20:57:37Z,Mirror of Apache Hadoop
95,Java,JiaoZiVideoPlayer,8448,2032,Java,https://github.com/lipangit/JiaoZiVideoPlayer,lipangit,55,2019-01-23T08:38:55Z,Android VideoPlayer MediaPlayer VideoView MediaView Float View And Fullscreen
96,Java,RxTool,8414,2119,Java,https://github.com/vondear/RxTool,vondear,117,2018-11-02T09:50:47Z,Android开发人员不得不收集的工具类集合 | 支付宝支付 | 微信支付（统一下单） | 微信分享 | Zip4j压缩（支持分卷压缩与加密） | 一键集成UCrop选择圆形头像 | 一键集成二维码和条形码的扫描与生成 | 常用Dialog | WebView的封装可播放视频 | 仿斗鱼滑动验证码 | Toast封装 | 震动 | GPS | Location定位 | 图片缩放 | Exif 图片添加地理位置信息（经纬度） | 蛛网等级 | 颜色选择器 | ArcGis | VTPK | 编译运行一下说不定会找到惊喜
97,Java,AppIntro,8331,1516,Java,https://github.com/AppIntro/AppIntro,AppIntro,68,2019-01-26T14:51:04Z,Make a cool intro for your Android app.
98,Java,AVLoadingIndicatorView,8324,1655,Java,https://github.com/81813780/AVLoadingIndicatorView,81813780,62,2018-04-24T02:59:27Z,DEPRECATED
99,Java,AndroidSlidingUpPanel,8236,2213,Java,https://github.com/umano/AndroidSlidingUpPanel,umano,277,2018-10-22T15:51:54Z,This library provides a simple way to add a draggable sliding up panel (popularized by Google Music and Google Maps) to your Android application. Brought to you by Umano.
100,Java,platform_frameworks_base,8232,5378,Java,https://github.com/aosp-mirror/platform_frameworks_base,aosp-mirror,0,2018-09-05T21:52:03Z,
1,JavaScript,freeCodeCamp,297111,20801,JavaScript,https://github.com/freeCodeCamp/freeCodeCamp,freeCodeCamp,4970,2019-01-27T02:56:16Z,The https://www.freeCodeCamp.org open source codebase and curriculum. Learn to code for free together with millions of people.
2,JavaScript,react,120762,21860,JavaScript,https://github.com/facebook/react,facebook,536,2019-01-27T01:55:48Z,"A declarative, efficient, and flexible JavaScript library for building user interfaces."
3,JavaScript,d3,81941,20300,JavaScript,https://github.com/d3/d3,d3,7,2019-01-21T18:26:09Z,"Bring data to life with SVG, Canvas and HTML. :bar_chart::chart_with_upwards_trend::tada:"
4,JavaScript,create-react-app,62639,13736,JavaScript,https://github.com/facebook/create-react-app,facebook,331,2019-01-27T00:35:08Z,Set up a modern web app by running one command.
5,JavaScript,angular.js,59368,28951,JavaScript,https://github.com/angular/angular.js,angular,460,2019-01-26T10:32:23Z,AngularJS - HTML enhanced for web apps!
6,JavaScript,Font-Awesome,58582,9937,JavaScript,https://github.com/FortAwesome/Font-Awesome,FortAwesome,4757,2019-01-19T03:18:31Z,"The iconic SVG, font, and CSS toolkit"
7,JavaScript,node,57633,12754,JavaScript,https://github.com/nodejs/node,nodejs,820,2019-01-27T03:07:42Z,Node.js JavaScript runtime :sparkles::turtle::rocket::sparkles:
8,JavaScript,axios,54210,4202,JavaScript,https://github.com/axios/axios,axios,518,2019-01-26T00:24:48Z,Promise based HTTP client for the browser and node.js
9,JavaScript,jquery,50824,17652,JavaScript,https://github.com/jquery/jquery,jquery,90,2019-01-21T17:42:40Z,jQuery JavaScript Library
10,JavaScript,three.js,48305,18170,JavaScript,https://github.com/mrdoob/three.js,mrdoob,801,2019-01-26T20:14:17Z,JavaScript 3D library.
11,JavaScript,atom,47618,10841,JavaScript,https://github.com/atom/atom,atom,726,2019-01-26T00:13:42Z,:atom: The hackable text editor
12,JavaScript,webpack,46718,5901,JavaScript,https://github.com/webpack/webpack,webpack,486,2019-01-26T02:37:21Z,"A bundler for javascript and friends. Packs many modules into a few bundled assets. Code Splitting allows for loading parts of the application on demand. Through ""loaders"", modules can be CommonJs, AMD, ES6 modules, CSS, Images, JSON, Coffeescript, LESS, ... and your custom stuff."
13,JavaScript,redux,46493,11798,JavaScript,https://github.com/reduxjs/redux,reduxjs,29,2019-01-25T06:18:08Z,Predictable state container for JavaScript apps
14,JavaScript,socket.io,45004,8331,JavaScript,https://github.com/socketio/socket.io,socketio,353,2019-01-19T06:08:50Z,Realtime application framework (Node.JS server)
15,JavaScript,free-programming-books-zh_CN,44653,14980,JavaScript,https://github.com/justjavac/free-programming-books-zh_CN,justjavac,150,2018-12-23T11:54:19Z,:books: 免费的计算机编程类中文书籍，欢迎投稿
16,JavaScript,puppeteer,44612,3849,JavaScript,https://github.com/GoogleChrome/puppeteer,GoogleChrome,276,2019-01-26T23:50:18Z,Headless Chrome Node API
17,JavaScript,reveal.js,44405,12813,JavaScript,https://github.com/hakimel/reveal.js,hakimel,403,2019-01-23T09:43:05Z,The HTML Presentation Framework
18,JavaScript,Semantic-UI,44289,4718,JavaScript,https://github.com/Semantic-Org/Semantic-UI,Semantic-Org,828,2019-01-22T05:37:47Z,Semantic is a UI component framework based around useful principles from natural language.
19,JavaScript,material-ui,43943,8899,JavaScript,https://github.com/mui-org/material-ui,mui-org,295,2019-01-27T02:27:08Z,React components that implement Google's Material Design.
20,JavaScript,javascript-algorithms,43343,5833,JavaScript,https://github.com/trekhleb/javascript-algorithms,trekhleb,67,2019-01-26T17:51:20Z,📝 Algorithms and data structures implemented in JavaScript with explanations and links to further readings
21,JavaScript,express,42078,7236,JavaScript,https://github.com/expressjs/express,expressjs,165,2019-01-24T19:53:03Z,"Fast, unopinionated, minimalist web framework for node."
22,JavaScript,html5-boilerplate,42034,9974,JavaScript,https://github.com/h5bp/html5-boilerplate,h5bp,7,2018-12-18T13:55:24Z,"A professional front-end template for building fast, robust, and adaptable web apps or sites."
23,JavaScript,Chart.js,41464,9300,JavaScript,https://github.com/chartjs/Chart.js,chartjs,459,2019-01-26T22:33:01Z,Simple HTML5 Charts using the <canvas> tag
24,JavaScript,meteor,40717,5032,JavaScript,https://github.com/meteor/meteor,meteor,273,2019-01-23T08:30:12Z,"Meteor, the JavaScript App Platform"
25,JavaScript,moment,39980,5990,JavaScript,https://github.com/moment/moment,moment,255,2019-01-25T14:48:38Z,"Parse, validate, manipulate, and display dates in javascript."
26,JavaScript,resume.github.com,39153,1040,JavaScript,https://github.com/resume/resume.github.com,resume,37,2018-12-29T23:17:05Z,Resumes generated using the GitHub informations
27,JavaScript,30-seconds-of-code,37760,4025,JavaScript,https://github.com/30-seconds/30-seconds-of-code,30-seconds,7,2019-01-26T06:09:46Z,Curated collection of useful JavaScript snippets that you can understand in 30 seconds or less.
28,JavaScript,json-server,37720,3267,JavaScript,https://github.com/typicode/json-server,typicode,397,2019-01-04T11:01:19Z,Get a full fake REST API with zero coding in less than 30 seconds (seriously)
29,JavaScript,lodash,37033,3824,JavaScript,https://github.com/lodash/lodash,lodash,6,2019-01-21T16:18:48Z,"A modern JavaScript utility library delivering modularity, performance, & extras."
30,JavaScript,markdown-here,35039,5921,JavaScript,https://github.com/adam-p/markdown-here,adam-p,225,2018-11-13T20:35:39Z,"Google Chrome, Firefox, and Thunderbird extension that lets you write email in Markdown and render it before sending."
31,JavaScript,materialize,34944,4692,JavaScript,https://github.com/Dogfalo/materialize,Dogfalo,608,2019-01-21T07:02:19Z,"Materialize, a CSS Framework based on Material Design"
32,JavaScript,yarn,34570,2048,JavaScript,https://github.com/yarnpkg/yarn,yarnpkg,1662,2019-01-26T19:18:34Z,"📦🐈 Fast, reliable, and secure dependency management."
33,JavaScript,impress.js,34425,6795,JavaScript,https://github.com/impress/impress.js,impress,53,2019-01-23T09:03:25Z,It's a presentation framework based on the power of CSS3 transforms and transitions in modern browsers and inspired by the idea behind prezi.com.
34,JavaScript,next.js,33983,3740,JavaScript,https://github.com/zeit/next.js,zeit,200,2019-01-27T01:43:15Z,The React Framework
35,JavaScript,storybook,33356,2506,JavaScript,https://github.com/storybooks/storybook,storybooks,224,2019-01-26T09:51:10Z,"Interactive UI component dev & test: React, React Native, Vue, Angular, Ember"
36,JavaScript,Front-End-Checklist,33114,3140,JavaScript,https://github.com/thedaviddias/Front-End-Checklist,thedaviddias,3,2019-01-17T18:40:00Z,🗂 The perfect Front-End Checklist for modern websites and meticulous developers
37,JavaScript,hacker-scripts,32689,5700,JavaScript,https://github.com/NARKOZ/hacker-scripts,NARKOZ,52,2018-10-09T05:16:03Z,Based on a true story
38,JavaScript,incubator-echarts,32267,9387,JavaScript,https://github.com/apache/incubator-echarts,apache,3186,2019-01-25T15:31:51Z,"A powerful, interactive charting and visualization library for browser"
39,JavaScript,babel,31625,3271,JavaScript,https://github.com/babel/babel,babel,786,2019-01-27T03:49:49Z,🐠 Babel is a compiler for writing next generation JavaScript.
40,JavaScript,gulp,30850,4426,JavaScript,https://github.com/gulpjs/gulp,gulpjs,23,2018-12-28T09:21:01Z,The streaming build system
41,JavaScript,gatsby,30732,4039,JavaScript,https://github.com/gatsbyjs/gatsby,gatsbyjs,801,2019-01-27T01:25:06Z,"Build blazing fast, modern apps and websites with React"
42,JavaScript,jQuery-File-Upload,29657,7928,JavaScript,https://github.com/blueimp/jQuery-File-Upload,blueimp,53,2018-11-14T06:09:12Z,"File Upload widget with multiple file selection, drag&drop support, progress bar, validation and preview images, audio and video for jQuery. Supports cross-domain, chunked and resumable file uploads. Works with any server-side platform (Google App Engine, PHP, Python, Ruby on Rails, Java, etc.) that supports standard HTML form file uploads."
43,JavaScript,brackets,29511,6385,JavaScript,https://github.com/adobe/brackets,adobe,2376,2019-01-21T05:38:39Z,"An open source code editor for the web, written in JavaScript, HTML and CSS."
44,JavaScript,parcel,29475,1308,JavaScript,https://github.com/parcel-bundler/parcel,parcel-bundler,623,2019-01-26T21:04:10Z,"📦🚀 Blazing fast, zero configuration web application bundler"
45,JavaScript,anime,28822,2070,JavaScript,https://github.com/juliangarnier/anime,juliangarnier,39,2019-01-27T01:44:33Z,JavaScript animation engine
46,JavaScript,awesome-selfhosted,28717,2323,JavaScript,https://github.com/Kickball/awesome-selfhosted,Kickball,48,2019-01-25T22:28:01Z,This is a list of Free Software network services and web applications which can be hosted locally. Selfhosting is the process of locally hosting and managing applications instead of renting from SaaS providers.
47,JavaScript,Ghost,28710,6196,JavaScript,https://github.com/TryGhost/Ghost,TryGhost,93,2019-01-26T18:18:36Z,The platform for professional publishers
48,JavaScript,pm2,27876,1927,JavaScript,https://github.com/Unitech/pm2,Unitech,598,2019-01-17T17:28:46Z,Node.js Production Process Manager with a built-in Load Balancer.
49,JavaScript,serverless,27706,3037,JavaScript,https://github.com/serverless/serverless,serverless,653,2019-01-26T07:38:44Z,"Serverless Framework – Build web, mobile and IoT applications with serverless architectures using AWS Lambda, Azure Functions, Google CloudFunctions & more! – "
50,JavaScript,backbone,27381,5723,JavaScript,https://github.com/jashkenas/backbone,jashkenas,81,2018-10-12T16:40:18Z,"Give your JS App some Backbone with Models, Views, Collections, and Events"
51,JavaScript,hyper,27225,2207,JavaScript,https://github.com/zeit/hyper,zeit,675,2019-01-26T15:13:49Z,A terminal built on web technologies
52,JavaScript,immutable-js,26307,1546,JavaScript,https://github.com/facebook/immutable-js,facebook,113,2019-01-24T18:37:16Z,Immutable persistent data collections for Javascript which increase efficiency and simplicity.
53,JavaScript,slate,25844,15605,JavaScript,https://github.com/lord/slate,lord,40,2019-01-24T00:58:42Z,Beautiful static documentation for your API
54,JavaScript,fullPage.js,25786,6266,JavaScript,https://github.com/alvarotrigo/fullPage.js,alvarotrigo,136,2019-01-21T12:32:47Z,fullPage plugin by Alvaro Trigo. Create full screen pages fast and simple
55,JavaScript,hackathon-starter,25592,5054,JavaScript,https://github.com/sahat/hackathon-starter,sahat,17,2019-01-14T18:12:13Z,A boilerplate for Node.js web applications
56,JavaScript,tech-interview-handbook,25424,3281,JavaScript,https://github.com/yangshun/tech-interview-handbook,yangshun,5,2019-01-27T01:54:24Z,"💯 Algorithms study materials, behavioral content and tips for rocking your coding interview"
57,JavaScript,pdf.js,25189,6083,JavaScript,https://github.com/mozilla/pdf.js,mozilla,682,2019-01-26T15:03:05Z,PDF Reader in JavaScript
58,JavaScript,async,25175,2283,JavaScript,https://github.com/caolan/async,caolan,17,2018-12-05T15:33:09Z,Async utilities for node and the browser
59,JavaScript,hexo,25052,3399,JavaScript,https://github.com/hexojs/hexo,hexojs,237,2019-01-24T22:53:32Z,"A fast, simple & powerful blog framework, powered by Node.js."
60,JavaScript,33-js-concepts,25044,2235,JavaScript,https://github.com/leonardomso/33-js-concepts,leonardomso,5,2019-01-25T13:15:15Z,📜 33 concepts every JavaScript developer should know.
61,JavaScript,clipboard.js,24924,2807,JavaScript,https://github.com/zenorocha/clipboard.js,zenorocha,40,2018-11-18T12:57:10Z,:scissors: Modern copy to clipboard. No Flash. Just 3kb gzipped :clipboard:
62,JavaScript,todomvc,24878,13277,JavaScript,https://github.com/tastejs/todomvc,tastejs,151,2019-01-07T06:13:39Z,"Helping you select an MV* framework - Todo apps for React.js, Ember.js, Angular, and many more"
63,JavaScript,koa,24746,2240,JavaScript,https://github.com/koajs/koa,koajs,45,2019-01-27T01:16:26Z,Expressive middleware for node.js using ES2017 async functions
64,JavaScript,nodebestpractices,24371,1770,JavaScript,https://github.com/i0natan/nodebestpractices,i0natan,62,2019-01-26T20:03:02Z,The largest Node.js best practices list (January 2019)
65,JavaScript,nylas-mail,24232,1344,JavaScript,https://github.com/nylas/nylas-mail,nylas,1047,2019-01-10T07:27:22Z,:love_letter: An extensible desktop mail app built on the modern web.  Forks welcome!
66,JavaScript,underscore,24127,5355,JavaScript,https://github.com/jashkenas/underscore,jashkenas,121,2019-01-26T23:23:17Z,JavaScript's utility _ belt
67,JavaScript,video.js,23861,5833,JavaScript,https://github.com/videojs/video.js,videojs,179,2019-01-25T20:20:54Z,Video.js - open source HTML5 & Flash video player
68,JavaScript,Leaflet,23847,3942,JavaScript,https://github.com/Leaflet/Leaflet,Leaflet,377,2019-01-25T12:35:23Z, :leaves: JavaScript library for mobile-friendly interactive maps
69,JavaScript,phaser,23750,5831,JavaScript,https://github.com/photonstorm/phaser,photonstorm,171,2019-01-26T15:54:19Z,"Phaser is a fun, free and fast 2D game framework for making HTML5 games for desktop and mobile web browsers, supporting Canvas and WebGL rendering."
70,JavaScript,Modernizr,23349,3023,JavaScript,https://github.com/Modernizr/Modernizr,Modernizr,190,2019-01-25T13:32:21Z,Modernizr is a JavaScript library that detects HTML5 and CSS3 features in the user’s browser.
71,JavaScript,slick,23235,4561,JavaScript,https://github.com/kenwheeler/slick,kenwheeler,1017,2019-01-18T15:38:08Z,the last carousel you'll ever need
72,JavaScript,select2,23207,5443,JavaScript,https://github.com/select2/select2,select2,461,2018-12-26T16:29:56Z,"Select2 is a jQuery based replacement for select boxes. It supports searching, remote data sets, and infinite scrolling of results."
73,JavaScript,jest,23133,3130,JavaScript,https://github.com/facebook/jest,facebook,533,2019-01-27T02:33:21Z,Delightful JavaScript Testing.
74,JavaScript,incubator-superset,22875,4194,JavaScript,https://github.com/apache/incubator-superset,apache,1094,2019-01-27T01:40:53Z,"Apache Superset (incubating) is a modern, enterprise-ready business intelligence web application"
75,JavaScript,awesome-react-native,22799,2783,JavaScript,https://github.com/jondot/awesome-react-native,jondot,43,2019-01-26T19:06:34Z,"Awesome React Native components, news, tools, and learning material!"
76,JavaScript,mermaid,21851,1256,JavaScript,https://github.com/knsv/mermaid,knsv,236,2019-01-20T22:36:01Z,Generation of diagram and flowchart from text in a similar manner as markdown
77,JavaScript,styled-components,21729,1299,JavaScript,https://github.com/styled-components/styled-components,styled-components,75,2019-01-24T16:42:37Z,Visual primitives for the component age. Use the best bits of ES6 and CSS to style your apps without stress 💅
78,JavaScript,request,21685,2558,JavaScript,https://github.com/request/request,request,304,2019-01-25T23:50:56Z,🏊🏾 Simplified HTTP request client.
79,JavaScript,realworld,21671,1437,JavaScript,https://github.com/gothinkster/realworld,gothinkster,121,2019-01-26T17:39:10Z,"""The mother of all demo apps"" — Exemplary fullstack Medium.com clone powered by React, Angular, Node, Django, and many more 🏅"
80,JavaScript,pixi.js,21647,3144,JavaScript,https://github.com/pixijs/pixi.js,pixijs,356,2019-01-26T23:29:04Z,"The HTML5 Creation Engine: Create beautiful digital content with the fastest, most flexible 2D WebGL renderer."
81,JavaScript,clean-code-javascript,21432,2228,JavaScript,https://github.com/ryanmcdermott/clean-code-javascript,ryanmcdermott,28,2019-01-24T02:58:56Z,:bathtub: Clean Code concepts adapted for JavaScript
82,JavaScript,preact,21374,1091,JavaScript,https://github.com/developit/preact,developit,187,2019-01-22T17:49:53Z,⚛️ Fast 3kB React alternative with the same modern API. Components & Virtual DOM.
83,JavaScript,quill,21309,1571,JavaScript,https://github.com/quilljs/quill,quilljs,529,2019-01-19T23:55:00Z,Quill is a modern WYSIWYG editor built for compatibility and extensibility.
84,JavaScript,fetch,21278,1922,JavaScript,https://github.com/github/fetch,github,11,2019-01-02T11:28:34Z,A window.fetch JavaScript polyfill.
85,JavaScript,react-boilerplate,21179,4107,JavaScript,https://github.com/react-boilerplate/react-boilerplate,react-boilerplate,19,2019-01-24T20:10:06Z,":fire: A highly scalable, offline-first foundation with the best developer experience and a focus on performance and best practices."
86,JavaScript,awesome-wechat-weapp,20827,4467,JavaScript,https://github.com/justjavac/awesome-wechat-weapp,justjavac,5,2019-01-16T12:20:10Z,微信小程序开发资源汇总 :100:
87,JavaScript,500lines,20725,4774,JavaScript,https://github.com/aosabook/500lines,aosabook,47,2018-10-19T15:15:57Z,500 Lines or Less
88,JavaScript,ember.js,20525,4095,JavaScript,https://github.com/emberjs/ember.js,emberjs,251,2019-01-27T03:51:17Z,Ember.js - A JavaScript framework for creating ambitious web applications
89,JavaScript,sails,20147,1832,JavaScript,https://github.com/balderdashy/sails,balderdashy,191,2019-01-22T04:13:00Z,Realtime MVC Framework for Node.js
90,JavaScript,postcss,20132,1116,JavaScript,https://github.com/postcss/postcss,postcss,14,2019-01-25T12:15:21Z,Transforming styles with JS plugins
91,JavaScript,gitbook,20109,2802,JavaScript,https://github.com/GitbookIO/gitbook,GitbookIO,990,2018-12-27T16:51:42Z,📝 Modern documentation format and toolchain using Git and Markdown
92,JavaScript,hammer.js,19606,2522,JavaScript,https://github.com/hammerjs/hammer.js,hammerjs,258,2018-06-07T10:29:26Z,A javascript library for multi-touch gestures :// You can touch this
93,JavaScript,RxJS,19541,2260,JavaScript,https://github.com/Reactive-Extensions/RxJS,Reactive-Extensions,288,2018-04-18T20:17:39Z,The Reactive Extensions for JavaScript
94,JavaScript,project-guidelines,19273,1808,JavaScript,https://github.com/elsewhencode/project-guidelines,elsewhencode,12,2018-10-29T10:58:22Z,A set of best practices for JavaScript projects
95,JavaScript,ace,19078,4250,JavaScript,https://github.com/ajaxorg/ace,ajaxorg,655,2019-01-15T07:33:32Z,Ace (Ajax.org Cloud9 Editor)
96,JavaScript,swiper,18840,6722,JavaScript,https://github.com/nolimits4web/swiper,nolimits4web,132,2019-01-15T23:49:35Z,Most modern mobile touch slider with hardware accelerated transitions
97,JavaScript,react-starter-kit,18732,3773,JavaScript,https://github.com/kriasoft/react-starter-kit,kriasoft,503,2018-12-27T08:32:55Z,"React Starter Kit — isomorphic web app boilerplate (Node.js, Express, GraphQL, React.js, Babel, PostCSS, Webpack, Browsersync)"
98,JavaScript,vuex,18706,6032,JavaScript,https://github.com/vuejs/vuex,vuejs,127,2019-01-18T08:42:24Z,🗃️ Centralized State Management for Vue.js.
99,JavaScript,vue-cli,18670,2974,JavaScript,https://github.com/vuejs/vue-cli,vuejs,303,2019-01-26T11:08:44Z,🛠️ Standard Tooling for Vue.js Development
100,JavaScript,webtorrent,18600,1782,JavaScript,https://github.com/webtorrent/webtorrent,webtorrent,92,2019-01-07T18:58:03Z,⚡️ Streaming torrent client for the web
1,Lua,kong,19934,2417,Lua,https://github.com/Kong/kong,Kong,293,2019-01-26T00:38:00Z,:gorilla: The Cloud-Native API Gateway & Service Mesh
2,Lua,neural-style,16502,2510,Lua,https://github.com/jcjohnson/neural-style,jcjohnson,310,2018-02-23T01:21:20Z,Torch implementation of neural style algorithm
3,Lua,waifu2x,12979,1486,Lua,https://github.com/nagadomi/waifu2x,nagadomi,75,2019-01-16T16:54:03Z,Image Super-Resolution for Anime-Style Art
4,Lua,openface,11487,2764,Lua,https://github.com/cmusatyalab/openface,cmusatyalab,11,2018-12-09T13:46:40Z,Face recognition with deep neural networks.
5,Lua,char-rnn,8978,2200,Lua,https://github.com/karpathy/char-rnn,karpathy,105,2018-05-04T15:25:25Z,"Multi-layer Recurrent Neural Networks (LSTM, GRU, RNN) for character-level language models in Torch"
6,Lua,CycleGAN,7835,1244,Lua,https://github.com/junyanz/CycleGAN,junyanz,25,2018-12-11T19:28:43Z,"Software that can generate photos from paintings,  turn horses into zebras,  perform style transfer, and more."
7,Lua,pix2pix,5719,926,Lua,https://github.com/phillipi/pix2pix,phillipi,42,2018-12-11T19:25:36Z,Image-to-image translation with conditional adversarial nets
8,Lua,dockercraft,5091,298,Lua,https://github.com/docker/dockercraft,docker,13,2018-06-18T12:15:21Z,Docker + Minecraft = Dockercraft
9,Lua,koreader,4554,607,Lua,https://github.com/koreader/koreader,koreader,360,2019-01-26T19:44:16Z,"An ebook reader application supporting PDF, DjVu, EPUB, FB2 and many more formats, running on Kindle, Kobo, PocketBook, Ubuntu Touch and Android devices"
10,Lua,VeryNginx,4509,695,Lua,https://github.com/alexazhou/VeryNginx,alexazhou,84,2018-12-27T01:55:18Z," A very powerful and friendly  nginx base on lua-nginx-module( openresty ) which provide WAF, Control Panel, and Dashboards. "
11,Lua,fairseq,3327,583,Lua,https://github.com/facebookresearch/fairseq,facebookresearch,8,2018-10-24T13:31:29Z,Facebook AI Research Sequence-to-Sequence Toolkit
12,Lua,lsyncd,3324,333,Lua,https://github.com/axkibe/lsyncd,axkibe,76,2018-12-05T21:42:23Z,Lsyncd (Live Syncing Daemon) synchronizes local directories with remote targets
