rank,item,repo_name,stars,forks,language,repo_url,username,issues,last_commit,description
1,top-100-stars,freeCodeCamp,304696,22512,JavaScript,https://github.com/freeCodeCamp/freeCodeCamp,freeCodeCamp,183,2019-09-06T09:48:45Z,The https://www.freeCodeCamp.org open source codebase and curriculum. Learn to code for free together with millions of people.
2,top-100-stars,996.ICU,247219,21303,Rust,https://github.com/996icu/996.ICU,996icu,16748,2019-09-03T09:20:14Z,Repo for counting stars and contributing. Press F to pay respect to glorious developers.
3,top-100-stars,vue,147574,21654,JavaScript,https://github.com/vuejs/vue,vuejs,350,2019-09-05T14:17:44Z,"🖖 Vue.js is a progressive, incrementally-adoptable JavaScript framework for building UI on the web."
4,top-100-stars,bootstrap,135626,66738,JavaScript,https://github.com/twbs/bootstrap,twbs,360,2019-09-06T09:49:07Z,"The most popular HTML, CSS, and JavaScript framework for developing responsive, mobile first projects on the web."
5,top-100-stars,react,135618,25407,JavaScript,https://github.com/facebook/react,facebook,783,2019-09-06T09:52:33Z,"A declarative, efficient, and flexible JavaScript library for building user interfaces."
6,top-100-stars,tensorflow,133598,77148,C++,https://github.com/tensorflow/tensorflow,tensorflow,2676,2019-09-06T10:33:04Z,An Open Source Machine Learning Framework for Everyone
7,top-100-stars,free-programming-books,128168,31946,,https://github.com/EbookFoundation/free-programming-books,EbookFoundation,43,2019-09-06T06:57:45Z,:books: Freely available programming books
8,top-100-stars,awesome,115348,15267,,https://github.com/sindresorhus/awesome,sindresorhus,30,2019-09-02T20:11:52Z,😎 Awesome lists about all kinds of interesting topics
9,top-100-stars,You-Dont-Know-JS,107944,21516,,https://github.com/getify/You-Dont-Know-JS,getify,140,2019-09-05T14:36:00Z,A book series on JavaScript. @YDKJS on twitter.
10,top-100-stars,oh-my-zsh,94516,17447,Shell,https://github.com/robbyrussell/oh-my-zsh,robbyrussell,733,2019-09-06T04:16:18Z,"🙃 A delightful community-driven (with 1,300+ contributors) framework for managing your zsh configuration. Includes 200+ optional plugins (rails, git, OSX, hub, capistrano, brew, ant, php, python, etc), over 140 themes to spice up your morning, and an auto-update tool so that makes it easy to keep up with the latest updates from the community."
11,top-100-stars,gitignore,89042,44483,,https://github.com/github/gitignore,github,117,2019-09-05T08:24:27Z,A collection of useful .gitignore templates
12,top-100-stars,coding-interview-university,88818,26016,,https://github.com/jwasham/coding-interview-university,jwasham,66,2019-09-03T11:31:42Z,A complete computer science study plan to become a software engineer.
13,top-100-stars,javascript,88642,17068,JavaScript,https://github.com/airbnb/javascript,airbnb,110,2019-09-06T04:14:31Z,JavaScript Style Guide
14,top-100-stars,developer-roadmap,87429,13933,,https://github.com/kamranahmedse/developer-roadmap,kamranahmedse,191,2019-08-28T11:27:12Z,Roadmap to becoming a web developer in 2019
15,top-100-stars,d3,87149,21276,JavaScript,https://github.com/d3/d3,d3,4,2019-08-23T13:13:48Z,"Bring data to life with SVG, Canvas and HTML. :bar_chart::chart_with_upwards_trend::tada:"
16,top-100-stars,vscode,82398,11810,TypeScript,https://github.com/microsoft/vscode,microsoft,6009,2019-09-06T10:56:48Z,Visual Studio Code
17,top-100-stars,react-native,80689,18025,JavaScript,https://github.com/facebook/react-native,facebook,701,2019-09-06T10:49:00Z,A framework for building native apps with React.
18,top-100-stars,linux,79919,27884,C,https://github.com/torvalds/linux,torvalds,287,2019-09-06T10:45:31Z,Linux kernel source tree
19,top-100-stars,electron,76699,10096,C++,https://github.com/electron/electron,electron,1056,2019-09-06T08:30:11Z,":electron: Build cross-platform desktop apps with JavaScript, HTML, and CSS"
20,top-100-stars,CS-Notes,76341,24313,Java,https://github.com/CyC2018/CS-Notes,CyC2018,18,2019-09-05T02:35:16Z,:books: Tech Interview Guide 技术面试必备基础知识、Leetcode 题解、Java、C++、Python、后端面试、操作系统、计算机网络、系统设计
21,top-100-stars,flutter,74254,9092,Dart,https://github.com/flutter/flutter,flutter,7748,2019-09-06T04:05:42Z,Flutter makes it easy and fast to build beautiful mobile apps.
22,top-100-stars,awesome-python,72689,14250,Python,https://github.com/vinta/awesome-python,vinta,490,2019-09-06T09:28:50Z,"A curated list of awesome Python frameworks, libraries, software and resources"
23,top-100-stars,system-design-primer,72427,11507,Python,https://github.com/donnemartin/system-design-primer,donnemartin,106,2019-09-01T01:03:33Z,Learn how to design large-scale systems. Prep for the system design interview.  Includes Anki flashcards.
24,top-100-stars,create-react-app,71333,16481,JavaScript,https://github.com/facebook/create-react-app,facebook,450,2019-09-06T01:31:04Z,Set up a modern web app by running one command.
25,top-100-stars,the-art-of-command-line,64212,7216,,https://github.com/jlevy/the-art-of-command-line,jlevy,153,2019-07-31T14:37:29Z,"Master the command line, in one page"
26,top-100-stars,axios,64199,5374,JavaScript,https://github.com/axios/axios,axios,699,2019-09-05T19:32:05Z,Promise based HTTP client for the browser and node.js
27,top-100-stars,node,64058,14752,JavaScript,https://github.com/nodejs/node,nodejs,1083,2019-09-06T10:51:18Z,Node.js JavaScript runtime :sparkles::turtle::rocket::sparkles:
28,top-100-stars,go,63133,8818,Go,https://github.com/golang/go,golang,4997,2019-09-06T07:49:11Z,The Go programming language
29,top-100-stars,animate.css,61854,13094,CSS,https://github.com/daneden/animate.css,daneden,25,2019-09-02T08:00:48Z,🍿 A cross-browser library of CSS animations. As easy to use as an easy thing.
30,top-100-stars,public-apis,61042,6582,Python,https://github.com/public-apis/public-apis,public-apis,71,2019-09-05T03:36:46Z,A collective list of free APIs for use in software and web development.
31,top-100-stars,Font-Awesome,60849,10275,JavaScript,https://github.com/FortAwesome/Font-Awesome,FortAwesome,4899,2019-09-05T07:51:20Z,"The iconic SVG, font, and CSS toolkit"
32,top-100-stars,angular.js,59617,28892,JavaScript,https://github.com/angular/angular.js,angular,464,2019-08-18T21:18:57Z,AngularJS - HTML enhanced for web apps!
33,top-100-stars,Python-100-Days,58848,22232,Jupyter Notebook,https://github.com/jackfrued/Python-100-Days,jackfrued,205,2019-09-06T02:21:26Z,Python - 100天从新手到大师
34,top-100-stars,kubernetes,57522,20098,Go,https://github.com/kubernetes/kubernetes,kubernetes,3254,2019-09-06T10:50:12Z,Production-Grade Container Scheduling and Management
35,top-100-stars,models,57263,35920,Python,https://github.com/tensorflow/models,tensorflow,1870,2019-09-06T06:46:29Z,Models and examples built with TensorFlow
36,top-100-stars,free-programming-books-zh_CN,55251,17798,,https://github.com/justjavac/free-programming-books-zh_CN,justjavac,167,2019-08-23T17:29:38Z,:books: 免费的计算机编程类中文书籍，欢迎投稿
37,top-100-stars,youtube-dl,55060,9563,Python,https://github.com/ytdl-org/youtube-dl,ytdl-org,2995,2019-09-04T23:30:02Z,Command-line program to download videos from YouTube.com and other video sites
38,top-100-stars,moby,54827,15824,Go,https://github.com/moby/moby,moby,3837,2019-09-06T02:35:27Z,Moby Project - a collaborative project for the container ecosystem to assemble container-based systems
39,top-100-stars,laravel,54800,16808,PHP,https://github.com/laravel/laravel,laravel,28,2019-09-06T06:45:20Z,A PHP framework for web artisans
40,top-100-stars,three.js,54437,20592,JavaScript,https://github.com/mrdoob/three.js,mrdoob,805,2019-09-06T09:01:53Z,JavaScript 3D library.
41,top-100-stars,Python,54351,16114,Jupyter Notebook,https://github.com/TheAlgorithms/Python,TheAlgorithms,206,2019-09-06T09:06:57Z,All Algorithms implemented in Python
42,top-100-stars,JavaGuide,54135,18047,Java,https://github.com/Snailclimb/JavaGuide,Snailclimb,40,2019-09-06T04:11:13Z,【Java学习+面试指南】 一份涵盖大部分Java程序员所需要掌握的核心知识。
43,top-100-stars,puppeteer,53526,5036,JavaScript,https://github.com/GoogleChrome/puppeteer,GoogleChrome,498,2019-09-05T11:29:33Z,Headless Chrome Node API
44,top-100-stars,TypeScript,53341,7318,TypeScript,https://github.com/microsoft/TypeScript,microsoft,3765,2019-09-06T09:34:04Z,TypeScript is a superset of JavaScript that compiles to clean JavaScript output.
45,top-100-stars,javascript-algorithms,53311,8098,JavaScript,https://github.com/trekhleb/javascript-algorithms,trekhleb,116,2019-08-30T21:43:54Z,📝 Algorithms and data structures implemented in JavaScript with explanations and links to further readings
46,top-100-stars,jquery,52137,18477,JavaScript,https://github.com/jquery/jquery,jquery,86,2019-08-31T23:03:37Z,jQuery JavaScript Library
47,top-100-stars,terminal,51522,5014,C++,https://github.com/microsoft/terminal,microsoft,656,2019-09-06T00:22:19Z,"The new Windows Terminal, and the original Windows console host -- all in the same place!"
48,top-100-stars,ant-design,51173,18223,TypeScript,https://github.com/ant-design/ant-design,ant-design,370,2019-09-06T10:58:30Z,🌈 A UI Design Language
49,top-100-stars,angular,51121,14227,TypeScript,https://github.com/angular/angular,angular,3099,2019-09-06T10:07:57Z,One framework. Mobile & desktop.
50,top-100-stars,java-design-patterns,51048,16494,Java,https://github.com/iluwatar/java-design-patterns,iluwatar,195,2019-09-05T12:53:41Z,Design patterns implemented in Java
51,top-100-stars,webpack,50826,6443,JavaScript,https://github.com/webpack/webpack,webpack,503,2019-09-06T02:27:11Z,"A bundler for javascript and friends. Packs many modules into a few bundled assets. Code Splitting allows for loading parts of the application on demand. Through ""loaders"", modules can be CommonJs, AMD, ES6 modules, CSS, Images, JSON, Coffeescript, LESS, ... and your custom stuff."
52,top-100-stars,redux,50435,13136,JavaScript,https://github.com/reduxjs/redux,reduxjs,36,2019-09-05T20:53:00Z,Predictable state container for JavaScript apps
53,top-100-stars,material-ui,50285,11836,JavaScript,https://github.com/mui-org/material-ui,mui-org,363,2019-09-06T10:41:14Z,"React components for faster and easier web development. Build your own design system, or start with Material Design."
54,top-100-stars,atom,49777,12675,JavaScript,https://github.com/atom/atom,atom,636,2019-09-05T17:49:59Z,:atom: The hackable text editor
55,top-100-stars,swift,49019,7891,C++,https://github.com/apple/swift,apple,572,2019-09-06T10:36:27Z,The Swift Programming Language
56,top-100-stars,30-seconds-of-code,48424,5512,JavaScript,https://github.com/30-seconds/30-seconds-of-code,30-seconds,12,2019-09-05T17:24:29Z,A curated collection of useful JavaScript snippets that you can understand in 30 seconds or less.
57,top-100-stars,awesome-vue,48389,6740,,https://github.com/vuejs/awesome-vue,vuejs,115,2019-09-06T07:26:38Z,🎉 A curated list of awesome things related to Vue.js
58,top-100-stars,reveal.js,48053,13922,JavaScript,https://github.com/hakimel/reveal.js,hakimel,492,2019-09-03T01:59:44Z,The HTML Presentation Framework
59,top-100-stars,awesome-go,47576,6277,Go,https://github.com/avelino/awesome-go,avelino,76,2019-09-04T17:00:03Z,"A curated list of awesome Go frameworks, libraries and software"
60,top-100-stars,socket.io,47406,8623,JavaScript,https://github.com/socketio/socket.io,socketio,417,2019-08-21T17:07:55Z,Realtime application framework (Node.JS server)
61,top-100-stars,build-your-own-x,47131,3267,,https://github.com/danistefanovic/build-your-own-x,danistefanovic,32,2019-09-05T16:47:08Z,🤓 Build your own (insert technology here)
62,top-100-stars,thefuck,46590,2305,Python,https://github.com/nvbn/thefuck,nvbn,170,2019-09-02T17:17:49Z,Magnificent app which corrects your previous console command.
63,top-100-stars,Semantic-UI,46319,4889,JavaScript,https://github.com/Semantic-Org/Semantic-UI,Semantic-Org,935,2019-08-02T23:11:46Z,Semantic is a UI component framework based around useful principles from natural language.
64,top-100-stars,flask,46291,12870,Python,https://github.com/pallets/flask,pallets,21,2019-09-02T16:05:06Z,The Python micro framework for building web applications.
65,top-100-stars,express,45332,7605,JavaScript,https://github.com/expressjs/express,expressjs,170,2019-09-02T20:23:02Z,"Fast, unopinionated, minimalist web framework for node."
66,top-100-stars,Chart.js,45084,9861,JavaScript,https://github.com/chartjs/Chart.js,chartjs,499,2019-09-05T22:32:09Z,Simple HTML5 Charts using the <canvas> tag
67,top-100-stars,lantern,44673,9660,Go,https://github.com/getlantern/lantern,getlantern,2534,2019-09-06T07:47:05Z,蓝灯Windows下载 https://raw.githubusercontent.com/getlantern/lantern-binaries/master/lantern-installer.exe 蓝灯安卓下载 https://raw.githubusercontent.com/getlantern/lantern-binaries/master/lantern-installer.apk
68,top-100-stars,Apollo-11,44325,6107,Assembly,https://github.com/chrislgarry/Apollo-11,chrislgarry,42,2019-09-02T15:11:26Z,Original Apollo 11 Guidance Computer (AGC) source code for the command and lunar modules.
69,top-100-stars,rails,44018,17769,Ruby,https://github.com/rails/rails,rails,1157,2019-09-06T10:29:22Z,Ruby on Rails
70,top-100-stars,elasticsearch,43939,14760,Java,https://github.com/elastic/elasticsearch,elastic,2191,2019-09-06T10:55:10Z,"Open Source, Distributed, RESTful Search Engine"
71,top-100-stars,keras,43908,16711,Python,https://github.com/keras-team/keras,keras-team,2567,2019-09-06T07:36:48Z,Deep Learning for humans
72,top-100-stars,django,43882,18842,Python,https://github.com/django/django,django,222,2019-09-06T10:28:59Z,The Web framework for perfectionists with deadlines.
73,top-100-stars,computer-science,43467,6370,,https://github.com/ossu/computer-science,ossu,30,2019-09-04T22:03:38Z,:mortar_board: Path to a free self-taught education in Computer Science!
74,top-100-stars,html5-boilerplate,43290,10336,JavaScript,https://github.com/h5bp/html5-boilerplate,h5bp,4,2019-09-05T01:45:22Z,"A professional front-end template for building fast, robust, and adaptable web apps or sites."
75,top-100-stars,httpie,42953,2818,Python,https://github.com/jakubroztocil/httpie,jakubroztocil,144,2019-09-05T16:47:50Z,"As easy as HTTPie /aitch-tee-tee-pie/ 🥧 Modern command line HTTP client – user-friendly curl alternative with intuitive UI, JSON support, syntax highlighting, wget-like downloads, extensions, etc.  https://twitter.com/clihttp"
76,top-100-stars,json-server,42475,3804,JavaScript,https://github.com/typicode/json-server,typicode,470,2019-09-02T16:36:05Z,Get a full fake REST API with zero coding in less than 30 seconds (seriously)
77,top-100-stars,moment,42237,6334,JavaScript,https://github.com/moment/moment,moment,380,2019-09-05T09:11:42Z,"Parse, validate, manipulate, and display dates in javascript."
78,top-100-stars,shadowsocks-windows,42178,13860,C#,https://github.com/shadowsocks/shadowsocks-windows,shadowsocks,120,2019-09-05T12:40:51Z,"If you want to keep a secret, you must also hide it from yourself."
79,top-100-stars,Front-end-Developer-Interview-Questions,42032,8478,HTML,https://github.com/h5bp/Front-end-Developer-Interview-Questions,h5bp,5,2019-07-27T02:44:26Z,"A list of helpful front-end related questions you can use to interview potential candidates, test yourself or completely ignore."
80,top-100-stars,resume.github.com,41836,1104,JavaScript,https://github.com/resume/resume.github.com,resume,35,2018-12-29T23:17:05Z,Resumes generated using the GitHub informations
81,top-100-stars,awesome-machine-learning,41615,10482,Python,https://github.com/josephmisiti/awesome-machine-learning,josephmisiti,7,2019-09-05T18:54:33Z,"A curated list of awesome Machine Learning frameworks, libraries and software."
82,top-100-stars,spring-boot,41569,26694,Java,https://github.com/spring-projects/spring-boot,spring-projects,385,2019-09-06T10:51:48Z,Spring Boot
83,top-100-stars,meteor,41304,5042,JavaScript,https://github.com/meteor/meteor,meteor,376,2019-09-05T22:50:22Z,"Meteor, the JavaScript App Platform"
84,top-100-stars,lodash,41266,4313,JavaScript,https://github.com/lodash/lodash,lodash,12,2019-08-30T20:44:14Z,"A modern JavaScript utility library delivering modularity, performance, & extras."
85,top-100-stars,storybook,41035,3443,TypeScript,https://github.com/storybookjs/storybook,storybookjs,417,2019-09-05T17:15:17Z,"UI component dev & test: React, Vue, Angular, React Native, Ember, Web Components & more!"
86,top-100-stars,netdata,40831,3650,C,https://github.com/netdata/netdata,netdata,575,2019-09-06T10:37:40Z,"Real-time performance monitoring, done right! https://my-netdata.io/"
87,top-100-stars,element,40816,8766,Vue,https://github.com/ElemeFE/element,ElemeFE,878,2019-09-06T07:46:27Z,A Vue.js 2.0 UI Toolkit for Web
88,top-100-stars,next.js,40620,5150,JavaScript,https://github.com/zeit/next.js,zeit,275,2019-09-06T09:28:24Z,The React Framework
89,top-100-stars,markdown-here,40392,6992,JavaScript,https://github.com/adam-p/markdown-here,adam-p,249,2019-05-11T14:08:34Z,"Google Chrome, Firefox, and Thunderbird extension that lets you write email in Markdown and render it before sending."
90,top-100-stars,RxJava,40389,6794,Java,https://github.com/ReactiveX/RxJava,ReactiveX,11,2019-08-29T14:52:58Z,RxJava – Reactive Extensions for the JVM – a library for composing asynchronous and event-based programs using observable sequences for the Java VM.
91,top-100-stars,vue-element-admin,40232,13467,Vue,https://github.com/PanJiaChen/vue-element-admin,PanJiaChen,390,2019-08-30T01:01:53Z,:tada: A magical vue admin                                                                https://panjiachen.github.io/vue-element-admin
92,top-100-stars,requests,40059,7270,Python,https://github.com/psf/requests,psf,239,2019-09-05T23:25:45Z,Python HTTP Requests for Humans™ ✨🍰✨
93,top-100-stars,bitcoin,39941,24044,C++,https://github.com/bitcoin/bitcoin,bitcoin,985,2019-09-06T10:35:54Z,Bitcoin Core integration/staging tree
94,top-100-stars,LeetCodeAnimation,39924,6809,Java,https://github.com/MisterBooo/LeetCodeAnimation,MisterBooo,0,2019-08-22T00:50:23Z,Demonstrate all the questions on LeetCode in the form of animation.（用动画的形式呈现解LeetCode题目的思路）
95,top-100-stars,every-programmer-should-know,39530,3636,,https://github.com/mtdvio/every-programmer-should-know,mtdvio,28,2019-07-25T19:43:26Z,A collection of (mostly) technical things every software developer should know
96,top-100-stars,ansible,39182,16618,Python,https://github.com/ansible/ansible,ansible,5995,2019-09-06T10:55:26Z,"Ansible is a radically simple IT automation platform that makes your applications and systems easier to deploy. Avoid writing scripts or custom code to deploy and update your applications — automate in a language that approaches plain English, using SSH, with no agents to install on remote systems. https://docs.ansible.com/ansible/"
97,top-100-stars,ionic,38937,13111,TypeScript,https://github.com/ionic-team/ionic,ionic-team,744,2019-09-05T21:32:24Z,Build amazing native and progressive web apps with open web technologies. One app running on everything 🎉
98,top-100-stars,rust,38927,6045,Rust,https://github.com/rust-lang/rust,rust-lang,5141,2019-09-06T10:37:56Z,Empowering everyone to build reliable and efficient software.
99,top-100-stars,material-design-icons,38753,7944,CSS,https://github.com/google/material-design-icons,google,564,2019-08-24T11:59:35Z,Material Design icons by Google
100,top-100-stars,jekyll,38582,8423,Ruby,https://github.com/jekyll/jekyll,jekyll,129,2019-09-05T14:32:43Z,:globe_with_meridians: Jekyll is a blog-aware static site generator in Ruby
1,top-100-forks,datasharing,4858,196997,,https://github.com/jtleek/datasharing,jtleek,457,2019-08-26T09:34:17Z,The Leek group guide to data sharing 
2,top-100-forks,ProgrammingAssignment2,604,118037,R,https://github.com/rdpeng/ProgrammingAssignment2,rdpeng,2844,2019-09-06T08:22:08Z,Repository for Programming Assignment 2 for R Programming on Coursera
3,top-100-forks,Spoon-Knife,10155,105466,HTML,https://github.com/octocat/Spoon-Knife,octocat,13873,2019-09-06T10:20:41Z,This repo is for demonstration purposes only.
4,top-100-forks,tensorflow,133598,77148,C++,https://github.com/tensorflow/tensorflow,tensorflow,2676,2019-09-06T10:33:04Z,An Open Source Machine Learning Framework for Everyone
5,top-100-forks,bootstrap,135626,66738,JavaScript,https://github.com/twbs/bootstrap,twbs,360,2019-09-06T09:49:07Z,"The most popular HTML, CSS, and JavaScript framework for developing responsive, mobile first projects on the web."
6,top-100-forks,SmartThingsPublic,1351,59229,Groovy,https://github.com/SmartThingsCommunity/SmartThingsPublic,SmartThingsCommunity,1307,2019-09-06T10:22:00Z,SmartThings open-source DeviceTypeHandlers and SmartApps code
7,top-100-forks,gitignore,89042,44483,,https://github.com/github/gitignore,github,117,2019-09-05T08:24:27Z,A collection of useful .gitignore templates
8,top-100-forks,RepData_PeerAssessment1,78,32062,,https://github.com/rdpeng/RepData_PeerAssessment1,rdpeng,273,2019-07-19T22:57:09Z,Peer Assessment 1 for Reproducible Research
9,top-100-forks,free-programming-books,128168,31946,,https://github.com/EbookFoundation/free-programming-books,EbookFoundation,43,2019-09-06T06:57:45Z,:books: Freely available programming books
10,top-100-forks,cgm-remote-monitor,908,31620,JavaScript,https://github.com/nightscout/cgm-remote-monitor,nightscout,251,2019-09-05T04:54:57Z,nightscout web monitor
11,top-100-forks,opencv,37970,28150,C++,https://github.com/opencv/opencv,opencv,1800,2019-09-06T07:21:50Z,Open Source Computer Vision Library
12,top-100-forks,courses,3279,27903,HTML,https://github.com/DataScienceSpecialization/courses,DataScienceSpecialization,93,2019-06-11T17:55:24Z,Course materials for the Data Science Specialization: https://www.coursera.org/specialization/jhudatascience/1
13,top-100-forks,spring-boot,41569,26694,Java,https://github.com/spring-projects/spring-boot,spring-projects,385,2019-09-06T10:51:48Z,Spring Boot
14,top-100-forks,react,135618,25407,JavaScript,https://github.com/facebook/react,facebook,783,2019-09-06T09:52:33Z,"A declarative, efficient, and flexible JavaScript library for building user interfaces."
15,top-100-forks,jekyll-now,6230,25303,CSS,https://github.com/barryclark/jekyll-now,barryclark,154,2019-09-05T06:30:05Z,"Build a Jekyll blog in minutes, without touching the command line."
16,top-100-forks,tutorials,16776,24922,Java,https://github.com/eugenp/tutorials,eugenp,102,2019-09-06T10:17:59Z,"The ""REST With Spring"" Course: "
17,top-100-forks,patchwork,901,24591,HTML,https://github.com/jlord/patchwork,jlord,825,2019-09-06T06:43:55Z,All the Git-it Workshop completers! 
18,top-100-forks,frontend-nanodegree-resume,1057,24445,JavaScript,https://github.com/udacity/frontend-nanodegree-resume,udacity,2,2019-08-28T19:07:42Z,This repository is used for one of the projects in Udacity's Front-End Web Developer Nanodegree program. Learn how to become a Front-End Developer today with line-by-line code reviewed projects and get a job with career services!
19,top-100-forks,bitcoin,39941,24044,C++,https://github.com/bitcoin/bitcoin,bitcoin,985,2019-09-06T10:35:54Z,Bitcoin Core integration/staging tree
20,top-100-forks,recipes,65,22741,,https://github.com/LarryMad/recipes,LarryMad,2250,2019-09-05T13:17:03Z,
21,top-100-forks,freeCodeCamp,304696,22512,JavaScript,https://github.com/freeCodeCamp/freeCodeCamp,freeCodeCamp,183,2019-09-06T09:48:45Z,The https://www.freeCodeCamp.org open source codebase and curriculum. Learn to code for free together with millions of people.
22,top-100-forks,Python-100-Days,58848,22232,Jupyter Notebook,https://github.com/jackfrued/Python-100-Days,jackfrued,205,2019-09-06T02:21:26Z,Python - 100天从新手到大师
23,top-100-forks,vue,147574,21654,JavaScript,https://github.com/vuejs/vue,vuejs,350,2019-09-05T14:17:44Z,"🖖 Vue.js is a progressive, incrementally-adoptable JavaScript framework for building UI on the web."
24,top-100-forks,You-Dont-Know-JS,107944,21516,,https://github.com/getify/You-Dont-Know-JS,getify,140,2019-09-05T14:36:00Z,A book series on JavaScript. @YDKJS on twitter.
25,top-100-forks,996.ICU,247219,21303,Rust,https://github.com/996icu/996.ICU,996icu,16748,2019-09-03T09:20:14Z,Repo for counting stars and contributing. Press F to pay respect to glorious developers.
26,top-100-forks,d3,87149,21276,JavaScript,https://github.com/d3/d3,d3,4,2019-08-23T13:13:48Z,"Bring data to life with SVG, Canvas and HTML. :bar_chart::chart_with_upwards_trend::tada:"
27,top-100-forks,spring-framework,32055,20826,Java,https://github.com/spring-projects/spring-framework,spring-projects,1032,2019-09-06T09:15:28Z,Spring Framework
28,top-100-forks,three.js,54437,20592,JavaScript,https://github.com/mrdoob/three.js,mrdoob,805,2019-09-06T09:01:53Z,JavaScript 3D library.
29,top-100-forks,kubernetes,57522,20098,Go,https://github.com/kubernetes/kubernetes,kubernetes,3254,2019-09-06T10:50:12Z,Production-Grade Container Scheduling and Management
30,top-100-forks,shadowsocks,31203,19052,Python,https://github.com/shadowsocks/shadowsocks,shadowsocks,449,2019-08-27T10:19:00Z,
31,top-100-forks,dubbo,28964,19030,Java,https://github.com/apache/dubbo,apache,574,2019-09-06T09:13:18Z,"Apache Dubbo is a high-performance, java based, open source RPC framework."
32,top-100-forks,first-contributions,7644,18900,,https://github.com/firstcontributions/first-contributions,firstcontributions,1170,2019-09-06T10:54:18Z,🚀✨ Help beginners to contribute to open source projects
33,top-100-forks,django,43882,18842,Python,https://github.com/django/django,django,222,2019-09-06T10:28:59Z,The Web framework for perfectionists with deadlines.
