rank,item,repo_name,stars,forks,language,repo_url,username,issues,last_commit,description
81,Java,VasSonic,9511,1316,Java,https://github.com/Tencent/VasSonic,Tencent,4,2019-03-19T13:43:02Z,"VasSonic is a lightweight and high-performance Hybrid framework developed by tencent VAS team, which is intended to speed up the first screen of websites working on Android and iOS platform. "
82,Java,GSYVideoPlayer,9502,2138,Java,https://github.com/CarGuo/GSYVideoPlayer,CarGuo,17,2019-04-07T12:14:20Z,"视频播放器（IJKplayer、ExoPlayer、MediaPlayer），HTTPS支持，支持弹幕，支持滤镜、水印、gif截图，片头广告、中间广告，多个同时播放，支持基本的拖动，声音、亮度调节，支持边播边缓存，支持视频本身自带rotation的旋转（90,270之类），重力旋转与手动旋转的同步支持，支持列表播放 ，直接添加控件为封面，列表全屏动画，视频加载速度，列表小窗口支持拖动，动画效果，调整比例，多分辨率切换，支持切换播放器，进度条小窗口预览，列表切换详情页面无缝播放，其他一些小动画效果，rtsp、concat、mpeg。项目解析： "
83,Java,vert.x,9493,1494,Java,https://github.com/eclipse-vertx/vert.x,eclipse-vertx,188,2019-04-09T22:57:29Z,Vert.x is a tool-kit for building reactive applications on the JVM
84,Java,PocketHub,9398,3663,Java,https://github.com/pockethub/PocketHub,pockethub,113,2019-03-18T19:05:35Z,PocketHub Android App
85,Java,ARouter,9370,1576,Java,https://github.com/alibaba/ARouter,alibaba,53,2019-03-30T09:24:13Z,💪 A framework for assisting in the renovation of Android componentization (帮助 Android App 进行组件化改造的路由框架)
86,Java,Android-ObservableScrollView,9296,2099,Java,https://github.com/ksoichiro/Android-ObservableScrollView,ksoichiro,178,2017-08-09T11:37:19Z,Android library to observe scroll events on scrollable views.
87,Java,vlayout,9284,1609,Java,https://github.com/alibaba/vlayout,alibaba,122,2019-03-18T04:09:54Z,"Project vlayout is a powerfull LayoutManager extension for RecyclerView, it provides a group of layouts for RecyclerView. Make it able to handle a complicate situation when grid, list and other layouts in the same recyclerview. "
88,Java,Matisse,9229,1378,Java,https://github.com/zhihu/Matisse,zhihu,268,2019-04-10T16:19:53Z,:fireworks: A well-designed local image and video selector for Android
89,Java,Arduino,9098,6467,Java,https://github.com/arduino/Arduino,arduino,1113,2019-04-09T16:32:01Z,open-source electronics prototyping platform
90,Java,recyclerview-animators,9055,1765,Java,https://github.com/wasabeef/recyclerview-animators,wasabeef,99,2018-11-16T07:20:43Z,An Android Animation library which easily add itemanimator to RecyclerView items.
91,Java,storm,9047,1780,Java,https://github.com/nathanmarz/storm,nathanmarz,44,2017-08-16T04:24:20Z,"Distributed and fault-tolerant realtime computation: stream processing, continuous computation, distributed RPC, and more"
92,Java,okhttp-OkGo,9013,2213,Java,https://github.com/jeasonlzy/okhttp-OkGo,jeasonlzy,355,2019-04-03T01:41:41Z,OkGo - 3.0 震撼来袭，该库是基于 Http 协议，封装了 OkHttp 的网络请求框架，比 Retrofit 更简单易用，支持 RxJava，RxJava2，支持自定义缓存，支持批量断点下载管理和批量上传管理功能
93,Java,MaterialDesignLibrary,9006,2401,Java,https://github.com/navasmdc/MaterialDesignLibrary,navasmdc,265,2019-02-22T05:33:49Z,This is a library with components of Android L to you use in android 2.2
94,Java,presto,8926,3034,Java,https://github.com/prestodb/presto,prestodb,1022,2019-04-11T03:51:01Z,The official home of the Presto distributed SQL query engine for big data
95,Java,springboot-learning-example,8872,4741,Java,https://github.com/JeffLi1993/springboot-learning-example,JeffLi1993,4,2019-04-10T16:05:57Z,spring boot 实践学习案例，是 spring boot 初学者及核心技术巩固的最佳实践。
96,Java,RxTool,8856,2208,Java,https://github.com/vondear/RxTool,vondear,120,2019-04-07T07:10:17Z,Android开发人员不得不收集的工具类集合 | 支付宝支付 | 微信支付（统一下单） | 微信分享 | Zip4j压缩（支持分卷压缩与加密） | 一键集成UCrop选择圆形头像 | 一键集成二维码和条形码的扫描与生成 | 常用Dialog | WebView的封装可播放视频 | 仿斗鱼滑动验证码 | Toast封装 | 震动 | GPS | Location定位 | 图片缩放 | Exif 图片添加地理位置信息（经纬度） | 蛛网等级 | 颜色选择器 | ArcGis | VTPK | 编译运行一下说不定会找到惊喜
97,Java,hadoop,8813,5537,Java,https://github.com/apache/hadoop,apache,242,2019-04-11T02:30:26Z,Mirror of Apache Hadoop
98,Java,JiaoZiVideoPlayer,8809,2094,Java,https://github.com/lipangit/JiaoZiVideoPlayer,lipangit,115,2019-04-06T08:27:45Z,Android VideoPlayer MediaPlayer VideoView MediaView Float View And Fullscreen
99,Java,PermissionsDispatcher,8787,1216,Java,https://github.com/permissions-dispatcher/PermissionsDispatcher,permissions-dispatcher,7,2019-04-09T02:39:40Z,Simple annotation-based API to handle runtime permissions.
100,Java,Android-PullToRefresh,8787,5044,Java,https://github.com/chrisbanes/Android-PullToRefresh,chrisbanes,30,2017-10-13T08:40:58Z,DEPRECATED
1,JavaScript,bootstrap,132430,64767,JavaScript,https://github.com/twbs/bootstrap,twbs,381,2019-04-10T13:10:08Z,"The most popular HTML, CSS, and JavaScript framework for developing responsive, mobile first projects on the web."
2,JavaScript,react,126764,23050,JavaScript,https://github.com/facebook/react,facebook,646,2019-04-11T00:16:28Z,"A declarative, efficient, and flexible JavaScript library for building user interfaces."
3,JavaScript,create-react-app,66096,14736,JavaScript,https://github.com/facebook/create-react-app,facebook,338,2019-04-10T19:44:19Z,Set up a modern web app by running one command.
4,JavaScript,node,60016,13356,JavaScript,https://github.com/nodejs/node,nodejs,844,2019-04-11T04:01:13Z,Node.js JavaScript runtime :sparkles::turtle::rocket::sparkles:
5,JavaScript,Font-Awesome,59453,10028,JavaScript,https://github.com/FortAwesome/Font-Awesome,FortAwesome,4816,2019-03-29T20:56:54Z,"The iconic SVG, font, and CSS toolkit"
6,JavaScript,three.js,50432,18926,JavaScript,https://github.com/mrdoob/three.js,mrdoob,864,2019-04-11T03:19:12Z,JavaScript 3D library.
7,JavaScript,puppeteer,47801,4252,JavaScript,https://github.com/GoogleChrome/puppeteer,GoogleChrome,335,2019-04-11T02:12:56Z,Headless Chrome Node API
8,JavaScript,socket.io,45910,8442,JavaScript,https://github.com/socketio/socket.io,socketio,375,2019-03-30T10:11:39Z,Realtime application framework (Node.JS server)
9,JavaScript,reveal.js,45647,13179,JavaScript,https://github.com/hakimel/reveal.js,hakimel,426,2019-04-10T08:09:46Z,The HTML Presentation Framework
10,JavaScript,express,43260,7341,JavaScript,https://github.com/expressjs/express,expressjs,180,2019-04-05T01:35:48Z,"Fast, unopinionated, minimalist web framework for node."
11,JavaScript,Chart.js,42862,9480,JavaScript,https://github.com/chartjs/Chart.js,chartjs,456,2019-04-08T07:43:13Z,Simple HTML5 Charts using the <canvas> tag
12,JavaScript,html5-boilerplate,42593,10093,JavaScript,https://github.com/h5bp/html5-boilerplate,h5bp,1,2019-04-11T01:34:11Z,"A professional front-end template for building fast, robust, and adaptable web apps or sites."
13,JavaScript,resume.github.com,40232,1059,JavaScript,https://github.com/resume/resume.github.com,resume,36,2018-12-29T23:17:05Z,Resumes generated using the GitHub informations
14,JavaScript,materialize,35499,4748,JavaScript,https://github.com/Dogfalo/materialize,Dogfalo,637,2019-04-08T18:44:43Z,"Materialize, a CSS Framework based on Material Design"
15,JavaScript,impress.js,34672,6809,JavaScript,https://github.com/impress/impress.js,impress,51,2019-04-10T07:21:34Z,It's a presentation framework based on the power of CSS3 transforms and transitions in modern browsers and inspired by the idea behind prezi.com.
16,JavaScript,gatsby,33659,4698,JavaScript,https://github.com/gatsbyjs/gatsby,gatsbyjs,517,2019-04-10T22:58:59Z,"Build blazing fast, modern apps and websites with React"
17,JavaScript,awesome-selfhosted,30639,2484,JavaScript,https://github.com/Kickball/awesome-selfhosted,Kickball,48,2019-04-08T00:00:21Z,This is a list of Free Software network services and web applications which can be hosted locally. Selfhosting is the process of locally hosting and managing applications instead of renting from SaaS providers.
18,JavaScript,jQuery-File-Upload,29874,7964,JavaScript,https://github.com/blueimp/jQuery-File-Upload,blueimp,52,2019-03-06T15:19:04Z,"File Upload widget with multiple file selection, drag&drop support, progress bar, validation and preview images, audio and video for jQuery. Supports cross-domain, chunked and resumable file uploads. Works with any server-side platform (Google App Engine, PHP, Python, Ruby on Rails, Java, etc.) that supports standard HTML form file uploads."
19,JavaScript,pm2,28689,1953,JavaScript,https://github.com/Unitech/pm2,Unitech,644,2019-04-09T21:24:42Z,Node.js Production Process Manager with a built-in Load Balancer.
20,JavaScript,immutable-js,27002,1575,JavaScript,https://github.com/immutable-js/immutable-js,immutable-js,123,2019-03-08T14:05:52Z,Immutable persistent data collections for Javascript which increase efficiency and simplicity.
21,JavaScript,nodebestpractices,26855,2049,JavaScript,https://github.com/i0natan/nodebestpractices,i0natan,33,2019-04-09T19:09:15Z,:white_check_mark: The largest Node.js best practices list (April 2019)
22,JavaScript,hackathon-starter,26289,5283,JavaScript,https://github.com/sahat/hackathon-starter,sahat,14,2019-04-08T04:39:04Z,A boilerplate for Node.js web applications
23,JavaScript,fullPage.js,26268,6346,JavaScript,https://github.com/alvarotrigo/fullPage.js,alvarotrigo,149,2019-04-10T16:35:26Z,fullPage plugin by Alvaro Trigo. Create full screen pages fast and simple
24,JavaScript,pdf.js,26151,6263,JavaScript,https://github.com/mozilla/pdf.js,mozilla,600,2019-04-10T22:05:49Z,PDF Reader in JavaScript
25,JavaScript,hexo,25998,3480,JavaScript,https://github.com/hexojs/hexo,hexojs,214,2019-04-06T16:11:21Z,"A fast, simple & powerful blog framework, powered by Node.js."
26,JavaScript,clipboard.js,25640,2950,JavaScript,https://github.com/zenorocha/clipboard.js,zenorocha,48,2019-03-26T10:59:33Z,:scissors: Modern copy to clipboard. No Flash. Just 3kb gzipped :clipboard:
27,JavaScript,async,25426,2308,JavaScript,https://github.com/caolan/async,caolan,7,2019-04-07T22:25:08Z,Async utilities for node and the browser
28,JavaScript,phaser,24416,5904,JavaScript,https://github.com/photonstorm/phaser,photonstorm,202,2019-04-10T19:56:57Z,"Phaser is a fun, free and fast 2D game framework for making HTML5 games for desktop and mobile web browsers, supporting Canvas and WebGL rendering."
29,JavaScript,incubator-superset,23875,4455,JavaScript,https://github.com/apache/incubator-superset,apache,1093,2019-04-11T00:22:12Z,"Apache Superset (incubating) is a modern, enterprise-ready business intelligence web application"
30,JavaScript,select2,23453,5532,JavaScript,https://github.com/select2/select2,select2,110,2019-04-08T15:39:14Z,"Select2 is a jQuery based replacement for select boxes. It supports searching, remote data sets, and infinite scrolling of results."
31,JavaScript,mermaid,22988,1341,JavaScript,https://github.com/knsv/mermaid,knsv,265,2019-03-18T10:48:25Z,Generation of diagram and flowchart from text in a similar manner as markdown
32,JavaScript,clean-code-javascript,22683,2416,JavaScript,https://github.com/ryanmcdermott/clean-code-javascript,ryanmcdermott,26,2019-03-24T21:13:45Z,:bathtub: Clean Code concepts adapted for JavaScript
33,JavaScript,request,22319,2632,JavaScript,https://github.com/request/request,request,278,2019-04-10T12:54:32Z,🏊🏾 Simplified HTTP request client.
34,JavaScript,quill,22271,1655,JavaScript,https://github.com/quilljs/quill,quilljs,532,2019-04-08T07:24:59Z,Quill is a modern WYSIWYG editor built for compatibility and extensibility.
35,JavaScript,preact,22224,1153,JavaScript,https://github.com/developit/preact,developit,151,2019-04-10T20:23:31Z,⚛️ Fast 3kB React alternative with the same modern API. Components & Virtual DOM.
36,JavaScript,vue-cli,20093,3284,JavaScript,https://github.com/vuejs/vue-cli,vuejs,340,2019-04-11T01:26:13Z,🛠️ Standard Tooling for Vue.js Development
37,JavaScript,vuex,19785,6350,JavaScript,https://github.com/vuejs/vuex,vuejs,124,2019-04-11T01:48:38Z,🗃️ Centralized State Management for Vue.js.
38,JavaScript,RxJS,19615,2277,JavaScript,https://github.com/Reactive-Extensions/RxJS,Reactive-Extensions,288,2018-04-18T20:17:39Z,The Reactive Extensions for JavaScript
39,JavaScript,swiper,19524,7032,JavaScript,https://github.com/nolimits4web/swiper,nolimits4web,165,2019-04-10T07:22:25Z,Most modern mobile touch slider with hardware accelerated transitions
40,JavaScript,marked,18970,2514,JavaScript,https://github.com/markedjs/marked,markedjs,72,2019-04-09T19:35:11Z,A markdown parser and compiler. Built for speed.
41,JavaScript,front-end-interview-handbook,18837,2324,JavaScript,https://github.com/yangshun/front-end-interview-handbook,yangshun,20,2019-04-01T07:13:17Z,"🕸 Almost complete answers to ""Front-end Job Interview Questions"" which you can use to interview potential candidates, test yourself or completely ignore"
42,JavaScript,dragula,18835,1596,JavaScript,https://github.com/bevacqua/dragula,bevacqua,210,2019-01-23T22:25:06Z,:ok_hand: Drag and drop so simple it hurts
43,JavaScript,faker.js,18356,1462,JavaScript,https://github.com/Marak/faker.js,Marak,230,2019-04-04T07:13:38Z,generate massive amounts of realistic fake data in Node.js and the browser
44,JavaScript,mongoose,18342,2587,JavaScript,https://github.com/Automattic/mongoose,Automattic,313,2019-04-11T00:02:46Z,MongoDB object modeling designed to work in an asynchronous environment.
45,JavaScript,pug,18102,1889,JavaScript,https://github.com/pugjs/pug,pugjs,215,2019-03-11T12:50:27Z,"Pug – robust, elegant, feature rich template engine for Node.js"
46,JavaScript,bluebird,18097,2255,JavaScript,https://github.com/petkaantonov/bluebird,petkaantonov,121,2019-04-03T10:35:30Z,:bird: :zap: Bluebird is a full featured promise library with unmatched performance.
47,JavaScript,mocha,17580,2389,JavaScript,https://github.com/mochajs/mocha,mochajs,296,2019-04-10T21:43:05Z,"☕️ simple, flexible, fun javascript test framework for node.js & the browser"
48,JavaScript,scrollreveal,17387,2007,JavaScript,https://github.com/scrollreveal/scrollreveal,scrollreveal,5,2019-03-13T00:36:37Z,Animate elements as they scroll into view.
49,JavaScript,redux-saga,17359,1527,JavaScript,https://github.com/redux-saga/redux-saga,redux-saga,92,2019-04-10T09:51:34Z,An alternative side effect model for Redux apps
50,JavaScript,CodeMirror,17310,3827,JavaScript,https://github.com/codemirror/CodeMirror,codemirror,312,2019-04-11T00:17:44Z,In-browser code editor
51,JavaScript,date-fns,17248,681,JavaScript,https://github.com/date-fns/date-fns,date-fns,179,2019-04-08T09:01:08Z,⏳ Modern JavaScript date utility library ⌛️
52,JavaScript,enzyme,16905,1854,JavaScript,https://github.com/airbnb/enzyme,airbnb,153,2019-04-10T06:03:39Z,JavaScript Testing utilities for React
53,JavaScript,hyperapp,16586,730,JavaScript,https://github.com/jorgebucaran/hyperapp,jorgebucaran,49,2019-04-02T21:45:51Z,1 kB JavaScript micro-framework for building declarative web applications
54,JavaScript,lighthouse,16501,5521,JavaScript,https://github.com/GoogleChrome/lighthouse,GoogleChrome,475,2019-04-11T03:23:22Z,"Auditing, performance metrics, and best practices for Progressive Web Apps"
55,JavaScript,parse-server,16271,4121,JavaScript,https://github.com/parse-community/parse-server,parse-community,56,2019-04-10T17:12:10Z,Parse-compatible API server module for Node/Express
56,JavaScript,lottie-web,16027,1403,JavaScript,https://github.com/airbnb/lottie-web,airbnb,460,2019-04-08T02:15:25Z,"Render After Effects animations natively on Web, Android and iOS, and React Native. http://airbnb.io/lottie/"
57,JavaScript,uBlock,16021,1333,JavaScript,https://github.com/gorhill/uBlock,gorhill,98,2019-04-08T15:36:40Z,uBlock Origin - An efficient blocker for Chromium and Firefox. Fast and lean.
58,JavaScript,lerna,15937,1003,JavaScript,https://github.com/lerna/lerna,lerna,155,2019-04-10T11:55:36Z,:dragon: A tool for managing JavaScript projects with multiple packages.
59,JavaScript,mostly-adequate-guide,15743,1276,JavaScript,https://github.com/MostlyAdequate/mostly-adequate-guide,MostlyAdequate,44,2019-04-04T11:02:42Z,Mostly adequate guide to FP (in javascript)
60,JavaScript,feather,15503,557,JavaScript,https://github.com/feathericons/feather,feathericons,225,2019-04-05T05:24:02Z,Simply beautiful open source icons
61,JavaScript,js-xlsx,15268,3528,JavaScript,https://github.com/SheetJS/js-xlsx,SheetJS,239,2019-04-01T21:34:40Z,:green_book: SheetJS Community Edition -- Spreadsheet Parser and Writer
62,JavaScript,bower,15257,1985,JavaScript,https://github.com/bower/bower,bower,199,2019-03-09T17:48:30Z,A package manager for the web
63,JavaScript,tesseract.js,15238,1026,JavaScript,https://github.com/naptha/tesseract.js,naptha,139,2019-02-16T13:00:42Z,Pure Javascript OCR for 62 Languages 📖🎉🖥
64,JavaScript,q,14635,1230,JavaScript,https://github.com/kriskowal/q,kriskowal,118,2018-10-23T13:47:02Z,A promise library for JavaScript
65,JavaScript,node-lessons,14518,4663,JavaScript,https://github.com/alsotang/node-lessons,alsotang,89,2018-05-31T07:54:21Z,:closed_book:《Node.js 包教不包会》 by alsotang
66,JavaScript,handlebars.js,14357,1837,JavaScript,https://github.com/wycats/handlebars.js,wycats,118,2019-03-29T12:11:23Z,
67,JavaScript,flv.js,14315,2106,JavaScript,https://github.com/bilibili/flv.js,bilibili,172,2019-01-07T14:53:12Z,HTML5 FLV Player
68,JavaScript,wekan,14229,2052,JavaScript,https://github.com/wekan/wekan,wekan,411,2019-04-09T12:16:20Z,The open-source kanban (built with Meteor)
69,JavaScript,fks,14107,4425,JavaScript,https://github.com/JacksonTian/fks,JacksonTian,8,2017-07-06T16:13:03Z,前端技能汇总 Frontend Knowledge Structure
70,JavaScript,highlight.js,14095,2396,JavaScript,https://github.com/highlightjs/highlight.js,highlightjs,353,2019-04-08T18:59:57Z,Javascript syntax highlighter
71,JavaScript,superagent,14065,1183,JavaScript,https://github.com/visionmedia/superagent,visionmedia,121,2019-04-08T18:42:48Z,Ajax for Node.js and browsers (JS HTTP client)
72,JavaScript,howler.js,14005,1419,JavaScript,https://github.com/goldfire/howler.js,goldfire,287,2019-04-09T21:43:02Z,Javascript audio library for the modern web.
73,JavaScript,mysql,13832,1919,JavaScript,https://github.com/mysqljs/mysql,mysqljs,141,2019-03-19T09:45:44Z,A pure node.js JavaScript Client implementing the MySql protocol.
74,JavaScript,react-beautiful-dnd,13661,724,JavaScript,https://github.com/atlassian/react-beautiful-dnd,atlassian,85,2019-04-11T01:34:31Z,Beautiful and accessible drag and drop for lists with React
75,JavaScript,plyr,13606,1458,JavaScript,https://github.com/sampotts/plyr,sampotts,258,2019-04-04T06:32:46Z,"A simple HTML5, YouTube and Vimeo player"
76,JavaScript,medium-editor,13474,1626,JavaScript,https://github.com/yabwe/medium-editor,yabwe,308,2019-03-08T10:34:15Z,Medium.com WYSIWYG editor clone. Uses contenteditable API to implement a rich text solution.
77,JavaScript,graphql-js,13465,1123,JavaScript,https://github.com/graphql/graphql-js,graphql,82,2019-04-10T14:18:29Z,A reference implementation of GraphQL for JavaScript
78,JavaScript,f8app,13431,2574,JavaScript,https://github.com/fbsamples/f8app,fbsamples,17,2018-08-18T10:56:43Z,"Source code of the official F8 app of 2017, powered by React Native and other Facebook open source projects."
79,JavaScript,angular-seed,13334,7434,JavaScript,https://github.com/angular/angular-seed,angular,19,2019-03-14T07:51:57Z,Seed project for angular apps. 
80,JavaScript,strapi,13328,1534,JavaScript,https://github.com/strapi/strapi,strapi,176,2019-04-10T19:51:19Z,🚀 Open source Node.js Headless CMS to easily build customisable APIs
81,JavaScript,pkg,13223,483,JavaScript,https://github.com/zeit/pkg,zeit,344,2019-04-04T14:51:10Z,Package your Node.js project into an executable
82,JavaScript,wtfjs,13216,856,JavaScript,https://github.com/denysdovhan/wtfjs,denysdovhan,24,2019-04-08T09:04:11Z,A list of funny and tricky JavaScript examples
83,JavaScript,react-native-web,13162,1039,JavaScript,https://github.com/necolas/react-native-web,necolas,73,2019-04-04T11:51:34Z,React Native for Web
84,JavaScript,webpack-dashboard,13141,389,JavaScript,https://github.com/FormidableLabs/webpack-dashboard,FormidableLabs,34,2019-03-28T17:27:46Z,A CLI dashboard for webpack dev server
85,JavaScript,validator.js,12942,1110,JavaScript,https://github.com/chriso/validator.js,chriso,102,2019-04-10T15:31:01Z,String validation
86,JavaScript,draggable,12816,655,JavaScript,https://github.com/Shopify/draggable,Shopify,106,2019-04-10T12:35:25Z,The JavaScript Drag & Drop library your grandparents warned you about.
87,JavaScript,amphtml,12497,2870,JavaScript,https://github.com/ampproject/amphtml,ampproject,1699,2019-04-11T02:46:02Z,The AMP web component library.
88,JavaScript,learnGitBranching,12463,2991,JavaScript,https://github.com/pcottle/learnGitBranching,pcottle,23,2019-04-10T23:08:52Z,An interactive git visualization to challenge and educate!
89,JavaScript,node-inspector,12405,772,JavaScript,https://github.com/node-inspector/node-inspector,node-inspector,234,2018-02-08T23:01:21Z,Node.js debugger based on Blink Developer Tools
90,JavaScript,electronic-wechat,12375,2213,JavaScript,https://github.com/geeeeeeeeek/electronic-wechat,geeeeeeeeek,208,2019-03-19T00:56:31Z,:speech_balloon: A better WeChat on macOS and Linux. Built with Electron by Zhongyi Tong.
91,JavaScript,stream-handbook,12309,929,JavaScript,https://github.com/substack/stream-handbook,substack,70,2017-10-13T04:43:09Z,how to write node programs with streams
92,JavaScript,Snap.svg,12003,1082,JavaScript,https://github.com/adobe-webplatform/Snap.svg,adobe-webplatform,231,2018-02-20T07:56:36Z,The JavaScript library for modern SVG graphics.
93,JavaScript,iscroll,11882,3510,JavaScript,https://github.com/cubiq/iscroll,cubiq,580,2018-12-13T19:06:24Z,Smooth scrolling for the web
94,JavaScript,pouchdb,11820,1173,JavaScript,https://github.com/pouchdb/pouchdb,pouchdb,45,2019-04-10T07:18:14Z,:koala: - PouchDB is a pocket-sized database.
95,JavaScript,electron-react-boilerplate,11703,1925,JavaScript,https://github.com/electron-react-boilerplate/electron-react-boilerplate,electron-react-boilerplate,47,2019-04-10T13:33:58Z,A Foundation for Scalable Cross-Platform Apps
96,JavaScript,react-redux-universal-hot-example,11701,2604,JavaScript,https://github.com/erikras/react-redux-universal-hot-example,erikras,447,2018-06-13T02:39:51Z,"A starter boilerplate for a universal webapp using express, react, redux, webpack, and react-transform"
97,JavaScript,NativeBase,11680,1385,JavaScript,https://github.com/GeekyAnts/NativeBase,GeekyAnts,56,2019-04-10T07:32:48Z,Essential cross-platform UI components for React Native
98,JavaScript,solved-by-flexbox,11657,960,JavaScript,https://github.com/philipwalton/solved-by-flexbox,philipwalton,20,2019-03-14T20:21:35Z,"A showcase of problems once hard or impossible to solve with CSS alone, now made trivially easy with Flexbox."
99,JavaScript,svgo,11585,860,JavaScript,https://github.com/svg/svgo,svg,249,2019-04-04T19:54:38Z,:tiger: Node.js tool for optimizing SVG files
100,JavaScript,popper.js,11523,775,JavaScript,https://github.com/FezVrasta/popper.js,FezVrasta,83,2019-04-09T06:10:52Z,A kickass library to manage your poppers
1,Lua,kong,21041,2544,Lua,https://github.com/Kong/kong,Kong,334,2019-04-10T20:19:58Z,:gorilla: The Cloud-Native API Gateway 
2,Lua,neural-style,16714,2534,Lua,https://github.com/jcjohnson/neural-style,jcjohnson,313,2018-02-23T01:21:20Z,Torch implementation of neural style algorithm
3,Lua,waifu2x,14119,1604,Lua,https://github.com/nagadomi/waifu2x,nagadomi,79,2019-03-16T10:36:17Z,Image Super-Resolution for Anime-Style Art
4,Lua,openface,11894,2889,Lua,https://github.com/cmusatyalab/openface,cmusatyalab,8,2018-12-09T13:46:40Z,Face recognition with deep neural networks.
5,Lua,char-rnn,9241,2251,Lua,https://github.com/karpathy/char-rnn,karpathy,106,2018-05-04T15:25:25Z,"Multi-layer Recurrent Neural Networks (LSTM, GRU, RNN) for character-level language models in Torch"
6,Lua,CycleGAN,8235,1304,Lua,https://github.com/junyanz/CycleGAN,junyanz,31,2018-12-11T19:28:43Z,"Software that can generate photos from paintings,  turn horses into zebras,  perform style transfer, and more."
7,Lua,pix2pix,6008,975,Lua,https://github.com/phillipi/pix2pix,phillipi,47,2019-03-02T07:59:17Z,Image-to-image translation with conditional adversarial nets
8,Lua,dockercraft,5157,302,Lua,https://github.com/docker/dockercraft,docker,14,2018-06-18T12:15:21Z,Docker + Minecraft = Dockercraft
9,Lua,koreader,4806,621,Lua,https://github.com/koreader/koreader,koreader,358,2019-04-10T19:32:17Z,"An ebook reader application supporting PDF, DjVu, EPUB, FB2 and many more formats, running on Kindle, Kobo, PocketBook, Ubuntu Touch and Android devices"
10,Lua,VeryNginx,4670,722,Lua,https://github.com/alexazhou/VeryNginx,alexazhou,85,2019-02-01T11:43:45Z," A very powerful and friendly  nginx base on lua-nginx-module( openresty ) which provide WAF, Control Panel, and Dashboards. "
11,Lua,lsyncd,3445,339,Lua,https://github.com/axkibe/lsyncd,axkibe,83,2018-12-05T21:42:23Z,Lsyncd (Live Syncing Daemon) synchronizes local directories with remote targets
