rank,item,repo_name,stars,forks,language,repo_url,username,issues,last_commit,description
45,Python,funNLP,12300,3591,Python,https://github.com/fighting41love/funNLP,fighting41love,1,2019-08-31T02:45:03Z,"中英文敏感词、语言检测、中外手机/电话归属地/运营商查询、名字推断性别、手机号抽取、身份证抽取、邮箱抽取、中日文人名库、中文缩写库、拆字词典、词汇情感值、停用词、反动词表、暴恐词表、繁简体转换、英文模拟中文发音、汪峰歌词生成器、职业名称词库、同义词库、反义词库、否定词库、汽车品牌词库、汽车零件词库、连续英文切割、各种中文词向量、公司名字大全、古诗词库、IT词库、财经词库、成语词库、地名词库、历史名人词库、诗词词库、医学词库、饮食词库、法律词库、汽车词库、动物词库、中文聊天语料、中文谣言数据、百度中文问答数据集、句子相似度匹配算法集合、bert资源、文本生成&摘要相关工具、cocoNLP信息抽取工具、国内电话号码正则匹配、清华大学XLORE:中英文跨语言百科知识图谱、清华大学人工智能技术系列报告、自然语言生成、NLU太难了系列、自动对联数据及机器人、用户名黑名单列表、罪名法务名词及分类模型、微信公众号语料、cs224n深度学习自然语言处理课程、中文手写汉字识别、中文自然语言处理 语料/数据集、变量命名神器、分词语料库+代码、任务型对话英文数据集、ASR 语音数据集 + 基于深度学习的中文语音识别系统、笑声检测器、Microsoft多语言数字/单位/如日期时间识别包、中华新华字典数据库及api(包括常用歇后语、成语、词语和汉字)、文档图谱自动生成、SpaCy 中文模型、Common Voice语音识别数据集新版、神经网络关系抽取、基于bert的命名实体识别、关键词(Keyphrase)抽取包pke、基于医疗领域知识图谱的问答系统、基于依存句法与语义角色标注的事件三元组抽取、依存句法分析4万句高质量标注数据、cnocr：用来做中文OCR的Python3包、中文人物关系知识图谱项目、中文nlp竞赛项目及代码汇总、中文字符数据、speech-aligner: 从“人声语音”及其“语言文本”产生音素级别时间对齐标注的工具、AmpliGraph: 知识图谱表示学习(Python)库：知识图谱概念链接预测、Scattertext 文本可视化(python)、语言/知识表示工具：BERT & ERNIE、中文对比英文自然语言处理NLP的区别综述、Synonyms中文近义词工具包、HarvestText领域自适应文本挖掘工具（新词发现-情感分析-实体链接等）、word2word：(Python)方便易用的多语言词-词对集：62种语言/3,564个多语言对、语音识别语料生成工具：从具有音频/字幕的在线视频创建自动语音识别(ASR)语料库、构建医疗实体识别的模型（包含词典和语料标注）、单文档非监督的关键词抽取、Kashgari中使用gpt-2语言模型、开源的金融投资数据提取工具、文本自动摘要库TextTeaser: 仅支持英文、人民日报语料处理工具集、一些关于自然语言的基本模型、基于14W歌曲知识库的问答尝试--功能包括歌词接龙and已知歌词找歌曲以及歌曲歌手歌词三角关系的问答、基于Siamese bilstm模型的相似句子判定模型并提供训练数据集和测试数据集、用Transformer编解码模型实现的根据Hacker News文章标题自动生成评论、用BERT进行序列标记和文本分类的模板代码、LitBank：NLP数据集——支持自然语言处理和计算人文学科任务的100部带标记英文小说语料、百度开源的基准信息抽取系统、虚假新闻数据集、Facebook: LAMA语言模型分析，提供Transformer-XL/BERT/ELMo/GPT预训练语言模型的统一访问接口、CommonsenseQA：面向常识的英文QA挑战、中文知识图谱资料、数据及工具、各大公司内部里大牛分享的技术文档 PDF 或者 PPT、自然语言生成SQL语句（英文）、中文NLP数据增强（EDA）工具、英文NLP数据增强工具 、基于医药知识图谱的智能问答系统、京东商品知识图谱、基于mongodb存储的军事领域知识图谱问答项目、基于远监督的中文关系抽取、语音情感分析、中文ULMFiT-情感分析-文本分类-语料及模型、一个拍照做题程序、世界各国大规模人名库、一个利用有趣中文语料库 qingyun 训练出来的中文聊天机器人、中文聊天机器人seqGAN、省市区镇行政区划数据带拼音标注、教育行业新闻语料库包含自动文摘功能、开放了对话机器人-知识图谱-语义理解-自然语言处理工具及数据、中文知识图谱：基于百度百科中文页面-抽取三元组信息-构建中文知识图谱、masr: 中文语音识别-提供预训练模型-高识别率、Python音频数据增广库、中文全词覆盖BERT及两份阅读理解数据、ConvLab：开源多域端到端对话系统平台、中文自然语言处理数据集、基于最新版本rasa搭建的对话系统、基于TensorFlow和BERT的管道式实体及关系抽取、一个小型的证券知识图谱/知识库、复盘所有NLP比赛的TOP方案、OpenCLaP：多领域开源中文预训练语言模型仓库、中文自然语言处理向量合集、基于金融-司法领域(兼有闲聊性质)的聊天机器人、g2pC：基于上下文的汉语读音自动标记模块、Zincbase 知识图谱构建工具包、诗歌质量评价/细粒度情感诗歌语料库。"
46,Python,NLP-progress,11848,1989,Python,https://github.com/sebastianruder/NLP-progress,sebastianruder,25,2019-09-06T04:04:10Z,"Repository to track the progress in Natural Language Processing (NLP), including the datasets and the current state-of-the-art for the most common NLP tasks."
47,Python,fabric,11633,1751,Python,https://github.com/fabric/fabric,fabric,355,2019-08-13T04:29:17Z,"Simple, Pythonic remote execution and deployment."
48,Python,Awesome-Linux-Software,11510,1090,Python,https://github.com/luong-komorebi/Awesome-Linux-Software,luong-komorebi,8,2019-08-25T13:22:51Z,"A list of awesome applications, software, tools and other materials for Linux distros. "
49,Python,d2l-zh,11164,2899,Python,https://github.com/d2l-ai/d2l-zh,d2l-ai,2,2019-08-30T18:47:53Z,《动手学深度学习》：面向中文读者、能运行、可讨论。英文版即伯克利“深度学习导论”教材。
50,Python,material-theme,10970,787,Python,https://github.com/equinusocio/material-theme,equinusocio,3,2019-08-20T19:59:53Z,"Material Theme, the most epic theme for Sublime Text 3 by Mattia Astorino"
51,Python,locust,10835,1561,Python,https://github.com/locustio/locust,locustio,189,2019-09-06T01:46:33Z,Scalable user load testing tool written in Python
52,Python,powerline,10684,827,Python,https://github.com/powerline/powerline,powerline,178,2019-07-05T11:31:33Z,"Powerline is a statusline plugin for vim, and provides statuslines and prompts for several other applications, including zsh, bash, tmux, IPython, Awesome and Qtile."
53,Python,pix2code,10412,1077,Python,https://github.com/tonybeltramelli/pix2code,tonybeltramelli,0,2019-04-09T23:35:37Z,pix2code: Generating Code from a Graphical User Interface Screenshot
54,Python,zulip,10369,3187,Python,https://github.com/zulip/zulip,zulip,1341,2019-09-06T02:52:41Z,Zulip server - powerful open source team chat
55,Python,cookiecutter,10189,1119,Python,https://github.com/cookiecutter/cookiecutter,cookiecutter,196,2019-09-05T20:39:36Z,"A command-line utility that creates projects from cookiecutters (project templates). E.g. Python package projects, jQuery plugin projects."
56,Python,autojump,10077,502,Python,https://github.com/wting/autojump,wting,156,2019-09-03T22:00:16Z,A cd command that learns - easily navigate directories from the command line
57,Python,matplotlib,9987,4442,Python,https://github.com/matplotlib/matplotlib,matplotlib,1466,2019-09-06T10:24:58Z,matplotlib: plotting with Python
58,Python,neural-networks-and-deep-learning,9913,4797,Python,https://github.com/mnielsen/neural-networks-and-deep-learning,mnielsen,6,2019-05-09T10:58:46Z,"Code samples for my book ""Neural Networks and Deep Learning"""
59,Python,FastPhotoStyle,9822,980,Python,https://github.com/NVIDIA/FastPhotoStyle,NVIDIA,42,2019-05-14T09:40:36Z,"Style transfer, deep learning, feature transform"
60,Python,gensim,9799,3537,Python,https://github.com/RaRe-Technologies/gensim,RaRe-Technologies,262,2019-09-06T09:17:00Z,Topic Modelling for Humans
61,Python,kivy,9799,2188,Python,https://github.com/kivy/kivy,kivy,661,2019-09-05T03:33:07Z,"Open source UI framework written in Python, running on Windows, Linux, macOS, Android and iOS"
62,Python,dash,9790,992,Python,https://github.com/plotly/dash,plotly,195,2019-09-04T19:30:31Z,Analytical Web Apps for Python & R. No JavaScript Required.
63,Python,inter,9506,192,Python,https://github.com/rsms/inter,rsms,24,2019-09-04T13:53:28Z,The Inter font family
64,Python,pytorch-CycleGAN-and-pix2pix,9467,2620,Python,https://github.com/junyanz/pytorch-CycleGAN-and-pix2pix,junyanz,103,2019-08-30T18:53:19Z,Image-to-Image Translation in PyTorch
65,Python,game-programmer,9458,1151,Python,https://github.com/miloyip/game-programmer,miloyip,17,2019-04-30T01:30:36Z,A Study Path for Game Programmer
66,Python,tflearn,9229,2350,Python,https://github.com/tflearn/tflearn,tflearn,559,2019-04-12T10:05:38Z,Deep learning library featuring a higher-level API for TensorFlow.
67,Python,neural-doodle,9208,828,Python,https://github.com/alexjc/neural-doodle,alexjc,49,2019-04-11T05:05:51Z,"Turn your two-bit doodles into fine artworks with deep neural networks, generate seamless textures from photos, transfer style from one image to another, perform example-based upscaling, but wait... there's more! (An implementation of Semantic Style Transfer.)"
68,Python,pelican,9029,1589,Python,https://github.com/getpelican/pelican,getpelican,110,2019-09-04T09:05:15Z,Static site generator that supports Markdown and reST syntax. Powered by Python.
69,Python,mackup,8975,717,Python,https://github.com/lra/mackup,lra,299,2019-09-06T04:37:07Z,Keep your application settings in sync (OS X/Linux)
70,Python,12306,8957,2719,Python,https://github.com/testerSunshine/12306,testerSunshine,37,2019-09-06T03:25:14Z,12306智能刷票，订票
71,Python,stanford-tensorflow-tutorials,8892,4084,Python,https://github.com/chiphuyen/stanford-tensorflow-tutorials,chiphuyen,81,2019-03-02T17:44:57Z,This repository contains code examples for the Stanford's course: TensorFlow for Deep Learning Research. 
72,Python,beets,8851,1525,Python,https://github.com/beetbox/beets,beetbox,620,2019-09-05T13:31:32Z,music library manager and MusicBrainz tagger
73,Python,InstaPy,8695,2384,Python,https://github.com/timgrossmann/InstaPy,timgrossmann,267,2019-09-06T04:55:27Z,📷 Instagram Bot - Tool for automated Instagram interactions
74,Python,wtfpython-cn,8674,1638,Python,https://github.com/leisurelicht/wtfpython-cn,leisurelicht,6,2019-08-13T09:41:19Z,wtfpython的中文翻译/施工结束/ 能力有限，欢迎帮我改进翻译
75,Python,ray,8560,1188,Python,https://github.com/ray-project/ray,ray-project,796,2019-09-06T10:11:22Z,A fast and simple framework for building and running distributed applications.
76,Python,walle-web,8495,2175,Python,https://github.com/meolu/walle-web,meolu,262,2019-08-21T08:04:12Z,walle - 瓦力 Devops开源项目代码部署平台
77,Python,aws-cli,8478,1857,Python,https://github.com/aws/aws-cli,aws,554,2019-09-05T22:22:59Z,Universal Command Line Interface for Amazon Web Services
78,Python,DeepCreamPy,8410,879,Python,https://github.com/deeppomf/DeepCreamPy,deeppomf,11,2019-08-26T22:21:43Z,Decensoring Hentai with Deep Neural Networks
79,Python,baselines,8369,2705,Python,https://github.com/openai/baselines,openai,358,2019-08-29T21:25:45Z,OpenAI Baselines: high-quality implementations of reinforcement learning algorithms
80,Python,python-telegram-bot,8312,1704,Python,https://github.com/python-telegram-bot/python-telegram-bot,python-telegram-bot,54,2019-09-06T07:55:27Z,We have made you a wrapper you can't refuse
81,Python,CheatSheetSeries,8285,1152,Python,https://github.com/OWASP/CheatSheetSeries,OWASP,37,2019-09-06T02:34:29Z,The OWASP Cheat Sheet Series was created to provide a concise collection of high value information on specific application security topics.
82,Python,aiohttp,8284,1235,Python,https://github.com/aio-libs/aiohttp,aio-libs,269,2019-09-06T10:04:58Z,Asynchronous HTTP client/server framework for asyncio and Python
83,Python,fast-style-transfer,8265,2018,Python,https://github.com/lengstrom/fast-style-transfer,lengstrom,54,2019-08-14T17:23:20Z,TensorFlow CNN for fast style transfer ⚡🖥🎨🖼
84,Python,labelImg,8244,2823,Python,https://github.com/tzutalin/labelImg,tzutalin,139,2019-08-31T18:40:10Z,:metal: LabelImg is a graphical image annotation tool and label object bounding boxes in images
85,Python,click,8102,804,Python,https://github.com/pallets/click,pallets,218,2019-09-06T07:51:36Z,Python composable command line interface toolkit
86,Python,httpbin,7951,1179,Python,https://github.com/postmanlabs/httpbin,postmanlabs,86,2019-08-25T12:44:43Z,"HTTP Request & Response Service, written in Python + Flask."
87,Python,Mailpile,7909,940,Python,https://github.com/mailpile/Mailpile,mailpile,387,2019-09-06T05:04:12Z,"A free & open modern, fast email client with user-friendly encryption and privacy features"
88,Python,sonnet,7861,1129,Python,https://github.com/deepmind/sonnet,deepmind,21,2019-09-05T16:29:00Z,TensorFlow-based neural network library
89,Python,redis-py,7829,1716,Python,https://github.com/andymccurdy/redis-py,andymccurdy,198,2019-08-28T00:35:07Z,Redis Python Client
90,Python,wagtail,7809,1698,Python,https://github.com/wagtail/wagtail,wagtail,792,2019-09-06T10:22:58Z,A Django content management system focused on flexibility and user experience
91,Python,musicbox,7802,1413,Python,https://github.com/darknessomi/musicbox,darknessomi,177,2019-09-01T12:22:26Z,网易云音乐命令行版本
92,Python,stylegan,7667,1453,Python,https://github.com/NVlabs/stylegan,NVlabs,4,2019-07-24T00:30:04Z,StyleGAN - Official TensorFlow Implementation
93,Python,MLAlgorithms,7647,1323,Python,https://github.com/rushter/MLAlgorithms,rushter,7,2019-08-25T17:02:49Z,Minimal and clean examples of machine learning algorithms implementations
94,Python,ungoogled-chromium,7569,330,Python,https://github.com/Eloston/ungoogled-chromium,Eloston,72,2019-09-04T22:05:21Z,"Google Chromium, sans integration with Google"
95,Python,sovereign,7498,702,Python,https://github.com/sovereign/sovereign,sovereign,77,2019-08-29T06:04:36Z,"A set of Ansible playbooks to build and maintain your own private cloud: email, calendar, contacts, file sync, IRC bouncer, VPN, and more."
96,Python,bcc,7433,1281,Python,https://github.com/iovisor/bcc,iovisor,372,2019-09-03T16:05:02Z,"BCC - Tools for BPF-based Linux IO analysis, networking, monitoring, and more"
97,Python,howdoi,7433,693,Python,https://github.com/gleitz/howdoi,gleitz,4,2019-09-01T01:52:16Z,instant coding answers via the command line
98,Python,coursera-dl,7322,1772,Python,https://github.com/coursera-dl/coursera-dl,coursera-dl,129,2019-05-03T07:59:44Z,Script for downloading Coursera.org videos and naming them.
99,Python,routersploit,7260,1381,Python,https://github.com/threat9/routersploit,threat9,59,2019-09-05T06:32:08Z,Exploitation Framework for Embedded Devices
100,Python,awesome-aws,7255,795,Python,https://github.com/donnemartin/awesome-aws,donnemartin,36,2019-08-31T14:23:17Z,"A curated list of awesome Amazon Web Services (AWS) libraries, open source repos, guides, blogs, and other resources.  Featuring the Fiery Meter of AWSome."
1,R,ggplot2,3979,1489,R,https://github.com/tidyverse/ggplot2,tidyverse,144,2019-09-03T12:46:28Z,An implementation of the Grammar of Graphics in R
2,R,awesome-R,3649,1223,R,https://github.com/qinwf/awesome-R,qinwf,12,2019-09-05T13:05:34Z,"A curated list of awesome R packages, frameworks and software."
3,R,ML_for_Hackers,3528,2237,R,https://github.com/johnmyleswhite/ML_for_Hackers,johnmyleswhite,34,2019-05-26T16:52:29Z,"Code accompanying the book ""Machine Learning for Hackers"""
4,R,shiny,3526,1528,R,https://github.com/rstudio/shiny,rstudio,429,2019-09-05T23:45:02Z,Easy interactive web applications with R
5,R,dplyr,3036,1113,R,https://github.com/tidyverse/dplyr,tidyverse,146,2019-09-04T06:14:43Z,dplyr: A grammar of data manipulation
6,R,AnomalyDetection,3016,682,R,https://github.com/twitter/AnomalyDetection,twitter,68,2019-08-30T19:49:16Z,Anomaly Detection with R
7,R,swirl_courses,3009,6259,R,https://github.com/swirldev/swirl_courses,swirldev,131,2019-08-09T05:21:10Z,:mortar_board: A collection of interactive courses for the swirl R package.
8,R,r4ds,2051,2560,R,https://github.com/hadley/r4ds,hadley,114,2019-08-22T09:29:27Z,R for data science: a book
9,R,devtools,1838,661,R,https://github.com/r-lib/devtools,r-lib,18,2019-09-05T15:38:40Z,Tools to make an R developer's life easier
10,R,knitr,1824,764,R,https://github.com/yihui/knitr,yihui,76,2019-09-06T09:57:45Z,A general-purpose tool for dynamic report generation in R
11,R,investing,1691,108,R,https://github.com/zonination/investing,zonination,0,2016-12-27T13:58:02Z,Investing Returns on the Market as a Whole
12,R,benchm-ml,1686,316,R,https://github.com/szilard/benchm-ml,szilard,10,2019-08-19T04:22:47Z,"A minimal benchmark for scalability, speed and accuracy of commonly used open source implementations (R packages, Python scikit-learn, H2O, xgboost, Spark MLlib etc.) of the top machine learning algorithms for binary classification (random forests, gradient boosted trees, deep neural networks etc.)."
13,R,rmarkdown,1596,676,R,https://github.com/rstudio/rmarkdown,rstudio,118,2019-09-03T03:06:49Z,Dynamic Documents for R
14,R,bookdown,1586,711,R,https://github.com/rstudio/bookdown,rstudio,90,2019-09-05T22:36:08Z,Authoring Books and Technical Documents with R Markdown
15,R,stats337,1562,235,R,https://github.com/hadley/stats337,hadley,7,2018-06-21T15:57:29Z,Readings in applied data science
16,R,nyc-taxi-data,1561,469,R,https://github.com/toddwschneider/nyc-taxi-data,toddwschneider,0,2019-08-21T10:48:40Z,"Import public NYC taxi and for-hire vehicle (Uber, Lyft, etc.) trip data into PostgreSQL database"
17,R,awesome-network-analysis,1546,335,R,https://github.com/briatte/awesome-network-analysis,briatte,18,2019-08-26T11:37:17Z,A curated list of awesome network analysis resources.
18,R,plotly,1538,526,R,https://github.com/ropensci/plotly,ropensci,288,2019-09-03T21:28:39Z,An interactive graphing library for R
19,R,DataScienceR,1360,751,R,https://github.com/ujjwalkarn/DataScienceR,ujjwalkarn,3,2018-04-18T00:01:52Z,"a curated list of R tutorials for Data Science, NLP and Machine Learning "
20,R,mlr,1310,360,R,https://github.com/mlr-org/mlr,mlr-org,373,2019-08-16T21:49:15Z,mlr: Machine Learning in R 
21,R,gganimate,1305,244,R,https://github.com/thomasp85/gganimate,thomasp85,86,2019-08-30T10:21:56Z,A Grammar of Animated Graphics
22,R,DiagrammeR,1213,186,R,https://github.com/rich-iannone/DiagrammeR,rich-iannone,106,2019-08-22T04:39:32Z,Graph and network visualization using tabular data in R
23,R,tensorflow,1145,314,R,https://github.com/rstudio/tensorflow,rstudio,3,2019-09-04T16:29:52Z,TensorFlow for R
24,R,patchwork,1110,86,R,https://github.com/thomasp85/patchwork,thomasp85,34,2019-09-05T12:43:55Z,The Composer of ggplots
25,R,caret,1106,524,R,https://github.com/topepo/caret,topepo,155,2019-08-10T21:41:27Z,caret (Classification And Regression Training) R package that contains misc functions for training and plotting classification and regression models
26,R,rvest,1097,275,R,https://github.com/tidyverse/rvest,tidyverse,32,2019-07-18T19:16:10Z,Simple web scraping for R
27,R,tidytuesday,1062,490,R,https://github.com/rfordatascience/tidytuesday,rfordatascience,51,2019-09-03T14:32:30Z,Official repo for the #tidytuesday project
28,R,labs,1041,1448,R,https://github.com/genomicsclass/labs,genomicsclass,14,2019-09-04T00:25:29Z,Rmd source files for the HarvardX series PH525x
29,R,wesanderson,1022,85,R,https://github.com/karthik/wesanderson,karthik,10,2019-02-01T23:29:59Z,A Wes Anderson color palette for R
30,R,blogdown,1003,227,R,https://github.com/rstudio/blogdown,rstudio,12,2019-08-24T16:45:21Z,Create Blogs and Websites with R Markdown
31,R,ggthemes,998,197,R,https://github.com/jrnold/ggthemes,jrnold,2,2019-05-13T14:40:04Z,"Additional themes, scales, and geoms for ggplot2"
32,R,CausalImpact,997,169,R,https://github.com/google/CausalImpact,google,19,2019-04-17T12:47:39Z,An R package for causal inference in time series
33,R,reticulate,949,174,R,https://github.com/rstudio/reticulate,rstudio,222,2019-09-02T21:52:55Z,R Interface to Python
34,R,drake,923,97,R,https://github.com/ropensci/drake,ropensci,7,2019-09-03T04:14:24Z,An R-focused pipeline toolkit for reproducibility and high-performance computing
35,R,plumber,916,172,R,https://github.com/rstudio/plumber,rstudio,130,2019-08-29T22:38:01Z,Turn your R code into a web API.
36,R,broom,881,241,R,https://github.com/tidymodels/broom,tidymodels,140,2019-09-04T04:00:13Z,Convert statistical analysis objects from R into tidy format
37,R,gt,867,62,R,https://github.com/rstudio/gt,rstudio,135,2019-09-06T04:47:02Z,"Easily generate information-rich, publication-quality tables from R"
38,R,bbplot,862,138,R,https://github.com/bbc/bbplot,bbc,11,2019-03-19T02:15:52Z,R package that helps create and export ggplot2 charts in the style used by the BBC News data team
39,R,tofsims,848,5,R,https://github.com/fossasia/tofsims,fossasia,0,2017-11-29T19:16:12Z,
40,R,rethinking,844,264,R,https://github.com/rmcelreath/rethinking,rmcelreath,94,2019-09-06T06:41:41Z,Statistical Rethinking course and book package
41,R,rayshader,834,79,R,https://github.com/tylermorganwall/rayshader,tylermorganwall,21,2019-08-30T16:00:52Z,"R Package for Producing and Visualizing Hillshaded Maps from Elevation Matrices, in 2D and 3D"
42,R,swirl,827,550,R,https://github.com/swirldev/swirl,swirldev,189,2019-07-19T18:09:49Z,":cyclone: Learn R, in R."
43,R,slidify,813,352,R,https://github.com/ramnathv/slidify,ramnathv,180,2016-08-02T03:54:45Z,Generate reproducible html5 slides from R markdown
44,R,httr,800,1851,R,https://github.com/r-lib/httr,r-lib,25,2019-09-02T12:08:02Z,httr: a friendly http package for R
45,R,tidytext,798,162,R,https://github.com/juliasilge/tidytext,juliasilge,8,2019-09-06T06:15:41Z,"Text mining using dplyr, ggplot2, and other tidy tools :sparkles::page_facing_up::sparkles::page_facing_up::sparkles:"
46,R,purrr,795,190,R,https://github.com/tidyverse/purrr,tidyverse,87,2019-08-14T08:54:20Z,A functional programming toolkit for R
47,R,tidyr,782,317,R,https://github.com/tidyverse/tidyr,tidyverse,23,2019-09-04T18:59:32Z,Easily tidy data with spread and gather functions.
48,R,advanced-shiny,768,280,R,https://github.com/daattali/advanced-shiny,daattali,1,2019-05-20T07:34:57Z,Shiny tips & tricks for improving your apps and solving common problems
49,R,rnaseq_tutorial,767,417,R,https://github.com/griffithlab/rnaseq_tutorial,griffithlab,11,2019-08-06T13:22:55Z,"Informatics for RNA-seq: A web resource for analysis on the cloud. Educational tutorials and working pipelines for RNA-seq analysis including an introduction to: cloud computing, critical file formats, reference genomes, gene annotation, expression, differential expression, alternative splicing, data visualization, and interpretation."
50,R,esquisse,752,84,R,https://github.com/dreamRs/esquisse,dreamRs,21,2019-08-22T15:26:42Z,RStudio add-in to make plots with ggplot2
51,R,tidyverse,750,156,R,https://github.com/tidyverse/tidyverse,tidyverse,7,2019-08-29T14:41:16Z,Easily install and load packages from the tidyverse
52,R,forecast,745,266,R,https://github.com/robjhyndman/forecast,robjhyndman,8,2019-08-28T05:10:25Z,forecast package for R
53,R,googlesheets,718,178,R,https://github.com/jennybc/googlesheets,jennybc,90,2019-05-28T23:50:21Z,Google Spreadsheets R API
54,R,readr,710,218,R,https://github.com/tidyverse/readr,tidyverse,90,2019-08-27T17:42:10Z,"Read flat files (csv, tsv, fwf) into R"
55,R,magrittr,700,131,R,https://github.com/tidyverse/magrittr,tidyverse,27,2019-01-05T16:37:00Z,Improve the readability of R code with the pipe
56,R,janitor,689,71,R,https://github.com/sfirke/janitor,sfirke,55,2019-08-11T11:15:55Z,simple tools for data cleaning in R
57,R,sparklyr,688,250,R,https://github.com/rstudio/sparklyr,rstudio,446,2019-08-30T22:28:57Z,R interface for Apache Spark
58,R,MLPB,684,261,R,https://github.com/ben519/MLPB,ben519,0,2019-06-04T17:32:17Z,Machine Learning Problem Bible | Problem Set Here >>
59,R,ggraph,664,80,R,https://github.com/thomasp85/ggraph,thomasp85,29,2019-09-02T07:11:22Z,Grammar of Graph Graphics
60,R,BanditsBook,663,229,R,https://github.com/johnmyleswhite/BanditsBook,johnmyleswhite,6,2018-04-05T06:34:29Z,Code for my book on Multi-Armed Bandit Algorithms
61,R,skimr,658,55,R,https://github.com/ropensci/skimr,ropensci,21,2019-08-26T08:33:58Z,"A frictionless, pipeable approach to dealing with summary statistics"
62,R,ggvis,655,182,R,https://github.com/rstudio/ggvis,rstudio,191,2019-07-08T13:01:06Z,Interactive grammar of graphics for R
63,R,SparkR-pkg,652,344,R,https://github.com/amplab-extras/SparkR-pkg,amplab-extras,21,2016-06-10T21:42:55Z,R frontend for Spark
64,R,ggrepel,646,72,R,https://github.com/slowkow/ggrepel,slowkow,20,2019-04-30T00:50:57Z,:round_pushpin: Repel overlapping text labels away from each other.
65,R,htmlwidgets,632,181,R,https://github.com/ramnathv/htmlwidgets,ramnathv,108,2019-08-13T00:00:53Z,HTML Widgets for R
