rank,item,repo_name,stars,forks,language,repo_url,username,issues,last_commit,description
1,top-100-stars,bootstrap,129490,63632,CSS,https://github.com/twbs/bootstrap,twbs,333,2018-12-20T17:00:07Z,"The most popular HTML, CSS, and JavaScript framework for developing responsive, mobile first projects on the web."
2,top-100-stars,vue,122745,17545,JavaScript,https://github.com/vuejs/vue,vuejs,219,2018-12-20T22:07:35Z,"🖖 A progressive, incrementally-adoptable JavaScript framework for building UI on the web."
3,top-100-stars,react,118055,21409,JavaScript,https://github.com/facebook/react,facebook,514,2018-12-20T20:04:26Z,"A declarative, efficient, and flexible JavaScript library for building user interfaces."
4,top-100-stars,tensorflow,117078,70741,C++,https://github.com/tensorflow/tensorflow,tensorflow,1821,2018-12-21T03:35:42Z,An Open Source Machine Learning Framework for Everyone
5,top-100-stars,free-programming-books,115182,29046,,https://github.com/EbookFoundation/free-programming-books,EbookFoundation,32,2018-12-19T18:17:43Z,:books: Freely available programming books
6,top-100-stars,awesome,98243,13080,,https://github.com/sindresorhus/awesome,sindresorhus,184,2018-12-20T02:13:39Z,:sunglasses: Curated list of awesome lists
7,top-100-stars,d3,81145,20186,JavaScript,https://github.com/d3/d3,d3,9,2018-12-19T13:16:30Z,"Bring data to life with SVG, Canvas and HTML. :bar_chart::chart_with_upwards_trend::tada:"
8,top-100-stars,oh-my-zsh,80914,15851,Shell,https://github.com/robbyrussell/oh-my-zsh,robbyrussell,981,2018-12-20T04:45:27Z,"A delightful community-driven (with 1,200+ contributors) framework for managing your zsh configuration. Includes 200+ optional plugins (rails, git, OSX, hub, capistrano, brew, ant, php, python, etc), over 140 themes to spice up your morning, and an auto-update tool so that makes it easy to keep up with the latest updates from the community."
9,top-100-stars,javascript,79726,15237,JavaScript,https://github.com/airbnb/javascript,airbnb,134,2018-12-20T18:58:29Z,JavaScript Style Guide
10,top-100-stars,gitignore,76656,36513,,https://github.com/github/gitignore,github,51,2018-12-19T18:25:57Z,A collection of useful .gitignore templates
11,top-100-stars,coding-interview-university,72413,21074,,https://github.com/jwasham/coding-interview-university,jwasham,57,2018-12-17T06:09:19Z,A complete computer science study plan to become a software engineer.
12,top-100-stars,react-native,72091,16120,JavaScript,https://github.com/facebook/react-native,facebook,887,2018-12-21T00:05:56Z,A framework for building native apps with React.
13,top-100-stars,electron,67862,8841,C++,https://github.com/electron/electron,electron,1237,2018-12-21T01:43:31Z,":electron: Build cross-platform desktop apps with JavaScript, HTML, and CSS"
14,top-100-stars,linux,67123,24318,C,https://github.com/torvalds/linux,torvalds,245,2018-12-20T22:53:58Z,Linux kernel source tree
15,top-100-stars,developer-roadmap,63318,10014,,https://github.com/kamranahmedse/developer-roadmap,kamranahmedse,147,2018-12-11T08:43:51Z,Roadmap to becoming a web developer in 2018
16,top-100-stars,create-react-app,60913,13282,JavaScript,https://github.com/facebook/create-react-app,facebook,331,2018-12-20T18:11:24Z,Set up a modern web app by running one command.
17,top-100-stars,angular.js,59309,28998,JavaScript,https://github.com/angular/angular.js,angular,487,2018-12-17T16:59:02Z,AngularJS - HTML enhanced for web apps!
18,top-100-stars,awesome-python,58882,11465,Python,https://github.com/vinta/awesome-python,vinta,440,2018-12-20T12:52:04Z,"A curated list of awesome Python frameworks, libraries, software and resources"
19,top-100-stars,Font-Awesome,58232,9911,JavaScript,https://github.com/FortAwesome/Font-Awesome,FortAwesome,4701,2018-12-20T22:41:20Z,"The iconic SVG, font, and CSS toolkit"
20,top-100-stars,node,56590,12507,JavaScript,https://github.com/nodejs/node,nodejs,736,2018-12-21T03:51:50Z,Node.js JavaScript runtime :sparkles::turtle::rocket::sparkles:
21,top-100-stars,animate.css,56271,12010,CSS,https://github.com/daneden/animate.css,daneden,15,2018-11-29T23:37:06Z,🍿 A cross-browser library of CSS animations. As easy to use as an easy thing.
22,top-100-stars,system-design-primer,53684,7597,Python,https://github.com/donnemartin/system-design-primer,donnemartin,66,2018-12-19T02:17:02Z,Learn how to design large-scale systems. Prep for the system design interview.  Includes Anki flashcards.
23,top-100-stars,moby,51575,15000,Go,https://github.com/moby/moby,moby,3518,2018-12-21T02:52:12Z,Moby Project - a collaborative project for the container ecosystem to assemble container-based systems
24,top-100-stars,go,50932,7022,Go,https://github.com/golang/go,golang,4047,2018-12-20T22:12:37Z,The Go programming language
25,top-100-stars,jquery,50603,17500,JavaScript,https://github.com/jquery/jquery,jquery,90,2018-12-20T10:07:06Z,jQuery JavaScript Library
26,top-100-stars,laravel,47985,14882,PHP,https://github.com/laravel/laravel,laravel,27,2018-12-20T13:55:13Z,A PHP framework for web artisans
27,top-100-stars,atom,47366,10583,JavaScript,https://github.com/atom/atom,atom,722,2018-12-21T01:52:34Z,:atom: The hackable text editor
28,top-100-stars,three.js,47313,17893,JavaScript,https://github.com/mrdoob/three.js,mrdoob,764,2018-12-21T03:01:18Z,JavaScript 3D library.
29,top-100-stars,flutter,47085,4813,Dart,https://github.com/flutter/flutter,flutter,4233,2018-12-21T02:46:40Z,Flutter makes it easy and fast to build beautiful mobile apps.
30,top-100-stars,models,46148,28130,Python,https://github.com/tensorflow/models,tensorflow,1324,2018-12-21T00:28:37Z,Models and examples built with TensorFlow
31,top-100-stars,swift,46117,7326,C++,https://github.com/apple/swift,apple,430,2018-12-21T03:56:40Z,The Swift Programming Language
32,top-100-stars,redux,45815,11646,JavaScript,https://github.com/reduxjs/redux,reduxjs,28,2018-12-20T17:14:58Z,Predictable state container for JavaScript apps
33,top-100-stars,kubernetes,45663,15942,Go,https://github.com/kubernetes/kubernetes,kubernetes,3220,2018-12-21T03:55:46Z,Production-Grade Container Scheduling and Management
34,top-100-stars,public-apis,45474,4717,Python,https://github.com/toddmotto/public-apis,toddmotto,5,2018-12-20T22:20:52Z,A collective list of free APIs for use in software and web development.
35,top-100-stars,youtube-dl,45045,7836,Python,https://github.com/rg3/youtube-dl,rg3,2576,2018-12-20T22:25:06Z,Command-line program to download videos from YouTube.com and other video sites
36,top-100-stars,socket.io,44656,8280,JavaScript,https://github.com/socketio/socket.io,socketio,347,2018-12-01T05:38:05Z,Realtime application framework (Node.JS server)
37,top-100-stars,CS-Notes,44614,13665,,https://github.com/CyC2018/CS-Notes,CyC2018,0,2018-12-21T03:52:16Z,:books: Computer Science Learning Notes
38,top-100-stars,Semantic-UI,43895,4694,JavaScript,https://github.com/Semantic-Org/Semantic-UI,Semantic-Org,811,2018-12-13T01:05:14Z,Semantic is a UI component framework based around useful principles from natural language.
39,top-100-stars,reveal.js,43827,12735,JavaScript,https://github.com/hakimel/reveal.js,hakimel,398,2018-12-19T10:04:34Z,The HTML Presentation Framework
40,top-100-stars,angular,43696,11241,TypeScript,https://github.com/angular/angular,angular,2618,2018-12-21T03:58:18Z,One framework. Mobile & desktop.
41,top-100-stars,free-programming-books-zh_CN,43258,14617,JavaScript,https://github.com/justjavac/free-programming-books-zh_CN,justjavac,149,2018-12-04T09:39:53Z,:books: 免费的计算机编程类中文书籍，欢迎投稿
42,top-100-stars,puppeteer,42975,3686,JavaScript,https://github.com/GoogleChrome/puppeteer,GoogleChrome,296,2018-12-20T00:13:07Z,Headless Chrome Node API
43,top-100-stars,material-ui,42882,8532,JavaScript,https://github.com/mui-org/material-ui,mui-org,291,2018-12-20T23:41:45Z,React components that implement Google's Material Design.
44,top-100-stars,java-design-patterns,42724,13841,Java,https://github.com/iluwatar/java-design-patterns,iluwatar,184,2018-12-17T07:08:48Z,Design patterns implemented in Java
45,top-100-stars,TypeScript,42681,6090,TypeScript,https://github.com/Microsoft/TypeScript,Microsoft,3306,2018-12-21T00:57:57Z,TypeScript is a superset of JavaScript that compiles to clean JavaScript output.
46,top-100-stars,html5-boilerplate,41843,9941,JavaScript,https://github.com/h5bp/html5-boilerplate,h5bp,7,2018-12-18T13:55:24Z,"A professional front-end template for building fast, robust, and adaptable web apps or sites."
47,top-100-stars,rails,41662,16877,Ruby,https://github.com/rails/rails,rails,1051,2018-12-21T03:25:43Z,Ruby on Rails
48,top-100-stars,express,41578,7184,JavaScript,https://github.com/expressjs/express,expressjs,160,2018-12-18T04:34:57Z,"Fast, unopinionated, minimalist web framework for node."
49,top-100-stars,Chart.js,40940,9242,JavaScript,https://github.com/chartjs/Chart.js,chartjs,465,2018-12-21T03:34:59Z,Simple HTML5 Charts using the <canvas> tag
50,top-100-stars,javascript-algorithms,40794,5371,JavaScript,https://github.com/trekhleb/javascript-algorithms,trekhleb,51,2018-12-17T15:51:04Z,📝 Algorithms and data structures implemented in JavaScript with explanations and links to further readings
51,top-100-stars,flask,40778,11745,Python,https://github.com/pallets/flask,pallets,69,2018-12-20T07:34:48Z,The Python micro framework for building web applications.
52,top-100-stars,build-your-own-x,40697,2640,,https://github.com/danistefanovic/build-your-own-x,danistefanovic,5,2018-11-25T10:33:53Z,🤓 Build your own (insert technology here)
53,top-100-stars,awesome-vue,40657,5620,,https://github.com/vuejs/awesome-vue,vuejs,69,2018-12-21T03:17:26Z,🎉 A curated list of awesome things related to Vue.js
54,top-100-stars,meteor,40626,5031,JavaScript,https://github.com/meteor/meteor,meteor,261,2018-12-19T19:54:48Z,"Meteor, the JavaScript App Platform"
55,top-100-stars,moment,39588,5952,JavaScript,https://github.com/moment/moment,moment,353,2018-12-18T01:06:26Z,"Parse, validate, manipulate, and display dates in javascript."
56,top-100-stars,thefuck,39450,1957,Python,https://github.com/nvbn/thefuck,nvbn,159,2018-12-13T14:47:45Z,Magnificent app which corrects your previous console command.
57,top-100-stars,lantern,39263,8809,Go,https://github.com/getlantern/lantern,getlantern,2536,2018-12-05T00:30:19Z,🔴蓝灯最新版本下载 https://github.com/getlantern/download 🔴 Lantern Latest Download https://github.com/getlantern/download 🔴
58,top-100-stars,resume.github.com,38829,1022,JavaScript,https://github.com/resume/resume.github.com,resume,36,2018-11-17T01:11:45Z,Resumes generated using the GitHub informations
59,top-100-stars,Front-end-Developer-Interview-Questions,38458,7885,HTML,https://github.com/h5bp/Front-end-Developer-Interview-Questions,h5bp,42,2018-12-11T04:40:34Z,"A list of helpful front-end related questions you can use to interview potential candidates, test yourself or completely ignore."
60,top-100-stars,django,38365,16584,Python,https://github.com/django/django,django,188,2018-12-21T03:31:56Z,The Web framework for perfectionists with deadlines.
61,top-100-stars,awesome-go,38244,4974,Go,https://github.com/avelino/awesome-go,avelino,23,2018-12-19T22:51:33Z,"A curated list of awesome Go frameworks, libraries and software"
62,top-100-stars,the-art-of-command-line,37766,3758,,https://github.com/jlevy/the-art-of-command-line,jlevy,105,2018-10-19T16:35:02Z,"Master the command line, in one page"
63,top-100-stars,ant-design,37089,12818,TypeScript,https://github.com/ant-design/ant-design,ant-design,302,2018-12-21T03:50:48Z,🐜 A UI Design Language
64,top-100-stars,awesome-machine-learning,37061,9152,Python,https://github.com/josephmisiti/awesome-machine-learning,josephmisiti,2,2018-12-18T07:28:04Z,"A curated list of awesome Machine Learning frameworks, libraries and software."
65,top-100-stars,elasticsearch,36982,12455,Java,https://github.com/elastic/elasticsearch,elastic,1856,2018-12-21T03:30:25Z,"Open Source, Distributed, RESTful Search Engine"
66,top-100-stars,RxJava,36867,6294,Java,https://github.com/ReactiveX/RxJava,ReactiveX,27,2018-12-19T17:47:18Z,RxJava – Reactive Extensions for the JVM – a library for composing asynchronous and event-based programs using observable sequences for the Java VM.
67,top-100-stars,json-server,36823,3172,JavaScript,https://github.com/typicode/json-server,typicode,386,2018-11-14T11:06:39Z,Get a full fake REST API with zero coding in less than 30 seconds (seriously)
68,top-100-stars,material-design-icons,36743,7425,CSS,https://github.com/google/material-design-icons,google,524,2018-12-06T00:59:39Z,Material Design icons by Google
69,top-100-stars,keras,36623,13980,Python,https://github.com/keras-team/keras,keras-team,2031,2018-12-20T22:25:47Z,Deep Learning for humans
70,top-100-stars,bitcoin,36445,21738,C++,https://github.com/bitcoin/bitcoin,bitcoin,879,2018-12-21T01:04:41Z,Bitcoin Core integration/staging tree
71,top-100-stars,computer-science,36439,5192,,https://github.com/ossu/computer-science,ossu,33,2018-12-10T02:20:05Z,:mortar_board: Path to a free self-taught education in Computer Science!
72,top-100-stars,lodash,36380,3771,JavaScript,https://github.com/lodash/lodash,lodash,4,2018-12-16T10:57:55Z,"A modern JavaScript utility library delivering modularity, performance, & extras."
73,top-100-stars,jekyll,36325,7968,Ruby,https://github.com/jekyll/jekyll,jekyll,140,2018-12-18T17:49:15Z,:globe_with_meridians: Jekyll is a blog-aware static site generator in Ruby
74,top-100-stars,requests,36299,6649,Python,https://github.com/requests/requests,requests,139,2018-12-13T21:34:12Z,Python HTTP Requests for Humans™ ✨🍰✨
75,top-100-stars,ionic,36203,12608,HTML,https://github.com/ionic-team/ionic,ionic-team,377,2018-12-20T23:45:40Z,Build amazing native and progressive web apps with open web technologies. One app running on everything 🎉
76,top-100-stars,every-programmer-should-know,35806,3222,,https://github.com/mtdvio/every-programmer-should-know,mtdvio,25,2018-12-05T21:19:43Z,A collection of (mostly) technical things every software developer should know
77,top-100-stars,30-seconds-of-code,34813,3650,JavaScript,https://github.com/30-seconds/30-seconds-of-code,30-seconds,8,2018-12-17T14:36:06Z,Curated collection of useful JavaScript snippets that you can understand in 30 seconds or less.
78,top-100-stars,nw.js,34766,3794,C++,https://github.com/nwjs/nw.js,nwjs,708,2018-12-21T03:25:03Z,Call all Node.js modules directly from DOM/WebWorker and enable a new way of writing applications with all Web technologies.
79,top-100-stars,materialize,34676,4683,JavaScript,https://github.com/Dogfalo/materialize,Dogfalo,586,2018-12-12T22:55:46Z,"Materialize, a CSS Framework based on Material Design"
80,top-100-stars,ansible,34385,13814,Python,https://github.com/ansible/ansible,ansible,5542,2018-12-21T03:57:27Z,"Ansible is a radically simple IT automation platform that makes your applications and systems easier to deploy. Avoid writing scripts or custom code to deploy and update your applications — automate in a language that approaches plain English, using SSH, with no agents to install on remote systems. https://docs.ansible.com/ansible/"
81,top-100-stars,impress.js,34298,6794,JavaScript,https://github.com/impress/impress.js,impress,46,2018-12-17T19:35:26Z,It's a presentation framework based on the power of CSS3 transforms and transitions in modern browsers and inspired by the idea behind prezi.com.
82,top-100-stars,markdown-here,34173,5767,JavaScript,https://github.com/adam-p/markdown-here,adam-p,223,2018-11-13T20:35:39Z,"Google Chrome, Firefox, and Thunderbird extension that lets you write email in Markdown and render it before sending."
83,top-100-stars,yarn,34132,2012,JavaScript,https://github.com/yarnpkg/yarn,yarnpkg,1599,2018-12-20T19:59:33Z,"📦🐈 Fast, reliable, and secure dependency management."
84,top-100-stars,react-router,34047,7088,JavaScript,https://github.com/ReactTraining/react-router,ReactTraining,63,2018-12-20T09:58:46Z,Declarative routing for React
85,top-100-stars,netdata,33890,2926,C,https://github.com/netdata/netdata,netdata,492,2018-12-20T21:43:11Z,"Real-time performance monitoring, done right! https://my-netdata.io/"
86,top-100-stars,element,33568,6646,Vue,https://github.com/ElemeFE/element,ElemeFE,614,2018-12-20T03:41:07Z,A Vue.js 2.0 UI Toolkit for Web
87,top-100-stars,x64dbg,33479,879,C++,https://github.com/x64dbg/x64dbg,x64dbg,343,2018-12-11T05:13:55Z,An open-source x64/x32 debugger for windows.
88,top-100-stars,normalize.css,33386,6782,CSS,https://github.com/necolas/normalize.css,necolas,14,2018-11-14T19:26:34Z,A modern alternative to CSS resets
89,top-100-stars,redis,33350,12808,C,https://github.com/antirez/redis,antirez,2021,2018-12-20T16:58:01Z,"Redis is an in-memory database that persists on disk. The data model is key-value, but many different kind of values are supported: Strings, Lists, Sets, Sorted Sets, Hashes, HyperLogLogs, Bitmaps."
90,top-100-stars,awesome-android-ui,32953,8680,,https://github.com/wasabeef/awesome-android-ui,wasabeef,19,2018-10-31T03:01:30Z,A curated list of awesome Android UI/UX libraries
91,top-100-stars,next.js,32710,3532,JavaScript,https://github.com/zeit/next.js,zeit,298,2018-12-21T02:50:18Z,The React Framework
92,top-100-stars,Front-End-Checklist,32651,3056,JavaScript,https://github.com/thedaviddias/Front-End-Checklist,thedaviddias,11,2018-12-21T02:07:57Z,🗂 The perfect Front-End Checklist for modern websites and meticulous developers
93,top-100-stars,papers-we-love,32628,3078,,https://github.com/papers-we-love/papers-we-love,papers-we-love,12,2018-11-24T14:07:05Z,Papers from the computer science community to read and discuss.
94,top-100-stars,rust,32626,5396,Rust,https://github.com/rust-lang/rust,rust-lang,4747,2018-12-21T03:34:26Z,Empowering everyone to build reliable and efficient software.
95,top-100-stars,scikit-learn,32410,15961,Python,https://github.com/scikit-learn/scikit-learn,scikit-learn,1855,2018-12-21T00:43:34Z,scikit-learn: machine learning in Python
96,top-100-stars,spring-boot,32308,22058,Java,https://github.com/spring-projects/spring-boot,spring-projects,394,2018-12-20T17:09:53Z,Spring Boot
97,top-100-stars,storybook,32191,2385,JavaScript,https://github.com/storybooks/storybook,storybooks,212,2018-12-21T00:34:53Z,"Interactive UI component dev & test: React, React Native, Vue, Angular, Ember"
98,top-100-stars,bulma,31875,2510,CSS,https://github.com/jgthms/bulma,jgthms,472,2018-12-20T11:20:41Z,Modern CSS framework based on Flexbox
99,top-100-stars,AFNetworking,31827,9710,Objective-C,https://github.com/AFNetworking/AFNetworking,AFNetworking,341,2018-12-17T18:38:46Z,"A delightful networking framework for iOS, macOS, watchOS, and tvOS."
100,top-100-stars,incubator-echarts,31715,9228,JavaScript,https://github.com/apache/incubator-echarts,apache,3108,2018-12-20T12:16:17Z,"A powerful, interactive charting and visualization library for browser"
1,top-100-forks,datasharing,4581,191523,,https://github.com/jtleek/datasharing,jtleek,444,2018-11-28T18:50:38Z,The Leek group guide to data sharing 
2,top-100-forks,ProgrammingAssignment2,567,114448,R,https://github.com/rdpeng/ProgrammingAssignment2,rdpeng,2649,2018-12-18T08:05:37Z,Repository for Programming Assignment 2 for R Programming on Coursera
3,top-100-forks,Spoon-Knife,10079,101825,HTML,https://github.com/octocat/Spoon-Knife,octocat,12997,2018-12-20T16:51:38Z,This repo is for demonstration purposes only.
4,top-100-forks,tensorflow,117078,70741,C++,https://github.com/tensorflow/tensorflow,tensorflow,1821,2018-12-21T03:35:42Z,An Open Source Machine Learning Framework for Everyone
5,top-100-forks,bootstrap,129490,63632,CSS,https://github.com/twbs/bootstrap,twbs,333,2018-12-20T17:00:07Z,"The most popular HTML, CSS, and JavaScript framework for developing responsive, mobile first projects on the web."
6,top-100-forks,SmartThingsPublic,1112,48831,Groovy,https://github.com/SmartThingsCommunity/SmartThingsPublic,SmartThingsCommunity,1072,2018-12-21T01:51:21Z,SmartThings open-source DeviceTypeHandlers and SmartApps code
7,top-100-forks,ExData_Plotting1,161,48777,,https://github.com/rdpeng/ExData_Plotting1,rdpeng,595,2018-12-07T16:42:31Z,Plotting Assignment 1 for Exploratory Data Analysis
8,top-100-forks,gitignore,76656,36513,,https://github.com/github/gitignore,github,51,2018-12-19T18:25:57Z,A collection of useful .gitignore templates
9,top-100-forks,RepData_PeerAssessment1,73,31094,,https://github.com/rdpeng/RepData_PeerAssessment1,rdpeng,264,2018-12-18T16:15:04Z,Peer Assessment 1 for Reproducible Research
10,top-100-forks,free-programming-books,115182,29046,,https://github.com/EbookFoundation/free-programming-books,EbookFoundation,32,2018-12-19T18:17:43Z,:books: Freely available programming books
11,top-100-forks,angular.js,59309,28998,JavaScript,https://github.com/angular/angular.js,angular,487,2018-12-17T16:59:02Z,AngularJS - HTML enhanced for web apps!
12,top-100-forks,models,46148,28130,Python,https://github.com/tensorflow/models,tensorflow,1324,2018-12-21T00:28:37Z,Models and examples built with TensorFlow
13,top-100-forks,courses,3089,27095,HTML,https://github.com/DataScienceSpecialization/courses,DataScienceSpecialization,93,2018-12-06T17:22:20Z,Course materials for the Data Science Specialization: https://www.coursera.org/specialization/jhudatascience/1
14,top-100-forks,frontend-nanodegree-resume,1002,25174,JavaScript,https://github.com/udacity/frontend-nanodegree-resume,udacity,0,2018-11-27T21:09:19Z,This repository is used for one of the projects in Udacity's Front-End Web Developer Nanodegree program. Learn how to become a Front-End Developer today with line-by-line code reviewed projects and get a job with career services!
15,top-100-forks,linux,67123,24318,C,https://github.com/torvalds/linux,torvalds,245,2018-12-20T22:53:58Z,Linux kernel source tree
16,top-100-forks,jekyll-now,5488,22571,CSS,https://github.com/barryclark/jekyll-now,barryclark,173,2018-12-20T21:34:31Z,"Build a Jekyll blog in minutes, without touching the command line."
17,top-100-forks,patchwork,792,22236,HTML,https://github.com/jlord/patchwork,jlord,547,2018-12-21T01:17:34Z,All the Git-it Workshop completers! 
18,top-100-forks,recipes,59,22264,,https://github.com/LarryMad/recipes,LarryMad,2111,2018-12-20T05:36:06Z,
19,top-100-forks,cgm-remote-monitor,602,22082,JavaScript,https://github.com/nightscout/cgm-remote-monitor,nightscout,189,2018-12-20T02:07:39Z,nightscout web monitor
20,top-100-forks,spring-boot,32308,22058,Java,https://github.com/spring-projects/spring-boot,spring-projects,394,2018-12-20T17:09:53Z,Spring Boot
21,top-100-forks,opencv,30418,21747,C++,https://github.com/opencv/opencv,opencv,1560,2018-12-20T20:46:52Z,Open Source Computer Vision Library
22,top-100-forks,bitcoin,36445,21738,C++,https://github.com/bitcoin/bitcoin,bitcoin,879,2018-12-21T01:04:41Z,Bitcoin Core integration/staging tree
23,top-100-forks,react,118055,21409,JavaScript,https://github.com/facebook/react,facebook,514,2018-12-20T20:04:26Z,"A declarative, efficient, and flexible JavaScript library for building user interfaces."
24,top-100-forks,coding-interview-university,72413,21074,,https://github.com/jwasham/coding-interview-university,jwasham,57,2018-12-17T06:09:19Z,A complete computer science study plan to become a software engineer.
25,top-100-forks,freeCodeCamp,296613,20637,JavaScript,https://github.com/freeCodeCamp/freeCodeCamp,freeCodeCamp,6341,2018-12-21T03:53:53Z,The https://www.freeCodeCamp.org open source codebase and curriculum. Learn to code for free together with millions of people.
26,top-100-forks,d3,81145,20186,JavaScript,https://github.com/d3/d3,d3,9,2018-12-19T13:16:30Z,"Bring data to life with SVG, Canvas and HTML. :bar_chart::chart_with_upwards_trend::tada:"
27,top-100-forks,You-Dont-Know-JS,93425,18060,,https://github.com/getify/You-Dont-Know-JS,getify,207,2018-12-18T13:38:46Z,A book series on JavaScript. @YDKJS on twitter.
28,top-100-forks,three.js,47313,17893,JavaScript,https://github.com/mrdoob/three.js,mrdoob,764,2018-12-21T03:01:18Z,JavaScript 3D library.
29,top-100-forks,spark,19960,17755,Scala,https://github.com/apache/spark,apache,461,2018-12-21T03:12:38Z,Apache Spark
30,top-100-forks,vue,122745,17545,JavaScript,https://github.com/vuejs/vue,vuejs,219,2018-12-20T22:07:35Z,"🖖 A progressive, incrementally-adoptable JavaScript framework for building UI on the web."
31,top-100-forks,jquery,50603,17500,JavaScript,https://github.com/jquery/jquery,jquery,90,2018-12-20T10:07:06Z,jQuery JavaScript Library
32,top-100-forks,shadowsocks,27946,17228,Python,https://github.com/shadowsocks/shadowsocks,shadowsocks,380,2018-12-19T08:58:50Z,
33,top-100-forks,rails,41662,16877,Ruby,https://github.com/rails/rails,rails,1051,2018-12-21T03:25:43Z,Ruby on Rails
34,top-100-forks,django,38365,16584,Python,https://github.com/django/django,django,188,2018-12-21T03:31:56Z,The Web framework for perfectionists with deadlines.
35,top-100-forks,spring-framework,25516,16262,Java,https://github.com/spring-projects/spring-framework,spring-projects,180,2018-12-20T20:36:02Z,Spring Framework
36,top-100-forks,caffe,26582,16158,C++,https://github.com/BVLC/caffe,BVLC,909,2018-12-21T02:01:35Z,Caffe: a fast open framework for deep learning.
37,top-100-forks,react-native,72091,16120,JavaScript,https://github.com/facebook/react-native,facebook,887,2018-12-21T00:05:56Z,A framework for building native apps with React.
38,top-100-forks,scikit-learn,32410,15961,Python,https://github.com/scikit-learn/scikit-learn,scikit-learn,1855,2018-12-21T00:43:34Z,scikit-learn: machine learning in Python
39,top-100-forks,kubernetes,45663,15942,Go,https://github.com/kubernetes/kubernetes,kubernetes,3220,2018-12-21T03:55:46Z,Production-Grade Container Scheduling and Management
