rank,item,repo_name,stars,forks,language,repo_url,username,issues,last_commit,description
62,Python,NLP-progress,11303,1869,Python,https://github.com/sebastianruder/NLP-progress,sebastianruder,20,2019-07-22T14:42:06Z,"Repository to track the progress in Natural Language Processing (NLP), including the datasets and the current state-of-the-art for the most common NLP tasks."
63,Python,material-theme,10919,788,Python,https://github.com/equinusocio/material-theme,equinusocio,5,2019-07-11T00:28:54Z,"Material Theme, the most epic theme for Sublime Text 3 by Mattia Astorino"
64,Python,d2l-zh,10648,2716,Python,https://github.com/d2l-ai/d2l-zh,d2l-ai,3,2019-07-22T23:36:27Z,《动手学深度学习》：面向中文读者、能运行、可讨论。英文版即伯克利“深度学习导论（STAT 157）”教材。
65,Python,locust,10525,1520,Python,https://github.com/locustio/locust,locustio,181,2019-07-22T18:55:36Z,Scalable user load testing tool written in Python
66,Python,zulip,10140,3126,Python,https://github.com/zulip/zulip,zulip,1334,2019-07-24T01:52:07Z,Zulip server - powerful open source team chat
67,Python,salt,10102,4603,Python,https://github.com/saltstack/salt,saltstack,2664,2019-07-24T00:41:46Z,Software to automate the management and configuration of any infrastructure or application at scale. Get access to the Salt software package repository here: 
68,Python,cookiecutter,9930,1087,Python,https://github.com/cookiecutter/cookiecutter,cookiecutter,204,2019-07-23T18:53:17Z,"A command-line utility that creates projects from cookiecutters (project templates). E.g. Python package projects, jQuery plugin projects."
69,Python,requests-html,9926,601,Python,https://github.com/psf/requests-html,psf,64,2019-05-31T17:23:28Z,Pythonic HTML Parsing for Humans™
70,Python,autojump,9870,488,Python,https://github.com/wting/autojump,wting,154,2019-07-22T12:37:33Z,A cd command that learns - easily navigate directories from the command line
71,Python,FastPhotoStyle,9747,953,Python,https://github.com/NVIDIA/FastPhotoStyle,NVIDIA,39,2019-05-14T09:40:36Z,"Style transfer, deep learning, feature transform"
72,Python,matplotlib,9647,4328,Python,https://github.com/matplotlib/matplotlib,matplotlib,1473,2019-07-24T00:11:24Z,matplotlib: plotting with Python
73,Python,neural-networks-and-deep-learning,9596,4668,Python,https://github.com/mnielsen/neural-networks-and-deep-learning,mnielsen,6,2019-05-09T10:58:46Z,"Code samples for my book ""Neural Networks and Deep Learning"""
74,Python,gensim,9580,3491,Python,https://github.com/RaRe-Technologies/gensim,RaRe-Technologies,243,2019-07-23T15:44:45Z,Topic Modelling for Humans
75,Python,kivy,9578,2142,Python,https://github.com/kivy/kivy,kivy,640,2019-07-24T02:36:07Z,"Open source UI framework written in Python, running on Windows, Linux, macOS, Android and iOS"
76,Python,Zappa,9447,1023,Python,https://github.com/Miserlou/Zappa,Miserlou,574,2019-07-22T10:20:13Z,Serverless Python
77,Python,game-programmer,9219,1108,Python,https://github.com/miloyip/game-programmer,miloyip,17,2019-04-30T01:30:36Z,A Study Path for Game Programmer
78,Python,tflearn,9173,2324,Python,https://github.com/tflearn/tflearn,tflearn,558,2019-04-12T10:05:38Z,Deep learning library featuring a higher-level API for TensorFlow.
79,Python,pytorch-CycleGAN-and-pix2pix,9000,2471,Python,https://github.com/junyanz/pytorch-CycleGAN-and-pix2pix,junyanz,84,2019-07-18T16:29:12Z,Image-to-Image Translation in PyTorch
80,Python,pelican,8929,1583,Python,https://github.com/getpelican/pelican,getpelican,105,2019-07-23T16:56:34Z,Static site generator that supports Markdown and reST syntax. Powered by Python.
81,Python,prophet,8904,2181,Python,https://github.com/facebook/prophet,facebook,79,2019-07-23T11:21:28Z,Tool for producing high quality forecasts for time series data that has multiple seasonality with linear or non-linear growth.
82,Python,Theano,8850,2493,Python,https://github.com/Theano/Theano,Theano,656,2019-06-01T05:33:19Z,"Theano is a Python library that allows you to define, optimize, and evaluate mathematical expressions involving multi-dimensional arrays efficiently. It can use GPUs and perform efficient symbolic differentiation."
83,Python,awesome-python-login-model,8830,1712,Python,https://github.com/CriseLYJ/awesome-python-login-model,CriseLYJ,54,2019-07-17T09:27:32Z,😮python模拟登陆一些大型网站，还有一些简单的爬虫，希望对你们有所帮助❤️，如果喜欢记得给个star哦🌟
84,Python,mackup,8824,697,Python,https://github.com/lra/mackup,lra,284,2019-07-20T23:02:37Z,Keep your application settings in sync (OS X/Linux)
85,Python,beets,8786,1521,Python,https://github.com/beetbox/beets,beetbox,616,2019-07-24T00:35:40Z,music library manager and MusicBrainz tagger
86,Python,stanford-tensorflow-tutorials,8751,4030,Python,https://github.com/chiphuyen/stanford-tensorflow-tutorials,chiphuyen,80,2019-03-02T17:44:57Z,This repository contains code examples for the Stanford's course: TensorFlow for Deep Learning Research. 
87,Python,ChatterBot,8660,3028,Python,https://github.com/gunthercox/ChatterBot,gunthercox,104,2019-07-21T20:38:17Z,"ChatterBot is a machine learning, conversational dialog engine for creating chat bots"
88,Python,facenet,8653,3577,Python,https://github.com/davidsandberg/facenet,davidsandberg,408,2019-07-02T11:47:58Z,Face recognition using Tensorflow
89,Python,awesome-python-applications,8613,1532,Python,https://github.com/mahmoud/awesome-python-applications,mahmoud,22,2019-07-15T20:08:29Z,"💿 Free software that works great, and also happens to be open-source Python. "
90,Python,PayloadsAllTheThings,8549,2678,Python,https://github.com/swisskyrepo/PayloadsAllTheThings,swisskyrepo,1,2019-07-22T19:46:13Z,A list of useful payloads and bypass for Web Application Security and Pentest/CTF
91,Python,tensor2tensor,8412,2143,Python,https://github.com/tensorflow/tensor2tensor,tensorflow,425,2019-07-24T02:02:00Z,Library of deep learning models and datasets designed to make deep learning more accessible and accelerate ML research.
92,Python,newspaper,8399,1400,Python,https://github.com/codelucas/newspaper,codelucas,303,2019-07-23T18:09:33Z,"News, full-text, and article metadata extraction in Python 3. Advanced docs:"
93,Python,speedtest-cli,8363,1180,Python,https://github.com/sivel/speedtest-cli,sivel,23,2019-07-18T08:32:56Z,Command line interface for testing internet bandwidth using speedtest.net
94,Python,aws-cli,8296,1801,Python,https://github.com/aws/aws-cli,aws,540,2019-07-24T01:42:53Z,Universal Command Line Interface for Amazon Web Services
95,Python,mailinabox,8279,882,Python,https://github.com/mail-in-a-box/mailinabox,mail-in-a-box,250,2019-07-16T17:43:37Z,"Mail-in-a-Box helps individuals take back control of their email by defining a one-click, easy-to-deploy SMTP+everything else server: a mail server in a box."
96,Python,walle-web,8183,2114,Python,https://github.com/meolu/walle-web,meolu,237,2019-07-20T01:50:18Z,walle - 瓦力 Devops开源项目代码部署平台
97,Python,faker,8174,953,Python,https://github.com/joke2k/faker,joke2k,83,2019-07-16T20:54:16Z,Faker is a Python package that generates fake data for you.
98,Python,DeepCreamPy,8162,843,Python,https://github.com/deeppomf/DeepCreamPy,deeppomf,13,2019-07-21T20:10:24Z,Decensoring Hentai with Deep Neural Networks
99,Python,fast-style-transfer,8127,1963,Python,https://github.com/lengstrom/fast-style-transfer,lengstrom,52,2019-04-08T23:50:42Z,TensorFlow CNN for fast style transfer ⚡🖥🎨🖼
100,Python,wtfpython-cn,8099,1524,Python,https://github.com/leisurelicht/wtfpython-cn,leisurelicht,7,2019-06-25T11:39:11Z,wtfpython的中文翻译/施工结束/ 能力有限，欢迎帮我改进翻译
1,R,ggplot2,3910,1481,R,https://github.com/tidyverse/ggplot2,tidyverse,133,2019-07-17T19:32:22Z,An implementation of the Grammar of Graphics in R
2,R,awesome-R,3590,1206,R,https://github.com/qinwf/awesome-R,qinwf,5,2019-07-20T17:48:44Z,"A curated list of awesome R packages, frameworks and software."
3,R,ML_for_Hackers,3517,2236,R,https://github.com/johnmyleswhite/ML_for_Hackers,johnmyleswhite,34,2019-05-26T16:52:29Z,"Code accompanying the book ""Machine Learning for Hackers"""
4,R,shiny,3465,1506,R,https://github.com/rstudio/shiny,rstudio,440,2019-07-22T21:41:20Z,Easy interactive web applications with R
5,R,dplyr,2996,1102,R,https://github.com/tidyverse/dplyr,tidyverse,122,2019-07-23T19:48:16Z,dplyr: A grammar of data manipulation
6,R,AnomalyDetection,2972,673,R,https://github.com/twitter/AnomalyDetection,twitter,68,2019-03-01T02:37:44Z,Anomaly Detection with R
7,R,swirl_courses,2958,6203,R,https://github.com/swirldev/swirl_courses,swirldev,128,2019-07-19T06:52:19Z,:mortar_board: A collection of interactive courses for the swirl R package.
8,R,r4ds,1998,2467,R,https://github.com/hadley/r4ds,hadley,107,2019-07-06T16:43:37Z,R for data science
9,R,devtools,1821,651,R,https://github.com/r-lib/devtools,r-lib,67,2019-07-02T20:03:48Z,Tools to make an R developer's life easier
10,R,knitr,1807,759,R,https://github.com/yihui/knitr,yihui,68,2019-07-04T02:37:14Z,A general-purpose tool for dynamic report generation in R
11,R,investing,1692,108,R,https://github.com/zonination/investing,zonination,0,2016-12-27T13:58:02Z,Investing Returns on the Market as a Whole
12,R,benchm-ml,1675,314,R,https://github.com/szilard/benchm-ml,szilard,10,2019-05-07T21:04:59Z,"A minimal benchmark for scalability, speed and accuracy of commonly used open source implementations (R packages, Python scikit-learn, H2O, xgboost, Spark MLlib etc.) of the top machine learning algorithms for binary classification (random forests, gradient boosted trees, deep neural networks etc.)."
13,R,rmarkdown,1561,660,R,https://github.com/rstudio/rmarkdown,rstudio,105,2019-07-23T23:09:28Z,Dynamic Documents for R
14,R,stats337,1551,236,R,https://github.com/hadley/stats337,hadley,7,2018-06-21T15:57:29Z,Readings in applied data science
15,R,nyc-taxi-data,1540,458,R,https://github.com/toddwschneider/nyc-taxi-data,toddwschneider,0,2019-04-08T10:56:34Z,"Import public NYC taxi and for-hire vehicle (Uber, Lyft, etc.) trip data into PostgreSQL database"
16,R,bookdown,1529,665,R,https://github.com/rstudio/bookdown,rstudio,79,2019-07-23T05:14:58Z,Authoring Books and Technical Documents with R Markdown
17,R,plotly,1519,524,R,https://github.com/ropensci/plotly,ropensci,276,2019-07-17T16:47:49Z,An interactive graphing library for R
18,R,awesome-network-analysis,1506,328,R,https://github.com/briatte/awesome-network-analysis,briatte,18,2019-07-14T21:31:56Z,A curated list of awesome network analysis resources.
19,R,DataScienceR,1346,742,R,https://github.com/ujjwalkarn/DataScienceR,ujjwalkarn,3,2018-04-18T00:01:52Z,"a curated list of R tutorials for Data Science, NLP and Machine Learning "
20,R,mlr,1289,353,R,https://github.com/mlr-org/mlr,mlr-org,385,2019-07-23T11:00:19Z,mlr: Machine Learning in R 
21,R,gganimate,1272,233,R,https://github.com/thomasp85/gganimate,thomasp85,85,2019-06-12T22:12:12Z,A Grammar of Animated Graphics
22,R,DiagrammeR,1198,185,R,https://github.com/rich-iannone/DiagrammeR,rich-iannone,102,2019-06-11T04:42:35Z,Graph and network visualization using tabular data in R
23,R,tensorflow,1140,314,R,https://github.com/rstudio/tensorflow,rstudio,11,2019-07-23T23:56:50Z,TensorFlow for R
24,R,caret,1089,520,R,https://github.com/topepo/caret,topepo,142,2019-07-16T15:09:49Z,caret (Classification And Regression Training) R package that contains misc functions for training and plotting classification and regression models
25,R,patchwork,1082,85,R,https://github.com/thomasp85/patchwork,thomasp85,37,2019-04-01T11:22:01Z,The Composer of ggplots
26,R,rvest,1082,274,R,https://github.com/tidyverse/rvest,tidyverse,31,2019-07-18T19:16:10Z,Simple web scraping for R
27,R,labs,1030,1439,R,https://github.com/genomicsclass/labs,genomicsclass,12,2018-10-29T20:05:09Z,Rmd source files for the HarvardX series PH525x
28,R,wesanderson,1002,83,R,https://github.com/karthik/wesanderson,karthik,10,2019-02-01T23:29:59Z,A Wes Anderson color palette for R
29,R,ggthemes,990,196,R,https://github.com/jrnold/ggthemes,jrnold,3,2019-05-13T14:40:04Z,"Additional themes, scales, and geoms for ggplot2"
30,R,blogdown,977,220,R,https://github.com/rstudio/blogdown,rstudio,10,2019-07-13T23:21:34Z,Create Blogs and Websites with R Markdown
31,R,CausalImpact,974,163,R,https://github.com/google/CausalImpact,google,19,2019-04-17T12:47:39Z,An R package for causal inference in time series
32,R,tidytuesday,946,454,R,https://github.com/rfordatascience/tidytuesday,rfordatascience,46,2019-07-23T14:54:27Z,Official repo for the #tidytuesday project
33,R,reticulate,928,167,R,https://github.com/rstudio/reticulate,rstudio,209,2019-07-23T20:42:32Z,R Interface to Python
34,R,plumber,906,170,R,https://github.com/trestletech/plumber,trestletech,116,2019-07-17T20:43:28Z,Turn your R code into a web API.
35,R,drake,893,91,R,https://github.com/ropensci/drake,ropensci,8,2019-07-23T16:04:57Z,An R-focused pipeline toolkit for reproducibility and high-performance computing
36,R,broom,873,237,R,https://github.com/tidymodels/broom,tidymodels,151,2019-07-18T19:16:35Z,Convert statistical analysis objects from R into tidy format
37,R,bbplot,843,128,R,https://github.com/bbc/bbplot,bbc,11,2019-03-19T02:15:52Z,R package that helps create and export ggplot2 charts in the style used by the BBC News data team
38,R,gt,830,59,R,https://github.com/rstudio/gt,rstudio,131,2019-07-23T00:59:09Z,"Easily generate information-rich, publication-quality tables from R"
39,R,rethinking,822,254,R,https://github.com/rmcelreath/rethinking,rmcelreath,93,2019-07-09T13:21:29Z,Statistical Rethinking course and book package
40,R,swirl,820,546,R,https://github.com/swirldev/swirl,swirldev,182,2019-07-19T18:09:49Z,":cyclone: Learn R, in R."
41,R,slidify,809,351,R,https://github.com/ramnathv/slidify,ramnathv,180,2016-08-02T03:54:45Z,Generate reproducible html5 slides from R markdown
42,R,tofsims,798,5,R,https://github.com/fossasia/tofsims,fossasia,0,2017-11-29T19:16:12Z,
43,R,httr,786,1848,R,https://github.com/r-lib/httr,r-lib,20,2019-06-30T18:15:50Z,httr: a friendly http package for R
44,R,tidytext,785,158,R,https://github.com/juliasilge/tidytext,juliasilge,8,2019-07-20T22:47:20Z,"Text mining using dplyr, ggplot2, and other tidy tools :sparkles::page_facing_up::sparkles::page_facing_up::sparkles:"
45,R,purrr,783,189,R,https://github.com/tidyverse/purrr,tidyverse,82,2019-07-08T14:16:47Z,A functional programming toolkit for R
46,R,rayshader,773,72,R,https://github.com/tylermorganwall/rayshader,tylermorganwall,18,2019-07-08T16:15:13Z,"R Package for Producing and Visualizing Hillshaded Maps from Elevation Matrices, in 2D and 3D"
47,R,tidyr,771,309,R,https://github.com/tidyverse/tidyr,tidyverse,23,2019-07-23T19:47:54Z,Easily tidy data with spread and gather functions.
48,R,advanced-shiny,743,276,R,https://github.com/daattali/advanced-shiny,daattali,1,2019-05-20T07:34:57Z,Shiny tips & tricks for improving your apps and solving common problems
49,R,forecast,740,260,R,https://github.com/robjhyndman/forecast,robjhyndman,11,2019-07-21T02:25:34Z,forecast package for R
50,R,rnaseq_tutorial,725,403,R,https://github.com/griffithlab/rnaseq_tutorial,griffithlab,11,2018-11-01T19:59:51Z,"Informatics for RNA-seq: A web resource for analysis on the cloud. Educational tutorials and working pipelines for RNA-seq analysis including an introduction to: cloud computing, critical file formats, reference genomes, gene annotation, expression, differential expression, alternative splicing, data visualization, and interpretation."
51,R,tidyverse,722,154,R,https://github.com/tidyverse/tidyverse,tidyverse,11,2019-07-22T10:56:10Z,Easily install and load packages from the tidyverse
52,R,esquisse,716,75,R,https://github.com/dreamRs/esquisse,dreamRs,18,2019-07-16T07:45:53Z,RStudio add-in to make plots with ggplot2
53,R,googlesheets,705,174,R,https://github.com/jennybc/googlesheets,jennybc,89,2019-05-28T23:50:21Z,Google Spreadsheets R API
54,R,readr,705,218,R,https://github.com/tidyverse/readr,tidyverse,89,2019-07-22T07:07:55Z,"Read flat files (csv, tsv, fwf) into R"
55,R,magrittr,696,129,R,https://github.com/tidyverse/magrittr,tidyverse,26,2019-01-05T16:37:00Z,Improve the readability of R code with the pipe
56,R,MLPB,674,258,R,https://github.com/ben519/MLPB,ben519,0,2019-06-04T17:32:17Z,Machine Learning Problem Bible | Problem Set Here >>
57,R,sparklyr,674,247,R,https://github.com/rstudio/sparklyr,rstudio,433,2019-07-17T02:39:48Z,R interface for Apache Spark
58,R,janitor,672,73,R,https://github.com/sfirke/janitor,sfirke,51,2019-07-15T19:29:06Z,simple tools for data cleaning in R
59,R,BanditsBook,657,227,R,https://github.com/johnmyleswhite/BanditsBook,johnmyleswhite,6,2018-04-05T06:34:29Z,Code for my book on Multi-Armed Bandit Algorithms
60,R,ggvis,656,181,R,https://github.com/rstudio/ggvis,rstudio,191,2019-07-08T13:01:06Z,Interactive grammar of graphics for R
61,R,SparkR-pkg,652,346,R,https://github.com/amplab-extras/SparkR-pkg,amplab-extras,21,2016-06-10T21:42:55Z,R frontend for Spark
62,R,ggraph,641,75,R,https://github.com/thomasp85/ggraph,thomasp85,70,2019-03-07T01:43:09Z,Grammar of Graph Graphics
63,R,skimr,641,55,R,https://github.com/ropensci/skimr,ropensci,21,2019-07-22T08:58:01Z,"A frictionless, pipeable approach to dealing with summary statistics"
64,R,ggrepel,637,71,R,https://github.com/slowkow/ggrepel,slowkow,19,2019-04-30T00:50:57Z,:round_pushpin: Repel overlapping text labels away from each other.
65,R,htmlwidgets,626,179,R,https://github.com/ramnathv/htmlwidgets,ramnathv,108,2019-06-05T20:05:07Z,HTML Widgets for R
66,R,r-source,623,202,R,https://github.com/wch/r-source,wch,0,2019-07-23T21:07:12Z,"Read-only mirror of R source code from https://svn.r-project.org/R/, updated hourly. See the build instructions on the wiki page."
67,R,rappor,620,121,R,https://github.com/google/rappor,google,34,2019-01-10T13:19:15Z,RAPPOR: Privacy-Preserving Reporting Algorithms
68,R,testthat,613,251,R,https://github.com/r-lib/testthat,r-lib,13,2019-07-22T21:42:10Z,An R 📦 to make testing 😀
69,R,perceptions,606,77,R,https://github.com/zonination/perceptions,zonination,0,2017-08-25T14:34:20Z,Perceptions of Probability and Numbers
70,R,text2vec,604,104,R,https://github.com/dselivanov/text2vec,dselivanov,28,2019-02-25T17:27:57Z,"Fast vectorization, topic modeling, distances and GloVe word embeddings in R."
71,R,ProgrammingAssignment2,597,117449,R,https://github.com/rdpeng/ProgrammingAssignment2,rdpeng,2800,2019-07-23T20:44:59Z,Repository for Programming Assignment 2 for R Programming on Coursera
72,R,lintr,594,109,R,https://github.com/jimhester/lintr,jimhester,137,2019-07-19T20:22:01Z,Static Code Analysis for R
73,R,rstan,589,192,R,https://github.com/stan-dev/rstan,stan-dev,167,2019-07-09T15:42:53Z,"RStan, the R interface to Stan"
74,R,keras,570,201,R,https://github.com/rstudio/keras,rstudio,17,2019-07-12T09:51:38Z,R Interface to Keras
75,R,ggthemr,562,79,R,https://github.com/cttobin/ggthemr,cttobin,4,2019-07-09T14:55:35Z,Themes for ggplot2.
76,R,hrbrthemes,562,60,R,https://github.com/hrbrmstr/hrbrthemes,hrbrmstr,17,2019-07-23T12:49:25Z,":lock_with_ink_pen: Opinionated, typographic-centric ggplot2 themes and theme components"
77,R,RStartHere,560,208,R,https://github.com/rstudio/RStartHere,rstudio,5,2018-04-02T18:39:27Z,A guide to some of the most useful R Packages that we know about
78,R,brms,556,73,R,https://github.com/paul-buerkner/brms,paul-buerkner,49,2019-07-20T08:25:54Z,brms R package for Bayesian generalized multivariate non-linear multilevel models using Stan
79,R,ggstatsplot,554,65,R,https://github.com/IndrajeetPatil/ggstatsplot,IndrajeetPatil,23,2019-07-23T20:12:36Z,Collection of functions to enhance ggplot2 plots with results from statistical tests.
80,R,sf,552,139,R,https://github.com/r-spatial/sf,r-spatial,36,2019-07-22T20:53:24Z,Simple Features for R
81,R,ProjectTemplate,546,155,R,https://github.com/KentonWhite/ProjectTemplate,KentonWhite,17,2019-04-16T00:31:02Z,A template utility for R projects that provides a skeletal project.
82,R,geocompr,530,226,R,https://github.com/Robinlovelace/geocompr,Robinlovelace,11,2019-07-19T22:01:51Z,Open source book: Geocomputation with R
83,R,ggmap,529,201,R,https://github.com/dkahle/ggmap,dkahle,80,2019-05-12T04:49:38Z,A package for plotting maps in R with ggplot2
84,R,asdfree,527,436,R,https://github.com/ajdamico/asdfree,ajdamico,91,2019-01-26T13:39:07Z,analyze survey data for free
85,R,future,525,44,R,https://github.com/HenrikBengtsson/future,HenrikBengtsson,73,2019-07-20T09:34:30Z,:rocket: R package: future: Unified Parallel and Distributed Processing in R for Everyone
86,R,opencpu,516,95,R,https://github.com/opencpu/opencpu,opencpu,82,2019-05-12T08:39:30Z,OpenCPU system for embedded scientific computation and reproducible research
87,R,datapasta,511,39,R,https://github.com/MilesMcBain/datapasta,MilesMcBain,16,2019-07-20T12:27:06Z,"On top of spaghetti, all covered in cheese...."
88,R,quanteda,509,120,R,https://github.com/quanteda/quanteda,quanteda,90,2019-07-23T10:38:05Z,An R package for the Quantitative Analysis of Textual Data
89,R,ESL-CN,501,152,R,https://github.com/szcf-weiya/ESL-CN,szcf-weiya,94,2019-07-18T13:30:38Z,The Elements of Statistical Learning (ESL)的中文翻译、代码实现及其习题解答。
90,R,seurat,494,308,R,https://github.com/satijalab/seurat,satijalab,54,2019-07-23T08:02:13Z,R toolkit for single cell genomics
91,R,networkD3,493,234,R,https://github.com/christophergandrud/networkD3,christophergandrud,72,2019-05-04T07:16:39Z,D3 JavaScript Network Graphs from R
92,R,addinslist,491,99,R,https://github.com/daattali/addinslist,daattali,1,2019-07-09T16:33:49Z,Discover and install useful RStudio addins 
93,R,formattable,484,66,R,https://github.com/renkun-ken/formattable,renkun-ken,45,2019-04-18T02:51:24Z,Formattable Data Structures
94,R,ballr,483,103,R,https://github.com/toddwschneider/ballr,toddwschneider,1,2019-06-26T11:15:23Z,Interactive NBA and NCAA Shot Charts with R and Shiny
95,R,plyr,475,122,R,https://github.com/hadley/plyr,hadley,30,2019-03-27T03:48:53Z,"A R package for splitting, applying and combining large problems into simpler problems"
96,R,waffle,467,65,R,https://github.com/hrbrmstr/waffle,hrbrmstr,29,2019-07-12T21:06:04Z,:maple_leaf: Make waffle (square pie) charts in R
97,R,engsoccerdata,460,132,R,https://github.com/jalapic/engsoccerdata,jalapic,14,2019-04-20T14:10:20Z,English and European soccer results 1871-2017
98,R,DALEX,453,62,R,https://github.com/pbiecek/DALEX,pbiecek,12,2019-07-23T17:01:33Z,Descriptive mAchine Learning EXplanations
99,R,mindr,453,39,R,https://github.com/pzhaonet/mindr,pzhaonet,0,2019-05-02T12:02:48Z,"an R package which converts markdown files (.md, .Rmd) into mindmaps (brainstorms)"
100,R,ggalt,449,66,R,https://github.com/hrbrmstr/ggalt,hrbrmstr,32,2019-07-05T20:47:25Z,":earth_americas: Extra Coordinate Systems, Geoms,  Statistical Transformations & Scales for 'ggplot2'"
1,Ruby,rails,43692,17572,Ruby,https://github.com/rails/rails,rails,1158,2019-07-23T23:18:27Z,Ruby on Rails
2,Ruby,jekyll,38245,8339,Ruby,https://github.com/jekyll/jekyll,jekyll,140,2019-07-23T14:43:48Z,:globe_with_meridians: Jekyll is a blog-aware static site generator in Ruby
3,Ruby,discourse,28693,6486,Ruby,https://github.com/discourse/discourse,discourse,18,2019-07-23T22:23:12Z,"A platform for community discussion. Free, open, simple."
4,Ruby,fastlane,26157,3983,Ruby,https://github.com/fastlane/fastlane,fastlane,232,2019-07-23T18:15:03Z,🚀 The easiest way to automate building and releasing your iOS and Android apps
5,Ruby,awesome-awesomeness,24578,3069,Ruby,https://github.com/bayandin/awesome-awesomeness,bayandin,7,2019-07-14T20:14:28Z,A curated list of awesome awesomeness
6,Ruby,gitlabhq,21922,5573,Ruby,https://github.com/gitlabhq/gitlabhq,gitlabhq,29,2019-07-24T02:52:26Z,GitLab CE Mirror | Please open new issues in our issue tracker on GitLab.com
7,Ruby,huginn,21774,2357,Ruby,https://github.com/huginn/huginn,huginn,368,2019-07-13T21:38:42Z,Create agents that monitor and act on your behalf.  Your agents are standing by!
8,Ruby,devdocs,21032,1376,Ruby,https://github.com/freeCodeCamp/devdocs,freeCodeCamp,108,2019-07-22T12:03:41Z,API Documentation Browser
9,Ruby,devise,20037,4782,Ruby,https://github.com/plataformatec/devise,plataformatec,45,2019-07-17T21:16:00Z,Flexible authentication solution for Rails with Warden.
10,Ruby,vagrant,18698,3756,Ruby,https://github.com/hashicorp/vagrant,hashicorp,458,2019-07-22T03:19:34Z,Vagrant is a tool for building and distributing development environments.
11,Ruby,brew,18423,4116,Ruby,https://github.com/Homebrew/brew,Homebrew,26,2019-07-24T02:51:11Z,🍺 The missing package manager for macOS (or Linux)
12,Ruby,mastodon,18309,3206,Ruby,https://github.com/tootsuite/mastodon,tootsuite,1358,2019-07-24T00:55:31Z,"Your self-hosted, globally interconnected microblogging community"
13,Ruby,metasploit-framework,17115,8424,Ruby,https://github.com/rapid7/metasploit-framework,rapid7,728,2019-07-24T00:49:23Z,Metasploit Framework
14,Ruby,ruby,15994,4267,Ruby,https://github.com/ruby/ruby,ruby,243,2019-07-24T03:01:07Z,The Ruby Programming Language [mirror]
15,Ruby,homebrew-cask,15646,7394,Ruby,https://github.com/Homebrew/homebrew-cask,Homebrew,36,2019-07-24T00:37:29Z,🍻 A CLI workflow for the administration of macOS applications distributed as binaries
16,Ruby,engineering-blogs,15594,1808,Ruby,https://github.com/kilimchoi/engineering-blogs,kilimchoi,34,2019-07-22T21:55:08Z,A curated list of engineering blogs
17,Ruby,bootstrap-sass,12779,3551,Ruby,https://github.com/twbs/bootstrap-sass,twbs,4,2019-06-13T02:01:46Z,Official Sass port of Bootstrap 2 and 3.
18,Ruby,diaspora,12260,2909,Ruby,https://github.com/diaspora/diaspora,diaspora,438,2019-07-06T20:45:27Z,"A privacy-aware, distributed, open source social network."
