rank,item,repo_name,stars,forks,language,repo_url,username,issues,last_commit,description
1,top-100-stars,freeCodeCamp,305725,22993,JavaScript,https://github.com/freeCodeCamp/freeCodeCamp,freeCodeCamp,306,2019-10-23T10:46:54Z,The https://www.freeCodeCamp.org open source codebase and curriculum. Learn to code for free together with millions of people.
2,top-100-stars,996.ICU,247498,21224,Rust,https://github.com/996icu/996.ICU,996icu,16735,2019-10-20T14:26:49Z,Repo for counting stars and contributing. Press F to pay respect to glorious developers.
3,top-100-stars,vue,150776,22387,JavaScript,https://github.com/vuejs/vue,vuejs,393,2019-10-22T05:45:07Z,"🖖 Vue.js is a progressive, incrementally-adoptable JavaScript framework for building UI on the web."
4,top-100-stars,react,138203,26190,JavaScript,https://github.com/facebook/react,facebook,876,2019-10-23T06:36:59Z,"A declarative, efficient, and flexible JavaScript library for building user interfaces."
5,top-100-stars,bootstrap,136437,67169,JavaScript,https://github.com/twbs/bootstrap,twbs,386,2019-10-23T08:15:10Z,"The most popular HTML, CSS, and JavaScript framework for developing responsive, mobile first projects on the web."
6,top-100-stars,tensorflow,136311,78092,C++,https://github.com/tensorflow/tensorflow,tensorflow,2934,2019-10-23T10:30:01Z,An Open Source Machine Learning Framework for Everyone
7,top-100-stars,free-programming-books,130236,32512,,https://github.com/EbookFoundation/free-programming-books,EbookFoundation,37,2019-10-21T20:23:37Z,:books: Freely available programming books
8,top-100-stars,awesome,118048,15693,,https://github.com/sindresorhus/awesome,sindresorhus,26,2019-10-22T05:53:52Z,😎 Awesome lists about all kinds of interesting topics
9,top-100-stars,You-Dont-Know-JS,110248,22019,,https://github.com/getify/You-Dont-Know-JS,getify,139,2019-10-22T16:21:43Z,A book series on JavaScript. @YDKJS on twitter.
10,top-100-stars,oh-my-zsh,97214,17807,Shell,https://github.com/robbyrussell/oh-my-zsh,robbyrussell,745,2019-10-23T08:53:44Z,"🙃 A delightful community-driven (with 1,300+ contributors) framework for managing your zsh configuration. Includes 200+ optional plugins (rails, git, OSX, hub, capistrano, brew, ant, php, python, etc), over 140 themes to spice up your morning, and an auto-update tool so that makes it easy to keep up with the latest updates from the community."
11,top-100-stars,coding-interview-university,91695,26982,,https://github.com/jwasham/coding-interview-university,jwasham,70,2019-10-20T03:19:05Z,A complete computer science study plan to become a software engineer.
12,top-100-stars,gitignore,90807,46080,,https://github.com/github/gitignore,github,114,2019-10-23T00:22:00Z,A collection of useful .gitignore templates
13,top-100-stars,javascript,89880,17392,JavaScript,https://github.com/airbnb/javascript,airbnb,110,2019-10-12T16:11:06Z,JavaScript Style Guide
14,top-100-stars,developer-roadmap,89368,14344,,https://github.com/kamranahmedse/developer-roadmap,kamranahmedse,196,2019-10-16T06:01:20Z,Roadmap to becoming a web developer in 2019
15,top-100-stars,d3,88141,21452,JavaScript,https://github.com/d3/d3,d3,4,2019-10-03T21:11:46Z,"Bring data to life with SVG, Canvas and HTML. :bar_chart::chart_with_upwards_trend::tada:"
16,top-100-stars,vscode,84896,12452,TypeScript,https://github.com/microsoft/vscode,microsoft,3954,2019-10-23T10:59:58Z,Visual Studio Code
17,top-100-stars,react-native,82021,18367,JavaScript,https://github.com/facebook/react-native,facebook,814,2019-10-23T09:37:20Z,A framework for building native apps with React.
18,top-100-stars,linux,81721,28592,C,https://github.com/torvalds/linux,torvalds,303,2019-10-23T10:29:12Z,Linux kernel source tree
19,top-100-stars,CS-Notes,81081,25911,Java,https://github.com/CyC2018/CS-Notes,CyC2018,9,2019-10-23T01:27:12Z,:books: Tech Interview Guide 技术面试必备基础知识、Leetcode 题解、Java、C++、Python、后端面试、操作系统、计算机网络、系统设计
20,top-100-stars,electron,77789,10310,C++,https://github.com/electron/electron,electron,1187,2019-10-23T09:57:44Z,":electron: Build cross-platform desktop apps with JavaScript, HTML, and CSS"
21,top-100-stars,flutter,77698,9752,Dart,https://github.com/flutter/flutter,flutter,7819,2019-10-23T08:53:18Z,Flutter makes it easy and fast to build beautiful mobile apps.
22,top-100-stars,system-design-primer,75264,12181,Python,https://github.com/donnemartin/system-design-primer,donnemartin,118,2019-10-21T06:35:22Z,Learn how to design large-scale systems. Prep for the system design interview.  Includes Anki flashcards.
23,top-100-stars,awesome-python,74658,14667,Python,https://github.com/vinta/awesome-python,vinta,534,2019-10-22T20:57:42Z,"A curated list of awesome Python frameworks, libraries, software and resources"
24,top-100-stars,create-react-app,72791,16977,JavaScript,https://github.com/facebook/create-react-app,facebook,446,2019-10-23T10:30:44Z,Set up a modern web app by running one command.
25,top-100-stars,the-art-of-command-line,65836,7472,,https://github.com/jlevy/the-art-of-command-line,jlevy,157,2019-10-22T10:18:30Z,"Master the command line, in one page"
26,top-100-stars,axios,65801,5602,JavaScript,https://github.com/axios/axios,axios,721,2019-10-23T10:33:21Z,Promise based HTTP client for the browser and node.js
27,top-100-stars,Python-100-Days,65393,25073,Jupyter Notebook,https://github.com/jackfrued/Python-100-Days,jackfrued,227,2019-10-22T05:13:42Z,Python - 100天从新手到大师
28,top-100-stars,node,65123,15140,JavaScript,https://github.com/nodejs/node,nodejs,1125,2019-10-23T10:37:37Z,Node.js JavaScript runtime :sparkles::turtle::rocket::sparkles:
29,top-100-stars,go,64916,9132,Go,https://github.com/golang/go,golang,5054,2019-10-23T08:10:10Z,The Go programming language
30,top-100-stars,public-apis,63968,7122,Python,https://github.com/public-apis/public-apis,public-apis,54,2019-10-22T07:19:25Z,A collective list of free APIs for use in software and web development.
31,top-100-stars,animate.css,62659,13275,CSS,https://github.com/daneden/animate.css,daneden,27,2019-10-16T19:07:47Z,🍿 A cross-browser library of CSS animations. As easy to use as an easy thing.
32,top-100-stars,Font-Awesome,61236,10364,JavaScript,https://github.com/FortAwesome/Font-Awesome,FortAwesome,4988,2019-10-15T09:04:06Z,"The iconic SVG, font, and CSS toolkit"
33,top-100-stars,Python,60146,18027,Jupyter Notebook,https://github.com/TheAlgorithms/Python,TheAlgorithms,283,2019-10-23T05:24:25Z,All Algorithms implemented in Python
34,top-100-stars,angular.js,59611,28901,JavaScript,https://github.com/angular/angular.js,angular,465,2019-10-22T06:58:11Z,AngularJS - HTML enhanced for web apps!
35,top-100-stars,kubernetes,59154,20735,Go,https://github.com/kubernetes/kubernetes,kubernetes,3284,2019-10-23T10:59:29Z,Production-Grade Container Scheduling and Management
36,top-100-stars,JavaGuide,58774,19747,Java,https://github.com/Snailclimb/JavaGuide,Snailclimb,33,2019-10-23T06:44:53Z,【Java学习+面试指南】 一份涵盖大部分Java程序员所需要掌握的核心知识。
37,top-100-stars,models,58616,36965,Python,https://github.com/tensorflow/models,tensorflow,1948,2019-10-23T05:20:08Z,Models and examples built with TensorFlow
38,top-100-stars,free-programming-books-zh_CN,57340,18292,,https://github.com/justjavac/free-programming-books-zh_CN,justjavac,174,2019-10-20T04:20:21Z,:books: 免费的计算机编程类中文书籍，欢迎投稿
39,top-100-stars,youtube-dl,56853,9895,Python,https://github.com/ytdl-org/youtube-dl,ytdl-org,3094,2019-10-22T16:59:35Z,Command-line program to download videos from YouTube.com and other video sites
40,top-100-stars,laravel,55753,17132,PHP,https://github.com/laravel/laravel,laravel,28,2019-10-21T18:47:43Z,A PHP framework for web artisans
41,top-100-stars,three.js,55693,21118,JavaScript,https://github.com/mrdoob/three.js,mrdoob,693,2019-10-23T10:36:37Z,JavaScript 3D library.
42,top-100-stars,moby,55245,15947,Go,https://github.com/moby/moby,moby,3823,2019-10-23T06:10:51Z,Moby Project - a collaborative project for the container ecosystem to assemble container-based systems
43,top-100-stars,javascript-algorithms,55199,8614,JavaScript,https://github.com/trekhleb/javascript-algorithms,trekhleb,139,2019-10-22T07:12:13Z,📝 Algorithms and data structures implemented in JavaScript with explanations and links to further readings
44,top-100-stars,puppeteer,55062,5305,JavaScript,https://github.com/GoogleChrome/puppeteer,GoogleChrome,601,2019-10-23T10:56:43Z,Headless Chrome Node.js API
45,top-100-stars,TypeScript,54968,7500,TypeScript,https://github.com/microsoft/TypeScript,microsoft,3905,2019-10-23T04:28:05Z,TypeScript is a superset of JavaScript that compiles to clean JavaScript output.
46,top-100-stars,terminal,53410,5176,C++,https://github.com/microsoft/terminal,microsoft,755,2019-10-23T09:14:59Z,"The new Windows Terminal, and the original Windows console host - all in the same place!"
47,top-100-stars,angular,53203,14728,TypeScript,https://github.com/angular/angular,angular,3250,2019-10-23T10:50:04Z,One framework. Mobile & desktop.
48,top-100-stars,ant-design,52749,18874,TypeScript,https://github.com/ant-design/ant-design,ant-design,389,2019-10-23T10:40:01Z,🌈 A UI Design Language and React UI library
49,top-100-stars,jquery,52378,18678,JavaScript,https://github.com/jquery/jquery,jquery,85,2019-10-22T23:00:45Z,jQuery JavaScript Library
50,top-100-stars,java-design-patterns,52112,16919,Java,https://github.com/iluwatar/java-design-patterns,iluwatar,172,2019-10-23T09:30:47Z,Design patterns implemented in Java
51,top-100-stars,material-ui,51563,12574,JavaScript,https://github.com/mui-org/material-ui,mui-org,387,2019-10-23T07:23:19Z,"React components for faster and easier web development. Build your own design system, or start with Material Design."
52,top-100-stars,webpack,51544,6564,JavaScript,https://github.com/webpack/webpack,webpack,474,2019-10-23T08:20:36Z,"A bundler for javascript and friends. Packs many modules into a few bundled assets. Code Splitting allows for loading parts of the application on demand. Through ""loaders"", modules can be CommonJs, AMD, ES6 modules, CSS, Images, JSON, Coffeescript, LESS, ... and your custom stuff."
53,top-100-stars,redux,51060,13312,TypeScript,https://github.com/reduxjs/redux,reduxjs,32,2019-10-17T00:26:17Z,Predictable state container for JavaScript apps
54,top-100-stars,30-seconds-of-code,50610,5753,JavaScript,https://github.com/30-seconds/30-seconds-of-code,30-seconds,5,2019-10-21T17:08:08Z,A curated collection of useful JavaScript snippets that you can understand in 30 seconds or less.
55,top-100-stars,computer-science,50234,7277,,https://github.com/ossu/computer-science,ossu,30,2019-10-21T23:32:58Z,:mortar_board: Path to a free self-taught education in Computer Science!
56,top-100-stars,atom,50218,13107,JavaScript,https://github.com/atom/atom,atom,564,2019-10-22T16:22:25Z,:atom: The hackable text editor
57,top-100-stars,thefuck,49619,2460,Python,https://github.com/nvbn/thefuck,nvbn,192,2019-10-22T22:30:56Z,Magnificent app which corrects your previous console command.
58,top-100-stars,awesome-vue,49566,6942,,https://github.com/vuejs/awesome-vue,vuejs,188,2019-10-23T08:33:20Z,🎉 A curated list of awesome things related to Vue.js
59,top-100-stars,build-your-own-x,49565,3455,,https://github.com/danistefanovic/build-your-own-x,danistefanovic,40,2019-10-22T20:46:30Z,🤓 Build your own (insert technology here)
60,top-100-stars,swift,49455,7995,C++,https://github.com/apple/swift,apple,593,2019-10-23T10:26:08Z,The Swift Programming Language
61,top-100-stars,reveal.js,48855,14185,JavaScript,https://github.com/hakimel/reveal.js,hakimel,523,2019-10-18T11:40:44Z,The HTML Presentation Framework
62,top-100-stars,awesome-go,48853,6453,Go,https://github.com/avelino/awesome-go,avelino,22,2019-10-22T20:22:42Z,"A curated list of awesome Go frameworks, libraries and software"
63,top-100-stars,socket.io,47819,8733,JavaScript,https://github.com/socketio/socket.io,socketio,427,2019-10-15T07:31:43Z,Realtime application framework (Node.JS server)
64,top-100-stars,flask,47115,12999,Python,https://github.com/pallets/flask,pallets,22,2019-10-18T23:08:47Z,The Python micro framework for building web applications.
65,top-100-stars,Semantic-UI,46634,4918,JavaScript,https://github.com/Semantic-Org/Semantic-UI,Semantic-Org,950,2019-09-23T18:12:40Z,Semantic is a UI component framework based around useful principles from natural language.
66,top-100-stars,lantern,45970,9925,Go,https://github.com/getlantern/lantern,getlantern,2532,2019-10-08T17:32:49Z,蓝灯Windows下载 https://raw.githubusercontent.com/getlantern/lantern-binaries/master/lantern-installer.exe 蓝灯安卓下载 https://raw.githubusercontent.com/getlantern/lantern-binaries/master/lantern-installer.apk
67,top-100-stars,express,45877,7687,JavaScript,https://github.com/expressjs/express,expressjs,179,2019-10-15T15:51:30Z,"Fast, unopinionated, minimalist web framework for node."
68,top-100-stars,Chart.js,45719,9983,JavaScript,https://github.com/chartjs/Chart.js,chartjs,520,2019-10-23T08:11:27Z,Simple HTML5 Charts using the <canvas> tag
69,top-100-stars,elasticsearch,44939,15138,Java,https://github.com/elastic/elasticsearch,elastic,2199,2019-10-23T10:50:08Z,"Open Source, Distributed, RESTful Search Engine"
70,top-100-stars,keras,44895,17084,Python,https://github.com/keras-team/keras,keras-team,2629,2019-10-23T07:22:12Z,Deep Learning for humans
71,top-100-stars,django,44793,19323,Python,https://github.com/django/django,django,238,2019-10-23T09:22:42Z,The Web framework for perfectionists with deadlines.
72,top-100-stars,Apollo-11,44719,6151,Assembly,https://github.com/chrislgarry/Apollo-11,chrislgarry,35,2019-10-14T20:10:12Z,Original Apollo 11 Guidance Computer (AGC) source code for the command and lunar modules.
73,top-100-stars,rails,44365,17911,Ruby,https://github.com/rails/rails,rails,1201,2019-10-23T10:59:14Z,Ruby on Rails
74,top-100-stars,shadowsocks-windows,43939,14341,C#,https://github.com/shadowsocks/shadowsocks-windows,shadowsocks,137,2019-10-15T17:02:33Z,"If you want to keep a secret, you must also hide it from yourself."
75,top-100-stars,vue-element-admin,43546,14681,Vue,https://github.com/PanJiaChen/vue-element-admin,PanJiaChen,426,2019-10-22T15:27:40Z,:tada: A magical vue admin                                                                https://panjiachen.github.io/vue-element-admin
76,top-100-stars,html5-boilerplate,43524,10400,JavaScript,https://github.com/h5bp/html5-boilerplate,h5bp,3,2019-10-21T18:57:49Z,"A professional front-end template for building fast, robust, and adaptable web apps or sites."
77,top-100-stars,httpie,43524,2855,Python,https://github.com/jakubroztocil/httpie,jakubroztocil,151,2019-10-15T18:54:24Z,"As easy as HTTPie /aitch-tee-tee-pie/ 🥧 Modern command line HTTP client – user-friendly curl alternative with intuitive UI, JSON support, syntax highlighting, wget-like downloads, extensions, etc.  https://twitter.com/clihttp"
78,top-100-stars,json-server,43383,3942,JavaScript,https://github.com/typicode/json-server,typicode,485,2019-10-15T23:27:39Z,Get a full fake REST API with zero coding in less than 30 seconds (seriously)
79,top-100-stars,LeetCodeAnimation,42983,7442,Java,https://github.com/MisterBooo/LeetCodeAnimation,MisterBooo,0,2019-10-16T07:53:49Z,Demonstrate all the questions on LeetCode in the form of animation.（用动画的形式呈现解LeetCode题目的思路）
80,top-100-stars,spring-boot,42716,27329,Java,https://github.com/spring-projects/spring-boot,spring-projects,400,2019-10-23T09:42:59Z,Spring Boot
81,top-100-stars,moment,42597,6373,JavaScript,https://github.com/moment/moment,moment,409,2019-10-20T17:17:09Z,"Parse, validate, manipulate, and display dates in javascript."
82,top-100-stars,Front-end-Developer-Interview-Questions,42536,8562,HTML,https://github.com/h5bp/Front-end-Developer-Interview-Questions,h5bp,11,2019-10-20T16:04:53Z,"A list of helpful front-end related questions you can use to interview potential candidates, test yourself or completely ignore."
83,top-100-stars,storybook,42478,3694,TypeScript,https://github.com/storybookjs/storybook,storybookjs,486,2019-10-23T10:12:31Z,"📓 UI component dev & test: React, Vue, Angular, React Native, Ember, Web Components & more!"
84,top-100-stars,resume.github.com,42391,1117,JavaScript,https://github.com/resume/resume.github.com,resume,35,2018-12-29T23:17:05Z,Resumes generated using the GitHub informations
85,top-100-stars,awesome-machine-learning,42263,10667,Python,https://github.com/josephmisiti/awesome-machine-learning,josephmisiti,2,2019-10-16T15:34:50Z,"A curated list of awesome Machine Learning frameworks, libraries and software."
86,top-100-stars,lodash,41954,4451,JavaScript,https://github.com/lodash/lodash,lodash,21,2019-10-23T10:13:35Z,"A modern JavaScript utility library delivering modularity, performance, & extras."
87,top-100-stars,netdata,41914,3794,C,https://github.com/netdata/netdata,netdata,603,2019-10-23T00:26:19Z,"Real-time performance monitoring, done right! https://my-netdata.io/"
88,top-100-stars,next.js,41868,5502,JavaScript,https://github.com/zeit/next.js,zeit,303,2019-10-23T02:54:45Z,The React Framework
89,top-100-stars,element,41748,9109,Vue,https://github.com/ElemeFE/element,ElemeFE,1131,2019-10-23T08:34:34Z,A Vue.js 2.0 UI Toolkit for Web
90,top-100-stars,markdown-here,41416,7262,JavaScript,https://github.com/adam-p/markdown-here,adam-p,254,2019-10-20T20:38:12Z,"Google Chrome, Firefox, and Thunderbird extension that lets you write email in Markdown and render it before sending."
91,top-100-stars,meteor,41373,5074,JavaScript,https://github.com/meteor/meteor,meteor,414,2019-10-20T11:01:16Z,"Meteor, the JavaScript App Platform"
92,top-100-stars,RxJava,40804,6863,Java,https://github.com/ReactiveX/RxJava,ReactiveX,9,2019-10-23T06:41:05Z,RxJava – Reactive Extensions for the JVM – a library for composing asynchronous and event-based programs using observable sequences for the Java VM.
93,top-100-stars,requests,40587,7365,Python,https://github.com/psf/requests,psf,276,2019-10-23T09:38:19Z,"A simple, yet elegant HTTP library."
94,top-100-stars,FiraCode,40586,1366,Clojure,https://github.com/tonsky/FiraCode,tonsky,190,2019-10-22T15:49:44Z,Monospaced font with programming ligatures
95,top-100-stars,bitcoin,40511,24360,C++,https://github.com/bitcoin/bitcoin,bitcoin,1014,2019-10-23T10:41:39Z,Bitcoin Core integration/staging tree
96,top-100-stars,ansible,39905,17149,Python,https://github.com/ansible/ansible,ansible,6234,2019-10-23T10:56:19Z,"Ansible is a radically simple IT automation platform that makes your applications and systems easier to deploy. Avoid writing scripts or custom code to deploy and update your applications — automate in a language that approaches plain English, using SSH, with no agents to install on remote systems. https://docs.ansible.com/ansible/"
97,top-100-stars,every-programmer-should-know,39874,3716,,https://github.com/mtdvio/every-programmer-should-know,mtdvio,32,2019-10-14T11:29:28Z,A collection of (mostly) technical things every software developer should know
98,top-100-stars,rust,39806,6174,Rust,https://github.com/rust-lang/rust,rust-lang,5140,2019-10-23T10:53:28Z,Empowering everyone to build reliable and efficient software.
99,top-100-stars,interviews,39738,8282,Java,https://github.com/kdn251/interviews,kdn251,59,2019-10-22T06:24:34Z,Everything you need to know to get the job.
100,top-100-stars,gatsby,39411,6462,JavaScript,https://github.com/gatsbyjs/gatsby,gatsbyjs,711,2019-10-23T10:57:12Z,"Build blazing fast, modern apps and websites with React"
1,top-100-forks,datasharing,4904,197807,,https://github.com/jtleek/datasharing,jtleek,460,2019-10-21T08:23:01Z,The Leek group guide to data sharing 
2,top-100-forks,ProgrammingAssignment2,610,118551,R,https://github.com/rdpeng/ProgrammingAssignment2,rdpeng,2878,2019-10-21T11:42:53Z,Repository for Programming Assignment 2 for R Programming on Coursera
3,top-100-forks,Spoon-Knife,10170,106473,HTML,https://github.com/octocat/Spoon-Knife,octocat,14106,2019-10-23T10:51:00Z,This repo is for demonstration purposes only.
4,top-100-forks,tensorflow,136311,78092,C++,https://github.com/tensorflow/tensorflow,tensorflow,2934,2019-10-23T10:30:01Z,An Open Source Machine Learning Framework for Everyone
5,top-100-forks,bootstrap,136437,67169,JavaScript,https://github.com/twbs/bootstrap,twbs,386,2019-10-23T08:15:10Z,"The most popular HTML, CSS, and JavaScript framework for developing responsive, mobile first projects on the web."
6,top-100-forks,SmartThingsPublic,1399,60806,Groovy,https://github.com/SmartThingsCommunity/SmartThingsPublic,SmartThingsCommunity,1363,2019-10-23T09:33:36Z,SmartThings open-source DeviceTypeHandlers and SmartApps code
7,top-100-forks,ExData_Plotting1,178,50161,,https://github.com/rdpeng/ExData_Plotting1,rdpeng,613,2019-10-21T13:30:37Z,Plotting Assignment 1 for Exploratory Data Analysis
8,top-100-forks,gitignore,90807,46081,,https://github.com/github/gitignore,github,114,2019-10-23T00:22:00Z,A collection of useful .gitignore templates
9,top-100-forks,models,58616,36965,Python,https://github.com/tensorflow/models,tensorflow,1948,2019-10-23T05:20:08Z,Models and examples built with TensorFlow
10,top-100-forks,cgm-remote-monitor,966,33546,JavaScript,https://github.com/nightscout/cgm-remote-monitor,nightscout,241,2019-10-23T10:59:59Z,nightscout web monitor
11,top-100-forks,free-programming-books,130236,32512,,https://github.com/EbookFoundation/free-programming-books,EbookFoundation,37,2019-10-21T20:23:37Z,:books: Freely available programming books
12,top-100-forks,RepData_PeerAssessment1,78,32177,,https://github.com/rdpeng/RepData_PeerAssessment1,rdpeng,273,2019-07-19T22:57:09Z,Peer Assessment 1 for Reproducible Research
13,top-100-forks,opencv,39271,29410,C++,https://github.com/opencv/opencv,opencv,1805,2019-10-23T10:09:22Z,Open Source Computer Vision Library
14,top-100-forks,angular.js,59611,28901,JavaScript,https://github.com/angular/angular.js,angular,465,2019-10-22T06:58:11Z,AngularJS - HTML enhanced for web apps!
15,top-100-forks,linux,81721,28592,C,https://github.com/torvalds/linux,torvalds,303,2019-10-23T10:29:12Z,Linux kernel source tree
16,top-100-forks,courses,3299,28020,HTML,https://github.com/DataScienceSpecialization/courses,DataScienceSpecialization,93,2019-06-11T17:55:24Z,Course materials for the Data Science Specialization: https://www.coursera.org/specialization/jhudatascience/1
17,top-100-forks,spring-boot,42716,27329,Java,https://github.com/spring-projects/spring-boot,spring-projects,400,2019-10-23T09:42:59Z,Spring Boot
18,top-100-forks,coding-interview-university,91695,26982,,https://github.com/jwasham/coding-interview-university,jwasham,70,2019-10-20T03:19:05Z,A complete computer science study plan to become a software engineer.
19,top-100-forks,tutorials,17617,26609,Java,https://github.com/eugenp/tutorials,eugenp,66,2019-10-23T10:59:34Z,"The ""REST With Spring"" Course: "
20,top-100-forks,react,138203,26190,JavaScript,https://github.com/facebook/react,facebook,876,2019-10-23T06:36:59Z,"A declarative, efficient, and flexible JavaScript library for building user interfaces."
21,top-100-forks,CS-Notes,81081,25911,Java,https://github.com/CyC2018/CS-Notes,CyC2018,9,2019-10-23T01:27:12Z,:books: Tech Interview Guide 技术面试必备基础知识、Leetcode 题解、Java、C++、Python、后端面试、操作系统、计算机网络、系统设计
22,top-100-forks,jekyll-now,6287,25800,CSS,https://github.com/barryclark/jekyll-now,barryclark,162,2019-10-23T07:30:49Z,"Build a Jekyll blog in minutes, without touching the command line."
23,top-100-forks,patchwork,921,25750,HTML,https://github.com/jlord/patchwork,jlord,957,2019-10-23T10:57:17Z,All the Git-it Workshop completers! 
24,top-100-forks,Python-100-Days,65393,25073,Jupyter Notebook,https://github.com/jackfrued/Python-100-Days,jackfrued,227,2019-10-22T05:13:42Z,Python - 100天从新手到大师
25,top-100-forks,bitcoin,40511,24360,C++,https://github.com/bitcoin/bitcoin,bitcoin,1014,2019-10-23T10:41:39Z,Bitcoin Core integration/staging tree
26,top-100-forks,frontend-nanodegree-resume,1064,24313,JavaScript,https://github.com/udacity/frontend-nanodegree-resume,udacity,2,2019-08-28T19:07:42Z,This repository is used for one of the projects in Udacity's Front-End Web Developer Nanodegree program. Learn how to become a Front-End Developer today with line-by-line code reviewed projects and get a job with career services!
27,top-100-forks,freeCodeCamp,305725,22993,JavaScript,https://github.com/freeCodeCamp/freeCodeCamp,freeCodeCamp,306,2019-10-23T10:46:54Z,The https://www.freeCodeCamp.org open source codebase and curriculum. Learn to code for free together with millions of people.
28,top-100-forks,Complete-Python-3-Bootcamp,6138,22810,Jupyter Notebook,https://github.com/Pierian-Data/Complete-Python-3-Bootcamp,Pierian-Data,49,2019-10-15T15:32:21Z,Course Files for Complete Python 3 Bootcamp Course on Udemy
29,top-100-forks,recipes,65,22612,,https://github.com/LarryMad/recipes,LarryMad,2258,2019-10-20T20:32:22Z,
30,top-100-forks,vue,150776,22387,JavaScript,https://github.com/vuejs/vue,vuejs,393,2019-10-22T05:45:07Z,"🖖 Vue.js is a progressive, incrementally-adoptable JavaScript framework for building UI on the web."
31,top-100-forks,first-contributions,8387,22371,,https://github.com/firstcontributions/first-contributions,firstcontributions,1965,2019-10-23T10:28:15Z,🚀✨ Help beginners to contribute to open source projects
32,top-100-forks,You-Dont-Know-JS,110248,22019,,https://github.com/getify/You-Dont-Know-JS,getify,139,2019-10-22T16:21:43Z,A book series on JavaScript. @YDKJS on twitter.
33,top-100-forks,spring-framework,33037,21577,Java,https://github.com/spring-projects/spring-framework,spring-projects,1085,2019-10-23T10:35:31Z,Spring Framework
