rank,item,repo_name,stars,forks,language,repo_url,username,issues,last_commit,description
83,Java,storm,9056,1789,Java,https://github.com/nathanmarz/storm,nathanmarz,44,2017-08-16T04:24:20Z,"Distributed and fault-tolerant realtime computation: stream processing, continuous computation, distributed RPC, and more"
84,Java,vlayout,9053,1585,Java,https://github.com/alibaba/vlayout,alibaba,115,2019-02-01T07:26:09Z,"Project vlayout is a powerfull LayoutManager extension for RecyclerView, it provides a group of layouts for RecyclerView. Make it able to handle a complicate situation when grid, list and other layouts in the same recyclerview. "
85,Java,MaterialDesignLibrary,8973,2397,Java,https://github.com/navasmdc/MaterialDesignLibrary,navasmdc,265,2019-02-22T05:33:49Z,This is a library with components of Android L to you use in android 2.2
86,Java,GSYVideoPlayer,8958,2011,Java,https://github.com/CarGuo/GSYVideoPlayer,CarGuo,17,2019-02-24T09:07:40Z,"视频播放器（IJKplayer、ExoPlayer、MediaPlayer），HTTPS支持，支持弹幕，支持滤镜、水印、gif截图，片头广告、中间广告，多个同时播放，支持基本的拖动，声音、亮度调节，支持边播边缓存，支持视频本身自带rotation的旋转（90,270之类），重力旋转与手动旋转的同步支持，支持列表播放 ，直接添加控件为封面，列表全屏动画，视频加载速度，列表小窗口支持拖动，动画效果，调整比例，多分辨率切换，支持切换播放器，进度条小窗口预览，列表切换详情页面无缝播放，其他一些小动画效果，rtsp、concat、mpeg。项目解析： "
87,Java,Arduino,8925,6427,Java,https://github.com/arduino/Arduino,arduino,1082,2019-02-15T09:45:49Z,open-source electronics prototyping platform
88,Java,recyclerview-animators,8918,1751,Java,https://github.com/wasabeef/recyclerview-animators,wasabeef,98,2018-11-16T07:20:43Z,An Android Animation library which easily add itemanimator to RecyclerView items.
89,Java,ARouter,8886,1472,Java,https://github.com/alibaba/ARouter,alibaba,37,2019-02-16T04:42:00Z,💪 A framework for assisting in the renovation of Android componentization (帮助 Android App 进行组件化改造的路由框架)
90,Java,Matisse,8856,1316,Java,https://github.com/zhihu/Matisse,zhihu,247,2019-02-11T10:12:13Z,:fireworks: A well-designed local image and video selector for Android
91,Java,okhttp-OkGo,8815,2172,Java,https://github.com/jeasonlzy/okhttp-OkGo,jeasonlzy,338,2018-08-09T02:48:24Z,OkGo - 3.0 震撼来袭，该库是基于 Http 协议，封装了 OkHttp 的网络请求框架，比 Retrofit 更简单易用，支持 RxJava，RxJava2，支持自定义缓存，支持批量断点下载管理和批量上传管理功能
92,Java,Android-PullToRefresh,8771,5065,Java,https://github.com/chrisbanes/Android-PullToRefresh,chrisbanes,30,2017-10-13T08:40:58Z,DEPRECATED
93,Java,presto,8756,2967,Java,https://github.com/prestodb/presto,prestodb,1414,2019-02-24T05:10:05Z,Distributed SQL query engine for big data
94,Java,hadoop,8606,5391,Java,https://github.com/apache/hadoop,apache,209,2019-02-24T23:45:59Z,Mirror of Apache Hadoop
95,Java,PermissionsDispatcher,8588,1206,Java,https://github.com/permissions-dispatcher/PermissionsDispatcher,permissions-dispatcher,2,2019-02-25T03:21:33Z,Simple annotation-based API to handle runtime permissions.
96,Java,JiaoZiVideoPlayer,8557,2044,Java,https://github.com/lipangit/JiaoZiVideoPlayer,lipangit,68,2019-02-11T10:19:20Z,Android VideoPlayer MediaPlayer VideoView MediaView Float View And Fullscreen
97,Java,RxTool,8531,2144,Java,https://github.com/vondear/RxTool,vondear,118,2018-11-02T09:50:47Z,Android开发人员不得不收集的工具类集合 | 支付宝支付 | 微信支付（统一下单） | 微信分享 | Zip4j压缩（支持分卷压缩与加密） | 一键集成UCrop选择圆形头像 | 一键集成二维码和条形码的扫描与生成 | 常用Dialog | WebView的封装可播放视频 | 仿斗鱼滑动验证码 | Toast封装 | 震动 | GPS | Location定位 | 图片缩放 | Exif 图片添加地理位置信息（经纬度） | 蛛网等级 | 颜色选择器 | ArcGis | VTPK | 编译运行一下说不定会找到惊喜
98,Java,AVLoadingIndicatorView,8384,1668,Java,https://github.com/81813780/AVLoadingIndicatorView,81813780,65,2018-04-24T02:59:27Z,DEPRECATED
99,Java,AppIntro,8371,1527,Java,https://github.com/AppIntro/AppIntro,AppIntro,69,2019-02-24T22:37:02Z,Make a cool intro for your Android app.
100,Java,spring-boot-examples,8344,4581,Java,https://github.com/ityouknow/spring-boot-examples,ityouknow,14,2019-02-14T12:49:14Z,about learning Spring Boot via examples. Spring Boot 教程、技术栈示例代码，快速简单上手教程。 
1,JavaScript,freeCodeCamp,297551,20967,JavaScript,https://github.com/freeCodeCamp/freeCodeCamp,freeCodeCamp,4194,2019-02-25T02:48:25Z,The https://www.freeCodeCamp.org open source codebase and curriculum. Learn to code for free together with millions of people.
2,JavaScript,bootstrap,131066,64114,JavaScript,https://github.com/twbs/bootstrap,twbs,326,2019-02-24T21:26:43Z,"The most popular HTML, CSS, and JavaScript framework for developing responsive, mobile first projects on the web."
3,JavaScript,vue,128748,18342,JavaScript,https://github.com/vuejs/vue,vuejs,233,2019-02-25T03:28:07Z,"🖖 Vue.js is a progressive, incrementally-adoptable JavaScript framework for building UI on the web."
4,JavaScript,react,123078,22319,JavaScript,https://github.com/facebook/react,facebook,541,2019-02-24T18:15:57Z,"A declarative, efficient, and flexible JavaScript library for building user interfaces."
5,JavaScript,d3,82616,20411,JavaScript,https://github.com/d3/d3,d3,7,2019-02-22T22:59:07Z,"Bring data to life with SVG, Canvas and HTML. :bar_chart::chart_with_upwards_trend::tada:"
6,JavaScript,javascript,82064,15706,JavaScript,https://github.com/airbnb/javascript,airbnb,139,2019-02-24T19:47:53Z,JavaScript Style Guide
7,JavaScript,react-native,74333,16519,JavaScript,https://github.com/facebook/react-native,facebook,713,2019-02-25T03:48:26Z,A framework for building native apps with React.
8,JavaScript,create-react-app,64003,14105,JavaScript,https://github.com/facebook/create-react-app,facebook,353,2019-02-24T23:56:46Z,Set up a modern web app by running one command.
9,JavaScript,angular.js,59393,28926,JavaScript,https://github.com/angular/angular.js,angular,463,2019-02-23T06:33:22Z,AngularJS - HTML enhanced for web apps!
10,JavaScript,Font-Awesome,58894,9973,JavaScript,https://github.com/FortAwesome/Font-Awesome,FortAwesome,4767,2019-02-19T14:13:24Z,"The iconic SVG, font, and CSS toolkit"
11,JavaScript,node,58426,12938,JavaScript,https://github.com/nodejs/node,nodejs,854,2019-02-25T03:06:56Z,Node.js JavaScript runtime :sparkles::turtle::rocket::sparkles:
12,JavaScript,axios,55522,4309,JavaScript,https://github.com/axios/axios,axios,534,2019-02-24T14:43:26Z,Promise based HTTP client for the browser and node.js
13,JavaScript,jquery,50966,17722,JavaScript,https://github.com/jquery/jquery,jquery,82,2019-02-19T12:20:58Z,jQuery JavaScript Library
14,JavaScript,three.js,48933,18364,JavaScript,https://github.com/mrdoob/three.js,mrdoob,830,2019-02-25T02:18:12Z,JavaScript 3D library.
15,JavaScript,atom,47897,11113,JavaScript,https://github.com/atom/atom,atom,716,2019-02-23T16:27:46Z,:atom: The hackable text editor
16,JavaScript,webpack,47225,5955,JavaScript,https://github.com/webpack/webpack,webpack,506,2019-02-24T10:46:25Z,"A bundler for javascript and friends. Packs many modules into a few bundled assets. Code Splitting allows for loading parts of the application on demand. Through ""loaders"", modules can be CommonJs, AMD, ES6 modules, CSS, Images, JSON, Coffeescript, LESS, ... and your custom stuff."
17,JavaScript,redux,47054,11965,JavaScript,https://github.com/reduxjs/redux,reduxjs,30,2019-02-24T16:10:03Z,Predictable state container for JavaScript apps
18,JavaScript,puppeteer,45783,4001,JavaScript,https://github.com/GoogleChrome/puppeteer,GoogleChrome,341,2019-02-25T03:31:36Z,Headless Chrome Node API
19,JavaScript,socket.io,45279,8368,JavaScript,https://github.com/socketio/socket.io,socketio,360,2019-01-19T06:08:50Z,Realtime application framework (Node.JS server)
20,JavaScript,javascript-algorithms,45215,6150,JavaScript,https://github.com/trekhleb/javascript-algorithms,trekhleb,85,2019-02-22T03:48:22Z,📝 Algorithms and data structures implemented in JavaScript with explanations and links to further readings
21,JavaScript,reveal.js,44882,13001,JavaScript,https://github.com/hakimel/reveal.js,hakimel,412,2019-02-19T22:46:21Z,The HTML Presentation Framework
22,JavaScript,material-ui,44649,9217,JavaScript,https://github.com/mui-org/material-ui,mui-org,290,2019-02-25T00:39:45Z,React components that implement Google's Material Design.
23,JavaScript,Semantic-UI,44570,4743,JavaScript,https://github.com/Semantic-Org/Semantic-UI,Semantic-Org,844,2019-01-22T05:37:47Z,Semantic is a UI component framework based around useful principles from natural language.
24,JavaScript,express,42560,7269,JavaScript,https://github.com/expressjs/express,expressjs,177,2019-02-23T09:21:34Z,"Fast, unopinionated, minimalist web framework for node."
25,JavaScript,html5-boilerplate,42315,9999,JavaScript,https://github.com/h5bp/html5-boilerplate,h5bp,2,2019-02-21T05:29:13Z,"A professional front-end template for building fast, robust, and adaptable web apps or sites."
26,JavaScript,Chart.js,41945,9352,JavaScript,https://github.com/chartjs/Chart.js,chartjs,452,2019-02-25T03:57:37Z,Simple HTML5 Charts using the <canvas> tag
27,JavaScript,meteor,40806,5044,JavaScript,https://github.com/meteor/meteor,meteor,298,2019-02-24T06:51:17Z,"Meteor, the JavaScript App Platform"
28,JavaScript,moment,40255,6049,JavaScript,https://github.com/moment/moment,moment,279,2019-02-21T05:45:26Z,"Parse, validate, manipulate, and display dates in javascript."
29,JavaScript,resume.github.com,39694,1048,JavaScript,https://github.com/resume/resume.github.com,resume,36,2018-12-29T23:17:05Z,Resumes generated using the GitHub informations
30,JavaScript,30-seconds-of-code,39624,4301,JavaScript,https://github.com/30-seconds/30-seconds-of-code,30-seconds,10,2019-02-23T17:14:17Z,Curated collection of useful JavaScript snippets that you can understand in 30 seconds or less.
31,JavaScript,json-server,38343,3328,JavaScript,https://github.com/typicode/json-server,typicode,403,2019-02-21T14:40:12Z,Get a full fake REST API with zero coding in less than 30 seconds (seriously)
32,JavaScript,lodash,37533,3881,JavaScript,https://github.com/lodash/lodash,lodash,6,2019-02-22T03:30:26Z,"A modern JavaScript utility library delivering modularity, performance, & extras."
33,JavaScript,markdown-here,35743,6051,JavaScript,https://github.com/adam-p/markdown-here,adam-p,228,2018-11-13T20:35:39Z,"Google Chrome, Firefox, and Thunderbird extension that lets you write email in Markdown and render it before sending."
34,JavaScript,materialize,35144,4708,JavaScript,https://github.com/Dogfalo/materialize,Dogfalo,628,2019-02-18T07:08:36Z,"Materialize, a CSS Framework based on Material Design"
35,JavaScript,next.js,35108,3929,JavaScript,https://github.com/zeit/next.js,zeit,238,2019-02-24T21:08:40Z,The React Framework
36,JavaScript,react-router,34932,7217,JavaScript,https://github.com/ReactTraining/react-router,ReactTraining,61,2019-02-22T18:55:03Z,Declarative routing for React
37,JavaScript,yarn,34849,2084,JavaScript,https://github.com/yarnpkg/yarn,yarnpkg,1713,2019-02-23T12:25:04Z,"📦🐈 Fast, reliable, and secure dependency management."
38,JavaScript,impress.js,34519,6797,JavaScript,https://github.com/impress/impress.js,impress,52,2019-02-24T15:57:20Z,It's a presentation framework based on the power of CSS3 transforms and transitions in modern browsers and inspired by the idea behind prezi.com.
39,JavaScript,storybook,34214,2608,JavaScript,https://github.com/storybooks/storybook,storybooks,257,2019-02-25T01:04:11Z,"Interactive UI component dev & test: React, React Native, Vue, Angular, Ember"
40,JavaScript,Front-End-Checklist,33600,3198,JavaScript,https://github.com/thedaviddias/Front-End-Checklist,thedaviddias,6,2019-02-23T19:45:49Z,🗂 The perfect Front-End Checklist for modern websites and meticulous developers
41,JavaScript,hacker-scripts,32801,5698,JavaScript,https://github.com/NARKOZ/hacker-scripts,NARKOZ,52,2018-10-09T05:16:03Z,Based on a true story
42,JavaScript,incubator-echarts,32573,9450,JavaScript,https://github.com/apache/incubator-echarts,apache,3204,2019-02-24T20:12:04Z,"A powerful, interactive charting and visualization library for browser"
43,JavaScript,babel,32039,3341,JavaScript,https://github.com/babel/babel,babel,799,2019-02-25T03:39:47Z,🐠 Babel is a compiler for writing next generation JavaScript.
44,JavaScript,gatsby,31932,4293,JavaScript,https://github.com/gatsbyjs/gatsby,gatsbyjs,542,2019-02-25T03:43:56Z,"Build blazing fast, modern apps and websites with React"
45,JavaScript,gulp,30944,4404,JavaScript,https://github.com/gulpjs/gulp,gulpjs,23,2018-12-28T09:21:01Z,The streaming build system
46,JavaScript,prettier,30475,1615,JavaScript,https://github.com/prettier/prettier,prettier,554,2019-02-24T12:10:47Z,Prettier is an opinionated code formatter.
47,JavaScript,parcel,29989,1348,JavaScript,https://github.com/parcel-bundler/parcel,parcel-bundler,646,2019-02-24T17:19:20Z,"📦🚀 Blazing fast, zero configuration web application bundler"
48,JavaScript,anime,29874,2146,JavaScript,https://github.com/juliangarnier/anime,juliangarnier,67,2019-02-17T17:08:56Z,JavaScript animation engine
49,JavaScript,jQuery-File-Upload,29733,7934,JavaScript,https://github.com/blueimp/jQuery-File-Upload,blueimp,53,2019-02-04T21:14:18Z,"File Upload widget with multiple file selection, drag&drop support, progress bar, validation and preview images, audio and video for jQuery. Supports cross-domain, chunked and resumable file uploads. Works with any server-side platform (Google App Engine, PHP, Python, Ruby on Rails, Java, etc.) that supports standard HTML form file uploads."
50,JavaScript,brackets,29570,6393,JavaScript,https://github.com/adobe/brackets,adobe,2395,2019-02-21T10:06:09Z,"An open source code editor for the web, written in JavaScript, HTML and CSS."
51,JavaScript,awesome-selfhosted,29538,2397,JavaScript,https://github.com/Kickball/awesome-selfhosted,Kickball,52,2019-02-24T20:04:25Z,This is a list of Free Software network services and web applications which can be hosted locally. Selfhosting is the process of locally hosting and managing applications instead of renting from SaaS providers.
52,JavaScript,Ghost,29083,6247,JavaScript,https://github.com/TryGhost/Ghost,TryGhost,97,2019-02-25T03:40:36Z,The platform for professional publishers
53,JavaScript,serverless,28320,3109,JavaScript,https://github.com/serverless/serverless,serverless,439,2019-02-22T22:06:12Z,"Serverless Framework – Build web, mobile and IoT applications with serverless architectures using AWS Lambda, Azure Functions, Google CloudFunctions & more! – "
54,JavaScript,pm2,28171,1935,JavaScript,https://github.com/Unitech/pm2,Unitech,624,2019-02-20T09:04:44Z,Node.js Production Process Manager with a built-in Load Balancer.
55,JavaScript,hyper,27591,2243,JavaScript,https://github.com/zeit/hyper,zeit,710,2019-02-23T07:14:26Z,A terminal built on web technologies
56,JavaScript,backbone,27393,5721,JavaScript,https://github.com/jashkenas/backbone,jashkenas,81,2019-02-19T18:36:16Z,"Give your JS App some Backbone with Models, Views, Collections, and Events"
57,JavaScript,immutable-js,26558,1560,JavaScript,https://github.com/immutable-js/immutable-js,immutable-js,117,2019-02-19T19:36:45Z,Immutable persistent data collections for Javascript which increase efficiency and simplicity.
58,JavaScript,awesome-mac,26280,3098,JavaScript,https://github.com/jaywcjlove/awesome-mac,jaywcjlove,35,2019-02-24T07:50:18Z," Now we have become very big, Different from the original idea. Collect premium software in various categories."
59,JavaScript,33-js-concepts,26108,2387,JavaScript,https://github.com/leonardomso/33-js-concepts,leonardomso,5,2019-02-23T21:19:56Z,📜 33 concepts every JavaScript developer should know.
60,JavaScript,slate,26106,15899,JavaScript,https://github.com/lord/slate,lord,36,2019-02-19T21:19:42Z,Beautiful static documentation for your API
61,JavaScript,tech-interview-handbook,25992,3398,JavaScript,https://github.com/yangshun/tech-interview-handbook,yangshun,5,2019-01-28T20:59:00Z,"💯 Algorithms study materials, behavioral content and tips for rocking your coding interview"
62,JavaScript,fullPage.js,25950,6279,JavaScript,https://github.com/alvarotrigo/fullPage.js,alvarotrigo,143,2019-02-22T15:49:30Z,fullPage plugin by Alvaro Trigo. Create full screen pages fast and simple
63,JavaScript,hackathon-starter,25870,5187,JavaScript,https://github.com/sahat/hackathon-starter,sahat,14,2019-02-24T23:51:20Z,A boilerplate for Node.js web applications
64,JavaScript,nodebestpractices,25649,1918,JavaScript,https://github.com/i0natan/nodebestpractices,i0natan,63,2019-02-25T00:40:52Z,The largest Node.js best practices list (February 2019)
65,JavaScript,pdf.js,25519,6137,JavaScript,https://github.com/mozilla/pdf.js,mozilla,625,2019-02-24T18:46:09Z,PDF Reader in JavaScript
66,JavaScript,hexo,25383,3422,JavaScript,https://github.com/hexojs/hexo,hexojs,235,2019-02-21T14:51:08Z,"A fast, simple & powerful blog framework, powered by Node.js."
67,JavaScript,async,25257,2298,JavaScript,https://github.com/caolan/async,caolan,14,2019-02-20T18:45:17Z,Async utilities for node and the browser
68,JavaScript,clipboard.js,25143,2848,JavaScript,https://github.com/zenorocha/clipboard.js,zenorocha,46,2019-02-22T14:31:30Z,:scissors: Modern copy to clipboard. No Flash. Just 3kb gzipped :clipboard:
69,JavaScript,koa,25074,2268,JavaScript,https://github.com/koajs/koa,koajs,43,2019-02-14T05:17:36Z,Expressive middleware for node.js using ES2017 async functions
70,JavaScript,todomvc,25003,13304,JavaScript,https://github.com/tastejs/todomvc,tastejs,156,2019-02-12T23:33:49Z,"Helping you select an MV* framework - Todo apps for React.js, Ember.js, Angular, and many more"
71,JavaScript,nylas-mail,24270,1352,JavaScript,https://github.com/nylas/nylas-mail,nylas,1045,2019-01-10T07:27:22Z,:love_letter: An extensible desktop mail app built on the modern web.  Forks welcome!
72,JavaScript,underscore,24205,5371,JavaScript,https://github.com/jashkenas/underscore,jashkenas,117,2019-01-26T23:23:17Z,JavaScript's utility _ belt
73,JavaScript,Leaflet,24108,3967,JavaScript,https://github.com/Leaflet/Leaflet,Leaflet,387,2019-02-22T07:37:34Z, :leaves: JavaScript library for mobile-friendly interactive maps
74,JavaScript,video.js,24096,5868,JavaScript,https://github.com/videojs/video.js,videojs,189,2019-02-24T19:03:54Z,Video.js - open source HTML5 & Flash video player
75,JavaScript,phaser,23978,5867,JavaScript,https://github.com/photonstorm/phaser,photonstorm,203,2019-02-24T23:37:04Z,"Phaser is a fun, free and fast 2D game framework for making HTML5 games for desktop and mobile web browsers, supporting Canvas and WebGL rendering."
76,JavaScript,jest,23823,3249,JavaScript,https://github.com/facebook/jest,facebook,552,2019-02-25T01:42:41Z,Delightful JavaScript Testing.
77,JavaScript,Modernizr,23413,3028,JavaScript,https://github.com/Modernizr/Modernizr,Modernizr,194,2019-02-22T14:01:25Z,Modernizr is a JavaScript library that detects HTML5 and CSS3 features in the user’s browser.
78,JavaScript,slick,23403,4612,JavaScript,https://github.com/kenwheeler/slick,kenwheeler,1043,2019-02-20T16:43:52Z,the last carousel you'll ever need
79,JavaScript,select2,23281,5471,JavaScript,https://github.com/select2/select2,select2,472,2019-02-20T20:01:26Z,"Select2 is a jQuery based replacement for select boxes. It supports searching, remote data sets, and infinite scrolling of results."
80,JavaScript,incubator-superset,23227,4281,JavaScript,https://github.com/apache/incubator-superset,apache,1095,2019-02-24T20:20:50Z,"Apache Superset (incubating) is a modern, enterprise-ready business intelligence web application"
81,JavaScript,awesome-react-native,23185,2837,JavaScript,https://github.com/jondot/awesome-react-native,jondot,35,2019-02-22T19:32:13Z,"Awesome React Native components, news, tools, and learning material!"
82,JavaScript,realworld,23076,1532,JavaScript,https://github.com/gothinkster/realworld,gothinkster,123,2019-02-24T17:54:36Z,"""The mother of all demo apps"" — Exemplary fullstack Medium.com clone powered by React, Angular, Node, Django, and many more 🏅"
83,JavaScript,styled-components,22289,1335,JavaScript,https://github.com/styled-components/styled-components,styled-components,91,2019-02-24T02:19:05Z,Visual primitives for the component age. Use the best bits of ES6 and CSS to style your apps without stress 💅
84,JavaScript,mermaid,22285,1301,JavaScript,https://github.com/knsv/mermaid,knsv,246,2019-02-21T20:10:26Z,Generation of diagram and flowchart from text in a similar manner as markdown
85,JavaScript,clean-code-javascript,22043,2313,JavaScript,https://github.com/ryanmcdermott/clean-code-javascript,ryanmcdermott,26,2019-02-11T01:11:05Z,:bathtub: Clean Code concepts adapted for JavaScript
86,JavaScript,pixi.js,22017,3177,JavaScript,https://github.com/pixijs/pixi.js,pixijs,69,2019-02-24T23:49:26Z,"The HTML5 Creation Engine: Create beautiful digital content with the fastest, most flexible 2D WebGL renderer."
87,JavaScript,request,21875,2591,JavaScript,https://github.com/request/request,request,295,2019-02-21T07:15:54Z,🏊🏾 Simplified HTTP request client.
88,JavaScript,quill,21655,1595,JavaScript,https://github.com/quilljs/quill,quilljs,564,2019-02-12T19:58:07Z,Quill is a modern WYSIWYG editor built for compatibility and extensibility.
89,JavaScript,preact,21635,1111,JavaScript,https://github.com/developit/preact,developit,189,2019-02-20T19:04:16Z,⚛️ Fast 3kB React alternative with the same modern API. Components & Virtual DOM.
90,JavaScript,Rocket.Chat,21629,4670,JavaScript,https://github.com/RocketChat/Rocket.Chat,RocketChat,2091,2019-02-25T01:40:59Z,"Have your own Slack like online chat, built with Meteor."
91,JavaScript,react-boilerplate,21476,4207,JavaScript,https://github.com/react-boilerplate/react-boilerplate,react-boilerplate,16,2019-02-24T19:50:03Z,":fire: A highly scalable, offline-first foundation with the best developer experience and a focus on performance and best practices."
92,JavaScript,fetch,21430,1950,JavaScript,https://github.com/github/fetch,github,11,2019-01-02T11:28:34Z,A window.fetch JavaScript polyfill.
93,JavaScript,500lines,20994,4813,JavaScript,https://github.com/aosabook/500lines,aosabook,47,2018-10-19T15:15:57Z,500 Lines or Less
94,JavaScript,ember.js,20658,4117,JavaScript,https://github.com/emberjs/ember.js,emberjs,275,2019-02-24T05:38:44Z,Ember.js - A JavaScript framework for creating ambitious web applications
95,JavaScript,standard,20488,1545,JavaScript,https://github.com/standard/standard,standard,84,2019-02-18T17:20:13Z,"🌟 JavaScript Style Guide, with linter & automatic code fixer"
96,JavaScript,postcss,20298,1122,JavaScript,https://github.com/postcss/postcss,postcss,15,2019-02-25T03:13:17Z,Transforming styles with JS plugins
97,JavaScript,sails,20265,1835,JavaScript,https://github.com/balderdashy/sails,balderdashy,201,2019-01-31T04:52:04Z,Realtime MVC Framework for Node.js
98,JavaScript,gitbook,20221,2826,JavaScript,https://github.com/GitbookIO/gitbook,GitbookIO,999,2019-01-29T03:54:48Z,📝 Modern documentation format and toolchain using Git and Markdown
99,JavaScript,hammer.js,19733,2522,JavaScript,https://github.com/hammerjs/hammer.js,hammerjs,262,2018-06-07T10:29:26Z,A javascript library for multi-touch gestures :// You can touch this
100,JavaScript,RxJS,19570,2275,JavaScript,https://github.com/Reactive-Extensions/RxJS,Reactive-Extensions,288,2018-04-18T20:17:39Z,The Reactive Extensions for JavaScript
1,Lua,kong,20406,2448,Lua,https://github.com/Kong/kong,Kong,300,2019-02-24T22:10:39Z,:gorilla: The Cloud-Native API Gateway & Service Mesh
2,Lua,neural-style,16571,2511,Lua,https://github.com/jcjohnson/neural-style,jcjohnson,311,2018-02-23T01:21:20Z,Torch implementation of neural style algorithm
3,Lua,waifu2x,13275,1511,Lua,https://github.com/nagadomi/waifu2x,nagadomi,76,2019-01-16T16:54:03Z,Image Super-Resolution for Anime-Style Art
4,Lua,openface,11625,2801,Lua,https://github.com/cmusatyalab/openface,cmusatyalab,7,2018-12-09T13:46:40Z,Face recognition with deep neural networks.
5,Lua,char-rnn,9065,2222,Lua,https://github.com/karpathy/char-rnn,karpathy,105,2018-05-04T15:25:25Z,"Multi-layer Recurrent Neural Networks (LSTM, GRU, RNN) for character-level language models in Torch"
6,Lua,CycleGAN,7994,1260,Lua,https://github.com/junyanz/CycleGAN,junyanz,27,2018-12-11T19:28:43Z,"Software that can generate photos from paintings,  turn horses into zebras,  perform style transfer, and more."
7,Lua,pix2pix,5818,946,Lua,https://github.com/phillipi/pix2pix,phillipi,45,2018-12-11T19:25:36Z,Image-to-image translation with conditional adversarial nets
8,Lua,dockercraft,5123,301,Lua,https://github.com/docker/dockercraft,docker,13,2018-06-18T12:15:21Z,Docker + Minecraft = Dockercraft
9,Lua,koreader,4660,615,Lua,https://github.com/koreader/koreader,koreader,342,2019-02-24T20:40:28Z,"An ebook reader application supporting PDF, DjVu, EPUB, FB2 and many more formats, running on Kindle, Kobo, PocketBook, Ubuntu Touch and Android devices"
10,Lua,VeryNginx,4577,707,Lua,https://github.com/alexazhou/VeryNginx,alexazhou,82,2019-02-01T11:43:45Z," A very powerful and friendly  nginx base on lua-nginx-module( openresty ) which provide WAF, Control Panel, and Dashboards. "
