rank,item,repo_name,stars,forks,language,repo_url,username,issues,last_commit,description
1,top-100-stars,freeCodeCamp,297140,20821,JavaScript,https://github.com/freeCodeCamp/freeCodeCamp,freeCodeCamp,4924,2019-01-29T21:06:26Z,The https://www.freeCodeCamp.org open source codebase and curriculum. Learn to code for free together with millions of people.
2,top-100-stars,bootstrap,130362,63937,CSS,https://github.com/twbs/bootstrap,twbs,314,2019-01-30T01:47:51Z,"The most popular HTML, CSS, and JavaScript framework for developing responsive, mobile first projects on the web."
3,top-100-stars,react,121008,21907,JavaScript,https://github.com/facebook/react,facebook,534,2019-01-30T01:48:57Z,"A declarative, efficient, and flexible JavaScript library for building user interfaces."
4,top-100-stars,free-programming-books,116777,29389,,https://github.com/EbookFoundation/free-programming-books,EbookFoundation,22,2019-01-29T16:41:46Z,:books: Freely available programming books
5,top-100-stars,awesome,100841,13362,,https://github.com/sindresorhus/awesome,sindresorhus,186,2019-01-29T13:17:56Z,:sunglasses: Curated list of awesome lists
6,top-100-stars,You-Dont-Know-JS,95524,18509,,https://github.com/getify/You-Dont-Know-JS,getify,220,2019-01-23T07:16:49Z,A book series on JavaScript. @YDKJS on twitter.
7,top-100-stars,oh-my-zsh,82685,16010,Shell,https://github.com/robbyrussell/oh-my-zsh,robbyrussell,1010,2019-01-30T02:15:52Z,"A delightful community-driven (with 1,200+ contributors) framework for managing your zsh configuration. Includes 200+ optional plugins (rails, git, OSX, hub, capistrano, brew, ant, php, python, etc), over 140 themes to spice up your morning, and an auto-update tool so that makes it easy to keep up with the latest updates from the community."
8,top-100-stars,d3,82050,20325,JavaScript,https://github.com/d3/d3,d3,7,2019-01-28T17:59:45Z,"Bring data to life with SVG, Canvas and HTML. :bar_chart::chart_with_upwards_trend::tada:"
9,top-100-stars,gitignore,78324,37404,,https://github.com/github/gitignore,github,67,2019-01-29T20:47:20Z,A collection of useful .gitignore templates
10,top-100-stars,electron,69477,9021,C++,https://github.com/electron/electron,electron,1136,2019-01-30T02:09:03Z,":electron: Build cross-platform desktop apps with JavaScript, HTML, and CSS"
11,top-100-stars,linux,68769,24750,C,https://github.com/torvalds/linux,torvalds,252,2019-01-30T01:25:02Z,Linux kernel source tree
12,top-100-stars,vscode,68161,9101,TypeScript,https://github.com/Microsoft/vscode,Microsoft,4854,2019-01-30T03:54:22Z,Visual Studio Code
13,top-100-stars,create-react-app,62796,13782,JavaScript,https://github.com/facebook/create-react-app,facebook,344,2019-01-29T13:28:10Z,Set up a modern web app by running one command.
14,top-100-stars,awesome-python,60861,11827,Python,https://github.com/vinta/awesome-python,vinta,449,2019-01-29T04:32:24Z,"A curated list of awesome Python frameworks, libraries, software and resources"
15,top-100-stars,angular.js,59369,28948,JavaScript,https://github.com/angular/angular.js,angular,459,2019-01-26T10:32:23Z,AngularJS - HTML enhanced for web apps!
16,top-100-stars,Font-Awesome,58626,9944,JavaScript,https://github.com/FortAwesome/Font-Awesome,FortAwesome,4720,2019-01-28T22:41:45Z,"The iconic SVG, font, and CSS toolkit"
17,top-100-stars,node,57720,12778,JavaScript,https://github.com/nodejs/node,nodejs,831,2019-01-30T02:36:33Z,Node.js JavaScript runtime :sparkles::turtle::rocket::sparkles:
18,top-100-stars,system-design-primer,55780,8065,Python,https://github.com/donnemartin/system-design-primer,donnemartin,69,2019-01-24T18:20:07Z,Learn how to design large-scale systems. Prep for the system design interview.  Includes Anki flashcards.
19,top-100-stars,axios,54336,4214,JavaScript,https://github.com/axios/axios,axios,520,2019-01-26T00:24:48Z,Promise based HTTP client for the browser and node.js
20,top-100-stars,go,52556,7232,Go,https://github.com/golang/go,golang,4171,2019-01-30T01:57:13Z,The Go programming language
21,top-100-stars,moby,52029,15078,Go,https://github.com/moby/moby,moby,3587,2019-01-28T21:06:07Z,Moby Project - a collaborative project for the container ecosystem to assemble container-based systems
22,top-100-stars,flutter,51933,5442,Dart,https://github.com/flutter/flutter,flutter,4252,2019-01-30T03:58:07Z,Flutter makes it easy and fast to build beautiful mobile apps.
23,top-100-stars,jquery,50841,17661,JavaScript,https://github.com/jquery/jquery,jquery,88,2019-01-29T13:13:54Z,jQuery JavaScript Library
24,top-100-stars,laravel,48826,15165,PHP,https://github.com/laravel/laravel,laravel,27,2019-01-29T22:04:40Z,A PHP framework for web artisans
25,top-100-stars,CS-Notes,48443,14933,,https://github.com/CyC2018/CS-Notes,CyC2018,0,2019-01-29T14:51:19Z,:books: 技术面试必备基础知识
26,top-100-stars,three.js,48379,18184,JavaScript,https://github.com/mrdoob/three.js,mrdoob,796,2019-01-30T03:19:28Z,JavaScript 3D library.
27,top-100-stars,models,47810,29163,Python,https://github.com/tensorflow/models,tensorflow,1365,2019-01-30T00:10:48Z,Models and examples built with TensorFlow
28,top-100-stars,atom,47648,10879,JavaScript,https://github.com/atom/atom,atom,723,2019-01-30T00:48:18Z,:atom: The hackable text editor
29,top-100-stars,kubernetes,47555,16511,Go,https://github.com/kubernetes/kubernetes,kubernetes,3130,2019-01-30T03:38:53Z,Production-Grade Container Scheduling and Management
30,top-100-stars,public-apis,46921,4877,Python,https://github.com/toddmotto/public-apis,toddmotto,4,2019-01-28T18:17:23Z,A collective list of free APIs for use in software and web development.
31,top-100-stars,webpack,46770,5915,JavaScript,https://github.com/webpack/webpack,webpack,488,2019-01-29T18:23:03Z,"A bundler for javascript and friends. Packs many modules into a few bundled assets. Code Splitting allows for loading parts of the application on demand. Through ""loaders"", modules can be CommonJs, AMD, ES6 modules, CSS, Images, JSON, Coffeescript, LESS, ... and your custom stuff."
32,top-100-stars,youtube-dl,46685,8102,Python,https://github.com/rg3/youtube-dl,rg3,2629,2019-01-29T23:21:24Z,Command-line program to download videos from YouTube.com and other video sites
33,top-100-stars,redux,46548,11823,JavaScript,https://github.com/reduxjs/redux,reduxjs,30,2019-01-29T03:04:50Z,Predictable state container for JavaScript apps
34,top-100-stars,swift,46501,7361,C++,https://github.com/apple/swift,apple,461,2019-01-30T03:47:06Z,The Swift Programming Language
35,top-100-stars,socket.io,45043,8334,JavaScript,https://github.com/socketio/socket.io,socketio,354,2019-01-19T06:08:50Z,Realtime application framework (Node.JS server)
36,top-100-stars,angular,44802,11609,TypeScript,https://github.com/angular/angular,angular,2635,2019-01-30T02:30:50Z,One framework. Mobile & desktop.
37,top-100-stars,puppeteer,44752,3870,JavaScript,https://github.com/GoogleChrome/puppeteer,GoogleChrome,268,2019-01-29T01:19:54Z,Headless Chrome Node API
38,top-100-stars,free-programming-books-zh_CN,44746,14988,JavaScript,https://github.com/justjavac/free-programming-books-zh_CN,justjavac,151,2018-12-23T11:54:19Z,:books: 免费的计算机编程类中文书籍，欢迎投稿
39,top-100-stars,reveal.js,44450,12824,JavaScript,https://github.com/hakimel/reveal.js,hakimel,406,2019-01-29T15:40:58Z,The HTML Presentation Framework
40,top-100-stars,TypeScript,44356,6245,TypeScript,https://github.com/Microsoft/TypeScript,Microsoft,3430,2019-01-30T01:45:43Z,TypeScript is a superset of JavaScript that compiles to clean JavaScript output.
41,top-100-stars,Semantic-UI,44315,4725,JavaScript,https://github.com/Semantic-Org/Semantic-UI,Semantic-Org,830,2019-01-22T05:37:47Z,Semantic is a UI component framework based around useful principles from natural language.
42,top-100-stars,material-ui,44007,8937,JavaScript,https://github.com/mui-org/material-ui,mui-org,308,2019-01-30T00:03:19Z,React components that implement Google's Material Design.
43,top-100-stars,java-design-patterns,43968,14260,Java,https://github.com/iluwatar/java-design-patterns,iluwatar,184,2019-01-19T06:50:32Z,Design patterns implemented in Java
44,top-100-stars,javascript-algorithms,43568,5876,JavaScript,https://github.com/trekhleb/javascript-algorithms,trekhleb,67,2019-01-28T12:57:14Z,📝 Algorithms and data structures implemented in JavaScript with explanations and links to further readings
45,top-100-stars,express,42133,7238,JavaScript,https://github.com/expressjs/express,expressjs,165,2019-01-24T19:53:03Z,"Fast, unopinionated, minimalist web framework for node."
46,top-100-stars,html5-boilerplate,42045,9970,JavaScript,https://github.com/h5bp/html5-boilerplate,h5bp,7,2019-01-29T16:09:40Z,"A professional front-end template for building fast, robust, and adaptable web apps or sites."
47,top-100-stars,rails,41991,16959,Ruby,https://github.com/rails/rails,rails,1081,2019-01-30T03:58:45Z,Ruby on Rails
48,top-100-stars,ant-design,41900,14122,TypeScript,https://github.com/ant-design/ant-design,ant-design,317,2019-01-30T03:45:01Z,🌈 A UI Design Language
49,top-100-stars,awesome-vue,41888,5804,,https://github.com/vuejs/awesome-vue,vuejs,74,2019-01-29T22:01:59Z,🎉 A curated list of awesome things related to Vue.js
50,top-100-stars,build-your-own-x,41832,2717,,https://github.com/danistefanovic/build-your-own-x,danistefanovic,2,2019-01-13T10:29:36Z,🤓 Build your own (insert technology here)
51,top-100-stars,flask,41592,11881,Python,https://github.com/pallets/flask,pallets,41,2019-01-25T13:56:55Z,The Python micro framework for building web applications.
52,top-100-stars,Chart.js,41526,9308,JavaScript,https://github.com/chartjs/Chart.js,chartjs,462,2019-01-30T01:58:49Z,Simple HTML5 Charts using the <canvas> tag
53,top-100-stars,meteor,40729,5035,JavaScript,https://github.com/meteor/meteor,meteor,276,2019-01-23T08:30:12Z,"Meteor, the JavaScript App Platform"
54,top-100-stars,thefuck,40487,2007,Python,https://github.com/nvbn/thefuck,nvbn,140,2019-01-20T06:02:28Z,Magnificent app which corrects your previous console command.
55,top-100-stars,moment,39997,5994,JavaScript,https://github.com/moment/moment,moment,252,2019-01-29T19:21:35Z,"Parse, validate, manipulate, and display dates in javascript."
56,top-100-stars,httpie,39568,2600,Python,https://github.com/jakubroztocil/httpie,jakubroztocil,143,2019-01-21T16:44:26Z,"As easy as httpie /aitch-tee-tee-pie/ 🥧 Modern command line HTTP client – user-friendly curl alternative with intuitive UI, JSON support, syntax highlighting, wget-like downloads, extensions, etc.  https://twitter.com/clihttp"
57,top-100-stars,awesome-go,39436,5126,Go,https://github.com/avelino/awesome-go,avelino,25,2019-01-29T19:51:24Z,"A curated list of awesome Go frameworks, libraries and software"
58,top-100-stars,resume.github.com,39193,1043,JavaScript,https://github.com/resume/resume.github.com,resume,37,2018-12-29T23:17:05Z,Resumes generated using the GitHub informations
59,top-100-stars,django,39173,16888,Python,https://github.com/django/django,django,179,2019-01-30T03:55:32Z,The Web framework for perfectionists with deadlines.
60,top-100-stars,Front-end-Developer-Interview-Questions,38973,7974,HTML,https://github.com/h5bp/Front-end-Developer-Interview-Questions,h5bp,39,2019-01-09T11:57:38Z,"A list of helpful front-end related questions you can use to interview potential candidates, test yourself or completely ignore."
61,top-100-stars,the-art-of-command-line,38620,3826,,https://github.com/jlevy/the-art-of-command-line,jlevy,106,2019-01-15T03:04:39Z,"Master the command line, in one page"
62,top-100-stars,elasticsearch,38023,12752,Java,https://github.com/elastic/elasticsearch,elastic,1901,2019-01-30T03:42:27Z,"Open Source, Distributed, RESTful Search Engine"
63,top-100-stars,30-seconds-of-code,37960,4064,JavaScript,https://github.com/30-seconds/30-seconds-of-code,30-seconds,7,2019-01-26T06:09:46Z,Curated collection of useful JavaScript snippets that you can understand in 30 seconds or less.
64,top-100-stars,awesome-machine-learning,37862,9342,Python,https://github.com/josephmisiti/awesome-machine-learning,josephmisiti,0,2019-01-25T14:31:31Z,"A curated list of awesome Machine Learning frameworks, libraries and software."
65,top-100-stars,keras,37819,14434,Python,https://github.com/keras-team/keras,keras-team,2101,2019-01-30T01:50:28Z,Deep Learning for humans
66,top-100-stars,json-server,37791,3277,JavaScript,https://github.com/typicode/json-server,typicode,398,2019-01-27T10:54:14Z,Get a full fake REST API with zero coding in less than 30 seconds (seriously)
67,top-100-stars,computer-science,37468,5390,,https://github.com/ossu/computer-science,ossu,39,2019-01-28T15:27:21Z,:mortar_board: Path to a free self-taught education in Computer Science!
68,top-100-stars,lodash,37090,3837,JavaScript,https://github.com/lodash/lodash,lodash,6,2019-01-28T15:53:29Z,"A modern JavaScript utility library delivering modularity, performance, & extras."
69,top-100-stars,material-design-icons,37032,7481,CSS,https://github.com/google/material-design-icons,google,533,2019-01-10T14:39:30Z,Material Design icons by Google
70,top-100-stars,bitcoin,36952,22003,C++,https://github.com/bitcoin/bitcoin,bitcoin,901,2019-01-30T02:54:54Z,Bitcoin Core integration/staging tree
71,top-100-stars,requests,36936,6740,Python,https://github.com/requests/requests,requests,154,2019-01-21T20:20:00Z,Python HTTP Requests for Humans™ ✨🍰✨
72,top-100-stars,ionic,36805,12830,HTML,https://github.com/ionic-team/ionic,ionic-team,367,2019-01-29T21:08:53Z,Build amazing native and progressive web apps with open web technologies. One app running on everything 🎉
73,top-100-stars,every-programmer-should-know,36308,3278,,https://github.com/mtdvio/every-programmer-should-know,mtdvio,26,2019-01-29T09:50:24Z,A collection of (mostly) technical things every software developer should know
74,top-100-stars,node-v0.x-archive,35623,7844,,https://github.com/nodejs/node-v0.x-archive,nodejs,571,2018-04-04T08:28:02Z,Moved to https://github.com/nodejs/node
75,top-100-stars,markdown-here,35106,5939,JavaScript,https://github.com/adam-p/markdown-here,adam-p,225,2018-11-13T20:35:39Z,"Google Chrome, Firefox, and Thunderbird extension that lets you write email in Markdown and render it before sending."
76,top-100-stars,netdata,35077,3031,C,https://github.com/netdata/netdata,netdata,498,2019-01-29T21:31:50Z,"Real-time performance monitoring, done right! https://my-netdata.io/"
77,top-100-stars,ansible,35073,14179,Python,https://github.com/ansible/ansible,ansible,5571,2019-01-30T03:48:13Z,"Ansible is a radically simple IT automation platform that makes your applications and systems easier to deploy. Avoid writing scripts or custom code to deploy and update your applications — automate in a language that approaches plain English, using SSH, with no agents to install on remote systems. https://docs.ansible.com/ansible/"
78,top-100-stars,nw.js,34961,3797,C++,https://github.com/nwjs/nw.js,nwjs,725,2019-01-29T23:40:44Z,Call all Node.js modules directly from DOM/WebWorker and enable a new way of writing applications with all Web technologies.
79,top-100-stars,materialize,34958,4697,JavaScript,https://github.com/Dogfalo/materialize,Dogfalo,609,2019-01-27T13:59:29Z,"Materialize, a CSS Framework based on Material Design"
80,top-100-stars,element,34754,6908,Vue,https://github.com/ElemeFE/element,ElemeFE,765,2019-01-30T03:59:07Z,A Vue.js 2.0 UI Toolkit for Web
81,top-100-stars,yarn,34618,2055,JavaScript,https://github.com/yarnpkg/yarn,yarnpkg,1670,2019-01-29T22:38:05Z,"📦🐈 Fast, reliable, and secure dependency management."
82,top-100-stars,impress.js,34438,6796,JavaScript,https://github.com/impress/impress.js,impress,53,2019-01-23T09:03:25Z,It's a presentation framework based on the power of CSS3 transforms and transitions in modern browsers and inspired by the idea behind prezi.com.
83,top-100-stars,next.js,34096,3765,JavaScript,https://github.com/zeit/next.js,zeit,202,2019-01-29T20:19:18Z,The React Framework
84,top-100-stars,redis,34052,13028,C,https://github.com/antirez/redis,antirez,2077,2019-01-30T03:13:42Z,"Redis is an in-memory database that persists on disk. The data model is key-value, but many different kind of values are supported: Strings, Lists, Sets, Sorted Sets, Hashes, HyperLogLogs, Bitmaps."
85,top-100-stars,normalize.css,33831,6856,CSS,https://github.com/necolas/normalize.css,necolas,17,2019-01-03T11:33:37Z,A modern alternative to CSS resets
86,top-100-stars,spring-boot,33678,22605,Java,https://github.com/spring-projects/spring-boot,spring-projects,398,2019-01-29T14:56:53Z,Spring Boot
87,top-100-stars,rust,33673,5495,Rust,https://github.com/rust-lang/rust,rust-lang,4663,2019-01-30T03:44:18Z,Empowering everyone to build reliable and efficient software.
88,top-100-stars,storybook,33467,2514,JavaScript,https://github.com/storybooks/storybook,storybooks,217,2019-01-30T02:49:46Z,"Interactive UI component dev & test: React, React Native, Vue, Angular, Ember"
89,top-100-stars,Front-End-Checklist,33204,3153,JavaScript,https://github.com/thedaviddias/Front-End-Checklist,thedaviddias,3,2019-01-29T21:48:26Z,🗂 The perfect Front-End Checklist for modern websites and meticulous developers
90,top-100-stars,hacker-scripts,32701,5696,JavaScript,https://github.com/NARKOZ/hacker-scripts,NARKOZ,52,2018-10-09T05:16:03Z,Based on a true story
91,top-100-stars,bulma,32616,2574,CSS,https://github.com/jgthms/bulma,jgthms,299,2019-01-25T08:17:09Z,Modern CSS framework based on Flexbox
92,top-100-stars,nvm,32451,3098,Shell,https://github.com/creationix/nvm,creationix,278,2019-01-27T00:43:16Z,Node Version Manager - Simple bash script to manage multiple active node.js versions
93,top-100-stars,shadowsocks-windows,32444,11455,C#,https://github.com/shadowsocks/shadowsocks-windows,shadowsocks,125,2019-01-20T12:02:58Z,"If you want to keep a secret, you must also hide it from yourself."
94,top-100-stars,incubator-echarts,32305,9396,JavaScript,https://github.com/apache/incubator-echarts,apache,3200,2019-01-29T09:39:34Z,"A powerful, interactive charting and visualization library for browser"
95,top-100-stars,hugo,32197,3681,Go,https://github.com/gohugoio/hugo,gohugoio,327,2019-01-29T20:48:26Z,The world’s fastest framework for building websites.
96,top-100-stars,interviews,32105,6326,Java,https://github.com/kdn251/interviews,kdn251,35,2019-01-23T10:36:13Z,Everything you need to know to get the job.
97,top-100-stars,protobuf,31834,8732,C++,https://github.com/protocolbuffers/protobuf,protocolbuffers,590,2019-01-29T15:04:57Z,Protocol Buffers - Google's data interchange format
98,top-100-stars,babel,31672,3280,JavaScript,https://github.com/babel/babel,babel,793,2019-01-29T16:21:56Z,🐠 Babel is a compiler for writing next generation JavaScript.
99,top-100-stars,opencv,31438,22455,C++,https://github.com/opencv/opencv,opencv,1584,2019-01-30T03:42:22Z,Open Source Computer Vision Library
100,top-100-stars,big-list-of-naughty-strings,31335,1317,Python,https://github.com/minimaxir/big-list-of-naughty-strings,minimaxir,67,2019-01-29T23:55:45Z,The Big List of Naughty Strings is a list of strings which have a high probability of causing issues when used as user-input data.
1,top-100-forks,datasharing,4613,192498,,https://github.com/jtleek/datasharing,jtleek,445,2019-01-22T19:51:28Z,The Leek group guide to data sharing 
2,top-100-forks,ProgrammingAssignment2,576,114996,R,https://github.com/rdpeng/ProgrammingAssignment2,rdpeng,2673,2019-01-29T19:41:47Z,Repository for Programming Assignment 2 for R Programming on Coursera
3,top-100-forks,Spoon-Knife,10074,102388,HTML,https://github.com/octocat/Spoon-Knife,octocat,13131,2019-01-30T03:56:10Z,This repo is for demonstration purposes only.
4,top-100-forks,tensorflow,119653,71694,C++,https://github.com/tensorflow/tensorflow,tensorflow,1965,2019-01-30T03:50:39Z,An Open Source Machine Learning Framework for Everyone
5,top-100-forks,bootstrap,130362,63937,CSS,https://github.com/twbs/bootstrap,twbs,314,2019-01-30T01:47:51Z,"The most popular HTML, CSS, and JavaScript framework for developing responsive, mobile first projects on the web."
6,top-100-forks,SmartThingsPublic,1169,50983,Groovy,https://github.com/SmartThingsCommunity/SmartThingsPublic,SmartThingsCommunity,1116,2019-01-29T21:14:30Z,SmartThings open-source DeviceTypeHandlers and SmartApps code
7,top-100-forks,ExData_Plotting1,162,48990,,https://github.com/rdpeng/ExData_Plotting1,rdpeng,602,2019-01-29T20:23:40Z,Plotting Assignment 1 for Exploratory Data Analysis
8,top-100-forks,gitignore,78324,37404,,https://github.com/github/gitignore,github,67,2019-01-29T20:47:20Z,A collection of useful .gitignore templates
9,top-100-forks,RepData_PeerAssessment1,77,31255,,https://github.com/rdpeng/RepData_PeerAssessment1,rdpeng,265,2019-01-15T16:25:39Z,Peer Assessment 1 for Reproducible Research
10,top-100-forks,free-programming-books,116777,29389,,https://github.com/EbookFoundation/free-programming-books,EbookFoundation,22,2019-01-29T16:41:46Z,:books: Freely available programming books
11,top-100-forks,models,47810,29163,Python,https://github.com/tensorflow/models,tensorflow,1365,2019-01-30T00:10:48Z,Models and examples built with TensorFlow
12,top-100-forks,angular.js,59369,28948,JavaScript,https://github.com/angular/angular.js,angular,459,2019-01-26T10:32:23Z,AngularJS - HTML enhanced for web apps!
13,top-100-forks,courses,3119,27204,HTML,https://github.com/DataScienceSpecialization/courses,DataScienceSpecialization,93,2018-12-06T17:22:20Z,Course materials for the Data Science Specialization: https://www.coursera.org/specialization/jhudatascience/1
14,top-100-forks,frontend-nanodegree-resume,1015,25042,JavaScript,https://github.com/udacity/frontend-nanodegree-resume,udacity,0,2018-11-27T21:09:19Z,This repository is used for one of the projects in Udacity's Front-End Web Developer Nanodegree program. Learn how to become a Front-End Developer today with line-by-line code reviewed projects and get a job with career services!
15,top-100-forks,linux,68769,24750,C,https://github.com/torvalds/linux,torvalds,252,2019-01-30T01:25:02Z,Linux kernel source tree
16,top-100-forks,cgm-remote-monitor,634,23469,JavaScript,https://github.com/nightscout/cgm-remote-monitor,nightscout,218,2019-01-29T03:45:11Z,nightscout web monitor
17,top-100-forks,jekyll-now,5645,23038,CSS,https://github.com/barryclark/jekyll-now,barryclark,178,2019-01-28T23:40:14Z,"Build a Jekyll blog in minutes, without touching the command line."
18,top-100-forks,patchwork,823,22733,HTML,https://github.com/jlord/patchwork,jlord,581,2019-01-30T03:49:53Z,All the Git-it Workshop completers! 
19,top-100-forks,spring-boot,33678,22605,Java,https://github.com/spring-projects/spring-boot,spring-projects,398,2019-01-29T14:56:53Z,Spring Boot
20,top-100-forks,opencv,31438,22455,C++,https://github.com/opencv/opencv,opencv,1584,2019-01-30T03:42:22Z,Open Source Computer Vision Library
21,top-100-forks,recipes,59,22412,,https://github.com/LarryMad/recipes,LarryMad,2134,2019-01-29T13:24:24Z,
22,top-100-forks,bitcoin,36952,22003,C++,https://github.com/bitcoin/bitcoin,bitcoin,901,2019-01-30T02:54:54Z,Bitcoin Core integration/staging tree
23,top-100-forks,react,121008,21907,JavaScript,https://github.com/facebook/react,facebook,534,2019-01-30T01:48:57Z,"A declarative, efficient, and flexible JavaScript library for building user interfaces."
24,top-100-forks,coding-interview-university,73670,21506,,https://github.com/jwasham/coding-interview-university,jwasham,57,2019-01-30T03:36:19Z,A complete computer science study plan to become a software engineer.
25,top-100-forks,freeCodeCamp,297140,20821,JavaScript,https://github.com/freeCodeCamp/freeCodeCamp,freeCodeCamp,4924,2019-01-29T21:06:26Z,The https://www.freeCodeCamp.org open source codebase and curriculum. Learn to code for free together with millions of people.
26,top-100-forks,d3,82050,20325,JavaScript,https://github.com/d3/d3,d3,7,2019-01-28T17:59:45Z,"Bring data to life with SVG, Canvas and HTML. :bar_chart::chart_with_upwards_trend::tada:"
27,top-100-forks,You-Dont-Know-JS,95524,18509,,https://github.com/getify/You-Dont-Know-JS,getify,220,2019-01-23T07:16:49Z,A book series on JavaScript. @YDKJS on twitter.
28,top-100-forks,three.js,48379,18184,JavaScript,https://github.com/mrdoob/three.js,mrdoob,796,2019-01-30T03:19:28Z,JavaScript 3D library.
29,top-100-forks,vue,126577,18062,JavaScript,https://github.com/vuejs/vue,vuejs,222,2019-01-29T22:27:50Z,"🖖 Vue.js is a progressive, incrementally-adoptable JavaScript framework for building UI on the web."
30,top-100-forks,spark,20420,17987,Scala,https://github.com/apache/spark,apache,450,2019-01-30T02:52:36Z,Apache Spark
31,top-100-forks,jquery,50841,17661,JavaScript,https://github.com/jquery/jquery,jquery,88,2019-01-29T13:13:54Z,jQuery JavaScript Library
32,top-100-forks,shadowsocks,28452,17462,Python,https://github.com/shadowsocks/shadowsocks,shadowsocks,390,2019-01-21T14:22:43Z,
33,top-100-forks,rails,41991,16959,Ruby,https://github.com/rails/rails,rails,1081,2019-01-30T03:58:45Z,Ruby on Rails
34,top-100-forks,django,39173,16888,Python,https://github.com/django/django,django,179,2019-01-30T03:55:32Z,The Web framework for perfectionists with deadlines.
35,top-100-forks,spring-framework,26280,16736,Java,https://github.com/spring-projects/spring-framework,spring-projects,876,2019-01-29T22:37:36Z,Spring Framework
36,top-100-forks,tutorials,11225,16597,Java,https://github.com/eugenp/tutorials,eugenp,42,2019-01-30T02:49:57Z,"The ""REST With Spring"" Course: "
37,top-100-forks,kubernetes,47555,16511,Go,https://github.com/kubernetes/kubernetes,kubernetes,3130,2019-01-30T03:38:53Z,Production-Grade Container Scheduling and Management
38,top-100-forks,react-native,73298,16345,JavaScript,https://github.com/facebook/react-native,facebook,766,2019-01-30T03:59:54Z,A framework for building native apps with React.
