rank,item,repo_name,stars,forks,language,repo_url,username,issues,last_commit,description
97,JavaScript,gitbook,21507,3130,JavaScript,https://github.com/GitbookIO/gitbook,GitbookIO,1006,2019-10-18T08:43:40Z,📝 Modern documentation format and toolchain using Git and Markdown
98,JavaScript,swiper,21436,7842,JavaScript,https://github.com/nolimits4web/swiper,nolimits4web,189,2019-10-23T06:06:55Z,Most modern mobile touch slider with hardware accelerated transitions
99,JavaScript,ember.js,21236,4193,JavaScript,https://github.com/emberjs/ember.js,emberjs,337,2019-10-23T09:42:34Z,Ember.js - A JavaScript framework for creating ambitious web applications
100,JavaScript,uppy,21204,1110,JavaScript,https://github.com/transloadit/uppy,transloadit,86,2019-10-23T10:30:12Z,The next open source file uploader for web browsers :dog: 
1,Lua,kong,23749,2968,Lua,https://github.com/Kong/kong,Kong,333,2019-10-23T06:30:05Z,🦍 The Cloud-Native API Gateway 
2,Lua,neural-style,17105,2640,Lua,https://github.com/jcjohnson/neural-style,jcjohnson,319,2018-02-23T01:21:20Z,Torch implementation of neural style algorithm
3,Lua,waifu2x,16323,1864,Lua,https://github.com/nagadomi/waifu2x,nagadomi,95,2019-08-13T16:55:52Z,Image Super-Resolution for Anime-Style Art
4,Lua,openface,12751,3170,Lua,https://github.com/cmusatyalab/openface,cmusatyalab,4,2019-10-23T05:04:22Z,Face recognition with deep neural networks.
5,Lua,char-rnn,9741,2318,Lua,https://github.com/karpathy/char-rnn,karpathy,107,2018-05-04T15:25:25Z,"Multi-layer Recurrent Neural Networks (LSTM, GRU, RNN) for character-level language models in Torch"
6,Lua,CycleGAN,9120,1496,Lua,https://github.com/junyanz/CycleGAN,junyanz,32,2019-08-13T03:42:02Z,"Software that can generate photos from paintings,  turn horses into zebras,  perform style transfer, and more."
7,Lua,pix2pix,7039,1221,Lua,https://github.com/phillipi/pix2pix,phillipi,61,2019-10-20T01:27:05Z,Image-to-image translation with conditional adversarial nets
8,Lua,dockercraft,5542,311,Lua,https://github.com/docker/dockercraft,docker,16,2018-06-18T12:15:21Z,Docker + Minecraft = Dockercraft
9,Lua,koreader,5400,687,Lua,https://github.com/koreader/koreader,koreader,344,2019-10-23T03:17:19Z,"An ebook reader application supporting PDF, DjVu, EPUB, FB2 and many more formats, running on Cervantes, Kindle, Kobo, PocketBook and Android devices"
10,Lua,VeryNginx,4997,788,Lua,https://github.com/alexazhou/VeryNginx,alexazhou,98,2019-08-26T06:47:13Z," A very powerful and friendly  nginx base on lua-nginx-module( openresty ) which provide WAF, Control Panel, and Dashboards. "
11,Lua,lsyncd,3751,362,Lua,https://github.com/axkibe/lsyncd,axkibe,98,2019-08-08T16:03:50Z,Lsyncd (Live Syncing Daemon) synchronizes local directories with remote targets
12,Lua,DenseNet,3715,902,Lua,https://github.com/liuzhuang13/DenseNet,liuzhuang13,27,2019-07-22T09:36:34Z,"Densely Connected Convolutional Networks, In CVPR 2017 (Best Paper Award)."
13,Lua,fairseq,3489,609,Lua,https://github.com/facebookresearch/fairseq,facebookresearch,9,2019-02-25T06:01:33Z,Facebook AI Research Sequence-to-Sequence Toolkit
14,Lua,fast-neural-style,3345,665,Lua,https://github.com/jcjohnson/fast-neural-style,jcjohnson,132,2019-07-09T05:36:53Z,Feedforward style transfer
15,Lua,luvit,3097,327,Lua,https://github.com/luvit/luvit,luvit,69,2019-10-13T01:04:40Z,Lua + libUV + jIT = pure awesomesauce
16,Lua,deepmask,3048,529,Lua,https://github.com/facebookresearch/deepmask,facebookresearch,48,2019-01-16T17:21:51Z,Torch implementation of DeepMask and SharpMask
17,Lua,ntopng,2917,356,Lua,https://github.com/ntop/ntopng,ntop,154,2019-10-23T09:53:45Z,Web-based Traffic and Security Network Traffic Monitoring
18,Lua,awesome,2764,345,Lua,https://github.com/awesomeWM/awesome,awesomeWM,310,2019-10-18T22:28:36Z,awesome window manager
19,Lua,openresty-best-practices,2761,701,Lua,https://github.com/moonbingbing/openresty-best-practices,moonbingbing,8,2019-07-13T00:32:36Z,
20,Lua,ngx_lua_waf,2737,1139,Lua,https://github.com/loveshell/ngx_lua_waf,loveshell,73,2019-04-26T04:14:46Z,ngx_lua_waf是一个基于lua-nginx-module(openresty)的web应用防火墙
21,Lua,snabb,2350,294,Lua,https://github.com/snabbco/snabb,snabbco,239,2019-10-02T10:32:06Z,Snabb: Simple and fast packet networking
22,Lua,neuralart,2316,351,Lua,https://github.com/kaishengtai/neuralart,kaishengtai,6,2017-03-05T18:08:54Z,An implementation of the paper 'A Neural Algorithm of Artistic Style'.
23,Lua,tarantool,2242,216,Lua,https://github.com/tarantool/tarantool,tarantool,855,2019-10-23T10:38:33Z,Get your data in RAM. Get compute close to data. Enjoy the performance.
24,Lua,moonscript,2232,160,Lua,https://github.com/leafo/moonscript,leafo,160,2019-09-26T17:25:23Z,:crescent_moon: A language that compiles to Lua
25,Lua,OpenNMT,2221,450,Lua,https://github.com/OpenNMT/OpenNMT,OpenNMT,49,2019-07-03T07:50:27Z,Open Source Neural Machine Translation in Torch (deprecated)
26,Lua,torch-rnn,2204,496,Lua,https://github.com/jcjohnson/torch-rnn,jcjohnson,109,2018-04-28T08:50:05Z,"Efficient, reusable RNNs and LSTMs for torch"
27,Lua,luci,2081,1060,Lua,https://github.com/openwrt/luci,openwrt,159,2019-10-23T09:55:31Z,LuCI - OpenWrt Configuration Interface
28,Lua,CorsixTH,2080,246,Lua,https://github.com/CorsixTH/CorsixTH,CorsixTH,284,2019-10-07T10:11:10Z,Open source clone of Theme Hospital
29,Lua,Algorithm-Implementations,2063,498,Lua,https://github.com/kennyledet/Algorithm-Implementations,kennyledet,11,2019-10-10T15:19:00Z,"Share, discuss and learn about algorithm implementations!"
30,Lua,siggraph2016_colorization,2006,285,Lua,https://github.com/satoshiiizuka/siggraph2016_colorization,satoshiiizuka,13,2017-08-24T08:40:12Z,Code for the paper 'Let there be Color!: Joint End-to-end Learning of Global and Local Image Priors for Automatic Image Colorization with Simultaneous Classification'. 
31,Lua,ZeroBraneStudio,1901,439,Lua,https://github.com/pkulchenko/ZeroBraneStudio,pkulchenko,88,2019-10-21T05:00:38Z,"Lightweight Lua-based IDE for Lua with code completion, syntax highlighting, live coding, remote debugger, and code analyzer; supports Lua 5.1, 5.2, 5.3, LuaJIT and other Lua interpreters on Windows, macOS, and Linux"
32,Lua,fb.resnet.torch,1873,619,Lua,https://github.com/facebook/fb.resnet.torch,facebook,62,2019-04-16T16:20:58Z,Torch implementation of ResNet from http://arxiv.org/abs/1512.03385 and training scripts
33,Lua,awesome-copycats,1840,399,Lua,https://github.com/lcpz/awesome-copycats,lcpz,1,2019-08-27T16:10:27Z,Awesome WM themes
34,Lua,orange,1819,487,Lua,https://github.com/orlabs/orange,orlabs,50,2019-10-23T08:21:33Z,OpenResty/Nginx Gateway for API Monitoring and Management.
35,Lua,DeepMind-Atari-Deep-Q-Learner,1761,544,Lua,https://github.com/kuz/DeepMind-Atari-Deep-Q-Learner,kuz,23,2018-01-23T03:06:50Z,The original code from the DeepMind article + my tweaks
36,Lua,nmap-vulners,1661,255,Lua,https://github.com/vulnersCom/nmap-vulners,vulnersCom,4,2019-08-15T15:08:10Z,NSE script based on Vulners.com API
37,Lua,PathOfBuilding,1643,667,Lua,https://github.com/Openarl/PathOfBuilding,Openarl,682,2019-10-17T18:56:09Z,Offline build planner for Path of Exile.
38,Lua,MemNN,1640,381,Lua,https://github.com/facebook/MemNN,facebook,17,2019-10-23T10:07:08Z,Memory Networks implementations
39,Lua,luarocks,1620,288,Lua,https://github.com/luarocks/luarocks,luarocks,164,2019-10-20T11:54:12Z,LuaRocks is the package manager for the Lua programming language.
40,Lua,ResNeXt,1569,259,Lua,https://github.com/facebookresearch/ResNeXt,facebookresearch,8,2019-01-16T00:47:02Z,Implementation of a classification framework from the paper Aggregated Residual Transformations for Deep Neural Networks
41,Lua,Anycomplete,1524,45,Lua,https://github.com/nathancahill/Anycomplete,nathancahill,3,2017-04-04T18:29:04Z,The magic of Google Autocomplete while you're typing. Anywhere.
42,Lua,crnn,1505,444,Lua,https://github.com/bgshih/crnn,bgshih,84,2019-03-04T05:12:37Z,Convolutional Recurrent Neural Network (CRNN) for image-based sequence recognition.
43,Lua,lua-resty-auto-ssl,1471,117,Lua,https://github.com/GUI/lua-resty-auto-ssl,GUI,55,2019-10-15T13:14:13Z,On the fly (and free) SSL registration and renewal inside OpenResty/nginx with Let's Encrypt.
44,Lua,art-DCGAN,1430,248,Lua,https://github.com/robbiebarrat/art-DCGAN,robbiebarrat,13,2019-01-09T20:36:18Z,"Modified implementation of DCGAN focused on generative art. Includes pre-trained models for landscapes, nude-portraits, and others."
45,Lua,luafun,1369,85,Lua,https://github.com/luafun/luafun,luafun,27,2019-09-17T10:35:51Z,Lua Fun is a high-performance functional programming library for Lua designed with LuaJIT's trace compiler in mind.
46,Lua,multipathnet,1358,296,Lua,https://github.com/facebookresearch/multipathnet,facebookresearch,23,2019-03-22T18:15:44Z,"A Torch implementation of the object detection network from ""A MultiPath Network for Object Detection"" (https://arxiv.org/abs/1604.02135)"
47,Lua,qipai_algorithm,1348,629,Lua,https://github.com/yuanfengyun/qipai_algorithm,yuanfengyun,15,2019-09-29T04:43:46Z,棋牌的胡牌算法，包括麻将、跑胡子、扑克。实现 lua 、c++ 、c# 、golang 、js 、java 、python 版本。( Mahjong  algorithm )
48,Lua,luakit,1329,219,Lua,https://github.com/luakit/luakit,luakit,188,2019-10-20T06:49:08Z,"Fast, small, webkit based browser framework extensible by Lua."
49,Lua,lua-resty-redis,1312,351,Lua,https://github.com/openresty/lua-resty-redis,openresty,49,2019-09-30T18:54:29Z,Lua redis client driver for the ngx_lua based on the cosocket API
50,Lua,z.lua,1245,48,Lua,https://github.com/skywind3000/z.lua,skywind3000,15,2019-10-12T05:43:38Z,A new cd command that helps you navigate faster by learning your habits :zap:
51,Lua,vulscan,1234,319,Lua,https://github.com/scipag/vulscan,scipag,6,2019-09-23T12:14:06Z,Advanced vulnerability scanning with Nmap NSE
52,Lua,nn,1217,972,Lua,https://github.com/torch/nn,torch,172,2018-10-04T01:47:39Z,
53,Lua,lua-resty-http,1187,419,Lua,https://github.com/ledgetech/lua-resty-http,ledgetech,28,2019-08-20T17:21:05Z,Lua HTTP client cosocket driver for OpenResty / ngx_lua.
54,Lua,Faster-High-Res-Neural-Inpainting,1156,200,Lua,https://github.com/leehomyc/Faster-High-Res-Neural-Inpainting,leehomyc,10,2018-05-29T22:01:59Z,High-Resolution Image Inpainting using Multi-Scale Neural Patch Synthesis
55,Lua,dcgan.torch,1133,356,Lua,https://github.com/soumith/dcgan.torch,soumith,41,2018-12-19T21:28:23Z,A torch implementation of http://arxiv.org/abs/1511.06434
56,Lua,keyboard,1131,119,Lua,https://github.com/jasonrudolph/keyboard,jasonrudolph,7,2019-08-15T18:10:48Z,⌨ Toward a more useful keyboard
57,Lua,middleclass,1130,134,Lua,https://github.com/kikito/middleclass,kikito,2,2019-10-18T11:02:12Z,Object-orientation for Lua
58,Lua,vlsub,1121,318,Lua,https://github.com/exebetche/vlsub,exebetche,82,2019-09-12T19:39:11Z,VLC extension to download subtitles from opensubtitles.org
59,Lua,seq2seq-attn,1101,281,Lua,https://github.com/harvardnlp/seq2seq-attn,harvardnlp,14,2018-02-13T05:27:41Z,Sequence-to-sequence model with LSTM encoder/decoders and attention
60,Lua,fbcunn,1079,264,Lua,https://github.com/facebookarchive/fbcunn,facebookarchive,38,2017-07-21T22:04:03Z,Facebook's extensions to torch/cunn.
61,Lua,texture_nets,1072,202,Lua,https://github.com/DmitryUlyanov/texture_nets,DmitryUlyanov,41,2018-01-07T06:56:34Z,"Code for ""Texture Networks: Feed-forward Synthesis of Textures and Stylized Images"" paper."
62,Lua,luacheck,1069,182,Lua,https://github.com/mpeterv/luacheck,mpeterv,37,2019-10-03T12:52:35Z, A tool for linting and static analysis of Lua code. 
63,Lua,nProbe,1065,33,Lua,https://github.com/ntop/nProbe,ntop,40,2019-06-20T10:25:16Z,Open source components and extensions for nProbe
64,Lua,Penlight,1052,186,Lua,https://github.com/Tieske/Penlight,Tieske,33,2019-10-15T20:18:07Z,"A set of pure Lua libraries focusing on input data handling (such as reading configuration files), functional programming (such as map, reduce, placeholder expressions,etc), and OS path management.  Much of the functionality is inspired by the Python standard libraries."
65,Lua,wide-residual-networks,994,255,Lua,https://github.com/szagoruyko/wide-residual-networks,szagoruyko,27,2019-08-20T08:37:42Z,3.8% and 18.3% on CIFAR-10 and CIFAR-100
66,Lua,torchnet,980,202,Lua,https://github.com/torchnet/torchnet,torchnet,3,2019-03-27T22:21:16Z,Torch on steroids
67,Lua,KikiAuth,951,1,Lua,https://github.com/fossasia/KikiAuth,fossasia,0,2018-11-23T17:17:23Z,CommonsNet KikiAuth for OpenWrt
68,Lua,lsofgraph,913,27,Lua,https://github.com/zevv/lsofgraph,zevv,0,2019-04-20T19:38:03Z,lsof to graphviz
69,Lua,rnn,913,317,Lua,https://github.com/Element-Research/rnn,Element-Research,79,2017-12-21T06:29:48Z,Recurrent Neural Network library for Torch7's nn
70,Lua,apisix,878,160,Lua,https://github.com/iresty/apisix,iresty,76,2019-10-23T10:26:51Z,Cloud-Native Microservices API Gateway
71,Lua,Fennel,873,53,Lua,https://github.com/bakpakin/Fennel,bakpakin,7,2019-10-08T12:59:06Z,Lua Lisp Language
72,Lua,sailor,858,129,Lua,https://github.com/sailorproject/sailor,sailorproject,46,2019-07-05T13:13:50Z,A Lua MVC Web Framework.
73,Lua,busted,849,134,Lua,https://github.com/Olivine-Labs/busted,Olivine-Labs,54,2019-09-16T19:28:51Z,Elegant Lua unit testing.
74,Lua,minetest_game,844,412,Lua,https://github.com/minetest/minetest_game,minetest,108,2019-10-22T20:46:19Z,Minetest Game - The default game for the Minetest engine [https://github.com/minetest/minetest/]
75,Lua,telegram-bot,842,521,Lua,https://github.com/yagop/telegram-bot,yagop,116,2018-10-14T09:09:36Z,UNMAINTAINED - A Telegram Bot based on plugins
76,Lua,hawkthorne-journey,840,370,Lua,https://github.com/hawkthorne/hawkthorne-journey,hawkthorne,34,2018-10-10T06:31:22Z,Digital Estate Planning: The Game
77,Lua,lor,837,163,Lua,https://github.com/sumory/lor,sumory,12,2019-09-18T07:06:49Z,"a fast, minimalist web framework for lua based on OpenResty"
78,Lua,NAMAS,832,254,Lua,https://github.com/facebookarchive/NAMAS,facebookarchive,18,2018-04-25T14:40:20Z,Neural Attention Model for Abstractive Summarization
79,Lua,doomrl,828,116,Lua,https://github.com/chaosforgeorg/doomrl,chaosforgeorg,19,2018-10-03T03:25:35Z,"D**m, the Roguelike"
80,Lua,QuestieDev,828,185,Lua,https://github.com/AeroScripts/QuestieDev,AeroScripts,161,2019-10-23T10:55:04Z,Questie: the vanilla quest helper
81,Lua,Crepe,819,232,Lua,https://github.com/zhangxiangxiao/Crepe,zhangxiangxiao,2,2019-07-23T06:07:51Z,Character-level Convolutional Networks for Text Classification
82,Lua,CNNMRF,801,140,Lua,https://github.com/chuanli11/CNNMRF,chuanli11,7,2019-10-12T20:14:46Z,"code for paper ""Combining Markov Random Fields and Convolutional Neural Networks for Image Synthesis"""
83,Lua,Neural-Dialogue-Generation,794,228,Lua,https://github.com/jiweil/Neural-Dialogue-Generation,jiweil,15,2017-07-12T12:18:28Z,
84,Lua,lstm-char-cnn,792,224,Lua,https://github.com/yoonkim/lstm-char-cnn,yoonkim,15,2016-08-24T12:53:43Z,LSTM language model with CNN over characters
85,Lua,AdaIN-style,789,122,Lua,https://github.com/xunhuang1995/AdaIN-style,xunhuang1995,13,2017-10-30T11:38:53Z,Arbitrary Style Transfer in Real-time with Adaptive Instance Normalization
86,Lua,bAbI-tasks,785,177,Lua,https://github.com/facebook/bAbI-tasks,facebook,5,2019-03-27T22:23:53Z,Task generation for testing text understanding and reasoning
87,Lua,sile,774,57,Lua,https://github.com/sile-typesetter/sile,sile-typesetter,172,2019-10-19T20:44:06Z,Simon's Improved Layout Engine
88,Lua,icml2016,773,187,Lua,https://github.com/reedscot/icml2016,reedscot,28,2018-09-05T16:45:56Z,Generative Adversarial Text-to-Image Synthesis
89,Lua,openstar,772,317,Lua,https://github.com/starjun/openstar,starjun,2,2019-08-20T03:43:44Z,"lua waf,nginx+lua,openresty,luajit,waf+,cdn,nginx"
90,Lua,treelstm,750,232,Lua,https://github.com/stanfordnlp/treelstm,stanfordnlp,9,2017-07-30T21:01:43Z,Tree-structured Long Short-Term Memory networks (http://arxiv.org/abs/1503.00075)
91,Lua,neuralconvo,750,356,Lua,https://github.com/macournoyer/neuralconvo,macournoyer,26,2019-05-31T08:42:14Z,Neural conversational model in Torch
92,Lua,XNOR-Net,734,221,Lua,https://github.com/allenai/XNOR-Net,allenai,27,2017-12-05T01:39:30Z,ImageNet classification using binary Convolutional Neural Networks
93,Lua,nmap-nse-scripts,728,322,Lua,https://github.com/cldrn/nmap-nse-scripts,cldrn,2,2019-08-05T06:26:44Z,My collection of nmap NSE scripts
94,Lua,awesome-hammerspoon,726,117,Lua,https://github.com/ashfinal/awesome-hammerspoon,ashfinal,11,2019-02-08T06:13:28Z,awesome configuration for Hammerspoon.
95,Lua,MoonGen,724,168,Lua,https://github.com/emmericp/MoonGen,emmericp,32,2019-09-23T08:59:54Z,MoonGen is a fully scriptable high-speed packet generator built on DPDK and LuaJIT. It can saturate a 10 Gbit/s connection with 64 byte packets on a single CPU core while executing user-provided Lua scripts for each packet. Multi-core support allows for even higher rates. It also features precise and accurate timestamping and rate control.
96,Lua,resnet-1k-layers,702,211,Lua,https://github.com/KaimingHe/resnet-1k-layers,KaimingHe,1,2017-05-24T17:35:48Z,Deep Residual Networks with 1K Layers
97,Lua,tiefvision,699,183,Lua,https://github.com/paucarre/tiefvision,paucarre,21,2017-03-30T16:28:08Z,End-to-end deep learning image-similarity search engine
98,Lua,inspect.lua,696,124,Lua,https://github.com/kikito/inspect.lua,kikito,10,2019-10-15T18:32:33Z,Human-readable representation of Lua tables
99,Lua,im2markup,695,122,Lua,https://github.com/harvardnlp/im2markup,harvardnlp,8,2017-04-28T15:20:33Z,Neural model for converting Image-to-Markup (by Yuntian Deng github.com/da03)
100,Lua,nginx-lua-prometheus,683,103,Lua,https://github.com/knyar/nginx-lua-prometheus,knyar,3,2019-10-17T13:45:21Z,Prometheus metric library for Nginx written in Lua
1,MATLAB,deep-photo-styletransfer,9343,1365,Matlab,https://github.com/luanfujun/deep-photo-styletransfer,luanfujun,30,2017-08-12T08:07:42Z,"Code and data for paper ""Deep Photo Style Transfer"": https://arxiv.org/abs/1703.07511 "
2,MATLAB,PRMLT,4282,1815,MATLAB,https://github.com/PRML/PRMLT,PRML,0,2019-07-25T08:12:43Z,Matlab code for machine learning algorithms in book PRML
3,MATLAB,OpenFace,3962,1337,MATLAB,https://github.com/TadasBaltrusaitis/OpenFace,TadasBaltrusaitis,148,2019-09-01T23:34:23Z,"OpenFace – a state-of-the art tool intended for facial landmark detection, head pose estimation, facial action unit recognition, and eye-gaze estimation."
4,MATLAB,DeepLearnToolbox,3377,2176,Matlab,https://github.com/rasmusbergpalm/DeepLearnToolbox,rasmusbergpalm,82,2018-10-13T18:08:01Z,"Matlab/Octave toolbox for deep learning. Includes Deep Belief Nets, Stacked Autoencoders, Convolutional Neural Nets, Convolutional Autoencoders and vanilla Neural Nets. Each method has examples to get you started."
5,MATLAB,faster_rcnn,2170,1136,Matlab,https://github.com/ShaoqingRen/faster_rcnn,ShaoqingRen,139,2018-07-26T04:26:32Z,Faster R-CNN
6,MATLAB,MTCNN_face_detection_alignment,2154,882,Matlab,https://github.com/kpzhang93/MTCNN_face_detection_alignment,kpzhang93,44,2018-04-04T03:17:19Z,Joint Face Detection and Alignment using Multi-task Cascaded Convolutional Neural Networks
7,MATLAB,OpenTLD,2057,1295,Matlab,https://github.com/zk00006/OpenTLD,zk00006,38,2016-02-01T11:28:11Z,OpenTLD is an open source library for real-time 2D tracking of a single object in video. This repository is no longer under development. For latest version see: http://www.tldvision.com/tld2.html
8,MATLAB,rcnn,1903,894,Matlab,https://github.com/rbgirshick/rcnn,rbgirshick,55,2017-04-03T16:16:14Z,R-CNN: Regions with Convolutional Neural Network Features
9,MATLAB,eviltransform,1783,393,Matlab,https://github.com/googollee/eviltransform,googollee,13,2018-11-23T17:35:39Z,Transport coordinate between earth(WGS-84) and mars in china(GCJ-02).
10,MATLAB,Coding-Guide,1327,178,MATLAB,https://github.com/ecmadao/Coding-Guide,ecmadao,0,2019-05-15T06:25:51Z,自己随手记录的东西
11,MATLAB,crfasrnn,1275,475,MATLAB,https://github.com/torrvision/crfasrnn,torrvision,47,2019-06-05T10:13:53Z,This repository contains the source code for the semantic image segmentation method described in the ICCV 2015 paper: Conditional Random Fields as Recurrent Neural Networks. http://crfasrnn.torr.vision/
12,MATLAB,R-FCN,1145,525,Matlab,https://github.com/daijifeng001/R-FCN,daijifeng001,30,2017-05-05T15:50:59Z,R-FCN: Object Detection via Region-based Fully Convolutional Networks
13,MATLAB,CAM,1038,313,Matlab,https://github.com/metalbubble/CAM,metalbubble,9,2018-05-02T19:30:19Z,Class Activation Mapping
14,MATLAB,tiny,1006,303,MATLAB,https://github.com/peiyunh/tiny,peiyunh,10,2019-07-30T19:46:58Z,"Tiny Face Detector, CVPR 2017"
15,MATLAB,machine-learning-coursera-1,960,862,,https://github.com/Borye/machine-learning-coursera-1,Borye,6,2019-07-28T13:49:39Z,This repo is specially created for all the work done my me as a part of Coursera's Machine Learning Course.
16,MATLAB,BPL,908,311,Matlab,https://github.com/brendenlake/BPL,brendenlake,0,2015-12-28T20:48:56Z,Bayesian Program Learning model for one-shot learning
17,MATLAB,matlab2tikz,821,200,MATLAB,https://github.com/matlab2tikz/matlab2tikz,matlab2tikz,210,2019-10-20T13:41:24Z,This program converts MATLAB®/Octave figures to TikZ/pgfplots figures for smooth integration into LaTeX.
18,MATLAB,toolbox,712,469,Matlab,https://github.com/pdollar/toolbox,pdollar,38,2019-05-06T18:46:16Z,Piotr's Image & Video Matlab Toolbox
19,MATLAB,omniglot,708,221,MATLAB,https://github.com/brendenlake/omniglot,brendenlake,1,2019-02-13T15:11:01Z,Omniglot data set for one-shot learning
20,MATLAB,export_fig,705,242,MATLAB,https://github.com/altmany/export_fig,altmany,43,2019-10-18T07:38:37Z,A MATLAB toolbox for exporting publication quality figures
21,MATLAB,face_verification_experiment,693,330,Matlab,https://github.com/AlfredXiangWu/face_verification_experiment,AlfredXiangWu,2,2017-02-10T09:19:33Z,Original Caffe Version for LightCNN-9. Highly recommend to use Pytorch Version (https://github.com/AlfredXiangWu/LightCNN) 
22,MATLAB,Octave,672,420,Matlab,https://github.com/schneems/Octave,schneems,10,2019-10-05T10:15:03Z,"my octave exercises for 2011 stanford machine learning class, posted after the due date of course"
23,MATLAB,DnCNN,609,328,MATLAB,https://github.com/cszn/DnCNN,cszn,13,2019-03-30T02:50:05Z,"Beyond a Gaussian Denoiser: Residual Learning of Deep CNN for Image Denoising (TIP, 2017)"
24,MATLAB,edges,607,323,Matlab,https://github.com/pdollar/edges,pdollar,16,2016-07-06T17:58:06Z,Structured Edge Detection Toolbox
25,MATLAB,convnet-burden,572,80,MATLAB,https://github.com/albanie/convnet-burden,albanie,4,2019-01-17T11:15:00Z,Memory consumption and FLOP count estimates for convnets
26,MATLAB,CNN-for-Image-Retrieval,536,221,MATLAB,https://github.com/willard-yuan/CNN-for-Image-Retrieval,willard-yuan,1,2019-07-14T09:12:22Z,":sunrise:The code of post ""Image retrieval using MatconvNet and pre-trained imageNet"""
27,MATLAB,activityrecognition,534,265,MATLAB,https://github.com/jindongwang/activityrecognition,jindongwang,0,2019-08-20T05:46:37Z,Resources about activity recognition-行为识别资料
28,MATLAB,mexopencv,528,279,Matlab,https://github.com/kyamagu/mexopencv,kyamagu,29,2018-12-16T22:07:19Z,Collection and a development kit of matlab mex functions for OpenCV library
29,MATLAB,voc-dpm,527,305,Matlab,https://github.com/rbgirshick/voc-dpm,rbgirshick,17,2017-04-03T16:06:41Z,Object detection system using deformable part models (DPMs) and latent SVM (voc-release5). You may want to use the latest tarball on my website. The github code may include code changes that have not been tested as thoroughly and will not necessarily reproduce the results on the website.
30,MATLAB,ICNet,521,178,MATLAB,https://github.com/hszhao/ICNet,hszhao,23,2019-09-09T13:49:55Z,"ICNet for Real-Time Semantic Segmentation on High-Resolution Images, ECCV2018"
31,MATLAB,siamese-fc,516,210,MATLAB,https://github.com/bertinetto/siamese-fc,bertinetto,33,2019-05-16T10:10:53Z,Arbitrary object tracking at 50-100 FPS with Fully Convolutional Siamese networks.
32,MATLAB,Gait-Tracking-With-x-IMU,515,307,Matlab,https://github.com/xioTechnologies/Gait-Tracking-With-x-IMU,xioTechnologies,11,2017-08-03T13:31:31Z,
33,MATLAB,lrslibrary,510,278,Matlab,https://github.com/andrewssobral/lrslibrary,andrewssobral,2,2018-04-08T18:49:08Z,Low-Rank and Sparse Tools for Background Modeling and Subtraction in Videos
34,MATLAB,machine-learning-octave,480,123,MATLAB,https://github.com/trekhleb/machine-learning-octave,trekhleb,0,2018-12-22T08:52:56Z,🤖 MatLab/Octave examples of popular machine learning algorithms with code examples and mathematics being explained
35,MATLAB,Stanford-Machine-Learning-Course,476,343,Matlab,https://github.com/zhouxc/Stanford-Machine-Learning-Course,zhouxc,1,2011-12-25T10:04:23Z,machine learning course programming exercise
36,MATLAB,Detect-Track,462,99,Matlab,https://github.com/feichtenhofer/Detect-Track,feichtenhofer,19,2018-07-03T16:38:41Z,"Code release for ""Detect to Track and Track to Detect"", ICCV 2017"
37,MATLAB,SemanticSoftSegmentation,461,127,Matlab,https://github.com/yaksoy/SemanticSoftSegmentation,yaksoy,4,2018-07-30T12:54:45Z,"Spectral segmentation described in Aksoy et al., ""Semantic Soft Segmentation"", ACM TOG (Proc. SIGGRAPH), 2018"
38,MATLAB,ECO,457,214,MATLAB,https://github.com/martin-danelljan/ECO,martin-danelljan,8,2019-07-30T17:27:38Z,Matlab implementation of the ECO tracker.
39,MATLAB,refinenet,454,142,MATLAB,https://github.com/guosheng/refinenet,guosheng,0,2019-06-01T05:40:49Z, RefineNet: Multi-Path Refinement Networks for High-Resolution Semantic Segmentation
40,MATLAB,SFD,443,129,Matlab,https://github.com/sfzhang15/SFD,sfzhang15,0,2018-10-17T15:02:16Z,"S³FD: Single Shot Scale-invariant Face Detector, ICCV, 2017"
