rank,item,repo_name,stars,forks,language,repo_url,username,issues,last_commit,description
47,CPP,leetcode,8902,2996,C++,https://github.com/haoel/leetcode,haoel,35,2019-02-05T06:45:11Z,LeetCode Problems' Solutions 
48,CPP,hardseed,8666,1912,C++,https://github.com/yangyangwithgnu/hardseed,yangyangwithgnu,33,2018-08-25T17:29:23Z,"SEX IS ZERO (0), so, who wanna be the ONE (1), aha?"
49,CPP,libphonenumber,8662,1103,C++,https://github.com/googlei18n/libphonenumber,googlei18n,80,2019-02-25T00:15:51Z,"Google's common Java, C++ and JavaScript library for parsing, formatting, and validating international phone numbers."
50,CPP,napajs,8550,315,C++,https://github.com/Microsoft/napajs,Microsoft,60,2018-10-30T21:08:57Z,Napa.js: a multi-threaded JavaScript runtime
51,CPP,CRYENGINE,8518,1644,C++,https://github.com/CRYTEK/CRYENGINE,CRYTEK,125,2019-02-22T19:23:32Z,CRYENGINE is a powerful real-time game development platform created by Crytek.
52,CPP,envoy,8501,1250,C++,https://github.com/envoyproxy/envoy,envoyproxy,451,2019-02-25T03:59:29Z,Cloud-native high-performance edge/middle/service proxy
53,CPP,Catch2,8455,1385,C++,https://github.com/catchorg/Catch2,catchorg,191,2019-02-23T22:04:29Z,"A modern, C++-native, header-only, test framework for unit-tests, TDD and BDD - using C++11, C++14, C++17 and later (or C++03 on the Catch1.x branch)"
54,CPP,xbmc,8433,4914,C++,https://github.com/xbmc/xbmc,xbmc,351,2019-02-24T19:47:06Z,"Kodi is an award-winning free and open source home theater/media center software and entertainment hub for digital media. With its beautiful interface and powerful skinning engine, it's available for Android, BSD, Linux, macOS, iOS and Windows."
55,CPP,openage,8415,830,C++,https://github.com/SFTtech/openage,SFTtech,194,2019-02-21T04:19:57Z,Free (as in freedom) open source clone of the Age of Empires II engine :rocket:
56,CPP,brpc,8235,1886,C++,https://github.com/brpc/brpc,brpc,73,2019-02-23T03:50:49Z,"Industrial-grade RPC framework used throughout Baidu, with 1,000,000+ instances and thousands kinds of services, called ""baidu-rpc"" inside Baidu."
57,CPP,turicreate,8172,779,C++,https://github.com/apple/turicreate,apple,283,2019-02-24T22:26:08Z,Turi Create simplifies the development of custom machine learning models.
58,CPP,Paddle,8168,2216,C++,https://github.com/PaddlePaddle/Paddle,PaddlePaddle,770,2019-02-25T03:45:09Z,PArallel Distributed Deep LEarning （PaddlePaddle核心框架，高性能单机、分布式训练和跨平台部署）
59,CPP,openalpr,8132,1777,C++,https://github.com/openalpr/openalpr,openalpr,377,2019-02-06T02:13:20Z,Automatic License Plate Recognition library
60,CPP,mosh,8042,506,C++,https://github.com/mobile-shell/mosh,mobile-shell,203,2019-02-10T23:50:02Z,Mobile Shell
61,CPP,Karabiner-Elements,7995,504,C++,https://github.com/tekezo/Karabiner-Elements,tekezo,103,2019-02-21T07:05:22Z,Karabiner-Elements is a powerful utility for keyboard customization on macOS Sierra (10.12) or later.
62,CPP,Proton,7898,263,C++,https://github.com/ValveSoftware/Proton,ValveSoftware,1617,2019-02-18T20:17:39Z,Compatibility tool for Steam Play based on Wine and additional components
63,CPP,LightGBM,7852,2093,C++,https://github.com/Microsoft/LightGBM,Microsoft,88,2019-02-25T00:11:17Z,"A fast, distributed, high performance gradient boosting (GBDT, GBRT, GBM or MART) framework based on decision tree algorithms, used for ranking, classification and many other machine learning tasks. It is under the umbrella of the DMTK(http://github.com/microsoft/dmtk) project of Microsoft."
64,CPP,wkhtmltopdf,7835,1107,C++,https://github.com/wkhtmltopdf/wkhtmltopdf,wkhtmltopdf,685,2019-02-15T21:53:27Z,Convert HTML to PDF using Webkit (QtWebKit)
65,CPP,watchman,7650,578,C++,https://github.com/facebook/watchman,facebook,67,2019-02-24T19:45:27Z,"Watches files and records, or triggers actions, when they change. "
66,CPP,vnpy,7495,3537,C++,https://github.com/vnpy/vnpy,vnpy,19,2019-02-25T03:50:29Z,基于Python的开源量化交易平台开发框架
67,CPP,rapidjson,7274,2021,C++,https://github.com/Tencent/rapidjson,Tencent,350,2019-02-20T14:27:09Z,A fast JSON parser/generator for C++ with both SAX/DOM style API
68,CPP,robomongo,7241,639,C++,https://github.com/Studio3T/robomongo,Studio3T,588,2019-02-23T14:26:55Z,Native cross-platform MongoDB management tool
69,CPP,AirSim,7016,1848,C++,https://github.com/Microsoft/AirSim,Microsoft,367,2019-02-19T22:26:01Z,"Open source simulator for autonomous vehicles built on Unreal Engine / Unity, from Microsoft AI & Research"
70,CPP,notepad-plus-plus,7000,2110,C++,https://github.com/notepad-plus-plus/notepad-plus-plus,notepad-plus-plus,2610,2019-02-24T19:22:46Z,Notepad++ official repository
71,CPP,OpenRCT2,6752,731,C++,https://github.com/OpenRCT2/OpenRCT2,OpenRCT2,988,2019-02-25T04:00:42Z,An open source re-implementation of RollerCoaster Tycoon 2 🎢
72,CPP,openFrameworks,6746,2202,C++,https://github.com/openframeworks/openFrameworks,openframeworks,908,2019-02-23T09:19:18Z,openFrameworks is a community-developed cross platform toolkit for creative coding in C++.
73,CPP,solidity,6672,1807,C++,https://github.com/ethereum/solidity,ethereum,606,2019-02-24T16:32:40Z,"Solidity, the Contract-Oriented Programming Language"
74,CPP,dlib,6642,2000,C++,https://github.com/davisking/dlib,davisking,39,2019-02-25T02:27:54Z,A toolkit for making real world machine learning and data analysis applications in C++
75,CPP,zeal,6622,523,C++,https://github.com/zealdocs/zeal,zealdocs,131,2019-02-14T08:33:45Z,Offline documentation browser inspired by Dash
76,CPP,synergy-core,6580,1599,C++,https://github.com/symless/synergy-core,symless,249,2019-01-02T14:57:30Z,"Open source core of Synergy, the keyboard and mouse sharing tool"
77,CPP,yuzu,6527,419,C++,https://github.com/yuzu-emu/yuzu,yuzu-emu,94,2019-02-25T00:29:50Z,Nintendo Switch Emulator
78,CPP,MMKV,6454,612,C++,https://github.com/Tencent/MMKV,Tencent,3,2019-01-29T14:56:12Z,"An efficient, small mobile key-value storage framework developed by WeChat. Works on iOS, Android, macOS and Windows."
79,CPP,AndFix,6450,1579,C++,https://github.com/alibaba/AndFix,alibaba,238,2017-10-18T13:56:12Z,AndFix is a library that offer hot-fix for Android App.
80,CPP,tinyrenderer,6407,491,C++,https://github.com/ssloy/tinyrenderer,ssloy,3,2019-02-20T13:41:57Z,A brief computer graphics / rendering course
81,CPP,AudioKit,6339,979,C++,https://github.com/AudioKit/AudioKit,AudioKit,11,2019-02-22T03:31:55Z,"Swift audio synthesis, processing, & analysis platform for iOS, macOS and tvOS"
82,CPP,Tars,6337,1575,C++,https://github.com/TarsCloud/Tars,TarsCloud,33,2019-02-19T02:34:16Z,Tars is a highly performance rpc framework based on naming service using tars protocol and provides a semi-automatic operation platform.
83,CPP,capnproto,6267,517,C++,https://github.com/capnproto/capnproto,capnproto,87,2019-02-19T23:32:01Z,Cap'n Proto serialization/RPC system - core tools and C++ library
84,CPP,Gource,6259,522,C++,https://github.com/acaudwell/Gource,acaudwell,65,2018-12-06T15:45:49Z,software version control visualization
85,CPP,ClickHouse,6240,1048,C++,https://github.com/yandex/ClickHouse,yandex,621,2019-02-25T03:20:56Z,ClickHouse is a free analytic DBMS for big data.
86,CPP,rpcs3,6166,1083,C++,https://github.com/RPCS3/rpcs3,RPCS3,446,2019-02-24T15:04:41Z,PS3 emulator/debugger
87,CPP,vowpal_wabbit,6120,1501,C++,https://github.com/VowpalWabbit/vowpal_wabbit,VowpalWabbit,59,2019-02-22T00:46:16Z,"Vowpal Wabbit is a machine learning system which pushes the frontier of machine learning with techniques such as online, hashing, allreduce, reductions, learning2search, active, and interactive learning."
88,CPP,shadowsocks-qt5,6057,1916,C++,https://github.com/shadowsocks/shadowsocks-qt5,shadowsocks,40,2019-01-01T20:28:17Z,A cross-platform shadowsocks GUI client
89,CPP,tiled,6039,1202,C++,https://github.com/bjorn/tiled,bjorn,443,2019-02-10T20:37:08Z,A flexible level editor
90,CPP,proxygen,5997,1147,C++,https://github.com/facebook/proxygen,facebook,31,2019-02-24T19:45:10Z,A collection of C++ HTTP libraries including an easy to use HTTP server.
91,CPP,Sonoff-Tasmota,5974,1381,C++,https://github.com/arendst/Sonoff-Tasmota,arendst,39,2019-02-25T01:20:00Z,"Provide ESP8266 based itead Sonoff with Web, MQTT and OTA firmware using Arduino IDE or PlatformIO"
92,CPP,aseprite,5969,622,C++,https://github.com/aseprite/aseprite,aseprite,675,2019-02-23T13:52:52Z,"Animated sprite editor & pixel art tool (Windows, macOS, Linux)"
93,CPP,node-sass,5964,828,C++,https://github.com/sass/node-sass,sass,145,2019-02-20T06:17:42Z,:rainbow: Node.js bindings to libsass
94,CPP,filament,5957,337,C++,https://github.com/google/filament,google,40,2019-02-25T03:56:29Z,"Filament is a real-time physically based rendering engine for Android, iOS, Windows, Linux, macOS and WASM/WebGL"
95,CPP,ssdb,5944,1210,C++,https://github.com/ideawu/ssdb,ideawu,362,2019-01-24T04:20:23Z,"SSDB - A fast NoSQL database, an alternative to Redis"
96,CPP,thrift,5896,2782,C++,https://github.com/apache/thrift,apache,4,2019-02-24T16:50:12Z,Apache Thrift
97,CPP,qBittorrent,5864,1006,C++,https://github.com/qbittorrent/qBittorrent,qbittorrent,2388,2019-02-24T23:51:04Z,qBittorrent BitTorrent client
98,CPP,bgfx,5853,958,C++,https://github.com/bkaradzic/bgfx,bkaradzic,188,2019-02-24T23:11:42Z,"Cross-platform, graphics API agnostic, ""Bring Your Own Engine/Framework"" style rendering library."
99,CPP,faiss,5801,1098,C++,https://github.com/facebookresearch/faiss,facebookresearch,32,2019-02-15T12:13:50Z,A library for efficient similarity search and clustering of dense vectors.
100,CPP,devilution,5719,678,C++,https://github.com/diasurgical/devilution,diasurgical,80,2019-02-20T21:40:03Z,Diablo devolved - magic behind the 1996 computer game
1,Clojure,FiraCode,31497,978,Clojure,https://github.com/tonsky/FiraCode,tonsky,188,2019-02-15T00:16:36Z,Monospaced font with programming ligatures
2,Clojure,metabase,13612,1785,Clojure,https://github.com/metabase/metabase,metabase,2064,2019-02-24T20:55:57Z,"The simplest, fastest way to get business intelligence and analytics  to everyone in your company :yum:"
3,Clojure,LightTable,10459,897,Clojure,https://github.com/LightTable/LightTable,LightTable,178,2019-02-13T15:21:27Z,The Light Table IDE ⛺
4,Clojure,clojurescript,7984,710,Clojure,https://github.com/clojure/clojurescript,clojure,2,2019-02-13T19:47:53Z,Clojure to JS compiler
5,Clojure,om,6611,374,Clojure,https://github.com/omcljs/om,omcljs,75,2019-02-17T20:19:25Z,ClojureScript interface to Facebook's React
6,Clojure,leiningen,6250,1458,Clojure,https://github.com/technomancy/leiningen,technomancy,193,2019-02-24T21:17:31Z,Automate Clojure projects without setting your hair on fire.
7,Clojure,overtone,4539,403,Clojure,https://github.com/overtone/overtone,overtone,85,2019-02-17T09:22:36Z,Collaborative Programmable Music 
8,Clojure,icepick,3787,213,Clojure,https://github.com/frankiesardo/icepick,frankiesardo,24,2018-08-21T21:53:46Z,Android Instance State made easy
9,Clojure,riemann,3719,506,Clojure,https://github.com/riemann/riemann,riemann,22,2019-01-31T19:44:57Z,"A network event stream processing system, in Clojure."
10,Clojure,jepsen,3622,423,Clojure,https://github.com/jepsen-io/jepsen,jepsen-io,29,2019-02-24T23:55:59Z,"A framework for distributed systems verification, with fault injection"
11,Clojure,re-frame,3603,472,Clojure,https://github.com/Day8/re-frame,Day8,29,2019-02-24T09:33:33Z,"A Reagent Framework For Writing SPAs, in Clojurescript."
12,Clojure,compojure,3528,232,Clojure,https://github.com/weavejester/compojure,weavejester,2,2018-08-20T21:11:26Z,A concise routing library for Ring/Clojure
13,Clojure,reagent,3325,267,Clojure,https://github.com/reagent-project/reagent,reagent-project,41,2019-02-22T22:25:05Z,A minimalistic ClojureScript interface to React.js
14,Clojure,alda,3235,197,Clojure,https://github.com/alda-lang/alda,alda-lang,2,2019-02-21T00:52:18Z,A music programming language for musicians. :notes:
15,Clojure,datascript,3197,204,Clojure,https://github.com/tonsky/datascript,tonsky,56,2019-02-19T21:24:18Z,"Immutable database and Datalog query engine for Clojure, ClojureScript and JS"
16,Clojure,clojure-koans,3055,1771,Clojure,https://github.com/functional-koans/clojure-koans,functional-koans,4,2019-01-27T12:41:03Z,A set of exercises for learning Clojure
17,Clojure,mori,3051,144,Clojure,https://github.com/swannodette/mori,swannodette,63,2018-11-09T11:13:57Z,ClojureScript's persistent data structures and supporting API from the comfort of vanilla JavaScript
18,Clojure,modern-cljs,2754,310,Clojure,https://github.com/magomimmo/modern-cljs,magomimmo,37,2018-08-30T16:05:03Z,A series of tutorials on ClojureScript
19,Clojure,ring,2725,422,Clojure,https://github.com/ring-clojure/ring,ring-clojure,27,2019-02-13T14:11:19Z,Clojure HTTP server abstraction
20,Clojure,lein-figwheel,2667,216,Clojure,https://github.com/bhauman/lein-figwheel,bhauman,90,2018-12-28T16:11:32Z,Figwheel builds your ClojureScript code and hot loads it into the browser as you are coding!
21,Clojure,quil,2254,147,Clojure,https://github.com/quil/quil,quil,30,2019-02-20T01:05:17Z,Main repo. Quil source code.
22,Clojure,clojure-cookbook,2106,394,Clojure,https://github.com/clojure-cookbook/clojure-cookbook,clojure-cookbook,40,2018-12-27T14:38:31Z,This is the home of O'Reilly's Clojure Cookbook - http://clojure-cookbook.com
23,Clojure,aleph,2094,194,Clojure,https://github.com/ztellman/aleph,ztellman,72,2019-02-23T12:44:34Z,asynchronous communication for clojure
24,Clojure,instaparse,2065,124,Clojure,https://github.com/Engelberg/instaparse,Engelberg,28,2018-12-18T20:39:49Z,
25,Clojure,incanter,2063,280,Clojure,https://github.com/incanter/incanter,incanter,70,2019-02-13T09:57:05Z,"Clojure-based, R-like statistical computing and graphics environment for the JVM"
26,Clojure,pedestal,2010,228,Clojure,https://github.com/pedestal/pedestal,pedestal,40,2019-02-24T14:50:02Z,The Pedestal Server-side Libraries
27,Clojure,schema,1933,231,Clojure,https://github.com/plumatic/schema,plumatic,21,2019-01-21T05:45:28Z,Clojure(Script) library for declarative data description and validation
28,Clojure,hiccup,1861,141,Clojure,https://github.com/weavejester/hiccup,weavejester,25,2019-01-22T01:02:10Z,Fast library for rendering HTML in Clojure
29,Clojure,onyx,1845,194,Clojure,https://github.com/onyx-platform/onyx,onyx-platform,78,2018-12-20T05:57:51Z,"Distributed, masterless, high performance, fault tolerant data processing"
30,Clojure,specter,1831,76,Clojure,https://github.com/nathanmarz/specter,nathanmarz,24,2019-01-29T19:25:16Z,Clojure(Script)'s missing piece
31,Clojure,klipse,1796,86,Clojure,https://github.com/viebel/klipse,viebel,74,2019-02-06T06:19:02Z,"A simple client-side code evaluator pluggable on any web page: clojure, ruby, javascript, python, scheme, es2017, jsx, brainfuck, c++, reagent, lua, ocaml, reasonml, prolog, common lisp"
32,Clojure,transit-format,1604,32,Clojure,https://github.com/cognitect/transit-format,cognitect,9,2017-03-15T11:21:48Z,A data interchange format.
33,Clojure,awesome-clojure,1595,130,Clojure,https://github.com/razum2um/awesome-clojure,razum2um,6,2019-01-17T12:18:11Z,A curated list of awesome Clojure libraries and resources. Inspired by awesome-... stuff
34,Clojure,component,1594,82,Clojure,https://github.com/stuartsierra/component,stuartsierra,2,2019-02-14T12:43:28Z,Managed lifecycle of stateful objects in Clojure
35,Clojure,core.async,1579,174,Clojure,https://github.com/clojure/core.async,clojure,2,2018-12-06T16:30:58Z,Facilities for async programming and communication in Clojure
36,Clojure,boot,1554,167,Clojure,https://github.com/boot-clj/boot,boot-clj,113,2019-02-13T23:13:23Z,Build tooling for Clojure.
37,Clojure,lumo,1543,70,Clojure,https://github.com/anmonteiro/lumo,anmonteiro,83,2019-01-14T16:17:05Z,"Fast, cross-platform, standalone ClojureScript environment"
38,Clojure,kibit,1480,117,Clojure,https://github.com/jonase/kibit,jonase,60,2019-02-21T22:25:26Z,There's a function for that!
39,Clojure,enlive,1459,141,Clojure,https://github.com/cgrand/enlive,cgrand,27,2018-09-26T09:26:22Z,a selector-based (à la CSS) templating and transformation system for Clojure
40,Clojure,Midje,1455,124,Clojure,https://github.com/marick/Midje,marick,38,2019-02-19T23:16:38Z,"Midje provides a migration path from clojure.test to a more flexible, readable, abstract, and gracious style of testing"
41,Clojure,Korma,1397,227,Clojure,https://github.com/korma/Korma,korma,79,2018-08-17T15:20:06Z,Tasty SQL for Clojure.
42,Clojure,auto-parcel,1389,91,Clojure,https://github.com/frankiesardo/auto-parcel,frankiesardo,12,2017-02-12T15:10:29Z,Android Parcelable models made easy
43,Clojure,sente,1378,134,Clojure,https://github.com/ptaoussanis/sente,ptaoussanis,27,2019-02-11T16:49:06Z,Realtime web comms for Clojure/Script
44,Clojure,drake,1361,103,Clojure,https://github.com/Factual/drake,Factual,83,2018-12-12T22:36:59Z,"Data workflow tool, like a ""Make for data"""
45,Clojure,plumbing,1350,109,Clojure,https://github.com/plumatic/plumbing,plumatic,10,2018-02-22T03:32:31Z,Prismatic's Clojure(Script) utility belt
46,Clojure,cascalog,1349,178,Clojure,https://github.com/nathanmarz/cascalog,nathanmarz,40,2016-05-06T07:14:10Z,Data processing on Hadoop without the hassle.
47,Clojure,clj-http,1306,335,Clojure,https://github.com/dakrone/clj-http,dakrone,30,2019-02-07T17:53:24Z,An idiomatic clojure http client wrapping the apache client. Offically supported version.
48,Clojure,duckling_old,1297,232,Clojure,https://github.com/wit-ai/duckling_old,wit-ai,70,2017-06-25T20:07:09Z,Deprecated in favor of https://github.com/facebook/duckling
49,Clojure,Nightcode,1297,120,Clojure,https://github.com/oakes/Nightcode,oakes,30,2019-02-25T03:01:22Z,An IDE for Clojure
50,Clojure,devcards,1290,100,Clojure,https://github.com/bhauman/devcards,bhauman,22,2019-02-05T15:29:01Z,Devcards aims to provide a visual REPL experience for ClojureScript
51,Clojure,yesql,1284,108,Clojure,https://github.com/krisajenkins/yesql,krisajenkins,68,2018-08-03T23:28:21Z,A Clojure library for using SQL.
52,Clojure,seesaw,1248,138,Clojure,https://github.com/daveray/seesaw,daveray,61,2019-01-09T06:57:10Z,"Seesaw turns the Horror of Swing into a friendly, well-documented, Clojure library"
53,Clojure,chestnut,1237,97,Clojure,https://github.com/plexus/chestnut,plexus,7,2019-02-21T08:34:02Z,Application template for Clojure + ClojureScript web apps
54,Clojure,Arcadia,1228,83,Clojure,https://github.com/arcadia-unity/Arcadia,arcadia-unity,30,2019-02-20T04:58:01Z,Clojure in Unity
55,Clojure,liberator,1169,143,Clojure,https://github.com/clojure-liberator/liberator,clojure-liberator,56,2019-01-09T08:26:56Z,Liberator is a Clojure library for building RESTful applications.
56,Clojure,core.logic,1154,102,Clojure,https://github.com/clojure/core.logic,clojure,1,2018-03-06T19:43:22Z,
57,Clojure,lacinia,1141,91,Clojure,https://github.com/walmartlabs/lacinia,walmartlabs,19,2019-02-22T22:17:02Z,GraphQL implementation in pure Clojure
58,Clojure,friend,1140,121,Clojure,https://github.com/cemerick/friend,cemerick,31,2017-07-25T15:52:18Z,An extensible authentication and authorization library for Clojure Ring web applications and services. 
59,Clojure,asciinema-player,1125,122,Clojure,https://github.com/asciinema/asciinema-player,asciinema,40,2018-12-31T16:18:56Z,Web player for terminal session recordings ⏩
60,Clojure,ultra,1122,28,Clojure,https://github.com/venantius/ultra,venantius,11,2019-02-23T05:34:18Z,A Leiningen plugin for a superior development environment
61,Clojure,cortex,1109,95,Clojure,https://github.com/originrose/cortex,originrose,31,2018-09-10T20:29:23Z,Machine learning in Clojure
62,Clojure,closh,1104,28,Clojure,https://github.com/dundalek/closh,dundalek,43,2019-02-21T23:02:49Z,Bash-like shell based on Clojure
63,Clojure,timbre,1100,130,Clojure,https://github.com/ptaoussanis/timbre,ptaoussanis,30,2019-02-15T17:48:48Z,Pure Clojure/Script logging library
64,Clojure,cheshire,1085,113,Clojure,https://github.com/dakrone/cheshire,dakrone,26,2019-02-08T23:36:31Z,Clojure JSON and JSON SMILE (binary json format) encoding/decoding
65,Clojure,core.typed,1070,67,Clojure,https://github.com/clojure/core.typed,clojure,0,2018-11-30T13:19:23Z,An optional type system for Clojure
66,Clojure,code-maat,1042,121,Clojure,https://github.com/adamtornhill/code-maat,adamtornhill,11,2019-01-29T20:32:23Z,A command line tool to mine and analyze data from version-control systems
67,Clojure,frak,1019,39,Clojure,https://github.com/noprompt/frak,noprompt,2,2018-11-16T15:40:25Z,Transform collections of strings into regular expressions.
68,Clojure,lux,1018,40,Clojure,https://github.com/LuxLang/lux,LuxLang,7,2019-02-25T01:53:42Z,The Lux Programming Language
69,Clojure,lein-cljsbuild,1017,164,Clojure,https://github.com/emezeske/lein-cljsbuild,emezeske,50,2018-07-02T13:39:11Z,Leiningen plugin to make ClojureScript development easy.
70,Clojure,frontend,1012,129,Clojure,https://github.com/circleci/frontend,circleci,20,2018-12-25T18:26:30Z,CircleCI's frontend
71,Clojure,garden,985,59,Clojure,https://github.com/noprompt/garden,noprompt,38,2018-10-14T00:19:53Z,Generate CSS with Clojure
72,Clojure,hitchhiker-tree,940,66,Clojure,https://github.com/datacrypt-project/hitchhiker-tree,datacrypt-project,17,2018-07-22T21:01:33Z,"Functional, persistent, off-heap, high performance data structure"
73,Clojure,honeysql,927,103,Clojure,https://github.com/jkk/honeysql,jkk,9,2019-02-11T22:36:54Z,Turn Clojure data structures into SQL
74,Clojure,play-clj,915,70,Clojure,https://github.com/oakes/play-clj,oakes,9,2017-10-21T14:25:43Z,A Clojure game library
75,Clojure,markright,909,59,Clojure,https://github.com/dvcrn/markright,dvcrn,24,2017-03-01T01:38:59Z,➡ Electron powered markdown editor with live preview
76,Clojure,4clojure,908,195,Clojure,https://github.com/4clojure/4clojure,4clojure,82,2019-01-01T08:03:51Z,An interactive problem website for learning Clojure
77,Clojure,compojure-api,907,125,Clojure,https://github.com/metosin/compojure-api,metosin,28,2019-02-12T09:50:09Z,Sweet web apis with Compojure & Swagger
78,Clojure,logic-tutorial,893,83,Clojure,https://github.com/swannodette/logic-tutorial,swannodette,14,2018-10-30T11:45:38Z,A Very Gentle Introduction to Relational Programming
79,Clojure,criterium,880,42,Clojure,https://github.com/hugoduncan/criterium,hugoduncan,13,2017-02-28T09:44:26Z,Benchmarking library for clojure
80,Clojure,test.check,877,93,Clojure,https://github.com/clojure/test.check,clojure,0,2018-11-30T13:29:12Z,QuickCheck for Clojure
81,Clojure,core.match,874,51,Clojure,https://github.com/clojure/core.match,clojure,0,2018-01-05T17:21:58Z,
82,Clojure,eastwood,871,54,Clojure,https://github.com/jonase/eastwood,jonase,103,2019-02-16T19:30:31Z,Clojure lint tool
83,Clojure,clojurec,862,53,Clojure,https://github.com/schani/clojurec,schani,5,2018-04-25T22:28:20Z,A Clojure implementation on top of C
84,Clojure,lt-cljs-tutorial,855,127,Clojure,https://github.com/swannodette/lt-cljs-tutorial,swannodette,10,2015-10-08T07:16:26Z,A ClojureScript Programming Language Tutorial for Light Table Users
85,Clojure,bidi,850,93,Clojure,https://github.com/juxt/bidi,juxt,51,2019-02-19T11:31:45Z,Bidirectional URI routing
86,Clojure,mount,848,64,Clojure,https://github.com/tolitius/mount,tolitius,21,2019-01-28T15:44:09Z,managing Clojure and ClojureScript app state since (reset)
87,Clojure,cljs-devtools,844,32,Clojure,https://github.com/binaryage/cljs-devtools,binaryage,8,2018-11-27T17:26:54Z,A collection of Chrome DevTools enhancements for ClojureScript developers
88,Clojure,carmine,842,89,Clojure,https://github.com/ptaoussanis/carmine,ptaoussanis,14,2019-02-01T14:00:09Z,Redis client and message queue for Clojure
89,Clojure,hoplon,840,64,Clojure,https://github.com/hoplon/hoplon,hoplon,41,2019-01-26T21:54:00Z,Hoplon web development tools and libraries.
90,Clojure,pulsar,840,50,Clojure,https://github.com/puniverse/pulsar,puniverse,9,2017-09-06T16:16:37Z,"Fibers, Channels and Actors for Clojure"
91,Clojure,clara-rules,833,93,Clojure,https://github.com/cerner/clara-rules,cerner,73,2019-02-07T22:21:53Z,Forward-chaining rules in Clojure(Script)
92,Clojure,amazonica,807,172,Clojure,https://github.com/mcohen01/amazonica,mcohen01,26,2019-01-02T05:31:15Z,A comprehensive Clojure client for the entire Amazon AWS api.
93,Clojure,pallet,799,120,Clojure,https://github.com/pallet/pallet,pallet,126,2018-05-25T15:44:26Z,Automates controlling and provisioning cloud server instances. DevOps for the JVM.
94,Clojure,shadow-cljs,787,43,Clojure,https://github.com/thheller/shadow-cljs,thheller,37,2019-02-24T22:14:00Z,ClojureScript compilation made easy
95,Clojure,swarmpit,774,75,Clojure,https://github.com/swarmpit/swarmpit,swarmpit,58,2019-02-20T04:29:10Z,Lightweight mobile-friendly Docker Swarm management UI
96,Clojure,duct,768,42,Clojure,https://github.com/duct-framework/duct,duct-framework,5,2019-02-15T15:34:17Z,Server-side application framework for Clojure
97,Clojure,noir,760,84,Clojure,https://github.com/noir-clojure/noir,noir-clojure,24,2012-12-13T23:35:54Z,A framework for writing web applications in clojure.
98,Clojure,Nightlight,752,33,Clojure,https://github.com/oakes/Nightlight,oakes,13,2019-02-17T22:47:07Z,An embedded editor for Clojure
99,Clojure,environ,751,61,Clojure,https://github.com/weavejester/environ,weavejester,14,2019-01-10T12:38:44Z,Library for managing environment variables in Clojure
100,Clojure,dommy,749,80,Clojure,https://github.com/plumatic/dommy,plumatic,17,2018-01-07T00:14:06Z,A tiny ClojureScript DOM manipulation and event library
1,CoffeeScript,coffeescript,15101,1993,CoffeeScript,https://github.com/jashkenas/coffeescript,jashkenas,41,2019-02-18T22:31:24Z,Unfancy JavaScript
