rank,item,repo_name,stars,forks,language,repo_url,username,issues,last_commit,description
85,Java,symphony,8700,2886,Java,https://github.com/b3log/symphony,b3log,3,2018-12-21T03:56:40Z,🎶 一款用 Java 实现的现代化社区（论坛/BBS/社交网络/博客）平台。https://hacpai.com
86,Java,HikariCP,8682,1316,Java,https://github.com/brettwooldridge/HikariCP,brettwooldridge,103,2018-12-12T09:03:59Z,"光 HikariCP・A solid, high-performance, JDBC connection pool at last."
87,Java,okhttp-OkGo,8610,2150,Java,https://github.com/jeasonlzy/okhttp-OkGo,jeasonlzy,318,2018-08-09T02:48:24Z,OkGo - 3.0 震撼来袭，该库是基于 Http 协议，封装了 OkHttp 的网络请求框架，比 Retrofit 更简单易用，支持 RxJava，RxJava2，支持自定义缓存，支持批量断点下载管理和批量上传管理功能
88,Java,presto,8449,2874,Java,https://github.com/prestodb/presto,prestodb,1458,2018-12-21T02:36:51Z,Distributed SQL query engine for big data
89,Java,Matisse,8442,1265,Java,https://github.com/zhihu/Matisse,zhihu,236,2018-12-20T14:25:17Z,:fireworks: A well-designed local image and video selector for Android
90,Java,PermissionsDispatcher,8395,1201,Java,https://github.com/permissions-dispatcher/PermissionsDispatcher,permissions-dispatcher,2,2018-12-21T03:17:50Z,Simple annotation-based API to handle runtime permissions.
91,Java,hadoop,8365,5249,Java,https://github.com/apache/hadoop,apache,214,2018-12-21T03:54:38Z,Mirror of Apache Hadoop
92,Java,GSYVideoPlayer,8354,1893,Java,https://github.com/CarGuo/GSYVideoPlayer,CarGuo,18,2018-12-20T12:41:38Z,"视频播放器（IJKplayer、ExoPlayer、MediaPlayer），HTTPS支持，支持弹幕，支持滤镜、水印、gif截图，片头广告、中间广告，多个同时播放，支持基本的拖动，声音、亮度调节，支持边播边缓存，支持视频本身自带rotation的旋转（90,270之类），重力旋转与手动旋转的同步支持，支持列表播放 ，直接添加控件为封面，列表全屏动画，视频加载速度，列表小窗口支持拖动，动画效果，调整比例，多分辨率切换，支持切换播放器，进度条小窗口预览，列表切换详情页面无缝播放，其他一些小动画效果，rtsp、concat、mpeg。项目解析： "
93,Java,ARouter,8291,1389,Java,https://github.com/alibaba/ARouter,alibaba,18,2018-12-14T06:45:58Z,💪 A framework for assisting in the renovation of Android componentization (帮助 Android App 进行组件化改造的路由框架)
94,Java,JiaoZiVideoPlayer,8249,2005,Java,https://github.com/lipangit/JiaoZiVideoPlayer,lipangit,40,2018-12-19T16:59:20Z,Android VideoPlayer MediaPlayer VideoView MediaView Float View And Fullscreen
95,Java,AppIntro,8237,1505,Java,https://github.com/paolorotolo/AppIntro,paolorotolo,67,2018-12-15T16:29:22Z,Make a cool intro for your Android app.
96,Java,AVLoadingIndicatorView,8208,1640,Java,https://github.com/81813780/AVLoadingIndicatorView,81813780,62,2018-04-24T02:59:27Z,DEPRECATED
97,Java,AndroidSlidingUpPanel,8164,2197,Java,https://github.com/umano/AndroidSlidingUpPanel,umano,276,2018-10-22T15:51:54Z,This library provides a simple way to add a draggable sliding up panel (popularized by Google Music and Google Maps) to your Android application. Brought to you by Umano.
98,Java,RxTool,8147,2061,Java,https://github.com/vondear/RxTool,vondear,114,2018-11-02T09:50:47Z,Android开发人员不得不收集的工具类集合 | 支付宝支付 | 微信支付（统一下单） | 微信分享 | Zip4j压缩（支持分卷压缩与加密） | 一键集成UCrop选择圆形头像 | 一键集成二维码和条形码的扫描与生成 | 常用Dialog | WebView的封装可播放视频 | 仿斗鱼滑动验证码 | Toast封装 | 震动 | GPS | Location定位 | 图片缩放 | Exif 图片添加地理位置信息（经纬度） | 蛛网等级 | 颜色选择器 | ArcGis | VTPK | 编译运行一下说不定会找到惊喜
99,Java,platform_frameworks_base,8136,5338,Java,https://github.com/aosp-mirror/platform_frameworks_base,aosp-mirror,0,2018-09-05T21:52:03Z,
100,Java,BottomBar,8120,1538,Java,https://github.com/roughike/BottomBar,roughike,294,2017-12-07T16:59:39Z,(Deprecated) A custom view component that mimics the new Material Design Bottom Navigation pattern.
1,JavaScript,freeCodeCamp,296613,20637,JavaScript,https://github.com/freeCodeCamp/freeCodeCamp,freeCodeCamp,6341,2018-12-21T04:00:45Z,The https://www.freeCodeCamp.org open source codebase and curriculum. Learn to code for free together with millions of people.
2,JavaScript,vue,122745,17545,JavaScript,https://github.com/vuejs/vue,vuejs,219,2018-12-20T22:07:35Z,"🖖 A progressive, incrementally-adoptable JavaScript framework for building UI on the web."
3,JavaScript,react,118055,21409,JavaScript,https://github.com/facebook/react,facebook,514,2018-12-20T20:04:26Z,"A declarative, efficient, and flexible JavaScript library for building user interfaces."
4,JavaScript,javascript,79726,15237,JavaScript,https://github.com/airbnb/javascript,airbnb,134,2018-12-20T18:58:29Z,JavaScript Style Guide
5,JavaScript,react-native,72091,16120,JavaScript,https://github.com/facebook/react-native,facebook,887,2018-12-21T00:05:56Z,A framework for building native apps with React.
6,JavaScript,create-react-app,60913,13282,JavaScript,https://github.com/facebook/create-react-app,facebook,331,2018-12-20T18:11:24Z,Set up a modern web app by running one command.
7,JavaScript,angular.js,59309,28998,JavaScript,https://github.com/angular/angular.js,angular,487,2018-12-17T16:59:02Z,AngularJS - HTML enhanced for web apps!
8,JavaScript,Font-Awesome,58232,9911,JavaScript,https://github.com/FortAwesome/Font-Awesome,FortAwesome,4701,2018-12-20T22:41:20Z,"The iconic SVG, font, and CSS toolkit"
9,JavaScript,node,56590,12507,JavaScript,https://github.com/nodejs/node,nodejs,736,2018-12-21T03:51:50Z,Node.js JavaScript runtime :sparkles::turtle::rocket::sparkles:
10,JavaScript,axios,52717,4033,JavaScript,https://github.com/axios/axios,axios,486,2018-12-20T10:44:44Z,Promise based HTTP client for the browser and node.js
11,JavaScript,jquery,50603,17500,JavaScript,https://github.com/jquery/jquery,jquery,90,2018-12-20T10:07:06Z,jQuery JavaScript Library
12,JavaScript,atom,47366,10583,JavaScript,https://github.com/atom/atom,atom,722,2018-12-21T01:52:34Z,:atom: The hackable text editor
13,JavaScript,three.js,47313,17893,JavaScript,https://github.com/mrdoob/three.js,mrdoob,764,2018-12-21T03:01:18Z,JavaScript 3D library.
14,JavaScript,webpack,45948,5811,JavaScript,https://github.com/webpack/webpack,webpack,495,2018-12-20T21:53:58Z,"A bundler for javascript and friends. Packs many modules into a few bundled assets. Code Splitting allows for loading parts of the application on demand. Through ""loaders"", modules can be CommonJs, AMD, ES6 modules, CSS, Images, JSON, Coffeescript, LESS, ... and your custom stuff."
15,JavaScript,redux,45816,11646,JavaScript,https://github.com/reduxjs/redux,reduxjs,28,2018-12-20T17:14:58Z,Predictable state container for JavaScript apps
16,JavaScript,socket.io,44656,8280,JavaScript,https://github.com/socketio/socket.io,socketio,347,2018-12-01T05:38:05Z,Realtime application framework (Node.JS server)
17,JavaScript,Semantic-UI,43895,4694,JavaScript,https://github.com/Semantic-Org/Semantic-UI,Semantic-Org,811,2018-12-13T01:05:14Z,Semantic is a UI component framework based around useful principles from natural language.
18,JavaScript,reveal.js,43827,12735,JavaScript,https://github.com/hakimel/reveal.js,hakimel,398,2018-12-19T10:04:34Z,The HTML Presentation Framework
19,JavaScript,free-programming-books-zh_CN,43258,14617,JavaScript,https://github.com/justjavac/free-programming-books-zh_CN,justjavac,149,2018-12-04T09:39:53Z,:books: 免费的计算机编程类中文书籍，欢迎投稿
20,JavaScript,puppeteer,42975,3686,JavaScript,https://github.com/GoogleChrome/puppeteer,GoogleChrome,296,2018-12-20T00:13:07Z,Headless Chrome Node API
21,JavaScript,html5-boilerplate,41843,9941,JavaScript,https://github.com/h5bp/html5-boilerplate,h5bp,7,2018-12-18T13:55:24Z,"A professional front-end template for building fast, robust, and adaptable web apps or sites."
22,JavaScript,express,41578,7184,JavaScript,https://github.com/expressjs/express,expressjs,160,2018-12-18T04:34:57Z,"Fast, unopinionated, minimalist web framework for node."
23,JavaScript,Chart.js,40940,9242,JavaScript,https://github.com/chartjs/Chart.js,chartjs,465,2018-12-21T03:34:59Z,Simple HTML5 Charts using the <canvas> tag
24,JavaScript,javascript-algorithms,40794,5371,JavaScript,https://github.com/trekhleb/javascript-algorithms,trekhleb,51,2018-12-17T15:51:04Z,📝 Algorithms and data structures implemented in JavaScript with explanations and links to further readings
25,JavaScript,meteor,40626,5031,JavaScript,https://github.com/meteor/meteor,meteor,261,2018-12-19T19:54:48Z,"Meteor, the JavaScript App Platform"
26,JavaScript,moment,39588,5952,JavaScript,https://github.com/moment/moment,moment,353,2018-12-18T01:06:26Z,"Parse, validate, manipulate, and display dates in javascript."
27,JavaScript,resume.github.com,38829,1022,JavaScript,https://github.com/resume/resume.github.com,resume,36,2018-11-17T01:11:45Z,Resumes generated using the GitHub informations
28,JavaScript,json-server,36823,3172,JavaScript,https://github.com/typicode/json-server,typicode,386,2018-11-14T11:06:39Z,Get a full fake REST API with zero coding in less than 30 seconds (seriously)
29,JavaScript,lodash,36380,3771,JavaScript,https://github.com/lodash/lodash,lodash,4,2018-12-16T10:57:55Z,"A modern JavaScript utility library delivering modularity, performance, & extras."
30,JavaScript,30-seconds-of-code,34813,3650,JavaScript,https://github.com/30-seconds/30-seconds-of-code,30-seconds,8,2018-12-17T14:36:06Z,Curated collection of useful JavaScript snippets that you can understand in 30 seconds or less.
31,JavaScript,materialize,34676,4683,JavaScript,https://github.com/Dogfalo/materialize,Dogfalo,586,2018-12-12T22:55:46Z,"Materialize, a CSS Framework based on Material Design"
32,JavaScript,impress.js,34298,6794,JavaScript,https://github.com/impress/impress.js,impress,46,2018-12-17T19:35:26Z,It's a presentation framework based on the power of CSS3 transforms and transitions in modern browsers and inspired by the idea behind prezi.com.
33,JavaScript,yarn,34132,2012,JavaScript,https://github.com/yarnpkg/yarn,yarnpkg,1599,2018-12-20T19:59:33Z,"📦🐈 Fast, reliable, and secure dependency management."
34,JavaScript,react-router,34047,7088,JavaScript,https://github.com/ReactTraining/react-router,ReactTraining,63,2018-12-20T09:58:46Z,Declarative routing for React
35,JavaScript,next.js,32710,3532,JavaScript,https://github.com/zeit/next.js,zeit,298,2018-12-21T02:50:18Z,The React Framework
36,JavaScript,hacker-scripts,32401,5688,JavaScript,https://github.com/NARKOZ/hacker-scripts,NARKOZ,51,2018-10-09T05:16:03Z,Based on a true story
37,JavaScript,incubator-echarts,31715,9228,JavaScript,https://github.com/apache/incubator-echarts,apache,3108,2018-12-20T12:16:17Z,"A powerful, interactive charting and visualization library for browser"
38,JavaScript,babel,31097,3215,JavaScript,https://github.com/babel/babel,babel,737,2018-12-20T21:46:38Z,🐠 Babel is a compiler for writing next generation JavaScript.
39,JavaScript,gulp,30711,4443,JavaScript,https://github.com/gulpjs/gulp,gulpjs,19,2018-12-17T01:19:16Z,The streaming build system
40,JavaScript,jQuery-File-Upload,29560,7901,JavaScript,https://github.com/blueimp/jQuery-File-Upload,blueimp,53,2018-11-14T06:09:12Z,"File Upload widget with multiple file selection, drag&drop support, progress bar, validation and preview images, audio and video for jQuery. Supports cross-domain, chunked and resumable file uploads. Works with any server-side platform (Google App Engine, PHP, Python, Ruby on Rails, Java, etc.) that supports standard HTML form file uploads."
41,JavaScript,brackets,29471,6381,JavaScript,https://github.com/adobe/brackets,adobe,2360,2018-12-07T13:29:52Z,"An open source code editor for the web, written in JavaScript, HTML and CSS."
42,JavaScript,prettier,29236,1514,JavaScript,https://github.com/prettier/prettier,prettier,480,2018-12-20T21:20:08Z,Prettier is an opinionated code formatter.
43,JavaScript,gatsby,29106,3765,JavaScript,https://github.com/gatsbyjs/gatsby,gatsbyjs,854,2018-12-21T01:30:50Z,"Build blazing fast, modern apps and websites with React"
44,JavaScript,parcel,28648,1271,JavaScript,https://github.com/parcel-bundler/parcel,parcel-bundler,593,2018-12-20T19:17:05Z,"📦🚀 Blazing fast, zero configuration web application bundler"
45,JavaScript,Ghost,28261,6115,JavaScript,https://github.com/TryGhost/Ghost,TryGhost,157,2018-12-20T10:50:45Z,The platform for professional publishers
46,JavaScript,awesome-selfhosted,27923,2272,JavaScript,https://github.com/Kickball/awesome-selfhosted,Kickball,42,2018-12-18T18:45:47Z,This is a list of Free Software network services and web applications which can be hosted locally. Selfhosting is the process of locally hosting and managing applications instead of renting from SaaS providers.
47,JavaScript,pm2,27435,1900,JavaScript,https://github.com/Unitech/pm2,Unitech,581,2018-12-19T21:39:04Z,Node.js Production Process Manager with a built-in Load Balancer.
48,JavaScript,backbone,27360,5743,JavaScript,https://github.com/jashkenas/backbone,jashkenas,81,2018-10-12T16:40:18Z,"Give your JS App some Backbone with Models, Views, Collections, and Events"
49,JavaScript,serverless,27106,2969,JavaScript,https://github.com/serverless/serverless,serverless,766,2018-12-20T19:03:34Z,"Serverless Framework – Build web, mobile and IoT applications with serverless architectures using AWS Lambda, Azure Functions, Google CloudFunctions & more! – "
50,JavaScript,hyper,26613,2162,JavaScript,https://github.com/zeit/hyper,zeit,650,2018-12-20T11:18:20Z,A terminal built on web technologies
51,JavaScript,immutable-js,25967,1531,JavaScript,https://github.com/facebook/immutable-js,facebook,99,2018-12-10T14:32:17Z,Immutable persistent data collections for Javascript which increase efficiency and simplicity.
52,JavaScript,fullPage.js,25537,6230,JavaScript,https://github.com/alvarotrigo/fullPage.js,alvarotrigo,137,2018-12-18T11:02:22Z,fullPage plugin by Alvaro Trigo. Create full screen pages fast and simple
53,JavaScript,slate,25515,15301,JavaScript,https://github.com/lord/slate,lord,36,2018-12-13T14:34:13Z,Beautiful static documentation for your API
54,JavaScript,async,25043,2275,JavaScript,https://github.com/caolan/async,caolan,13,2018-12-05T15:33:09Z,Async utilities for node and the browser
55,JavaScript,anime,24925,1872,JavaScript,https://github.com/juliangarnier/anime,juliangarnier,128,2018-12-19T11:47:51Z,JavaScript Animation Engine
56,JavaScript,tech-interview-handbook,24794,3149,JavaScript,https://github.com/yangshun/tech-interview-handbook,yangshun,6,2018-10-31T22:36:02Z,"💯 Algorithms study materials, behavioral content and tips for rocking your coding interview"
57,JavaScript,todomvc,24756,13246,JavaScript,https://github.com/tastejs/todomvc,tastejs,152,2018-12-12T23:01:29Z,"Helping you select an MV* framework - Todo apps for React.js, Ember.js, Angular, and many more"
58,JavaScript,pdf.js,24697,6003,JavaScript,https://github.com/mozilla/pdf.js,mozilla,718,2018-12-21T00:42:35Z,PDF Reader in JavaScript
59,JavaScript,hexo,24598,3352,JavaScript,https://github.com/hexojs/hexo,hexojs,227,2018-12-18T15:00:37Z,"A fast, simple & powerful blog framework, powered by Node.js."
60,JavaScript,clipboard.js,24520,2744,JavaScript,https://github.com/zenorocha/clipboard.js,zenorocha,38,2018-11-18T12:57:10Z,:scissors: Modern copy to clipboard. No Flash. Just 3kb gzipped :clipboard:
61,JavaScript,koa,24316,2209,JavaScript,https://github.com/koajs/koa,koajs,50,2018-12-20T15:05:16Z,Expressive middleware for node.js using ES2017 async functions
62,JavaScript,nylas-mail,24206,1334,JavaScript,https://github.com/nylas/nylas-mail,nylas,1047,2018-10-02T22:52:56Z,:love_letter: An extensible desktop mail app built on the modern web.  Forks welcome!
63,JavaScript,underscore,24027,5354,JavaScript,https://github.com/jashkenas/underscore,jashkenas,114,2018-12-18T17:22:32Z,JavaScript's utility _ belt
64,JavaScript,Leaflet,23580,3907,JavaScript,https://github.com/Leaflet/Leaflet,Leaflet,376,2018-12-20T17:46:54Z, :leaves: JavaScript library for mobile-friendly interactive maps
65,JavaScript,video.js,23529,5787,JavaScript,https://github.com/videojs/video.js,videojs,199,2018-12-20T17:26:25Z,Video.js - open source HTML5 & Flash video player
66,JavaScript,phaser,23466,5796,JavaScript,https://github.com/photonstorm/phaser,photonstorm,163,2018-12-21T02:47:21Z,"Phaser is a fun, free and fast 2D game framework for making HTML5 games for desktop and mobile web browsers, supporting Canvas and WebGL rendering."
67,JavaScript,Modernizr,23253,3009,JavaScript,https://github.com/Modernizr/Modernizr,Modernizr,185,2018-12-14T12:24:19Z,Modernizr is a JavaScript library that detects HTML5 and CSS3 features in the user’s browser.
68,JavaScript,select2,23119,5420,JavaScript,https://github.com/select2/select2,select2,446,2018-12-03T11:07:56Z,"Select2 is a jQuery based replacement for select boxes. It supports searching, remote data sets, and infinite scrolling of results."
69,JavaScript,slick,22991,4506,JavaScript,https://github.com/kenwheeler/slick,kenwheeler,995,2018-12-20T02:31:37Z,the last carousel you'll ever need
70,JavaScript,awesome-mac,22931,2758,JavaScript,https://github.com/jaywcjlove/awesome-mac,jaywcjlove,33,2018-12-20T01:38:47Z," Now we have become very big, Different from the original idea. Collect premium software in various categories."
71,JavaScript,33-js-concepts,22537,1928,JavaScript,https://github.com/leonardomso/33-js-concepts,leonardomso,7,2018-12-20T12:39:15Z,📜 33 concepts every JavaScript developer should know.
72,JavaScript,awesome-react-native,22427,2749,JavaScript,https://github.com/jondot/awesome-react-native,jondot,28,2018-12-16T22:23:22Z,"Awesome React Native components, news, tools, and learning material!"
73,JavaScript,jest,22361,2993,JavaScript,https://github.com/facebook/jest,facebook,559,2018-12-20T21:55:03Z,Delightful JavaScript Testing.
74,JavaScript,incubator-superset,22339,4060,JavaScript,https://github.com/apache/incubator-superset,apache,1113,2018-12-20T17:32:47Z,"Apache Superset (incubating) is a modern, enterprise-ready business intelligence web application"
75,JavaScript,request,21409,2539,JavaScript,https://github.com/request/request,request,316,2018-12-14T17:52:53Z,🏊🏾 Simplified HTTP request client.
76,JavaScript,mermaid,21390,1230,JavaScript,https://github.com/knsv/mermaid,knsv,225,2018-12-18T06:04:20Z,Generation of diagram and flowchart from text in a similar manner as markdown
77,JavaScript,preact,21088,1073,JavaScript,https://github.com/developit/preact,developit,190,2018-12-20T01:18:19Z,⚛️ Fast 3kB React alternative with the same modern API. Components & Virtual DOM.
78,JavaScript,styled-components,21029,1251,JavaScript,https://github.com/styled-components/styled-components,styled-components,60,2018-12-20T11:22:46Z,Visual primitives for the component age. Use the best bits of ES6 and CSS to style your apps without stress 💅
79,JavaScript,fetch,21007,1894,JavaScript,https://github.com/github/fetch,github,11,2018-12-12T07:14:14Z,A window.fetch JavaScript polyfill.
80,JavaScript,realworld,20966,1366,JavaScript,https://github.com/gothinkster/realworld,gothinkster,129,2018-12-20T17:23:54Z,"""The mother of all demo apps"" — Exemplary fullstack Medium.com clone powered by React, Angular, Node, Django, and many more 🏅"
81,JavaScript,Rocket.Chat,20894,4454,JavaScript,https://github.com/RocketChat/Rocket.Chat,RocketChat,2088,2018-12-21T02:30:58Z,"Have your own Slack like online chat, built with Meteor."
82,JavaScript,quill,20889,1542,JavaScript,https://github.com/quilljs/quill,quilljs,511,2018-12-19T15:32:22Z,Quill is a modern WYSIWYG editor built for compatibility and extensibility.
83,JavaScript,react-boilerplate,20831,4026,JavaScript,https://github.com/react-boilerplate/react-boilerplate,react-boilerplate,15,2018-12-20T09:33:39Z,":fire: A highly scalable, offline-first foundation with the best developer experience and a focus on performance and best practices."
84,JavaScript,clean-code-javascript,20431,2124,JavaScript,https://github.com/ryanmcdermott/clean-code-javascript,ryanmcdermott,29,2018-11-09T18:28:10Z,:bathtub: Clean Code concepts adapted for JavaScript
85,JavaScript,ember.js,20296,4075,JavaScript,https://github.com/emberjs/ember.js,emberjs,255,2018-12-21T03:00:13Z,Ember.js - A JavaScript framework for creating ambitious web applications
86,JavaScript,500lines,20280,4689,JavaScript,https://github.com/aosabook/500lines,aosabook,48,2018-10-19T15:15:57Z,500 Lines or Less
87,JavaScript,nodebestpractices,20006,1397,JavaScript,https://github.com/i0natan/nodebestpractices,i0natan,53,2018-12-18T20:17:12Z,The largest Node.JS best practices list (November 2018)
88,JavaScript,standard,19951,1508,JavaScript,https://github.com/standard/standard,standard,88,2018-12-09T20:05:44Z,"🌟 JavaScript Style Guide, with linter & automatic code fixer"
89,JavaScript,postcss,19886,1096,JavaScript,https://github.com/postcss/postcss,postcss,16,2018-12-17T01:59:05Z,Transforming styles with JS plugins
90,JavaScript,gitbook,19867,2755,JavaScript,https://github.com/GitbookIO/gitbook,GitbookIO,981,2018-12-07T10:21:05Z,📝 Modern documentation format and toolchain using Git and Markdown
91,JavaScript,RxJS,19515,2268,JavaScript,https://github.com/Reactive-Extensions/RxJS,Reactive-Extensions,288,2018-04-18T20:17:39Z,The Reactive Extensions for JavaScript
92,JavaScript,hammer.js,19451,2509,JavaScript,https://github.com/hammerjs/hammer.js,hammerjs,257,2018-06-07T10:29:26Z,A javascript library for multi-touch gestures :// You can touch this
93,JavaScript,project-guidelines,18973,1776,JavaScript,https://github.com/elsewhencode/project-guidelines,elsewhencode,11,2018-10-29T10:58:22Z,A set of best practices for JavaScript projects
94,JavaScript,ace,18895,4211,JavaScript,https://github.com/ajaxorg/ace,ajaxorg,641,2018-12-19T22:42:57Z,Ace (Ajax.org Cloud9 Editor)
95,JavaScript,swiper,18487,6594,JavaScript,https://github.com/nolimits4web/swiper,nolimits4web,106,2018-12-19T22:59:26Z,Most modern mobile touch slider with hardware accelerated transitions
96,JavaScript,dragula,18446,1512,JavaScript,https://github.com/bevacqua/dragula,bevacqua,200,2018-12-18T20:03:56Z,:ok_hand: Drag and drop so simple it hurts
97,JavaScript,webtorrent,18285,1757,JavaScript,https://github.com/webtorrent/webtorrent,webtorrent,90,2018-12-21T00:34:16Z,⚡️ Streaming torrent client for the web
98,JavaScript,vuex,18236,5877,JavaScript,https://github.com/vuejs/vuex,vuejs,118,2018-12-20T06:08:43Z,🗃️ Centralized State Management for Vue.js.
99,JavaScript,cheerio,18153,1188,JavaScript,https://github.com/cheeriojs/cheerio,cheeriojs,193,2018-12-15T03:36:41Z,"Fast, flexible, and lean implementation of core jQuery designed specifically for the server."
100,JavaScript,marked,18044,2425,JavaScript,https://github.com/markedjs/marked,markedjs,75,2018-12-20T22:43:56Z,A markdown parser and compiler. Built for speed.
1,Lua,kong,19258,2318,Lua,https://github.com/Kong/kong,Kong,329,2018-12-20T23:37:40Z,:gorilla: The Cloud-Native API Gateway
2,Lua,neural-style,16407,2492,Lua,https://github.com/jcjohnson/neural-style,jcjohnson,309,2018-02-23T01:21:20Z,Torch implementation of neural style algorithm
3,Lua,waifu2x,12701,1467,Lua,https://github.com/nagadomi/waifu2x,nagadomi,72,2018-12-20T07:26:17Z,Image Super-Resolution for Anime-Style Art
4,Lua,openface,11270,2723,Lua,https://github.com/cmusatyalab/openface,cmusatyalab,11,2018-12-09T13:46:40Z,Face recognition with deep neural networks.
5,Lua,char-rnn,8858,2184,Lua,https://github.com/karpathy/char-rnn,karpathy,103,2018-05-04T15:25:25Z,"Multi-layer Recurrent Neural Networks (LSTM, GRU, RNN) for character-level language models in Torch"
6,Lua,CycleGAN,7651,1211,Lua,https://github.com/junyanz/CycleGAN,junyanz,24,2018-12-11T19:28:43Z,"Software that can generate photos from paintings,  turn horses into zebras,  perform style transfer, and more."
7,Lua,pix2pix,5592,910,Lua,https://github.com/phillipi/pix2pix,phillipi,42,2018-12-11T19:25:36Z,Image-to-image translation with conditional adversarial nets
8,Lua,dockercraft,5050,299,Lua,https://github.com/docker/dockercraft,docker,13,2018-06-18T12:15:21Z,Docker + Minecraft = Dockercraft
9,Lua,VeryNginx,4412,684,Lua,https://github.com/alexazhou/VeryNginx,alexazhou,84,2018-09-29T01:16:16Z," A very powerful and friendly  nginx base on lua-nginx-module( openresty ) which provide WAF, Control Panel, and Dashboards. "
10,Lua,koreader,4408,594,Lua,https://github.com/koreader/koreader,koreader,358,2018-12-21T02:03:59Z,"An ebook reader application supporting PDF, DjVu, EPUB, FB2 and many more formats, running on Kindle, Kobo, PocketBook, Ubuntu Touch and Android devices"
11,Lua,fairseq,3272,580,Lua,https://github.com/facebookresearch/fairseq,facebookresearch,8,2018-10-24T13:31:29Z,Facebook AI Research Sequence-to-Sequence Toolkit
12,Lua,lsyncd,3271,327,Lua,https://github.com/axkibe/lsyncd,axkibe,71,2018-12-05T21:42:23Z,Lsyncd (Live Syncing Daemon) synchronizes local directories with remote targets
13,Lua,DenseNet,3102,752,Lua,https://github.com/liuzhuang13/DenseNet,liuzhuang13,22,2018-04-25T23:37:39Z,"Densely Connected Convolutional Networks, In CVPR 2017 (Best Paper Award)."
14,Lua,deepmask,2973,521,Lua,https://github.com/facebookresearch/deepmask,facebookresearch,48,2017-11-11T08:18:40Z,Torch implementation of DeepMask and SharpMask
15,Lua,luvit,2934,315,Lua,https://github.com/luvit/luvit,luvit,77,2018-10-30T22:10:46Z,Lua + libUV + jIT = pure awesomesauce
