rank,item,repo_name,stars,forks,language,repo_url,username,issues,last_commit,description
48,CPP,napajs,8490,313,C++,https://github.com/Microsoft/napajs,Microsoft,58,2018-10-30T21:08:57Z,Napa.js: a multi-threaded JavaScript runtime
49,CPP,CRYENGINE,8449,1622,C++,https://github.com/CRYTEK/CRYENGINE,CRYTEK,254,2019-01-25T18:48:31Z,CRYENGINE is a powerful real-time game development platform created by Crytek.
50,CPP,openage,8347,820,C++,https://github.com/SFTtech/openage,SFTtech,198,2019-01-27T00:40:11Z,Free (as in freedom) open source clone of the Age of Empires II engine :rocket:
51,CPP,Catch2,8265,1353,C++,https://github.com/catchorg/Catch2,catchorg,194,2019-01-26T23:03:17Z,"A modern, C++-native, header-only, test framework for unit-tests, TDD and BDD - using C++11, C++14, C++17 and later (or C++03 on the Catch1.x branch)"
52,CPP,xbmc,8226,4893,C++,https://github.com/xbmc/xbmc,xbmc,266,2019-01-27T02:10:28Z,"Kodi is an award-winning free and open source home theater/media center software and entertainment hub for digital media. With its beautiful interface and powerful skinning engine, it's available for Android, BSD, Linux, macOS, iOS and Windows."
53,CPP,brpc,8176,1859,C++,https://github.com/brpc/brpc,brpc,59,2019-01-26T04:16:14Z,"Industrial-grade RPC framework used throughout Baidu, with 1,000,000+ instances and thousands kinds of services, called ""baidu-rpc"" inside Baidu."
54,CPP,envoy,8152,1184,C++,https://github.com/envoyproxy/envoy,envoyproxy,424,2019-01-27T02:47:34Z,Cloud-native high-performance edge/middle/service proxy
55,CPP,Paddle,8077,2189,C++,https://github.com/PaddlePaddle/Paddle,PaddlePaddle,835,2019-01-27T03:35:11Z,PArallel Distributed Deep LEarning （PaddlePaddle核心框架，高性能单机、分布式训练和跨平台部署）
56,CPP,turicreate,8061,760,C++,https://github.com/apple/turicreate,apple,274,2019-01-25T23:31:21Z,Turi Create simplifies the development of custom machine learning models.
57,CPP,libphonenumber,8057,1051,C++,https://github.com/googlei18n/libphonenumber,googlei18n,77,2019-01-25T01:41:59Z,"Google's common Java, C++ and JavaScript library for parsing, formatting, and validating international phone numbers."
58,CPP,openalpr,8011,1748,C++,https://github.com/openalpr/openalpr,openalpr,371,2018-10-19T21:03:42Z,Automatic License Plate Recognition library
59,CPP,mosh,7964,503,C++,https://github.com/mobile-shell/mosh,mobile-shell,203,2019-01-04T12:09:17Z,Mobile Shell
60,CPP,Karabiner-Elements,7846,503,C++,https://github.com/tekezo/Karabiner-Elements,tekezo,100,2019-01-27T01:45:48Z,Karabiner-Elements is a powerful utility for keyboard customization on macOS Sierra (10.12) or later.
61,CPP,wkhtmltopdf,7708,1094,C++,https://github.com/wkhtmltopdf/wkhtmltopdf,wkhtmltopdf,666,2019-01-08T15:00:17Z,Convert HTML to PDF using Webkit (QtWebKit)
62,CPP,Proton,7708,257,C++,https://github.com/ValveSoftware/Proton,ValveSoftware,1570,2019-01-23T18:48:59Z,Compatibility tool for Steam Play based on Wine and additional components
63,CPP,LightGBM,7680,2056,C++,https://github.com/Microsoft/LightGBM,Microsoft,91,2019-01-27T03:50:56Z,"A fast, distributed, high performance gradient boosting (GBDT, GBRT, GBM or MART) framework based on decision tree algorithms, used for ranking, classification and many other machine learning tasks. It is under the umbrella of the DMTK(http://github.com/microsoft/dmtk) project of Microsoft."
64,CPP,watchman,7572,573,C++,https://github.com/facebook/watchman,facebook,67,2019-01-26T05:38:11Z,"Watches files and records, or triggers actions, when they change. "
65,CPP,vnpy,7328,3470,C++,https://github.com/vnpy/vnpy,vnpy,22,2019-01-26T13:43:10Z,基于Python的开源量化交易平台开发框架
66,CPP,robomongo,7201,624,C++,https://github.com/Studio3T/robomongo,Studio3T,593,2019-01-19T17:46:43Z,Native cross-platform MongoDB management tool
67,CPP,rapidjson,7171,1996,C++,https://github.com/Tencent/rapidjson,Tencent,342,2019-01-25T14:39:08Z,A fast JSON parser/generator for C++ with both SAX/DOM style API
68,CPP,arangodb,7147,533,C++,https://github.com/arangodb/arangodb,arangodb,499,2019-01-26T13:22:53Z,"🥑 ArangoDB is a native multi-model database with flexible data models for documents, graphs, and key-values. Build high performance applications using a convenient SQL-like query language or JavaScript extensions."
69,CPP,notepad-plus-plus,6873,2073,C++,https://github.com/notepad-plus-plus/notepad-plus-plus,notepad-plus-plus,2560,2019-01-27T01:57:24Z,Notepad++ official repository
70,CPP,AirSim,6839,1793,C++,https://github.com/Microsoft/AirSim,Microsoft,373,2019-01-26T23:10:19Z,"Open source simulator for autonomous vehicles built on Unreal Engine / Unity, from Microsoft AI & Research"
71,CPP,openFrameworks,6701,2192,C++,https://github.com/openframeworks/openFrameworks,openframeworks,895,2019-01-19T14:42:57Z,openFrameworks is a community-developed cross platform toolkit for creative coding in C++.
72,CPP,OpenRCT2,6637,721,C++,https://github.com/OpenRCT2/OpenRCT2,OpenRCT2,1077,2019-01-26T17:42:11Z,An open source re-implementation of RollerCoaster Tycoon 2 🎢
73,CPP,solidity,6588,1788,C++,https://github.com/ethereum/solidity,ethereum,581,2019-01-26T14:11:42Z,"Solidity, the Contract-Oriented Programming Language"
74,CPP,synergy-core,6543,1577,C++,https://github.com/symless/synergy-core,symless,244,2019-01-02T14:57:30Z,"Open source core of Synergy, the keyboard and mouse sharing tool"
75,CPP,zeal,6535,518,C++,https://github.com/zealdocs/zeal,zealdocs,131,2019-01-27T00:38:28Z,Offline documentation browser inspired by Dash
76,CPP,dlib,6481,1962,C++,https://github.com/davisking/dlib,davisking,39,2019-01-26T20:17:04Z,A toolkit for making real world machine learning and data analysis applications in C++
77,CPP,AndFix,6422,1575,C++,https://github.com/alibaba/AndFix,alibaba,238,2017-10-18T13:56:12Z,AndFix is a library that offer hot-fix for Android App.
78,CPP,yuzu,6325,402,C++,https://github.com/yuzu-emu/yuzu,yuzu-emu,90,2019-01-27T02:35:03Z,Nintendo Switch Emulator
79,CPP,MMKV,6270,589,C++,https://github.com/Tencent/MMKV,Tencent,2,2019-01-25T04:26:45Z,"An efficient, small mobile key-value storage framework developed by WeChat. Works on iOS, Android, macOS and Windows."
80,CPP,AudioKit,6251,952,C++,https://github.com/AudioKit/AudioKit,AudioKit,10,2019-01-24T20:33:03Z,"Swift audio synthesis, processing, & analysis platform for iOS, macOS and tvOS"
81,CPP,Tars,6232,1549,C++,https://github.com/TarsCloud/Tars,TarsCloud,49,2019-01-02T11:16:40Z,Tars is a highly performance rpc framework based on naming service using tars protocol and provides a semi-automatic operation platform.
82,CPP,capnproto,6215,513,C++,https://github.com/capnproto/capnproto,capnproto,86,2019-01-23T19:45:50Z,Cap'n Proto serialization/RPC system - core tools and C++ library
83,CPP,rpcs3,6085,1078,C++,https://github.com/RPCS3/rpcs3,RPCS3,425,2019-01-26T23:13:39Z,PS3 emulator/debugger
84,CPP,Gource,6062,511,C++,https://github.com/acaudwell/Gource,acaudwell,65,2018-12-06T15:45:49Z,software version control visualization
85,CPP,vowpal_wabbit,6056,1497,C++,https://github.com/VowpalWabbit/vowpal_wabbit,VowpalWabbit,54,2019-01-25T13:34:34Z,"Vowpal Wabbit is a machine learning system which pushes the frontier of machine learning with techniques such as online, hashing, allreduce, reductions, learning2search, active, and interactive learning."
86,CPP,ClickHouse,6023,979,C++,https://github.com/yandex/ClickHouse,yandex,590,2019-01-27T00:43:17Z,ClickHouse is a free analytic DBMS for big data.
87,CPP,tiled,5966,1197,C++,https://github.com/bjorn/tiled,bjorn,432,2019-01-23T22:17:41Z,A flexible level editor
88,CPP,proxygen,5962,1140,C++,https://github.com/facebook/proxygen,facebook,31,2019-01-26T05:55:10Z,A collection of C++ HTTP libraries including an easy to use HTTP server.
89,CPP,shadowsocks-qt5,5952,1896,C++,https://github.com/shadowsocks/shadowsocks-qt5,shadowsocks,31,2019-01-01T20:28:17Z,A cross-platform shadowsocks GUI client
90,CPP,node-sass,5907,821,C++,https://github.com/sass/node-sass,sass,141,2019-01-22T07:31:07Z,:rainbow: Node.js bindings to libsass
91,CPP,ssdb,5902,1207,C++,https://github.com/ideawu/ssdb,ideawu,358,2019-01-24T04:20:23Z,"SSDB - A fast NoSQL database, an alternative to Redis"
92,CPP,tinyrenderer,5898,469,C++,https://github.com/ssloy/tinyrenderer,ssloy,2,2019-01-22T12:30:22Z,A brief computer graphics / rendering course
93,CPP,aseprite,5880,615,C++,https://github.com/aseprite/aseprite,aseprite,661,2019-01-25T19:01:16Z,"Animated sprite editor & pixel art tool (Windows, macOS, Linux)"
94,CPP,thrift,5798,2745,C++,https://github.com/apache/thrift,apache,12,2019-01-27T01:06:33Z,Apache Thrift
95,CPP,bgfx,5733,941,C++,https://github.com/bkaradzic/bgfx,bkaradzic,190,2019-01-27T01:43:34Z,"Cross-platform, graphics API agnostic, ""Bring Your Own Engine/Framework"" style rendering library."
96,CPP,filament,5719,320,C++,https://github.com/google/filament,google,30,2019-01-26T17:59:10Z,"Filament is a real-time physically based rendering engine for Android, iOS, Windows, Linux, macOS and WASM/WebGL"
97,CPP,qBittorrent,5705,975,C++,https://github.com/qbittorrent/qBittorrent,qbittorrent,2356,2019-01-26T17:21:00Z,qBittorrent BitTorrent client
98,CPP,devilution,5676,679,C++,https://github.com/diasurgical/devilution,diasurgical,80,2019-01-27T01:59:07Z,Diablo devolved - magic behind the 1996 computer game
99,CPP,faiss,5627,1063,C++,https://github.com/facebookresearch/faiss,facebookresearch,36,2019-01-15T20:47:03Z,A library for efficient similarity search and clustering of dense vectors.
100,CPP,node-canvas,5625,758,C++,https://github.com/Automattic/node-canvas,Automattic,139,2019-01-26T01:33:49Z,Node canvas is a Cairo backed Canvas implementation for NodeJS.
1,Clojure,FiraCode,30637,949,Clojure,https://github.com/tonsky/FiraCode,tonsky,179,2019-01-02T16:22:34Z,Monospaced font with programming ligatures
2,Clojure,LightTable,10412,893,Clojure,https://github.com/LightTable/LightTable,LightTable,159,2019-01-07T02:06:58Z,The Light Table IDE ⛺
3,Clojure,clojurescript,7962,699,Clojure,https://github.com/clojure/clojurescript,clojure,2,2019-01-25T21:32:24Z,Clojure to JS compiler
4,Clojure,om,6609,371,Clojure,https://github.com/omcljs/om,omcljs,74,2018-06-01T19:24:08Z,ClojureScript interface to Facebook's React
5,Clojure,leiningen,6226,1444,Clojure,https://github.com/technomancy/leiningen,technomancy,193,2019-01-23T02:34:29Z,Automate Clojure projects without setting your hair on fire.
6,Clojure,overtone,4518,401,Clojure,https://github.com/overtone/overtone,overtone,87,2019-01-26T01:35:25Z,Collaborative Programmable Music 
7,Clojure,icepick,3782,213,Clojure,https://github.com/frankiesardo/icepick,frankiesardo,24,2018-08-21T21:53:46Z,Android Instance State made easy
8,Clojure,riemann,3704,503,Clojure,https://github.com/riemann/riemann,riemann,19,2019-01-23T12:56:50Z,"A network event stream processing system, in Clojure."
9,Clojure,re-frame,3565,462,Clojure,https://github.com/Day8/re-frame,Day8,26,2019-01-10T21:57:32Z,"A Reagent Framework For Writing SPAs, in Clojurescript."
10,Clojure,jepsen,3562,413,Clojure,https://github.com/jepsen-io/jepsen,jepsen-io,30,2019-01-25T18:47:58Z,"A framework for distributed systems verification, with fault injection"
11,Clojure,compojure,3512,231,Clojure,https://github.com/weavejester/compojure,weavejester,2,2018-08-20T21:11:26Z,A concise routing library for Ring/Clojure
12,Clojure,reagent,3287,262,Clojure,https://github.com/reagent-project/reagent,reagent-project,37,2019-01-10T19:05:56Z,A minimalistic ClojureScript interface to React.js
13,Clojure,alda,3204,194,Clojure,https://github.com/alda-lang/alda,alda-lang,2,2019-01-27T03:11:46Z,A music programming language for musicians. :notes:
14,Clojure,datascript,3143,202,Clojure,https://github.com/tonsky/datascript,tonsky,56,2019-01-26T21:50:35Z,"Immutable database and Datalog query engine for Clojure, ClojureScript and JS"
15,Clojure,clojure-koans,3047,1770,Clojure,https://github.com/functional-koans/clojure-koans,functional-koans,3,2018-12-31T15:39:25Z,A set of exercises for learning Clojure
16,Clojure,mori,3034,144,Clojure,https://github.com/swannodette/mori,swannodette,63,2018-11-09T11:13:57Z,ClojureScript's persistent data structures and supporting API from the comfort of vanilla JavaScript
17,Clojure,modern-cljs,2744,308,Clojure,https://github.com/magomimmo/modern-cljs,magomimmo,35,2018-08-30T16:05:03Z,A series of tutorials on ClojureScript
18,Clojure,ring,2706,420,Clojure,https://github.com/ring-clojure/ring,ring-clojure,30,2019-01-16T15:29:27Z,Clojure HTTP server abstraction
19,Clojure,lein-figwheel,2650,215,Clojure,https://github.com/bhauman/lein-figwheel,bhauman,87,2018-12-28T16:11:32Z,Figwheel builds your ClojureScript code and hot loads it into the browser as you are coding!
20,Clojure,quil,2237,148,Clojure,https://github.com/quil/quil,quil,28,2019-01-07T18:32:06Z,Main repo. Quil source code.
21,Clojure,clojure-cookbook,2092,393,Clojure,https://github.com/clojure-cookbook/clojure-cookbook,clojure-cookbook,40,2018-12-27T14:38:31Z,This is the home of O'Reilly's Clojure Cookbook - http://clojure-cookbook.com
22,Clojure,aleph,2078,193,Clojure,https://github.com/ztellman/aleph,ztellman,64,2019-01-25T22:26:47Z,asynchronous communication for clojure
23,Clojure,instaparse,2061,124,Clojure,https://github.com/Engelberg/instaparse,Engelberg,28,2018-12-18T20:39:49Z,
24,Clojure,incanter,2052,279,Clojure,https://github.com/incanter/incanter,incanter,69,2018-12-05T13:22:55Z,"Clojure-based, R-like statistical computing and graphics environment for the JVM"
25,Clojure,pedestal,1988,229,Clojure,https://github.com/pedestal/pedestal,pedestal,37,2019-01-25T23:30:19Z,The Pedestal Server-side Libraries
26,Clojure,schema,1920,230,Clojure,https://github.com/plumatic/schema,plumatic,21,2019-01-21T05:45:28Z,Clojure(Script) library for declarative data description and validation
27,Clojure,hiccup,1847,140,Clojure,https://github.com/weavejester/hiccup,weavejester,24,2019-01-22T01:02:10Z,Fast library for rendering HTML in Clojure
28,Clojure,onyx,1835,189,Clojure,https://github.com/onyx-platform/onyx,onyx-platform,77,2018-12-20T05:57:51Z,"Distributed, masterless, high performance, fault tolerant data processing"
29,Clojure,specter,1822,76,Clojure,https://github.com/nathanmarz/specter,nathanmarz,24,2018-12-14T02:23:04Z,Clojure(Script)'s missing piece
30,Clojure,klipse,1764,85,Clojure,https://github.com/viebel/klipse,viebel,74,2019-01-10T12:27:14Z,"A simple client-side code evaluator pluggable on any web page: clojure, ruby, javascript, python, scheme, es2017, jsx, brainfuck, c++, reagent, lua, ocaml, reasonml, prolog, common lisp"
31,Clojure,transit-format,1597,33,Clojure,https://github.com/cognitect/transit-format,cognitect,9,2017-03-15T11:21:48Z,A data interchange format.
32,Clojure,component,1583,82,Clojure,https://github.com/stuartsierra/component,stuartsierra,1,2018-12-30T19:00:34Z,Managed lifecycle of stateful objects in Clojure
33,Clojure,awesome-clojure,1570,131,Clojure,https://github.com/razum2um/awesome-clojure,razum2um,6,2019-01-17T12:18:11Z,A curated list of awesome Clojure libraries and resources. Inspired by awesome-... stuff
34,Clojure,core.async,1567,172,Clojure,https://github.com/clojure/core.async,clojure,2,2018-12-06T16:30:58Z,Facilities for async programming and communication in Clojure
35,Clojure,boot,1548,164,Clojure,https://github.com/boot-clj/boot,boot-clj,110,2019-01-27T03:58:45Z,Build tooling for Clojure.
36,Clojure,lumo,1527,70,Clojure,https://github.com/anmonteiro/lumo,anmonteiro,80,2019-01-14T16:17:05Z,"Fast, cross-platform, standalone ClojureScript environment"
37,Clojure,kibit,1470,114,Clojure,https://github.com/jonase/kibit,jonase,61,2019-01-10T20:00:01Z,There's a function for that!
38,Clojure,enlive,1457,141,Clojure,https://github.com/cgrand/enlive,cgrand,27,2018-09-26T09:26:22Z,a selector-based (à la CSS) templating and transformation system for Clojure
39,Clojure,Midje,1447,124,Clojure,https://github.com/marick/Midje,marick,37,2019-01-17T13:03:08Z,"Midje provides a migration path from clojure.test to a more flexible, readable, abstract, and gracious style of testing"
40,Clojure,Korma,1393,227,Clojure,https://github.com/korma/Korma,korma,79,2018-08-17T15:20:06Z,Tasty SQL for Clojure.
41,Clojure,auto-parcel,1389,91,Clojure,https://github.com/frankiesardo/auto-parcel,frankiesardo,12,2017-02-12T15:10:29Z,Android Parcelable models made easy
42,Clojure,sente,1374,134,Clojure,https://github.com/ptaoussanis/sente,ptaoussanis,26,2019-01-23T18:59:48Z,Realtime web comms for Clojure/Script
43,Clojure,drake,1355,103,Clojure,https://github.com/Factual/drake,Factual,83,2018-12-12T22:36:59Z,"Data workflow tool, like a ""Make for data"""
44,Clojure,cascalog,1345,180,Clojure,https://github.com/nathanmarz/cascalog,nathanmarz,40,2016-05-06T07:14:10Z,Data processing on Hadoop without the hassle.
45,Clojure,plumbing,1342,109,Clojure,https://github.com/plumatic/plumbing,plumatic,10,2018-02-22T03:32:31Z,Prismatic's Clojure(Script) utility belt
46,Clojure,clj-http,1298,331,Clojure,https://github.com/dakrone/clj-http,dakrone,28,2019-01-26T14:15:53Z,An idiomatic clojure http client wrapping the apache client. Offically supported version.
47,Clojure,duckling_old,1295,228,Clojure,https://github.com/wit-ai/duckling_old,wit-ai,70,2017-06-25T20:07:09Z,Deprecated in favor of https://github.com/facebook/duckling
48,Clojure,Nightcode,1284,122,Clojure,https://github.com/oakes/Nightcode,oakes,30,2019-01-24T17:39:17Z,An IDE for Clojure
49,Clojure,yesql,1282,108,Clojure,https://github.com/krisajenkins/yesql,krisajenkins,68,2018-08-03T23:28:21Z,A Clojure library for using SQL.
50,Clojure,devcards,1280,101,Clojure,https://github.com/bhauman/devcards,bhauman,20,2019-01-22T18:39:28Z,Devcards aims to provide a visual REPL experience for ClojureScript
51,Clojure,seesaw,1247,137,Clojure,https://github.com/daveray/seesaw,daveray,61,2019-01-09T06:57:10Z,"Seesaw turns the Horror of Swing into a friendly, well-documented, Clojure library"
52,Clojure,chestnut,1225,95,Clojure,https://github.com/plexus/chestnut,plexus,4,2019-01-01T23:18:56Z,Application template for Clojure + ClojureScript web apps
53,Clojure,Arcadia,1205,83,Clojure,https://github.com/arcadia-unity/Arcadia,arcadia-unity,31,2019-01-14T23:38:58Z,Clojure in Unity
54,Clojure,liberator,1165,143,Clojure,https://github.com/clojure-liberator/liberator,clojure-liberator,55,2019-01-09T08:26:56Z,Liberator is a Clojure library for building RESTful applications.
55,Clojure,core.logic,1148,101,Clojure,https://github.com/clojure/core.logic,clojure,1,2018-03-06T19:43:22Z,
56,Clojure,friend,1137,121,Clojure,https://github.com/cemerick/friend,cemerick,31,2017-07-25T15:52:18Z,An extensible authentication and authorization library for Clojure Ring web applications and services. 
57,Clojure,lacinia,1109,87,Clojure,https://github.com/walmartlabs/lacinia,walmartlabs,18,2019-01-25T23:07:30Z,GraphQL implementation in pure Clojure
58,Clojure,asciinema-player,1107,119,Clojure,https://github.com/asciinema/asciinema-player,asciinema,39,2018-12-31T16:18:56Z,Web player for terminal session recordings ⏩
59,Clojure,ultra,1105,24,Clojure,https://github.com/venantius/ultra,venantius,8,2018-12-14T11:25:48Z,A Leiningen plugin for a superior development environment
60,Clojure,closh,1098,28,Clojure,https://github.com/dundalek/closh,dundalek,43,2019-01-21T20:47:22Z,Bash-like shell based on Clojure
61,Clojure,cortex,1095,95,Clojure,https://github.com/originrose/cortex,originrose,31,2018-09-10T20:29:23Z,Machine learning in Clojure
62,Clojure,timbre,1091,129,Clojure,https://github.com/ptaoussanis/timbre,ptaoussanis,26,2018-11-06T19:11:54Z,Pure Clojure/Script logging library
63,Clojure,cheshire,1082,112,Clojure,https://github.com/dakrone/cheshire,dakrone,26,2018-12-14T17:04:04Z,Clojure JSON and JSON SMILE (binary json format) encoding/decoding
64,Clojure,core.typed,1065,67,Clojure,https://github.com/clojure/core.typed,clojure,0,2018-11-30T13:19:23Z,An optional type system for Clojure
65,Clojure,code-maat,1018,119,Clojure,https://github.com/adamtornhill/code-maat,adamtornhill,12,2019-01-15T07:52:17Z,A command line tool to mine and analyze data from version-control systems
66,Clojure,frak,1017,39,Clojure,https://github.com/noprompt/frak,noprompt,2,2018-11-16T15:40:25Z,Transform collections of strings into regular expressions.
67,Clojure,lein-cljsbuild,1013,163,Clojure,https://github.com/emezeske/lein-cljsbuild,emezeske,50,2018-07-02T13:39:11Z,Leiningen plugin to make ClojureScript development easy.
68,Clojure,lux,1004,40,Clojure,https://github.com/LuxLang/lux,LuxLang,7,2019-01-25T03:50:10Z,The Lux Programming Language
69,Clojure,frontend,1000,129,Clojure,https://github.com/circleci/frontend,circleci,20,2018-12-25T18:26:30Z,CircleCI's frontend
70,Clojure,garden,975,59,Clojure,https://github.com/noprompt/garden,noprompt,36,2018-10-14T00:19:53Z,Generate CSS with Clojure
71,Clojure,hitchhiker-tree,936,65,Clojure,https://github.com/datacrypt-project/hitchhiker-tree,datacrypt-project,17,2018-07-22T21:01:33Z,"Functional, persistent, off-heap, high performance data structure"
72,Clojure,play-clj,914,69,Clojure,https://github.com/oakes/play-clj,oakes,9,2017-10-21T14:25:43Z,A Clojure game library
73,Clojure,honeysql,913,101,Clojure,https://github.com/jkk/honeysql,jkk,9,2019-01-07T23:01:08Z,Turn Clojure data structures into SQL
74,Clojure,markright,909,57,Clojure,https://github.com/dvcrn/markright,dvcrn,24,2017-03-01T01:38:59Z,➡ Electron powered markdown editor with live preview
75,Clojure,4clojure,904,194,Clojure,https://github.com/4clojure/4clojure,4clojure,81,2019-01-01T08:03:51Z,An interactive problem website for learning Clojure
76,Clojure,compojure-api,893,125,Clojure,https://github.com/metosin/compojure-api,metosin,26,2018-12-09T07:23:07Z,Sweet web apis with Compojure & Swagger
77,Clojure,logic-tutorial,890,82,Clojure,https://github.com/swannodette/logic-tutorial,swannodette,14,2018-10-30T11:45:38Z,A Very Gentle Introduction to Relational Programming
78,Clojure,criterium,878,42,Clojure,https://github.com/hugoduncan/criterium,hugoduncan,13,2017-02-28T09:44:26Z,Benchmarking library for clojure
79,Clojure,test.check,872,91,Clojure,https://github.com/clojure/test.check,clojure,0,2018-11-30T13:29:12Z,QuickCheck for Clojure
80,Clojure,core.match,868,51,Clojure,https://github.com/clojure/core.match,clojure,0,2018-01-05T17:21:58Z,
81,Clojure,eastwood,865,54,Clojure,https://github.com/jonase/eastwood,jonase,102,2019-01-26T19:53:02Z,Clojure lint tool
82,Clojure,clojurec,862,53,Clojure,https://github.com/schani/clojurec,schani,5,2018-04-25T22:28:20Z,A Clojure implementation on top of C
83,Clojure,lt-cljs-tutorial,854,127,Clojure,https://github.com/swannodette/lt-cljs-tutorial,swannodette,10,2015-10-08T07:16:26Z,A ClojureScript Programming Language Tutorial for Light Table Users
84,Clojure,bidi,844,89,Clojure,https://github.com/juxt/bidi,juxt,50,2018-12-28T07:12:40Z,Bidirectional URI routing
85,Clojure,mount,843,63,Clojure,https://github.com/tolitius/mount,tolitius,24,2019-01-26T12:23:34Z,managing Clojure and ClojureScript app state since (reset)
86,Clojure,carmine,840,89,Clojure,https://github.com/ptaoussanis/carmine,ptaoussanis,13,2018-11-03T13:04:28Z,Redis client and message queue for Clojure
87,Clojure,cljs-devtools,838,32,Clojure,https://github.com/binaryage/cljs-devtools,binaryage,8,2018-11-27T17:26:54Z,A collection of Chrome DevTools enhancements for ClojureScript developers
88,Clojure,pulsar,837,50,Clojure,https://github.com/puniverse/pulsar,puniverse,9,2017-09-06T16:16:37Z,"Fibers, Channels and Actors for Clojure"
89,Clojure,hoplon,833,63,Clojure,https://github.com/hoplon/hoplon,hoplon,41,2019-01-26T21:54:00Z,Hoplon web development tools and libraries.
90,Clojure,clara-rules,822,93,Clojure,https://github.com/cerner/clara-rules,cerner,68,2019-01-21T22:11:26Z,Forward-chaining rules in Clojure(Script)
91,Clojure,amazonica,805,171,Clojure,https://github.com/mcohen01/amazonica,mcohen01,26,2019-01-02T05:31:15Z,A comprehensive Clojure client for the entire Amazon AWS api.
92,Clojure,pallet,798,120,Clojure,https://github.com/pallet/pallet,pallet,126,2018-05-25T15:44:26Z,Automates controlling and provisioning cloud server instances. DevOps for the JVM.
93,Clojure,noir,763,85,Clojure,https://github.com/noir-clojure/noir,noir-clojure,24,2012-12-13T23:35:54Z,A framework for writing web applications in clojure.
94,Clojure,shadow-cljs,749,39,Clojure,https://github.com/thheller/shadow-cljs,thheller,41,2019-01-26T12:44:42Z,ClojureScript compilation made easy
95,Clojure,dommy,749,80,Clojure,https://github.com/plumatic/dommy,plumatic,17,2018-01-07T00:14:06Z,A tiny ClojureScript DOM manipulation and event library
96,Clojure,environ,745,61,Clojure,https://github.com/weavejester/environ,weavejester,14,2019-01-10T12:38:44Z,Library for managing environment variables in Clojure
97,Clojure,Nightlight,743,33,Clojure,https://github.com/oakes/Nightlight,oakes,12,2019-01-20T13:20:21Z,An embedded editor for Clojure
98,Clojure,tesser,742,39,Clojure,https://github.com/aphyr/tesser,aphyr,3,2018-05-15T13:35:07Z,"Clojure reducers, but for parallel execution: locally and on distributed systems."
99,Clojure,duct,741,40,Clojure,https://github.com/duct-framework/duct,duct-framework,4,2019-01-24T19:27:18Z,Server-side application framework for Clojure
100,Clojure,swarmpit,727,67,Clojure,https://github.com/swarmpit/swarmpit,swarmpit,57,2019-01-25T21:40:25Z,Lightweight Docker Swarm management UI
1,CoffeeScript,coffeescript,15076,1994,CoffeeScript,https://github.com/jashkenas/coffeescript,jashkenas,39,2019-01-22T19:32:51Z,Unfancy JavaScript
2,CoffeeScript,trix,12981,594,CoffeeScript,https://github.com/basecamp/trix,basecamp,31,2019-01-15T16:51:28Z,A rich text editor for everyday writing
