rank,item,repo_name,stars,forks,language,repo_url,username,issues,last_commit,description
49,CPP,tdesktop,9961,2391,C++,https://github.com/telegramdesktop/tdesktop,telegramdesktop,1113,2019-07-23T13:13:45Z,Telegram Desktop messaging app
50,CPP,react-native-windows,9606,704,C++,https://github.com/microsoft/react-native-windows,microsoft,363,2019-07-23T23:37:23Z,A framework for building native Windows apps with React.
51,CPP,libphonenumber,9514,1208,C++,https://github.com/google/libphonenumber,google,80,2019-07-18T00:11:31Z,"Google's common Java, C++ and JavaScript library for parsing, formatting, and validating international phone numbers."
52,CPP,Catch2,9513,1579,C++,https://github.com/catchorg/Catch2,catchorg,218,2019-07-23T19:04:28Z,"A modern, C++-native, header-only, test framework for unit-tests, TDD and BDD - using C++11, C++14, C++17 and later (or C++03 on the Catch1.x branch)"
53,CPP,Paddle,9444,2542,C++,https://github.com/PaddlePaddle/Paddle,PaddlePaddle,1273,2019-07-24T02:53:43Z,PArallel Distributed Deep LEarning （『飞桨』核心框架，高性能单机、分布式训练和跨平台部署）
54,CPP,foundationdb,9395,746,C++,https://github.com/apple/foundationdb,apple,290,2019-07-24T02:32:46Z,"FoundationDB - the open source, distributed, transactional key-value store"
55,CPP,xbmc,9358,5111,C++,https://github.com/xbmc/xbmc,xbmc,520,2019-07-24T00:30:09Z,"Kodi is an award-winning free and open source home theater/media center software and entertainment hub for digital media. With its beautiful interface and powerful skinning engine, it's available for Android, BSD, Linux, macOS, iOS and Windows."
56,CPP,LightGBM,9195,2459,C++,https://github.com/microsoft/LightGBM,microsoft,96,2019-07-24T00:06:25Z,"A fast, distributed, high performance gradient boosting (GBT, GBDT, GBRT, GBM or MART) framework based on decision tree algorithms, used for ranking, classification and many other machine learning tasks. It is under the umbrella of the DMTK(http://github.com/microsoft/dmtk) project of Microsoft."
57,CPP,hardseed,9029,1947,C++,https://github.com/yangyangwithgnu/hardseed,yangyangwithgnu,35,2018-08-25T17:29:23Z,"SEX IS ZERO (0), so, who wanna be the ONE (1), aha?"
58,CPP,vnpy,9016,4139,C++,https://github.com/vnpy/vnpy,vnpy,14,2019-07-24T02:46:31Z,基于Python的开源量化交易平台开发框架
59,CPP,Proton,8991,310,C++,https://github.com/ValveSoftware/Proton,ValveSoftware,1997,2019-07-16T05:31:40Z,Compatibility tool for Steam Play based on Wine and additional components
60,CPP,openage,8946,859,C++,https://github.com/SFTtech/openage,SFTtech,203,2019-07-02T03:00:46Z,Free (as in freedom) open source clone of the Age of Empires II engine :rocket:
61,CPP,incubator-brpc,8863,2109,C++,https://github.com/apache/incubator-brpc,apache,156,2019-07-22T11:52:58Z,"Industrial-grade RPC framework used throughout Baidu, with 1,000,000+ instances and thousands kinds of services, called ""baidu-rpc"" inside Baidu."
62,CPP,CRYENGINE,8854,1719,C++,https://github.com/CRYTEK/CRYENGINE,CRYTEK,65,2019-07-23T08:53:44Z,CRYENGINE is a powerful real-time game development platform created by Crytek.
63,CPP,Karabiner-Elements,8834,552,C++,https://github.com/tekezo/Karabiner-Elements,tekezo,94,2019-07-21T13:55:46Z,Karabiner-Elements is a powerful utility for keyboard customization on macOS Sierra (10.12) or later.
64,CPP,turicreate,8808,868,C++,https://github.com/apple/turicreate,apple,439,2019-07-24T00:59:45Z,Turi Create simplifies the development of custom machine learning models.
65,CPP,napajs,8677,316,C++,https://github.com/microsoft/napajs,microsoft,63,2018-10-30T21:08:57Z,Napa.js: a multi-threaded JavaScript runtime
66,CPP,openalpr,8607,1944,C++,https://github.com/openalpr/openalpr,openalpr,412,2019-07-05T16:30:11Z,Automatic License Plate Recognition library
67,CPP,mosh,8480,534,C++,https://github.com/mobile-shell/mosh,mobile-shell,220,2019-07-17T14:26:11Z,Mobile Shell
68,CPP,wkhtmltopdf,8458,1184,C++,https://github.com/wkhtmltopdf/wkhtmltopdf,wkhtmltopdf,802,2019-07-21T10:07:32Z,Convert HTML to PDF using Webkit (QtWebKit)
69,CPP,arangodb,8278,578,C++,https://github.com/arangodb/arangodb,arangodb,566,2019-07-23T22:48:48Z,"🥑 ArangoDB is a native multi-model database with flexible data models for documents, graphs, and key-values. Build high performance applications using a convenient SQL-like query language or JavaScript extensions."
70,CPP,watchman,8121,628,C++,https://github.com/facebook/watchman,facebook,85,2019-07-24T00:25:56Z,"Watches files and records, or triggers actions, when they change. "
71,CPP,rapidjson,7998,2178,C++,https://github.com/Tencent/rapidjson,Tencent,407,2019-07-22T12:05:59Z,A fast JSON parser/generator for C++ with both SAX/DOM style API
72,CPP,AirSim,7912,2166,C++,https://github.com/microsoft/AirSim,microsoft,512,2019-07-17T07:55:28Z,News: We're hosting a drone racing competition this Neurips. Click on link -->
73,CPP,MMKV,7853,796,C++,https://github.com/Tencent/MMKV,Tencent,2,2019-07-05T12:44:13Z,"An efficient, small mobile key-value storage framework developed by WeChat. Works on iOS, Android, macOS and Windows."
74,CPP,notepad-plus-plus,7739,2238,C++,https://github.com/notepad-plus-plus/notepad-plus-plus,notepad-plus-plus,1008,2019-07-23T19:41:21Z,Notepad++ official repository
75,CPP,yuzu,7694,503,C++,https://github.com/yuzu-emu/yuzu,yuzu-emu,164,2019-07-22T22:12:50Z,Nintendo Switch Emulator
76,CPP,ClickHouse,7659,1306,C++,https://github.com/yandex/ClickHouse,yandex,904,2019-07-24T02:07:23Z,ClickHouse is a free analytic DBMS for big data.
77,CPP,dlib,7614,2278,C++,https://github.com/davisking/dlib,davisking,58,2019-07-20T08:22:23Z,A toolkit for making real world machine learning and data analysis applications in C++
78,CPP,robomongo,7531,659,C++,https://github.com/Studio3T/robomongo,Studio3T,628,2019-06-17T10:06:31Z,Native cross-platform MongoDB management tool
79,CPP,Sonoff-Tasmota,7293,1707,C++,https://github.com/arendst/Sonoff-Tasmota,arendst,24,2019-07-23T21:19:59Z,"Provide ESP8266 based itead Sonoff with Web, MQTT and OTA firmware using Arduino IDE or PlatformIO"
80,CPP,filament,7292,453,C++,https://github.com/google/filament,google,46,2019-07-23T23:02:02Z,"Filament is a real-time physically based rendering engine for Android, iOS, Windows, Linux, macOS and WASM/WebGL"
81,CPP,libfacedetection,7227,2024,C++,https://github.com/ShiqiYu/libfacedetection,ShiqiYu,96,2019-03-28T13:04:20Z,An open source library for face detection in images. The face detection speed can reach 1500FPS. 
82,CPP,Tars,7190,1766,C++,https://github.com/TarsCloud/Tars,TarsCloud,60,2019-07-17T09:27:00Z,"Tars is a high-performance RPC framework based on name service and Tars protocol, also integrated administration platform, and implemented hosting-service via flexible schedule."
83,CPP,solidity,7151,1952,C++,https://github.com/ethereum/solidity,ethereum,655,2019-07-23T19:54:16Z,"Solidity, the Contract-Oriented Programming Language"
84,CPP,OpenRCT2,7137,791,C++,https://github.com/OpenRCT2/OpenRCT2,OpenRCT2,1231,2019-07-23T22:04:08Z,An open source re-implementation of RollerCoaster Tycoon 2 🎢
85,CPP,simdjson,7134,382,C++,https://github.com/lemire/simdjson,lemire,41,2019-07-23T20:14:38Z,Parsing gigabytes of JSON per second 
86,CPP,faiss,7130,1333,C++,https://github.com/facebookresearch/faiss,facebookresearch,36,2019-06-28T11:50:47Z,A library for efficient similarity search and clustering of dense vectors.
87,CPP,openFrameworks,7104,2285,C++,https://github.com/openframeworks/openFrameworks,openframeworks,927,2019-07-21T19:07:30Z,openFrameworks is a community-developed cross platform toolkit for creative coding in C++.
88,CPP,tinyrenderer,7052,564,C++,https://github.com/ssloy/tinyrenderer,ssloy,6,2019-02-20T13:41:57Z,A brief computer graphics / rendering course
89,CPP,zeal,7028,553,C++,https://github.com/zealdocs/zeal,zealdocs,139,2019-07-14T14:47:05Z,Offline documentation browser inspired by Dash
90,CPP,horovod,7000,1051,C++,https://github.com/horovod/horovod,horovod,356,2019-07-24T00:34:59Z,"Distributed training framework for TensorFlow, Keras, PyTorch, and Apache MXNet."
91,CPP,shadowsocks-qt5,6899,2146,C++,https://github.com/shadowsocks/shadowsocks-qt5,shadowsocks,60,2019-01-01T20:28:17Z,A cross-platform shadowsocks GUI client
92,CPP,ncnn,6884,1828,C++,https://github.com/Tencent/ncnn,Tencent,164,2019-07-23T09:05:44Z,ncnn is a high-performance neural network inference framework optimized for the mobile platform
93,CPP,Magisk,6870,1033,C++,https://github.com/topjohnwu/Magisk,topjohnwu,32,2019-07-23T16:34:19Z,A Magic Mask to Alter Android System Systemless-ly
94,CPP,synergy-core,6821,1732,C++,https://github.com/symless/synergy-core,symless,264,2019-07-22T14:48:24Z,"Open source core of Synergy, the keyboard and mouse sharing tool"
95,CPP,qBittorrent,6808,1181,C++,https://github.com/qbittorrent/qBittorrent,qbittorrent,2626,2019-07-23T17:19:17Z,qBittorrent BitTorrent client
96,CPP,rpcs3,6766,1160,C++,https://github.com/RPCS3/rpcs3,RPCS3,432,2019-07-23T22:38:15Z,PS3 emulator/debugger
97,CPP,Gource,6764,551,C++,https://github.com/acaudwell/Gource,acaudwell,75,2019-06-27T22:17:34Z,software version control visualization
98,CPP,AudioKit,6755,1060,C++,https://github.com/AudioKit/AudioKit,AudioKit,8,2019-07-24T00:21:48Z,"Swift audio synthesis, processing, & analysis platform for iOS, macOS and tvOS"
99,CPP,devilution,6660,782,C++,https://github.com/diasurgical/devilution,diasurgical,16,2019-07-24T01:41:34Z,Diablo devolved - magic behind the 1996 computer game
100,CPP,capnproto,6654,555,C++,https://github.com/capnproto/capnproto,capnproto,98,2019-07-23T00:19:36Z,Cap'n Proto serialization/RPC system - core tools and C++ library
1,Clojure,FiraCode,36892,1187,Clojure,https://github.com/tonsky/FiraCode,tonsky,203,2019-07-16T14:45:23Z,Monospaced font with programming ligatures
2,Clojure,metabase,15862,2119,Clojure,https://github.com/metabase/metabase,metabase,2158,2019-07-24T00:35:37Z,"The simplest, fastest way to get business intelligence and analytics  to everyone in your company :yum:"
3,Clojure,LightTable,10700,908,Clojure,https://github.com/LightTable/LightTable,LightTable,190,2019-07-16T14:48:22Z,The Light Table IDE ⛺
4,Clojure,clojurescript,8133,726,Clojure,https://github.com/clojure/clojurescript,clojure,3,2019-07-23T20:26:58Z,Clojure to JS compiler
5,Clojure,om,6612,371,Clojure,https://github.com/omcljs/om,omcljs,78,2019-02-17T20:19:25Z,ClojureScript interface to Facebook's React
6,Clojure,leiningen,6441,1495,Clojure,https://github.com/technomancy/leiningen,technomancy,173,2019-07-22T14:50:46Z,Automate Clojure projects without setting your hair on fire.
7,Clojure,overtone,4638,409,Clojure,https://github.com/overtone/overtone,overtone,87,2019-05-20T17:00:46Z,Collaborative Programmable Music 
8,Clojure,jepsen,3999,455,Clojure,https://github.com/jepsen-io/jepsen,jepsen-io,30,2019-06-26T18:08:32Z,"A framework for distributed systems verification, with fault injection"
9,Clojure,icepick,3819,214,Clojure,https://github.com/frankiesardo/icepick,frankiesardo,25,2018-08-21T21:53:46Z,Android Instance State made easy
10,Clojure,re-frame,3812,514,Clojure,https://github.com/Day8/re-frame,Day8,23,2019-07-15T02:24:11Z,"A Reagent Framework For Writing SPAs, in Clojurescript."
11,Clojure,riemann,3790,510,Clojure,https://github.com/riemann/riemann,riemann,16,2019-06-22T21:56:24Z,"A network event stream processing system, in Clojure."
12,Clojure,compojure,3614,242,Clojure,https://github.com/weavejester/compojure,weavejester,3,2019-06-05T20:11:10Z,A concise routing library for Ring/Clojure
13,Clojure,reagent,3480,282,Clojure,https://github.com/reagent-project/reagent,reagent-project,46,2019-07-02T18:29:18Z,A minimalistic ClojureScript interface to React.js
14,Clojure,alda,3358,203,Clojure,https://github.com/alda-lang/alda,alda-lang,1,2019-06-29T12:22:57Z,A music programming language for musicians. :notes:
15,Clojure,datascript,3310,215,Clojure,https://github.com/tonsky/datascript,tonsky,62,2019-06-05T13:48:58Z,"Immutable database and Datalog query engine for Clojure, ClojureScript and JS"
16,Clojure,clojure-koans,3142,1817,Clojure,https://github.com/functional-koans/clojure-koans,functional-koans,4,2019-06-29T03:45:47Z,A set of exercises for learning Clojure
17,Clojure,mori,3101,144,Clojure,https://github.com/swannodette/mori,swannodette,63,2019-06-10T15:21:45Z,ClojureScript's persistent data structures and supporting API from the comfort of vanilla JavaScript
18,Clojure,ring,2833,433,Clojure,https://github.com/ring-clojure/ring,ring-clojure,32,2019-06-25T20:35:49Z,Clojure HTTP server abstraction
19,Clojure,modern-cljs,2793,308,Clojure,https://github.com/magomimmo/modern-cljs,magomimmo,37,2018-08-30T16:05:03Z,A series of tutorials on ClojureScript
20,Clojure,lein-figwheel,2728,221,Clojure,https://github.com/bhauman/lein-figwheel,bhauman,94,2019-06-17T13:41:41Z,Figwheel builds your ClojureScript code and hot loads it into the browser as you are coding!
21,Clojure,status-react,2719,684,Clojure,https://github.com/status-im/status-react,status-im,514,2019-07-24T01:48:03Z,"a free (libre) open source, mobile OS for Ethereum"
22,Clojure,quil,2321,149,Clojure,https://github.com/quil/quil,quil,25,2019-07-14T03:19:22Z,Main repo. Quil source code.
23,Clojure,clojure-cookbook,2169,397,Clojure,https://github.com/clojure-cookbook/clojure-cookbook,clojure-cookbook,40,2018-12-27T14:38:31Z,This is the home of O'Reilly's Clojure Cookbook - http://clojure-cookbook.com
24,Clojure,aleph,2167,205,Clojure,https://github.com/ztellman/aleph,ztellman,74,2019-07-05T05:54:03Z,asynchronous communication for clojure
25,Clojure,instaparse,2145,125,Clojure,https://github.com/Engelberg/instaparse,Engelberg,28,2019-03-15T06:56:33Z,
26,Clojure,incanter,2087,282,Clojure,https://github.com/incanter/incanter,incanter,74,2019-06-06T15:15:40Z,"Clojure-based, R-like statistical computing and graphics environment for the JVM"
27,Clojure,pedestal,2084,239,Clojure,https://github.com/pedestal/pedestal,pedestal,38,2019-07-15T13:48:54Z,The Pedestal Server-side Libraries
28,Clojure,schema,1976,237,Clojure,https://github.com/plumatic/schema,plumatic,22,2019-06-13T01:48:59Z,Clojure(Script) library for declarative data description and validation
29,Clojure,hiccup,1926,146,Clojure,https://github.com/weavejester/hiccup,weavejester,29,2019-01-22T01:02:10Z,Fast library for rendering HTML in Clojure
30,Clojure,klipse,1892,95,Clojure,https://github.com/viebel/klipse,viebel,77,2019-06-19T16:50:06Z,"Klipse is a Javacript plugin for embedding interactive code snippets in tech blogs. A simple client-side code evaluator pluggable on any web page: clojure, ruby, javascript, python, scheme, es2017, jsx, brainfuck, c++, reagent, lua, ocaml, reasonml, prolog, common lisp"
31,Clojure,specter,1892,75,Clojure,https://github.com/nathanmarz/specter,nathanmarz,25,2019-01-29T19:25:16Z,Clojure(Script)'s missing piece
32,Clojure,onyx,1887,201,Clojure,https://github.com/onyx-platform/onyx,onyx-platform,83,2019-07-05T06:39:24Z,"Distributed, masterless, high performance, fault tolerant data processing"
33,Clojure,awesome-clojure,1721,139,Clojure,https://github.com/razum2um/awesome-clojure,razum2um,6,2019-07-07T23:18:13Z,A curated list of awesome Clojure libraries and resources. Inspired by awesome-... stuff
34,Clojure,component,1645,88,Clojure,https://github.com/stuartsierra/component,stuartsierra,3,2019-02-14T12:43:28Z,Managed lifecycle of stateful objects in Clojure
35,Clojure,transit-format,1635,33,Clojure,https://github.com/cognitect/transit-format,cognitect,9,2019-04-17T19:38:47Z,A data interchange format.
36,Clojure,core.async,1632,180,Clojure,https://github.com/clojure/core.async,clojure,2,2019-06-11T15:43:47Z,Facilities for async programming and communication in Clojure
37,Clojure,lumo,1626,81,Clojure,https://github.com/anmonteiro/lumo,anmonteiro,83,2019-07-10T03:20:50Z,"Fast, cross-platform, standalone ClojureScript environment"
38,Clojure,boot,1591,169,Clojure,https://github.com/boot-clj/boot,boot-clj,102,2019-07-07T03:43:50Z,Build tooling for Clojure.
39,Clojure,kibit,1538,121,Clojure,https://github.com/jonase/kibit,jonase,64,2019-07-14T21:45:48Z,There's a function for that!
40,Clojure,Midje,1503,123,Clojure,https://github.com/marick/Midje,marick,39,2019-07-10T08:57:10Z,"Midje provides a migration path from clojure.test to a more flexible, readable, abstract, and gracious style of testing"
41,Clojure,enlive,1463,143,Clojure,https://github.com/cgrand/enlive,cgrand,28,2019-06-04T15:09:32Z,a selector-based (à la CSS) templating and transformation system for Clojure
42,Clojure,Korma,1419,231,Clojure,https://github.com/korma/Korma,korma,82,2018-08-17T15:20:06Z,Tasty SQL for Clojure.
43,Clojure,sente,1407,144,Clojure,https://github.com/ptaoussanis/sente,ptaoussanis,32,2019-04-05T16:02:44Z,Realtime web comms for Clojure/Script
44,Clojure,auto-parcel,1398,88,Clojure,https://github.com/frankiesardo/auto-parcel,frankiesardo,12,2017-02-12T15:10:29Z,Android Parcelable models made easy
45,Clojure,drake,1384,105,Clojure,https://github.com/Factual/drake,Factual,83,2018-12-12T22:36:59Z,"Data workflow tool, like a ""Make for data"""
46,Clojure,plumbing,1359,108,Clojure,https://github.com/plumatic/plumbing,plumatic,10,2018-02-22T03:32:31Z,Prismatic's Clojure(Script) utility belt
47,Clojure,clj-http,1355,354,Clojure,https://github.com/dakrone/clj-http,dakrone,36,2019-07-17T00:25:50Z,An idiomatic clojure http client wrapping the apache client. Offically supported version.
48,Clojure,cascalog,1354,179,Clojure,https://github.com/nathanmarz/cascalog,nathanmarz,40,2016-05-06T07:14:10Z,Data processing on Hadoop without the hassle.
49,Clojure,Nightcode,1326,118,Clojure,https://github.com/oakes/Nightcode,oakes,32,2019-04-03T03:20:55Z,An IDE for Clojure
50,Clojure,devcards,1315,101,Clojure,https://github.com/bhauman/devcards,bhauman,25,2019-02-05T15:29:01Z,Devcards aims to provide a visual REPL experience for ClojureScript
51,Clojure,yesql,1308,114,Clojure,https://github.com/krisajenkins/yesql,krisajenkins,69,2019-07-06T10:46:03Z,A Clojure library for using SQL.
52,Clojure,konstellate,1308,47,Clojure,https://github.com/containership/konstellate,containership,4,2019-05-21T14:39:48Z,Free and Open Source GUI to Visualize Kubernetes Applications.
53,Clojure,Arcadia,1306,93,Clojure,https://github.com/arcadia-unity/Arcadia,arcadia-unity,43,2019-07-22T18:05:49Z,Clojure in Unity
54,Clojure,duckling_old,1301,234,Clojure,https://github.com/facebookarchive/duckling_old,facebookarchive,70,2019-05-30T14:10:47Z,Deprecated in favor of https://github.com/facebook/duckling
55,Clojure,seesaw,1274,141,Clojure,https://github.com/daveray/seesaw,daveray,64,2019-01-09T06:57:10Z,"Seesaw turns the Horror of Swing into a friendly, well-documented, Clojure library"
56,Clojure,chestnut,1258,98,Clojure,https://github.com/plexus/chestnut,plexus,6,2019-04-03T20:11:35Z,Application template for Clojure + ClojureScript web apps
57,Clojure,asciinema-player,1243,136,Clojure,https://github.com/asciinema/asciinema-player,asciinema,45,2018-12-31T16:18:56Z,Web player for terminal session recordings ⏩
58,Clojure,lacinia,1243,97,Clojure,https://github.com/walmartlabs/lacinia,walmartlabs,13,2019-07-11T19:26:59Z,GraphQL implementation in pure Clojure
59,Clojure,core.logic,1192,104,Clojure,https://github.com/clojure/core.logic,clojure,1,2019-04-28T22:32:01Z,
60,Clojure,liberator,1179,146,Clojure,https://github.com/clojure-liberator/liberator,clojure-liberator,60,2019-07-05T14:51:58Z,Liberator is a Clojure library for building RESTful applications.
61,Clojure,ultra,1171,30,Clojure,https://github.com/venantius/ultra,venantius,8,2019-03-09T13:33:25Z,A Leiningen plugin for a superior development environment
62,Clojure,closh,1170,33,Clojure,https://github.com/dundalek/closh,dundalek,49,2019-07-20T16:50:11Z,Bash-like shell based on Clojure
63,Clojure,cortex,1152,97,Clojure,https://github.com/originrose/cortex,originrose,30,2018-09-10T20:29:23Z,Machine learning in Clojure
64,Clojure,friend,1151,120,Clojure,https://github.com/cemerick/friend,cemerick,31,2017-07-25T15:52:18Z,An extensible authentication and authorization library for Clojure Ring web applications and services. 
65,Clojure,code-maat,1129,131,Clojure,https://github.com/adamtornhill/code-maat,adamtornhill,12,2019-01-29T20:32:23Z,A command line tool to mine and analyze data from version-control systems
66,Clojure,timbre,1128,139,Clojure,https://github.com/ptaoussanis/timbre,ptaoussanis,43,2019-06-17T17:09:54Z,Pure Clojure/Script logging library
67,Clojure,cheshire,1125,118,Clojure,https://github.com/dakrone/cheshire,dakrone,28,2019-03-26T20:57:39Z,Clojure JSON and JSON SMILE (binary json format) encoding/decoding
68,Clojure,core.typed,1094,68,Clojure,https://github.com/clojure/core.typed,clojure,0,2019-04-29T03:09:02Z,An optional type system for Clojure
69,Clojure,frontend,1047,146,Clojure,https://github.com/circleci/frontend,circleci,21,2019-06-18T23:54:18Z,CircleCI's frontend
70,Clojure,lux,1041,41,Clojure,https://github.com/LuxLang/lux,LuxLang,6,2019-07-08T04:24:38Z,The Lux Programming Language
71,Clojure,frak,1036,39,Clojure,https://github.com/noprompt/frak,noprompt,1,2019-04-10T22:38:00Z,Transform collections of strings into regular expressions.
72,Clojure,lein-cljsbuild,1028,164,Clojure,https://github.com/emezeske/lein-cljsbuild,emezeske,50,2018-07-02T13:39:11Z,Leiningen plugin to make ClojureScript development easy.
73,Clojure,garden,1017,62,Clojure,https://github.com/noprompt/garden,noprompt,35,2019-04-10T22:38:13Z,Generate CSS with Clojure
74,Clojure,swarmpit,1010,97,Clojure,https://github.com/swarmpit/swarmpit,swarmpit,63,2019-07-17T17:21:25Z,Lightweight mobile-friendly Docker Swarm management UI
75,Clojure,honeysql,987,106,Clojure,https://github.com/jkk/honeysql,jkk,9,2019-05-28T17:06:02Z,Turn Clojure data structures into SQL
76,Clojure,hitchhiker-tree,974,68,Clojure,https://github.com/datacrypt-project/hitchhiker-tree,datacrypt-project,17,2018-07-22T21:01:33Z,"Functional, persistent, off-heap, high performance data structure"
77,Clojure,shadow-cljs,959,52,Clojure,https://github.com/thheller/shadow-cljs,thheller,55,2019-07-21T15:37:34Z,ClojureScript compilation made easy
78,Clojure,compojure-api,942,127,Clojure,https://github.com/metosin/compojure-api,metosin,34,2019-04-25T17:27:31Z,Sweet web apis with Compojure & Swagger
79,Clojure,4clojure,935,201,Clojure,https://github.com/4clojure/4clojure,4clojure,80,2019-01-01T08:03:51Z,An interactive problem website for learning Clojure
80,Clojure,play-clj,920,72,Clojure,https://github.com/oakes/play-clj,oakes,9,2019-03-11T00:46:23Z,A Clojure game library
81,Clojure,eastwood,912,59,Clojure,https://github.com/jonase/eastwood,jonase,107,2019-06-28T17:43:45Z,Clojure lint tool
82,Clojure,markright,907,60,Clojure,https://github.com/dvcrn/markright,dvcrn,24,2017-03-01T01:38:59Z,➡ Electron powered markdown editor with live preview
83,Clojure,test.check,906,99,Clojure,https://github.com/clojure/test.check,clojure,0,2019-06-30T18:34:28Z,QuickCheck for Clojure
84,Clojure,core.match,904,53,Clojure,https://github.com/clojure/core.match,clojure,0,2019-04-28T22:32:06Z,
85,Clojure,logic-tutorial,904,83,Clojure,https://github.com/swannodette/logic-tutorial,swannodette,14,2018-10-30T11:45:38Z,A Very Gentle Introduction to Relational Programming
86,Clojure,criterium,894,45,Clojure,https://github.com/hugoduncan/criterium,hugoduncan,12,2019-04-19T12:17:45Z,Benchmarking library for clojure
87,Clojure,mount,893,70,Clojure,https://github.com/tolitius/mount,tolitius,21,2019-07-09T20:28:23Z,managing Clojure and ClojureScript app state since (reset)
88,Clojure,carmine,877,95,Clojure,https://github.com/ptaoussanis/carmine,ptaoussanis,16,2019-05-11T13:37:28Z,Redis client and message queue for Clojure
89,Clojure,bidi,873,87,Clojure,https://github.com/juxt/bidi,juxt,49,2019-06-14T11:02:07Z,Bidirectional URI routing
90,Clojure,clojurec,870,54,Clojure,https://github.com/schani/clojurec,schani,5,2018-04-25T22:28:20Z,A Clojure implementation on top of C
91,Clojure,cljs-devtools,867,35,Clojure,https://github.com/binaryage/cljs-devtools,binaryage,8,2019-07-02T19:57:31Z,A collection of Chrome DevTools enhancements for ClojureScript developers
92,Clojure,clara-rules,867,95,Clojure,https://github.com/cerner/clara-rules,cerner,72,2019-07-05T12:38:38Z,Forward-chaining rules in Clojure(Script)
93,Clojure,lt-cljs-tutorial,859,128,Clojure,https://github.com/swannodette/lt-cljs-tutorial,swannodette,10,2015-10-08T07:16:26Z,A ClojureScript Programming Language Tutorial for Light Table Users
94,Clojure,hoplon,858,65,Clojure,https://github.com/hoplon/hoplon,hoplon,37,2019-07-07T15:42:56Z,Hoplon web development tools and libraries.
95,Clojure,pulsar,851,51,Clojure,https://github.com/puniverse/pulsar,puniverse,9,2017-09-06T16:16:37Z,"Fibers, Channels and Actors for Clojure"
96,Clojure,duct,834,45,Clojure,https://github.com/duct-framework/duct,duct-framework,6,2019-06-26T18:17:39Z,Server-side application framework for Clojure
97,Clojure,amazonica,820,176,Clojure,https://github.com/mcohen01/amazonica,mcohen01,29,2019-07-19T15:41:21Z,A comprehensive Clojure client for the entire Amazon AWS api.
98,Clojure,pallet,802,122,Clojure,https://github.com/pallet/pallet,pallet,126,2018-05-25T15:44:26Z,Automates controlling and provisioning cloud server instances. DevOps for the JVM.
99,Clojure,Nightlight,781,37,Clojure,https://github.com/oakes/Nightlight,oakes,12,2019-05-31T11:43:51Z,An embedded editor for Clojure
100,Clojure,environ,773,63,Clojure,https://github.com/weavejester/environ,weavejester,14,2019-01-10T12:38:44Z,Library for managing environment variables in Clojure
1,CoffeeScript,coffeescript,15254,1995,CoffeeScript,https://github.com/jashkenas/coffeescript,jashkenas,44,2019-07-23T23:01:13Z,Unfancy JavaScript
2,CoffeeScript,trix,13746,656,CoffeeScript,https://github.com/basecamp/trix,basecamp,26,2019-07-15T12:45:00Z,A rich text editor for everyday writing
