rank,item,repo_name,stars,forks,language,repo_url,username,issues,last_commit,description
43,CPP,sqlitebrowser,11453,1313,C++,https://github.com/sqlitebrowser/sqlitebrowser,sqlitebrowser,356,2019-06-13T14:32:04Z,"Official home of the DB Browser for SQLite (DB4S) project. Previously known as ""SQLite Database Browser"" and ""Database Browser for SQLite"". Website at: "
44,CPP,leetcode,10906,3445,C++,https://github.com/haoel/leetcode,haoel,34,2019-06-12T13:06:19Z,LeetCode Problems' Solutions 
45,CPP,uWebSockets,10634,1010,C++,https://github.com/uNetworking/uWebSockets,uNetworking,19,2019-06-14T19:56:06Z,"Simple, secure & standards compliant web I/O for the most demanding of applications"
46,CPP,DeepSpeech,10387,1913,C++,https://github.com/mozilla/DeepSpeech,mozilla,99,2019-06-14T17:39:01Z,A TensorFlow implementation of Baidu's DeepSpeech architecture
47,CPP,envoy,9928,1524,C++,https://github.com/envoyproxy/envoy,envoyproxy,489,2019-06-15T02:37:28Z,Cloud-native high-performance edge/middle/service proxy
48,CPP,tdesktop,9671,2325,C++,https://github.com/telegramdesktop/tdesktop,telegramdesktop,1034,2019-06-12T07:18:48Z,Telegram Desktop messaging app
49,CPP,foundationdb,9303,733,C++,https://github.com/apple/foundationdb,apple,272,2019-06-14T22:26:42Z,"FoundationDB - the open source, distributed, transactional key-value store"
50,CPP,Catch2,9196,1526,C++,https://github.com/catchorg/Catch2,catchorg,209,2019-06-14T19:39:26Z,"A modern, C++-native, header-only, test framework for unit-tests, TDD and BDD - using C++11, C++14, C++17 and later (or C++03 on the Catch1.x branch)"
51,CPP,libphonenumber,9172,1178,C++,https://github.com/google/libphonenumber,google,80,2019-06-14T08:01:39Z,"Google's common Java, C++ and JavaScript library for parsing, formatting, and validating international phone numbers."
52,CPP,xbmc,9129,5074,C++,https://github.com/xbmc/xbmc,xbmc,495,2019-06-14T21:10:19Z,"Kodi is an award-winning free and open source home theater/media center software and entertainment hub for digital media. With its beautiful interface and powerful skinning engine, it's available for Android, BSD, Linux, macOS, iOS and Windows."
53,CPP,hardseed,8991,1944,C++,https://github.com/yangyangwithgnu/hardseed,yangyangwithgnu,35,2018-08-25T17:29:23Z,"SEX IS ZERO (0), so, who wanna be the ONE (1), aha?"
54,CPP,Paddle,8934,2427,C++,https://github.com/PaddlePaddle/Paddle,PaddlePaddle,1173,2019-06-15T01:43:34Z,PArallel Distributed Deep LEarning （『飞桨』核心框架，高性能单机、分布式训练和跨平台部署）
55,CPP,LightGBM,8900,2384,C++,https://github.com/microsoft/LightGBM,microsoft,88,2019-06-14T15:03:03Z,"A fast, distributed, high performance gradient boosting (GBT, GBDT, GBRT, GBM or MART) framework based on decision tree algorithms, used for ranking, classification and many other machine learning tasks. It is under the umbrella of the DMTK(http://github.com/microsoft/dmtk) project of Microsoft."
56,CPP,openage,8830,850,C++,https://github.com/SFTtech/openage,SFTtech,204,2019-06-15T02:38:15Z,Free (as in freedom) open source clone of the Age of Empires II engine :rocket:
57,CPP,CRYENGINE,8747,1680,C++,https://github.com/CRYTEK/CRYENGINE,CRYTEK,133,2019-06-14T16:48:22Z,CRYENGINE is a powerful real-time game development platform created by Crytek.
58,CPP,Proton,8745,297,C++,https://github.com/ValveSoftware/Proton,ValveSoftware,1938,2019-06-11T16:29:15Z,Compatibility tool for Steam Play based on Wine and additional components
59,CPP,turicreate,8697,843,C++,https://github.com/apple/turicreate,apple,423,2019-06-15T01:39:48Z,Turi Create simplifies the development of custom machine learning models.
60,CPP,vnpy,8674,3967,C++,https://github.com/vnpy/vnpy,vnpy,21,2019-06-14T14:08:34Z,基于Python的开源量化交易平台开发框架
61,CPP,napajs,8660,314,C++,https://github.com/microsoft/napajs,microsoft,62,2018-10-30T21:08:57Z,Napa.js: a multi-threaded JavaScript runtime
62,CPP,incubator-brpc,8656,2043,C++,https://github.com/apache/incubator-brpc,apache,137,2019-06-14T10:03:38Z,"Industrial-grade RPC framework used throughout Baidu, with 1,000,000+ instances and thousands kinds of services, called ""baidu-rpc"" inside Baidu."
63,CPP,Karabiner-Elements,8608,535,C++,https://github.com/tekezo/Karabiner-Elements,tekezo,100,2019-06-14T19:19:52Z,Karabiner-Elements is a powerful utility for keyboard customization on macOS Sierra (10.12) or later.
64,CPP,openalpr,8493,1901,C++,https://github.com/openalpr/openalpr,openalpr,404,2019-05-13T13:44:16Z,Automatic License Plate Recognition library
65,CPP,mosh,8361,528,C++,https://github.com/mobile-shell/mosh,mobile-shell,215,2019-06-13T06:15:52Z,Mobile Shell
66,CPP,wkhtmltopdf,8289,1161,C++,https://github.com/wkhtmltopdf/wkhtmltopdf,wkhtmltopdf,774,2019-05-02T11:53:16Z,Convert HTML to PDF using Webkit (QtWebKit)
67,CPP,arangodb,8120,572,C++,https://github.com/arangodb/arangodb,arangodb,536,2019-06-14T23:39:06Z,"🥑 ArangoDB is a native multi-model database with flexible data models for documents, graphs, and key-values. Build high performance applications using a convenient SQL-like query language or JavaScript extensions."
68,CPP,watchman,8022,610,C++,https://github.com/facebook/watchman,facebook,75,2019-06-15T01:13:59Z,"Watches files and records, or triggers actions, when they change. "
69,CPP,REKCARC-TSC-UHT,7850,2233,C++,https://github.com/PKUanonym/REKCARC-TSC-UHT,PKUanonym,5,2019-06-14T14:38:31Z,"清华大学计算机系课程攻略 Guidance for courses in Department of Computer Science and Technology, Tsinghua University"
70,CPP,rapidjson,7810,2146,C++,https://github.com/Tencent/rapidjson,Tencent,394,2019-06-07T11:48:54Z,A fast JSON parser/generator for C++ with both SAX/DOM style API
71,CPP,AirSim,7701,2076,C++,https://github.com/microsoft/AirSim,microsoft,463,2019-06-12T22:04:19Z,"Open source simulator for autonomous vehicles built on Unreal Engine / Unity, from Microsoft AI & Research"
72,CPP,notepad-plus-plus,7592,2202,C++,https://github.com/notepad-plus-plus/notepad-plus-plus,notepad-plus-plus,951,2019-06-14T17:11:01Z,Notepad++ official repository
73,CPP,MMKV,7524,756,C++,https://github.com/Tencent/MMKV,Tencent,4,2019-06-13T02:42:52Z,"An efficient, small mobile key-value storage framework developed by WeChat. Works on iOS, Android, macOS and Windows."
74,CPP,robomongo,7480,655,C++,https://github.com/Studio3T/robomongo,Studio3T,618,2019-04-12T14:12:22Z,Native cross-platform MongoDB management tool
75,CPP,dlib,7396,2203,C++,https://github.com/davisking/dlib,davisking,49,2019-06-09T14:36:53Z,A toolkit for making real world machine learning and data analysis applications in C++
76,CPP,ClickHouse,7173,1219,C++,https://github.com/yandex/ClickHouse,yandex,829,2019-06-15T01:11:25Z,ClickHouse is a free analytic DBMS for big data.
77,CPP,yuzu,7145,465,C++,https://github.com/yuzu-emu/yuzu,yuzu-emu,104,2019-06-14T15:24:19Z,Nintendo Switch Emulator
78,CPP,libfacedetection,7045,1937,C++,https://github.com/ShiqiYu/libfacedetection,ShiqiYu,93,2019-03-28T13:04:20Z,An open source library for face detection in images. The face detection speed can reach 1500FPS. 
79,CPP,OpenRCT2,7039,772,C++,https://github.com/OpenRCT2/OpenRCT2,OpenRCT2,1151,2019-06-14T21:55:13Z,An open source re-implementation of RollerCoaster Tycoon 2 🎢
80,CPP,openFrameworks,7012,2263,C++,https://github.com/openframeworks/openFrameworks,openframeworks,910,2019-06-13T22:07:05Z,openFrameworks is a community-developed cross platform toolkit for creative coding in C++.
81,CPP,solidity,7009,1915,C++,https://github.com/ethereum/solidity,ethereum,650,2019-06-14T16:22:18Z,"Solidity, the Contract-Oriented Programming Language"
82,CPP,Sonoff-Tasmota,7002,1636,C++,https://github.com/arendst/Sonoff-Tasmota,arendst,26,2019-06-14T16:57:34Z,"Provide ESP8266 based itead Sonoff with Web, MQTT and OTA firmware using Arduino IDE or PlatformIO"
83,CPP,Tars,6965,1720,C++,https://github.com/TarsCloud/Tars,TarsCloud,44,2019-06-05T15:26:21Z,"Tars is a high-performance RPC framework based on name service and Tars protocol, also integrated administration platform, and implemented hosting-service via flexible schedule."
84,CPP,filament,6964,427,C++,https://github.com/google/filament,google,35,2019-06-15T01:56:32Z,"Filament is a real-time physically based rendering engine for Android, iOS, Windows, Linux, macOS and WASM/WebGL"
85,CPP,zeal,6922,543,C++,https://github.com/zealdocs/zeal,zealdocs,131,2019-05-11T03:05:55Z,Offline documentation browser inspired by Dash
86,CPP,simdjson,6916,361,C++,https://github.com/lemire/simdjson,lemire,42,2019-06-12T20:32:47Z,Parsing gigabytes of JSON per second 
87,CPP,tinyrenderer,6878,543,C++,https://github.com/ssloy/tinyrenderer,ssloy,5,2019-02-20T13:41:57Z,A brief computer graphics / rendering course
88,CPP,synergy-core,6771,1699,C++,https://github.com/symless/synergy-core,symless,259,2019-05-24T10:17:26Z,"Open source core of Synergy, the keyboard and mouse sharing tool"
89,CPP,faiss,6751,1266,C++,https://github.com/facebookresearch/faiss,facebookresearch,32,2019-06-14T18:52:52Z,A library for efficient similarity search and clustering of dense vectors.
90,CPP,AudioKit,6689,1043,C++,https://github.com/AudioKit/AudioKit,AudioKit,4,2019-06-14T18:18:27Z,"Swift audio synthesis, processing, & analysis platform for iOS, macOS and tvOS"
91,CPP,shadowsocks-qt5,6683,2082,C++,https://github.com/shadowsocks/shadowsocks-qt5,shadowsocks,53,2019-01-01T20:28:17Z,A cross-platform shadowsocks GUI client
92,CPP,Gource,6666,543,C++,https://github.com/acaudwell/Gource,acaudwell,74,2019-06-14T02:36:08Z,software version control visualization
93,CPP,horovod,6628,969,C++,https://github.com/horovod/horovod,horovod,318,2019-06-15T01:30:14Z,"Distributed training framework for TensorFlow, Keras, PyTorch, and Apache MXNet."
94,CPP,rpcs3,6617,1145,C++,https://github.com/RPCS3/rpcs3,RPCS3,449,2019-06-14T22:24:12Z,PS3 emulator/debugger
95,CPP,ncnn,6562,1736,C++,https://github.com/Tencent/ncnn,Tencent,142,2019-06-14T09:48:40Z,ncnn is a high-performance neural network inference framework optimized for the mobile platform
96,CPP,AndFix,6554,1587,C++,https://github.com/alibaba/AndFix,alibaba,237,2017-10-18T13:56:12Z,AndFix is a library that offer hot-fix for Android App.
97,CPP,capnproto,6546,548,C++,https://github.com/capnproto/capnproto,capnproto,98,2019-06-10T16:29:22Z,Cap'n Proto serialization/RPC system - core tools and C++ library
98,CPP,qBittorrent,6539,1120,C++,https://github.com/qbittorrent/qBittorrent,qbittorrent,2583,2019-06-14T21:19:14Z,qBittorrent BitTorrent client
99,CPP,Magisk,6421,953,C++,https://github.com/topjohnwu/Magisk,topjohnwu,27,2019-06-14T04:33:26Z,A Magic Mask to Alter Android System Systemless-ly
100,CPP,bgfx,6399,1034,C++,https://github.com/bkaradzic/bgfx,bkaradzic,218,2019-06-15T02:10:34Z,"Cross-platform, graphics API agnostic, ""Bring Your Own Engine/Framework"" style rendering library."
1,Clojure,FiraCode,35636,1141,Clojure,https://github.com/tonsky/FiraCode,tonsky,190,2019-06-09T15:17:34Z,Monospaced font with programming ligatures
2,Clojure,metabase,15315,2035,Clojure,https://github.com/metabase/metabase,metabase,2158,2019-06-15T01:23:49Z,"The simplest, fastest way to get business intelligence and analytics  to everyone in your company :yum:"
3,Clojure,LightTable,10649,904,Clojure,https://github.com/LightTable/LightTable,LightTable,189,2019-04-21T18:09:00Z,The Light Table IDE ⛺
4,Clojure,clojurescript,8098,720,Clojure,https://github.com/clojure/clojurescript,clojure,3,2019-06-14T20:37:00Z,Clojure to JS compiler
5,Clojure,om,6608,372,Clojure,https://github.com/omcljs/om,omcljs,78,2019-02-17T20:19:25Z,ClojureScript interface to Facebook's React
6,Clojure,leiningen,6403,1487,Clojure,https://github.com/technomancy/leiningen,technomancy,190,2019-06-14T14:12:09Z,Automate Clojure projects without setting your hair on fire.
7,Clojure,overtone,4614,408,Clojure,https://github.com/overtone/overtone,overtone,86,2019-05-20T17:00:46Z,Collaborative Programmable Music 
8,Clojure,jepsen,3921,452,Clojure,https://github.com/jepsen-io/jepsen,jepsen-io,30,2019-06-13T15:12:33Z,"A framework for distributed systems verification, with fault injection"
9,Clojure,icepick,3812,215,Clojure,https://github.com/frankiesardo/icepick,frankiesardo,24,2018-08-21T21:53:46Z,Android Instance State made easy
10,Clojure,riemann,3769,510,Clojure,https://github.com/riemann/riemann,riemann,15,2019-05-24T17:28:59Z,"A network event stream processing system, in Clojure."
11,Clojure,re-frame,3756,499,Clojure,https://github.com/Day8/re-frame,Day8,25,2019-06-09T14:09:34Z,"A Reagent Framework For Writing SPAs, in Clojurescript."
12,Clojure,compojure,3591,241,Clojure,https://github.com/weavejester/compojure,weavejester,3,2019-06-05T20:11:10Z,A concise routing library for Ring/Clojure
13,Clojure,reagent,3458,283,Clojure,https://github.com/reagent-project/reagent,reagent-project,44,2019-06-14T09:49:23Z,A minimalistic ClojureScript interface to React.js
14,Clojure,alda,3317,199,Clojure,https://github.com/alda-lang/alda,alda-lang,1,2019-06-14T14:04:08Z,A music programming language for musicians. :notes:
15,Clojure,datascript,3289,214,Clojure,https://github.com/tonsky/datascript,tonsky,60,2019-06-05T13:48:58Z,"Immutable database and Datalog query engine for Clojure, ClojureScript and JS"
16,Clojure,clojure-koans,3120,1801,Clojure,https://github.com/functional-koans/clojure-koans,functional-koans,3,2019-06-10T15:10:04Z,A set of exercises for learning Clojure
17,Clojure,mori,3089,142,Clojure,https://github.com/swannodette/mori,swannodette,63,2019-06-10T15:21:45Z,ClojureScript's persistent data structures and supporting API from the comfort of vanilla JavaScript
18,Clojure,ring,2811,430,Clojure,https://github.com/ring-clojure/ring,ring-clojure,31,2019-04-24T20:32:07Z,Clojure HTTP server abstraction
19,Clojure,modern-cljs,2787,306,Clojure,https://github.com/magomimmo/modern-cljs,magomimmo,37,2018-08-30T16:05:03Z,A series of tutorials on ClojureScript
20,Clojure,lein-figwheel,2716,218,Clojure,https://github.com/bhauman/lein-figwheel,bhauman,94,2019-05-27T20:15:29Z,Figwheel builds your ClojureScript code and hot loads it into the browser as you are coding!
21,Clojure,status-react,2685,679,Clojure,https://github.com/status-im/status-react,status-im,468,2019-06-15T00:53:54Z,"a free (libre) open source, mobile OS for Ethereum"
22,Clojure,quil,2314,149,Clojure,https://github.com/quil/quil,quil,24,2019-06-10T08:14:11Z,Main repo. Quil source code.
23,Clojure,clojure-cookbook,2159,397,Clojure,https://github.com/clojure-cookbook/clojure-cookbook,clojure-cookbook,40,2018-12-27T14:38:31Z,This is the home of O'Reilly's Clojure Cookbook - http://clojure-cookbook.com
24,Clojure,aleph,2159,200,Clojure,https://github.com/ztellman/aleph,ztellman,71,2019-06-01T20:39:22Z,asynchronous communication for clojure
25,Clojure,instaparse,2128,124,Clojure,https://github.com/Engelberg/instaparse,Engelberg,28,2019-03-15T06:56:33Z,
26,Clojure,incanter,2088,282,Clojure,https://github.com/incanter/incanter,incanter,74,2019-06-06T15:15:40Z,"Clojure-based, R-like statistical computing and graphics environment for the JVM"
27,Clojure,pedestal,2061,234,Clojure,https://github.com/pedestal/pedestal,pedestal,40,2019-06-13T15:03:43Z,The Pedestal Server-side Libraries
28,Clojure,schema,1963,236,Clojure,https://github.com/plumatic/schema,plumatic,21,2019-06-13T01:48:59Z,Clojure(Script) library for declarative data description and validation
29,Clojure,hiccup,1913,146,Clojure,https://github.com/weavejester/hiccup,weavejester,28,2019-01-22T01:02:10Z,Fast library for rendering HTML in Clojure
30,Clojure,onyx,1877,199,Clojure,https://github.com/onyx-platform/onyx,onyx-platform,85,2019-06-08T00:24:54Z,"Distributed, masterless, high performance, fault tolerant data processing"
31,Clojure,klipse,1875,92,Clojure,https://github.com/viebel/klipse,viebel,80,2019-06-03T15:34:17Z,"Klipse is a Javacript plugin for embedding interactive code snippets in tech blogs. A simple client-side code evaluator pluggable on any web page: clojure, ruby, javascript, python, scheme, es2017, jsx, brainfuck, c++, reagent, lua, ocaml, reasonml, prolog, common lisp"
32,Clojure,specter,1874,75,Clojure,https://github.com/nathanmarz/specter,nathanmarz,26,2019-01-29T19:25:16Z,Clojure(Script)'s missing piece
33,Clojure,awesome-clojure,1690,139,Clojure,https://github.com/razum2um/awesome-clojure,razum2um,6,2019-06-06T23:14:58Z,A curated list of awesome Clojure libraries and resources. Inspired by awesome-... stuff
34,Clojure,component,1634,85,Clojure,https://github.com/stuartsierra/component,stuartsierra,2,2019-02-14T12:43:28Z,Managed lifecycle of stateful objects in Clojure
35,Clojure,transit-format,1630,32,Clojure,https://github.com/cognitect/transit-format,cognitect,9,2019-04-17T19:38:47Z,A data interchange format.
36,Clojure,core.async,1621,178,Clojure,https://github.com/clojure/core.async,clojure,2,2019-06-11T15:43:47Z,Facilities for async programming and communication in Clojure
37,Clojure,lumo,1612,75,Clojure,https://github.com/anmonteiro/lumo,anmonteiro,82,2019-05-25T04:58:16Z,"Fast, cross-platform, standalone ClojureScript environment"
38,Clojure,boot,1583,170,Clojure,https://github.com/boot-clj/boot,boot-clj,100,2019-06-01T18:25:41Z,Build tooling for Clojure.
39,Clojure,kibit,1529,118,Clojure,https://github.com/jonase/kibit,jonase,63,2019-04-23T01:11:55Z,There's a function for that!
40,Clojure,Midje,1490,121,Clojure,https://github.com/marick/Midje,marick,37,2019-05-16T19:36:14Z,"Midje provides a migration path from clojure.test to a more flexible, readable, abstract, and gracious style of testing"
41,Clojure,enlive,1462,143,Clojure,https://github.com/cgrand/enlive,cgrand,28,2019-06-04T15:09:32Z,a selector-based (à la CSS) templating and transformation system for Clojure
42,Clojure,Korma,1418,230,Clojure,https://github.com/korma/Korma,korma,81,2018-08-17T15:20:06Z,Tasty SQL for Clojure.
43,Clojure,sente,1404,141,Clojure,https://github.com/ptaoussanis/sente,ptaoussanis,30,2019-04-05T16:02:44Z,Realtime web comms for Clojure/Script
44,Clojure,auto-parcel,1397,89,Clojure,https://github.com/frankiesardo/auto-parcel,frankiesardo,12,2017-02-12T15:10:29Z,Android Parcelable models made easy
45,Clojure,drake,1377,106,Clojure,https://github.com/Factual/drake,Factual,83,2018-12-12T22:36:59Z,"Data workflow tool, like a ""Make for data"""
46,Clojure,plumbing,1361,110,Clojure,https://github.com/plumatic/plumbing,plumatic,10,2018-02-22T03:32:31Z,Prismatic's Clojure(Script) utility belt
47,Clojure,cascalog,1354,177,Clojure,https://github.com/nathanmarz/cascalog,nathanmarz,40,2016-05-06T07:14:10Z,Data processing on Hadoop without the hassle.
48,Clojure,clj-http,1349,349,Clojure,https://github.com/dakrone/clj-http,dakrone,37,2019-06-13T23:52:50Z,An idiomatic clojure http client wrapping the apache client. Offically supported version.
49,Clojure,Nightcode,1317,121,Clojure,https://github.com/oakes/Nightcode,oakes,32,2019-04-03T03:20:55Z,An IDE for Clojure
50,Clojure,devcards,1312,100,Clojure,https://github.com/bhauman/devcards,bhauman,24,2019-02-05T15:29:01Z,Devcards aims to provide a visual REPL experience for ClojureScript
51,Clojure,yesql,1304,110,Clojure,https://github.com/krisajenkins/yesql,krisajenkins,68,2019-04-23T14:04:24Z,A Clojure library for using SQL.
52,Clojure,duckling_old,1301,231,Clojure,https://github.com/facebookarchive/duckling_old,facebookarchive,70,2019-05-30T14:10:47Z,Deprecated in favor of https://github.com/facebook/duckling
53,Clojure,Arcadia,1290,90,Clojure,https://github.com/arcadia-unity/Arcadia,arcadia-unity,41,2019-06-04T21:35:23Z,Clojure in Unity
54,Clojure,seesaw,1266,139,Clojure,https://github.com/daveray/seesaw,daveray,63,2019-01-09T06:57:10Z,"Seesaw turns the Horror of Swing into a friendly, well-documented, Clojure library"
55,Clojure,chestnut,1256,98,Clojure,https://github.com/plexus/chestnut,plexus,5,2019-04-03T20:11:35Z,Application template for Clojure + ClojureScript web apps
56,Clojure,konstellate,1246,44,Clojure,https://github.com/containership/konstellate,containership,3,2019-05-21T14:39:48Z,Free and Open Source GUI to Visualize Kubernetes Applications.
57,Clojure,lacinia,1228,96,Clojure,https://github.com/walmartlabs/lacinia,walmartlabs,15,2019-06-14T23:50:05Z,GraphQL implementation in pure Clojure
58,Clojure,asciinema-player,1212,135,Clojure,https://github.com/asciinema/asciinema-player,asciinema,43,2018-12-31T16:18:56Z,Web player for terminal session recordings ⏩
59,Clojure,core.logic,1183,104,Clojure,https://github.com/clojure/core.logic,clojure,1,2019-04-28T22:32:01Z,
60,Clojure,liberator,1177,142,Clojure,https://github.com/clojure-liberator/liberator,clojure-liberator,59,2019-05-17T13:41:18Z,Liberator is a Clojure library for building RESTful applications.
61,Clojure,closh,1163,31,Clojure,https://github.com/dundalek/closh,dundalek,56,2019-04-28T16:19:32Z,Bash-like shell based on Clojure
62,Clojure,ultra,1160,29,Clojure,https://github.com/venantius/ultra,venantius,8,2019-03-09T13:33:25Z,A Leiningen plugin for a superior development environment
63,Clojure,friend,1149,120,Clojure,https://github.com/cemerick/friend,cemerick,31,2017-07-25T15:52:18Z,An extensible authentication and authorization library for Clojure Ring web applications and services. 
64,Clojure,cortex,1147,96,Clojure,https://github.com/originrose/cortex,originrose,31,2018-09-10T20:29:23Z,Machine learning in Clojure
65,Clojure,timbre,1123,137,Clojure,https://github.com/ptaoussanis/timbre,ptaoussanis,39,2019-05-27T11:55:06Z,Pure Clojure/Script logging library
66,Clojure,cheshire,1120,116,Clojure,https://github.com/dakrone/cheshire,dakrone,28,2019-03-26T20:57:39Z,Clojure JSON and JSON SMILE (binary json format) encoding/decoding
67,Clojure,code-maat,1111,131,Clojure,https://github.com/adamtornhill/code-maat,adamtornhill,12,2019-01-29T20:32:23Z,A command line tool to mine and analyze data from version-control systems
68,Clojure,core.typed,1088,68,Clojure,https://github.com/clojure/core.typed,clojure,0,2019-04-29T03:09:02Z,An optional type system for Clojure
69,Clojure,frontend,1037,142,Clojure,https://github.com/circleci/frontend,circleci,20,2019-04-27T06:15:31Z,CircleCI's frontend
70,Clojure,frak,1035,39,Clojure,https://github.com/noprompt/frak,noprompt,1,2019-04-10T22:38:00Z,Transform collections of strings into regular expressions.
71,Clojure,lux,1034,40,Clojure,https://github.com/LuxLang/lux,LuxLang,6,2019-06-14T03:33:13Z,The Lux Programming Language
72,Clojure,lein-cljsbuild,1028,163,Clojure,https://github.com/emezeske/lein-cljsbuild,emezeske,50,2018-07-02T13:39:11Z,Leiningen plugin to make ClojureScript development easy.
73,Clojure,garden,1019,61,Clojure,https://github.com/noprompt/garden,noprompt,35,2019-04-10T22:38:13Z,Generate CSS with Clojure
74,Clojure,honeysql,979,106,Clojure,https://github.com/jkk/honeysql,jkk,9,2019-05-28T17:06:02Z,Turn Clojure data structures into SQL
75,Clojure,hitchhiker-tree,971,67,Clojure,https://github.com/datacrypt-project/hitchhiker-tree,datacrypt-project,17,2018-07-22T21:01:33Z,"Functional, persistent, off-heap, high performance data structure"
76,Clojure,swarmpit,965,94,Clojure,https://github.com/swarmpit/swarmpit,swarmpit,58,2019-06-05T17:01:33Z,Lightweight mobile-friendly Docker Swarm management UI
77,Clojure,compojure-api,936,126,Clojure,https://github.com/metosin/compojure-api,metosin,31,2019-04-25T17:27:31Z,Sweet web apis with Compojure & Swagger
78,Clojure,4clojure,934,200,Clojure,https://github.com/4clojure/4clojure,4clojure,80,2019-01-01T08:03:51Z,An interactive problem website for learning Clojure
79,Clojure,play-clj,918,71,Clojure,https://github.com/oakes/play-clj,oakes,9,2019-03-11T00:46:23Z,A Clojure game library
80,Clojure,shadow-cljs,910,49,Clojure,https://github.com/thheller/shadow-cljs,thheller,52,2019-06-12T08:53:42Z,ClojureScript compilation made easy
81,Clojure,markright,908,60,Clojure,https://github.com/dvcrn/markright,dvcrn,24,2017-03-01T01:38:59Z,➡ Electron powered markdown editor with live preview
82,Clojure,eastwood,903,58,Clojure,https://github.com/jonase/eastwood,jonase,107,2019-05-01T16:19:02Z,Clojure lint tool
83,Clojure,test.check,902,99,Clojure,https://github.com/clojure/test.check,clojure,0,2019-05-04T23:17:36Z,QuickCheck for Clojure
84,Clojure,logic-tutorial,900,83,Clojure,https://github.com/swannodette/logic-tutorial,swannodette,14,2018-10-30T11:45:38Z,A Very Gentle Introduction to Relational Programming
85,Clojure,core.match,894,53,Clojure,https://github.com/clojure/core.match,clojure,0,2019-04-28T22:32:06Z,
86,Clojure,criterium,894,45,Clojure,https://github.com/hugoduncan/criterium,hugoduncan,12,2019-04-19T12:17:45Z,Benchmarking library for clojure
87,Clojure,mount,884,68,Clojure,https://github.com/tolitius/mount,tolitius,21,2019-04-12T00:12:44Z,managing Clojure and ClojureScript app state since (reset)
88,Clojure,carmine,875,95,Clojure,https://github.com/ptaoussanis/carmine,ptaoussanis,15,2019-05-11T13:37:28Z,Redis client and message queue for Clojure
89,Clojure,bidi,872,86,Clojure,https://github.com/juxt/bidi,juxt,49,2019-06-14T11:02:07Z,Bidirectional URI routing
90,Clojure,clojurec,870,54,Clojure,https://github.com/schani/clojurec,schani,5,2018-04-25T22:28:20Z,A Clojure implementation on top of C
91,Clojure,cljs-devtools,861,32,Clojure,https://github.com/binaryage/cljs-devtools,binaryage,9,2018-11-27T17:26:54Z,A collection of Chrome DevTools enhancements for ClojureScript developers
92,Clojure,lt-cljs-tutorial,860,128,Clojure,https://github.com/swannodette/lt-cljs-tutorial,swannodette,10,2015-10-08T07:16:26Z,A ClojureScript Programming Language Tutorial for Light Table Users
93,Clojure,clara-rules,858,94,Clojure,https://github.com/cerner/clara-rules,cerner,73,2019-06-05T14:46:23Z,Forward-chaining rules in Clojure(Script)
94,Clojure,hoplon,855,64,Clojure,https://github.com/hoplon/hoplon,hoplon,36,2019-04-28T22:56:18Z,Hoplon web development tools and libraries.
