rank,item,repo_name,stars,forks,language,repo_url,username,issues,last_commit,description
95,JavaScript,layui,21103,6023,JavaScript,https://github.com/sentsin/layui,sentsin,486,2020-02-27T13:32:15Z,采用自身模块规范编写的前端 UI 框架，遵循原生 HTML/CSS/JS 的书写形式，极低门槛，拿来即用。
96,JavaScript,hammer.js,21076,2574,JavaScript,https://github.com/hammerjs/hammer.js,hammerjs,284,2020-01-03T19:08:19Z,A javascript library for multi-touch gestures :// You can touch this
97,JavaScript,mongoose,20357,2764,JavaScript,https://github.com/Automattic/mongoose,Automattic,282,2020-03-10T00:25:53Z,MongoDB object modeling designed to work in an asynchronous environment.
98,JavaScript,project-guidelines,20297,2000,JavaScript,https://github.com/elsewhencode/project-guidelines,elsewhencode,14,2020-01-15T17:28:49Z,A set of best practices for JavaScript projects
99,JavaScript,nodemon,20139,1309,JavaScript,https://github.com/remy/nodemon,remy,9,2020-02-23T04:55:25Z,Monitor for any changes in your node.js application and automatically restart the server - perfect for development
100,JavaScript,sheetjs,20091,5085,JavaScript,https://github.com/SheetJS/sheetjs,SheetJS,341,2020-02-29T06:55:02Z,:green_book: SheetJS Community Edition -- Spreadsheet Data Toolkit
1,Lua,kong,25059,3207,Lua,https://github.com/Kong/kong,Kong,336,2020-03-10T09:56:00Z,🦍 The Cloud-Native API Gateway 
2,Lua,waifu2x,17607,2020,Lua,https://github.com/nagadomi/waifu2x,nagadomi,103,2020-01-09T20:28:16Z,Image Super-Resolution for Anime-Style Art
3,Lua,neural-style,17380,2698,Lua,https://github.com/jcjohnson/neural-style,jcjohnson,321,2018-02-23T01:21:20Z,Torch implementation of neural style algorithm
4,Lua,openface,13136,3299,Lua,https://github.com/cmusatyalab/openface,cmusatyalab,3,2019-11-30T12:13:11Z,Face recognition with deep neural networks.
5,Lua,char-rnn,10035,2389,Lua,https://github.com/karpathy/char-rnn,karpathy,109,2018-05-04T15:25:25Z,"Multi-layer Recurrent Neural Networks (LSTM, GRU, RNN) for character-level language models in Torch"
6,Lua,CycleGAN,9501,1592,Lua,https://github.com/junyanz/CycleGAN,junyanz,34,2019-08-13T03:42:02Z,"Software that can generate photos from paintings,  turn horses into zebras,  perform style transfer, and more."
7,Lua,pix2pix,7505,1310,Lua,https://github.com/phillipi/pix2pix,phillipi,64,2019-10-20T01:27:05Z,Image-to-image translation with conditional adversarial nets
8,Lua,koreader,5881,717,Lua,https://github.com/koreader/koreader,koreader,346,2020-03-10T08:09:26Z,"An ebook reader application supporting PDF, DjVu, EPUB, FB2 and many more formats, running on Cervantes, Kindle, Kobo, PocketBook and Android devices"
9,Lua,dockercraft,5706,326,Lua,https://github.com/docker/dockercraft,docker,16,2018-06-18T12:15:21Z,Docker + Minecraft = Dockercraft
10,Lua,VeryNginx,5237,833,Lua,https://github.com/alexazhou/VeryNginx,alexazhou,101,2019-10-29T02:43:57Z," A very powerful and friendly  nginx base on lua-nginx-module( openresty ) which provide WAF, Control Panel, and Dashboards. "
11,Lua,lsyncd,3935,374,Lua,https://github.com/axkibe/lsyncd,axkibe,106,2019-11-13T08:19:54Z,Lsyncd (Live Syncing Daemon) synchronizes local directories with remote targets
12,Lua,DenseNet,3875,932,Lua,https://github.com/liuzhuang13/DenseNet,liuzhuang13,27,2020-02-11T15:57:57Z,"Densely Connected Convolutional Networks, In CVPR 2017 (Best Paper Award)."
13,Lua,fairseq,3559,626,Lua,https://github.com/facebookresearch/fairseq,facebookresearch,12,2019-02-25T06:01:33Z,Facebook AI Research Sequence-to-Sequence Toolkit
14,Lua,fast-neural-style,3465,700,Lua,https://github.com/jcjohnson/fast-neural-style,jcjohnson,135,2019-11-02T19:22:22Z,Feedforward style transfer
15,Lua,ntopng,3166,396,Lua,https://github.com/ntop/ntopng,ntop,168,2020-03-10T10:01:25Z,Web-based Traffic and Security Network Traffic Monitoring
16,Lua,luvit,3155,329,Lua,https://github.com/luvit/luvit,luvit,64,2020-03-10T09:29:13Z,Lua + libUV + jIT = pure awesomesauce
17,Lua,deepmask,3064,529,Lua,https://github.com/facebookresearch/deepmask,facebookresearch,48,2019-01-16T17:21:51Z,Torch implementation of DeepMask and SharpMask
18,Lua,awesome,2988,378,Lua,https://github.com/awesomeWM/awesome,awesomeWM,337,2020-03-09T18:16:36Z,awesome window manager
19,Lua,ngx_lua_waf,2882,1194,Lua,https://github.com/loveshell/ngx_lua_waf,loveshell,76,2019-04-26T04:14:46Z,ngx_lua_waf是一个基于lua-nginx-module(openresty)的web应用防火墙
20,Lua,openresty-best-practices,2878,723,Lua,https://github.com/moonbingbing/openresty-best-practices,moonbingbing,8,2020-01-09T14:45:49Z,
21,Lua,articles,2798,748,Lua,https://github.com/Wscats/articles,Wscats,3,2020-03-02T09:35:52Z,🔖My Learning Notes and Memories - 分享我的学习片段和与你的回忆
22,Lua,snabb,2389,294,Lua,https://github.com/snabbco/snabb,snabbco,221,2020-02-07T11:07:23Z,Snabb: Simple and fast packet networking
23,Lua,neuralart,2338,354,Lua,https://github.com/kaishengtai/neuralart,kaishengtai,6,2017-03-05T18:08:54Z,An implementation of the paper 'A Neural Algorithm of Artistic Style'.
24,Lua,moonscript,2329,166,Lua,https://github.com/leafo/moonscript,leafo,162,2020-02-17T19:59:51Z,:crescent_moon: A language that compiles to Lua
25,Lua,tarantool,2328,230,Lua,https://github.com/tarantool/tarantool,tarantool,910,2020-03-10T09:49:32Z,Get your data in RAM. Get compute close to data. Enjoy the performance.
26,Lua,torch-rnn,2256,502,Lua,https://github.com/jcjohnson/torch-rnn,jcjohnson,110,2018-04-28T08:50:05Z,"Efficient, reusable RNNs and LSTMs for torch"
27,Lua,OpenNMT,2252,459,Lua,https://github.com/OpenNMT/OpenNMT,OpenNMT,48,2020-02-19T16:08:46Z,Open Source Neural Machine Translation in Torch (deprecated)
28,Lua,CorsixTH,2140,253,Lua,https://github.com/CorsixTH/CorsixTH,CorsixTH,262,2020-03-10T09:51:49Z,Open source clone of Theme Hospital
29,Lua,Algorithm-Implementations,2081,504,Lua,https://github.com/kennyledet/Algorithm-Implementations,kennyledet,12,2019-11-06T17:35:19Z,"Share, discuss and learn about algorithm implementations!"
30,Lua,siggraph2016_colorization,2037,298,Lua,https://github.com/satoshiiizuka/siggraph2016_colorization,satoshiiizuka,13,2017-08-24T08:40:12Z,Code for the paper 'Let there be Color!: Joint End-to-end Learning of Global and Local Image Priors for Automatic Image Colorization with Simultaneous Classification'. 
31,Lua,incubator-apisix,2006,361,Lua,https://github.com/apache/incubator-apisix,apache,142,2020-03-10T09:24:06Z,Cloud-Native Microservices API Gateway
32,Lua,nmap-vulners,1967,307,Lua,https://github.com/vulnersCom/nmap-vulners,vulnersCom,10,2019-12-03T05:09:25Z,NSE script based on Vulners.com API
33,Lua,ZeroBraneStudio,1953,447,Lua,https://github.com/pkulchenko/ZeroBraneStudio,pkulchenko,77,2020-03-05T00:01:29Z,"Lightweight Lua-based IDE for Lua with code completion, syntax highlighting, live coding, remote debugger, and code analyzer; supports Lua 5.1, 5.2, 5.3, LuaJIT and other Lua interpreters on Windows, macOS, and Linux"
34,Lua,orange,1945,518,Lua,https://github.com/orlabs/orange,orlabs,66,2020-01-09T05:06:27Z,OpenResty/Nginx Gateway for API Monitoring and Management.
35,Lua,awesome-copycats,1930,415,Lua,https://github.com/lcpz/awesome-copycats,lcpz,3,2019-11-26T15:44:55Z,Awesome WM themes
36,Lua,fb.resnet.torch,1929,629,Lua,https://github.com/facebookarchive/fb.resnet.torch,facebookarchive,61,2019-10-29T17:21:00Z,Torch implementation of ResNet from http://arxiv.org/abs/1512.03385 and training scripts
37,Lua,PathOfBuilding,1869,842,Lua,https://github.com/Openarl/PathOfBuilding,Openarl,749,2020-02-09T01:32:42Z,Offline build planner for Path of Exile.
38,Lua,DeepMind-Atari-Deep-Q-Learner,1777,547,Lua,https://github.com/kuz/DeepMind-Atari-Deep-Q-Learner,kuz,23,2018-01-23T03:06:50Z,The original code from the DeepMind article + my tweaks
39,Lua,luarocks,1740,310,Lua,https://github.com/luarocks/luarocks,luarocks,159,2020-02-20T18:18:33Z,LuaRocks is the package manager for the Lua programming language.
40,Lua,MemNN,1680,381,Lua,https://github.com/facebook/MemNN,facebook,13,2019-12-09T15:07:40Z,Memory Networks implementations
41,Lua,ResNeXt,1631,270,Lua,https://github.com/facebookresearch/ResNeXt,facebookresearch,8,2020-01-14T19:58:44Z,Implementation of a classification framework from the paper Aggregated Residual Transformations for Deep Neural Networks
42,Lua,crnn,1625,472,Lua,https://github.com/bgshih/crnn,bgshih,85,2019-03-04T05:12:37Z,Convolutional Recurrent Neural Network (CRNN) for image-based sequence recognition.
43,Lua,art-DCGAN,1555,273,Lua,https://github.com/robbiebarrat/art-DCGAN,robbiebarrat,14,2019-01-09T20:36:18Z,"Modified implementation of DCGAN focused on generative art. Includes pre-trained models for landscapes, nude-portraits, and others."
44,Lua,lua-resty-auto-ssl,1538,120,Lua,https://github.com/auto-ssl/lua-resty-auto-ssl,auto-ssl,72,2020-02-20T06:29:11Z,On the fly (and free) SSL registration and renewal inside OpenResty/nginx with Let's Encrypt.
45,Lua,Anycomplete,1533,46,Lua,https://github.com/nathancahill/Anycomplete,nathancahill,3,2017-04-04T18:29:04Z,The magic of Google Autocomplete while you're typing. Anywhere.
46,Lua,qipai_algorithm,1461,665,Lua,https://github.com/yuanfengyun/qipai_algorithm,yuanfengyun,15,2019-09-29T04:43:46Z,棋牌的胡牌算法，包括麻将、跑胡子、扑克。实现 lua 、c++ 、c# 、golang 、js 、java 、python 版本。( Mahjong  algorithm )
47,Lua,z.lua,1446,66,Lua,https://github.com/skywind3000/z.lua,skywind3000,21,2020-03-07T16:14:15Z,A new cd command that helps you navigate faster by learning your habits :zap:
48,Lua,vulscan,1416,345,Lua,https://github.com/scipag/vulscan,scipag,10,2019-09-23T12:14:06Z,Advanced vulnerability scanning with Nmap NSE
49,Lua,luafun,1412,89,Lua,https://github.com/luafun/luafun,luafun,28,2019-11-05T17:20:32Z,Lua Fun is a high-performance functional programming library for Lua designed with LuaJIT's trace compiler in mind.
50,Lua,lua-resty-redis,1396,365,Lua,https://github.com/openresty/lua-resty-redis,openresty,59,2020-03-04T20:46:38Z,Lua redis client driver for the ngx_lua based on the cosocket API
51,Lua,luakit,1356,220,Lua,https://github.com/luakit/luakit,luakit,194,2020-02-17T15:12:19Z,"Fast, small, webkit based browser framework extensible by Lua."
52,Lua,multipathnet,1356,295,Lua,https://github.com/facebookresearch/multipathnet,facebookresearch,23,2019-03-22T18:15:44Z,"A Torch implementation of the object detection network from ""A MultiPath Network for Object Detection"" (https://arxiv.org/abs/1604.02135)"
53,Lua,lua-resty-http,1290,444,Lua,https://github.com/ledgetech/lua-resty-http,ledgetech,36,2020-02-24T17:18:50Z,Lua HTTP client cosocket driver for OpenResty / ngx_lua.
54,Lua,nn,1229,968,Lua,https://github.com/torch/nn,torch,172,2018-10-04T01:47:39Z,
55,Lua,keyboard,1214,134,Lua,https://github.com/jasonrudolph/keyboard,jasonrudolph,6,2020-03-05T15:34:32Z,⌨ Toward a more useful keyboard
56,Lua,Faster-High-Res-Neural-Inpainting,1191,208,Lua,https://github.com/leehomyc/Faster-High-Res-Neural-Inpainting,leehomyc,11,2018-05-29T22:01:59Z,High-Resolution Image Inpainting using Multi-Scale Neural Patch Synthesis
57,Lua,dcgan.torch,1187,372,Lua,https://github.com/soumith/dcgan.torch,soumith,41,2018-12-19T21:28:23Z,A torch implementation of http://arxiv.org/abs/1511.06434
58,Lua,middleclass,1176,136,Lua,https://github.com/kikito/middleclass,kikito,2,2019-11-27T03:24:40Z,Object-orientation for Lua
59,Lua,vlsub,1146,318,Lua,https://github.com/exebetche/vlsub,exebetche,81,2020-02-27T16:49:39Z,VLC extension to download subtitles from opensubtitles.org
60,Lua,luacheck,1140,191,Lua,https://github.com/mpeterv/luacheck,mpeterv,38,2019-11-12T02:02:17Z, A tool for linting and static analysis of Lua code. 
61,Lua,nProbe,1125,34,Lua,https://github.com/ntop/nProbe,ntop,47,2020-01-16T16:55:14Z,Open source components and extensions for nProbe
62,Lua,seq2seq-attn,1123,283,Lua,https://github.com/harvardnlp/seq2seq-attn,harvardnlp,14,2018-02-13T05:27:41Z,Sequence-to-sequence model with LSTM encoder/decoders and attention
63,Lua,KikiAuth,1117,1,Lua,https://github.com/fossasia/KikiAuth,fossasia,0,2018-11-23T17:17:23Z,CommonsNet KikiAuth for OpenWrt
64,Lua,Penlight,1105,191,Lua,https://github.com/Tieske/Penlight,Tieske,36,2020-02-02T08:44:44Z,"A set of pure Lua libraries focusing on input data handling (such as reading configuration files), functional programming (such as map, reduce, placeholder expressions,etc), and OS path management.  Much of the functionality is inspired by the Python standard libraries."
65,Lua,texture_nets,1103,212,Lua,https://github.com/DmitryUlyanov/texture_nets,DmitryUlyanov,41,2018-01-07T06:56:34Z,"Code for ""Texture Networks: Feed-forward Synthesis of Textures and Stylized Images"" paper."
66,Lua,fbcunn,1079,263,Lua,https://github.com/facebookarchive/fbcunn,facebookarchive,38,2017-07-21T22:04:03Z,Facebook's extensions to torch/cunn.
67,Lua,wide-residual-networks,1048,261,Lua,https://github.com/szagoruyko/wide-residual-networks,szagoruyko,26,2019-08-20T08:37:42Z,3.8% and 18.3% on CIFAR-10 and CIFAR-100
68,Lua,torchnet,989,204,Lua,https://github.com/facebookarchive/torchnet,facebookarchive,3,2019-03-27T22:21:16Z,Torch on steroids
69,Lua,Fennel,963,59,Lua,https://github.com/bakpakin/Fennel,bakpakin,7,2020-03-08T16:36:17Z,Lua Lisp Language
70,Lua,lsofgraph,941,30,Lua,https://github.com/zevv/lsofgraph,zevv,0,2019-04-20T19:38:03Z,lsof to graphviz
71,Lua,rnn,922,318,Lua,https://github.com/Element-Research/rnn,Element-Research,79,2017-12-21T06:29:48Z,Recurrent Neural Network library for Torch7's nn
72,Lua,sile,920,65,Lua,https://github.com/sile-typesetter/sile,sile-typesetter,206,2020-03-02T13:24:00Z,Simon's Improved Layout Engine
73,Lua,minetest_game,896,426,Lua,https://github.com/minetest/minetest_game,minetest,113,2020-03-09T18:26:31Z,Minetest Game - The default game for the Minetest engine [https://github.com/minetest/minetest/]
74,Lua,AdaIN-style,871,142,Lua,https://github.com/xunhuang1995/AdaIN-style,xunhuang1995,14,2017-10-30T11:38:53Z,Arbitrary Style Transfer in Real-time with Adaptive Instance Normalization
75,Lua,busted,868,139,Lua,https://github.com/Olivine-Labs/busted,Olivine-Labs,52,2020-03-02T14:49:38Z,Elegant Lua unit testing.
76,Lua,lor,867,166,Lua,https://github.com/sumory/lor,sumory,12,2020-02-18T14:29:56Z,"a fast, minimalist web framework for lua based on OpenResty"
77,Lua,sailor,860,127,Lua,https://github.com/sailorproject/sailor,sailorproject,46,2019-07-05T13:13:50Z,A Lua MVC Web Framework.
78,Lua,doomrl,853,115,Lua,https://github.com/chaosforgeorg/doomrl,chaosforgeorg,19,2018-10-03T03:25:35Z,"D**m, the Roguelike"
79,Lua,hawkthorne-journey,853,375,Lua,https://github.com/hawkthorne/hawkthorne-journey,hawkthorne,34,2018-10-10T06:31:22Z,Digital Estate Planning: The Game
80,Lua,QuestieDev,851,200,Lua,https://github.com/AeroScripts/QuestieDev,AeroScripts,94,2020-03-10T08:35:01Z,Questie: the vanilla quest helper
81,Lua,NAMAS,845,252,Lua,https://github.com/facebookarchive/NAMAS,facebookarchive,18,2018-04-25T14:40:20Z,Neural Attention Model for Abstractive Summarization
82,Lua,telegram-bot,839,518,Lua,https://github.com/yagop/telegram-bot,yagop,116,2018-10-14T09:09:36Z,UNMAINTAINED - A Telegram Bot based on plugins
83,Lua,Crepe,827,231,Lua,https://github.com/zhangxiangxiao/Crepe,zhangxiangxiao,2,2019-07-23T06:07:51Z,Character-level Convolutional Networks for Text Classification
84,Lua,CNNMRF,823,142,Lua,https://github.com/chuanli11/CNNMRF,chuanli11,8,2019-10-12T20:14:46Z,"code for paper ""Combining Markov Random Fields and Convolutional Neural Networks for Image Synthesis"""
85,Lua,openstar,816,335,Lua,https://github.com/starjun/openstar,starjun,3,2020-01-19T12:56:53Z,"lua waf,nginx+lua,openresty,luajit,waf+,cdn,nginx"
86,Lua,Neural-Dialogue-Generation,806,227,Lua,https://github.com/jiweil/Neural-Dialogue-Generation,jiweil,15,2017-07-12T12:18:28Z,
87,Lua,lstm-char-cnn,805,225,Lua,https://github.com/yoonkim/lstm-char-cnn,yoonkim,14,2016-08-24T12:53:43Z,LSTM language model with CNN over characters
88,Lua,bAbI-tasks,805,180,Lua,https://github.com/facebookarchive/bAbI-tasks,facebookarchive,5,2019-03-27T22:23:53Z,Task generation for testing text understanding and reasoning
89,Lua,awesome-hammerspoon,801,129,Lua,https://github.com/ashfinal/awesome-hammerspoon,ashfinal,11,2019-02-08T06:13:28Z,awesome configuration for Hammerspoon.
90,Lua,icml2016,794,193,Lua,https://github.com/reedscot/icml2016,reedscot,28,2018-09-05T16:45:56Z,Generative Adversarial Text-to-Image Synthesis
91,Lua,treelstm,775,232,Lua,https://github.com/stanfordnlp/treelstm,stanfordnlp,9,2017-07-30T21:01:43Z,Tree-structured Long Short-Term Memory networks (http://arxiv.org/abs/1503.00075)
92,Lua,neuralconvo,763,360,Lua,https://github.com/macournoyer/neuralconvo,macournoyer,26,2019-05-31T08:42:14Z,Neural conversational model in Torch
93,Lua,XNOR-Net,760,231,Lua,https://github.com/allenai/XNOR-Net,allenai,27,2017-12-05T01:39:30Z,ImageNet classification using binary Convolutional Neural Networks
94,Lua,MoonGen,751,175,Lua,https://github.com/emmericp/MoonGen,emmericp,36,2020-02-26T15:47:04Z,MoonGen is a fully scriptable high-speed packet generator built on DPDK and LuaJIT. It can saturate a 10 Gbit/s connection with 64 byte packets on a single CPU core while executing user-provided Lua scripts for each packet. Multi-core support allows for even higher rates. It also features precise and accurate timestamping and rate control.
95,Lua,im2markup,750,135,Lua,https://github.com/harvardnlp/im2markup,harvardnlp,11,2017-04-28T15:20:33Z,Neural model for converting Image-to-Markup (by Yuntian Deng github.com/da03)
96,Lua,nginx-lua-prometheus,749,118,Lua,https://github.com/knyar/nginx-lua-prometheus,knyar,2,2019-10-17T13:45:21Z,Prometheus metric library for Nginx written in Lua
97,Lua,nmap-nse-scripts,745,334,Lua,https://github.com/cldrn/nmap-nse-scripts,cldrn,3,2020-01-17T12:09:10Z,My collection of nmap NSE scripts
98,Lua,inspect.lua,732,139,Lua,https://github.com/kikito/inspect.lua,kikito,10,2019-10-15T18:32:33Z,Human-readable representation of Lua tables
99,Lua,resnet-1k-layers,727,219,Lua,https://github.com/KaimingHe/resnet-1k-layers,KaimingHe,1,2017-05-24T17:35:48Z,Deep Residual Networks with 1K Layers
100,Lua,lua-protobuf,719,181,Lua,https://github.com/starwing/lua-protobuf,starwing,20,2020-02-21T17:41:20Z,A Lua module to work with Google protobuf
1,MATLAB,deep-photo-styletransfer,9519,1402,Matlab,https://github.com/luanfujun/deep-photo-styletransfer,luanfujun,30,2017-08-12T08:07:42Z,"Code and data for paper ""Deep Photo Style Transfer"": https://arxiv.org/abs/1703.07511 "
2,MATLAB,PRMLT,4528,1878,MATLAB,https://github.com/PRML/PRMLT,PRML,0,2020-03-04T13:50:30Z,Matlab code for machine learning algorithms in book PRML
3,MATLAB,OpenFace,4276,1419,MATLAB,https://github.com/TadasBaltrusaitis/OpenFace,TadasBaltrusaitis,185,2020-02-28T18:04:50Z,"OpenFace – a state-of-the art tool intended for facial landmark detection, head pose estimation, facial action unit recognition, and eye-gaze estimation."
4,MATLAB,DeepLearnToolbox,3456,2216,Matlab,https://github.com/rasmusbergpalm/DeepLearnToolbox,rasmusbergpalm,83,2018-10-13T18:08:01Z,"Matlab/Octave toolbox for deep learning. Includes Deep Belief Nets, Stacked Autoencoders, Convolutional Neural Nets, Convolutional Autoencoders and vanilla Neural Nets. Each method has examples to get you started."
5,MATLAB,MTCNN_face_detection_alignment,2303,929,Matlab,https://github.com/kpzhang93/MTCNN_face_detection_alignment,kpzhang93,45,2018-04-04T03:17:19Z,Joint Face Detection and Alignment using Multi-task Cascaded Convolutional Neural Networks
6,MATLAB,faster_rcnn,2258,1173,Matlab,https://github.com/ShaoqingRen/faster_rcnn,ShaoqingRen,139,2018-07-26T04:26:32Z,Faster R-CNN
7,MATLAB,OpenTLD,2069,1294,Matlab,https://github.com/zk00006/OpenTLD,zk00006,38,2016-02-01T11:28:11Z,OpenTLD is an open source library for real-time 2D tracking of a single object in video. This repository is no longer under development. For latest version see: http://www.tldvision.com/tld2.html
8,MATLAB,rcnn,1973,900,Matlab,https://github.com/rbgirshick/rcnn,rbgirshick,55,2017-04-03T16:16:14Z,R-CNN: Regions with Convolutional Neural Network Features
9,MATLAB,eviltransform,1866,406,Matlab,https://github.com/googollee/eviltransform,googollee,14,2020-01-25T12:23:20Z,Transport coordinate between earth(WGS-84) and mars in china(GCJ-02).
10,MATLAB,Coding-Guide,1355,180,MATLAB,https://github.com/ecmadao/Coding-Guide,ecmadao,0,2020-02-28T02:17:04Z,自己随手记录的东西
11,MATLAB,crfasrnn,1298,481,MATLAB,https://github.com/torrvision/crfasrnn,torrvision,47,2019-11-30T13:17:39Z,This repository contains the source code for the semantic image segmentation method described in the ICCV 2015 paper: Conditional Random Fields as Recurrent Neural Networks. http://crfasrnn.torr.vision/
12,MATLAB,R-FCN,1179,539,Matlab,https://github.com/daijifeng001/R-FCN,daijifeng001,30,2017-05-05T15:50:59Z,R-FCN: Object Detection via Region-based Fully Convolutional Networks
13,MATLAB,CAM,1158,342,Matlab,https://github.com/zhoubolei/CAM,zhoubolei,8,2018-05-02T19:30:19Z,Class Activation Mapping
14,MATLAB,tiny,1037,306,MATLAB,https://github.com/peiyunh/tiny,peiyunh,10,2019-07-30T19:46:58Z,"Tiny Face Detector, CVPR 2017"
15,MATLAB,machine-learning-coursera-1,1015,906,,https://github.com/Borye/machine-learning-coursera-1,Borye,6,2019-07-28T13:49:39Z,This repo is specially created for all the work done my me as a part of Coursera's Machine Learning Course.
16,MATLAB,BPL,919,309,Matlab,https://github.com/brendenlake/BPL,brendenlake,0,2015-12-28T20:48:56Z,Bayesian Program Learning model for one-shot learning
17,MATLAB,matlab2tikz,891,208,MATLAB,https://github.com/matlab2tikz/matlab2tikz,matlab2tikz,218,2020-02-23T10:25:18Z,This program converts MATLAB®/Octave figures to TikZ/pgfplots figures for smooth integration into LaTeX.
18,MATLAB,omniglot,791,252,MATLAB,https://github.com/brendenlake/omniglot,brendenlake,1,2019-02-13T15:11:01Z,Omniglot data set for one-shot learning
19,MATLAB,export_fig,770,260,MATLAB,https://github.com/altmany/export_fig,altmany,46,2020-03-03T16:47:38Z,A MATLAB toolbox for exporting publication quality figures
20,MATLAB,toolbox,728,476,Matlab,https://github.com/pdollar/toolbox,pdollar,38,2019-05-06T18:46:16Z,Piotr's Image & Video Matlab Toolbox
21,MATLAB,DnCNN,716,376,MATLAB,https://github.com/cszn/DnCNN,cszn,20,2019-12-18T17:09:11Z,"Beyond a Gaussian Denoiser: Residual Learning of Deep CNN for Image Denoising (TIP, 2017)"
22,MATLAB,Octave,705,436,Matlab,https://github.com/schneems/Octave,schneems,10,2019-10-05T10:15:03Z,"my octave exercises for 2011 stanford machine learning class, posted after the due date of course"
23,MATLAB,face_verification_experiment,699,335,Matlab,https://github.com/AlfredXiangWu/face_verification_experiment,AlfredXiangWu,2,2017-02-10T09:19:33Z,Original Caffe Version for LightCNN-9. Highly recommend to use PyTorch Version (https://github.com/AlfredXiangWu/LightCNN) 
24,MATLAB,edges,652,336,Matlab,https://github.com/pdollar/edges,pdollar,18,2019-12-02T22:40:33Z,Structured Edge Detection Toolbox
25,MATLAB,convnet-burden,635,96,MATLAB,https://github.com/albanie/convnet-burden,albanie,4,2019-01-17T11:15:00Z,Memory consumption and FLOP count estimates for convnets
26,MATLAB,Algorithms_MathModels,628,291,MATLAB,https://github.com/HuangCongQing/Algorithms_MathModels,HuangCongQing,1,2020-02-12T15:48:07Z,【国赛】【美赛】数学建模相关算法 MATLAB实现（2018年初整理）
27,MATLAB,activityrecognition,588,282,MATLAB,https://github.com/jindongwang/activityrecognition,jindongwang,1,2019-08-20T05:46:37Z,Resources about activity recognition-行为识别资料
28,MATLAB,CNN-for-Image-Retrieval,566,228,MATLAB,https://github.com/willard-yuan/CNN-for-Image-Retrieval,willard-yuan,1,2019-07-14T09:12:22Z,":sunrise:The code of post ""Image retrieval using MatconvNet and pre-trained imageNet"""
29,MATLAB,lrslibrary,552,296,MATLAB,https://github.com/andrewssobral/lrslibrary,andrewssobral,2,2020-03-07T21:09:36Z,Low-Rank and Sparse Tools for Background Modeling and Subtraction in Videos
30,MATLAB,Gait-Tracking-With-x-IMU,552,320,Matlab,https://github.com/xioTechnologies/Gait-Tracking-With-x-IMU,xioTechnologies,14,2017-08-03T13:31:31Z,
31,MATLAB,ICNet,552,187,MATLAB,https://github.com/hszhao/ICNet,hszhao,24,2019-09-09T13:49:55Z,"ICNet for Real-Time Semantic Segmentation on High-Resolution Images, ECCV2018"
32,MATLAB,machine-learning-octave,551,154,MATLAB,https://github.com/trekhleb/machine-learning-octave,trekhleb,0,2018-12-22T08:52:56Z,🤖 MatLab/Octave examples of popular machine learning algorithms with code examples and mathematics being explained
33,MATLAB,siamese-fc,549,218,MATLAB,https://github.com/bertinetto/siamese-fc,bertinetto,33,2019-05-16T10:10:53Z,Arbitrary object tracking at 50-100 FPS with Fully Convolutional Siamese networks.
34,MATLAB,mexopencv,546,288,Matlab,https://github.com/kyamagu/mexopencv,kyamagu,30,2018-12-16T22:07:19Z,Collection and a development kit of matlab mex functions for OpenCV library
35,MATLAB,voc-dpm,532,307,Matlab,https://github.com/rbgirshick/voc-dpm,rbgirshick,16,2017-04-03T16:06:41Z,Object detection system using deformable part models (DPMs) and latent SVM (voc-release5). You may want to use the latest tarball on my website. The github code may include code changes that have not been tested as thoroughly and will not necessarily reproduce the results on the website.
36,MATLAB,refinenet,493,149,MATLAB,https://github.com/guosheng/refinenet,guosheng,0,2019-06-01T05:40:49Z, RefineNet: Multi-Path Refinement Networks for High-Resolution Semantic Segmentation
37,MATLAB,Stanford-Machine-Learning-Course,491,354,Matlab,https://github.com/zhouxc/Stanford-Machine-Learning-Course,zhouxc,1,2011-12-25T10:04:23Z,machine learning course programming exercise
