rank,item,repo_name,stars,forks,language,repo_url,username,issues,last_commit,description
1,top-100-stars,freeCodeCamp,310155,23947,JavaScript,https://github.com/freeCodeCamp/freeCodeCamp,freeCodeCamp,236,2020-04-23T09:50:01Z,freeCodeCamp.org's open source codebase and curriculum. Learn to code for free together with millions of people.
2,top-100-stars,996.ICU,249281,21110,Rust,https://github.com/996icu/996.ICU,996icu,16767,2020-04-07T06:06:52Z,Repo for counting stars and contributing. Press F to pay respect to glorious developers.
3,top-100-stars,vue,162439,24594,JavaScript,https://github.com/vuejs/vue,vuejs,490,2020-04-22T06:53:40Z,"🖖 Vue.js is a progressive, incrementally-adoptable JavaScript framework for building UI on the web."
4,top-100-stars,react,147396,28507,JavaScript,https://github.com/facebook/react,facebook,543,2020-04-23T05:48:19Z,"A declarative, efficient, and flexible JavaScript library for building user interfaces."
5,top-100-stars,free-programming-books,145248,35294,,https://github.com/EbookFoundation/free-programming-books,EbookFoundation,48,2020-04-22T20:47:54Z,:books: Freely available programming books
6,top-100-stars,tensorflow,143506,80913,C++,https://github.com/tensorflow/tensorflow,tensorflow,3522,2020-04-23T10:52:12Z,An Open Source Machine Learning Framework for Everyone
7,top-100-stars,bootstrap,140231,68659,JavaScript,https://github.com/twbs/bootstrap,twbs,389,2020-04-22T12:09:04Z,"The most popular HTML, CSS, and JavaScript framework for developing responsive, mobile first projects on the web."
8,top-100-stars,awesome,131599,17553,,https://github.com/sindresorhus/awesome,sindresorhus,36,2020-04-21T16:42:01Z,😎 Awesome lists about all kinds of interesting topics
9,top-100-stars,You-Dont-Know-JS,120302,24160,,https://github.com/getify/You-Dont-Know-JS,getify,109,2020-04-02T02:24:11Z,A book series on JavaScript. @YDKJS on twitter.
10,top-100-stars,coding-interview-university,109957,32111,,https://github.com/jwasham/coding-interview-university,jwasham,48,2020-04-22T15:56:22Z,A complete computer science study plan to become a software engineer.
11,top-100-stars,ohmyzsh,108301,19453,Shell,https://github.com/ohmyzsh/ohmyzsh,ohmyzsh,713,2020-04-23T08:41:07Z,"🙃 A delightful community-driven (with 1500+ contributors) framework for managing your zsh configuration. Includes 200+ optional plugins (rails, git, OSX, hub, capistrano, brew, ant, php, python, etc), over 140 themes to spice up your morning, and an auto-update tool so that makes it easy to keep up with the latest updates from the community."
12,top-100-stars,developer-roadmap,105388,16729,,https://github.com/kamranahmedse/developer-roadmap,kamranahmedse,11,2020-04-22T23:43:10Z,Roadmap to becoming a web developer in 2020
13,top-100-stars,gitignore,100172,52702,,https://github.com/github/gitignore,github,121,2020-04-22T16:03:22Z,A collection of useful .gitignore templates
14,top-100-stars,CS-Notes,98202,31988,Java,https://github.com/CyC2018/CS-Notes,CyC2018,35,2020-04-21T08:07:07Z,:books: 技术面试必备基础知识、Leetcode、计算机操作系统、计算机网络、系统设计、Java、Python、C++
15,top-100-stars,vscode,95035,14750,TypeScript,https://github.com/microsoft/vscode,microsoft,4861,2020-04-23T10:13:44Z,Visual Studio Code
16,top-100-stars,javascript,94713,18462,JavaScript,https://github.com/airbnb/javascript,airbnb,115,2020-04-09T23:03:28Z,JavaScript Style Guide
17,top-100-stars,system-design-primer,91910,15751,Python,https://github.com/donnemartin/system-design-primer,donnemartin,148,2020-04-20T19:16:07Z,Learn how to design large-scale systems. Prep for the system design interview.  Includes Anki flashcards.
18,top-100-stars,d3,91088,21996,JavaScript,https://github.com/d3/d3,d3,4,2020-04-20T17:59:50Z,"Bring data to life with SVG, Canvas and HTML. :bar_chart::chart_with_upwards_trend::tada:"
19,top-100-stars,flutter,90966,12216,Dart,https://github.com/flutter/flutter,flutter,7534,2020-04-23T05:30:14Z,Flutter makes it easy and fast to build beautiful apps for mobile and beyond.
20,top-100-stars,linux,89857,31368,C,https://github.com/torvalds/linux,torvalds,328,2020-04-23T07:27:44Z,Linux kernel source tree
21,top-100-stars,react-native,86574,19294,JavaScript,https://github.com/facebook/react-native,facebook,818,2020-04-23T06:43:43Z,A framework for building native apps with React.
22,top-100-stars,Python-100-Days,83151,33422,Jupyter Notebook,https://github.com/jackfrued/Python-100-Days,jackfrued,372,2020-04-21T12:26:02Z,Python - 100天从新手到大师
23,top-100-stars,electron,82181,11002,C++,https://github.com/electron/electron,electron,1140,2020-04-23T07:35:38Z,":electron: Build cross-platform desktop apps with JavaScript, HTML, and CSS"
24,top-100-stars,awesome-python,81599,16073,Python,https://github.com/vinta/awesome-python,vinta,35,2020-04-17T16:28:00Z,"A curated list of awesome Python frameworks, libraries, software and resources"
25,top-100-stars,public-apis,79496,9221,Python,https://github.com/public-apis/public-apis,public-apis,110,2020-04-22T23:34:12Z,A collective list of free APIs for use in software and web development.
26,top-100-stars,create-react-app,77964,18755,JavaScript,https://github.com/facebook/create-react-app,facebook,617,2020-04-23T10:59:40Z,Set up a modern web app by running one command.
27,top-100-stars,JavaGuide,76209,26205,Java,https://github.com/Snailclimb/JavaGuide,Snailclimb,27,2020-04-23T07:17:43Z,【Java学习+面试指南】 一份涵盖大部分Java程序员所需要掌握的核心知识。
28,top-100-stars,the-art-of-command-line,74267,8512,,https://github.com/jlevy/the-art-of-command-line,jlevy,178,2020-04-13T19:01:57Z,"Master the command line, in one page"
29,top-100-stars,axios,72300,6487,JavaScript,https://github.com/axios/axios,axios,350,2020-04-22T18:58:05Z,Promise based HTTP client for the browser and node.js
30,top-100-stars,go,71599,10208,Go,https://github.com/golang/go,golang,5746,2020-04-23T07:34:59Z,The Go programming language
31,top-100-stars,Python,70090,21150,Python,https://github.com/TheAlgorithms/Python,TheAlgorithms,38,2020-04-23T10:00:37Z,All Algorithms implemented in Python
32,top-100-stars,node,69373,16744,JavaScript,https://github.com/nodejs/node,nodejs,1295,2020-04-23T10:49:17Z,Node.js JavaScript runtime :sparkles::turtle::rocket::sparkles:
33,top-100-stars,build-your-own-x,68754,5305,,https://github.com/danistefanovic/build-your-own-x,danistefanovic,76,2020-04-19T16:33:02Z,🤓 Build your own (insert technology here)
34,top-100-stars,javascript-algorithms,68684,11378,JavaScript,https://github.com/trekhleb/javascript-algorithms,trekhleb,181,2020-04-15T21:41:43Z,📝 Algorithms and data structures implemented in JavaScript with explanations and links to further readings
35,top-100-stars,animate.css,66137,14162,CSS,https://github.com/daneden/animate.css,daneden,4,2020-04-22T09:52:14Z,🍿 A cross-browser library of CSS animations. As easy to use as an easy thing.
36,top-100-stars,free-programming-books-zh_CN,65703,20245,,https://github.com/justjavac/free-programming-books-zh_CN,justjavac,140,2020-04-11T14:05:47Z,:books: 免费的计算机编程类中文书籍，欢迎投稿
37,top-100-stars,kubernetes,65313,23284,Go,https://github.com/kubernetes/kubernetes,kubernetes,2900,2020-04-23T10:58:01Z,Production-Grade Container Scheduling and Management
38,top-100-stars,youtube-dl,65013,11312,Python,https://github.com/ytdl-org/youtube-dl,ytdl-org,3387,2020-04-23T08:07:01Z,Command-line program to download videos from YouTube.com and other video sites
39,top-100-stars,models,63226,40451,Python,https://github.com/tensorflow/models,tensorflow,1080,2020-04-23T08:18:49Z,Models and examples built with TensorFlow
40,top-100-stars,Font-Awesome,62638,10650,JavaScript,https://github.com/FortAwesome/Font-Awesome,FortAwesome,5253,2020-03-23T18:53:55Z,"The iconic SVG, font, and CSS toolkit"
41,top-100-stars,puppeteer,60580,6188,JavaScript,https://github.com/puppeteer/puppeteer,puppeteer,969,2020-04-23T10:56:36Z,Headless Chrome Node.js API
42,top-100-stars,terminal,60392,5759,C++,https://github.com/microsoft/terminal,microsoft,896,2020-04-23T05:55:16Z,"The new Windows Terminal and the original Windows console host, all in the same place!"
43,top-100-stars,angular,60215,16447,TypeScript,https://github.com/angular/angular,angular,3417,2020-04-23T10:47:48Z,One framework. Mobile & desktop.
44,top-100-stars,three.js,59932,23213,JavaScript,https://github.com/mrdoob/three.js,mrdoob,574,2020-04-23T10:33:49Z,JavaScript 3D library.
45,top-100-stars,TypeScript,59639,8049,TypeScript,https://github.com/microsoft/TypeScript,microsoft,4510,2020-04-23T07:40:15Z,TypeScript is a superset of JavaScript that compiles to clean JavaScript output.
46,top-100-stars,angular.js,59566,28754,JavaScript,https://github.com/angular/angular.js,angular,469,2020-04-20T10:09:00Z,AngularJS - HTML enhanced for web apps!
47,top-100-stars,ant-design,58939,21572,TypeScript,https://github.com/ant-design/ant-design,ant-design,465,2020-04-23T10:11:13Z,🌈 A UI Design Language and React UI library
48,top-100-stars,computer-science,58882,8730,,https://github.com/ossu/computer-science,ossu,13,2020-04-22T17:36:47Z,:mortar_board: Path to a free self-taught education in Computer Science!
49,top-100-stars,laravel,58766,18364,PHP,https://github.com/laravel/laravel,laravel,29,2020-04-22T20:59:23Z,A PHP framework for web artisans
50,top-100-stars,java-design-patterns,57019,18361,Java,https://github.com/iluwatar/java-design-patterns,iluwatar,166,2020-04-14T14:26:25Z,Design patterns implemented in Java
51,top-100-stars,moby,56887,16439,Go,https://github.com/moby/moby,moby,3758,2020-04-23T09:51:03Z,Moby Project - a collaborative project for the container ecosystem to assemble container-based systems
52,top-100-stars,material-ui,56633,15606,JavaScript,https://github.com/mui-org/material-ui,mui-org,393,2020-04-23T10:09:58Z,"React components for faster and easier web development. Build your own design system, or start with Material Design."
53,top-100-stars,30-seconds-of-code,55986,6198,JavaScript,https://github.com/30-seconds/30-seconds-of-code,30-seconds,0,2020-04-20T08:08:44Z,Short JavaScript code snippets for all your development needs
54,top-100-stars,webpack,53861,6946,JavaScript,https://github.com/webpack/webpack,webpack,445,2020-04-23T09:55:26Z,"A bundler for javascript and friends. Packs many modules into a few bundled assets. Code Splitting allows for loading parts of the application on demand. Through ""loaders"", modules can be CommonJs, AMD, ES6 modules, CSS, Images, JSON, Coffeescript, LESS, ... and your custom stuff."
55,top-100-stars,awesome-go,53721,7126,Go,https://github.com/avelino/awesome-go,avelino,27,2020-04-23T08:15:55Z,"A curated list of awesome Go frameworks, libraries and software"
56,top-100-stars,awesome-vue,53590,7564,,https://github.com/vuejs/awesome-vue,vuejs,62,2020-04-23T10:13:44Z,🎉 A curated list of awesome things related to Vue.js
57,top-100-stars,jquery,53207,19251,JavaScript,https://github.com/jquery/jquery,jquery,82,2020-04-23T10:28:28Z,jQuery JavaScript Library
58,top-100-stars,thefuck,53061,2666,Python,https://github.com/nvbn/thefuck,nvbn,221,2020-04-17T15:19:44Z,Magnificent app which corrects your previous console command.
59,top-100-stars,vue-element-admin,53028,18300,Vue,https://github.com/PanJiaChen/vue-element-admin,PanJiaChen,665,2020-04-23T07:24:52Z,:tada: A magical vue admin                                                                https://panjiachen.github.io/vue-element-admin
60,top-100-stars,redux,52974,13918,TypeScript,https://github.com/reduxjs/redux,reduxjs,40,2020-04-15T16:44:04Z,Predictable state container for JavaScript apps
61,top-100-stars,LeetCodeAnimation,52828,9651,Java,https://github.com/MisterBooo/LeetCodeAnimation,MisterBooo,1,2020-04-22T15:25:16Z,Demonstrate all the questions on LeetCode in the form of animation.（用动画的形式呈现解LeetCode题目的思路）
62,top-100-stars,atom,51716,14398,JavaScript,https://github.com/atom/atom,atom,693,2020-04-22T21:51:39Z,:atom: The hackable text editor
63,top-100-stars,swift,51346,8333,C++,https://github.com/apple/swift,apple,415,2020-04-23T10:53:55Z,The Swift Programming Language
64,top-100-stars,reveal.js,51223,14735,JavaScript,https://github.com/hakimel/reveal.js,hakimel,544,2020-04-23T09:44:13Z,The HTML Presentation Framework
65,top-100-stars,flask,50002,13433,Python,https://github.com/pallets/flask,pallets,23,2020-04-23T01:10:44Z,The Python micro framework for building web applications.
66,top-100-stars,socket.io,49351,8990,JavaScript,https://github.com/socketio/socket.io,socketio,492,2020-04-17T12:38:29Z,Realtime application framework (Node.JS server)
67,top-100-stars,shadowsocks-windows,48978,15621,C#,https://github.com/shadowsocks/shadowsocks-windows,shadowsocks,58,2020-04-22T10:39:54Z,"If you want to keep a secret, you must also hide it from yourself."
68,top-100-stars,django,48706,21099,Python,https://github.com/django/django,django,222,2020-04-23T10:48:41Z,The Web framework for perfectionists with deadlines.
69,top-100-stars,Chart.js,48311,10303,JavaScript,https://github.com/chartjs/Chart.js,chartjs,383,2020-04-15T15:38:49Z,Simple HTML5 Charts using the <canvas> tag
70,top-100-stars,elasticsearch,48267,16477,Java,https://github.com/elastic/elasticsearch,elastic,2731,2020-04-23T10:58:19Z,"Open Source, Distributed, RESTful Search Engine"
71,top-100-stars,express,48252,8072,JavaScript,https://github.com/expressjs/express,expressjs,151,2020-04-23T04:59:43Z,"Fast, unopinionated, minimalist web framework for node."
72,top-100-stars,keras,47880,18075,Python,https://github.com/keras-team/keras,keras-team,3019,2020-04-22T09:57:49Z,Deep Learning for humans
73,top-100-stars,Semantic-UI,47717,5039,JavaScript,https://github.com/Semantic-Org/Semantic-UI,Semantic-Org,998,2020-03-16T05:18:52Z,Semantic is a UI component framework based around useful principles from natural language.
74,top-100-stars,deno,47448,2236,TypeScript,https://github.com/denoland/deno,denoland,425,2020-04-23T10:16:01Z,A secure JavaScript and TypeScript runtime
75,top-100-stars,storybook,47369,4516,TypeScript,https://github.com/storybookjs/storybook,storybookjs,575,2020-04-23T10:48:55Z,"📓 UI component dev & test: React, Vue, Angular, React Native, Ember, Web Components & more!"
76,top-100-stars,next.js,47237,6959,JavaScript,https://github.com/zeit/next.js,zeit,480,2020-04-23T09:57:32Z,The React Framework
77,top-100-stars,spring-boot,47095,29582,Java,https://github.com/spring-projects/spring-boot,spring-projects,479,2020-04-23T10:49:20Z,Spring Boot
78,top-100-stars,Apollo-11,46987,6374,Assembly,https://github.com/chrislgarry/Apollo-11,chrislgarry,97,2020-03-04T19:08:50Z,Original Apollo 11 Guidance Computer (AGC) source code for the command and lunar modules.
79,top-100-stars,json-server,46833,4338,JavaScript,https://github.com/typicode/json-server,typicode,528,2020-04-17T06:25:11Z,Get a full fake REST API with zero coding in less than 30 seconds (seriously)
80,top-100-stars,httpie,46462,3005,Python,https://github.com/jakubroztocil/httpie,jakubroztocil,161,2020-04-23T00:17:26Z,"As easy as HTTPie /aitch-tee-tee-pie/  🥧 Modern command line HTTP client – user-friendly curl alternative with intuitive UI, JSON support, syntax highlighting, wget-like downloads, extensions, etc.  https://twitter.com/clihttp"
81,top-100-stars,FiraCode,46385,1831,Clojure,https://github.com/tonsky/FiraCode,tonsky,233,2020-04-18T17:22:43Z,Free monospaced font with programming ligatures
82,top-100-stars,netdata,46265,4235,C,https://github.com/netdata/netdata,netdata,733,2020-04-23T09:40:41Z,"Real-time performance monitoring, done right! https://www.netdata.cloud"
83,top-100-stars,markdown-here,45668,8178,JavaScript,https://github.com/adam-p/markdown-here,adam-p,269,2020-02-21T01:02:55Z,"Google Chrome, Firefox, and Thunderbird extension that lets you write email in Markdown and render it before sending."
84,top-100-stars,rails,45430,18359,Ruby,https://github.com/rails/rails,rails,605,2020-04-23T10:47:29Z,Ruby on Rails
85,top-100-stars,architect-awesome,44988,14136,,https://github.com/xingshaocheng/architect-awesome,xingshaocheng,54,2020-04-07T10:54:16Z,后端架构师技术图谱
86,top-100-stars,element,44860,10308,Vue,https://github.com/ElemeFE/element,ElemeFE,1741,2020-04-23T09:33:22Z,A Vue.js 2.0 UI Toolkit for Web
87,top-100-stars,html5-boilerplate,44644,10694,JavaScript,https://github.com/h5bp/html5-boilerplate,h5bp,7,2020-04-18T16:14:59Z,"A professional front-end template for building fast, robust, and adaptable web apps or sites."
88,top-100-stars,lodash,44424,4840,JavaScript,https://github.com/lodash/lodash,lodash,100,2020-04-21T23:29:02Z,"A modern JavaScript utility library delivering modularity, performance, & extras."
89,top-100-stars,awesome-machine-learning,44310,11200,Python,https://github.com/josephmisiti/awesome-machine-learning,josephmisiti,1,2020-04-22T13:31:16Z,"A curated list of awesome Machine Learning frameworks, libraries and software."
90,top-100-stars,resume.github.com,44192,1159,JavaScript,https://github.com/resume/resume.github.com,resume,35,2018-12-29T23:17:05Z,Resumes generated using the GitHub informations
91,top-100-stars,rust,44187,6677,Rust,https://github.com/rust-lang/rust,rust-lang,5576,2020-04-23T10:53:19Z,Empowering everyone to build reliable and efficient software.
92,top-100-stars,Front-end-Developer-Interview-Questions,44186,8881,HTML,https://github.com/h5bp/Front-end-Developer-Interview-Questions,h5bp,5,2020-04-20T01:35:38Z,"A list of helpful front-end related questions you can use to interview potential candidates, test yourself or completely ignore."
93,top-100-stars,opencv,43896,34879,C++,https://github.com/opencv/opencv,opencv,1749,2020-04-23T09:07:37Z,Open Source Computer Vision Library
94,top-100-stars,moment,43796,6580,JavaScript,https://github.com/moment/moment,moment,537,2020-04-23T08:27:29Z,"Parse, validate, manipulate, and display dates in javascript."
95,top-100-stars,awesome-selfhosted,43784,3489,JavaScript,https://github.com/awesome-selfhosted/awesome-selfhosted,awesome-selfhosted,83,2020-04-23T10:26:27Z,A list of Free Software network services and web applications which can be hosted locally. Selfhosting is the process of hosting and managing applications instead of renting from Software-as-a-Service providers
96,top-100-stars,gatsby,43720,7839,JavaScript,https://github.com/gatsbyjs/gatsby,gatsbyjs,762,2020-04-23T10:59:08Z,"Build blazing fast, modern apps and websites with React"
97,top-100-stars,hugo,43420,4929,Go,https://github.com/gohugoio/hugo,gohugoio,497,2020-04-22T10:06:47Z,The world’s fastest framework for building websites.
98,top-100-stars,interviews,43300,9153,Java,https://github.com/kdn251/interviews,kdn251,68,2020-02-15T10:25:54Z,Everything you need to know to get the job.
99,top-100-stars,nodebestpractices,43099,3867,JavaScript,https://github.com/goldbergyoni/nodebestpractices,goldbergyoni,27,2020-04-22T21:56:06Z,:white_check_mark: The Node.js best practices list (April 2020)
100,top-100-stars,bitcoin,42991,25578,C++,https://github.com/bitcoin/bitcoin,bitcoin,1155,2020-04-23T10:40:12Z,Bitcoin Core integration/staging tree
1,top-100-forks,datasharing,5097,204129,,https://github.com/jtleek/datasharing,jtleek,519,2020-04-21T21:24:59Z,The Leek group guide to data sharing 
2,top-100-forks,ProgrammingAssignment2,619,121449,R,https://github.com/rdpeng/ProgrammingAssignment2,rdpeng,3014,2020-04-23T10:29:46Z,Repository for Programming Assignment 2 for R Programming on Coursera
3,top-100-forks,Spoon-Knife,10203,109657,HTML,https://github.com/octocat/Spoon-Knife,octocat,14827,2020-04-23T10:05:14Z,This repo is for demonstration purposes only.
4,top-100-forks,tensorflow,143506,80913,C++,https://github.com/tensorflow/tensorflow,tensorflow,3522,2020-04-23T10:52:12Z,An Open Source Machine Learning Framework for Everyone
5,top-100-forks,bootstrap,140231,68659,JavaScript,https://github.com/twbs/bootstrap,twbs,389,2020-04-22T12:09:04Z,"The most popular HTML, CSS, and JavaScript framework for developing responsive, mobile first projects on the web."
6,top-100-forks,SmartThingsPublic,1576,68203,Groovy,https://github.com/SmartThingsCommunity/SmartThingsPublic,SmartThingsCommunity,1559,2020-04-23T10:15:05Z,SmartThings open-source DeviceTypeHandlers and SmartApps code
7,top-100-forks,gitignore,100172,52702,,https://github.com/github/gitignore,github,121,2020-04-22T16:03:22Z,A collection of useful .gitignore templates
8,top-100-forks,ExData_Plotting1,183,51086,,https://github.com/rdpeng/ExData_Plotting1,rdpeng,618,2020-04-18T08:35:57Z,Plotting Assignment 1 for Exploratory Data Analysis
9,top-100-forks,models,63226,40451,Python,https://github.com/tensorflow/models,tensorflow,1080,2020-04-23T08:18:49Z,Models and examples built with TensorFlow
10,top-100-forks,cgm-remote-monitor,1168,39869,JavaScript,https://github.com/nightscout/cgm-remote-monitor,nightscout,155,2020-04-22T19:11:25Z,nightscout web monitor
11,top-100-forks,free-programming-books,145248,35294,,https://github.com/EbookFoundation/free-programming-books,EbookFoundation,48,2020-04-22T20:47:54Z,:books: Freely available programming books
12,top-100-forks,opencv,43896,34879,C++,https://github.com/opencv/opencv,opencv,1749,2020-04-23T09:07:37Z,Open Source Computer Vision Library
13,top-100-forks,Complete-Python-3-Bootcamp,9276,33883,Jupyter Notebook,https://github.com/Pierian-Data/Complete-Python-3-Bootcamp,Pierian-Data,38,2020-04-21T18:43:16Z,Course Files for Complete Python 3 Bootcamp Course on Udemy
14,top-100-forks,Python-100-Days,83151,33422,Jupyter Notebook,https://github.com/jackfrued/Python-100-Days,jackfrued,372,2020-04-21T12:26:02Z,Python - 100天从新手到大师
15,top-100-forks,RepData_PeerAssessment1,81,32839,,https://github.com/rdpeng/RepData_PeerAssessment1,rdpeng,281,2020-04-23T08:46:03Z,Peer Assessment 1 for Reproducible Research
16,top-100-forks,tutorials,20544,32586,Java,https://github.com/eugenp/tutorials,eugenp,88,2020-04-23T05:46:58Z,"Just Announced - ""Learn Spring Security OAuth"": "
17,top-100-forks,coding-interview-university,109957,32111,,https://github.com/jwasham/coding-interview-university,jwasham,48,2020-04-22T15:56:22Z,A complete computer science study plan to become a software engineer.
18,top-100-forks,CS-Notes,98202,31988,Java,https://github.com/CyC2018/CS-Notes,CyC2018,35,2020-04-21T08:07:07Z,:books: 技术面试必备基础知识、Leetcode、计算机操作系统、计算机网络、系统设计、Java、Python、C++
19,top-100-forks,linux,89857,31368,C,https://github.com/torvalds/linux,torvalds,328,2020-04-23T07:27:44Z,Linux kernel source tree
20,top-100-forks,spring-boot,47095,29582,Java,https://github.com/spring-projects/spring-boot,spring-projects,479,2020-04-23T10:49:20Z,Spring Boot
21,top-100-forks,angular.js,59566,28754,JavaScript,https://github.com/angular/angular.js,angular,469,2020-04-20T10:09:00Z,AngularJS - HTML enhanced for web apps!
22,top-100-forks,react,147396,28507,JavaScript,https://github.com/facebook/react,facebook,543,2020-04-23T05:48:19Z,"A declarative, efficient, and flexible JavaScript library for building user interfaces."
23,top-100-forks,courses,3402,28505,HTML,https://github.com/DataScienceSpecialization/courses,DataScienceSpecialization,92,2020-02-18T13:58:38Z,Course materials for the Data Science Specialization: https://www.coursera.org/specialization/jhudatascience/1
24,top-100-forks,patchwork,948,28082,HTML,https://github.com/jlord/patchwork,jlord,1332,2020-04-23T09:34:01Z,All the Git-it Workshop completers! 
25,top-100-forks,jekyll-now,6654,27598,CSS,https://github.com/barryclark/jekyll-now,barryclark,195,2020-04-23T07:17:50Z,"Build a Jekyll blog in minutes, without touching the command line."
26,top-100-forks,JavaGuide,76209,26205,Java,https://github.com/Snailclimb/JavaGuide,Snailclimb,27,2020-04-23T07:17:43Z,【Java学习+面试指南】 一份涵盖大部分Java程序员所需要掌握的核心知识。
27,top-100-forks,first-contributions,9954,25736,,https://github.com/firstcontributions/first-contributions,firstcontributions,2833,2020-04-23T10:35:13Z,🚀✨ Help beginners to contribute to open source projects
28,top-100-forks,bitcoin,42991,25578,C++,https://github.com/bitcoin/bitcoin,bitcoin,1155,2020-04-23T10:40:12Z,Bitcoin Core integration/staging tree
29,top-100-forks,vue,162439,24594,JavaScript,https://github.com/vuejs/vue,vuejs,490,2020-04-22T06:53:40Z,"🖖 Vue.js is a progressive, incrementally-adoptable JavaScript framework for building UI on the web."
30,top-100-forks,spring-framework,36510,24507,Java,https://github.com/spring-projects/spring-framework,spring-projects,1131,2020-04-23T10:03:20Z,Spring Framework
31,top-100-forks,You-Dont-Know-JS,120302,24160,,https://github.com/getify/You-Dont-Know-JS,getify,109,2020-04-02T02:24:11Z,A book series on JavaScript. @YDKJS on twitter.
32,top-100-forks,frontend-nanodegree-resume,1079,23906,JavaScript,https://github.com/udacity/frontend-nanodegree-resume,udacity,3,2020-03-18T01:23:05Z,This repository is used for one of the projects in Udacity's Front-End Web Developer Nanodegree program. Learn how to become a Front-End Developer today with line-by-line code reviewed projects and get a job with career services!
33,top-100-forks,freeCodeCamp,310155,23947,JavaScript,https://github.com/freeCodeCamp/freeCodeCamp,freeCodeCamp,236,2020-04-23T09:50:01Z,freeCodeCamp.org's open source codebase and curriculum. Learn to code for free together with millions of people.
34,top-100-forks,kubernetes,65313,23284,Go,https://github.com/kubernetes/kubernetes,kubernetes,2900,2020-04-23T10:58:01Z,Production-Grade Container Scheduling and Management
35,top-100-forks,three.js,59932,23213,JavaScript,https://github.com/mrdoob/three.js,mrdoob,574,2020-04-23T10:33:49Z,JavaScript 3D library.
36,top-100-forks,recipes,67,22171,,https://github.com/LarryMad/recipes,LarryMad,2254,2020-04-12T06:57:01Z,
